00:00.0 Host bridge [0600]: Intel Corporation 2nd Generation Core Processor Family DRAM Controller [8086:0100] (rev 09)
	Control: I/O- Mem+ BusMaster+ SpecCycle- MemWINV- VGASnoop- ParErr- Stepping- SERR- FastB2B- DisINTx-
	Status: Cap+ 66MHz- UDF- FastB2B+ ParErr- DEVSEL=fast >TAbort- <TAbort- <MAbort+ >SERR- <PERR- INTx-
	Latency: 0
	Capabilities: [e0] Vendor Specific Information: Len=0c <?>
	Kernel driver in use: snb_uncore

00:01.0 PCI bridge [0604]: Intel Corporation Xeon E3-1200/2nd Generation Core Processor Family PCI Express Root Port [8086:0101] (rev 09) (prog-if 00 [Normal decode])
	Control: I/O+ Mem+ BusMaster+ SpecCycle- MemWINV- VGASnoop- ParErr- Stepping- SERR- FastB2B- DisINTx+
	Status: Cap+ 66MHz- UDF- FastB2B- ParErr- DEVSEL=fast >TAbort- <TAbort- <MAbort- >SERR- <PERR- INTx-
	Latency: 0, Cache Line Size: 4 bytes
	Interrupt: pin A routed to IRQ 24
	Bus: primary=00, secondary=01, subordinate=01, sec-latency=0
	I/O behind bridge: 0000e000-0000efff [size=4K]
	Memory behind bridge: f6000000-f9ffffff [size=64M]
	Prefetchable memory behind bridge: 00000000e0000000-00000000efffffff [size=256M]
	Secondary status: 66MHz- FastB2B- ParErr- DEVSEL=fast >TAbort- <TAbort- <MAbort+ <SERR- <PERR-
	BridgeCtl: Parity- SERR+ NoISA- VGA+ VGA16- MAbort- >Reset- FastB2B-
		PriDiscTmr- SecDiscTmr- DiscTmrStat- DiscTmrSERREn-
	Capabilities: [88] Subsystem: Gigabyte Technology Co., Ltd Xeon E3-1200/2nd Generation Core Processor Family PCI Express Root Port [1458:5000]
	Capabilities: [80] Power Management version 3
		Flags: PMEClk- DSI- D1- D2- AuxCurrent=0mA PME(D0+,D1-,D2-,D3hot+,D3cold+)
		Status: D0 NoSoftRst+ PME-Enable- DSel=0 DScale=0 PME-
	Capabilities: [90] MSI: Enable+ Count=1/1 Maskable- 64bit-
		Address: fee04004  Data: 0021
	Capabilities: [a0] Express (v2) Root Port (Slot+), MSI 00
		DevCap:	MaxPayload 128 bytes, PhantFunc 0
			ExtTag- RBE+
		DevCtl:	CorrErr- NonFatalErr- FatalErr- UnsupReq-
			RlxdOrd- ExtTag- PhantFunc- AuxPwr- NoSnoop-
			MaxPayload 128 bytes, MaxReadReq 128 bytes
		DevSta:	CorrErr- NonFatalErr- FatalErr- UnsupReq- AuxPwr- TransPend-
		LnkCap:	Port #2, Speed 5GT/s, Width x16, ASPM L0s L1, Exit Latency L0s <256ns, L1 <4us
			ClockPM- Surprise- LLActRep- BwNot+ ASPMOptComp-
		LnkCtl:	ASPM Disabled; RCB 64 bytes, Disabled- CommClk+
			ExtSynch- ClockPM- AutWidDis- BWInt- AutBWInt-
		LnkSta:	Speed 2.5GT/s (downgraded), Width x16 (ok)
			TrErr- Train- SlotClk+ DLActive- BWMgmt+ ABWMgmt-
		SltCap:	AttnBtn- PwrCtrl- MRL- AttnInd- PwrInd- HotPlug- Surprise-
			Slot #1, PowerLimit 0.000W; Interlock- NoCompl+
		SltCtl:	Enable: AttnBtn- PwrFlt- MRL- PresDet- CmdCplt- HPIrq- LinkChg-
			Control: AttnInd Unknown, PwrInd Unknown, Power- Interlock-
		SltSta:	Status: AttnBtn- PowerFlt- MRL- CmdCplt- PresDet+ Interlock-
			Changed: MRL- PresDet+ LinkState-
		RootCap: CRSVisible-
		RootCtl: ErrCorrectable- ErrNon-Fatal- ErrFatal- PMEIntEna- CRSVisible-
		RootSta: PME ReqID 0000, PMEStatus- PMEPending-
		DevCap2: Completion Timeout: Not Supported, TimeoutDis- NROPrPrP- LTR+
			 10BitTagComp- 10BitTagReq- OBFF Not Supported, ExtFmt- EETLPPrefix-
			 EmergencyPowerReduction Not Supported, EmergencyPowerReductionInit-
			 FRS- LN System CLS Not Supported, TPHComp- ExtTPHComp- ARIFwd-
			 AtomicOpsCap: Routing- 32bit- 64bit- 128bitCAS-
		DevCtl2: Completion Timeout: 50us to 50ms, TimeoutDis- LTR- OBFF Disabled, ARIFwd-
			 AtomicOpsCtl: ReqEn- EgressBlck-
		LnkCtl2: Target Link Speed: 5GT/s, EnterCompliance- SpeedDis-
			 Transmit Margin: Normal Operating Range, EnterModifiedCompliance- ComplianceSOS-
			 Compliance De-emphasis: -6dB
		LnkSta2: Current De-emphasis Level: -6dB, EqualizationComplete- EqualizationPhase1-
			 EqualizationPhase2- EqualizationPhase3- LinkEqualizationRequest-
			 Retimer- 2Retimers- CrosslinkRes: unsupported
	Capabilities: [100 v1] Virtual Channel
		Caps:	LPEVC=0 RefClk=100ns PATEntryBits=1
		Arb:	Fixed- WRR32- WRR64- WRR128-
		Ctrl:	ArbSelect=Fixed
		Status:	InProgress-
		VC0:	Caps:	PATOffset=00 MaxTimeSlots=1 RejSnoopTrans-
			Arb:	Fixed+ WRR32- WRR64- WRR128- TWRR128- WRR256-
			Ctrl:	Enable+ ID=0 ArbSelect=Fixed TC/VC=ff
			Status:	NegoPending- InProgress-
	Capabilities: [140 v1] Root Complex Link
		Desc:	PortNumber=02 ComponentID=01 EltType=Config
		Link0:	Desc:	TargetPort=00 TargetComponent=01 AssocRCRB- LinkType=MemMapped LinkValid+
			Addr:	0000000000009000
	Kernel driver in use: pcieport

00:02.0 Display controller [0380]: Intel Corporation 2nd Generation Core Processor Family Integrated Graphics Controller [8086:0102] (rev 09)
	Subsystem: Gigabyte Technology Co., Ltd 2nd Generation Core Processor Family Integrated Graphics Controller [1458:d000]
	Control: I/O+ Mem+ BusMaster+ SpecCycle- MemWINV- VGASnoop- ParErr- Stepping- SERR- FastB2B- DisINTx+
	Status: Cap+ 66MHz- UDF- FastB2B+ ParErr- DEVSEL=fast >TAbort- <TAbort- <MAbort- >SERR- <PERR- INTx-
	Latency: 0
	Interrupt: pin A routed to IRQ 45
	Region 0: Memory at fb400000 (64-bit, non-prefetchable) [size=4M]
	Region 2: Memory at d0000000 (64-bit, prefetchable) [size=256M]
	Region 4: I/O ports at ff00 [size=64]
	Capabilities: [90] MSI: Enable+ Count=1/1 Maskable- 64bit-
		Address: fee40004  Data: 0025
	Capabilities: [d0] Power Management version 2
		Flags: PMEClk- DSI+ D1- D2- AuxCurrent=0mA PME(D0-,D1-,D2-,D3hot-,D3cold-)
		Status: D0 NoSoftRst- PME-Enable- DSel=0 DScale=0 PME-
	Capabilities: [a4] PCI Advanced Features
		AFCap: TP+ FLR+
		AFCtrl: FLR-
		AFStatus: TP-
	Kernel driver in use: i915
	Kernel modules: i915

00:16.0 Communication controller [0780]: Intel Corporation 6 Series/C200 Series Chipset Family MEI Controller #1 [8086:1c3a] (rev 04)
	Subsystem: Gigabyte Technology Co., Ltd 6 Series/C200 Series Chipset Family MEI Controller [1458:1c3a]
	Control: I/O- Mem+ BusMaster+ SpecCycle- MemWINV- VGASnoop- ParErr- Stepping- SERR- FastB2B- DisINTx+
	Status: Cap+ 66MHz- UDF- FastB2B- ParErr- DEVSEL=fast >TAbort- <TAbort- <MAbort- >SERR- <PERR- INTx-
	Latency: 0
	Interrupt: pin A routed to IRQ 46
	Region 0: Memory at fbfff000 (64-bit, non-prefetchable) [size=16]
	Capabilities: [50] Power Management version 3
		Flags: PMEClk- DSI- D1- D2- AuxCurrent=0mA PME(D0+,D1-,D2-,D3hot+,D3cold+)
		Status: D0 NoSoftRst+ PME-Enable- DSel=0 DScale=0 PME-
	Capabilities: [8c] MSI: Enable+ Count=1/1 Maskable- 64bit+
		Address: 00000000fee10004  Data: 0024
	Kernel driver in use: mei_me
	Kernel modules: mei_me

00:1a.0 USB controller [0c03]: Intel Corporation 6 Series/C200 Series Chipset Family USB Enhanced Host Controller #2 [8086:1c2d] (rev 05) (prog-if 20 [EHCI])
	Subsystem: Gigabyte Technology Co., Ltd 6 Series/C200 Series Chipset Family USB Enhanced Host Controller [1458:5006]
	Control: I/O- Mem+ BusMaster+ SpecCycle- MemWINV- VGASnoop- ParErr- Stepping- SERR- FastB2B- DisINTx-
	Status: Cap+ 66MHz- UDF- FastB2B+ ParErr- DEVSEL=medium >TAbort- <TAbort- <MAbort- >SERR- <PERR- INTx-
	Latency: 0
	Interrupt: pin C routed to IRQ 18
	Region 0: Memory at fbffe000 (32-bit, non-prefetchable) [size=1K]
	Capabilities: [50] Power Management version 2
		Flags: PMEClk- DSI- D1- D2- AuxCurrent=375mA PME(D0+,D1-,D2-,D3hot+,D3cold+)
		Status: D0 NoSoftRst- PME-Enable- DSel=0 DScale=0 PME-
	Capabilities: [58] Debug port: BAR=1 offset=00a0
	Capabilities: [98] PCI Advanced Features
		AFCap: TP+ FLR+
		AFCtrl: FLR-
		AFStatus: TP-
	Kernel driver in use: ehci-pci

00:1b.0 Audio device [0403]: Intel Corporation 6 Series/C200 Series Chipset Family High Definition Audio Controller [8086:1c20] (rev 05)
	Subsystem: Gigabyte Technology Co., Ltd 6 Series/C200 Series Chipset Family High Definition Audio Controller [1458:a102]
	Control: I/O- Mem+ BusMaster+ SpecCycle- MemWINV- VGASnoop- ParErr- Stepping- SERR- FastB2B- DisINTx+
	Status: Cap+ 66MHz- UDF- FastB2B- ParErr- DEVSEL=fast >TAbort- <TAbort- <MAbort- >SERR- <PERR- INTx-
	Latency: 0, Cache Line Size: 4 bytes
	Interrupt: pin A routed to IRQ 47
	Region 0: Memory at fbff4000 (64-bit, non-prefetchable) [size=16K]
	Capabilities: [50] Power Management version 2
		Flags: PMEClk- DSI- D1- D2- AuxCurrent=55mA PME(D0+,D1-,D2-,D3hot+,D3cold+)
		Status: D0 NoSoftRst- PME-Enable- DSel=0 DScale=0 PME-
	Capabilities: [60] MSI: Enable+ Count=1/1 Maskable- 64bit+
		Address: 00000000fee20004  Data: 0024
	Capabilities: [70] Express (v1) Root Complex Integrated Endpoint, MSI 00
		DevCap:	MaxPayload 128 bytes, PhantFunc 0
			ExtTag- RBE- FLReset+
		DevCtl:	CorrErr- NonFatalErr- FatalErr- UnsupReq-
			RlxdOrd- ExtTag- PhantFunc- AuxPwr- NoSnoop- FLReset-
			MaxPayload 128 bytes, MaxReadReq 128 bytes
		DevSta:	CorrErr- NonFatalErr- FatalErr- UnsupReq- AuxPwr+ TransPend-
	Capabilities: [100 v1] Virtual Channel
		Caps:	LPEVC=0 RefClk=100ns PATEntryBits=1
		Arb:	Fixed- WRR32- WRR64- WRR128-
		Ctrl:	ArbSelect=Fixed
		Status:	InProgress-
		VC0:	Caps:	PATOffset=00 MaxTimeSlots=1 RejSnoopTrans-
			Arb:	Fixed- WRR32- WRR64- WRR128- TWRR128- WRR256-
			Ctrl:	Enable+ ID=0 ArbSelect=Fixed TC/VC=01
			Status:	NegoPending- InProgress-
		VC1:	Caps:	PATOffset=00 MaxTimeSlots=1 RejSnoopTrans-
			Arb:	Fixed- WRR32- WRR64- WRR128- TWRR128- WRR256-
			Ctrl:	Enable+ ID=1 ArbSelect=Fixed TC/VC=02
			Status:	NegoPending- InProgress-
	Capabilities: [130 v1] Root Complex Link
		Desc:	PortNumber=0f ComponentID=00 EltType=Config
		Link0:	Desc:	TargetPort=00 TargetComponent=00 AssocRCRB- LinkType=MemMapped LinkValid+
			Addr:	00000000fed1c000
	Kernel driver in use: snd_hda_intel
	Kernel modules: snd_hda_intel

00:1c.0 PCI bridge [0604]: Intel Corporation 6 Series/C200 Series Chipset Family PCI Express Root Port 1 [8086:1c10] (rev b5) (prog-if 00 [Normal decode])
	Control: I/O- Mem+ BusMaster+ SpecCycle- MemWINV- VGASnoop- ParErr- Stepping- SERR- FastB2B- DisINTx-
	Status: Cap+ 66MHz- UDF- FastB2B- ParErr- DEVSEL=fast >TAbort- <TAbort- <MAbort- >SERR- <PERR- INTx-
	Latency: 0, Cache Line Size: 4 bytes
	Interrupt: pin A routed to IRQ 16
	Bus: primary=00, secondary=02, subordinate=02, sec-latency=0
	I/O behind bridge: [disabled]
	Memory behind bridge: fbd00000-fbdfffff [size=1M]
	Prefetchable memory behind bridge: [disabled]
	Secondary status: 66MHz- FastB2B- ParErr- DEVSEL=fast >TAbort- <TAbort- <MAbort+ <SERR- <PERR-
	BridgeCtl: Parity- SERR+ NoISA- VGA- VGA16- MAbort- >Reset- FastB2B-
		PriDiscTmr- SecDiscTmr- DiscTmrStat- DiscTmrSERREn-
	Capabilities: [40] Express (v2) Root Port (Slot+), MSI 00
		DevCap:	MaxPayload 128 bytes, PhantFunc 0
			ExtTag- RBE+
		DevCtl:	CorrErr- NonFatalErr- FatalErr- UnsupReq-
			RlxdOrd- ExtTag- PhantFunc- AuxPwr- NoSnoop-
			MaxPayload 128 bytes, MaxReadReq 128 bytes
		DevSta:	CorrErr- NonFatalErr- FatalErr- UnsupReq- AuxPwr+ TransPend-
		LnkCap:	Port #1, Speed 5GT/s, Width x4, ASPM L0s L1, Exit Latency L0s <512ns, L1 <4us
			ClockPM- Surprise- LLActRep+ BwNot- ASPMOptComp-
		LnkCtl:	ASPM Disabled; RCB 64 bytes, Disabled- CommClk+
			ExtSynch- ClockPM- AutWidDis- BWInt- AutBWInt-
		LnkSta:	Speed 5GT/s (ok), Width x4 (ok)
			TrErr- Train- SlotClk+ DLActive+ BWMgmt- ABWMgmt-
		SltCap:	AttnBtn- PwrCtrl- MRL- AttnInd- PwrInd- HotPlug- Surprise-
			Slot #0, PowerLimit 25.000W; Interlock- NoCompl+
		SltCtl:	Enable: AttnBtn- PwrFlt- MRL- PresDet- CmdCplt- HPIrq- LinkChg-
			Control: AttnInd Unknown, PwrInd Unknown, Power- Interlock-
		SltSta:	Status: AttnBtn- PowerFlt- MRL- CmdCplt- PresDet+ Interlock-
			Changed: MRL- PresDet- LinkState+
		RootCap: CRSVisible-
		RootCtl: ErrCorrectable- ErrNon-Fatal- ErrFatal- PMEIntEna- CRSVisible-
		RootSta: PME ReqID 0000, PMEStatus- PMEPending-
		DevCap2: Completion Timeout: Range BC, TimeoutDis+ NROPrPrP- LTR-
			 10BitTagComp- 10BitTagReq- OBFF Not Supported, ExtFmt- EETLPPrefix-
			 EmergencyPowerReduction Not Supported, EmergencyPowerReductionInit-
			 FRS- LN System CLS Not Supported, TPHComp- ExtTPHComp- ARIFwd-
			 AtomicOpsCap: Routing- 32bit- 64bit- 128bitCAS-
		DevCtl2: Completion Timeout: 260ms to 900ms, TimeoutDis- LTR- OBFF Disabled, ARIFwd-
			 AtomicOpsCtl: ReqEn- EgressBlck-
		LnkCtl2: Target Link Speed: 5GT/s, EnterCompliance- SpeedDis-
			 Transmit Margin: Normal Operating Range, EnterModifiedCompliance- ComplianceSOS-
			 Compliance De-emphasis: -6dB
		LnkSta2: Current De-emphasis Level: -6dB, EqualizationComplete- EqualizationPhase1-
			 EqualizationPhase2- EqualizationPhase3- LinkEqualizationRequest-
			 Retimer- 2Retimers- CrosslinkRes: unsupported
	Capabilities: [80] MSI: Enable- Count=1/1 Maskable- 64bit-
		Address: 00000000  Data: 0000
	Capabilities: [90] Subsystem: Gigabyte Technology Co., Ltd 6 Series/C200 Series Chipset Family PCI Express Root Port 1 [1458:5001]
	Capabilities: [a0] Power Management version 2
		Flags: PMEClk- DSI- D1- D2- AuxCurrent=0mA PME(D0+,D1-,D2-,D3hot+,D3cold+)
		Status: D0 NoSoftRst- PME-Enable- DSel=0 DScale=0 PME-
	Kernel driver in use: pcieport

00:1c.5 PCI bridge [0604]: Intel Corporation 6 Series/C200 Series Chipset Family PCI Express Root Port 6 [8086:1c1a] (rev b5) (prog-if 00 [Normal decode])
	Control: I/O+ Mem+ BusMaster+ SpecCycle- MemWINV- VGASnoop- ParErr- Stepping- SERR- FastB2B- DisINTx-
	Status: Cap+ 66MHz- UDF- FastB2B- ParErr- DEVSEL=fast >TAbort- <TAbort- <MAbort- >SERR- <PERR- INTx-
	Latency: 0, Cache Line Size: 4 bytes
	Interrupt: pin B routed to IRQ 17
	Bus: primary=00, secondary=03, subordinate=03, sec-latency=0
	I/O behind bridge: 0000d000-0000dfff [size=4K]
	Memory behind bridge: [disabled]
	Prefetchable memory behind bridge: 00000000fbc00000-00000000fbcfffff [size=1M]
	Secondary status: 66MHz- FastB2B- ParErr- DEVSEL=fast >TAbort- <TAbort- <MAbort+ <SERR- <PERR-
	BridgeCtl: Parity- SERR+ NoISA- VGA- VGA16- MAbort- >Reset- FastB2B-
		PriDiscTmr- SecDiscTmr- DiscTmrStat- DiscTmrSERREn-
	Capabilities: [40] Express (v2) Root Port (Slot+), MSI 00
		DevCap:	MaxPayload 128 bytes, PhantFunc 0
			ExtTag- RBE+
		DevCtl:	CorrErr- NonFatalErr- FatalErr- UnsupReq-
			RlxdOrd- ExtTag- PhantFunc- AuxPwr- NoSnoop-
			MaxPayload 128 bytes, MaxReadReq 128 bytes
		DevSta:	CorrErr- NonFatalErr- FatalErr- UnsupReq- AuxPwr+ TransPend-
		LnkCap:	Port #6, Speed 5GT/s, Width x1, ASPM L0s L1, Exit Latency L0s <512ns, L1 <4us
			ClockPM- Surprise- LLActRep+ BwNot- ASPMOptComp-
		LnkCtl:	ASPM Disabled; RCB 64 bytes, Disabled- CommClk+
			ExtSynch- ClockPM- AutWidDis- BWInt- AutBWInt-
		LnkSta:	Speed 2.5GT/s (downgraded), Width x1 (ok)
			TrErr- Train- SlotClk+ DLActive+ BWMgmt- ABWMgmt-
		SltCap:	AttnBtn- PwrCtrl- MRL- AttnInd- PwrInd- HotPlug- Surprise-
			Slot #5, PowerLimit 10.000W; Interlock- NoCompl+
		SltCtl:	Enable: AttnBtn- PwrFlt- MRL- PresDet- CmdCplt- HPIrq- LinkChg-
			Control: AttnInd Unknown, PwrInd Unknown, Power- Interlock-
		SltSta:	Status: AttnBtn- PowerFlt- MRL- CmdCplt- PresDet+ Interlock-
			Changed: MRL- PresDet- LinkState+
		RootCap: CRSVisible-
		RootCtl: ErrCorrectable- ErrNon-Fatal- ErrFatal- PMEIntEna- CRSVisible-
		RootSta: PME ReqID 0000, PMEStatus- PMEPending-
		DevCap2: Completion Timeout: Range BC, TimeoutDis+ NROPrPrP- LTR-
			 10BitTagComp- 10BitTagReq- OBFF Not Supported, ExtFmt- EETLPPrefix-
			 EmergencyPowerReduction Not Supported, EmergencyPowerReductionInit-
			 FRS- LN System CLS Not Supported, TPHComp- ExtTPHComp- ARIFwd-
			 AtomicOpsCap: Routing- 32bit- 64bit- 128bitCAS-
		DevCtl2: Completion Timeout: 260ms to 900ms, TimeoutDis- LTR- OBFF Disabled, ARIFwd-
			 AtomicOpsCtl: ReqEn- EgressBlck-
		LnkCtl2: Target Link Speed: 5GT/s, EnterCompliance- SpeedDis-
			 Transmit Margin: Normal Operating Range, EnterModifiedCompliance- ComplianceSOS-
			 Compliance De-emphasis: -6dB
		LnkSta2: Current De-emphasis Level: -3.5dB, EqualizationComplete- EqualizationPhase1-
			 EqualizationPhase2- EqualizationPhase3- LinkEqualizationRequest-
			 Retimer- 2Retimers- CrosslinkRes: unsupported
	Capabilities: [80] MSI: Enable- Count=1/1 Maskable- 64bit-
		Address: 00000000  Data: 0000
	Capabilities: [90] Subsystem: Gigabyte Technology Co., Ltd 6 Series/C200 Series Chipset Family PCI Express Root Port 6 [1458:5001]
	Capabilities: [a0] Power Management version 2
		Flags: PMEClk- DSI- D1- D2- AuxCurrent=0mA PME(D0+,D1-,D2-,D3hot+,D3cold+)
		Status: D0 NoSoftRst- PME-Enable- DSel=0 DScale=0 PME-
	Kernel driver in use: pcieport

00:1c.6 PCI bridge [0604]: Intel Corporation 6 Series/C200 Series Chipset Family PCI Express Root Port 7 [8086:1c1c] (rev b5) (prog-if 00 [Normal decode])
	Control: I/O- Mem+ BusMaster+ SpecCycle- MemWINV- VGASnoop- ParErr- Stepping- SERR- FastB2B- DisINTx-
	Status: Cap+ 66MHz- UDF- FastB2B- ParErr- DEVSEL=fast >TAbort- <TAbort- <MAbort- >SERR- <PERR- INTx-
	Latency: 0, Cache Line Size: 4 bytes
	Interrupt: pin C routed to IRQ 18
	Bus: primary=00, secondary=04, subordinate=05, sec-latency=0
	I/O behind bridge: [disabled]
	Memory behind bridge: fbb00000-fbbfffff [size=1M]
	Prefetchable memory behind bridge: [disabled]
	Secondary status: 66MHz- FastB2B- ParErr- DEVSEL=fast >TAbort- <TAbort- <MAbort+ <SERR- <PERR-
	BridgeCtl: Parity- SERR+ NoISA- VGA- VGA16- MAbort- >Reset- FastB2B-
		PriDiscTmr- SecDiscTmr- DiscTmrStat- DiscTmrSERREn-
	Capabilities: [40] Express (v2) Root Port (Slot+), MSI 00
		DevCap:	MaxPayload 128 bytes, PhantFunc 0
			ExtTag- RBE+
		DevCtl:	CorrErr- NonFatalErr- FatalErr- UnsupReq-
			RlxdOrd- ExtTag- PhantFunc- AuxPwr- NoSnoop-
			MaxPayload 128 bytes, MaxReadReq 128 bytes
		DevSta:	CorrErr- NonFatalErr- FatalErr- UnsupReq- AuxPwr+ TransPend-
		LnkCap:	Port #7, Speed 5GT/s, Width x1, ASPM L0s L1, Exit Latency L0s <512ns, L1 <4us
			ClockPM- Surprise- LLActRep+ BwNot- ASPMOptComp-
		LnkCtl:	ASPM Disabled; RCB 64 bytes, Disabled- CommClk+
			ExtSynch- ClockPM- AutWidDis- BWInt- AutBWInt-
		LnkSta:	Speed 2.5GT/s (downgraded), Width x1 (ok)
			TrErr- Train- SlotClk+ DLActive+ BWMgmt- ABWMgmt-
		SltCap:	AttnBtn- PwrCtrl- MRL- AttnInd- PwrInd- HotPlug- Surprise-
			Slot #6, PowerLimit 10.000W; Interlock- NoCompl+
		SltCtl:	Enable: AttnBtn- PwrFlt- MRL- PresDet- CmdCplt- HPIrq- LinkChg-
			Control: AttnInd Unknown, PwrInd Unknown, Power- Interlock-
		SltSta:	Status: AttnBtn- PowerFlt- MRL- CmdCplt- PresDet+ Interlock-
			Changed: MRL- PresDet- LinkState+
		RootCap: CRSVisible-
		RootCtl: ErrCorrectable- ErrNon-Fatal- ErrFatal- PMEIntEna- CRSVisible-
		RootSta: PME ReqID 0000, PMEStatus- PMEPending-
		DevCap2: Completion Timeout: Range BC, TimeoutDis+ NROPrPrP- LTR-
			 10BitTagComp- 10BitTagReq- OBFF Not Supported, ExtFmt- EETLPPrefix-
			 EmergencyPowerReduction Not Supported, EmergencyPowerReductionInit-
			 FRS- LN System CLS Not Supported, TPHComp- ExtTPHComp- ARIFwd-
			 AtomicOpsCap: Routing- 32bit- 64bit- 128bitCAS-
		DevCtl2: Completion Timeout: 260ms to 900ms, TimeoutDis- LTR- OBFF Disabled, ARIFwd-
			 AtomicOpsCtl: ReqEn- EgressBlck-
		LnkCtl2: Target Link Speed: 5GT/s, EnterCompliance- SpeedDis-
			 Transmit Margin: Normal Operating Range, EnterModifiedCompliance- ComplianceSOS-
			 Compliance De-emphasis: -6dB
		LnkSta2: Current De-emphasis Level: -3.5dB, EqualizationComplete- EqualizationPhase1-
			 EqualizationPhase2- EqualizationPhase3- LinkEqualizationRequest-
			 Retimer- 2Retimers- CrosslinkRes: unsupported
	Capabilities: [80] MSI: Enable- Count=1/1 Maskable- 64bit-
		Address: 00000000  Data: 0000
	Capabilities: [90] Subsystem: Gigabyte Technology Co., Ltd 6 Series/C200 Series Chipset Family PCI Express Root Port 7 [1458:5001]
	Capabilities: [a0] Power Management version 2
		Flags: PMEClk- DSI- D1- D2- AuxCurrent=0mA PME(D0+,D1-,D2-,D3hot+,D3cold+)
		Status: D0 NoSoftRst- PME-Enable- DSel=0 DScale=0 PME-
	Kernel driver in use: pcieport

00:1c.7 PCI bridge [0604]: Intel Corporation 6 Series/C200 Series Chipset Family PCI Express Root Port 8 [8086:1c1e] (rev b5) (prog-if 00 [Normal decode])
	Control: I/O- Mem+ BusMaster+ SpecCycle- MemWINV- VGASnoop- ParErr- Stepping- SERR- FastB2B- DisINTx-
	Status: Cap+ 66MHz- UDF- FastB2B- ParErr- DEVSEL=fast >TAbort- <TAbort- <MAbort- >SERR- <PERR- INTx-
	Latency: 0, Cache Line Size: 4 bytes
	Interrupt: pin D routed to IRQ 19
	Bus: primary=00, secondary=06, subordinate=06, sec-latency=0
	I/O behind bridge: [disabled]
	Memory behind bridge: fbe00000-fbefffff [size=1M]
	Prefetchable memory behind bridge: [disabled]
	Secondary status: 66MHz- FastB2B- ParErr- DEVSEL=fast >TAbort- <TAbort- <MAbort+ <SERR- <PERR-
	BridgeCtl: Parity- SERR+ NoISA- VGA- VGA16- MAbort- >Reset- FastB2B-
		PriDiscTmr- SecDiscTmr- DiscTmrStat- DiscTmrSERREn-
	Capabilities: [40] Express (v2) Root Port (Slot+), MSI 00
		DevCap:	MaxPayload 128 bytes, PhantFunc 0
			ExtTag- RBE+
		DevCtl:	CorrErr- NonFatalErr- FatalErr- UnsupReq-
			RlxdOrd- ExtTag- PhantFunc- AuxPwr- NoSnoop-
			MaxPayload 128 bytes, MaxReadReq 128 bytes
		DevSta:	CorrErr- NonFatalErr- FatalErr- UnsupReq- AuxPwr+ TransPend-
		LnkCap:	Port #8, Speed 5GT/s, Width x1, ASPM L0s L1, Exit Latency L0s <512ns, L1 <4us
			ClockPM- Surprise- LLActRep+ BwNot- ASPMOptComp-
		LnkCtl:	ASPM Disabled; RCB 64 bytes, Disabled- CommClk+
			ExtSynch- ClockPM- AutWidDis- BWInt- AutBWInt-
		LnkSta:	Speed 5GT/s (ok), Width x1 (ok)
			TrErr- Train- SlotClk+ DLActive+ BWMgmt- ABWMgmt-
		SltCap:	AttnBtn- PwrCtrl- MRL- AttnInd- PwrInd- HotPlug- Surprise-
			Slot #7, PowerLimit 10.000W; Interlock- NoCompl+
		SltCtl:	Enable: AttnBtn- PwrFlt- MRL- PresDet- CmdCplt- HPIrq- LinkChg-
			Control: AttnInd Unknown, PwrInd Unknown, Power- Interlock-
		SltSta:	Status: AttnBtn- PowerFlt- MRL- CmdCplt- PresDet+ Interlock-
			Changed: MRL- PresDet- LinkState+
		RootCap: CRSVisible-
		RootCtl: ErrCorrectable- ErrNon-Fatal- ErrFatal- PMEIntEna- CRSVisible-
		RootSta: PME ReqID 0000, PMEStatus- PMEPending-
		DevCap2: Completion Timeout: Range BC, TimeoutDis+ NROPrPrP- LTR-
			 10BitTagComp- 10BitTagReq- OBFF Not Supported, ExtFmt- EETLPPrefix-
			 EmergencyPowerReduction Not Supported, EmergencyPowerReductionInit-
			 FRS- LN System CLS Not Supported, TPHComp- ExtTPHComp- ARIFwd-
			 AtomicOpsCap: Routing- 32bit- 64bit- 128bitCAS-
		DevCtl2: Completion Timeout: 260ms to 900ms, TimeoutDis- LTR- OBFF Disabled, ARIFwd-
			 AtomicOpsCtl: ReqEn- EgressBlck-
		LnkCtl2: Target Link Speed: 5GT/s, EnterCompliance- SpeedDis-
			 Transmit Margin: Normal Operating Range, EnterModifiedCompliance- ComplianceSOS-
			 Compliance De-emphasis: -6dB
		LnkSta2: Current De-emphasis Level: -6dB, EqualizationComplete- EqualizationPhase1-
			 EqualizationPhase2- EqualizationPhase3- LinkEqualizationRequest-
			 Retimer- 2Retimers- CrosslinkRes: unsupported
	Capabilities: [80] MSI: Enable- Count=1/1 Maskable- 64bit-
		Address: 00000000  Data: 0000
	Capabilities: [90] Subsystem: Gigabyte Technology Co., Ltd 6 Series/C200 Series Chipset Family PCI Express Root Port 8 [1458:5001]
	Capabilities: [a0] Power Management version 2
		Flags: PMEClk- DSI- D1- D2- AuxCurrent=0mA PME(D0+,D1-,D2-,D3hot+,D3cold+)
		Status: D0 NoSoftRst- PME-Enable- DSel=0 DScale=0 PME-
	Kernel driver in use: pcieport

00:1d.0 USB controller [0c03]: Intel Corporation 6 Series/C200 Series Chipset Family USB Enhanced Host Controller #1 [8086:1c26] (rev 05) (prog-if 20 [EHCI])
	Subsystem: Gigabyte Technology Co., Ltd 6 Series/C200 Series Chipset Family USB Enhanced Host Controller [1458:5006]
	Control: I/O- Mem+ BusMaster+ SpecCycle- MemWINV- VGASnoop- ParErr- Stepping- SERR- FastB2B- DisINTx-
	Status: Cap+ 66MHz- UDF- FastB2B+ ParErr- DEVSEL=medium >TAbort- <TAbort- <MAbort- >SERR- <PERR- INTx-
	Latency: 0
	Interrupt: pin A routed to IRQ 23
	Region 0: Memory at fbffd000 (32-bit, non-prefetchable) [size=1K]
	Capabilities: [50] Power Management version 2
		Flags: PMEClk- DSI- D1- D2- AuxCurrent=375mA PME(D0+,D1-,D2-,D3hot+,D3cold+)
		Status: D0 NoSoftRst- PME-Enable- DSel=0 DScale=0 PME-
	Capabilities: [58] Debug port: BAR=1 offset=00a0
	Capabilities: [98] PCI Advanced Features
		AFCap: TP+ FLR+
		AFCtrl: FLR-
		AFStatus: TP-
	Kernel driver in use: ehci-pci

00:1e.0 PCI bridge [0604]: Intel Corporation 82801 PCI Bridge [8086:244e] (rev a5) (prog-if 01 [Subtractive decode])
	Control: I/O+ Mem- BusMaster- SpecCycle- MemWINV- VGASnoop- ParErr- Stepping- SERR- FastB2B- DisINTx-
	Status: Cap+ 66MHz- UDF- FastB2B- ParErr- DEVSEL=fast >TAbort- <TAbort- <MAbort- >SERR- <PERR- INTx-
	Bus: primary=00, secondary=07, subordinate=07, sec-latency=32
	I/O behind bridge: [disabled]
	Memory behind bridge: [disabled]
	Prefetchable memory behind bridge: [disabled]
	Secondary status: 66MHz- FastB2B+ ParErr- DEVSEL=medium >TAbort- <TAbort- <MAbort+ <SERR- <PERR-
	BridgeCtl: Parity- SERR+ NoISA- VGA- VGA16- MAbort- >Reset- FastB2B-
		PriDiscTmr- SecDiscTmr- DiscTmrStat- DiscTmrSERREn-
	Capabilities: [50] Subsystem: Gigabyte Technology Co., Ltd Motherboard [1458:5000]

00:1f.0 ISA bridge [0601]: Intel Corporation H67 Express Chipset LPC Controller [8086:1c4a] (rev 05)
	Subsystem: Gigabyte Technology Co., Ltd H67 Express Chipset LPC Controller [1458:5001]
	Control: I/O+ Mem+ BusMaster+ SpecCycle- MemWINV- VGASnoop- ParErr- Stepping- SERR+ FastB2B- DisINTx-
	Status: Cap+ 66MHz- UDF- FastB2B- ParErr- DEVSEL=medium >TAbort- <TAbort- <MAbort- >SERR- <PERR- INTx-
	Latency: 0
	Capabilities: [e0] Vendor Specific Information: Len=0c <?>
	Kernel driver in use: lpc_ich
	Kernel modules: lpc_ich

00:1f.2 RAID bus controller [0104]: Intel Corporation SATA Controller [RAID mode] [8086:2822] (rev 05)
	Subsystem: Gigabyte Technology Co., Ltd SATA Controller [RAID mode] [1458:b000]
	Control: I/O+ Mem+ BusMaster+ SpecCycle- MemWINV- VGASnoop- ParErr- Stepping- SERR- FastB2B- DisINTx+
	Status: Cap+ 66MHz+ UDF- FastB2B+ ParErr- DEVSEL=medium >TAbort- <TAbort- <MAbort- >SERR- <PERR- INTx-
	Latency: 0
	Interrupt: pin B routed to IRQ 43
	Region 0: I/O ports at fe00 [size=8]
	Region 1: I/O ports at fd00 [size=4]
	Region 2: I/O ports at fc00 [size=8]
	Region 3: I/O ports at fb00 [size=4]
	Region 4: I/O ports at fa00 [size=32]
	Region 5: Memory at fbffc000 (32-bit, non-prefetchable) [size=2K]
	Capabilities: [80] MSI: Enable+ Count=1/1 Maskable- 64bit-
		Address: fee08004  Data: 0025
	Capabilities: [70] Power Management version 3
		Flags: PMEClk- DSI- D1- D2- AuxCurrent=0mA PME(D0-,D1-,D2-,D3hot+,D3cold-)
		Status: D0 NoSoftRst+ PME-Enable- DSel=0 DScale=0 PME-
	Capabilities: [a8] SATA HBA v1.0 BAR4 Offset=00000004
	Capabilities: [b0] PCI Advanced Features
		AFCap: TP+ FLR+
		AFCtrl: FLR-
		AFStatus: TP-
	Kernel driver in use: ahci
	Kernel modules: ahci

00:1f.3 SMBus [0c05]: Intel Corporation 6 Series/C200 Series Chipset Family SMBus Controller [8086:1c22] (rev 05)
	Subsystem: Gigabyte Technology Co., Ltd 6 Series/C200 Series Chipset Family SMBus Controller [1458:5001]
	Control: I/O+ Mem+ BusMaster- SpecCycle- MemWINV- VGASnoop- ParErr- Stepping- SERR- FastB2B- DisINTx-
	Status: Cap- 66MHz- UDF- FastB2B+ ParErr- DEVSEL=medium >TAbort- <TAbort- <MAbort- >SERR- <PERR- INTx-
	Interrupt: pin C routed to IRQ 18
	Region 0: Memory at fbffb000 (64-bit, non-prefetchable) [size=256]
	Region 4: I/O ports at 0500 [size=32]
	Kernel driver in use: i801_smbus
	Kernel modules: i2c_i801

01:00.0 VGA compatible controller [0300]: NVIDIA Corporation G96C [GeForce 9500 GT] [10de:0640] (rev a1) (prog-if 00 [VGA controller])
	Subsystem: XFX Pine Group Inc. G96C [GeForce 9500 GT] [1682:400a]
	Control: I/O+ Mem+ BusMaster+ SpecCycle- MemWINV- VGASnoop- ParErr- Stepping- SERR- FastB2B- DisINTx+
	Status: Cap+ 66MHz- UDF- FastB2B- ParErr- DEVSEL=fast >TAbort- <TAbort- <MAbort- >SERR- <PERR- INTx-
	Latency: 0, Cache Line Size: 4 bytes
	Interrupt: pin A routed to IRQ 44
	Region 0: Memory at f8000000 (32-bit, non-prefetchable) [size=16M]
	Region 1: Memory at e0000000 (64-bit, prefetchable) [size=256M]
	Region 3: Memory at f6000000 (64-bit, non-prefetchable) [size=32M]
	Region 5: I/O ports at ef00 [size=128]
	Expansion ROM at 000c0000 [virtual] [disabled] [size=128K]
	Capabilities: [60] Power Management version 3
		Flags: PMEClk- DSI- D1- D2- AuxCurrent=0mA PME(D0-,D1-,D2-,D3hot-,D3cold-)
		Status: D0 NoSoftRst- PME-Enable- DSel=0 DScale=0 PME-
	Capabilities: [68] MSI: Enable+ Count=1/1 Maskable- 64bit+
		Address: 00000000fee20004  Data: 0025
	Capabilities: [78] Express (v2) Endpoint, MSI 00
		DevCap:	MaxPayload 128 bytes, PhantFunc 0, Latency L0s <1us, L1 <4us
			ExtTag+ AttnBtn- AttnInd- PwrInd- RBE+ FLReset- SlotPowerLimit 0.000W
		DevCtl:	CorrErr- NonFatalErr- FatalErr- UnsupReq-
			RlxdOrd+ ExtTag+ PhantFunc- AuxPwr- NoSnoop+
			MaxPayload 128 bytes, MaxReadReq 512 bytes
		DevSta:	CorrErr- NonFatalErr- FatalErr- UnsupReq- AuxPwr- TransPend-
		LnkCap:	Port #0, Speed 2.5GT/s, Width x16, ASPM L0s L1, Exit Latency L0s <1us, L1 <1us
			ClockPM- Surprise- LLActRep- BwNot- ASPMOptComp-
		LnkCtl:	ASPM Disabled; RCB 128 bytes, Disabled- CommClk+
			ExtSynch- ClockPM- AutWidDis- BWInt- AutBWInt-
		LnkSta:	Speed 2.5GT/s (ok), Width x16 (ok)
			TrErr- Train- SlotClk+ DLActive- BWMgmt- ABWMgmt-
		DevCap2: Completion Timeout: Not Supported, TimeoutDis+ NROPrPrP- LTR-
			 10BitTagComp- 10BitTagReq- OBFF Not Supported, ExtFmt- EETLPPrefix-
			 EmergencyPowerReduction Not Supported, EmergencyPowerReductionInit-
			 FRS- TPHComp- ExtTPHComp-
			 AtomicOpsCap: 32bit- 64bit- 128bitCAS-
		DevCtl2: Completion Timeout: 50us to 50ms, TimeoutDis- LTR- OBFF Disabled,
			 AtomicOpsCtl: ReqEn-
		LnkCtl2: Target Link Speed: 2.5GT/s, EnterCompliance- SpeedDis-
			 Transmit Margin: Normal Operating Range, EnterModifiedCompliance- ComplianceSOS-
			 Compliance De-emphasis: -6dB
		LnkSta2: Current De-emphasis Level: -6dB, EqualizationComplete- EqualizationPhase1-
			 EqualizationPhase2- EqualizationPhase3- LinkEqualizationRequest-
			 Retimer- 2Retimers- CrosslinkRes: unsupported
	Capabilities: [b4] Vendor Specific Information: Len=14 <?>
	Capabilities: [100 v1] Virtual Channel
		Caps:	LPEVC=0 RefClk=100ns PATEntryBits=1
		Arb:	Fixed- WRR32- WRR64- WRR128-
		Ctrl:	ArbSelect=Fixed
		Status:	InProgress-
		VC0:	Caps:	PATOffset=00 MaxTimeSlots=1 RejSnoopTrans-
			Arb:	Fixed- WRR32- WRR64- WRR128- TWRR128- WRR256-
			Ctrl:	Enable+ ID=0 ArbSelect=Fixed TC/VC=ff
			Status:	NegoPending- InProgress-
	Capabilities: [128 v1] Power Budgeting <?>
	Capabilities: [600 v1] Vendor Specific Information: ID=0001 Rev=1 Len=024 <?>
	Kernel driver in use: nouveau
	Kernel modules: nvidiafb, nouveau

02:00.0 Non-Volatile memory controller [0108]: Kingston Technology Company, Inc. OM3PDP3 NVMe SSD [2646:500d] (rev 01) (prog-if 02 [NVM Express])
	Subsystem: Kingston Technology Company, Inc. OM3PDP3 NVMe SSD [2646:500d]
	Control: I/O- Mem+ BusMaster+ SpecCycle- MemWINV- VGASnoop- ParErr- Stepping- SERR- FastB2B- DisINTx+
	Status: Cap+ 66MHz- UDF- FastB2B- ParErr- DEVSEL=fast >TAbort- <TAbort- <MAbort- >SERR- <PERR- INTx-
	Latency: 0, Cache Line Size: 4 bytes
	Interrupt: pin A routed to IRQ 16
	NUMA node: 0
	Region 0: Memory at fbdfc000 (64-bit, non-prefetchable) [size=16K]
	Capabilities: [80] Express (v2) Endpoint, MSI 00
		DevCap:	MaxPayload 128 bytes, PhantFunc 0, Latency L0s unlimited, L1 unlimited
			ExtTag+ AttnBtn- AttnInd- PwrInd- RBE+ FLReset+ SlotPowerLimit 25.000W
		DevCtl:	CorrErr- NonFatalErr- FatalErr- UnsupReq-
			RlxdOrd+ ExtTag+ PhantFunc- AuxPwr- NoSnoop+ FLReset-
			MaxPayload 128 bytes, MaxReadReq 512 bytes
		DevSta:	CorrErr+ NonFatalErr- FatalErr- UnsupReq+ AuxPwr- TransPend-
		LnkCap:	Port #1, Speed 8GT/s, Width x4, ASPM L1, Exit Latency L1 unlimited
			ClockPM- Surprise- LLActRep- BwNot- ASPMOptComp+
		LnkCtl:	ASPM Disabled; RCB 64 bytes, Disabled- CommClk+
			ExtSynch- ClockPM- AutWidDis- BWInt- AutBWInt-
		LnkSta:	Speed 5GT/s (downgraded), Width x4 (ok)
			TrErr- Train- SlotClk+ DLActive- BWMgmt- ABWMgmt-
		DevCap2: Completion Timeout: Range ABCD, TimeoutDis+ NROPrPrP- LTR+
			 10BitTagComp- 10BitTagReq- OBFF Not Supported, ExtFmt+ EETLPPrefix-
			 EmergencyPowerReduction Not Supported, EmergencyPowerReductionInit-
			 FRS- TPHComp- ExtTPHComp-
			 AtomicOpsCap: 32bit- 64bit- 128bitCAS-
		DevCtl2: Completion Timeout: 50us to 50ms, TimeoutDis- LTR- OBFF Disabled,
			 AtomicOpsCtl: ReqEn-
		LnkCap2: Supported Link Speeds: 2.5-8GT/s, Crosslink- Retimer- 2Retimers- DRS-
		LnkCtl2: Target Link Speed: 8GT/s, EnterCompliance- SpeedDis-
			 Transmit Margin: Normal Operating Range, EnterModifiedCompliance- ComplianceSOS-
			 Compliance De-emphasis: -6dB
		LnkSta2: Current De-emphasis Level: -6dB, EqualizationComplete- EqualizationPhase1-
			 EqualizationPhase2- EqualizationPhase3- LinkEqualizationRequest-
			 Retimer- 2Retimers- CrosslinkRes: unsupported
	Capabilities: [d0] MSI-X: Enable+ Count=9 Masked-
		Vector table: BAR=0 offset=00002000
		PBA: BAR=0 offset=00003000
	Capabilities: [e0] MSI: Enable- Count=1/8 Maskable+ 64bit+
		Address: 0000000000000000  Data: 0000
		Masking: 00000000  Pending: 00000000
	Capabilities: [f8] Power Management version 3
		Flags: PMEClk- DSI- D1- D2- AuxCurrent=0mA PME(D0-,D1-,D2-,D3hot-,D3cold-)
		Status: D0 NoSoftRst+ PME-Enable- DSel=0 DScale=0 PME-
	Capabilities: [100 v1] Latency Tolerance Reporting
		Max snoop latenpcilib: sysfs_read_vpd: read failed: No such device
cy: 0ns
		Max no snoop latency: 0ns
	Capabilities: [110 v1] L1 PM Substates
		L1SubCap: PCI-PM_L1.2+ PCI-PM_L1.1+ ASPM_L1.2+ ASPM_L1.1+ L1_PM_Substates+
			  PortCommonModeRestoreTime=10us PortTPowerOnTime=220us
		L1SubCtl1: PCI-PM_L1.2- PCI-PM_L1.1- ASPM_L1.2- ASPM_L1.1-
			   T_CommonMode=0us LTR1.2_Threshold=0ns
		L1SubCtl2: T_PwrOn=10us
	Capabilities: [200 v2] Advanced Error Reporting
		UESta:	DLP- SDES- TLP- FCP- CmpltTO- CmpltAbrt- UnxCmplt- RxOF- MalfTLP- ECRC- UnsupReq- ACSViol-
		UEMsk:	DLP- SDES- TLP- FCP- CmpltTO- CmpltAbrt- UnxCmplt- RxOF- MalfTLP- ECRC- UnsupReq- ACSViol-
		UESvrt:	DLP+ SDES- TLP- FCP+ CmpltTO- CmpltAbrt- UnxCmplt- RxOF- MalfTLP+ ECRC- UnsupReq- ACSViol-
		CESta:	RxErr- BadTLP- BadDLLP- Rollover- Timeout- AdvNonFatalErr+
		CEMsk:	RxErr- BadTLP- BadDLLP- Rollover- Timeout- AdvNonFatalErr+
		AERCap:	First Error Pointer: 00, ECRCGenCap- ECRCGenEn- ECRCChkCap+ ECRCChkEn-
			MultHdrRecCap- MultHdrRecEn- TLPPfxPres- HdrLogCap-
		HeaderLog: 04000001 00000003 05070000 600aaf3e
	Capabilities: [300 v1] Secondary PCI Express
		LnkCtl3: LnkEquIntrruptEn- PerformEqu-
		LaneErrStat: 0
	Kernel driver in use: nvme
	Kernel modules: nvme

03:00.0 Ethernet controller [0200]: Realtek Semiconductor Co., Ltd. RTL8111/8168/8411 PCI Express Gigabit Ethernet Controller [10ec:8168] (rev 06)
	Subsystem: Gigabyte Technology Co., Ltd Onboard Ethernet [1458:e000]
	Control: I/O+ Mem+ BusMaster+ SpecCycle- MemWINV- VGASnoop- ParErr- Stepping- SERR- FastB2B- DisINTx+
	Status: Cap+ 66MHz- UDF- FastB2B- ParErr- DEVSEL=fast >TAbort- <TAbort- <MAbort- >SERR- <PERR- INTx-
	Latency: 0, Cache Line Size: 4 bytes
	Interrupt: pin A routed to IRQ 17
	Region 0: I/O ports at de00 [size=256]
	Region 2: Memory at fbcff000 (64-bit, prefetchable) [size=4K]
	Region 4: Memory at fbcf8000 (64-bit, prefetchable) [size=16K]
	Capabilities: [40] Power Management version 3
		Flags: PMEClk- DSI- D1+ D2+ AuxCurrent=375mA PME(D0+,D1+,D2+,D3hot+,D3cold+)
		Status: D0 NoSoftRst+ PME-Enable- DSel=0 DScale=0 PME-
	Capabilities: [50] MSI: Enable- Count=1/1 Maskable- 64bit+
		Address: 0000000000000000  Data: 0000
	Capabilities: [70] Express (v2) Endpoint, MSI 01
		DevCap:	MaxPayload 256 bytes, PhantFunc 0, Latency L0s <512ns, L1 <64us
			ExtTag- AttnBtn- AttnInd- PwrInd- RBE+ FLReset- SlotPowerLimit 10.000W
		DevCtl:	CorrErr- NonFatalErr- FatalErr- UnsupReq-
			RlxdOrd+ ExtTag- PhantFunc- AuxPwr- NoSnoop-
			MaxPayload 128 bytes, MaxReadReq 4096 bytes
		DevSta:	CorrErr+ NonFatalErr- FatalErr- UnsupReq+ AuxPwr+ TransPend-
		LnkCap:	Port #0, Speed 2.5GT/s, Width x1, ASPM L0s L1, Exit Latency L0s <512ns, L1 <64us
			ClockPM+ Surprise- LLActRep- BwNot- ASPMOptComp-
		LnkCtl:	ASPM Disabled; RCB 64 bytes, Disabled- CommClk+
			ExtSynch- ClockPM- AutWidDis- BWInt- AutBWInt-
		LnkSta:	Speed 2.5GT/s (ok), Width x1 (ok)
			TrErr- Train- SlotClk+ DLActive- BWMgmt- ABWMgmt-
		DevCap2: Completion Timeout: Not Supported, TimeoutDis+ NROPrPrP- LTR-
			 10BitTagComp- 10BitTagReq- OBFF Not Supported, ExtFmt- EETLPPrefix-
			 EmergencyPowerReduction Not Supported, EmergencyPowerReductionInit-
			 FRS- TPHComp- ExtTPHComp-
			 AtomicOpsCap: 32bit- 64bit- 128bitCAS-
		DevCtl2: Completion Timeout: 50us to 50ms, TimeoutDis- LTR- OBFF Disabled,
			 AtomicOpsCtl: ReqEn-
		LnkCtl2: Target Link Speed: 2.5GT/s, EnterCompliance- SpeedDis-
			 Transmit Margin: Normal Operating Range, EnterModifiedCompliance- ComplianceSOS-
			 Compliance De-emphasis: -6dB
		LnkSta2: Current De-emphasis Level: -6dB, EqualizationComplete- EqualizationPhase1-
			 EqualizationPhase2- EqualizationPhase3- LinkEqualizationRequest-
			 Retimer- 2Retimers- CrosslinkRes: unsupported
	Capabilities: [b0] MSI-X: Enable+ Count=4 Masked-
		Vector table: BAR=4 offset=00000000
		PBA: BAR=4 offset=00000800
	Capabilities: [d0] Vital Product Data
		Not readable
	Capabilities: [100 v1] Advanced Error Reporting
		UESta:	DLP- SDES- TLP- FCP- CmpltTO- CmpltAbrt- UnxCmplt- RxOF- MalfTLP- ECRC- UnsupReq- ACSViol-
		UEMsk:	DLP- SDES- TLP- FCP- CmpltTO- CmpltAbrt- UnxCmplt- RxOF- MalfTLP- ECRC- UnsupReq- ACSViol-
		UESvrt:	DLP+ SDES+ TLP- FCP+ CmpltTO- CmpltAbrt- UnxCmplt- RxOF+ MalfTLP+ ECRC- UnsupReq- ACSViol-
		CESta:	RxErr- BadTLP- BadDLLP- Rollover- Timeout- AdvNonFatalErr+
		CEMsk:	RxErr- BadTLP- BadDLLP- Rollover- Timeout- AdvNonFatalErr+
		AERCap:	First Error Pointer: 00, ECRCGenCap+ ECRCGenEn- ECRCChkCap+ ECRCChkEn-
			MultHdrRecCap- MultHdrRecEn- TLPPfxPres- HdrLogCap-
		HeaderLog: 00000000 00000000 00000000 00000000
	Capabilities: [140 v1] Virtual Channel
		Caps:	LPEVC=0 RefClk=100ns PATEntryBits=1
		Arb:	Fixed- WRR32- WRR64- WRR128-
		Ctrl:	ArbSelect=Fixed
		Status:	InProgress-
		VC0:	Caps:	PATOffset=00 MaxTimeSlots=1 RejSnoopTrans-
			Arb:	Fixed- WRR32- WRR64- WRR128- TWRR128- WRR256-
			Ctrl:	Enable+ ID=0 ArbSelect=Fixed TC/VC=ff
			Status:	NegoPending- InProgress-
	Capabilities: [160 v1] Device Serial Number ...
	Kernel driver in use: r8169
	Kernel modules: r8169

04:00.0 PCI bridge [0604]: Integrated Technology Express, Inc. IT8892E PCIe to PCI Bridge [1283:8892] (rev 10) (prog-if 00 [Normal decode])
	Control: I/O- Mem+ BusMaster+ SpecCycle- MemWINV- VGASnoop- ParErr- Stepping- SERR- FastB2B- DisINTx-
	Status: Cap+ 66MHz- UDF- FastB2B- ParErr- DEVSEL=fast >TAbort- <TAbort- <MAbort- >SERR- <PERR- INTx-
	Latency: 0, Cache Line Size: 4 bytes
	Interrupt: pin A routed to IRQ 18
	Bus: primary=04, secondary=05, subordinate=05, sec-latency=32
	I/O behind bridge: [disabled]
	Memory behind bridge: fbb00000-fbbfffff [size=1M]
	Prefetchable memory behind bridge: [disabled]
	Secondary status: 66MHz+ FastB2B- ParErr- DEVSEL=medium >TAbort- <TAbort- <MAbort+ <SERR- <PERR-
	BridgeCtl: Parity- SERR+ NoISA- VGA- VGA16- MAbort- >Reset- FastB2B-
		PriDiscTmr- SecDiscTmr+ DiscTmrStat- DiscTmrSERREn-
	Capabilities: [70] Express (v1) PCI-Express to PCI/PCI-X Bridge, MSI 00
		DevCap:	MaxPayload 128 bytes, PhantFunc 0
			ExtTag- AttnBtn- AttnInd- PwrInd- RBE- SlotPowerLimit 10.000W
		DevCtl:	CorrErr- NonFatalErr- FatalErr- UnsupReq-
			RlxdOrd- ExtTag- PhantFunc- AuxPwr- NoSnoop- BrConfRtry-
			MaxPayload 128 bytes, MaxReadReq 512 bytes
		DevSta:	CorrErr- NonFatalErr- FatalErr- UnsupReq- AuxPwr- TransPend-
		LnkCap:	Port #1, Speed 2.5GT/s, Width x1, ASPM L0s L1, Exit Latency L0s unlimited, L1 unlimited
			ClockPM- Surprise- LLActRep- BwNot- ASPMOptComp-
		LnkCtl:	ASPM Disabled; RCB 64 bytes, Disabled- CommClk-
			ExtSynch- ClockPM- AutWidDis- BWInt- AutBWInt-
		LnkSta:	Speed unknown (downgraded), Width x1 (ok)
			TrErr- Train- SlotClk- DLActive- BWMgmt- ABWMgmt-
	Capabilities: [90] Power Management version 2
		Flags: PMEClk- DSI- D1+ D2+ AuxCurrent=55mA PME(D0+,D1+,D2+,D3hot+,D3cold+)
		Status: D0 NoSoftRst- PME-Enable- DSel=0 DScale=0 PME-
	Capabilities: [a0] Subsystem: Device [0000:0000]
	Capabilities: [100 v1] Device Serial Number ...

05:00.0 Network controller [0280]: Ralink corp. RT2561/RT61 802.11g PCI [1814:0301]
	Subsystem: Ralink corp. EW-7108PCg/EW-7128g [1814:2561]
	Control: I/O- Mem+ BusMaster+ SpecCycle- MemWINV+ VGASnoop- ParErr- Stepping- SERR- FastB2B- DisINTx-
	Status: Cap+ 66MHz- UDF- FastB2B- ParErr- DEVSEL=slow >TAbort- <TAbort- <MAbort- >SERR- <PERR- INTx-
	Latency: 32, Cache Line Size: 4 bytes
	Interrupt: pin A routed to IRQ 18
	Region 0: Memory at fbbf0000 (32-bit, non-prefetchable) [size=32K]
	Capabilities: [40] Power Management version 2
		Flags: PMEClk- DSI- D1- D2- AuxCurrent=0mA PME(D0-,D1-,D2-,D3hot-,D3cold-)
		Status: D0 NoSoftRst- PME-Enable- DSel=0 DScale=0 PME-
	Kernel driver in use: rt61pci
	Kernel modules: rt61pci

05:03.0 FireWire (IEEE 1394) [0c00]: Texas Instruments TSB43AB23 IEEE-1394a-2000 Controller (PHY/Link) [104c:8024] (prog-if 10 [OHCI])
	Subsystem: Gigabyte Technology Co., Ltd Motherboard [1458:1000]
	Control: I/O- Mem+ BusMaster+ SpecCycle- MemWINV- VGASnoop- ParErr- Stepping- SERR- FastB2B- DisINTx-
	Status: Cap+ 66MHz- UDF- FastB2B- ParErr- DEVSEL=medium >TAbort- <TAbort- <MAbort- >SERR- <PERR- INTx-
	Latency: 64 (500ns min, 1000ns max), Cache Line Size: 4 bytes
	Interrupt: pin A routed to IRQ 17
	Region 0: Memory at fbbff000 (32-bit, non-prefetchable) [size=2K]
	Region 1: Memory at fbbf8000 (32-bit, non-prefetchable) [size=16K]
	Capabilities: [44] Power Management version 2
		Flags: PMEClk- DSI- D1+ D2+ AuxCurrent=0mA PME(D0+,D1+,D2+,D3hot+,D3cold-)
		Status: D0 NoSoftRst- PME-Enable- DSel=0 DScale=0 PME+
	Kernel driver in use: firewire_ohci
	Kernel modules: firewire_ohci

06:00.0 USB controller [0c03]: NEC Corporation uPD720200 USB 3.0 Host Controller [1033:0194] (rev 04) (prog-if 30 [XHCI])
	Subsystem: Gigabyte Technology Co., Ltd uPD720200 USB 3.0 Host Controller [1458:5007]
	Control: I/O- Mem+ BusMaster+ SpecCycle- MemWINV- VGASnoop- ParErr- Stepping- SERR- FastB2B- DisINTx+
	Status: Cap+ 66MHz- UDF- FastB2B- ParErr- DEVSEL=fast >TAbort- <TAbort- <MAbort- >SERR- <PERR- INTx-
	Latency: 0, Cache Line Size: 4 bytes
	Interrupt: pin A routed to IRQ 19
	Region 0: Memory at fbefe000 (64-bit, non-prefetchable) [size=8K]
	Capabilities: [50] Power Management version 3
		Flags: PMEClk- DSI- D1- D2- AuxCurrent=375mA PME(D0+,D1-,D2-,D3hot+,D3cold+)
		Status: D0 NoSoftRst+ PME-Enable- DSel=0 DScale=0 PME-
	Capabilities: [70] MSI: Enable- Count=1/8 Maskable- 64bit+
		Address: 0000000000000000  Data: 0000
	Capabilities: [90] MSI-X: Enable+ Count=8 Masked-
		Vector table: BAR=0 offset=00001000
		PBA: BAR=0 offset=00001080
	Capabilities: [a0] Express (v2) Endpoint, MSI 00
		DevCap:	MaxPayload 128 bytes, PhantFunc 0, Latency L0s unlimited, L1 unlimited
			ExtTag- AttnBtn- AttnInd- PwrInd- RBE+ FLReset- SlotPowerLimit 0.000W
		DevCtl:	CorrErr- NonFatalErr- FatalErr- UnsupReq-
			RlxdOrd- ExtTag- PhantFunc- AuxPwr- NoSnoop+
			MaxPayload 128 bytes, MaxReadReq 512 bytes
		DevSta:	CorrErr+ NonFatalErr- FatalErr- UnsupReq+ AuxPwr+ TransPend-
		LnkCap:	Port #0, Speed 5GT/s, Width x1, ASPM L0s L1, Exit Latency L0s <4us, L1 unlimited
			ClockPM+ Surprise- LLActRep- BwNot- ASPMOptComp-
		LnkCtl:	ASPM Disabled; RCB 64 bytes, Disabled- CommClk+
			ExtSynch- ClockPM+ AutWidDis- BWInt- AutBWInt-
		LnkSta:	Speed 5GT/s (ok), Width x1 (ok)
			TrErr- Train- SlotClk+ DLActive- BWMgmt- ABWMgmt-
		DevCap2: Completion Timeout: Not Supported, TimeoutDis+ NROPrPrP- LTR+
			 10BitTagComp- 10BitTagReq- OBFF Not Supported, ExtFmt- EETLPPrefix-
			 EmergencyPowerReduction Not Supported, EmergencyPowerReductionInit-
			 FRS- TPHComp- ExtTPHComp-
			 AtomicOpsCap: 32bit- 64bit- 128bitCAS-
		DevCtl2: Completion Timeout: 50us to 50ms, TimeoutDis- LTR- OBFF Disabled,
			 AtomicOpsCtl: ReqEn-
		LnkCtl2: Target Link Speed: 5GT/s, EnterCompliance- SpeedDis-
			 Transmit Margin: Normal Operating Range, EnterModifiedCompliance- ComplianceSOS-
			 Compliance De-emphasis: -6dB
		LnkSta2: Current De-emphasis Level: -6dB, EqualizationComplete- EqualizationPhase1-
			 EqualizationPhase2- EqualizationPhase3- LinkEqualizationRequest-
			 Retimer- 2Retimers- CrosslinkRes: unsupported
	Capabilities: [100 v1] Advanced Error Reporting
		UESta:	DLP- SDES- TLP- FCP- CmpltTO- CmpltAbrt- UnxCmplt- RxOF- MalfTLP- ECRC- UnsupReq- ACSViol-
		UEMsk:	DLP- SDES- TLP- FCP- CmpltTO- CmpltAbrt- UnxCmplt- RxOF- MalfTLP- ECRC- UnsupReq- ACSViol-
		UESvrt:	DLP+ SDES+ TLP- FCP+ CmpltTO- CmpltAbrt- UnxCmplt- RxOF+ MalfTLP+ ECRC- UnsupReq- ACSViol-
		CESta:	RxErr- BadTLP- BadDLLP- Rollover- Timeout- AdvNonFatalErr+
		CEMsk:	RxErr- BadTLP- BadDLLP- Rollover- Timeout- AdvNonFatalErr+
		AERCap:	First Error Pointer: 00, ECRCGenCap- ECRCGenEn- ECRCChkCap- ECRCChkEn-
			MultHdrRecCap- MultHdrRecEn- TLPPfxPres- HdrLogCap-
		HeaderLog: 00000000 00000000 00000000 00000000
	Capabilities: [140 v1] Device Serial Number ...
	Capabilities: [150 v1] Latency Tolerance Reporting
		Max snoop latency: 0ns
		Max no snoop latency: 0ns
	Kernel driver in use: xhci_hcd
	Kernel modules: xhci_pci

