00:00.0 Host bridge [0600]: Advanced Micro Devices, Inc. [AMD/ATI] RD780 Host Bridge [1002:5958]
	Subsystem: Advanced Micro Devices, Inc. [AMD/ATI] RD780 Host Bridge [1002:5958]
	Control: I/O- Mem+ BusMaster+ SpecCycle- MemWINV- VGASnoop- ParErr- Stepping- SERR- FastB2B- DisINTx-
	Status: Cap+ 66MHz+ UDF- FastB2B- ParErr- DEVSEL=medium >TAbort- <TAbort- <MAbort+ >SERR- <PERR- INTx-
	Latency: 32
	NUMA node: 0
	Region 3: Memory at <ignored> (64-bit, non-prefetchable)
	Capabilities: [c4] HyperTransport: Slave or Primary Interface
		Command: BaseUnitID=0 UnitCnt=12 MastHost- DefDir- DUL-
		Link Control 0: CFlE- CST- CFE- <LkFail- Init+ EOC- TXO- <CRCErr=0 IsocEn- LSEn- ExtCTL- 64b-
		Link Config 0: MLWI=16bit DwFcIn- MLWO=16bit DwFcOut- LWI=16bit DwFcInEn- LWO=16bit DwFcOutEn-
		Link Control 1: CFlE- CST- CFE- <LkFail+ Init- EOC+ TXO+ <CRCErr=0 IsocEn- LSEn- ExtCTL- 64b-
		Link Config 1: MLWI=8bit DwFcIn- MLWO=8bit DwFcOut- LWI=8bit DwFcInEn- LWO=8bit DwFcOutEn-
		Revision ID: 3.00
		Link Frequency 0: [a]
		Link Error 0: <Prot- <Ovfl- <EOC- CTLTm-
		Link Frequency Capability 0: 200MHz+ 300MHz- 400MHz+ 500MHz- 600MHz+ 800MHz+ 1.0GHz+ 1.2GHz+ 1.4GHz- 1.6GHz- Vend-
		Feature Capability: IsocFC- LDTSTOP+ CRCTM- ECTLT- 64bA- UIDRD-
		Link Frequency 1: 200MHz
		Link Error 1: <Prot- <Ovfl- <EOC- CTLTm-
		Link Frequency Capability 1: 200MHz- 300MHz- 400MHz- 500MHz- 600MHz- 800MHz- 1.0GHz- 1.2GHz- 1.4GHz- 1.6GHz- Vend-
		Error Handling: PFlE- OFlE- PFE- OFE- EOCFE- RFE- CRCFE- SERRFE- CF- RE- PNFE- ONFE- EOCNFE- RNFE- CRCNFE- SERRNFE-
		Prefetchable memory behind bridge Upper: 00-00
		Bus Number: 00
	Capabilities: [40] HyperTransport: Retry Mode
	Capabilities: [54] HyperTransport: UnitID Clumping
	Capabilities: [9c] HyperTransport: #1a

00:02.0 PCI bridge [0604]: Advanced Micro Devices, Inc. [AMD/ATI] RX780/RD790 PCI to PCI bridge (external gfx0 port A) [1002:5978] (prog-if 00 [Normal decode])
	Control: I/O+ Mem+ BusMaster+ SpecCycle- MemWINV- VGASnoop- ParErr- Stepping- SERR- FastB2B- DisINTx+
	Status: Cap+ 66MHz- UDF- FastB2B- ParErr- DEVSEL=fast >TAbort- <TAbort- <MAbort- >SERR- <PERR- INTx-
	Latency: 0, Cache Line Size: 4 bytes
	Interrupt: pin A routed to IRQ 24
	NUMA node: 0
	Bus: primary=00, secondary=01, subordinate=01, sec-latency=0
	I/O behind bridge: 0000e000-0000efff [size=4K]
	Memory behind bridge: f8000000-fbffffff [size=64M]
	Prefetchable memory behind bridge: 00000000d0000000-00000000dfffffff [size=256M]
	Secondary status: 66MHz- FastB2B- ParErr- DEVSEL=fast >TAbort- <TAbort- <MAbort- <SERR- <PERR-
	BridgeCtl: Parity- SERR+ NoISA- VGA+ VGA16- MAbort- >Reset- FastB2B-
		PriDiscTmr- SecDiscTmr- DiscTmrStat- DiscTmrSERREn-
	Capabilities: [50] Power Management version 3
		Flags: PMEClk- DSI- D1- D2- AuxCurrent=0mA PME(D0+,D1-,D2-,D3hot+,D3cold+)
		Status: D0 NoSoftRst- PME-Enable- DSel=0 DScale=0 PME-
	Capabilities: [58] Express (v2) Root Port (Slot-), MSI 00
		DevCap:	MaxPayload 128 bytes, PhantFunc 0
			ExtTag+ RBE+
		DevCtl:	CorrErr- NonFatalErr- FatalErr- UnsupReq-
			RlxdOrd+ ExtTag+ PhantFunc- AuxPwr- NoSnoop+
			MaxPayload 128 bytes, MaxReadReq 128 bytes
		DevSta:	CorrErr- NonFatalErr- FatalErr- UnsupReq- AuxPwr- TransPend-
		LnkCap:	Port #0, Speed 5GT/s, Width x16, ASPM L0s L1, Exit Latency L0s <64ns, L1 <1us
			ClockPM- Surprise- LLActRep+ BwNot+ ASPMOptComp-
		LnkCtl:	ASPM Disabled; RCB 64 bytes Disabled- CommClk+
			ExtSynch- ClockPM- AutWidDis- BWInt- AutBWInt-
		LnkSta:	Speed 2.5GT/s (downgraded), Width x16 (ok)
			TrErr- Train- SlotClk+ DLActive+ BWMgmt+ ABWMgmt-
		RootCap: CRSVisible+
		RootCtl: ErrCorrectable- ErrNon-Fatal- ErrFatal- PMEIntEna- CRSVisible+
		RootSta: PME ReqID 0000, PMEStatus- PMEPending-
		DevCap2: Completion Timeout: Not Supported, TimeoutDis-, NROPrPrP-, LTR-
			 10BitTagComp-, 10BitTagReq-, OBFF Not Supported, ExtFmt-, EETLPPrefix-
			 EmergencyPowerReduction Not Supported, EmergencyPowerReductionInit-
			 FRS-, LN System CLS Not Supported, TPHComp-, ExtTPHComp-, ARIFwd-
			 AtomicOpsCap: Routing- 32bit- 64bit- 128bitCAS-
		DevCtl2: Completion Timeout: 50us to 50ms, TimeoutDis-, LTR-, OBFF Disabled ARIFwd-
			 AtomicOpsCtl: ReqEn- EgressBlck-
		LnkCtl2: Target Link Speed: 5GT/s, EnterCompliance- SpeedDis-
			 Transmit Margin: Normal Operating Range, EnterModifiedCompliance- ComplianceSOS-
			 Compliance De-emphasis: -6dB
		LnkSta2: Current De-emphasis Level: -3.5dB, EqualizationComplete-, EqualizationPhase1-
			 EqualizationPhase2-, EqualizationPhase3-, LinkEqualizationRequest-
	Capabilities: [a0] MSI: Enable+ Count=1/1 Maskable- 64bit-
		Address: fee04004  Data: 4021
	Capabilities: [b0] Subsystem: Advanced Micro Devices, Inc. [AMD/ATI] Device [1002:5958]
	Capabilities: [b8] HyperTransport: MSI Mapping Enable+ Fixed+
	Capabilities: [100 v1] Vendor Specific Information: ID=0001 Rev=1 Len=010 <?>
	Capabilities: [110 v1] Virtual Channel
		Caps:	LPEVC=0 RefClk=100ns PATEntryBits=1
		Arb:	Fixed- WRR32- WRR64- WRR128-
		Ctrl:	ArbSelect=Fixed
		Status:	InProgress-
		VC0:	Caps:	PATOffset=00 MaxTimeSlots=1 RejSnoopTrans-
			Arb:	Fixed+ WRR32- WRR64- WRR128- TWRR128- WRR256-
			Ctrl:	Enable+ ID=0 ArbSelect=Fixed TC/VC=ff
			Status:	NegoPending- InProgress-
	Kernel driver in use: pcieport

00:11.0 SATA controller [0106]: Advanced Micro Devices, Inc. [AMD/ATI] SB7x0/SB8x0/SB9x0 SATA Controller [IDE mode] [1002:4390] (prog-if 01 [AHCI 1.0])
	Subsystem: Gigabyte Technology Co., Ltd GA-MA770-DS3rev2.0 Motherboard [1458:b002]
	Control: I/O+ Mem+ BusMaster+ SpecCycle- MemWINV- VGASnoop- ParErr- Stepping- SERR- FastB2B- DisINTx-
	Status: Cap+ 66MHz+ UDF- FastB2B- ParErr- DEVSEL=medium >TAbort- <TAbort- <MAbort- >SERR- <PERR- INTx-
	Latency: 32
	Interrupt: pin A routed to IRQ 22
	NUMA node: 0
	Region 0: I/O ports at ff00 [size=8]
	Region 1: I/O ports at fe00 [size=4]
	Region 2: I/O ports at fd00 [size=8]
	Region 3: I/O ports at fc00 [size=4]
	Region 4: I/O ports at fb00 [size=16]
	Region 5: Memory at fe02f000 (32-bit, non-prefetchable) [size=1K]
	Capabilities: [60] Power Management version 2
		Flags: PMEClk- DSI+ D1- D2- AuxCurrent=0mA PME(D0-,D1-,D2-,D3hot-,D3cold-)
		Status: D0 NoSoftRst- PME-Enable- DSel=0 DScale=0 PME-
	Capabilities: [70] SATA HBA v1.0 InCfgSpace
	Kernel driver in use: ahci

00:12.0 USB controller [0c03]: Advanced Micro Devices, Inc. [AMD/ATI] SB7x0/SB8x0/SB9x0 USB OHCI0 Controller [1002:4397] (prog-if 10 [OHCI])
	Subsystem: Gigabyte Technology Co., Ltd GA-880GMA-USB3 [1458:5004]
	Control: I/O- Mem+ BusMaster+ SpecCycle- MemWINV- VGASnoop- ParErr- Stepping- SERR- FastB2B- DisINTx-
	Status: Cap- 66MHz+ UDF- FastB2B+ ParErr- DEVSEL=medium >TAbort- <TAbort- <MAbort- >SERR- <PERR- INTx-
	Latency: 32, Cache Line Size: 4 bytes
	Interrupt: pin A routed to IRQ 16
	NUMA node: 0
	Region 0: Memory at fe02e000 (32-bit, non-prefetchable) [size=4K]
	Kernel driver in use: ohci-pci

00:12.1 USB controller [0c03]: Advanced Micro Devices, Inc. [AMD/ATI] SB7x0 USB OHCI1 Controller [1002:4398] (prog-if 10 [OHCI])
	Subsystem: Gigabyte Technology Co., Ltd Device [1458:5004]
	Control: I/O+ Mem+ BusMaster+ SpecCycle- MemWINV- VGASnoop- ParErr- Stepping- SERR- FastB2B- DisINTx-
	Status: Cap- 66MHz+ UDF- FastB2B+ ParErr- DEVSEL=medium >TAbort- <TAbort- <MAbort- >SERR- <PERR- INTx-
	Latency: 32, Cache Line Size: 4 bytes
	Interrupt: pin A routed to IRQ 16
	NUMA node: 0
	Region 0: Memory at fe02d000 (32-bit, non-prefetchable) [size=4K]
	Kernel driver in use: ohci-pci

00:12.2 USB controller [0c03]: Advanced Micro Devices, Inc. [AMD/ATI] SB7x0/SB8x0/SB9x0 USB EHCI Controller [1002:4396] (prog-if 20 [EHCI])
	Subsystem: Gigabyte Technology Co., Ltd GA-880GMA-USB3 [1458:5004]
	Control: I/O- Mem+ BusMaster+ SpecCycle- MemWINV+ VGASnoop- ParErr- Stepping- SERR- FastB2B- DisINTx-
	Status: Cap+ 66MHz+ UDF- FastB2B+ ParErr- DEVSEL=medium >TAbort- <TAbort- <MAbort- >SERR- <PERR- INTx-
	Latency: 32, Cache Line Size: 4 bytes
	Interrupt: pin B routed to IRQ 17
	NUMA node: 0
	Region 0: Memory at fe02c000 (32-bit, non-prefetchable) [size=256]
	Capabilities: [c0] Power Management version 2
		Flags: PMEClk- DSI- D1+ D2+ AuxCurrent=0mA PME(D0+,D1+,D2+,D3hot+,D3cold-)
		Status: D0 NoSoftRst- PME-Enable- DSel=0 DScale=0 PME-
		Bridge: PM- B3+
	Capabilities: [e4] Debug port: BAR=1 offset=00e0
	Kernel driver in use: ehci-pci

00:13.0 USB controller [0c03]: Advanced Micro Devices, Inc. [AMD/ATI] SB7x0/SB8x0/SB9x0 USB OHCI0 Controller [1002:4397] (prog-if 10 [OHCI])
	Subsystem: Gigabyte Technology Co., Ltd GA-880GMA-USB3 [1458:5004]
	Control: I/O- Mem+ BusMaster+ SpecCycle- MemWINV- VGASnoop- ParErr- Stepping- SERR- FastB2B- DisINTx-
	Status: Cap- 66MHz+ UDF- FastB2B+ ParErr- DEVSEL=medium >TAbort- <TAbort- <MAbort- >SERR- <PERR- INTx-
	Latency: 32, Cache Line Size: 4 bytes
	Interrupt: pin A routed to IRQ 18
	NUMA node: 0
	Region 0: Memory at fe02b000 (32-bit, non-prefetchable) [size=4K]
	Kernel driver in use: ohci-pci

00:13.1 USB controller [0c03]: Advanced Micro Devices, Inc. [AMD/ATI] SB7x0 USB OHCI1 Controller [1002:4398] (prog-if 10 [OHCI])
	Subsystem: Gigabyte Technology Co., Ltd Device [1458:5004]
	Control: I/O+ Mem+ BusMaster+ SpecCycle- MemWINV- VGASnoop- ParErr- Stepping- SERR- FastB2B- DisINTx-
	Status: Cap- 66MHz+ UDF- FastB2B+ ParErr- DEVSEL=medium >TAbort- <TAbort- <MAbort- >SERR- <PERR- INTx-
	Latency: 32, Cache Line Size: 4 bytes
	Interrupt: pin A routed to IRQ 18
	NUMA node: 0
	Region 0: Memory at fe02a000 (32-bit, non-prefetchable) [size=4K]
	Kernel driver in use: ohci-pci

00:13.2 USB controller [0c03]: Advanced Micro Devices, Inc. [AMD/ATI] SB7x0/SB8x0/SB9x0 USB EHCI Controller [1002:4396] (prog-if 20 [EHCI])
	Subsystem: Gigabyte Technology Co., Ltd GA-880GMA-USB3 [1458:5004]
	Control: I/O- Mem+ BusMaster+ SpecCycle- MemWINV+ VGASnoop- ParErr- Stepping- SERR- FastB2B- DisINTx-
	Status: Cap+ 66MHz+ UDF- FastB2B+ ParErr- DEVSEL=medium >TAbort- <TAbort- <MAbort- >SERR- <PERR- INTx-
	Latency: 32, Cache Line Size: 4 bytes
	Interrupt: pin B routed to IRQ 19
	NUMA node: 0
	Region 0: Memory at fe029000 (32-bit, non-prefetchable) [size=256]
	Capabilities: [c0] Power Management version 2
		Flags: PMEClk- DSI- D1+ D2+ AuxCurrent=0mA PME(D0+,D1+,D2+,D3hot+,D3cold-)
		Status: D0 NoSoftRst- PME-Enable- DSel=0 DScale=0 PME-
		Bridge: PM- B3+
	Capabilities: [e4] Debug port: BAR=1 offset=00e0
	Kernel driver in use: ehci-pci

00:14.0 SMBus [0c05]: Advanced Micro Devices, Inc. [AMD/ATI] SBx00 SMBus Controller [1002:4385] (rev 3a)
	Subsystem: Gigabyte Technology Co., Ltd GA-MA770-DS3rev2.0 Motherboard [1458:4385]
	Control: I/O+ Mem+ BusMaster- SpecCycle- MemWINV- VGASnoop- ParErr- Stepping- SERR- FastB2B- DisINTx+
	Status: Cap+ 66MHz+ UDF- FastB2B- ParErr- DEVSEL=medium >TAbort- <TAbort- <MAbort- >SERR- <PERR- INTx-
	NUMA node: 0
	Capabilities: [b0] HyperTransport: MSI Mapping Enable- Fixed+
	Kernel modules: i2c_piix4, sp5100_tco

00:14.1 IDE interface [0101]: Advanced Micro Devices, Inc. [AMD/ATI] SB7x0/SB8x0/SB9x0 IDE Controller [1002:439c] (prog-if 8a [ISA Compatibility mode controller, supports both channels switched to PCI native mode, supports bus mastering])
	Subsystem: Gigabyte Technology Co., Ltd Device [1458:5002]
	Control: I/O+ Mem- BusMaster+ SpecCycle- MemWINV- VGASnoop- ParErr- Stepping- SERR- FastB2B- DisINTx-
	Status: Cap+ 66MHz+ UDF- FastB2B- ParErr- DEVSEL=medium >TAbort- <TAbort- <MAbort- >SERR- <PERR- INTx-
	Latency: 32
	Interrupt: pin A routed to IRQ 16
	NUMA node: 0
	Region 0: Memory at 000001f0 (32-bit, non-prefetchable) [virtual] [size=8]
	Region 1: Memory at 000003f0 (type 3, non-prefetchable) [virtual]
	Region 2: Memory at 00000170 (32-bit, non-prefetchable) [virtual] [size=8]
	Region 3: Memory at 00000370 (type 3, non-prefetchable) [virtual]
	Region 4: I/O ports at fa00 [virtual] [size=16]
	Capabilities: [70] MSI: Enable- Count=1/2 Maskable- 64bit-
		Address: 00000000  Data: 0000
	Kernel driver in use: pata_atiixp
	Kernel modules: pata_atiixp, pata_acpi, ata_generic

00:14.2 Audio device [0403]: Advanced Micro Devices, Inc. [AMD/ATI] SBx00 Azalia (Intel HDA) [1002:4383]
	Subsystem: Gigabyte Technology Co., Ltd Device [1458:a002]
	Control: I/O- Mem+ BusMaster+ SpecCycle- MemWINV- VGASnoop- ParErr- Stepping- SERR- FastB2B- DisINTx-
	Status: Cap+ 66MHz- UDF- FastB2B- ParErr- DEVSEL=slow >TAbort- <TAbort- <MAbort- >SERR- <PERR- INTx-
	Latency: 32, Cache Line Size: 4 bytes
	Interrupt: pin A routed to IRQ 16
	NUMA node: 0
	Region 0: Memory at fe024000 (64-bit, non-prefetchable) [size=16K]
	Capabilities: [50] Power Management version 2
		Flags: PMEClk- DSI- D1- D2- AuxCurrent=55mA PME(D0+,D1-,D2-,D3hot+,D3cold+)
		Status: D0 NoSoftRst- PME-Enable- DSel=0 DScale=0 PME-
	Kernel driver in use: snd_hda_intel
	Kernel modules: snd_hda_intel

00:14.3 ISA bridge [0601]: Advanced Micro Devices, Inc. [AMD/ATI] SB7x0/SB8x0/SB9x0 LPC host controller [1002:439d]
	Subsystem: Advanced Micro Devices, Inc. [AMD/ATI] SB7x0/SB8x0/SB9x0 LPC host controller [1002:439d]
	Control: I/O+ Mem+ BusMaster+ SpecCycle+ MemWINV- VGASnoop- ParErr- Stepping- SERR- FastB2B- DisINTx-
	Status: Cap- 66MHz+ UDF- FastB2B- ParErr- DEVSEL=medium >TAbort- <TAbort- <MAbort- >SERR- <PERR- INTx-
	Latency: 0
	NUMA node: 0

00:14.4 PCI bridge [0604]: Advanced Micro Devices, Inc. [AMD/ATI] SBx00 PCI to PCI Bridge [1002:4384] (prog-if 01 [Subtractive decode])
	Control: I/O+ Mem+ BusMaster+ SpecCycle- MemWINV- VGASnoop+ ParErr- Stepping- SERR- FastB2B- DisINTx-
	Status: Cap- 66MHz+ UDF- FastB2B+ ParErr- DEVSEL=medium >TAbort- <TAbort- <MAbort- >SERR- <PERR- INTx-
	Latency: 64
	NUMA node: 0
	Bus: primary=00, secondary=02, subordinate=02, sec-latency=64
	I/O behind bridge: 0000d000-0000dfff [size=4K]
	Memory behind bridge: fde00000-fdefffff [size=1M]
	Prefetchable memory behind bridge: fdf00000-fdffffff [size=1M]
	Secondary status: 66MHz- FastB2B+ ParErr- DEVSEL=medium >TAbort- <TAbort- <MAbort+ <SERR- <PERR-
	BridgeCtl: Parity- SERR+ NoISA- VGA- VGA16- MAbort- >Reset- FastB2B-
		PriDiscTmr- SecDiscTmr- DiscTmrStat- DiscTmrSERREn-

00:14.5 USB controller [0c03]: Advanced Micro Devices, Inc. [AMD/ATI] SB7x0/SB8x0/SB9x0 USB OHCI2 Controller [1002:4399] (prog-if 10 [OHCI])
	Subsystem: Gigabyte Technology Co., Ltd GA-880GMA-USB3 [1458:5004]
	Control: I/O- Mem+ BusMaster+ SpecCycle- MemWINV- VGASnoop- ParErr- Stepping- SERR- FastB2B- DisINTx-
	Status: Cap- 66MHz+ UDF- FastB2B+ ParErr- DEVSEL=medium >TAbort- <TAbort- <MAbort- >SERR- <PERR- INTx-
	Latency: 32, Cache Line Size: 4 bytes
	Interrupt: pin C routed to IRQ 18
	NUMA node: 0
	Region 0: Memory at fe028000 (32-bit, non-prefetchable) [size=4K]
	Kernel driver in use: ohci-pci

00:18.0 Host bridge [0600]: Advanced Micro Devices, Inc. [AMD] Family 10h Processor HyperTransport Configuration [1022:1200]
	Control: I/O- Mem- BusMaster- SpecCycle- MemWINV- VGASnoop- ParErr- Stepping- SERR- FastB2B- DisINTx-
	Status: Cap+ 66MHz- UDF- FastB2B- ParErr- DEVSEL=fast >TAbort- <TAbort- <MAbort- >SERR- <PERR- INTx-
	NUMA node: 0
	Capabilities: [80] HyperTransport: Host or Secondary Interface
		Command: WarmRst+ DblEnd- DevNum=0 ChainSide- HostHide+ Slave- <EOCErr- DUL-
		Link Control: CFlE- CST- CFE- <LkFail- Init+ EOC- TXO- <CRCErr=0 IsocEn- LSEn+ ExtCTL- 64b-
		Link Config: MLWI=16bit DwFcIn- MLWO=16bit DwFcOut- LWI=16bit DwFcInEn- LWO=16bit DwFcOutEn-
		Revision ID: 3.00
		Link Frequency: [a]
		Link Error: <Prot- <Ovfl- <EOC- CTLTm-
		Link Frequency Capability: 200MHz+ 300MHz- 400MHz+ 500MHz- 600MHz+ 800MHz+ 1.0GHz+ 1.2GHz+ 1.4GHz- 1.6GHz- Vend-
		Feature Capability: IsocFC+ LDTSTOP+ CRCTM- ECTLT- 64bA+ UIDRD- ExtRS- UCnfE-

00:18.1 Host bridge [0600]: Advanced Micro Devices, Inc. [AMD] Family 10h Processor Address Map [1022:1201]
	Control: I/O- Mem- BusMaster- SpecCycle- MemWINV- VGASnoop- ParErr- Stepping- SERR- FastB2B- DisINTx-
	Status: Cap- 66MHz- UDF- FastB2B- ParErr- DEVSEL=fast >TAbort- <TAbort- <MAbort- >SERR- <PERR- INTx-
	NUMA node: 0

00:18.2 Host bridge [0600]: Advanced Micro Devices, Inc. [AMD] Family 10h Processor DRAM Controller [1022:1202]
	Control: I/O- Mem- BusMaster- SpecCycle- MemWINV- VGASnoop- ParErr- Stepping- SERR- FastB2B- DisINTx-
	Status: Cap- 66MHz- UDF- FastB2B- ParErr- DEVSEL=fast >TAbort- <TAbort- <MAbort- >SERR- <PERR- INTx-
	NUMA node: 0

00:18.3 Host bridge [0600]: Advanced Micro Devices, Inc. [AMD] Family 10h Processor Miscellaneous Control [1022:1203]
	Control: I/O- Mem- BusMaster- SpecCycle- MemWINV- VGASnoop- ParErr- Stepping- SERR- FastB2B- DisINTx-
	Status: Cap+ 66MHz- UDF- FastB2B- ParErr- DEVSEL=fast >TAbort- <TAbort- <MAbort- >SERR- <PERR- INTx-
	NUMA node: 0
	Capabilities: [f0] Secure device <?>
	Kernel modules: k10temp

00:18.4 Host bridge [0600]: Advanced Micro Devices, Inc. [AMD] Family 10h Processor Link Control [1022:1204]
	Control: I/O- Mem- BusMaster- SpecCycle- MemWINV- VGASnoop- ParErr- Stepping- SERR- FastB2B- DisINTx-
	Status: Cap- 66MHz- UDF- FastB2B- ParErr- DEVSEL=fast >TAbort- <TAbort- <MAbort- >SERR- <PERR- INTx-
	NUMA node: 0

01:00.0 VGA compatible controller [0300]: NVIDIA Corporation G92 [GeForce 9800 GT] [10de:0614] (rev a2) (prog-if 00 [VGA controller])
	Subsystem: Gigabyte Technology Co., Ltd Device [1458:34af]
	Control: I/O+ Mem+ BusMaster+ SpecCycle- MemWINV- VGASnoop- ParErr- Stepping- SERR- FastB2B- DisINTx+
	Status: Cap+ 66MHz- UDF- FastB2B- ParErr- DEVSEL=fast >TAbort- <TAbort- <MAbort- >SERR- <PERR- INTx-
	Latency: 0, Cache Line Size: 4 bytes
	Interrupt: pin A routed to IRQ 25
	NUMA node: 0
	Region 0: Memory at fa000000 (32-bit, non-prefetchable) [size=16M]
	Region 1: Memory at d0000000 (64-bit, prefetchable) [size=256M]
	Region 3: Memory at f8000000 (64-bit, non-prefetchable) [size=32M]
	Region 5: I/O ports at ef00 [size=128]
	Expansion ROM at 000c0000 [virtual] [disabled] [size=128K]
	Capabilities: [60] Power Management version 3
		Flags: PMEClk- DSI- D1- D2- AuxCurrent=0mA PME(D0-,D1-,D2-,D3hot-,D3cold-)
		Status: D0 NoSoftRst+ PME-Enable- DSel=0 DScale=0 PME-
	Capabilities: [68] MSI: Enable+ Count=1/1 Maskable- 64bit+
		Address: 00000000fee01004  Data: 4024
	Capabilities: [78] Express (v2) Endpoint, MSI 00
		DevCap:	MaxPayload 128 bytes, PhantFunc 0, Latency L0s <512ns, L1 <4us
			ExtTag+ AttnBtn- AttnInd- PwrInd- RBE+ FLReset- SlotPowerLimit 0.000W
		DevCtl:	CorrErr- NonFatalErr- FatalErr- UnsupReq-
			RlxdOrd+ ExtTag+ PhantFunc- AuxPwr- NoSnoop+
			MaxPayload 128 bytes, MaxReadReq 512 bytes
		DevSta:	CorrErr- NonFatalErr- FatalErr- UnsupReq- AuxPwr- TransPend-
		LnkCap:	Port #0, Speed 2.5GT/s, Width x16, ASPM L0s L1, Exit Latency L0s <512ns, L1 <1us
			ClockPM- Surprise- LLActRep- BwNot- ASPMOptComp-
		LnkCtl:	ASPM Disabled; RCB 128 bytes Disabled- CommClk+
			ExtSynch- ClockPM- AutWidDis- BWInt- AutBWInt-
		LnkSta:	Speed 2.5GT/s (ok), Width x16 (ok)
			TrErr- Train- SlotClk+ DLActive- BWMgmt- ABWMgmt-
		DevCap2: Completion Timeout: Not Supported, TimeoutDis+, NROPrPrP-, LTR-
			 10BitTagComp-, 10BitTagReq-, OBFF Not Supported, ExtFmt-, EETLPPrefix-
			 EmergencyPowerReduction Not Supported, EmergencyPowerReductionInit-
			 FRS-, TPHComp-, ExtTPHComp-
			 AtomicOpsCap: 32bit- 64bit- 128bitCAS-
		DevCtl2: Completion Timeout: 50us to 50ms, TimeoutDis-, LTR-, OBFF Disabled
			 AtomicOpsCtl: ReqEn-
		LnkCtl2: Target Link Speed: 2.5GT/s, EnterCompliance- SpeedDis-
			 Transmit Margin: Normal Operating Range, EnterModifiedCompliance- ComplianceSOS-
			 Compliance De-emphasis: -6dB
		LnkSta2: Current De-emphasis Level: -6dB, EqualizationComplete-, EqualizationPhase1-
			 EqualizationPhase2-, EqualizationPhase3-, LinkEqualizationRequest-
	Capabilities: [100 v1] Virtual Channel
		Caps:	LPEVC=0 RefClk=100ns PATEntryBits=1
		Arb:	Fixed- WRR32- WRR64- WRR128-
		Ctrl:	ArbSelect=Fixed
		Status:	InProgress-
		VC0:	Caps:	PATOffset=00 MaxTimeSlots=1 RejSnoopTrans-
			Arb:	Fixed- WRR32- WRR64- WRR128- TWRR128- WRR256-
			Ctrl:	Enable+ ID=0 ArbSelect=Fixed TC/VC=ff
			Status:	NegoPending- InProgress-
	Capabilities: [128 v1] Power Budgeting <?>
	Capabilities: [600 v1] Vendor Specific Information: ID=0001 Rev=1 Len=024 <?>
	Kernel driver in use: nouveau
	Kernel modules: nouveau

02:06.0 Ethernet controller [0200]: Realtek Semiconductor Co., Ltd. RTL8169 PCI Gigabit Ethernet Controller [10ec:8169] (rev 10)
	Subsystem: Realtek Semiconductor Co., Ltd. RTL8169/8110 Family PCI Gigabit Ethernet NIC [10ec:8169]
	Control: I/O+ Mem+ BusMaster+ SpecCycle- MemWINV+ VGASnoop- ParErr- Stepping- SERR- FastB2B- DisINTx-
	Status: Cap+ 66MHz+ UDF- FastB2B+ ParErr- DEVSEL=medium >TAbort- <TAbort- <MAbort- >SERR- <PERR- INTx-
	Latency: 64 (8000ns min, 16000ns max), Cache Line Size: 32 bytes
	Interrupt: pin A routed to IRQ 20
	NUMA node: 0
	Region 0: I/O ports at de00 [size=256]
	Region 1: Memory at fdeff000 (32-bit, non-prefetchable) [size=256]
	Expansion ROM at fdf00000 [virtual] [disabled] [size=128K]
	Capabilities: [dc] Power Management version 2
		Flags: PMEClk- DSI- D1+ D2+ AuxCurrent=375mA PME(D0-,D1+,D2+,D3hot+,D3cold+)
		Status: D0 NoSoftRst- PME-Enable- DSel=0 DScale=0 PME-
	Kernel driver in use: r8169
	Kernel modules: r8169

