00:00.0 Host bridge [0600]: Intel Corporation 82G33/G31/P35/P31 Express DRAM Controller [8086:29c0] (rev 10)
	Subsystem: ASUSTeK Computer Inc. P5KPL-VM Motherboard [1043:82b0]
	Control: I/O- Mem+ BusMaster+ SpecCycle- MemWINV- VGASnoop- ParErr- Stepping- SERR- FastB2B- DisINTx-
	Status: Cap+ 66MHz- UDF- FastB2B+ ParErr- DEVSEL=fast >TAbort- <TAbort- <MAbort+ >SERR- <PERR- INTx-
	Latency: 0
	Capabilities: [e0] Vendor Specific Information: Len=0b <?>

00:01.0 PCI bridge [0604]: Intel Corporation 82G33/G31/P35/P31 Express PCI Express Root Port [8086:29c1] (rev 10) (prog-if 00 [Normal decode])
	Control: I/O+ Mem+ BusMaster+ SpecCycle- MemWINV- VGASnoop- ParErr- Stepping- SERR+ FastB2B- DisINTx-
	Status: Cap+ 66MHz- UDF- FastB2B- ParErr- DEVSEL=fast >TAbort- <TAbort- <MAbort- >SERR- <PERR- INTx-
	Latency: 0, Cache Line Size: 32 bytes
	Interrupt: pin A routed to IRQ 16
	Bus: primary=00, secondary=01, subordinate=01, sec-latency=0
	I/O behind bridge: 0000d000-0000dfff [size=4K]
	Memory behind bridge: fea00000-feafffff [size=1M]
	Prefetchable memory behind bridge: 00000000e0000000-00000000efffffff [size=256M]
	Secondary status: 66MHz- FastB2B- ParErr- DEVSEL=fast >TAbort- <TAbort- <MAbort+ <SERR- <PERR-
	BridgeCtl: Parity- SERR+ NoISA- VGA+ VGA16- MAbort- >Reset- FastB2B-
		PriDiscTmr- SecDiscTmr- DiscTmrStat- DiscTmrSERREn-
	Capabilities: [88] Subsystem: ASUSTeK Computer Inc. 82G33/G31/P35/P31 Express PCI Express Root Port [1043:82b0]
	Capabilities: [80] Power Management version 3
		Flags: PMEClk- DSI- D1- D2- AuxCurrent=0mA PME(D0+,D1-,D2-,D3hot+,D3cold+)
		Status: D0 NoSoftRst+ PME-Enable- DSel=0 DScale=0 PME-
	Capabilities: [90] MSI: Enable- Count=1/1 Maskable- 64bit-
		Address: 00000000  Data: 0000
	Capabilities: [a0] Express (v1) Root Port (Slot+), MSI 00
		DevCap:	MaxPayload 128 bytes, PhantFunc 0
			ExtTag- RBE+
		DevCtl:	CorrErr- NonFatalErr- FatalErr- UnsupReq-
			RlxdOrd- ExtTag- PhantFunc- AuxPwr- NoSnoop-
			MaxPayload 128 bytes, MaxReadReq 128 bytes
		DevSta:	CorrErr- NonFatalErr- FatalErr- UnsupReq- AuxPwr- TransPend-
		LnkCap:	Port #2, Speed 2.5GT/s, Width x16, ASPM L0s, Exit Latency L0s <256ns
			ClockPM- Surprise- LLActRep- BwNot- ASPMOptComp-
		LnkCtl:	ASPM Disabled; RCB 64 bytes, Disabled- CommClk+
			ExtSynch- ClockPM- AutWidDis- BWInt- AutBWInt-
		LnkSta:	Speed 2.5GT/s (ok), Width x16 (ok)
			TrErr- Train- SlotClk+ DLActive- BWMgmt- ABWMgmt-
		SltCap:	AttnBtn- PwrCtrl- MRL- AttnInd- PwrInd- HotPlug- Surprise-
			Slot #0, PowerLimit 75.000W; Interlock- NoCompl-
		SltCtl:	Enable: AttnBtn- PwrFlt- MRL- PresDet- CmdCplt- HPIrq- LinkChg-
			Control: AttnInd Off, PwrInd On, Power- Interlock-
		SltSta:	Status: AttnBtn- PowerFlt- MRL- CmdCplt- PresDet+ Interlock-
			Changed: MRL- PresDet+ LinkState-
		RootCap: CRSVisible-
		RootCtl: ErrCorrectable- ErrNon-Fatal- ErrFatal- PMEIntEna- CRSVisible-
		RootSta: PME ReqID 0000, PMEStatus- PMEPending-
	Capabilities: [100 v1] Virtual Channel
		Caps:	LPEVC=0 RefClk=100ns PATEntryBits=1
		Arb:	Fixed- WRR32- WRR64- WRR128-
		Ctrl:	ArbSelect=Fixed
		Status:	InProgress-
		VC0:	Caps:	PATOffset=00 MaxTimeSlots=1 RejSnoopTrans-
			Arb:	Fixed- WRR32- WRR64- WRR128- TWRR128- WRR256-
			Ctrl:	Enable+ ID=0 ArbSelect=Fixed TC/VC=01
			Status:	NegoPending- InProgress-
	Capabilities: [140 v1] Root Complex Link
		Desc:	PortNumber=02 ComponentID=01 EltType=Config
		Link0:	Desc:	TargetPort=00 TargetComponent=01 AssocRCRB- LinkType=MemMapped LinkValid+
			Addr:	00000000fed19000
	Kernel driver in use: pcieport

00:1b.0 Audio device [0403]: Intel Corporation NM10/ICH7 Family High Definition Audio Controller [8086:27d8] (rev 01)
	Subsystem: ASUSTeK Computer Inc. P5KPL-CM Motherboard [1043:82ea]
	Control: I/O- Mem+ BusMaster+ SpecCycle- MemWINV- VGASnoop- ParErr- Stepping- SERR- FastB2B- DisINTx+
	Status: Cap+ 66MHz- UDF- FastB2B- ParErr- DEVSEL=fast >TAbort- <TAbort- <MAbort- >SERR- <PERR- INTx-
	Latency: 0, Cache Line Size: 32 bytes
	Interrupt: pin A routed to IRQ 25
	Region 0: Memory at fe9fc000 (64-bit, non-prefetchable) [size=16K]
	Capabilities: [50] Power Management version 2
		Flags: PMEClk- DSI- D1- D2- AuxCurrent=55mA PME(D0+,D1-,D2-,D3hot+,D3cold+)
		Status: D0 NoSoftRst- PME-Enable- DSel=0 DScale=0 PME-
	Capabilities: [60] MSI: Enable+ Count=1/1 Maskable- 64bit+
		Address: 00000000fee04004  Data: 0024
	Capabilities: [70] Express (v1) Root Complex Integrated Endpoint, MSI 00
		DevCap:	MaxPayload 128 bytes, PhantFunc 0
			ExtTag- RBE- FLReset-
		DevCtl:	CorrErr- NonFatalErr- FatalErr- UnsupReq-
			RlxdOrd- ExtTag- PhantFunc- AuxPwr- NoSnoop+
			MaxPayload 128 bytes, MaxReadReq 128 bytes
		DevSta:	CorrErr- NonFatalErr- FatalErr- UnsupReq- AuxPwr+ TransPend-
	Capabilities: [100 v1] Virtual Channel
		Caps:	LPEVC=0 RefClk=100ns PATEntryBits=1
		Arb:	Fixed- WRR32- WRR64- WRR128-
		Ctrl:	ArbSelect=Fixed
		Status:	InProgress-
		VC0:	Caps:	PATOffset=00 MaxTimeSlots=1 RejSnoopTrans-
			Arb:	Fixed- WRR32- WRR64- WRR128- TWRR128- WRR256-
			Ctrl:	Enable+ ID=0 ArbSelect=Fixed TC/VC=01
			Status:	NegoPending- InProgress-
		VC1:	Caps:	PATOffset=00 MaxTimeSlots=1 RejSnoopTrans-
			Arb:	Fixed- WRR32- WRR64- WRR128- TWRR128- WRR256-
			Ctrl:	Enable- ID=0 ArbSelect=Fixed TC/VC=00
			Status:	NegoPending- InProgress-
	Capabilities: [130 v1] Root Complex Link
		Desc:	PortNumber=0f ComponentID=00 EltType=Config
		Link0:	Desc:	TargetPort=00 TargetComponent=00 AssocRCRB- LinkType=MemMapped LinkValid+
			Addr:	00000000fed1c000
	Kernel driver in use: snd_hda_intel
	Kernel modules: snd_hda_intel

00:1c.0 PCI bridge [0604]: Intel Corporation NM10/ICH7 Family PCI Express Port 1 [8086:27d0] (rev 01) (prog-if 00 [Normal decode])
	Control: I/O+ Mem+ BusMaster+ SpecCycle- MemWINV- VGASnoop- ParErr- Stepping- SERR+ FastB2B- DisINTx-
	Status: Cap+ 66MHz- UDF- FastB2B- ParErr- DEVSEL=fast >TAbort- <TAbort- <MAbort- >SERR- <PERR- INTx-
	Latency: 0, Cache Line Size: 32 bytes
	Interrupt: pin A routed to IRQ 16
	Bus: primary=00, secondary=03, subordinate=03, sec-latency=0
	I/O behind bridge: 00001000-00001fff [size=4K]
	Memory behind bridge: f4000000-f41fffff [size=2M]
	Prefetchable memory behind bridge: 00000000f4200000-00000000f43fffff [size=2M]
	Secondary status: 66MHz- FastB2B- ParErr- DEVSEL=fast >TAbort- <TAbort- <MAbort+ <SERR- <PERR-
	BridgeCtl: Parity- SERR+ NoISA- VGA- VGA16- MAbort- >Reset- FastB2B-
		PriDiscTmr- SecDiscTmr- DiscTmrStat- DiscTmrSERREn-
	Capabilities: [40] Express (v1) Root Port (Slot+), MSI 00
		DevCap:	MaxPayload 128 bytes, PhantFunc 0
			ExtTag- RBE-
		DevCtl:	CorrErr- NonFatalErr- FatalErr- UnsupReq-
			RlxdOrd- ExtTag- PhantFunc- AuxPwr- NoSnoop-
			MaxPayload 128 bytes, MaxReadReq 128 bytes
		DevSta:	CorrErr- NonFatalErr- FatalErr- UnsupReq- AuxPwr+ TransPend-
		LnkCap:	Port #1, Speed 2.5GT/s, Width x1, ASPM L0s L1, Exit Latency L0s <1us, L1 <4us
			ClockPM- Surprise- LLActRep+ BwNot- ASPMOptComp-
		LnkCtl:	ASPM Disabled; RCB 64 bytes, Disabled- CommClk-
			ExtSynch- ClockPM- AutWidDis- BWInt- AutBWInt-
		LnkSta:	Speed 2.5GT/s (ok), Width x0 (downgraded)
			TrErr- Train- SlotClk+ DLActive- BWMgmt- ABWMgmt-
		SltCap:	AttnBtn- PwrCtrl- MRL- AttnInd- PwrInd- HotPlug+ Surprise+
			Slot #4, PowerLimit 25.000W; Interlock- NoCompl-
		SltCtl:	Enable: AttnBtn- PwrFlt- MRL- PresDet- CmdCplt- HPIrq- LinkChg-
			Control: AttnInd Unknown, PwrInd Unknown, Power- Interlock-
		SltSta:	Status: AttnBtn- PowerFlt- MRL- CmdCplt- PresDet- Interlock-
			Changed: MRL- PresDet- LinkState-
		RootCap: CRSVisible-
		RootCtl: ErrCorrectable- ErrNon-Fatal- ErrFatal- PMEIntEna- CRSVisible-
		RootSta: PME ReqID 0000, PMEStatus- PMEPending-
	Capabilities: [80] MSI: Enable- Count=1/1 Maskable- 64bit-
		Address: 00000000  Data: 0000
	Capabilities: [90] Subsystem: ASUSTeK Computer Inc. NM10/ICH7 Family PCI Express Port 1 [1043:8179]
	Capabilities: [a0] Power Management version 2
		Flags: PMEClk- DSI- D1- D2- AuxCurrent=0mA PME(D0+,D1-,D2-,D3hot+,D3cold+)
		Status: D0 NoSoftRst- PME-Enable- DSel=0 DScale=0 PME-
	Capabilities: [100 v1] Virtual Channel
		Caps:	LPEVC=0 RefClk=100ns PATEntryBits=1
		Arb:	Fixed+ WRR32- WRR64- WRR128-
		Ctrl:	ArbSelect=Fixed
		Status:	InProgress-
		VC0:	Caps:	PATOffset=00 MaxTimeSlots=1 RejSnoopTrans-
			Arb:	Fixed+ WRR32- WRR64- WRR128- TWRR128- WRR256-
			Ctrl:	Enable+ ID=0 ArbSelect=Fixed TC/VC=01
			Status:	NegoPending- InProgress-
		VC1:	Caps:	PATOffset=00 MaxTimeSlots=1 RejSnoopTrans-
			Arb:	Fixed+ WRR32- WRR64- WRR128- TWRR128- WRR256-
			Ctrl:	Enable- ID=0 ArbSelect=Fixed TC/VC=00
			Status:	NegoPending- InProgress-
	Capabilities: [180 v1] Root Complex Link
		Desc:	PortNumber=01 ComponentID=00 EltType=Config
		Link0:	Desc:	TargetPort=00 TargetComponent=00 AssocRCRB- LinkType=MemMapped LinkValid+
			Addr:	00000000fed1c001
	Kernel driver in use: pcieport

00:1c.1 PCI bridge [0604]: Intel Corporation NM10/ICH7 Family PCI Express Port 2 [8086:27d2] (rev 01) (prog-if 00 [Normal decode])
	Control: I/O+ Mem+ BusMaster+ SpecCycle- MemWINV- VGASnoop- ParErr- Stepping- SERR+ FastB2B- DisINTx-
	Status: Cap+ 66MHz- UDF- FastB2B- ParErr- DEVSEL=fast >TAbort- <TAbort- <MAbort- >SERR- <PERR- INTx-
	Latency: 0, Cache Line Size: 32 bytes
	Interrupt: pin B routed to IRQ 17
	Bus: primary=00, secondary=02, subordinate=02, sec-latency=0
	I/O behind bridge: 0000e000-0000efff [size=4K]
	Memory behind bridge: feb00000-febfffff [size=1M]
	Prefetchable memory behind bridge: 00000000f4400000-00000000f45fffff [size=2M]
	Secondary status: 66MHz- FastB2B- ParErr- DEVSEL=fast >TAbort- <TAbort- <MAbort+ <SERR- <PERR-
	BridgeCtl: Parity- SERR+ NoISA- VGA- VGA16- MAbort- >Reset- FastB2B-
		PriDiscTmr- SecDiscTmr- DiscTmrStat- DiscTmrSERREn-
	Capabilities: [40] Express (v1) Root Port (Slot+), MSI 00
		DevCap:	MaxPayload 128 bytes, PhantFunc 0
			ExtTag- RBE-
		DevCtl:	CorrErr- NonFatalErr- FatalErr- UnsupReq-
			RlxdOrd- ExtTag- PhantFunc- AuxPwr- NoSnoop-
			MaxPayload 128 bytes, MaxReadReq 128 bytes
		DevSta:	CorrErr- NonFatalErr- FatalErr- UnsupReq- AuxPwr+ TransPend-
		LnkCap:	Port #2, Speed 2.5GT/s, Width x1, ASPM L0s L1, Exit Latency L0s <256ns, L1 <4us
			ClockPM- Surprise- LLActRep+ BwNot- ASPMOptComp-
		LnkCtl:	ASPM Disabled; RCB 64 bytes, Disabled- CommClk+
			ExtSynch- ClockPM- AutWidDis- BWInt- AutBWInt-
		LnkSta:	Speed 2.5GT/s (ok), Width x1 (ok)
			TrErr- Train- SlotClk+ DLActive+ BWMgmt- ABWMgmt-
		SltCap:	AttnBtn- PwrCtrl- MRL- AttnInd- PwrInd- HotPlug+ Surprise+
			Slot #0, PowerLimit 0.000W; Interlock- NoCompl-
		SltCtl:	Enable: AttnBtn- PwrFlt- MRL- PresDet- CmdCplt- HPIrq- LinkChg-
			Control: AttnInd Unknown, PwrInd Unknown, Power- Interlock-
		SltSta:	Status: AttnBtn- PowerFlt- MRL- CmdCplt- PresDet+ Interlock-
			Changed: MRL- PresDet+ LinkState+
		RootCap: CRSVisible-
		RootCtl: ErrCorrectable- ErrNon-Fatal- ErrFatal- PMEIntEna- CRSVisible-
		RootSta: PME ReqID 0000, PMEStatus- PMEPending-
	Capabilities: [80] MSI: Enable- Count=1/1 Maskable- 64bit-
		Address: 00000000  Data: 0000
	Capabilities: [90] Subsystem: ASUSTeK Computer Inc. NM10/ICH7 Family PCI Express Port 2 [1043:8179]
	Capabilities: [a0] Power Management version 2
		Flags: PMEClk- DSI- D1- D2- AuxCurrent=0mA PME(D0+,D1-,D2-,D3hot+,D3cold+)
		Status: D0 NoSoftRst- PME-Enable- DSel=0 DScale=0 PME-
	Capabilities: [100 v1] Virtual Channel
		Caps:	LPEVC=0 RefClk=100ns PATEntryBits=1
		Arb:	Fixed+ WRR32- WRR64- WRR128-
		Ctrl:	ArbSelect=Fixed
		Status:	InProgress-
		VC0:	Caps:	PATOffset=00 MaxTimeSlots=1 RejSnoopTrans-
			Arb:	Fixed+ WRR32- WRR64- WRR128- TWRR128- WRR256-
			Ctrl:	Enable+ ID=0 ArbSelect=Fixed TC/VC=01
			Status:	NegoPending- InProgress-
		VC1:	Caps:	PATOffset=00 MaxTimeSlots=1 RejSnoopTrans-
			Arb:	Fixed+ WRR32- WRR64- WRR128- TWRR128- WRR256-
			Ctrl:	Enable- ID=0 ArbSelect=Fixed TC/VC=00
			Status:	NegoPending- InProgress-
	Capabilities: [180 v1] Root Complex Link
		Desc:	PortNumber=02 ComponentID=00 EltType=Config
		Link0:	Desc:	TargetPort=00 TargetComponent=00 AssocRCRB- LinkType=MemMapped LinkValid+
			Addr:	00000000fed1c001
	Kernel driver in use: pcieport

00:1d.0 USB controller [0c03]: Intel Corporation NM10/ICH7 Family USB UHCI Controller #1 [8086:27c8] (rev 01) (prog-if 00 [UHCI])
	Subsystem: ASUSTeK Computer Inc. P5B-MX/WiFi-AP, P5KPL-VM, P5LD2-VM Mainboard [1043:8179]
	Control: I/O+ Mem- BusMaster+ SpecCycle- MemWINV- VGASnoop- ParErr- Stepping- SERR- FastB2B- DisINTx-
	Status: Cap- 66MHz- UDF- FastB2B+ ParErr- DEVSEL=medium >TAbort- <TAbort- <MAbort- >SERR- <PERR- INTx-
	Latency: 0
	Interrupt: pin A routed to IRQ 23
	Region 4: I/O ports at c480 [size=32]
	Kernel driver in use: uhci_hcd

00:1d.1 USB controller [0c03]: Intel Corporation NM10/ICH7 Family USB UHCI Controller #2 [8086:27c9] (rev 01) (prog-if 00 [UHCI])
	Subsystem: ASUSTeK Computer Inc. P5B-MX/WiFi-AP, P5KPL-VM, P5LD2-VM Mainboard [1043:8179]
	Control: I/O+ Mem- BusMaster+ SpecCycle- MemWINV- VGASnoop- ParErr- Stepping- SERR- FastB2B- DisINTx-
	Status: Cap- 66MHz- UDF- FastB2B+ ParErr- DEVSEL=medium >TAbort- <TAbort- <MAbort- >SERR- <PERR- INTx-
	Latency: 0
	Interrupt: pin B routed to IRQ 19
	Region 4: I/O ports at c800 [size=32]
	Kernel driver in use: uhci_hcd

00:1d.2 USB controller [0c03]: Intel Corporation NM10/ICH7 Family USB UHCI Controller #3 [8086:27ca] (rev 01) (prog-if 00 [UHCI])
	Subsystem: ASUSTeK Computer Inc. P5B-MX/WiFi-AP, P5KPL-VM, P5LD2-VM Mainboard [1043:8179]
	Control: I/O+ Mem- BusMaster+ SpecCycle- MemWINV- VGASnoop- ParErr- Stepping- SERR- FastB2B- DisINTx-
	Status: Cap- 66MHz- UDF- FastB2B+ ParErr- DEVSEL=medium >TAbort- <TAbort- <MAbort- >SERR- <PERR- INTx-
	Latency: 0
	Interrupt: pin C routed to IRQ 18
	Region 4: I/O ports at c880 [size=32]
	Kernel driver in use: uhci_hcd

00:1d.3 USB controller [0c03]: Intel Corporation NM10/ICH7 Family USB UHCI Controller #4 [8086:27cb] (rev 01) (prog-if 00 [UHCI])
	Subsystem: ASUSTeK Computer Inc. P5B-MX/WiFi-AP, P5KPL-VM, P5LD2-VM Mainboard [1043:8179]
	Control: I/O+ Mem- BusMaster+ SpecCycle- MemWINV- VGASnoop- ParErr- Stepping- SERR- FastB2B- DisINTx-
	Status: Cap- 66MHz- UDF- FastB2B+ ParErr- DEVSEL=medium >TAbort- <TAbort- <MAbort- >SERR- <PERR- INTx-
	Latency: 0
	Interrupt: pin D routed to IRQ 16
	Region 4: I/O ports at cc00 [size=32]
	Kernel driver in use: uhci_hcd

00:1d.7 USB controller [0c03]: Intel Corporation NM10/ICH7 Family USB2 EHCI Controller [8086:27cc] (rev 01) (prog-if 20 [EHCI])
	Subsystem: ASUSTeK Computer Inc. P5B-MX/WiFi-AP, P5KPL-VM, P5LD2-VM Mainboard [1043:8179]
	Control: I/O- Mem+ BusMaster+ SpecCycle- MemWINV- VGASnoop- ParErr- Stepping- SERR- FastB2B- DisINTx-
	Status: Cap+ 66MHz- UDF- FastB2B+ ParErr- DEVSEL=medium >TAbort- <TAbort- <MAbort- >SERR- <PERR- INTx-
	Latency: 0
	Interrupt: pin A routed to IRQ 23
	Region 0: Memory at fe9fbc00 (32-bit, non-prefetchable) [size=1K]
	Capabilities: [50] Power Management version 2
		Flags: PMEClk- DSI- D1- D2- AuxCurrent=375mA PME(D0+,D1-,D2-,D3hot+,D3cold+)
		Status: D0 NoSoftRst- PME-Enable- DSel=0 DScale=0 PME-
	Capabilities: [58] Debug port: BAR=1 offset=00a0
	Kernel driver in use: ehci-pci

00:1e.0 PCI bridge [0604]: Intel Corporation 82801 PCI Bridge [8086:244e] (rev e1) (prog-if 01 [Subtractive decode])
	Control: I/O+ Mem- BusMaster+ SpecCycle- MemWINV- VGASnoop- ParErr- Stepping- SERR+ FastB2B- DisINTx-
	Status: Cap+ 66MHz- UDF- FastB2B- ParErr- DEVSEL=fast >TAbort- <TAbort- <MAbort- >SERR- <PERR- INTx-
	Latency: 0
	Bus: primary=00, secondary=04, subordinate=04, sec-latency=32
	I/O behind bridge: [disabled]
	Memory behind bridge: [disabled]
	Prefetchable memory behind bridge: [disabled]
	Secondary status: 66MHz- FastB2B+ ParErr- DEVSEL=medium >TAbort- <TAbort- <MAbort+ <SERR- <PERR-
	BridgeCtl: Parity- SERR+ NoISA- VGA- VGA16- MAbort- >Reset- FastB2B-
		PriDiscTmr- SecDiscTmr- DiscTmrStat- DiscTmrSERREn-
	Capabilities: [50] Subsystem: ASUSTeK Computer Inc. 82801 PCI Bridge [1043:8179]

00:1f.0 ISA bridge [0601]: Intel Corporation 82801GB/GR (ICH7 Family) LPC Interface Bridge [8086:27b8] (rev 01)
	Subsystem: ASUSTeK Computer Inc. P5B-MX/WiFi-AP, P5KPL-VM Motherboard [1043:8179]
	Control: I/O+ Mem+ BusMaster+ SpecCycle- MemWINV- VGASnoop- ParErr- Stepping- SERR- FastB2B- DisINTx-
	Status: Cap+ 66MHz- UDF- FastB2B- ParErr- DEVSEL=medium >TAbort- <TAbort- <MAbort- >SERR- <PERR- INTx-
	Latency: 0
	Capabilities: [e0] Vendor Specific Information: Len=0c <?>
	Kernel driver in use: lpc_ich
	Kernel modules: intel_rng, lpc_ich, leds_ss4200

00:1f.1 IDE interface [0101]: Intel Corporation 82801G (ICH7 Family) IDE Controller [8086:27df] (rev 01) (prog-if 8a [ISA Compatibility mode controller, supports both channels switched to PCI native mode, supports bus mastering])
	Subsystem: ASUSTeK Computer Inc. P5B-MX/WiFi-AP, P5KPL-VM Motherboard [1043:8179]
	Control: I/O+ Mem- BusMaster+ SpecCycle- MemWINV- VGASnoop- ParErr- Stepping- SERR- FastB2B- DisINTx-
	Status: Cap- 66MHz- UDF- FastB2B+ ParErr- DEVSEL=medium >TAbort- <TAbort- <MAbort- >SERR- <PERR- INTx-
	Latency: 0
	Interrupt: pin A routed to IRQ 18
	Region 0: Memory at 000001f0 (32-bit, non-prefetchable) [virtual] [size=8]
	Region 1: Memory at 000003f0 (type 3, non-prefetchable) [virtual]
	Region 2: I/O ports at 0170 [virtual] [size=8]
	Region 3: I/O ports at 0374 [virtual]
	Region 4: I/O ports at ffa0 [virtual] [size=16]
	Kernel driver in use: ata_piix
	Kernel modules: pata_acpi

00:1f.2 IDE interface [0101]: Intel Corporation NM10/ICH7 Family SATA Controller [IDE mode] [8086:27c0] (rev 01) (prog-if 8f [PCI native mode controller, supports both channels switched to ISA compatibility mode, supports bus mastering])
	Subsystem: ASUSTeK Computer Inc. P5B-MX/WiFi-AP, P5KPL-VM Motherboard [1043:8179]
	Control: I/O+ Mem- BusMaster+ SpecCycle- MemWINV- VGASnoop- ParErr- Stepping- SERR- FastB2B- DisINTx-
	Status: Cap+ 66MHz+ UDF- FastB2B+ ParErr- DEVSEL=medium >TAbort- <TAbort- <MAbort- >SERR- <PERR- INTx-
	Latency: 0
	Interrupt: pin B routed to IRQ 19
	Region 0: I/O ports at c400 [size=8]
	Region 1: I/O ports at c080 [size=4]
	Region 2: I/O ports at c000 [size=8]
	Region 3: I/O ports at bc00 [size=4]
	Region 4: I/O ports at b880 [size=16]
	Capabilities: [70] Power Management version 2
		Flags: PMEClk- DSI- D1- D2- AuxCurrent=0mA PME(D0-,D1-,D2-,D3hot+,D3cold-)
		Status: D0 NoSoftRst- PME-Enable- DSel=0 DScale=0 PME-
	Kernel driver in use: ata_piix
	Kernel modules: pata_acpi

00:1f.3 SMBus [0c05]: Intel Corporation NM10/ICH7 Family SMBus Controller [8086:27da] (rev 01)
	Subsystem: ASUSTeK Computer Inc. P5B-MX/WiFi-AP, P5KPL-VM Motherboard [1043:8179]
	Control: I/O+ Mem- BusMaster- SpecCycle- MemWINV- VGASnoop- ParErr- Stepping- SERR- FastB2B- DisINTx-
	Status: Cap- 66MHz- UDF- FastB2B+ ParErr- DEVSEL=medium >TAbort- <TAbort- <MAbort- >SERR- <PERR- INTx-
	Interrupt: pin B routed to IRQ 19
	Region 4: I/O ports at 0400 [size=32]
	Kernel driver in use: i801_smbus
	Kernel modules: i2c_i801

01:00.0 VGA compatible controller [0300]: Advanced Micro Devices, Inc. [AMD/ATI] Pitcairn PRO [Radeon HD 7850 / R7 265 / R9 270 1024SP] [1002:6819] (prog-if 00 [VGA controller])
	Subsystem: PC Partner Limited / Sapphire Technology Radeon HD 7850 2GB GDDR5 DVI-I/DVI-D/HDMI/DP [174b:e221]
	Control: I/O+ Mem+ BusMaster+ SpecCycle- MemWINV- VGASnoop- ParErr- Stepping- SERR- FastB2B- DisINTx+
	Status: Cap+ 66MHz- UDF- FastB2B- ParErr- DEVSEL=fast >TAbort- <TAbort- <MAbort- >SERR- <PERR- INTx-
	Latency: 0, Cache Line Size: 32 bytes
	Interrupt: pin A routed to IRQ 24
	Region 0: Memory at e0000000 (64-bit, prefetchable) [size=256M]
	Region 2: Memory at fea80000 (64-bit, non-prefetchable) [size=256K]
	Region 4: I/O ports at d000 [size=256]
	Expansion ROM at 000c0000 [disabled] [size=128K]
	Capabilities: [48] Vendor Specific Information: Len=08 <?>
	Capabilities: [50] Power Management version 3
		Flags: PMEClk- DSI- D1+ D2+ AuxCurrent=0mA PME(D0-,D1+,D2+,D3hot+,D3cold-)
		Status: D0 NoSoftRst- PME-Enable- DSel=0 DScale=0 PME-
	Capabilities: [58] Express (v2) Legacy Endpoint, MSI 00
		DevCap:	MaxPayload 256 bytes, PhantFunc 0, Latency L0s <4us, L1 unlimited
			ExtTag+ AttnBtn- AttnInd- PwrInd- RBE+ FLReset-
		DevCtl:	CorrErr- NonFatalErr- FatalErr- UnsupReq-
			RlxdOrd+ ExtTag+ PhantFunc- AuxPwr- NoSnoop+
			MaxPayload 128 bytes, MaxReadReq 512 bytes
		DevSta:	CorrErr+ NonFatalErr- FatalErr- UnsupReq+ AuxPwr- TransPend-
		LnkCap:	Port #0, Speed 8GT/s, Width x16, ASPM L0s L1, Exit Latency L0s <64ns, L1 <1us
			ClockPM- Surprise- LLActRep- BwNot- ASPMOptComp+
		LnkCtl:	ASPM Disabled; RCB 64 bytes, Disabled- CommClk+
			ExtSynch- ClockPM- AutWidDis- BWInt- AutBWInt-
		LnkSta:	Speed 2.5GT/s (downgraded), Width x16 (ok)
			TrErr- Train- SlotClk+ DLActive- BWMgmt- ABWMgmt-
		DevCap2: Completion Timeout: Not Supported, TimeoutDis- NROPrPrP- LTR-
			 10BitTagComp- 10BitTagReq- OBFF Not Supported, ExtFmt+ EETLPPrefix+, MaxEETLPPrefixes 1
			 EmergencyPowerReduction Not Supported, EmergencyPowerReductionInit-
			 FRS-
			 AtomicOpsCap: 32bit- 64bit- 128bitCAS-
		DevCtl2: Completion Timeout: 50us to 50ms, TimeoutDis- LTR- OBFF Disabled,
			 AtomicOpsCtl: ReqEn-
		LnkCap2: Supported Link Speeds: 2.5-8GT/s, Crosslink- Retimer- 2Retimers- DRS-
		LnkCtl2: Target Link Speed: 8GT/s, EnterCompliance- SpeedDis-
			 Transmit Margin: Normal Operating Range, EnterModifiedCompliance- ComplianceSOS-
			 Compliance De-emphasis: -6dB
		LnkSta2: Current De-emphasis Level: -3.5dB, EqualizationComplete- EqualizationPhase1-
			 EqualizationPhase2- EqualizationPhase3- LinkEqualizationRequest-
			 Retimer- 2Retimers- CrosslinkRes: unsupported
	Capabilities: [a0] MSI: Enable+ Count=1/1 Maskable- 64bit+
		Address: 00000000fee02004  Data: 0025
	Capabilities: [100 v1] Vendor Specific Information: ID=0001 Rev=1 Len=010 <?>
	Capabilities: [150 v2] Advanced Error Reporting
		UESta:	DLP- SDES- TLP- FCP- CmpltTO- CmpltAbrt- UnxCmplt- RxOF- MalfTLP- ECRC- UnsupReq- ACSViol-
		UEMsk:	DLP- SDES- TLP- FCP- CmpltTO- CmpltAbrt- UnxCmplt- RxOF- MalfTLP- ECRC- UnsupReq- ACSViol-
		UESvrt:	DLP+ SDES+ TLP- FCP+ CmpltTO- CmpltAbrt- UnxCmplt- RxOF+ MalfTLP+ ECRC- UnsupReq- ACSViol-
		CESta:	RxErr- BadTLP- BadDLLP- Rollover- Timeout- AdvNonFatalErr+
		CEMsk:	RxErr- BadTLP- BadDLLP- Rollover- Timeout- AdvNonFatalErr+
		AERCap:	First Error Pointer: 00, ECRCGenCap+ ECRCGenEn- ECRCChkCap+ ECRCChkEn-
			MultHdrRecCap- MultHdrRecEn- TLPPfxPres- HdrLogCap-
		HeaderLog: 00000000 00000000 00000000 00000000
	Capabilities: [270 v1] Secondary PCI Express
		LnkCtl3: LnkEquIntrruptEn- PerformEqu-
		LaneErrStat: 0
	Capabilities: [2b0 v1] Address Translation Service (ATS)
		ATSCap:	Invalidate Queue Depth: 00
		ATSCtl:	Enable-, Smallest Translation Unit: 00
	Capabilities: [2c0 v1] Page Request Interface (PRI)
		PRICtl: Enable- Reset-
		PRISta: RF- UPRGI- Stopped+
		Page Request Capacity: 00000020, Page Request Allocation: 00000000
	Capabilities: [2d0 v1] Process Address Space ID (PASID)
		PASIDCap: Exec+ Priv+, Max PASID Width: 10
		PASIDCtl: Enable- Exec- Priv-
	Kernel driver in use: radeon
	Kernel modules: radeon, amdgpu

01:00.1 Audio device [0403]: Advanced Micro Devices, Inc. [AMD/ATI] Oland/Hainan/Cape Verde/Pitcairn HDMI Audio [Radeon HD 7000 Series] [1002:aab0]
	Subsystem: PC Partner Limited / Sapphire Technology Oland/Hainan/Cape Verde/Pitcairn HDMI Audio [Radeon HD 7000 Series] [174b:aab0]
	Control: I/O+ Mem+ BusMaster+ SpecCycle- MemWINV- VGASnoop- ParErr- Stepping- SERR- FastB2B- DisINTx+
	Status: Cap+ 66MHz- UDF- FastB2B- ParErr- DEVSEL=fast >TAbort- <TAbort- <MAbort- >SERR- <PERR- INTx-
	Latency: 0, Cache Line Size: 32 bytes
	Interrupt: pin B routed to IRQ 26
	Region 0: Memory at feafc000 (64-bit, non-prefetchable) [size=16K]
	Capabilities: [48] Vendor Specific Information: Len=08 <?>
	Capabilities: [50] Power Management version 3
		Flags: PMEClk- DSI- D1+ D2+ AuxCurrent=0mA PME(D0-,D1-,D2-,D3hot-,D3cold-)
		Status: D0 NoSoftRst- PME-Enable- DSel=0 DScale=0 PME-
	Capabilities: [58] Express (v2) Legacy Endpoint, MSI 00
		DevCap:	MaxPayload 256 bytes, PhantFunc 0, Latency L0s <4us, L1 unlimited
			ExtTag+ AttnBtn- AttnInd- PwrInd- RBE+ FLReset-
		DevCtl:	CorrErr- NonFatalErr- FatalErr- UnsupReq-
			RlxdOrd+ ExtTag+ PhantFunc- AuxPwr- NoSnoop+
			MaxPayload 128 bytes, MaxReadReq 512 bytes
		DevSta:	CorrErr+ NonFatalErr- FatalErr- UnsupReq+ AuxPwr- TransPend-
		LnkCap:	Port #0, Speed 8GT/s, Width x16, ASPM L0s L1, Exit Latency L0s <64ns, L1 <1us
			ClockPM- Surprise- LLActRep- BwNot- ASPMOptComp+
		LnkCtl:	ASPM Disabled; RCB 64 bytes, Disabled- CommClk+
			ExtSynch- ClockPM- AutWidDis- BWInt- AutBWInt-
		LnkSta:	Speed 2.5GT/s (downgraded), Width x16 (ok)
			TrErr- Train- SlotClk+ DLActive- BWMgmt- ABWMgmt-
		DevCap2: Completion Timeout: Not Supported, TimeoutDis- NROPrPrP- LTR-
			 10BitTagComp- 10BitTagReq- OBFF Not Supported, ExtFmt+ EETLPPrefix+, MaxEETLPPrefixes 1
			 EmergencyPowerReduction Not Supported, EmergencyPowerReductionInit-
			 FRS-
			 AtomicOpsCap: 32bit- 64bit- 128bitCAS-
		DevCtl2: Completion Timeout: 50us to 50ms, TimeoutDis- LTR- OBFF Disabled,
			 AtomicOpsCtl: ReqEn-
		LnkSta2: Current De-emphasis Level: -3.5dB, EqualizationComplete- EqualizationPhase1-
			 EqualizationPhase2- EqualizationPhase3- LinkEqualizationRequest-
			 Retimer- 2Retimers- CrosslinkRes: unsupported
	Capabilities: [a0] MSI: Enable+ Count=1/1 Maskable- 64bit+
		Address: 00000000fee08004  Data: 0024
	Capabilities: [100 v1] Vendor Specific Information: ID=0001 Rev=1 Len=010 <?>
	Capabilities: [150 v2] Advanced Error Reporting
		UESta:	DLP- SDES- TLP- FCP- CmpltTO- CmpltAbrt- UnxCmplt- RxOF- MalfTLP- ECRC- UnsupReq- ACSViol-
		UEMsk:	DLP- SDES- TLP- FCP- CmpltTO- CmpltAbrt- UnxCmplt- RxOF- MalfTLP- ECRC- UnsupReq- ACSViol-
		UESvrt:	DLP+ SDES+ TLP- FCP+ CmpltTO- CmpltAbrt- UnxCmplt- RxOF+ MalfTLP+ ECRC- UnsupReq- ACSViol-
		CESta:	RxErr- BadTLP- BadDLLP- Rollover- Timeout- AdvNonFatalErr+
		CEMsk:	RxErr- BadTLP- BadDLLP- Rollover- Timeout- AdvNonFatalErr+
		AERCap:	First Error Pointer: 00, ECRCGenCap+ ECRCGenEn- ECRCChkCap+ ECRCChkEn-
			MultHdrRecCap- MultHdrRecEn- TLPPfxPres- HdrLogCap-
		HeaderLog: 00000000 00000000 00000000 00000000
	Kernel driver in use: snd_hda_intel
	Kernel modules: snd_hda_intel

02:00.0 Ethernet controller [0200]: Qualcomm Atheros AR8121/AR8113/AR8114 Gigabit or Fast Ethernet [1969:1026] (rev b0)
	Subsystem: ASUSTeK Computer Inc. P5KPL-CM Motherboard [1043:8304]
	Control: I/O+ Mem+ BusMaster+ SpecCycle- MemWINV- VGASnoop- ParErr- Stepping- SERR- FastB2B- DisINTx-
	Status: Cap+ 66MHz- UDF- FastB2B- ParErr- DEVSEL=fast >TAbort- <TAbort- <MAbort- >SERR- <PERR- INTx-
	Latency: 0, Cache Line Size: 32 bytes
	Interrupt: pin A routed to IRQ 17
	Region 0: Memory at febc0000 (64-bit, non-prefetchable) [size=256K]
	Region 2: I/O ports at ec00 [size=128]
	Capabilities: [40] Power Management version 2
		Flags: PMEClk- DSI- D1- D2- AuxCurrent=0mA PME(D0-,D1-,D2-,D3hot+,D3cold+)
		Status: D0 NoSoftRst- PME-Enable- DSel=0 DScale=0 PME-
	Capabilities: [48] MSI: Enable- Count=1/1 Maskable- 64bit+
		Address: 0000000000000000  Data: 0000
	Capabilities: [58] Express (v1) Endpoint, MSI 00
		DevCap:	MaxPayload 4096 bytes, PhantFunc 0, Latency L0s <4us, L1 unlimited
			ExtTag- AttnBtn+ AttnInd+ PwrInd+ RBE- FLReset- SlotPowerLimit 0.000W
		DevCtl:	CorrErr- NonFatalErr- FatalErr- UnsupReq-
			RlxdOrd- ExtTag- PhantFunc- AuxPwr- NoSnoop-
			MaxPayload 128 bytes, MaxReadReq 512 bytes
		DevSta:	CorrErr- NonFatalErr+ FatalErr- UnsupReq+ AuxPwr+ TransPend-
		LnkCap:	Port #0, Speed 2.5GT/s, Width x1, ASPM L0s, Exit Latency L0s unlimited
			ClockPM- Surprise- LLActRep- BwNot- ASPMOptComp-
		LnkCtl:	ASPM Disabled; RCB 64 bytes, Disabled- CommClk+
			ExtSynch- ClockPM- AutWidDis- BWInt- AutBWInt-
		LnkSta:	Speed 2.5GT/s (ok), Width x1 (ok)
			TrErr- Train- SlotClk+ DLActive- BWMgmt- ABWMgmt-
	Capabilities: [100 v1] Advanced Error Reporting
		UESta:	DLP- SDES- TLP- FCP- CmpltTO- CmpltAbrt- UnxCmplt- RxOF- MalfTLP- ECRC- UnsupReq+ ACSViol-
		UEMsk:	DLP- SDES- TLP- FCP- CmpltTO- CmpltAbrt- UnxCmplt- RxOF- MalfTLP- ECRC- UnsupReq- ACSViol-
		UESvrt:	DLP+ SDES- TLP- FCP+ CmpltTO- CmpltAbrt- UnxCmplt- RxOF+ MalfTLP+ ECRC- UnsupReq- ACSViol-
		CESta:	RxErr- BadTLP- BadDLLP- Rollover- Timeout- AdvNonFatalErr-
		CEMsk:	RxErr- BadTLP- BadDLLP- Rollover- Timeout- AdvNonFatalErr-
		AERCap:	First Error Pointer: 14, ECRCGenCap+ ECRCGenEn- ECRCChkCap+ ECRCChkEn-
			MultHdrRecCap- MultHdrRecEn- TLPPfxPres- HdrLogCap-
		HeaderLog: 00000001 00001303 febbc000 00000000
	Capabilities: [180 v1] Device Serial Number ...
	Kernel driver in use: ATL1E
	Kernel modules: atl1e

