00:00.0 Host bridge [0600]: Intel Corporation Device [8086:4c53] (rev 01)
	DeviceName: Onboard - Other
	Subsystem: ASUSTeK Computer Inc. Device [1043:8694]
	Control: I/O- Mem+ BusMaster+ SpecCycle- MemWINV- VGASnoop- ParErr- Stepping- SERR- FastB2B- DisINTx-
	Status: Cap+ 66MHz- UDF- FastB2B+ ParErr- DEVSEL=fast >TAbort- <TAbort- <MAbort- >SERR- <PERR- INTx-
	Latency: 0
	Expansion ROM at <ignored>
	Kernel driver in use: icl_uncore

00:01.0 PCI bridge [0604]: Intel Corporation Device [8086:4c01] (rev 01) (prog-if 00 [Normal decode])
	Subsystem: ASUSTeK Computer Inc. Device [1043:8694]
	Control: I/O+ Mem+ BusMaster+ SpecCycle- MemWINV- VGASnoop- ParErr- Stepping- SERR- FastB2B- DisINTx+
	Status: Cap+ 66MHz- UDF- FastB2B- ParErr- DEVSEL=fast >TAbort- <TAbort- <MAbort- >SERR- <PERR- INTx-
	Latency: 0, Cache Line Size: 64 bytes
	Interrupt: pin A routed to IRQ 121
	Bus: primary=00, secondary=01, subordinate=01, sec-latency=0
	I/O behind bridge: 3000-3fff [size=4K] [16-bit]
	Memory behind bridge: a0000000-a10fffff [size=17M] [32-bit]
	Prefetchable memory behind bridge: 4000000000-40120fffff [size=289M] [32-bit]
	Secondary status: 66MHz- FastB2B- ParErr- DEVSEL=fast >TAbort- <TAbort- <MAbort+ <SERR- <PERR-
	BridgeCtl: Parity- SERR+ NoISA- VGA- VGA16+ MAbort- >Reset- FastB2B-
		PriDiscTmr- SecDiscTmr- DiscTmrStat- DiscTmrSERREn-
	Capabilities: [40] Express (v2) Root Port (Slot+), MSI 00
		DevCap:	MaxPayload 256 bytes, PhantFunc 0
			ExtTag- RBE+
		DevCtl:	CorrErr+ NonFatalErr+ FatalErr+ UnsupReq+
			RlxdOrd- ExtTag- PhantFunc- AuxPwr- NoSnoop-
			MaxPayload 128 bytes, MaxReadReq 128 bytes
		DevSta:	CorrErr- NonFatalErr- FatalErr- UnsupReq- AuxPwr+ TransPend-
		LnkCap:	Port #2, Speed 16GT/s, Width x16, ASPM not supported
			ClockPM- Surprise- LLActRep+ BwNot+ ASPMOptComp+
		LnkCtl:	ASPM Disabled; RCB 64 bytes, Disabled- CommClk+
			ExtSynch- ClockPM- AutWidDis- BWInt- AutBWInt-
		LnkSta:	Speed 8GT/s, Width x16
			TrErr- Train- SlotClk+ DLActive+ BWMgmt+ ABWMgmt+
		SltCap:	AttnBtn- PwrCtrl- MRL- AttnInd- PwrInd- HotPlug- Surprise-
			Slot #1, PowerLimit 75W; Interlock- NoCompl+
		SltCtl:	Enable: AttnBtn- PwrFlt- MRL- PresDet- CmdCplt- HPIrq- LinkChg-
			Control: AttnInd Unknown, PwrInd Unknown, Power- Interlock-
		SltSta:	Status: AttnBtn- PowerFlt- MRL- CmdCplt- PresDet+ Interlock-
			Changed: MRL- PresDet- LinkState-
		RootCap: CRSVisible-
		RootCtl: ErrCorrectable- ErrNon-Fatal- ErrFatal- PMEIntEna+ CRSVisible-
		RootSta: PME ReqID 0000, PMEStatus- PMEPending-
		DevCap2: Completion Timeout: Range ABC, TimeoutDis+ NROPrPrP- LTR+
			 10BitTagComp- 10BitTagReq- OBFF Via WAKE#, ExtFmt- EETLPPrefix-
			 EmergencyPowerReduction Not Supported, EmergencyPowerReductionInit-
			 FRS- LN System CLS Not Supported, TPHComp- ExtTPHComp- ARIFwd+
			 AtomicOpsCap: Routing- 32bit- 64bit- 128bitCAS-
		DevCtl2: Completion Timeout: 50us to 50ms, TimeoutDis- LTR+ 10BitTagReq- OBFF Disabled, ARIFwd-
			 AtomicOpsCtl: ReqEn+ EgressBlck+
		LnkCap2: Supported Link Speeds: 2.5-16GT/s, Crosslink- Retimer+ 2Retimers+ DRS-
		LnkCtl2: Target Link Speed: 8GT/s, EnterCompliance- SpeedDis-
			 Transmit Margin: Normal Operating Range, EnterModifiedCompliance- ComplianceSOS-
			 Compliance Preset/De-emphasis: -6dB de-emphasis, 0dB preshoot
		LnkSta2: Current De-emphasis Level: -6dB, EqualizationComplete+ EqualizationPhase1+
			 EqualizationPhase2+ EqualizationPhase3+ LinkEqualizationRequest-
			 Retimer- 2Retimers- CrosslinkRes: unsupported
	Capabilities: [80] MSI: Enable+ Count=1/1 Maskable- 64bit-
		Address: fee00218  Data: 0000
	Capabilities: [90] Subsystem: ASUSTeK Computer Inc. Device [1043:8694]
	Capabilities: [a0] Power Management version 3
		Flags: PMEClk- DSI- D1- D2- AuxCurrent=0mA PME(D0+,D1-,D2-,D3hot+,D3cold+)
		Status: D0 NoSoftRst- PME-Enable- DSel=0 DScale=0 PME-
	Capabilities: [100 v1] Advanced Error Reporting
		UESta:	DLP- SDES- TLP- FCP- CmpltTO- CmpltAbrt- UnxCmplt- RxOF- MalfTLP- ECRC- UnsupReq- ACSViol-
		UEMsk:	DLP- SDES- TLP- FCP- CmpltTO- CmpltAbrt- UnxCmplt+ RxOF- MalfTLP- ECRC- UnsupReq- ACSViol-
		UESvrt:	DLP+ SDES- TLP- FCP- CmpltTO- CmpltAbrt- UnxCmplt- RxOF+ MalfTLP+ ECRC- UnsupReq- ACSViol-
		CESta:	RxErr- BadTLP- BadDLLP- Rollover- Timeout- AdvNonFatalErr-
		CEMsk:	RxErr- BadTLP- BadDLLP- Rollover- Timeout- AdvNonFatalErr+
		AERCap:	First Error Pointer: 00, ECRCGenCap- ECRCGenEn- ECRCChkCap- ECRCChkEn-
			MultHdrRecCap- MultHdrRecEn- TLPPfxPres- HdrLogCap-
		HeaderLog: 00000000 00000000 00000000 00000000
		RootCmd: CERptEn+ NFERptEn+ FERptEn+
		RootSta: CERcvd- MultCERcvd- UERcvd- MultUERcvd-
			 FirstFatal- NonFatalMsg- FatalMsg- IntMsg 0
		ErrorSrc: ERR_COR: 0000 ERR_FATAL/NONFATAL: 0000
	Capabilities: [220 v1] Access Control Services
		ACSCap:	SrcValid+ TransBlk+ ReqRedir+ CmpltRedir+ UpstreamFwd+ EgressCtrl- DirectTrans-
		ACSCtl:	SrcValid- TransBlk- ReqRedir- CmpltRedir- UpstreamFwd- EgressCtrl- DirectTrans-
	Capabilities: [150 v1] Precision Time Measurement
		PTMCap: Requester:- Responder:+ Root:+
		PTMClockGranularity: 4ns
		PTMControl: Enabled:+ RootSelected:+
		PTMEffectiveGranularity: Unknown
	Capabilities: [280 v1] Virtual Channel
		Caps:	LPEVC=0 RefClk=100ns PATEntryBits=1
		Arb:	Fixed- WRR32- WRR64- WRR128-
		Ctrl:	ArbSelect=Fixed
		Status:	InProgress-
		VC0:	Caps:	PATOffset=00 MaxTimeSlots=1 RejSnoopTrans-
			Arb:	Fixed- WRR32- WRR64- WRR128- TWRR128- WRR256-
			Ctrl:	Enable+ ID=0 ArbSelect=Fixed TC/VC=ff
			Status:	NegoPending- InProgress-
	Capabilities: [a00 v1] Downstream Port Containment
		DpcCap:	INT Msg #0, RPExt+ PoisonedTLP+ SwTrigger+ RP PIO Log 4, DL_ActiveErr+
		DpcCtl:	Trigger:1 Cmpl- INT+ ErrCor- PoisonedTLP- SwTrigger- DL_ActiveErr-
		DpcSta:	Trigger- Reason:00 INT- RPBusy- TriggerExt:00 RP PIO ErrPtr:1f
		Source:	0000
	Capabilities: [a30 v1] Secondary PCI Express
		LnkCtl3: LnkEquIntrruptEn- PerformEqu-
		LaneErrStat: 0
	Capabilities: [a90 v1] Data Link Feature <?>
	Capabilities: [a9c v1] Physical Layer 16.0 GT/s <?>
	Capabilities: [edc v1] Lane Margining at the Receiver <?>
	Kernel driver in use: pcieport

00:06.0 PCI bridge [0604]: Intel Corporation Device [8086:4c09] (rev 01) (prog-if 00 [Normal decode])
	Subsystem: ASUSTeK Computer Inc. Device [1043:8694]
	Control: I/O+ Mem+ BusMaster+ SpecCycle- MemWINV- VGASnoop- ParErr- Stepping- SERR- FastB2B- DisINTx+
	Status: Cap+ 66MHz- UDF- FastB2B- ParErr- DEVSEL=fast >TAbort- <TAbort- <MAbort- >SERR- <PERR- INTx-
	Latency: 0, Cache Line Size: 64 bytes
	Interrupt: pin D routed to IRQ 122
	Bus: primary=00, secondary=02, subordinate=02, sec-latency=0
	I/O behind bridge: [disabled] [16-bit]
	Memory behind bridge: a1900000-a19fffff [size=1M] [32-bit]
	Prefetchable memory behind bridge: [disabled] [64-bit]
	Secondary status: 66MHz- FastB2B- ParErr- DEVSEL=fast >TAbort- <TAbort- <MAbort- <SERR- <PERR-
	BridgeCtl: Parity- SERR+ NoISA- VGA- VGA16+ MAbort- >Reset- FastB2B-
		PriDiscTmr- SecDiscTmr- DiscTmrStat- DiscTmrSERREn-
	Capabilities: [40] Express (v2) Root Port (Slot+), MSI 00
		DevCap:	MaxPayload 256 bytes, PhantFunc 0
			ExtTag- RBE+
		DevCtl:	CorrErr+ NonFatalErr+ FatalErr+ UnsupReq+
			RlxdOrd- ExtTag- PhantFunc- AuxPwr- NoSnoop-
			MaxPayload 256 bytes, MaxReadReq 128 bytes
		DevSta:	CorrErr- NonFatalErr- FatalErr- UnsupReq- AuxPwr+ TransPend-
		LnkCap:	Port #5, Speed 16GT/s, Width x4, ASPM not supported
			ClockPM- Surprise- LLActRep+ BwNot+ ASPMOptComp+
		LnkCtl:	ASPM Disabled; RCB 64 bytes, Disabled- CommClk+
			ExtSynch- ClockPM- AutWidDis- BWInt- AutBWInt-
		LnkSta:	Speed 8GT/s, Width x4
			TrErr- Train- SlotClk+ DLActive+ BWMgmt+ ABWMgmt-
		SltCap:	AttnBtn- PwrCtrl- MRL- AttnInd- PwrInd- HotPlug- Surprise-
			Slot #0, PowerLimit 75W; Interlock- NoCompl+
		SltCtl:	Enable: AttnBtn- PwrFlt- MRL- PresDet- CmdCplt- HPIrq- LinkChg-
			Control: AttnInd Unknown, PwrInd Unknown, Power- Interlock-
		SltSta:	Status: AttnBtn- PowerFlt- MRL- CmdCplt- PresDet+ Interlock-
			Changed: MRL- PresDet- LinkState-
		RootCap: CRSVisible-
		RootCtl: ErrCorrectable- ErrNon-Fatal- ErrFatal- PMEIntEna+ CRSVisible-
		RootSta: PME ReqID 0000, PMEStatus- PMEPending-
		DevCap2: Completion Timeout: Range ABC, TimeoutDis+ NROPrPrP- LTR+
			 10BitTagComp- 10BitTagReq- OBFF Via WAKE#, ExtFmt- EETLPPrefix-
			 EmergencyPowerReduction Not Supported, EmergencyPowerReductionInit-
			 FRS- LN System CLS Not Supported, TPHComp- ExtTPHComp- ARIFwd+
			 AtomicOpsCap: Routing- 32bit- 64bit- 128bitCAS-
		DevCtl2: Completion Timeout: 50us to 50ms, TimeoutDis- LTR+ 10BitTagReq- OBFF Disabled, ARIFwd-
			 AtomicOpsCtl: ReqEn+ EgressBlck+
		LnkCap2: Supported Link Speeds: 2.5-16GT/s, Crosslink- Retimer+ 2Retimers+ DRS-
		LnkCtl2: Target Link Speed: 8GT/s, EnterCompliance- SpeedDis-
			 Transmit Margin: Normal Operating Range, EnterModifiedCompliance- ComplianceSOS-
			 Compliance Preset/De-emphasis: -6dB de-emphasis, 0dB preshoot
		LnkSta2: Current De-emphasis Level: -3.5dB, EqualizationComplete+ EqualizationPhase1+
			 EqualizationPhase2+ EqualizationPhase3+ LinkEqualizationRequest-
			 Retimer- 2Retimers- CrosslinkRes: unsupported
	Capabilities: [80] MSI: Enable+ Count=1/1 Maskable- 64bit-
		Address: fee00258  Data: 0000
	Capabilities: [90] Subsystem: ASUSTeK Computer Inc. Device [1043:8694]
	Capabilities: [a0] Power Management version 3
		Flags: PMEClk- DSI- D1- D2- AuxCurrent=0mA PME(D0+,D1-,D2-,D3hot+,D3cold+)
		Status: D0 NoSoftRst- PME-Enable- DSel=0 DScale=0 PME-
	Capabilities: [100 v1] Advanced Error Reporting
		UESta:	DLP- SDES- TLP- FCP- CmpltTO- CmpltAbrt- UnxCmplt- RxOF- MalfTLP- ECRC- UnsupReq- ACSViol-
		UEMsk:	DLP- SDES- TLP- FCP- CmpltTO- CmpltAbrt- UnxCmplt+ RxOF- MalfTLP- ECRC- UnsupReq- ACSViol-
		UESvrt:	DLP+ SDES- TLP- FCP- CmpltTO- CmpltAbrt- UnxCmplt- RxOF+ MalfTLP+ ECRC- UnsupReq- ACSViol-
		CESta:	RxErr- BadTLP- BadDLLP- Rollover- Timeout- AdvNonFatalErr-
		CEMsk:	RxErr- BadTLP- BadDLLP- Rollover- Timeout- AdvNonFatalErr+
		AERCap:	First Error Pointer: 00, ECRCGenCap- ECRCGenEn- ECRCChkCap- ECRCChkEn-
			MultHdrRecCap- MultHdrRecEn- TLPPfxPres- HdrLogCap-
		HeaderLog: 00000000 00000000 00000000 00000000
		RootCmd: CERptEn+ NFERptEn+ FERptEn+
		RootSta: CERcvd- MultCERcvd- UERcvd- MultUERcvd-
			 FirstFatal- NonFatalMsg- FatalMsg- IntMsg 0
		ErrorSrc: ERR_COR: 0000 ERR_FATAL/NONFATAL: 0000
	Capabilities: [220 v1] Access Control Services
		ACSCap:	SrcValid+ TransBlk+ ReqRedir+ CmpltRedir+ UpstreamFwd+ EgressCtrl- DirectTrans-
		ACSCtl:	SrcValid- TransBlk- ReqRedir- CmpltRedir- UpstreamFwd- EgressCtrl- DirectTrans-
	Capabilities: [150 v1] Precision Time Measurement
		PTMCap: Requester:- Responder:+ Root:+
		PTMClockGranularity: 4ns
		PTMControl: Enabled:+ RootSelected:+
		PTMEffectiveGranularity: Unknown
	Capabilities: [280 v1] Virtual Channel
		Caps:	LPEVC=0 RefClk=100ns PATEntryBits=1
		Arb:	Fixed- WRR32- WRR64- WRR128-
		Ctrl:	ArbSelect=Fixed
		Status:	InProgress-
		VC0:	Caps:	PATOffset=00 MaxTimeSlots=1 RejSnoopTrans-
			Arb:	Fixed- WRR32- WRR64- WRR128- TWRR128- WRR256-
			Ctrl:	Enable+ ID=0 ArbSelect=Fixed TC/VC=ff
			Status:	NegoPending- InProgress-
	Capabilities: [a00 v1] Downstream Port Containment
		DpcCap:	INT Msg #0, RPExt+ PoisonedTLP+ SwTrigger+ RP PIO Log 4, DL_ActiveErr+
		DpcCtl:	Trigger:1 Cmpl- INT+ ErrCor- PoisonedTLP- SwTrigger- DL_ActiveErr-
		DpcSta:	Trigger- Reason:00 INT- RPBusy- TriggerExt:00 RP PIO ErrPtr:1f
		Source:	0000
	Capabilities: [a30 v1] Secondary PCI Express
		LnkCtl3: LnkEquIntrruptEn- PerformEqu-
		LaneErrStat: 0
	Capabilities: [a90 v1] Data Link Feature <?>
	Capabilities: [a9c v1] Physical Layer 16.0 GT/s <?>
	Capabilities: [edc v1] Lane Margining at the Receiver <?>
	Kernel driver in use: pcieport

00:14.0 USB controller [0c03]: Intel Corporation Tiger Lake-H USB 3.2 Gen 2x1 xHCI Host Controller [8086:43ed] (rev 11) (prog-if 30 [XHCI])
	DeviceName: Onboard - Other
	Subsystem: ASUSTeK Computer Inc. Device [1043:8694]
	Control: I/O- Mem+ BusMaster+ SpecCycle- MemWINV- VGASnoop- ParErr- Stepping- SERR- FastB2B- DisINTx+
	Status: Cap+ 66MHz- UDF- FastB2B+ ParErr- DEVSEL=medium >TAbort- <TAbort- <MAbort- >SERR- <PERR- INTx-
	Latency: 0
	Interrupt: pin A routed to IRQ 131
	Region 0: Memory at 4012200000 (64-bit, non-prefetchable) [size=64K]
	Capabilities: [70] Power Management version 2
		Flags: PMEClk- DSI- D1- D2- AuxCurrent=375mA PME(D0-,D1-,D2-,D3hot+,D3cold+)
		Status: D0 NoSoftRst+ PME-Enable- DSel=0 DScale=0 PME-
	Capabilities: [80] MSI: Enable+ Count=1/8 Maskable- 64bit+
		Address: 00000000fee00398  Data: 0000
	Capabilities: [90] Vendor Specific Information: Len=14 <?>
	Capabilities: [b0] Vendor Specific Information: Len=00 <?>
	Kernel driver in use: xhci_hcd

00:14.2 RAM memory [0500]: Intel Corporation Tiger Lake-H Shared SRAM [8086:43ef] (rev 11)
	DeviceName: Onboard - Other
	Subsystem: ASUSTeK Computer Inc. Device [1043:8694]
	Control: I/O- Mem- BusMaster- SpecCycle- MemWINV- VGASnoop- ParErr- Stepping- SERR- FastB2B- DisINTx-
	Status: Cap+ 66MHz- UDF- FastB2B- ParErr- DEVSEL=fast >TAbort- <TAbort- <MAbort- >SERR- <PERR- INTx-
	Region 0: Memory at 4012214000 (64-bit, non-prefetchable) [disabled] [size=16K]
	Region 2: Memory at 401221c000 (64-bit, non-prefetchable) [disabled] [size=4K]
	Capabilities: [80] Power Management version 3
		Flags: PMEClk- DSI- D1- D2- AuxCurrent=0mA PME(D0-,D1-,D2-,D3hot-,D3cold-)
		Status: D0 NoSoftRst+ PME-Enable- DSel=0 DScale=0 PME-

00:15.0 Serial bus controller [0c80]: Intel Corporation Tiger Lake-H Serial IO I2C Controller #0 [8086:43e8] (rev 11)
	DeviceName: Onboard - Other
	Subsystem: ASUSTeK Computer Inc. Device [1043:8694]
	Control: I/O- Mem+ BusMaster+ SpecCycle- MemWINV- VGASnoop- ParErr- Stepping- SERR- FastB2B- DisINTx-
	Status: Cap+ 66MHz- UDF- FastB2B- ParErr- DEVSEL=fast >TAbort- <TAbort- <MAbort- >SERR- <PERR- INTx-
	Latency: 0, Cache Line Size: 64 bytes
	Interrupt: pin A routed to IRQ 27
	Region 0: Memory at 401221a000 (64-bit, non-prefetchable) [size=4K]
	Capabilities: [80] Power Management version 3
		Flags: PMEClk- DSI- D1- D2- AuxCurrent=0mA PME(D0-,D1-,D2-,D3hot-,D3cold-)
		Status: D3 NoSoftRst+ PME-Enable- DSel=0 DScale=0 PME-
	Capabilities: [90] Vendor Specific Information: Len=14 <?>
	Kernel driver in use: intel-lpss

00:15.1 Serial bus controller [0c80]: Intel Corporation Tiger Lake-H Serial IO I2C Controller #1 [8086:43e9] (rev 11)
	DeviceName: Onboard - Other
	Subsystem: ASUSTeK Computer Inc. Device [1043:8694]
	Control: I/O- Mem+ BusMaster+ SpecCycle- MemWINV- VGASnoop- ParErr- Stepping- SERR- FastB2B- DisINTx-
	Status: Cap+ 66MHz- UDF- FastB2B- ParErr- DEVSEL=fast >TAbort- <TAbort- <MAbort- >SERR- <PERR- INTx-
	Latency: 0, Cache Line Size: 64 bytes
	Interrupt: pin B routed to IRQ 40
	Region 0: Memory at 401221b000 (64-bit, non-prefetchable) [size=4K]
	Capabilities: [80] Power Management version 3
		Flags: PMEClk- DSI- D1- D2- AuxCurrent=0mA PME(D0-,D1-,D2-,D3hot-,D3cold-)
		Status: D3 NoSoftRst+ PME-Enable- DSel=0 DScale=0 PME-
	Capabilities: [90] Vendor Specific Information: Len=14 <?>
	Kernel driver in use: intel-lpss

00:16.0 Communication controller [0780]: Intel Corporation Tiger Lake-H Management Engine Interface [8086:43e0] (rev 11)
	DeviceName: Onboard - Other
	Subsystem: ASUSTeK Computer Inc. Device [1043:8694]
	Control: I/O- Mem+ BusMaster+ SpecCycle- MemWINV- VGASnoop- ParErr- Stepping- SERR- FastB2B- DisINTx+
	Status: Cap+ 66MHz- UDF- FastB2B- ParErr- DEVSEL=fast >TAbort- <TAbort- <MAbort- >SERR- <PERR- INTx-
	Latency: 0
	Interrupt: pin A routed to IRQ 174
	Region 0: Memory at 4012219000 (64-bit, non-prefetchable) [size=4K]
	Capabilities: [50] Power Management version 3
		Flags: PMEClk- DSI- D1- D2- AuxCurrent=0mA PME(D0-,D1-,D2-,D3hot+,D3cold-)
		Status: D0 NoSoftRst+ PME-Enable- DSel=0 DScale=0 PME-
	Capabilities: [8c] MSI: Enable+ Count=1/1 Maskable- 64bit+
		Address: 00000000fee00918  Data: 0000
	Capabilities: [a4] Vendor Specific Information: Len=14 <?>
	Kernel driver in use: mei_me

00:17.0 SATA controller [0106]: Intel Corporation Device [8086:43d2] (rev 11) (prog-if 01 [AHCI 1.0])
	DeviceName: Onboard - SATA
	Subsystem: ASUSTeK Computer Inc. Device [1043:8694]
	Control: I/O+ Mem+ BusMaster+ SpecCycle- MemWINV- VGASnoop- ParErr- Stepping- SERR- FastB2B- DisINTx+
	Status: Cap+ 66MHz+ UDF- FastB2B+ ParErr- DEVSEL=medium >TAbort- <TAbort- <MAbort- >SERR- <PERR- INTx-
	Latency: 0
	Interrupt: pin A routed to IRQ 129
	Region 0: Memory at a1a00000 (32-bit, non-prefetchable) [size=8K]
	Region 1: Memory at a1a03000 (32-bit, non-prefetchable) [size=256]
	Region 2: I/O ports at 4050 [size=8]
	Region 3: I/O ports at 4040 [size=4]
	Region 4: I/O ports at 4020 [size=32]
	Region 5: Memory at a1a02000 (32-bit, non-prefetchable) [size=2K]
	Capabilities: [80] MSI: Enable+ Count=1/1 Maskable- 64bit-
		Address: fee00358  Data: 0000
	Capabilities: [70] Power Management version 3
		Flags: PMEClk- DSI- D1- D2- AuxCurrent=0mA PME(D0-,D1-,D2-,D3hot+,D3cold-)
		Status: D0 NoSoftRst+ PME-Enable- DSel=0 DScale=0 PME-
	Capabilities: [a8] SATA HBA v1.0 BAR4 Offset=00000004
	Kernel driver in use: ahci

00:1b.0 PCI bridge [0604]: Intel Corporation Device [8086:43c0] (rev 11) (prog-if 00 [Normal decode])
	Subsystem: ASUSTeK Computer Inc. Device [1043:8694]
	Control: I/O+ Mem+ BusMaster+ SpecCycle- MemWINV- VGASnoop- ParErr- Stepping- SERR- FastB2B- DisINTx+
	Status: Cap+ 66MHz- UDF- FastB2B- ParErr- DEVSEL=fast >TAbort- <TAbort- <MAbort- >SERR- <PERR- INTx-
	Latency: 0, Cache Line Size: 64 bytes
	Interrupt: pin ? routed to IRQ 123
	Bus: primary=00, secondary=03, subordinate=03, sec-latency=0
	I/O behind bridge: [disabled] [16-bit]
	Memory behind bridge: [disabled] [32-bit]
	Prefetchable memory behind bridge: [disabled] [64-bit]
	Secondary status: 66MHz- FastB2B- ParErr- DEVSEL=fast >TAbort- <TAbort- <MAbort+ <SERR- <PERR-
	BridgeCtl: Parity- SERR+ NoISA- VGA- VGA16+ MAbort- >Reset- FastB2B-
		PriDiscTmr- SecDiscTmr- DiscTmrStat- DiscTmrSERREn-
	Capabilities: [40] Express (v2) Root Port (Slot-), MSI 00
		DevCap:	MaxPayload 256 bytes, PhantFunc 0
			ExtTag- RBE+
		DevCtl:	CorrErr- NonFatalErr- FatalErr- UnsupReq-
			RlxdOrd- ExtTag- PhantFunc- AuxPwr- NoSnoop-
			MaxPayload 128 bytes, MaxReadReq 128 bytes
		DevSta:	CorrErr- NonFatalErr- FatalErr- UnsupReq- AuxPwr+ TransPend-
		LnkCap:	Port #17, Speed 8GT/s, Width x1, ASPM L0s L1, Exit Latency L0s <1us, L1 <4us
			ClockPM- Surprise- LLActRep+ BwNot+ ASPMOptComp+
		LnkCtl:	ASPM L0s L1 Enabled; RCB 64 bytes, Disabled- CommClk-
			ExtSynch- ClockPM- AutWidDis- BWInt- AutBWInt-
		LnkSta:	Speed 2.5GT/s, Width x0
			TrErr- Train- SlotClk+ DLActive- BWMgmt- ABWMgmt-
		RootCap: CRSVisible-
		RootCtl: ErrCorrectable- ErrNon-Fatal- ErrFatal- PMEIntEna+ CRSVisible-
		RootSta: PME ReqID 0000, PMEStatus- PMEPending-
		DevCap2: Completion Timeout: Range ABC, TimeoutDis+ NROPrPrP- LTR+
			 10BitTagComp- 10BitTagReq- OBFF Via WAKE#, ExtFmt- EETLPPrefix-
			 EmergencyPowerReduction Not Supported, EmergencyPowerReductionInit-
			 FRS- LN System CLS Not Supported, TPHComp- ExtTPHComp- ARIFwd+
			 AtomicOpsCap: Routing- 32bit- 64bit- 128bitCAS-
		DevCtl2: Completion Timeout: 50us to 50ms, TimeoutDis- LTR+ 10BitTagReq- OBFF Disabled, ARIFwd-
			 AtomicOpsCtl: ReqEn- EgressBlck-
		LnkCap2: Supported Link Speeds: 2.5-8GT/s, Crosslink- Retimer- 2Retimers- DRS-
		LnkCtl2: Target Link Speed: 8GT/s, EnterCompliance- SpeedDis-
			 Transmit Margin: Normal Operating Range, EnterModifiedCompliance- ComplianceSOS-
			 Compliance Preset/De-emphasis: -6dB de-emphasis, 0dB preshoot
		LnkSta2: Current De-emphasis Level: -3.5dB, EqualizationComplete- EqualizationPhase1-
			 EqualizationPhase2- EqualizationPhase3- LinkEqualizationRequest-
			 Retimer- 2Retimers- CrosslinkRes: unsupported
	Capabilities: [80] MSI: Enable+ Count=1/1 Maskable- 64bit-
		Address: fee00278  Data: 0000
	Capabilities: [90] Subsystem: ASUSTeK Computer Inc. Device [1043:8694]
	Capabilities: [a0] Power Management version 3
		Flags: PMEClk- DSI- D1- D2- AuxCurrent=0mA PME(D0+,D1-,D2-,D3hot+,D3cold+)
		Status: D3 NoSoftRst+ PME-Enable+ DSel=0 DScale=0 PME-
	Kernel driver in use: pcieport

00:1b.2 PCI bridge [0604]: Intel Corporation Device [8086:43c2] (rev 11) (prog-if 00 [Normal decode])
	Subsystem: ASUSTeK Computer Inc. Device [1043:8694]
	Control: I/O+ Mem+ BusMaster+ SpecCycle- MemWINV- VGASnoop- ParErr- Stepping- SERR- FastB2B- DisINTx+
	Status: Cap+ 66MHz- UDF- FastB2B- ParErr- DEVSEL=fast >TAbort- <TAbort- <MAbort- >SERR- <PERR- INTx-
	Latency: 0, Cache Line Size: 64 bytes
	Interrupt: pin C routed to IRQ 124
	Bus: primary=00, secondary=04, subordinate=04, sec-latency=0
	I/O behind bridge: [disabled] [16-bit]
	Memory behind bridge: a1500000-a16fffff [size=2M] [32-bit]
	Prefetchable memory behind bridge: [disabled] [64-bit]
	Secondary status: 66MHz- FastB2B- ParErr- DEVSEL=fast >TAbort- <TAbort- <MAbort+ <SERR- <PERR-
	BridgeCtl: Parity- SERR+ NoISA- VGA- VGA16+ MAbort- >Reset- FastB2B-
		PriDiscTmr- SecDiscTmr- DiscTmrStat- DiscTmrSERREn-
	Capabilities: [40] Express (v2) Root Port (Slot+), MSI 00
		DevCap:	MaxPayload 256 bytes, PhantFunc 0
			ExtTag- RBE+
		DevCtl:	CorrErr+ NonFatalErr+ FatalErr+ UnsupReq+
			RlxdOrd- ExtTag- PhantFunc- AuxPwr- NoSnoop-
			MaxPayload 256 bytes, MaxReadReq 128 bytes
		DevSta:	CorrErr- NonFatalErr- FatalErr- UnsupReq- AuxPwr+ TransPend-
		LnkCap:	Port #19, Speed 8GT/s, Width x1, ASPM L0s L1, Exit Latency L0s <1us, L1 <16us
			ClockPM- Surprise- LLActRep+ BwNot+ ASPMOptComp+
		LnkCtl:	ASPM Disabled; RCB 64 bytes, Disabled- CommClk+
			ExtSynch- ClockPM- AutWidDis- BWInt- AutBWInt-
		LnkSta:	Speed 5GT/s, Width x1
			TrErr- Train- SlotClk+ DLActive+ BWMgmt+ ABWMgmt-
		SltCap:	AttnBtn- PwrCtrl- MRL- AttnInd- PwrInd- HotPlug- Surprise-
			Slot #22, PowerLimit 10W; Interlock- NoCompl+
		SltCtl:	Enable: AttnBtn- PwrFlt- MRL- PresDet- CmdCplt- HPIrq- LinkChg-
			Control: AttnInd Unknown, PwrInd Unknown, Power- Interlock-
		SltSta:	Status: AttnBtn- PowerFlt- MRL- CmdCplt- PresDet+ Interlock-
			Changed: MRL- PresDet- LinkState-
		RootCap: CRSVisible-
		RootCtl: ErrCorrectable- ErrNon-Fatal- ErrFatal- PMEIntEna+ CRSVisible-
		RootSta: PME ReqID 0000, PMEStatus- PMEPending-
		DevCap2: Completion Timeout: Range ABC, TimeoutDis+ NROPrPrP- LTR+
			 10BitTagComp- 10BitTagReq- OBFF Not Supported, ExtFmt- EETLPPrefix-
			 EmergencyPowerReduction Not Supported, EmergencyPowerReductionInit-
			 FRS- LN System CLS Not Supported, TPHComp- ExtTPHComp- ARIFwd+
			 AtomicOpsCap: Routing- 32bit- 64bit- 128bitCAS-
		DevCtl2: Completion Timeout: 50us to 50ms, TimeoutDis- LTR+ 10BitTagReq- OBFF Disabled, ARIFwd-
			 AtomicOpsCtl: ReqEn- EgressBlck-
		LnkCap2: Supported Link Speeds: 2.5-8GT/s, Crosslink- Retimer- 2Retimers- DRS-
		LnkCtl2: Target Link Speed: 8GT/s, EnterCompliance- SpeedDis-
			 Transmit Margin: Normal Operating Range, EnterModifiedCompliance- ComplianceSOS-
			 Compliance Preset/De-emphasis: -6dB de-emphasis, 0dB preshoot
		LnkSta2: Current De-emphasis Level: -6dB, EqualizationComplete- EqualizationPhase1-
			 EqualizationPhase2- EqualizationPhase3- LinkEqualizationRequest-
			 Retimer- 2Retimers- CrosslinkRes: unsupported
	Capabilities: [80] MSI: Enable+ Count=1/1 Maskable- 64bit-
		Address: fee002b8  Data: 0000
	Capabilities: [90] Subsystem: ASUSTeK Computer Inc. Device [1043:8694]
	Capabilities: [a0] Power Management version 3
		Flags: PMEClk- DSI- D1- D2- AuxCurrent=0mA PME(D0+,D1-,D2-,D3hot+,D3cold+)
		Status: D0 NoSoftRst- PME-Enable- DSel=0 DScale=0 PME-
	Capabilities: [100 v1] Advanced Error Reporting
		UESta:	DLP- SDES- TLP- FCP- CmpltTO- CmpltAbrt- UnxCmplt- RxOF- MalfTLP- ECRC- UnsupReq- ACSViol-
		UEMsk:	DLP- SDES- TLP- FCP- CmpltTO- CmpltAbrt- UnxCmplt- RxOF- MalfTLP- ECRC- UnsupReq- ACSViol-
		UESvrt:	DLP+ SDES- TLP- FCP- CmpltTO- CmpltAbrt- UnxCmplt- RxOF+ MalfTLP+ ECRC- UnsupReq- ACSViol-
		CESta:	RxErr- BadTLP- BadDLLP- Rollover- Timeout- AdvNonFatalErr-
		CEMsk:	RxErr- BadTLP- BadDLLP- Rollover- Timeout- AdvNonFatalErr+
		AERCap:	First Error Pointer: 00, ECRCGenCap- ECRCGenEn- ECRCChkCap- ECRCChkEn-
			MultHdrRecCap- MultHdrRecEn- TLPPfxPres- HdrLogCap-
		HeaderLog: 00000000 00000000 00000000 00000000
		RootCmd: CERptEn+ NFERptEn+ FERptEn+
		RootSta: CERcvd- MultCERcvd- UERcvd- MultUERcvd-
			 FirstFatal- NonFatalMsg- FatalMsg- IntMsg 0
		ErrorSrc: ERR_COR: 0000 ERR_FATAL/NONFATAL: 0000
	Capabilities: [220 v1] Access Control Services
		ACSCap:	SrcValid+ TransBlk+ ReqRedir+ CmpltRedir+ UpstreamFwd+ EgressCtrl- DirectTrans-
		ACSCtl:	SrcValid- TransBlk- ReqRedir- CmpltRedir- UpstreamFwd- EgressCtrl- DirectTrans-
	Capabilities: [150 v1] Precision Time Measurement
		PTMCap: Requester:- Responder:+ Root:+
		PTMClockGranularity: 4ns
		PTMControl: Enabled:+ RootSelected:+
		PTMEffectiveGranularity: Unknown
	Capabilities: [a30 v1] Secondary PCI Express
		LnkCtl3: LnkEquIntrruptEn- PerformEqu-
		LaneErrStat: 0
	Capabilities: [a00 v1] Downstream Port Containment
		DpcCap:	INT Msg #0, RPExt+ PoisonedTLP+ SwTrigger+ RP PIO Log 4, DL_ActiveErr+
		DpcCtl:	Trigger:1 Cmpl- INT+ ErrCor- PoisonedTLP- SwTrigger- DL_ActiveErr-
		DpcSta:	Trigger- Reason:00 INT- RPBusy- TriggerExt:00 RP PIO ErrPtr:1f
		Source:	0000
	Kernel driver in use: pcieport

00:1b.4 PCI bridge [0604]: Intel Corporation Device [8086:43c4] (rev 11) (prog-if 00 [Normal decode])
	Subsystem: ASUSTeK Computer Inc. Device [1043:8694]
	Control: I/O+ Mem+ BusMaster+ SpecCycle- MemWINV- VGASnoop- ParErr- Stepping- SERR- FastB2B- DisINTx+
	Status: Cap+ 66MHz- UDF- FastB2B- ParErr- DEVSEL=fast >TAbort- <TAbort- <MAbort- >SERR- <PERR- INTx-
	Latency: 0, Cache Line Size: 64 bytes
	Interrupt: pin A routed to IRQ 125
	Bus: primary=00, secondary=05, subordinate=05, sec-latency=0
	I/O behind bridge: [disabled] [16-bit]
	Memory behind bridge: a1800000-a18fffff [size=1M] [32-bit]
	Prefetchable memory behind bridge: [disabled] [64-bit]
	Secondary status: 66MHz- FastB2B- ParErr- DEVSEL=fast >TAbort- <TAbort- <MAbort+ <SERR- <PERR-
	BridgeCtl: Parity- SERR+ NoISA- VGA- VGA16+ MAbort- >Reset- FastB2B-
		PriDiscTmr- SecDiscTmr- DiscTmrStat- DiscTmrSERREn-
	Capabilities: [40] Express (v2) Root Port (Slot+), MSI 00
		DevCap:	MaxPayload 256 bytes, PhantFunc 0
			ExtTag- RBE+
		DevCtl:	CorrErr+ NonFatalErr+ FatalErr+ UnsupReq+
			RlxdOrd- ExtTag- PhantFunc- AuxPwr- NoSnoop-
			MaxPayload 256 bytes, MaxReadReq 128 bytes
		DevSta:	CorrErr- NonFatalErr- FatalErr- UnsupReq- AuxPwr+ TransPend-
		LnkCap:	Port #21, Speed 8GT/s, Width x4, ASPM L1, Exit Latency L1 <16us
			ClockPM- Surprise- LLActRep+ BwNot+ ASPMOptComp+
		LnkCtl:	ASPM Disabled; RCB 64 bytes, Disabled- CommClk+
			ExtSynch- ClockPM- AutWidDis- BWInt- AutBWInt-
		LnkSta:	Speed 8GT/s, Width x4
			TrErr- Train- SlotClk+ DLActive+ BWMgmt+ ABWMgmt-
		SltCap:	AttnBtn- PwrCtrl- MRL- AttnInd- PwrInd- HotPlug- Surprise-
			Slot #24, PowerLimit 25W; Interlock- NoCompl+
		SltCtl:	Enable: AttnBtn- PwrFlt- MRL- PresDet- CmdCplt- HPIrq- LinkChg-
			Control: AttnInd Unknown, PwrInd Unknown, Power- Interlock-
		SltSta:	Status: AttnBtn- PowerFlt- MRL- CmdCplt- PresDet+ Interlock-
			Changed: MRL- PresDet- LinkState-
		RootCap: CRSVisible-
		RootCtl: ErrCorrectable- ErrNon-Fatal- ErrFatal- PMEIntEna+ CRSVisible-
		RootSta: PME ReqID 0000, PMEStatus- PMEPending-
		DevCap2: Completion Timeout: Range ABC, TimeoutDis+ NROPrPrP- LTR+
			 10BitTagComp- 10BitTagReq- OBFF Not Supported, ExtFmt- EETLPPrefix-
			 EmergencyPowerReduction Not Supported, EmergencyPowerReductionInit-
			 FRS- LN System CLS Not Supported, TPHComp- ExtTPHComp- ARIFwd+
			 AtomicOpsCap: Routing- 32bit- 64bit- 128bitCAS-
		DevCtl2: Completion Timeout: 50us to 50ms, TimeoutDis- LTR+ 10BitTagReq- OBFF Disabled, ARIFwd-
			 AtomicOpsCtl: ReqEn- EgressBlck-
		LnkCap2: Supported Link Speeds: 2.5-8GT/s, Crosslink- Retimer- 2Retimers- DRS-
		LnkCtl2: Target Link Speed: 8GT/s, EnterCompliance- SpeedDis-
			 Transmit Margin: Normal Operating Range, EnterModifiedCompliance- ComplianceSOS-
			 Compliance Preset/De-emphasis: -6dB de-emphasis, 0dB preshoot
		LnkSta2: Current De-emphasis Level: -3.5dB, EqualizationComplete+ EqualizationPhase1+
			 EqualizationPhase2+ EqualizationPhase3+ LinkEqualizationRequest-
			 Retimer- 2Retimers- CrosslinkRes: unsupported
	Capabilities: [80] MSI: Enable+ Count=1/1 Maskable- 64bit-
		Address: fee002d8  Data: 0000
	Capabilities: [90] Subsystem: ASUSTeK Computer Inc. Device [1043:8694]
	Capabilities: [a0] Power Management version 3
		Flags: PMEClk- DSI- D1- D2- AuxCurrent=0mA PME(D0+,D1-,D2-,D3hot+,D3cold+)
		Status: D0 NoSoftRst- PME-Enable- DSel=0 DScale=0 PME-
	Capabilities: [100 v1] Advanced Error Reporting
		UESta:	DLP- SDES- TLP- FCP- CmpltTO- CmpltAbrt- UnxCmplt- RxOF- MalfTLP- ECRC- UnsupReq- ACSViol-
		UEMsk:	DLP- SDES- TLP- FCP- CmpltTO- CmpltAbrt- UnxCmplt- RxOF- MalfTLP- ECRC- UnsupReq- ACSViol-
		UESvrt:	DLP+ SDES- TLP- FCP- CmpltTO- CmpltAbrt- UnxCmplt- RxOF+ MalfTLP+ ECRC- UnsupReq- ACSViol-
		CESta:	RxErr- BadTLP- BadDLLP- Rollover- Timeout- AdvNonFatalErr-
		CEMsk:	RxErr- BadTLP- BadDLLP- Rollover- Timeout- AdvNonFatalErr+
		AERCap:	First Error Pointer: 00, ECRCGenCap- ECRCGenEn- ECRCChkCap- ECRCChkEn-
			MultHdrRecCap- MultHdrRecEn- TLPPfxPres- HdrLogCap-
		HeaderLog: 00000000 00000000 00000000 00000000
		RootCmd: CERptEn+ NFERptEn+ FERptEn+
		RootSta: CERcvd- MultCERcvd- UERcvd- MultUERcvd-
			 FirstFatal- NonFatalMsg- FatalMsg- IntMsg 0
		ErrorSrc: ERR_COR: 0000 ERR_FATAL/NONFATAL: 0000
	Capabilities: [220 v1] Access Control Services
		ACSCap:	SrcValid+ TransBlk+ ReqRedir+ CmpltRedir+ UpstreamFwd+ EgressCtrl- DirectTrans-
		ACSCtl:	SrcValid- TransBlk- ReqRedir- CmpltRedir- UpstreamFwd- EgressCtrl- DirectTrans-
	Capabilities: [150 v1] Precision Time Measurement
		PTMCap: Requester:- Responder:+ Root:+
		PTMClockGranularity: 4ns
		PTMControl: Enabled:+ RootSelected:+
		PTMEffectiveGranularity: Unknown
	Capabilities: [a30 v1] Secondary PCI Express
		LnkCtl3: LnkEquIntrruptEn- PerformEqu-
		LaneErrStat: 0
	Capabilities: [a00 v1] Downstream Port Containment
		DpcCap:	INT Msg #0, RPExt+ PoisonedTLP+ SwTrigger+ RP PIO Log 4, DL_ActiveErr+
		DpcCtl:	Trigger:1 Cmpl- INT+ ErrCor- PoisonedTLP- SwTrigger- DL_ActiveErr-
		DpcSta:	Trigger- Reason:00 INT- RPBusy- TriggerExt:00 RP PIO ErrPtr:1f
		Source:	0000
	Kernel driver in use: pcieport

00:1c.0 PCI bridge [0604]: Intel Corporation Device [8086:43b8] (rev 11) (prog-if 00 [Normal decode])
	Subsystem: ASUSTeK Computer Inc. Device [1043:8694]
	Control: I/O+ Mem+ BusMaster+ SpecCycle- MemWINV- VGASnoop- ParErr- Stepping- SERR- FastB2B- DisINTx+
	Status: Cap+ 66MHz- UDF- FastB2B- ParErr- DEVSEL=fast >TAbort- <TAbort- <MAbort- >SERR- <PERR- INTx-
	Latency: 0, Cache Line Size: 64 bytes
	Interrupt: pin ? routed to IRQ 126
	Bus: primary=00, secondary=06, subordinate=06, sec-latency=0
	I/O behind bridge: [disabled] [16-bit]
	Memory behind bridge: [disabled] [32-bit]
	Prefetchable memory behind bridge: [disabled] [64-bit]
	Secondary status: 66MHz- FastB2B- ParErr- DEVSEL=fast >TAbort- <TAbort- <MAbort+ <SERR- <PERR-
	BridgeCtl: Parity- SERR+ NoISA- VGA- VGA16+ MAbort- >Reset- FastB2B-
		PriDiscTmr- SecDiscTmr- DiscTmrStat- DiscTmrSERREn-
	Capabilities: [40] Express (v2) Root Port (Slot-), MSI 00
		DevCap:	MaxPayload 256 bytes, PhantFunc 0
			ExtTag- RBE+
		DevCtl:	CorrErr- NonFatalErr- FatalErr- UnsupReq-
			RlxdOrd- ExtTag- PhantFunc- AuxPwr- NoSnoop-
			MaxPayload 128 bytes, MaxReadReq 128 bytes
		DevSta:	CorrErr- NonFatalErr- FatalErr- UnsupReq- AuxPwr+ TransPend-
		LnkCap:	Port #1, Speed 8GT/s, Width x1, ASPM L0s L1, Exit Latency L0s <1us, L1 <4us
			ClockPM- Surprise- LLActRep+ BwNot+ ASPMOptComp+
		LnkCtl:	ASPM L0s L1 Enabled; RCB 64 bytes, Disabled- CommClk-
			ExtSynch- ClockPM- AutWidDis- BWInt- AutBWInt-
		LnkSta:	Speed 2.5GT/s, Width x0
			TrErr- Train- SlotClk+ DLActive- BWMgmt- ABWMgmt-
		RootCap: CRSVisible-
		RootCtl: ErrCorrectable- ErrNon-Fatal- ErrFatal- PMEIntEna+ CRSVisible-
		RootSta: PME ReqID 0000, PMEStatus- PMEPending-
		DevCap2: Completion Timeout: Range ABC, TimeoutDis+ NROPrPrP- LTR+
			 10BitTagComp- 10BitTagReq- OBFF Via WAKE#, ExtFmt- EETLPPrefix-
			 EmergencyPowerReduction Not Supported, EmergencyPowerReductionInit-
			 FRS- LN System CLS Not Supported, TPHComp- ExtTPHComp- ARIFwd+
			 AtomicOpsCap: Routing- 32bit- 64bit- 128bitCAS-
		DevCtl2: Completion Timeout: 50us to 50ms, TimeoutDis- LTR- 10BitTagReq- OBFF Disabled, ARIFwd-
			 AtomicOpsCtl: ReqEn- EgressBlck-
		LnkCap2: Supported Link Speeds: 2.5-8GT/s, Crosslink- Retimer- 2Retimers- DRS-
		LnkCtl2: Target Link Speed: 8GT/s, EnterCompliance- SpeedDis-
			 Transmit Margin: Normal Operating Range, EnterModifiedCompliance- ComplianceSOS-
			 Compliance Preset/De-emphasis: -6dB de-emphasis, 0dB preshoot
		LnkSta2: Current De-emphasis Level: -3.5dB, EqualizationComplete- EqualizationPhase1-
			 EqualizationPhase2- EqualizationPhase3- LinkEqualizationRequest-
			 Retimer- 2Retimers- CrosslinkRes: unsupported
	Capabilities: [80] MSI: Enable+ Count=1/1 Maskable- 64bit-
		Address: fee002f8  Data: 0000
	Capabilities: [90] Subsystem: ASUSTeK Computer Inc. Device [1043:8694]
	Capabilities: [a0] Power Management version 3
		Flags: PMEClk- DSI- D1- D2- AuxCurrent=0mA PME(D0+,D1-,D2-,D3hot+,D3cold+)
		Status: D3 NoSoftRst+ PME-Enable+ DSel=0 DScale=0 PME-
	Kernel driver in use: pcieport

00:1c.4 PCI bridge [0604]: Intel Corporation Tiger Lake-H PCI Express Root Port #5 [8086:43bc] (rev 11) (prog-if 00 [Normal decode])
	Subsystem: ASUSTeK Computer Inc. Device [1043:8694]
	Control: I/O+ Mem+ BusMaster+ SpecCycle- MemWINV- VGASnoop- ParErr- Stepping- SERR- FastB2B- DisINTx+
	Status: Cap+ 66MHz- UDF- FastB2B- ParErr- DEVSEL=fast >TAbort- <TAbort- <MAbort- >SERR- <PERR- INTx-
	Latency: 0, Cache Line Size: 64 bytes
	Interrupt: pin A routed to IRQ 127
	Bus: primary=00, secondary=07, subordinate=07, sec-latency=0
	I/O behind bridge: [disabled] [16-bit]
	Memory behind bridge: a1200000-a14fffff [size=3M] [32-bit]
	Prefetchable memory behind bridge: [disabled] [64-bit]
	Secondary status: 66MHz- FastB2B- ParErr- DEVSEL=fast >TAbort- <TAbort- <MAbort+ <SERR- <PERR-
	BridgeCtl: Parity- SERR+ NoISA- VGA- VGA16+ MAbort- >Reset- FastB2B-
		PriDiscTmr- SecDiscTmr- DiscTmrStat- DiscTmrSERREn-
	Capabilities: [40] Express (v2) Root Port (Slot+), MSI 00
		DevCap:	MaxPayload 256 bytes, PhantFunc 0
			ExtTag- RBE+
		DevCtl:	CorrErr+ NonFatalErr+ FatalErr+ UnsupReq+
			RlxdOrd- ExtTag- PhantFunc- AuxPwr- NoSnoop-
			MaxPayload 256 bytes, MaxReadReq 128 bytes
		DevSta:	CorrErr- NonFatalErr- FatalErr- UnsupReq- AuxPwr+ TransPend-
		LnkCap:	Port #5, Speed 8GT/s, Width x4, ASPM L0s L1, Exit Latency L0s <1us, L1 <16us
			ClockPM- Surprise- LLActRep+ BwNot+ ASPMOptComp+
		LnkCtl:	ASPM Disabled; RCB 64 bytes, Disabled- CommClk+
			ExtSynch- ClockPM- AutWidDis- BWInt- AutBWInt-
		LnkSta:	Speed 2.5GT/s, Width x1
			TrErr- Train- SlotClk+ DLActive+ BWMgmt+ ABWMgmt-
		SltCap:	AttnBtn- PwrCtrl- MRL- AttnInd- PwrInd- HotPlug- Surprise-
			Slot #8, PowerLimit 25W; Interlock- NoCompl+
		SltCtl:	Enable: AttnBtn- PwrFlt- MRL- PresDet- CmdCplt- HPIrq- LinkChg-
			Control: AttnInd Unknown, PwrInd Unknown, Power- Interlock-
		SltSta:	Status: AttnBtn- PowerFlt- MRL- CmdCplt- PresDet+ Interlock-
			Changed: MRL- PresDet- LinkState-
		RootCap: CRSVisible-
		RootCtl: ErrCorrectable- ErrNon-Fatal- ErrFatal- PMEIntEna+ CRSVisible-
		RootSta: PME ReqID 0000, PMEStatus- PMEPending-
		DevCap2: Completion Timeout: Range ABC, TimeoutDis+ NROPrPrP- LTR+
			 10BitTagComp- 10BitTagReq- OBFF Not Supported, ExtFmt- EETLPPrefix-
			 EmergencyPowerReduction Not Supported, EmergencyPowerReductionInit-
			 FRS- LN System CLS Not Supported, TPHComp- ExtTPHComp- ARIFwd+
			 AtomicOpsCap: Routing- 32bit- 64bit- 128bitCAS-
		DevCtl2: Completion Timeout: 50us to 50ms, TimeoutDis- LTR+ 10BitTagReq- OBFF Disabled, ARIFwd-
			 AtomicOpsCtl: ReqEn- EgressBlck-
		LnkCap2: Supported Link Speeds: 2.5-8GT/s, Crosslink- Retimer- 2Retimers- DRS-
		LnkCtl2: Target Link Speed: 8GT/s, EnterCompliance- SpeedDis-
			 Transmit Margin: Normal Operating Range, EnterModifiedCompliance- ComplianceSOS-
			 Compliance Preset/De-emphasis: -6dB de-emphasis, 0dB preshoot
		LnkSta2: Current De-emphasis Level: -3.5dB, EqualizationComplete- EqualizationPhase1-
			 EqualizationPhase2- EqualizationPhase3- LinkEqualizationRequest-
			 Retimer- 2Retimers- CrosslinkRes: unsupported
	Capabilities: [80] MSI: Enable+ Count=1/1 Maskable- 64bit-
		Address: fee00318  Data: 0000
	Capabilities: [90] Subsystem: ASUSTeK Computer Inc. Device [1043:8694]
	Capabilities: [a0] Power Management version 3
		Flags: PMEClk- DSI- D1- D2- AuxCurrent=0mA PME(D0+,D1-,D2-,D3hot+,D3cold+)
		Status: D0 NoSoftRst- PME-Enable- DSel=0 DScale=0 PME-
	Capabilities: [100 v1] Advanced Error Reporting
		UESta:	DLP- SDES- TLP- FCP- CmpltTO- CmpltAbrt- UnxCmplt- RxOF- MalfTLP- ECRC- UnsupReq- ACSViol-
		UEMsk:	DLP- SDES- TLP- FCP- CmpltTO- CmpltAbrt- UnxCmplt- RxOF- MalfTLP- ECRC- UnsupReq- ACSViol-
		UESvrt:	DLP+ SDES- TLP- FCP- CmpltTO- CmpltAbrt- UnxCmplt- RxOF+ MalfTLP+ ECRC- UnsupReq- ACSViol-
		CESta:	RxErr- BadTLP- BadDLLP- Rollover- Timeout- AdvNonFatalErr-
		CEMsk:	RxErr- BadTLP- BadDLLP- Rollover- Timeout- AdvNonFatalErr+
		AERCap:	First Error Pointer: 00, ECRCGenCap- ECRCGenEn- ECRCChkCap- ECRCChkEn-
			MultHdrRecCap- MultHdrRecEn- TLPPfxPres- HdrLogCap-
		HeaderLog: 00000000 00000000 00000000 00000000
		RootCmd: CERptEn+ NFERptEn+ FERptEn+
		RootSta: CERcvd- MultCERcvd- UERcvd- MultUERcvd-
			 FirstFatal- NonFatalMsg- FatalMsg- IntMsg 0
		ErrorSrc: ERR_COR: 0000 ERR_FATAL/NONFATAL: 0000
	Capabilities: [220 v1] Access Control Services
		ACSCap:	SrcValid+ TransBlk+ ReqRedir+ CmpltRedir+ UpstreamFwd+ EgressCtrl- DirectTrans-
		ACSCtl:	SrcValid- TransBlk- ReqRedir- CmpltRedir- UpstreamFwd- EgressCtrl- DirectTrans-
	Capabilities: [150 v1] Precision Time Measurement
		PTMCap: Requester:- Responder:+ Root:+
		PTMClockGranularity: 4ns
		PTMControl: Enabled:+ RootSelected:+
		PTMEffectiveGranularity: Unknown
	Capabilities: [a30 v1] Secondary PCI Express
		LnkCtl3: LnkEquIntrruptEn- PerformEqu-
		LaneErrStat: 0
	Capabilities: [a00 v1] Downstream Port Containment
		DpcCap:	INT Msg #0, RPExt+ PoisonedTLP+ SwTrigger+ RP PIO Log 4, DL_ActiveErr+
		DpcCtl:	Trigger:1 Cmpl- INT+ ErrCor- PoisonedTLP- SwTrigger- DL_ActiveErr-
		DpcSta:	Trigger- Reason:00 INT- RPBusy- TriggerExt:00 RP PIO ErrPtr:1f
		Source:	0000
	Kernel driver in use: pcieport

00:1d.0 PCI bridge [0604]: Intel Corporation Tiger Lake-H PCI Express Root Port #9 [8086:43b0] (rev 11) (prog-if 00 [Normal decode])
	Subsystem: ASUSTeK Computer Inc. Device [1043:8694]
	Control: I/O+ Mem+ BusMaster+ SpecCycle- MemWINV- VGASnoop- ParErr- Stepping- SERR- FastB2B- DisINTx+
	Status: Cap+ 66MHz- UDF- FastB2B- ParErr- DEVSEL=fast >TAbort- <TAbort- <MAbort- >SERR- <PERR- INTx-
	Latency: 0, Cache Line Size: 64 bytes
	Interrupt: pin A routed to IRQ 128
	Bus: primary=00, secondary=08, subordinate=08, sec-latency=0
	I/O behind bridge: [disabled] [16-bit]
	Memory behind bridge: a1700000-a17fffff [size=1M] [32-bit]
	Prefetchable memory behind bridge: [disabled] [64-bit]
	Secondary status: 66MHz- FastB2B- ParErr- DEVSEL=fast >TAbort- <TAbort- <MAbort+ <SERR- <PERR-
	BridgeCtl: Parity- SERR+ NoISA- VGA- VGA16+ MAbort- >Reset- FastB2B-
		PriDiscTmr- SecDiscTmr- DiscTmrStat- DiscTmrSERREn-
	Capabilities: [40] Express (v2) Root Port (Slot+), MSI 00
		DevCap:	MaxPayload 256 bytes, PhantFunc 0
			ExtTag- RBE+
		DevCtl:	CorrErr+ NonFatalErr+ FatalErr+ UnsupReq+
			RlxdOrd- ExtTag- PhantFunc- AuxPwr- NoSnoop-
			MaxPayload 256 bytes, MaxReadReq 128 bytes
		DevSta:	CorrErr- NonFatalErr- FatalErr- UnsupReq- AuxPwr+ TransPend-
		LnkCap:	Port #9, Speed 8GT/s, Width x4, ASPM L1, Exit Latency L1 <16us
			ClockPM- Surprise- LLActRep+ BwNot+ ASPMOptComp+
		LnkCtl:	ASPM Disabled; RCB 64 bytes, Disabled- CommClk+
			ExtSynch- ClockPM- AutWidDis- BWInt- AutBWInt-
		LnkSta:	Speed 8GT/s, Width x4
			TrErr- Train- SlotClk+ DLActive+ BWMgmt+ ABWMgmt-
		SltCap:	AttnBtn- PwrCtrl- MRL- AttnInd- PwrInd- HotPlug- Surprise-
			Slot #12, PowerLimit 25W; Interlock- NoCompl+
		SltCtl:	Enable: AttnBtn- PwrFlt- MRL- PresDet- CmdCplt- HPIrq- LinkChg-
			Control: AttnInd Unknown, PwrInd Unknown, Power- Interlock-
		SltSta:	Status: AttnBtn- PowerFlt- MRL- CmdCplt- PresDet+ Interlock-
			Changed: MRL- PresDet- LinkState-
		RootCap: CRSVisible-
		RootCtl: ErrCorrectable- ErrNon-Fatal- ErrFatal- PMEIntEna+ CRSVisible-
		RootSta: PME ReqID 0000, PMEStatus- PMEPending-
		DevCap2: Completion Timeout: Range ABC, TimeoutDis+ NROPrPrP- LTR+
			 10BitTagComp- 10BitTagReq- OBFF Not Supported, ExtFmt- EETLPPrefix-
			 EmergencyPowerReduction Not Supported, EmergencyPowerReductionInit-
			 FRS- LN System CLS Not Supported, TPHComp- ExtTPHComp- ARIFwd+
			 AtomicOpsCap: Routing- 32bit- 64bit- 128bitCAS-
		DevCtl2: Completion Timeout: 50us to 50ms, TimeoutDis- LTR+ 10BitTagReq- OBFF Disabled, ARIFwd-
			 AtomicOpsCtl: ReqEn- EgressBlck-
		LnkCap2: Supported Link Speeds: 2.5-8GT/s, Crosslink- Retimer- 2Retimers- DRS-
		LnkCtl2: Target Link Speed: 8GT/s, EnterCompliance- SpeedDis-
			 Transmit Margin: Normal Operating Range, EnterModifiedCompliance- ComplianceSOS-
			 Compliance Preset/De-emphasis: -6dB de-emphasis, 0dB preshoot
		LnkSta2: Current De-emphasis Level: -3.5dB, EqualizationComplete+ EqualizationPhase1+
			 EqualizationPhase2+ EqualizationPhase3+ LinkEqualizationRequest-
			 Retimer- 2Retimers- CrosslinkRes: unsupported
	Capabilities: [80] MSI: Enable+ Count=1/1 Maskable- 64bit-
		Address: fee00338  Data: 0000
	Capabilities: [90] Subsystem: ASUSTeK Computer Inc. Device [1043:8694]
	Capabilities: [a0] Power Management version 3
		Flags: PMEClk- DSI- D1- D2- AuxCurrent=0mA PME(D0+,D1-,D2-,D3hot+,D3cold+)
		Status: D0 NoSoftRst- PME-Enable- DSel=0 DScale=0 PME-
	Capabilities: [100 v1] Advanced Error Reporting
		UESta:	DLP- SDES- TLP- FCP- CmpltTO- CmpltAbrt- UnxCmplt- RxOF- MalfTLP- ECRC- UnsupReq- ACSViol-
		UEMsk:	DLP- SDES- TLP- FCP- CmpltTO- CmpltAbrt- UnxCmplt- RxOF- MalfTLP- ECRC- UnsupReq- ACSViol-
		UESvrt:	DLP+ SDES- TLP- FCP- CmpltTO- CmpltAbrt- UnxCmplt- RxOF+ MalfTLP+ ECRC- UnsupReq- ACSViol-
		CESta:	RxErr- BadTLP- BadDLLP- Rollover- Timeout- AdvNonFatalErr-
		CEMsk:	RxErr- BadTLP- BadDLLP- Rollover- Timeout- AdvNonFatalErr+
		AERCap:	First Error Pointer: 00, ECRCGenCap- ECRCGenEn- ECRCChkCap- ECRCChkEn-
			MultHdrRecCap- MultHdrRecEn- TLPPfxPres- HdrLogCap-
		HeaderLog: 00000000 00000000 00000000 00000000
		RootCmd: CERptEn+ NFERptEn+ FERptEn+
		RootSta: CERcvd- MultCERcvd- UERcvd- MultUERcvd-
			 FirstFatal- NonFatalMsg- FatalMsg- IntMsg 0
		ErrorSrc: ERR_COR: 0000 ERR_FATAL/NONFATAL: 0000
	Capabilities: [220 v1] Access Control Services
		ACSCap:	SrcValid+ TransBlk+ ReqRedir+ CmpltRedir+ UpstreamFwd+ EgressCtrl- DirectTrans-
		ACSCtl:	SrcValid- TransBlk- ReqRedir- CmpltRedir- UpstreamFwd- EgressCtrl- DirectTrans-
	Capabilities: [150 v1] Precision Time Measurement
		PTMCap: Requester:- Responder:+ Root:+
		PTMClockGranularity: 4ns
		PTMControl: Enabled:+ RootSelected:+
		PTMEffectiveGranularity: Unknown
	Capabilities: [a30 v1] Secondary PCI Express
		LnkCtl3: LnkEquIntrruptEn- PerformEqu-
		LaneErrStat: 0
	Capabilities: [a00 v1] Downstream Port Containment
		DpcCap:	INT Msg #0, RPExt+ PoisonedTLP+ SwTrigger+ RP PIO Log 4, DL_ActiveErr+
		DpcCtl:	Trigger:1 Cmpl- INT+ ErrCor- PoisonedTLP- SwTrigger- DL_ActiveErr-
		DpcSta:	Trigger- Reason:00 INT- RPBusy- TriggerExt:00 RP PIO ErrPtr:1f
		Source:	0000
	Kernel driver in use: pcieport

00:1f.0 ISA bridge [0601]: Intel Corporation Device [8086:4385] (rev 11)
	DeviceName: Onboard - Other
	Subsystem: ASUSTeK Computer Inc. Device [1043:8694]
	Control: I/O+ Mem+ BusMaster+ SpecCycle- MemWINV- VGASnoop- ParErr- Stepping- SERR- FastB2B- DisINTx+
	Status: Cap- 66MHz- UDF- FastB2B- ParErr- DEVSEL=fast >TAbort- <TAbort- <MAbort- >SERR- <PERR- INTx-
	Latency: 0

00:1f.3 Audio device [0403]: Intel Corporation Tiger Lake-H HD Audio Controller [8086:43c8] (rev 11)
	DeviceName: Onboard - Sound
	Subsystem: ASUSTeK Computer Inc. Device [1043:87b2]
	Control: I/O- Mem+ BusMaster+ SpecCycle- MemWINV- VGASnoop- ParErr- Stepping- SERR- FastB2B- DisINTx+
	Status: Cap+ 66MHz- UDF- FastB2B- ParErr- DEVSEL=fast >TAbort- <TAbort- <MAbort- >SERR- <PERR- INTx-
	Latency: 32, Cache Line Size: 64 bytes
	Interrupt: pin A routed to IRQ 173
	Region 0: Memory at 4012210000 (64-bit, non-prefetchable) [size=16K]
	Region 4: Memory at 4012100000 (64-bit, non-prefetchable) [size=1M]
	Capabilities: [50] Power Management version 3
		Flags: PMEClk- DSI- D1- D2- AuxCurrent=55mA PME(D0-,D1-,D2-,D3hot+,D3cold+)
		Status: D0 NoSoftRst+ PME-Enable- DSel=0 DScale=0 PME-
	Capabilities: [80] Vendor Specific Information: Len=14 <?>
	Capabilities: [60] MSI: Enable+ Count=1/1 Maskable- 64bit+
		Address: 00000000fee008d8  Data: 0000
	Kernel driver in use: snd_hda_intel

00:1f.4 SMBus [0c05]: Intel Corporation Tiger Lake-H SMBus Controller [8086:43a3] (rev 11)
	DeviceName: Onboard - Other
	Subsystem: ASUSTeK Computer Inc. Device [1043:8694]
	Control: I/O+ Mem+ BusMaster- SpecCycle- MemWINV- VGASnoop- ParErr- Stepping- SERR- FastB2B- DisINTx-
	Status: Cap- 66MHz- UDF- FastB2B+ ParErr- DEVSEL=medium >TAbort- <TAbort- <MAbort- >SERR- <PERR- INTx-
	Interrupt: pin A routed to IRQ 16
	Region 0: Memory at 4012218000 (64-bit, non-prefetchable) [size=256]
	Region 4: I/O ports at efa0 [size=32]
	Kernel driver in use: i801_smbus

00:1f.5 Serial bus controller [0c80]: Intel Corporation Tiger Lake-H SPI Controller [8086:43a4] (rev 11)
	DeviceName: Onboard - Other
	Subsystem: ASUSTeK Computer Inc. Device [1043:8694]
	Control: I/O- Mem+ BusMaster- SpecCycle- MemWINV- VGASnoop- ParErr- Stepping- SERR- FastB2B- DisINTx+
	Status: Cap- 66MHz- UDF- FastB2B- ParErr- DEVSEL=fast >TAbort- <TAbort- <MAbort- >SERR- <PERR- INTx-
	Region 0: Memory at a1100000 (32-bit, non-prefetchable) [size=4K]
	Kernel driver in use: intel-spi

01:00.0 VGA compatible controller [0300]: NVIDIA Corporation TU104 [GeForce RTX 2080 Rev. A] [10de:1e87] (rev a1) (prog-if 00 [VGA controller])
	Subsystem: Gigabyte Technology Co., Ltd Device [1458:37c5]
	Control: I/O+ Mem+ BusMaster+ SpecCycle- MemWINV- VGASnoop- ParErr- Stepping- SERR- FastB2B- DisINTx+
	Status: Cap+ 66MHz- UDF- FastB2B- ParErr- DEVSEL=fast >TAbort- <TAbort- <MAbort- >SERR- <PERR- INTx-
	Latency: 0
	Interrupt: pin A routed to IRQ 130
	Region 0: Memory at a0000000 (32-bit, non-prefetchable) [size=16M]
	Region 1: Memory at 4000000000 (64-bit, prefetchable) [size=256M]
	Region 3: Memory at 4010000000 (64-bit, prefetchable) [size=32M]
	Region 5: I/O ports at 3000 [size=128]
	Expansion ROM at a1000000 [virtual] [disabled] [size=512K]
	Capabilities: [60] Power Management version 3
		Flags: PMEClk- DSI- D1- D2- AuxCurrent=375mA PME(D0+,D1-,D2-,D3hot+,D3cold-)
		Status: D0 NoSoftRst+ PME-Enable- DSel=0 DScale=0 PME-
	Capabilities: [68] MSI: Enable+ Count=1/1 Maskable- 64bit+
		Address: 00000000fee00378  Data: 0000
	Capabilities: [78] Express (v2) Legacy Endpoint, MSI 00
		DevCap:	MaxPayload 256 bytes, PhantFunc 0, Latency L0s unlimited, L1 <64us
			ExtTag+ AttnBtn- AttnInd- PwrInd- RBE+ FLReset+
		DevCtl:	CorrErr+ NonFatalErr+ FatalErr+ UnsupReq+
			RlxdOrd+ ExtTag+ PhantFunc- AuxPwr- NoSnoop+ FLReset-
			MaxPayload 128 bytes, MaxReadReq 512 bytes
		DevSta:	CorrErr- NonFatalErr- FatalErr- UnsupReq- AuxPwr- TransPend-
		LnkCap:	Port #0, Speed 8GT/s, Width x16, ASPM L0s L1, Exit Latency L0s <1us, L1 <4us
			ClockPM+ Surprise- LLActRep- BwNot- ASPMOptComp+
		LnkCtl:	ASPM Disabled; RCB 64 bytes, Disabled- CommClk+
			ExtSynch- ClockPM- AutWidDis- BWInt- AutBWInt-
		LnkSta:	Speed 8GT/s, Width x16
			TrErr- Train- SlotClk+ DLActive- BWMgmt- ABWMgmt-
		DevCap2: Completion Timeout: Range AB, TimeoutDis+ NROPrPrP- LTR+
			 10BitTagComp- 10BitTagReq- OBFF Via message, ExtFmt- EETLPPrefix-
			 EmergencyPowerReduction Not Supported, EmergencyPowerReductionInit-
			 FRS-
			 AtomicOpsCap: 32bit- 64bit- 128bitCAS-
		DevCtl2: Completion Timeout: 50us to 50ms, TimeoutDis- LTR+ 10BitTagReq- OBFF Disabled,
			 AtomicOpsCtl: ReqEn-
		LnkCap2: Supported Link Speeds: 2.5-8GT/s, Crosslink- Retimer- 2Retimers- DRS-
		LnkCtl2: Target Link Speed: 8GT/s, EnterCompliance- SpeedDis-
			 Transmit Margin: Normal Operating Range, EnterModifiedCompliance- ComplianceSOS-
			 Compliance Preset/De-emphasis: -6dB de-emphasis, 0dB preshoot
		LnkSta2: Current De-emphasis Level: -6dB, EqualizationComplete+ EqualizationPhase1+
			 EqualizationPhase2+ EqualizationPhase3+ LinkEqualizationRequest-
			 Retimer- 2Retimers- CrosslinkRes: unsupported
	Capabilities: [100 v1] Virtual Channel
		Caps:	LPEVC=0 RefClk=100ns PATEntryBits=1
		Arb:	Fixed- WRR32- WRR64- WRR128-
		Ctrl:	ArbSelect=Fixed
		Status:	InProgress-
		VC0:	Caps:	PATOffset=00 MaxTimeSlots=1 RejSnoopTrans-
			Arb:	Fixed- WRR32- WRR64- WRR128- TWRR128- WRR256-
			Ctrl:	Enable+ ID=0 ArbSelect=Fixed TC/VC=ff
			Status:	NegoPending- InProgress-
	Capabilities: [250 v1] Latency Tolerance Reporting
		Max snoop latency: 34326183936ns
		Max no snoop latency: 34326183936ns
	Capabilities: [258 v1] L1 PM Substates
		L1SubCap: PCI-PM_L1.2+ PCI-PM_L1.1+ ASPM_L1.2+ ASPM_L1.1+ L1_PM_Substates+
			  PortCommonModeRestoreTime=255us PortTPowerOnTime=10us
		L1SubCtl1: PCI-PM_L1.2- PCI-PM_L1.1- ASPM_L1.2- ASPM_L1.1-
			   T_CommonMode=0us LTR1.2_Threshold=281600ns
		L1SubCtl2: T_PwrOn=10us
	Capabilities: [128 v1] Power Budgeting <?>
	Capabilities: [420 v2] Advanced Error Reporting
		UESta:	DLP- SDES- TLP- FCP- CmpltTO- CmpltAbrt- UnxCmplt- RxOF- MalfTLP- ECRC- UnsupReq- ACSViol-
		UEMsk:	DLP- SDES- TLP- FCP- CmpltTO- CmpltAbrt- UnxCmplt- RxOF- MalfTLP- ECRC- UnsupReq- ACSViol-
		UESvrt:	DLP+ SDES+ TLP- FCP+ CmpltTO- CmpltAbrt- UnxCmplt- RxOF+ MalfTLP+ ECRC- UnsupReq- ACSViol-
		CESta:	RxErr- BadTLP- BadDLLP- Rollover- Timeout- AdvNonFatalErr-
		CEMsk:	RxErr- BadTLP- BadDLLP- Rollover- Timeout- AdvNonFatalErr+
		AERCap:	First Error Pointer: 00, ECRCGenCap- ECRCGenEn- ECRCChkCap- ECRCChkEn-
			MultHdrRecCap- MultHdrRecEn- TLPPfxPres- HdrLogCap-
		HeaderLog: 00000000 00000000 00000000 00000000
	Capabilities: [600 v1] Vendor Specific Information: ID=0001 Rev=1 Len=024 <?>
	Capabilities: [900 v1] Secondary PCI Express
		LnkCtl3: LnkEquIntrruptEn- PerformEqu-
		LaneErrStat: 0
	Capabilities: [bb0 v1] Physical Resizable BAR
		BAR 0: current size: 16MB, supported: 16MB
		BAR 1: current size: 256MB, supported: 64MB 128MB 256MB
		BAR 3: current size: 32MB, supported: 32MB
	Kernel driver in use: nvidia

01:00.1 Audio device [0403]: NVIDIA Corporation TU104 HD Audio Controller [10de:10f8] (rev a1)
	Subsystem: Gigabyte Technology Co., Ltd Device [1458:37c5]
	Control: I/O- Mem+ BusMaster+ SpecCycle- MemWINV- VGASnoop- ParErr- Stepping- SERR- FastB2B- DisINTx-
	Status: Cap+ 66MHz- UDF- FastB2B- ParErr- DEVSEL=fast >TAbort- <TAbort- <MAbort- >SERR- <PERR- INTx-
	Latency: 0, Cache Line Size: 64 bytes
	Interrupt: pin B routed to IRQ 17
	Region 0: Memory at a1080000 (32-bit, non-prefetchable) [size=16K]
	Capabilities: [60] Power Management version 3
		Flags: PMEClk- DSI- D1- D2- AuxCurrent=0mA PME(D0-,D1-,D2-,D3hot-,D3cold-)
		Status: D0 NoSoftRst+ PME-Enable- DSel=0 DScale=0 PME-
	Capabilities: [68] MSI: Enable- Count=1/1 Maskable- 64bit+
		Address: 0000000000000000  Data: 0000
	Capabilities: [78] Express (v2) Endpoint, MSI 00
		DevCap:	MaxPayload 256 bytes, PhantFunc 0, Latency L0s unlimited, L1 <64us
			ExtTag+ AttnBtn- AttnInd- PwrInd- RBE+ FLReset- SlotPowerLimit 75W
		DevCtl:	CorrErr+ NonFatalErr+ FatalErr+ UnsupReq+
			RlxdOrd+ ExtTag+ PhantFunc- AuxPwr- NoSnoop+
			MaxPayload 128 bytes, MaxReadReq 512 bytes
		DevSta:	CorrErr+ NonFatalErr- FatalErr- UnsupReq+ AuxPwr- TransPend-
		LnkCap:	Port #0, Speed 8GT/s, Width x16, ASPM L0s L1, Exit Latency L0s <1us, L1 <4us
			ClockPM+ Surprise- LLActRep- BwNot- ASPMOptComp+
		LnkCtl:	ASPM Disabled; RCB 64 bytes, Disabled- CommClk+
			ExtSynch- ClockPM- AutWidDis- BWInt- AutBWInt-
		LnkSta:	Speed 8GT/s, Width x16
			TrErr- Train- SlotClk+ DLActive- BWMgmt- ABWMgmt-
		DevCap2: Completion Timeout: Range AB, TimeoutDis+ NROPrPrP- LTR+
			 10BitTagComp- 10BitTagReq- OBFF Via message, ExtFmt- EETLPPrefix-
			 EmergencyPowerReduction Not Supported, EmergencyPowerReductionInit-
			 FRS- TPHComp- ExtTPHComp-
			 AtomicOpsCap: 32bit- 64bit- 128bitCAS-
		DevCtl2: Completion Timeout: 50us to 50ms, TimeoutDis- LTR- 10BitTagReq- OBFF Disabled,
			 AtomicOpsCtl: ReqEn-
		LnkSta2: Current De-emphasis Level: -6dB, EqualizationComplete- EqualizationPhase1-
			 EqualizationPhase2- EqualizationPhase3- LinkEqualizationRequest-
			 Retimer- 2Retimers- CrosslinkRes: unsupported
	Capabilities: [100 v2] Advanced Error Reporting
		UESta:	DLP- SDES- TLP- FCP- CmpltTO- CmpltAbrt- UnxCmplt- RxOF- MalfTLP- ECRC- UnsupReq- ACSViol-
		UEMsk:	DLP- SDES- TLP- FCP- CmpltTO- CmpltAbrt- UnxCmplt- RxOF- MalfTLP- ECRC- UnsupReq- ACSViol-
		UESvrt:	DLP+ SDES+ TLP- FCP+ CmpltTO- CmpltAbrt- UnxCmplt- RxOF+ MalfTLP+ ECRC- UnsupReq- ACSViol-
		CESta:	RxErr- BadTLP- BadDLLP- Rollover- Timeout- AdvNonFatalErr-
		CEMsk:	RxErr- BadTLP- BadDLLP- Rollover- Timeout- AdvNonFatalErr+
		AERCap:	First Error Pointer: 00, ECRCGenCap- ECRCGenEn- ECRCChkCap- ECRCChkEn-
			MultHdrRecCap- MultHdrRecEn- TLPPfxPres- HdrLogCap-
		HeaderLog: 00000000 00000000 00000000 00000000
	Kernel driver in use: snd_hda_intel

01:00.2 USB controller [0c03]: NVIDIA Corporation TU104 USB 3.1 Host Controller [10de:1ad8] (rev a1) (prog-if 30 [XHCI])
	Subsystem: Gigabyte Technology Co., Ltd Device [1458:37c5]
	Control: I/O- Mem+ BusMaster- SpecCycle- MemWINV- VGASnoop- ParErr- Stepping- SERR- FastB2B- DisINTx+
	Status: Cap+ 66MHz- UDF- FastB2B- ParErr- DEVSEL=fast >TAbort- <TAbort- <MAbort- >SERR- <PERR- INTx-
	Interrupt: pin C routed to IRQ 135
	Region 0: Memory at 4012000000 (64-bit, prefetchable) [size=256K]
	Region 3: Memory at 4012040000 (64-bit, prefetchable) [size=64K]
	Capabilities: [68] MSI: Enable+ Count=1/1 Maskable- 64bit+
		Address: 00000000fee00418  Data: 0000
	Capabilities: [78] Express (v2) Endpoint, MSI 00
		DevCap:	MaxPayload 128 bytes, PhantFunc 0, Latency L0s unlimited, L1 <64us
			ExtTag+ AttnBtn- AttnInd- PwrInd- RBE+ FLReset- SlotPowerLimit 75W
		DevCtl:	CorrErr+ NonFatalErr+ FatalErr+ UnsupReq+
			RlxdOrd+ ExtTag+ PhantFunc- AuxPwr- NoSnoop+
			MaxPayload 128 bytes, MaxReadReq 512 bytes
		DevSta:	CorrErr+ NonFatalErr+ FatalErr- UnsupReq+ AuxPwr- TransPend-
		LnkCap:	Port #0, Speed 8GT/s, Width x16, ASPM L0s L1, Exit Latency L0s <1us, L1 <4us
			ClockPM+ Surprise- LLActRep- BwNot- ASPMOptComp+
		LnkCtl:	ASPM Disabled; RCB 64 bytes, Disabled- CommClk+
			ExtSynch- ClockPM- AutWidDis- BWInt- AutBWInt-
		LnkSta:	Speed 8GT/s, Width x16
			TrErr- Train- SlotClk+ DLActive- BWMgmt- ABWMgmt-
		DevCap2: Completion Timeout: Range AB, TimeoutDis+ NROPrPrP- LTR+
			 10BitTagComp- 10BitTagReq- OBFF Via message, ExtFmt- EETLPPrefix-
			 EmergencyPowerReduction Not Supported, EmergencyPowerReductionInit-
			 FRS- TPHComp- ExtTPHComp-
			 AtomicOpsCap: 32bit- 64bit- 128bitCAS-
		DevCtl2: Completion Timeout: 50us to 50ms, TimeoutDis- LTR- 10BitTagReq- OBFF Disabled,
			 AtomicOpsCtl: ReqEn-
		LnkSta2: Current De-emphasis Level: -6dB, EqualizationComplete- EqualizationPhase1-
			 EqualizationPhase2- EqualizationPhase3- LinkEqualizationRequest-
			 Retimer- 2Retimers- CrosslinkRes: unsupported
	Capabilities: [b4] Power Management version 3
		Flags: PMEClk- DSI- D1- D2- AuxCurrent=55mA PME(D0+,D1-,D2-,D3hot+,D3cold-)
		Status: D3 NoSoftRst+ PME-Enable+ DSel=0 DScale=0 PME-
	Capabilities: [100 v2] Advanced Error Reporting
		UESta:	DLP- SDES- TLP- FCP- CmpltTO- CmpltAbrt- UnxCmplt- RxOF- MalfTLP- ECRC- UnsupReq- ACSViol-
		UEMsk:	DLP- SDES- TLP- FCP- CmpltTO- CmpltAbrt- UnxCmplt- RxOF- MalfTLP- ECRC- UnsupReq- ACSViol-
		UESvrt:	DLP+ SDES+ TLP- FCP+ CmpltTO- CmpltAbrt- UnxCmplt- RxOF+ MalfTLP+ ECRC- UnsupReq- ACSViol-
		CESta:	RxErr- BadTLP- BadDLLP- Rollover- Timeout- AdvNonFatalErr-
		CEMsk:	RxErr- BadTLP- BadDLLP- Rollover- Timeout- AdvNonFatalErr+
		AERCap:	First Error Pointer: 00, ECRCGenCap- ECRCGenEn- ECRCChkCap- ECRCChkEn-
			MultHdrRecCap- MultHdrRecEn- TLPPfxPres- HdrLogCap-
		HeaderLog: 00000000 00000000 00000000 00000000
	Kernel driver in use: xhci_hcd

01:00.3 Serial bus controller [0c80]: NVIDIA Corporation TU104 USB Type-C UCSI Controller [10de:1ad9] (rev a1)
	Subsystem: Gigabyte Technology Co., Ltd Device [1458:37c5]
	Control: I/O- Mem+ BusMaster+ SpecCycle- MemWINV- VGASnoop- ParErr- Stepping- SERR- FastB2B- DisINTx+
	Status: Cap+ 66MHz- UDF- FastB2B- ParErr- DEVSEL=fast >TAbort- <TAbort- <MAbort- >SERR- <PERR- INTx-
	Latency: 0, Cache Line Size: 64 bytes
	Interrupt: pin D routed to IRQ 172
	Region 0: Memory at a1084000 (32-bit, non-prefetchable) [size=4K]
	Capabilities: [68] MSI: Enable+ Count=1/1 Maskable- 64bit+
		Address: 00000000fee008b8  Data: 0000
	Capabilities: [78] Express (v2) Endpoint, MSI 00
		DevCap:	MaxPayload 128 bytes, PhantFunc 0, Latency L0s unlimited, L1 <64us
			ExtTag+ AttnBtn- AttnInd- PwrInd- RBE+ FLReset- SlotPowerLimit 75W
		DevCtl:	CorrErr+ NonFatalErr+ FatalErr+ UnsupReq+
			RlxdOrd+ ExtTag+ PhantFunc- AuxPwr- NoSnoop+
			MaxPayload 128 bytes, MaxReadReq 512 bytes
		DevSta:	CorrErr+ NonFatalErr- FatalErr- UnsupReq+ AuxPwr- TransPend-
		LnkCap:	Port #0, Speed 8GT/s, Width x16, ASPM L0s L1, Exit Latency L0s <1us, L1 <4us
			ClockPM+ Surprise- LLActRep- BwNot- ASPMOptComp+
		LnkCtl:	ASPM Disabled; RCB 64 bytes, Disabled- CommClk+
			ExtSynch- ClockPM- AutWidDis- BWInt- AutBWInt-
		LnkSta:	Speed 8GT/s, Width x16
			TrErr- Train- SlotClk+ DLActive- BWMgmt- ABWMgmt-
		DevCap2: Completion Timeout: Range AB, TimeoutDis+ NROPrPrP- LTR+
			 10BitTagComp- 10BitTagReq- OBFF Via message, ExtFmt- EETLPPrefix-
			 EmergencyPowerReduction Not Supported, EmergencyPowerReductionInit-
			 FRS- TPHComp- ExtTPHComp-
			 AtomicOpsCap: 32bit- 64bit- 128bitCAS-
		DevCtl2: Completion Timeout: 50us to 50ms, TimeoutDis- LTR- 10BitTagReq- OBFF Disabled,
			 AtomicOpsCtl: ReqEn-
		LnkSta2: Current De-emphasis Level: -6dB, EqualizationComplete- EqualizationPhase1-
			 EqualizationPhase2- EqualizationPhase3- LinkEqualizationRequest-
			 Retimer- 2Retimers- CrosslinkRes: unsupported
	Capabilities: [b4] Power Management version 3
		Flags: PMEClk- DSI- D1- D2- AuxCurrent=55mA PME(D0+,D1-,D2-,D3hot+,D3cold-)
		Status: D3 NoSoftRst+ PME-Enable+ DSel=0 DScale=0 PME-
	Capabilities: [100 v2] Advanced Error Reporting
		UESta:	DLP- SDES- TLP- FCP- CmpltTO- CmpltAbrt- UnxCmplt- RxOF- MalfTLP- ECRC- UnsupReq- ACSViol-
		UEMsk:	DLP- SDES- TLP- FCP- CmpltTO- CmpltAbrt- UnxCmplt- RxOF- MalfTLP- ECRC- UnsupReq- ACSViol-
		UESvrt:	DLP+ SDES+ TLP- FCP+ CmpltTO- CmpltAbrt- UnxCmplt- RxOF+ MalfTLP+ ECRC- UnsupReq- ACSViol-
		CESta:	RxErr- BadTLP- BadDLLP- Rollover- Timeout- AdvNonFatalErr-
		CEMsk:	RxErr- BadTLP- BadDLLP- Rollover- Timeout- AdvNonFatalErr+
		AERCap:	First Error Pointer: 00, ECRCGenCap- ECRCGenEn- ECRCChkCap- ECRCChkEn-
			MultHdrRecCap- MultHdrRecEn- TLPPfxPres- HdrLogCap-
		HeaderLog: 00000000 00000000 00000000 00000000
	Kernel driver in use: nvidia-gpu

02:00.0 Non-Volatile memory controller [0108]: Samsung Electronics Co Ltd NVMe SSD Controller SM981/PM981/PM983 [144d:a808] (prog-if 02 [NVM Express])
	Subsystem: Samsung Electronics Co Ltd SSD 970 EVO Plus 1TB [144d:a801]
	Control: I/O- Mem+ BusMaster+ SpecCycle- MemWINV- VGASnoop- ParErr- Stepping- SERR- FastB2B- DisINTx+
	Status: Cap+ 66MHz- UDF- FastB2B- ParErr- DEVSEL=fast >TAbort- <TAbort- <MAbort- >SERR- <PERR- INTx-
	Latency: 0, Cache Line Size: 64 bytes
	Interrupt: pin A routed to IRQ 16
	NUMA node: 0
	Region 0: Memory at a1900000 (64-bit, non-prefetchable) [size=16K]
	Capabilities: [40] Power Management version 3
		Flags: PMEClk- DSI- D1- D2- AuxCurrent=0mA PME(D0-,D1-,D2-,D3hot-,D3cold-)
		Status: D0 NoSoftRst+ PME-Enable- DSel=0 DScale=0 PME-
	Capabilities: [50] MSI: Enable- Count=1/1 Maskable- 64bit+
		Address: 0000000000000000  Data: 0000
	Capabilities: [70] Express (v2) Endpoint, MSI 00
		DevCap:	MaxPayload 256 bytes, PhantFunc 0, Latency L0s unlimited, L1 unlimited
			ExtTag- AttnBtn- AttnInd- PwrInd- RBE+ FLReset+ SlotPowerLimit 75W
		DevCtl:	CorrErr+ NonFatalErr+ FatalErr+ UnsupReq+
			RlxdOrd+ ExtTag- PhantFunc- AuxPwr- NoSnoop+ FLReset-
			MaxPayload 256 bytes, MaxReadReq 512 bytes
		DevSta:	CorrErr- NonFatalErr- FatalErr- UnsupReq- AuxPwr- TransPend-
		LnkCap:	Port #0, Speed 8GT/s, Width x4, ASPM L1, Exit Latency L1 <64us
			ClockPM+ Surprise- LLActRep- BwNot- ASPMOptComp+
		LnkCtl:	ASPM Disabled; RCB 64 bytes, Disabled- CommClk+
			ExtSynch- ClockPM- AutWidDis- BWInt- AutBWInt-
		LnkSta:	Speed 8GT/s, Width x4
			TrErr- Train- SlotClk+ DLActive- BWMgmt- ABWMgmt-
		DevCap2: Completion Timeout: Range ABCD, TimeoutDis+ NROPrPrP- LTR+
			 10BitTagComp- 10BitTagReq- OBFF Not Supported, ExtFmt- EETLPPrefix-
			 EmergencyPowerReduction Not Supported, EmergencyPowerReductionInit-
			 FRS- TPHComp- ExtTPHComp-
			 AtomicOpsCap: 32bit- 64bit- 128bitCAS-
		DevCtl2: Completion Timeout: 50us to 50ms, TimeoutDis- LTR+ 10BitTagReq- OBFF Disabled,
			 AtomicOpsCtl: ReqEn-
		LnkCap2: Supported Link Speeds: 2.5-8GT/s, Crosslink- Retimer- 2Retimers- DRS-
		LnkCtl2: Target Link Speed: 8GT/s, EnterCompliance- SpeedDis-
			 Transmit Margin: Normal Operating Range, EnterModifiedCompliance- ComplianceSOS-
			 Compliance Preset/De-emphasis: -6dB de-emphasis, 0dB preshoot
		LnkSta2: Current De-emphasis Level: -6dB, EqualizationComplete+ EqualizationPhase1+
			 EqualizationPhase2+ EqualizationPhase3+ LinkEqualizationRequest-
			 Retimer- 2Retimers- CrosslinkRes: unsupported
	Capabilities: [b0] MSI-X: Enable+ Count=33 Masked-
		Vector table: BAR=0 offset=00003000
		PBA: BAR=0 offset=00002000
	Capabilities: [100 v2] Advanced Error Reporting
		UESta:	DLP- SDES- TLP- FCP- CmpltTO- CmpltAbrt- UnxCmplt- RxOF- MalfTLP- ECRC- UnsupReq- ACSViol-
		UEMsk:	DLP- SDES- TLP- FCP- CmpltTO- CmpltAbrt- UnxCmplt- RxOF- MalfTLP- ECRC- UnsupReq- ACSViol-
		UESvrt:	DLP+ SDES+ TLP- FCP+ CmpltTO- CmpltAbrt- UnxCmplt- RxOF+ MalfTLP+ ECRC- UnsupReq- ACSViol-
		CESta:	RxErr- BadTLP- BadDLLP- Rollover- Timeout- AdvNonFatalErr-
		CEMsk:	RxErr- BadTLP- BadDLLP- Rollover- Timeout- AdvNonFatalErr+
		AERCap:	First Error Pointer: 00, ECRCGenCap+ ECRCGenEn- ECRCChkCap+ ECRCChkEn-
			MultHdrRecCap+ MultHdrRecEn- TLPPfxPres- HdrLogCap-
		HeaderLog: 00000000 00000000 00000000 00000000
	Capabilities: [148 v1] Device Serial Number ...
	Capabilities: [158 v1] Power Budgeting <?>
	Capabilities: [168 v1] Secondary PCI Express
		LnkCtl3: LnkEquIntrruptEn- PerformEqu-
		LaneErrStat: 0
	Capabilities: [188 v1] Latency Tolerance Reporting
		Max snoop latency: 3145728ns
		Max no snoop latency: 3145728ns
	Capabilities: [190 v1] L1 PM Substates
		L1SubCap: PCI-PM_L1.2+ PCI-PM_L1.1+ ASPM_L1.2+ ASPM_L1.1+ L1_PM_Substates+
			  PortCommonModeRestoreTime=10us PortTPowerOnTime=10us
		L1SubCtl1: PCI-PM_L1.2- PCI-PM_L1.1- ASPM_L1.2- ASPM_L1.1-
			   T_CommonMode=0us LTR1.2_Threshold=30720ns
		L1SubCtl2: T_PwrOn=10us
	Kernel driver in use: nvme

04:00.0 Ethernet controller [0200]: Intel Corporation Ethernet Controller I225-V [8086:15f3] (rev 03)
	Subsystem: ASUSTeK Computer Inc. Device [1043:87d2]
	Control: I/O- Mem+ BusMaster+ SpecCycle- MemWINV- VGASnoop- ParErr- Stepping- SERR- FastB2B- DisINTx+
	Status: Cap+ 66MHz- UDF- FastB2B- ParErr- DEVSEL=fast >TAbort- <TAbort- <MAbort- >SERR- <PERR- INTx-
	Latency: 0, Cache Line Size: 64 bytes
	Interrupt: pin A routed to IRQ 18
	Region 0: Memory at a1500000 (32-bit, non-prefetchable) [size=1M]
	Region 3: Memory at a1600000 (32-bit, non-prefetchable) [size=16K]
	Capabilities: [40] Power Management version 3
		Flags: PMEClk- DSI+ D1- D2- AuxCurrent=0mA PME(D0+,D1-,D2-,D3hot+,D3cold+)
		Status: D0 NoSoftRst+ PME-Enable- DSel=0 DScale=1 PME-
	Capabilities: [50] MSI: Enable- Count=1/1 Maskable+ 64bit+
		Address: 0000000000000000  Data: 0000
		Masking: 00000000  Pending: 00000000
	Capabilities: [70] MSI-X: Enable+ Count=5 Masked-
		Vector table: BAR=3 offset=00000000
		PBA: BAR=3 offset=00002000
	Capabilities: [a0] Express (v2) Endpoint, MSI 00
		DevCap:	MaxPayload 512 bytes, PhantFunc 0, Latency L0s <512ns, L1 <64us
			ExtTag- AttnBtn- AttnInd- PwrInd- RBE+ FLReset+ SlotPowerLimit 0W
		DevCtl:	CorrErr+ NonFatalErr+ FatalErr+ UnsupReq+
			RlxdOrd+ ExtTag- PhantFunc- AuxPwr- NoSnoop+ FLReset-
			MaxPayload 256 bytes, MaxReadReq 512 bytes
		DevSta:	CorrErr- NonFatalErr- FatalErr- UnsupReq- AuxPwr+ TransPend-
		LnkCap:	Port #0, Speed 5GT/s, Width x1, ASPM L1, Exit Latency L1 <4us
			ClockPM- Surprise- LLActRep- BwNot- ASPMOptComp+
		LnkCtl:	ASPM Disabled; RCB 64 bytes, Disabled- CommClk+
			ExtSynch- ClockPM- AutWidDis- BWInt- AutBWInt-
		LnkSta:	Speed 5GT/s, Width x1
			TrErr- Train- SlotClk+ DLActive- BWMgmt- ABWMgmt-
		DevCap2: Completion Timeout: Range ABCD, TimeoutDis+ NROPrPrP- LTR+
			 10BitTagComp- 10BitTagReq- OBFF Not Supported, ExtFmt- EETLPPrefix-
			 EmergencyPowerReduction Not Supported, EmergencyPowerReductionInit-
			 FRS- TPHComp- ExtTPHComp-
			 AtomicOpsCap: 32bit- 64bit- 128bitCAS-
		DevCtl2: Completion Timeout: 50us to 50ms, TimeoutDis- LTR+ 10BitTagReq- OBFF Disabled,
			 AtomicOpsCtl: ReqEn-
		LnkCtl2: Target Link Speed: 5GT/s, EnterCompliance- SpeedDis-
			 Transmit Margin: Normal Operating Range, EnterModifiedCompliance- ComplianceSOS-
			 Compliance Preset/De-emphasis: -6dB de-emphasis, 0dB preshoot
		LnkSta2: Current De-emphasis Level: -6dB, EqualizationComplete- EqualizationPhase1-
			 EqualizationPhase2- EqualizationPhase3- LinkEqualizationRequest-
			 Retimer- 2Retimers- CrosslinkRes: unsupported
	Capabilities: [100 v2] Advanced Error Reporting
		UESta:	DLP- SDES- TLP- FCP- CmpltTO- CmpltAbrt- UnxCmplt- RxOF- MalfTLP- ECRC- UnsupReq- ACSViol-
		UEMsk:	DLP- SDES- TLP- FCP- CmpltTO- CmpltAbrt- UnxCmplt- RxOF- MalfTLP- ECRC- UnsupReq- ACSViol-
		UESvrt:	DLP+ SDES+ TLP- FCP+ CmpltTO- CmpltAbrt- UnxCmplt- RxOF+ MalfTLP+ ECRC- UnsupReq- ACSViol-
		CESta:	RxErr- BadTLP- BadDLLP- Rollover- Timeout- AdvNonFatalErr-
		CEMsk:	RxErr- BadTLP- BadDLLP- Rollover- Timeout- AdvNonFatalErr+
		AERCap:	First Error Pointer: 00, ECRCGenCap+ ECRCGenEn- ECRCChkCap+ ECRCChkEn-
			MultHdrRecCap- MultHdrRecEn- TLPPfxPres- HdrLogCap-
		HeaderLog: 00000000 00000000 00000000 00000000
	Capabilities: [140 v1] Device Serial Number ...
	Capabilities: [1c0 v1] Latency Tolerance Reporting
		Max snoop latency: 3145728ns
		Max no snoop latency: 3145728ns
	Capabilities: [1f0 v1] Precision Time Measurement
		PTMCap: Requester:+ Responder:- Root:-
		PTMClockGranularity: 4ns
		PTMControl: Enabled:+ RootSelected:-
		PTMEffectiveGranularity: 4ns
	Capabilities: [1e0 v1] L1 PM Substates
		L1SubCap: PCI-PM_L1.2- PCI-PM_L1.1+ ASPM_L1.2- ASPM_L1.1+ L1_PM_Substates+
		L1SubCtl1: PCI-PM_L1.2- PCI-PM_L1.1- ASPM_L1.2- ASPM_L1.1-
		L1SubCtl2:
	Kernel driver in use: igc

05:00.0 Non-Volatile memory controller [0108]: Samsung Electronics Co Ltd NVMe SSD Controller SM981/PM981/PM983 [144d:a808] (prog-if 02 [NVM Express])
	Subsystem: Samsung Electronics Co Ltd SSD 970 EVO Plus 1TB [144d:a801]
	Control: I/O- Mem+ BusMaster+ SpecCycle- MemWINV- VGASnoop- ParErr- Stepping- SERR- FastB2B- DisINTx+
	Status: Cap+ 66MHz- UDF- FastB2B- ParErr- DEVSEL=fast >TAbort- <TAbort- <MAbort- >SERR- <PERR- INTx-
	Latency: 0, Cache Line Size: 64 bytes
	Interrupt: pin A routed to IRQ 16
	NUMA node: 0
	Region 0: Memory at a1800000 (64-bit, non-prefetchable) [size=16K]
	Capabilities: [40] Power Management version 3
		Flags: PMEClk- DSI- D1- D2- AuxCurrent=0mA PME(D0-,D1-,D2-,D3hot-,D3cold-)
		Status: D0 NoSoftRst+ PME-Enable- DSel=0 DScale=0 PME-
	Capabilities: [50] MSI: Enable- Count=1/1 Maskable- 64bit+
		Address: 0000000000000000  Data: 0000
	Capabilities: [70] Express (v2) Endpoint, MSI 00
		DevCap:	MaxPayload 256 bytes, PhantFunc 0, Latency L0s unlimited, L1 unlimited
			ExtTag- AttnBtn- AttnInd- PwrInd- RBE+ FLReset+ SlotPowerLimit 25W
		DevCtl:	CorrErr+ NonFatalErr+ FatalErr+ UnsupReq+
			RlxdOrd+ ExtTag- PhantFunc- AuxPwr- NoSnoop+ FLReset-
			MaxPayload 256 bytes, MaxReadReq 512 bytes
		DevSta:	CorrErr- NonFatalErr- FatalErr- UnsupReq- AuxPwr- TransPend-
		LnkCap:	Port #0, Speed 8GT/s, Width x4, ASPM L1, Exit Latency L1 <64us
			ClockPM+ Surprise- LLActRep- BwNot- ASPMOptComp+
		LnkCtl:	ASPM Disabled; RCB 64 bytes, Disabled- CommClk+
			ExtSynch- ClockPM- AutWidDis- BWInt- AutBWInt-
		LnkSta:	Speed 8GT/s, Width x4
			TrErr- Train- SlotClk+ DLActive- BWMgmt- ABWMgmt-
		DevCap2: Completion Timeout: Range ABCD, TimeoutDis+ NROPrPrP- LTR+
			 10BitTagComp- 10BitTagReq- OBFF Not Supported, ExtFmt- EETLPPrefix-
			 EmergencyPowerReduction Not Supported, EmergencyPowerReductionInit-
			 FRS- TPHComp- ExtTPHComp-
			 AtomicOpsCap: 32bit- 64bit- 128bitCAS-
		DevCtl2: Completion Timeout: 50us to 50ms, TimeoutDis- LTR+ 10BitTagReq- OBFF Disabled,
			 AtomicOpsCtl: ReqEn-
		LnkCap2: Supported Link Speeds: 2.5-8GT/s, Crosslink- Retimer- 2Retimers- DRS-
		LnkCtl2: Target Link Speed: 8GT/s, EnterCompliance- SpeedDis-
			 Transmit Margin: Normal Operating Range, EnterModifiedCompliance- ComplianceSOS-
			 Compliance Preset/De-emphasis: -6dB de-emphasis, 0dB preshoot
		LnkSta2: Current De-emphasis Level: -6dB, EqualizationComplete+ EqualizationPhase1+
			 EqualizationPhase2+ EqualizationPhase3+ LinkEqualizationRequest-
			 Retimer- 2Retimers- CrosslinkRes: unsupported
	Capabilities: [b0] MSI-X: Enable+ Count=33 Masked-
		Vector table: BAR=0 offset=00003000
		PBA: BAR=0 offset=00002000
	Capabilities: [100 v2] Advanced Error Reporting
		UESta:	DLP- SDES- TLP- FCP- CmpltTO- CmpltAbrt- UnxCmplt- RxOF- MalfTLP- ECRC- UnsupReq- ACSViol-
		UEMsk:	DLP- SDES- TLP- FCP- CmpltTO- CmpltAbrt- UnxCmplt- RxOF- MalfTLP- ECRC- UnsupReq- ACSViol-
		UESvrt:	DLP+ SDES+ TLP- FCP+ CmpltTO- CmpltAbrt- UnxCmplt- RxOF+ MalfTLP+ ECRC- UnsupReq- ACSViol-
		CESta:	RxErr- BadTLP- BadDLLP- Rollover- Timeout- AdvNonFatalErr-
		CEMsk:	RxErr- BadTLP- BadDLLP- Rollover- Timeout- AdvNonFatalErr+
		AERCap:	First Error Pointer: 00, ECRCGenCap+ ECRCGenEn- ECRCChkCap+ ECRCChkEn-
			MultHdrRecCap+ MultHdrRecEn- TLPPfxPres- HdrLogCap-
		HeaderLog: 00000000 00000000 00000000 00000000
	Capabilities: [148 v1] Device Serial Number ...
	Capabilities: [158 v1] Power Budgeting <?>
	Capabilities: [168 v1] Secondary PCI Express
		LnkCtl3: LnkEquIntrruptEn- PerformEqu-
		LaneErrStat: 0
	Capabilities: [188 v1] Latency Tolerance Reporting
		Max snoop latency: 3145728ns
		Max no snoop latency: 3145728ns
	Capabilities: [190 v1] L1 PM Substates
		L1SubCap: PCI-PM_L1.2+ PCI-PM_L1.1+ ASPM_L1.2+ ASPM_L1.1+ L1_PM_Substates+
			  PortCommonModeRestoreTime=10us PortTPowerOnTime=10us
		L1SubCtl1: PCI-PM_L1.2- PCI-PM_L1.1- ASPM_L1.2- ASPM_L1.1-
			   T_CommonMode=0us LTR1.2_Threshold=30720ns
		L1SubCtl2: T_PwrOn=10us
	Kernel driver in use: nvme

07:00.0 Network controller [0280]: Broadcom Inc. and subsidiaries BCM4352 802.11ac Wireless Network Adapter [14e4:43b1] (rev 03)
	Subsystem: ASUSTeK Computer Inc. Device [1043:85ba]
	Control: I/O- Mem+ BusMaster+ SpecCycle- MemWINV- VGASnoop- ParErr- Stepping- SERR- FastB2B- DisINTx-
	Status: Cap+ 66MHz- UDF- FastB2B- ParErr- DEVSEL=fast >TAbort- <TAbort- <MAbort- >SERR- <PERR- INTx-
	Latency: 0, Cache Line Size: 64 bytes
	Interrupt: pin A routed to IRQ 16
	Region 0: Memory at a1400000 (64-bit, non-prefetchable) [size=32K]
	Region 2: Memory at a1200000 (64-bit, non-prefetchable) [size=2M]
	Capabilities: [48] Power Management version 3
		Flags: PMEClk- DSI- D1+ D2+ AuxCurrent=0mA PME(D0+,D1+,D2+,D3hot+,D3cold+)
		Status: D0 NoSoftRst+ PME-Enable- DSel=0 DScale=2 PME-
	Capabilities: [58] MSI: Enable- Count=1/1 Maskable- 64bit+
		Address: 0000000000000000  Data: 0000
	Capabilities: [68] Vendor Specific Information: Len=44 <?>
	Capabilities: [ac] Express (v2) Endpoint, MSI 00
		DevCap:	MaxPayload 256 bytes, PhantFunc 0, Latency L0s <4us, L1 unlimited
			ExtTag- AttnBtn- AttnInd- PwrInd- RBE+ FLReset- SlotPowerLimit 25W
		DevCtl:	CorrErr+ NonFatalErr+ FatalErr+ UnsupReq+
			RlxdOrd+ ExtTag- PhantFunc- AuxPwr+ NoSnoop+
			MaxPayload 256 bytes, MaxReadReq 1024 bytes
		DevSta:	CorrErr- NonFatalErr- FatalErr- UnsupReq- AuxPwr+ TransPend-
		LnkCap:	Port #0, Speed 2.5GT/s, Width x1, ASPM L0s L1, Exit Latency L0s <2us, L1 <32us
			ClockPM+ Surprise- LLActRep- BwNot- ASPMOptComp+
		LnkCtl:	ASPM Disabled; RCB 64 bytes, Disabled- CommClk+
			ExtSynch- ClockPM- AutWidDis- BWInt- AutBWInt-
		LnkSta:	Speed 2.5GT/s, Width x1
			TrErr- Train- SlotClk+ DLActive- BWMgmt- ABWMgmt-
		DevCap2: Completion Timeout: Range ABCD, TimeoutDis+ NROPrPrP- LTR+
			 10BitTagComp- 10BitTagReq- OBFF Via WAKE#, ExtFmt- EETLPPrefix-
			 EmergencyPowerReduction Not Supported, EmergencyPowerReductionInit-
			 FRS- TPHComp- ExtTPHComp-
			 AtomicOpsCap: 32bit- 64bit- 128bitCAS-
		DevCtl2: Completion Timeout: 50us to 50ms, TimeoutDis- LTR+ 10BitTagReq- OBFF Disabled,
			 AtomicOpsCtl: ReqEn-
		LnkCtl2: Target Link Speed: 2.5GT/s, EnterCompliance- SpeedDis-
			 Transmit Margin: Normal Operating Range, EnterModifiedCompliance- ComplianceSOS-
			 Compliance Preset/De-emphasis: -6dB de-emphasis, 0dB preshoot
		LnkSta2: Current De-emphasis Level: -3.5dB, EqualizationComplete- EqualizationPhase1-
			 EqualizationPhase2- EqualizationPhase3- LinkEqualizationRequest-
			 Retimer- 2Retimers- CrosslinkRes: unsupported
	Capabilities: [100 v1] Advanced Error Reporting
		UESta:	DLP- SDES- TLP- FCP- CmpltTO- CmpltAbrt- UnxCmplt- RxOF- MalfTLP- ECRC- UnsupReq- ACSViol-
		UEMsk:	DLP- SDES- TLP- FCP- CmpltTO- CmpltAbrt- UnxCmplt- RxOF- MalfTLP- ECRC- UnsupReq- ACSViol-
		UESvrt:	DLP+ SDES+ TLP- FCP+ CmpltTO- CmpltAbrt- UnxCmplt- RxOF+ MalfTLP+ ECRC- UnsupReq- ACSViol-
		CESta:	RxErr- BadTLP- BadDLLP- Rollover- Timeout- AdvNonFatalErr-
		CEMsk:	RxErr- BadTLP- BadDLLP- Rollover- Timeout- AdvNonFatalErr+
		AERCap:	First Error Pointer: 00, ECRCGenCap+ ECRCGenEn- ECRCChkCap+ ECRCChkEn-
			MultHdrRecCap- MultHdrRecEn- TLPPfxPres- HdrLogCap-
		HeaderLog: 00000000 00000000 00000000 00000000
	Capabilities: [13c v1] Device Serial Number ...
	Capabilities: [150 v1] Power Budgeting <?>
	Capabilities: [160 v1] Virtual Channel
		Caps:	LPEVC=0 RefClk=100ns PATEntryBits=1
		Arb:	Fixed- WRR32- WRR64- WRR128-
		Ctrl:	ArbSelect=Fixed
		Status:	InProgress-
		VC0:	Caps:	PATOffset=00 MaxTimeSlots=1 RejSnoopTrans-
			Arb:	Fixed- WRR32- WRR64- WRR128- TWRR128- WRR256-
			Ctrl:	Enable+ ID=0 ArbSelect=Fixed TC/VC=ff
			Status:	NegoPending- InProgress-
	Capabilities: [1b0 v1] Latency Tolerance Reporting
		Max snoop latency: 3145728ns
		Max no snoop latency: 3145728ns
	Capabilities: [220 v1] Physical Resizable BAR
		BAR 2: current size: 2MB, supported: 1MB 2MB
	Kernel driver in use: wl

08:00.0 Non-Volatile memory controller [0108]: Samsung Electronics Co Ltd NVMe SSD Controller SM981/PM981/PM983 [144d:a808] (prog-if 02 [NVM Express])
	Subsystem: Samsung Electronics Co Ltd SSD 970 EVO Plus 1TB [144d:a801]
	Control: I/O- Mem+ BusMaster+ SpecCycle- MemWINV- VGASnoop- ParErr- Stepping- SERR- FastB2B- DisINTx+
	Status: Cap+ 66MHz- UDF- FastB2B- ParErr- DEVSEL=fast >TAbort- <TAbort- <MAbort- >SERR- <PERR- INTx-
	Latency: 0, Cache Line Size: 64 bytes
	Interrupt: pin A routed to IRQ 16
	NUMA node: 0
	Region 0: Memory at a1700000 (64-bit, non-prefetchable) [size=16K]
	Capabilities: [40] Power Management version 3
		Flags: PMEClk- DSI- D1- D2- AuxCurrent=0mA PME(D0-,D1-,D2-,D3hot-,D3cold-)
		Status: D0 NoSoftRst+ PME-Enable- DSel=0 DScale=0 PME-
	Capabilities: [50] MSI: Enable- Count=1/1 Maskable- 64bit+
		Address: 0000000000000000  Data: 0000
	Capabilities: [70] Express (v2) Endpoint, MSI 00
		DevCap:	MaxPayload 256 bytes, PhantFunc 0, Latency L0s unlimited, L1 unlimited
			ExtTag- AttnBtn- AttnInd- PwrInd- RBE+ FLReset+ SlotPowerLimit 25W
		DevCtl:	CorrErr+ NonFatalErr+ FatalErr+ UnsupReq+
			RlxdOrd+ ExtTag- PhantFunc- AuxPwr- NoSnoop+ FLReset-
			MaxPayload 256 bytes, MaxReadReq 512 bytes
		DevSta:	CorrErr- NonFatalErr- FatalErr- UnsupReq- AuxPwr- TransPend-
		LnkCap:	Port #0, Speed 8GT/s, Width x4, ASPM L1, Exit Latency L1 <64us
			ClockPM+ Surprise- LLActRep- BwNot- ASPMOptComp+
		LnkCtl:	ASPM Disabled; RCB 64 bytes, Disabled- CommClk+
			ExtSynch- ClockPM- AutWidDis- BWInt- AutBWInt-
		LnkSta:	Speed 8GT/s, Width x4
			TrErr- Train- SlotClk+ DLActive- BWMgmt- ABWMgmt-
		DevCap2: Completion Timeout: Range ABCD, TimeoutDis+ NROPrPrP- LTR+
			 10BitTagComp- 10BitTagReq- OBFF Not Supported, ExtFmt- EETLPPrefix-
			 EmergencyPowerReduction Not Supported, EmergencyPowerReductionInit-
			 FRS- TPHComp- ExtTPHComp-
			 AtomicOpsCap: 32bit- 64bit- 128bitCAS-
		DevCtl2: Completion Timeout: 50us to 50ms, TimeoutDis- LTR+ 10BitTagReq- OBFF Disabled,
			 AtomicOpsCtl: ReqEn-
		LnkCap2: Supported Link Speeds: 2.5-8GT/s, Crosslink- Retimer- 2Retimers- DRS-
		LnkCtl2: Target Link Speed: 8GT/s, EnterCompliance- SpeedDis-
			 Transmit Margin: Normal Operating Range, EnterModifiedCompliance- ComplianceSOS-
			 Compliance Preset/De-emphasis: -6dB de-emphasis, 0dB preshoot
		LnkSta2: Current De-emphasis Level: -6dB, EqualizationComplete+ EqualizationPhase1+
			 EqualizationPhase2+ EqualizationPhase3+ LinkEqualizationRequest-
			 Retimer- 2Retimers- CrosslinkRes: unsupported
	Capabilities: [b0] MSI-X: Enable+ Count=33 Masked-
		Vector table: BAR=0 offset=00003000
		PBA: BAR=0 offset=00002000
	Capabilities: [100 v2] Advanced Error Reporting
		UESta:	DLP- SDES- TLP- FCP- CmpltTO- CmpltAbrt- UnxCmplt- RxOF- MalfTLP- ECRC- UnsupReq- ACSViol-
		UEMsk:	DLP- SDES- TLP- FCP- CmpltTO- CmpltAbrt- UnxCmplt- RxOF- MalfTLP- ECRC- UnsupReq- ACSViol-
		UESvrt:	DLP+ SDES+ TLP- FCP+ CmpltTO- CmpltAbrt- UnxCmplt- RxOF+ MalfTLP+ ECRC- UnsupReq- ACSViol-
		CESta:	RxErr- BadTLP- BadDLLP- Rollover- Timeout- AdvNonFatalErr-
		CEMsk:	RxErr- BadTLP- BadDLLP- Rollover- Timeout- AdvNonFatalErr+
		AERCap:	First Error Pointer: 00, ECRCGenCap+ ECRCGenEn- ECRCChkCap+ ECRCChkEn-
			MultHdrRecCap+ MultHdrRecEn- TLPPfxPres- HdrLogCap-
		HeaderLog: 00000000 00000000 00000000 00000000
	Capabilities: [148 v1] Device Serial Number ...
	Capabilities: [158 v1] Power Budgeting <?>
	Capabilities: [168 v1] Secondary PCI Express
		LnkCtl3: LnkEquIntrruptEn- PerformEqu-
		LaneErrStat: 0
	Capabilities: [188 v1] Latency Tolerance Reporting
		Max snoop latency: 3145728ns
		Max no snoop latency: 3145728ns
	Capabilities: [190 v1] L1 PM Substates
		L1SubCap: PCI-PM_L1.2+ PCI-PM_L1.1+ ASPM_L1.2+ ASPM_L1.1+ L1_PM_Substates+
			  PortCommonModeRestoreTime=10us PortTPowerOnTime=10us
		L1SubCtl1: PCI-PM_L1.2- PCI-PM_L1.1- ASPM_L1.2- ASPM_L1.1-
			   T_CommonMode=0us LTR1.2_Threshold=30720ns
		L1SubCtl2: T_PwrOn=10us
	Kernel driver in use: nvme

