00:00.0 Host bridge [0600]: VIA Technologies, Inc. CN700/VN800/P4M800CE/Pro Host Bridge [1106:0314]
	Subsystem: VIA Technologies, Inc. CN700/VN800/P4M800CE/Pro Host Bridge [1106:0314]
	Control: I/O- Mem+ BusMaster+ SpecCycle- MemWINV- VGASnoop- ParErr- Stepping- SERR- FastB2B- DisINTx-
	Status: Cap+ 66MHz+ UDF- FastB2B- ParErr- DEVSEL=medium >TAbort- <TAbort- <MAbort+ >SERR- <PERR- INTx-
	Latency: 8
	Region 0: Memory at e8000000 (32-bit, prefetchable) [size=128M]
	Capabilities: [80] AGP version 3.5
		Status: RQ=8 Iso- ArqSz=0 Cal=0 SBA+ ITACoh- GART64- HTrans- 64bit- FW- AGP3+ Rate=x4,x8
		Command: RQ=1 ArqSz=0 Cal=0 SBA- AGP- GART64- 64bit- FW- Rate=<none>
	Capabilities: [50] Power Management version 2
		Flags: PMEClk- DSI- D1- D2- AuxCurrent=0mA PME(D0-,D1-,D2-,D3hot-,D3cold-)
		Status: D0 NoSoftRst- PME-Enable- DSel=0 DScale=0 PME-
	Kernel driver in use: agpgart-via

00:00.1 Host bridge [0600]: VIA Technologies, Inc. CN700/VN800/P4M800CE/Pro Host Bridge [1106:1314]
	Control: I/O- Mem+ BusMaster+ SpecCycle- MemWINV- VGASnoop- ParErr- Stepping- SERR- FastB2B- DisINTx-
	Status: Cap- 66MHz- UDF- FastB2B- ParErr- DEVSEL=medium >TAbort- <TAbort- <MAbort- >SERR- <PERR- INTx-
	Latency: 0

00:00.2 Host bridge [0600]: VIA Technologies, Inc. CN700/VN800/P4M800CE/Pro Host Bridge [1106:2314]
	Control: I/O- Mem+ BusMaster+ SpecCycle- MemWINV- VGASnoop- ParErr- Stepping- SERR- FastB2B- DisINTx-
	Status: Cap- 66MHz- UDF- FastB2B- ParErr- DEVSEL=medium >TAbort- <TAbort- <MAbort- >SERR- <PERR- INTx-
	Latency: 0

00:00.3 Host bridge [0600]: VIA Technologies, Inc. PT890 Host Bridge [1106:3208]
	Control: I/O- Mem+ BusMaster+ SpecCycle- MemWINV- VGASnoop- ParErr- Stepping- SERR- FastB2B- DisINTx-
	Status: Cap- 66MHz- UDF- FastB2B- ParErr- DEVSEL=medium >TAbort- <TAbort- <MAbort- >SERR- <PERR- INTx-
	Latency: 0

00:00.4 Host bridge [0600]: VIA Technologies, Inc. CN700/VN800/P4M800CE/Pro Host Bridge [1106:4314]
	Control: I/O- Mem+ BusMaster+ SpecCycle- MemWINV- VGASnoop- ParErr- Stepping- SERR- FastB2B- DisINTx-
	Status: Cap- 66MHz- UDF- FastB2B- ParErr- DEVSEL=medium >TAbort- <TAbort- <MAbort- >SERR- <PERR- INTx-
	Latency: 0

00:00.7 Host bridge [0600]: VIA Technologies, Inc. CN700/VN800/P4M800CE/Pro Host Bridge [1106:7314]
	Control: I/O- Mem+ BusMaster+ SpecCycle- MemWINV- VGASnoop- ParErr- Stepping- SERR- FastB2B- DisINTx-
	Status: Cap- 66MHz- UDF- FastB2B- ParErr- DEVSEL=medium >TAbort- <TAbort- <MAbort- >SERR- <PERR- INTx-
	Latency: 0

00:01.0 PCI bridge [0604]: VIA Technologies, Inc. VT8237/VX700 PCI Bridge [1106:b198] (prog-if 00 [Normal decode])
	Control: I/O+ Mem+ BusMaster+ SpecCycle- MemWINV- VGASnoop- ParErr- Stepping- SERR- FastB2B- DisINTx-
	Status: Cap+ 66MHz+ UDF- FastB2B- ParErr- DEVSEL=medium >TAbort- <TAbort- <MAbort- >SERR- <PERR- INTx-
	Latency: 0
	Bus: primary=00, secondary=01, subordinate=01, sec-latency=0
	I/O behind bridge: 0000d000-0000dfff [size=4K]
	Memory behind bridge: fb000000-fcffffff [size=32M]
	Prefetchable memory behind bridge: f4000000-f7ffffff [size=64M]
	Secondary status: 66MHz+ FastB2B- ParErr- DEVSEL=medium >TAbort- <TAbort- <MAbort+ <SERR+ <PERR+
	BridgeCtl: Parity- SERR+ NoISA- VGA+ VGA16- MAbort- >Reset- FastB2B-
		PriDiscTmr- SecDiscTmr- DiscTmrStat- DiscTmrSERREn-
	Capabilities: [70] Power Management version 2
		Flags: PMEClk- DSI- D1+ D2- AuxCurrent=0mA PME(D0-,D1-,D2-,D3hot-,D3cold-)
		Status: D0 NoSoftRst- PME-Enable- DSel=0 DScale=0 PME-

00:0a.0 FireWire (IEEE 1394) [0c00]: VIA Technologies, Inc. VT6306/7/8 [Fire II(M)] IEEE 1394 OHCI Controller [1106:3044] (rev 80) (prog-if 10 [OHCI])
	Subsystem: VIA Technologies, Inc. VT6306/7/8 [Fire II(M)] IEEE 1394 OHCI Controller [1106:3044]
	Control: I/O+ Mem+ BusMaster+ SpecCycle- MemWINV- VGASnoop- ParErr- Stepping+ SERR- FastB2B- DisINTx-
	Status: Cap+ 66MHz- UDF- FastB2B- ParErr- DEVSEL=medium >TAbort- <TAbort- <MAbort- >SERR- <PERR- INTx-
	Latency: 32 (8000ns max), Cache Line Size: 64 bytes
	Interrupt: pin A routed to IRQ 19
	Region 0: Memory at fdfff000 (32-bit, non-prefetchable) [size=2K]
	Region 1: I/O ports at ff00 [size=128]
	Capabilities: [50] Power Management version 2
		Flags: PMEClk- DSI- D1- D2+ AuxCurrent=0mA PME(D0-,D1-,D2+,D3hot+,D3cold+)
		Status: D0 NoSoftRst- PME-Enable- DSel=0 DScale=0 PME-
	Kernel driver in use: firewire_ohci
	Kernel modules: firewire_ohci

00:0b.0 Ethernet controller [0200]: Realtek Semiconductor Co., Ltd. RTL-8110SC/8169SC Gigabit Ethernet [10ec:8167] (rev 10)
	Subsystem: Jetway Information Co., Ltd. RTL-8110SC/8169SC Gigabit Ethernet [16f3:10ec]
	Control: I/O+ Mem+ BusMaster+ SpecCycle- MemWINV+ VGASnoop- ParErr- Stepping- SERR- FastB2B- DisINTx-
	Status: Cap+ 66MHz+ UDF- FastB2B+ ParErr- DEVSEL=medium >TAbort- <TAbort- <MAbort- >SERR- <PERR- INTx-
	Latency: 64 (8000ns min, 16000ns max), Cache Line Size: 32 bytes
	Interrupt: pin A routed to IRQ 19
	Region 0: I/O ports at f000 [size=256]
	Region 1: Memory at fdffe000 (32-bit, non-prefetchable) [size=256]
	Expansion ROM at 3bf00000 [virtual] [disabled] [size=128K]
	Capabilities: [dc] Power Management version 2
		Flags: PMEClk- DSI- D1+ D2+ AuxCurrent=375mA PME(D0-,D1+,D2+,D3hot+,D3cold+)
		Status: D0 NoSoftRst- PME-Enable- DSel=0 DScale=0 PME-
	Kernel driver in use: r8169
	Kernel modules: r8169

00:0f.0 IDE interface [0101]: VIA Technologies, Inc. VIA VT6420 SATA RAID Controller [1106:3149] (rev 80) (prog-if 8f [PCI native mode controller, supports both channels switched to ISA compatibility mode, supports bus mastering])
	Subsystem: VIA Technologies, Inc. VIA VT6420 SATA RAID Controller [1106:3149]
	Control: I/O+ Mem+ BusMaster+ SpecCycle- MemWINV- VGASnoop- ParErr- Stepping- SERR- FastB2B- DisINTx-
	Status: Cap+ 66MHz- UDF- FastB2B+ ParErr- DEVSEL=medium >TAbort- <TAbort- <MAbort- >SERR- <PERR- INTx-
	Latency: 32
	Interrupt: pin B routed to IRQ 20
	Region 0: I/O ports at fe00 [size=8]
	Region 1: I/O ports at fd00 [size=4]
	Region 2: I/O ports at fc00 [size=8]
	Region 3: I/O ports at fb00 [size=4]
	Region 4: I/O ports at fa00 [size=16]
	Region 5: I/O ports at f200 [size=256]
	Capabilities: [c0] Power Management version 2
		Flags: PMEClk- DSI- D1- D2- AuxCurrent=0mA PME(D0-,D1-,D2-,D3hot-,D3cold-)
		Status: D0 NoSoftRst- PME-Enable- DSel=0 DScale=0 PME-
	Kernel driver in use: sata_via
	Kernel modules: sata_via, ata_generic

00:0f.1 IDE interface [0101]: VIA Technologies, Inc. VT82C586A/B/VT82C686/A/B/VT823x/A/C PIPC Bus Master IDE [1106:0571] (rev 06) (prog-if 8a [ISA Compatibility mode controller, supports both channels switched to PCI native mode, supports bus mastering])
	Subsystem: VIA Technologies, Inc. VT82C586/B/VT82C686/A/B/VT8233/A/C/VT8235 PIPC Bus Master IDE [1106:0571]
	Control: I/O+ Mem+ BusMaster+ SpecCycle- MemWINV- VGASnoop- ParErr- Stepping- SERR- FastB2B- DisINTx-
	Status: Cap+ 66MHz- UDF- FastB2B+ ParErr- DEVSEL=medium >TAbort- <TAbort- <MAbort- >SERR- <PERR- INTx-
	Latency: 32
	Interrupt: pin A routed to IRQ 20
	Region 0: Memory at 000001f0 (32-bit, non-prefetchable) [virtual] [size=8]
	Region 1: Memory at 000003f0 (type 3, non-prefetchable) [virtual]
	Region 2: Memory at 00000170 (32-bit, non-prefetchable) [virtual] [size=8]
	Region 3: Memory at 00000370 (type 3, non-prefetchable) [virtual]
	Region 4: I/O ports at f900 [virtual] [size=16]
	Capabilities: [c0] Power Management version 2
		Flags: PMEClk- DSI- D1- D2- AuxCurrent=0mA PME(D0-,D1-,D2-,D3hot-,D3cold-)
		Status: D0 NoSoftRst- PME-Enable- DSel=0 DScale=0 PME-
	Kernel driver in use: pata_via
	Kernel modules: pata_via, ata_generic

00:10.0 USB controller [0c03]: VIA Technologies, Inc. VT82xx/62xx UHCI USB 1.1 Controller [1106:3038] (rev 81) (prog-if 00 [UHCI])
	Subsystem: VIA Technologies, Inc. VT82xx/62xx UHCI USB 1.1 Controller [1106:3038]
	Control: I/O+ Mem+ BusMaster+ SpecCycle- MemWINV- VGASnoop- ParErr- Stepping- SERR- FastB2B- DisINTx-
	Status: Cap+ 66MHz- UDF- FastB2B- ParErr- DEVSEL=medium >TAbort- <TAbort- <MAbort- >SERR- <PERR- INTx-
	Latency: 32, Cache Line Size: 64 bytes
	Interrupt: pin A routed to IRQ 21
	Region 4: I/O ports at f800 [size=32]
	Capabilities: [80] Power Management version 2
		Flags: PMEClk- DSI- D1+ D2+ AuxCurrent=375mA PME(D0+,D1+,D2+,D3hot+,D3cold+)
		Status: D0 NoSoftRst- PME-Enable- DSel=0 DScale=0 PME-
	Kernel driver in use: uhci_hcd
	Kernel modules: uhci_hcd

00:10.1 USB controller [0c03]: VIA Technologies, Inc. VT82xx/62xx UHCI USB 1.1 Controller [1106:3038] (rev 81) (prog-if 00 [UHCI])
	Subsystem: VIA Technologies, Inc. VT82xx/62xx UHCI USB 1.1 Controller [1106:3038]
	Control: I/O+ Mem+ BusMaster+ SpecCycle- MemWINV- VGASnoop- ParErr- Stepping- SERR- FastB2B- DisINTx-
	Status: Cap+ 66MHz- UDF- FastB2B- ParErr- DEVSEL=medium >TAbort- <TAbort- <MAbort- >SERR- <PERR- INTx-
	Latency: 32, Cache Line Size: 64 bytes
	Interrupt: pin A routed to IRQ 21
	Region 4: I/O ports at f700 [size=32]
	Capabilities: [80] Power Management version 2
		Flags: PMEClk- DSI- D1+ D2+ AuxCurrent=375mA PME(D0+,D1+,D2+,D3hot+,D3cold+)
		Status: D0 NoSoftRst- PME-Enable- DSel=0 DScale=0 PME-
	Kernel driver in use: uhci_hcd
	Kernel modules: uhci_hcd

00:10.2 USB controller [0c03]: VIA Technologies, Inc. VT82xx/62xx UHCI USB 1.1 Controller [1106:3038] (rev 81) (prog-if 00 [UHCI])
	Subsystem: VIA Technologies, Inc. VT82xx/62xx UHCI USB 1.1 Controller [1106:3038]
	Control: I/O+ Mem+ BusMaster+ SpecCycle- MemWINV- VGASnoop- ParErr- Stepping- SERR- FastB2B- DisINTx-
	Status: Cap+ 66MHz- UDF- FastB2B- ParErr- DEVSEL=medium >TAbort- <TAbort- <MAbort- >SERR- <PERR- INTx-
	Latency: 32, Cache Line Size: 64 bytes
	Interrupt: pin B routed to IRQ 21
	Region 4: I/O ports at f600 [size=32]
	Capabilities: [80] Power Management version 2
		Flags: PMEClk- DSI- D1+ D2+ AuxCurrent=375mA PME(D0+,D1+,D2+,D3hot+,D3cold+)
		Status: D0 NoSoftRst- PME-Enable- DSel=0 DScale=0 PME-
	Kernel driver in use: uhci_hcd
	Kernel modules: uhci_hcd

00:10.3 USB controller [0c03]: VIA Technologies, Inc. VT82xx/62xx UHCI USB 1.1 Controller [1106:3038] (rev 81) (prog-if 00 [UHCI])
	Subsystem: VIA Technologies, Inc. VT82xx/62xx UHCI USB 1.1 Controller [1106:3038]
	Control: I/O+ Mem+ BusMaster+ SpecCycle- MemWINV- VGASnoop- ParErr- Stepping- SERR- FastB2B- DisINTx-
	Status: Cap+ 66MHz- UDF- FastB2B- ParErr- DEVSEL=medium >TAbort- <TAbort- <MAbort- >SERR- <PERR- INTx-
	Latency: 32, Cache Line Size: 64 bytes
	Interrupt: pin B routed to IRQ 21
	Region 4: I/O ports at f500 [size=32]
	Capabilities: [80] Power Management version 2
		Flags: PMEClk- DSI- D1+ D2+ AuxCurrent=375mA PME(D0+,D1+,D2+,D3hot+,D3cold+)
		Status: D0 NoSoftRst- PME-Enable- DSel=0 DScale=0 PME-
	Kernel driver in use: uhci_hcd
	Kernel modules: uhci_hcd

00:10.4 USB controller [0c03]: VIA Technologies, Inc. USB 2.0 [1106:3104] (rev 86) (prog-if 20 [EHCI])
	Subsystem: VIA Technologies, Inc. USB 2.0 Controller [1106:3104]
	Control: I/O+ Mem+ BusMaster+ SpecCycle- MemWINV+ VGASnoop- ParErr- Stepping- SERR- FastB2B- DisINTx-
	Status: Cap+ 66MHz- UDF- FastB2B- ParErr- DEVSEL=medium >TAbort- <TAbort- <MAbort- >SERR- <PERR- INTx-
	Latency: 32, Cache Line Size: 64 bytes
	Interrupt: pin C routed to IRQ 21
	Region 0: Memory at fdffd000 (32-bit, non-prefetchable) [size=256]
	Capabilities: [80] Power Management version 2
		Flags: PMEClk- DSI- D1+ D2+ AuxCurrent=375mA PME(D0+,D1+,D2+,D3hot+,D3cold+)
		Status: D0 NoSoftRst- PME-Enable- DSel=0 DScale=0 PME-
	Kernel driver in use: ehci-pci
	Kernel modules: ehci_pci

00:11.0 ISA bridge [0601]: VIA Technologies, Inc. VT8237 ISA bridge [KT600/K8T800/K8T890 South] [1106:3227]
	Subsystem: VIA Technologies, Inc. DFI KT600-AL / Soltek SL-B9D-FGR Motherboard [1106:3227]
	Control: I/O+ Mem+ BusMaster+ SpecCycle- MemWINV- VGASnoop- ParErr- Stepping+ SERR- FastB2B- DisINTx-
	Status: Cap+ 66MHz- UDF- FastB2B- ParErr- DEVSEL=medium >TAbort- <TAbort- <MAbort- >SERR- <PERR- INTx-
	Latency: 0
	Capabilities: [c0] Power Management version 2
		Flags: PMEClk- DSI- D1- D2- AuxCurrent=0mA PME(D0-,D1-,D2-,D3hot-,D3cold-)
		Status: D0 NoSoftRst- PME-Enable- DSel=0 DScale=0 PME-
	Kernel modules: i2c_viapro

00:11.5 Multimedia audio controller [0401]: VIA Technologies, Inc. VT8233/A/8235/8237 AC97 Audio Controller [1106:3059] (rev 60)
	Subsystem: Jetway Information Co., Ltd. VT8233/A/8235/8237 AC97 Audio Controller [16f3:4170]
	Control: I/O+ Mem- BusMaster- SpecCycle- MemWINV- VGASnoop- ParErr- Stepping- SERR- FastB2B- DisINTx-
	Status: Cap+ 66MHz- UDF- FastB2B- ParErr- DEVSEL=medium >TAbort- <TAbort- <MAbort- >SERR- <PERR- INTx-
	Interrupt: pin C routed to IRQ 22
	Region 0: I/O ports at ee00 [size=256]
	Capabilities: [c0] Power Management version 2
		Flags: PMEClk- DSI- D1+ D2+ AuxCurrent=0mA PME(D0-,D1-,D2-,D3hot-,D3cold-)
		Status: D0 NoSoftRst- PME-Enable- DSel=0 DScale=0 PME-
	Kernel driver in use: snd_via82xx
	Kernel modules: snd_via82xx

00:12.0 Ethernet controller [0200]: VIA Technologies, Inc. VT6102/VT6103 [Rhine-II] [1106:3065] (rev 78)
	Subsystem: VIA Technologies, Inc. VT6102/6103 [Rhine II] Ethernet Controller [1106:0102]
	Control: I/O+ Mem+ BusMaster+ SpecCycle- MemWINV- VGASnoop- ParErr- Stepping+ SERR- FastB2B- DisINTx-
	Status: Cap+ 66MHz- UDF- FastB2B- ParErr- DEVSEL=medium >TAbort- <TAbort- <MAbort- >SERR- <PERR- INTx-
	Latency: 32 (750ns min, 2000ns max), Cache Line Size: 64 bytes
	Interrupt: pin A routed to IRQ 23
	Region 0: I/O ports at ec00 [size=256]
	Region 1: Memory at fdffc000 (32-bit, non-prefetchable) [size=256]
	Capabilities: [40] Power Management version 2
		Flags: PMEClk- DSI- D1+ D2+ AuxCurrent=0mA PME(D0+,D1+,D2+,D3hot+,D3cold+)
		Status: D0 NoSoftRst- PME-Enable- DSel=0 DScale=0 PME-
	Kernel driver in use: via-rhine
	Kernel modules: via_rhine

01:00.0 VGA compatible controller [0300]: VIA Technologies, Inc. CN700/P4M800 Pro/P4M800 CE/VN800 Graphics [S3 UniChrome Pro] [1106:3344] (rev 01) (prog-if 00 [VGA controller])
	Subsystem: VIA Technologies, Inc. CN700/P4M800 Pro/P4M800 CE/VN800 Graphics [S3 UniChrome Pro] [1106:3344]
	Control: I/O+ Mem+ BusMaster+ SpecCycle- MemWINV- VGASnoop- ParErr- Stepping- SERR- FastB2B- DisINTx-
	Status: Cap+ 66MHz+ UDF- FastB2B- ParErr- DEVSEL=medium >TAbort- <TAbort- <MAbort- >SERR- <PERR- INTx-
	Latency: 32 (500ns min)
	Interrupt: pin A routed to IRQ 10
	Region 0: Memory at f4000000 (32-bit, prefetchable) [size=64M]
	Region 1: Memory at fb000000 (32-bit, non-prefetchable) [size=16M]
	Expansion ROM at 000c0000 [virtual] [disabled] [size=128K]
	Capabilities: [60] Power Management version 2
		Flags: PMEClk- DSI+ D1+ D2+ AuxCurrent=0mA PME(D0-,D1-,D2-,D3hot-,D3cold-)
		Status: D0 NoSoftRst- PME-Enable- DSel=0 DScale=0 PME-
	Capabilities: [70] AGP version 3.0
		Status: RQ=256 Iso- ArqSz=0 Cal=7 SBA+ ITACoh- GART64- HTrans- 64bit- FW- AGP3+ Rate=x4,x8
		Command: RQ=1 ArqSz=0 Cal=0 SBA+ AGP- GART64- 64bit- FW- Rate=<none>

