00:00.0 Host bridge [0600]: Intel Corporation 4 Series Chipset DRAM Controller [8086:2e10] (rev 03)
	Subsystem: Fujitsu Technology Solutions Device [1734:114c]
	Control: I/O- Mem+ BusMaster+ SpecCycle- MemWINV- VGASnoop- ParErr- Stepping- SERR+ FastB2B- DisINTx-
	Status: Cap+ 66MHz- UDF- FastB2B+ ParErr- DEVSEL=fast >TAbort- <TAbort- <MAbort+ >SERR- <PERR- INTx-
	Latency: 0
	Capabilities: <access denied>

00:01.0 PCI bridge [0604]: Intel Corporation 4 Series Chipset PCI Express Root Port [8086:2e11] (rev 03) (prog-if 00 [Normal decode])
	Control: I/O+ Mem+ BusMaster+ SpecCycle- MemWINV- VGASnoop- ParErr- Stepping- SERR+ FastB2B- DisINTx-
	Status: Cap+ 66MHz- UDF- FastB2B- ParErr- DEVSEL=fast >TAbort- <TAbort- <MAbort- >SERR- <PERR- INTx-
	Latency: 0, Cache Line Size: 32 bytes
	Interrupt: pin A routed to IRQ 16
	Bus: primary=00, secondary=01, subordinate=01, sec-latency=0
	I/O behind bridge: 00002000-00002fff [size=4K]
	Memory behind bridge: dd000000-dfffffff [size=48M]
	Prefetchable memory behind bridge: 00000000e0000000-00000000efffffff [size=256M]
	Secondary status: 66MHz- FastB2B- ParErr- DEVSEL=fast >TAbort- <TAbort- <MAbort+ <SERR- <PERR-
	BridgeCtl: Parity- SERR- NoISA- VGA+ VGA16+ MAbort- >Reset- FastB2B-
		PriDiscTmr- SecDiscTmr- DiscTmrStat- DiscTmrSERREn-
	Capabilities: <access denied>
	Kernel driver in use: pcieport
	Kernel modules: shpchp

00:03.0 Communication controller [0780]: Intel Corporation 4 Series Chipset HECI Controller [8086:2e14] (rev 03)
	Subsystem: Fujitsu Technology Solutions Device [1734:114c]
	Control: I/O- Mem+ BusMaster+ SpecCycle- MemWINV- VGASnoop- ParErr- Stepping- SERR- FastB2B- DisINTx+
	Status: Cap+ 66MHz- UDF- FastB2B- ParErr- DEVSEL=fast >TAbort- <TAbort- <MAbort- >SERR- <PERR- INTx-
	Latency: 0
	Interrupt: pin A routed to IRQ 28
	Region 0: Memory at fc224000 (64-bit, non-prefetchable) [size=16]
	Capabilities: <access denied>
	Kernel driver in use: mei_me
	Kernel modules: mei_me

00:03.2 IDE interface [0101]: Intel Corporation 4 Series Chipset PT IDER Controller [8086:2e16] (rev 03) (prog-if 85 [PCI native mode-only controller, supports bus mastering])
	Subsystem: Fujitsu Technology Solutions Device [1734:114c]
	Control: I/O+ Mem- BusMaster+ SpecCycle- MemWINV- VGASnoop- ParErr- Stepping- SERR- FastB2B- DisINTx-
	Status: Cap+ 66MHz+ UDF- FastB2B+ ParErr- DEVSEL=fast >TAbort- <TAbort- <MAbort- >SERR- <PERR- INTx-
	Latency: 0
	Interrupt: pin C routed to IRQ 18
	Region 0: I/O ports at 1c80 [size=8]
	Region 1: I/O ports at 1c74 [size=4]
	Region 2: I/O ports at 1c78 [size=8]
	Region 3: I/O ports at 1c70 [size=4]
	Region 4: I/O ports at 1c20 [size=16]
	Capabilities: <access denied>
	Kernel driver in use: ata_generic
	Kernel modules: pata_acpi

00:03.3 Serial controller [0700]: Intel Corporation 4 Series Chipset Serial KT Controller [8086:2e17] (rev 03) (prog-if 02 [16550])
	Subsystem: Fujitsu Technology Solutions Device [1734:114c]
	Control: I/O+ Mem+ BusMaster+ SpecCycle- MemWINV- VGASnoop- ParErr- Stepping- SERR- FastB2B- DisINTx-
	Status: Cap+ 66MHz+ UDF- FastB2B+ ParErr- DEVSEL=fast >TAbort- <TAbort- <MAbort- >SERR- <PERR- INTx-
	Latency: 0
	Interrupt: pin B routed to IRQ 17
	Region 0: I/O ports at 1c88 [size=8]
	Region 1: Memory at fc226000 (32-bit, non-prefetchable) [size=4K]
	Capabilities: <access denied>
	Kernel driver in use: serial

00:19.0 Ethernet controller [0200]: Intel Corporation 82567LF-3 Gigabit Network Connection [8086:10df] (rev 02)
	Subsystem: Fujitsu Technology Solutions Device [1734:114d]
	Control: I/O+ Mem+ BusMaster+ SpecCycle- MemWINV- VGASnoop- ParErr- Stepping- SERR+ FastB2B- DisINTx+
	Status: Cap+ 66MHz- UDF- FastB2B- ParErr- DEVSEL=fast >TAbort- <TAbort- <MAbort- >SERR- <PERR- INTx-
	Latency: 0
	Interrupt: pin A routed to IRQ 26
	Region 0: Memory at fc200000 (32-bit, non-prefetchable) [size=128K]
	Region 1: Memory at fc227000 (32-bit, non-prefetchable) [size=4K]
	Region 2: I/O ports at 1820 [size=32]
	Capabilities: <access denied>
	Kernel driver in use: e1000e
	Kernel modules: e1000e

00:1a.0 USB controller [0c03]: Intel Corporation 82801JD/DO (ICH10 Family) USB UHCI Controller #4 [8086:3a67] (rev 02) (prog-if 00 [UHCI])
	Subsystem: Fujitsu Technology Solutions Device [1734:114d]
	Control: I/O+ Mem- BusMaster+ SpecCycle- MemWINV- VGASnoop- ParErr- Stepping- SERR- FastB2B- DisINTx-
	Status: Cap+ 66MHz- UDF- FastB2B+ ParErr- DEVSEL=medium >TAbort- <TAbort- <MAbort- >SERR- <PERR- INTx-
	Latency: 0
	Interrupt: pin A routed to IRQ 20
	Region 4: I/O ports at 1840 [size=32]
	Capabilities: <access denied>
	Kernel driver in use: uhci_hcd

00:1a.1 USB controller [0c03]: Intel Corporation 82801JD/DO (ICH10 Family) USB UHCI Controller #5 [8086:3a68] (rev 02) (prog-if 00 [UHCI])
	Subsystem: Fujitsu Technology Solutions Device [1734:114d]
	Control: I/O+ Mem- BusMaster+ SpecCycle- MemWINV- VGASnoop- ParErr- Stepping- SERR- FastB2B- DisINTx-
	Status: Cap+ 66MHz- UDF- FastB2B+ ParErr- DEVSEL=medium >TAbort- <TAbort- <MAbort- >SERR- <PERR- INTx-
	Latency: 0
	Interrupt: pin B routed to IRQ 18
	Region 4: I/O ports at 1860 [size=32]
	Capabilities: <access denied>
	Kernel driver in use: uhci_hcd

00:1a.2 USB controller [0c03]: Intel Corporation 82801JD/DO (ICH10 Family) USB UHCI Controller #6 [8086:3a69] (rev 02) (prog-if 00 [UHCI])
	Subsystem: Fujitsu Technology Solutions Device [1734:114d]
	Control: I/O+ Mem- BusMaster+ SpecCycle- MemWINV- VGASnoop- ParErr- Stepping- SERR- FastB2B- DisINTx-
	Status: Cap+ 66MHz- UDF- FastB2B+ ParErr- DEVSEL=medium >TAbort- <TAbort- <MAbort- >SERR- <PERR- INTx-
	Latency: 0
	Interrupt: pin C routed to IRQ 19
	Region 4: I/O ports at 1880 [size=32]
	Capabilities: <access denied>
	Kernel driver in use: uhci_hcd

00:1a.7 USB controller [0c03]: Intel Corporation 82801JD/DO (ICH10 Family) USB2 EHCI Controller #2 [8086:3a6c] (rev 02) (prog-if 20 [EHCI])
	Subsystem: Fujitsu Technology Solutions Device [1734:114d]
	Control: I/O- Mem+ BusMaster+ SpecCycle- MemWINV- VGASnoop- ParErr- Stepping- SERR+ FastB2B- DisINTx-
	Status: Cap+ 66MHz- UDF- FastB2B+ ParErr- DEVSEL=medium >TAbort- <TAbort- <MAbort- >SERR- <PERR- INTx-
	Latency: 0
	Interrupt: pin B routed to IRQ 18
	Region 0: Memory at fc228000 (32-bit, non-prefetchable) [size=1K]
	Capabilities: <access denied>
	Kernel driver in use: ehci-pci

00:1b.0 Audio device [0403]: Intel Corporation 82801JD/DO (ICH10 Family) HD Audio Controller [8086:3a6e] (rev 02)
	Subsystem: Fujitsu Technology Solutions Device [1734:1157]
	Control: I/O- Mem+ BusMaster+ SpecCycle- MemWINV- VGASnoop- ParErr- Stepping- SERR+ FastB2B- DisINTx-
	Status: Cap+ 66MHz- UDF- FastB2B- ParErr- DEVSEL=fast >TAbort- <TAbort- <MAbort- >SERR- <PERR- INTx-
	Latency: 0, Cache Line Size: 32 bytes
	Interrupt: pin A routed to IRQ 20
	Region 0: Memory at fc220000 (64-bit, non-prefetchable) [size=16K]
	Capabilities: <access denied>
	Kernel driver in use: snd_hda_intel
	Kernel modules: snd_hda_intel

00:1c.0 PCI bridge [0604]: Intel Corporation 82801JD/DO (ICH10 Family) PCI Express Port 1 [8086:3a70] (rev 02) (prog-if 00 [Normal decode])
	Control: I/O+ Mem+ BusMaster+ SpecCycle- MemWINV- VGASnoop- ParErr- Stepping- SERR- FastB2B- DisINTx-
	Status: Cap+ 66MHz- UDF- FastB2B- ParErr- DEVSEL=fast >TAbort- <TAbort- <MAbort- >SERR- <PERR- INTx-
	Latency: 0, Cache Line Size: 32 bytes
	Interrupt: pin A routed to IRQ 18
	Bus: primary=00, secondary=02, subordinate=02, sec-latency=0
	I/O behind bridge: 00003000-00003fff [size=4K]
	Memory behind bridge: c0000000-c01fffff [size=2M]
	Prefetchable memory behind bridge: 00000000c0200000-00000000c03fffff [size=2M]
	Secondary status: 66MHz- FastB2B- ParErr- DEVSEL=fast >TAbort- <TAbort- <MAbort+ <SERR- <PERR-
	BridgeCtl: Parity- SERR- NoISA- VGA- VGA16- MAbort- >Reset- FastB2B-
		PriDiscTmr- SecDiscTmr- DiscTmrStat- DiscTmrSERREn-
	Capabilities: <access denied>
	Kernel driver in use: pcieport
	Kernel modules: shpchp

00:1c.4 PCI bridge [0604]: Intel Corporation 82801JD/DO (ICH10 Family) PCI Express Port 5 [8086:3a78] (rev 02) (prog-if 00 [Normal decode])
	Control: I/O+ Mem+ BusMaster+ SpecCycle- MemWINV- VGASnoop- ParErr- Stepping- SERR- FastB2B- DisINTx-
	Status: Cap+ 66MHz- UDF- FastB2B- ParErr- DEVSEL=fast >TAbort- <TAbort- <MAbort- >SERR- <PERR- INTx-
	Latency: 0, Cache Line Size: 32 bytes
	Interrupt: pin B routed to IRQ 22
	Bus: primary=00, secondary=03, subordinate=03, sec-latency=0
	I/O behind bridge: 00004000-00004fff [size=4K]
	Memory behind bridge: c0400000-c05fffff [size=2M]
	Prefetchable memory behind bridge: 00000000c0600000-00000000c07fffff [size=2M]
	Secondary status: 66MHz- FastB2B- ParErr- DEVSEL=fast >TAbort- <TAbort- <MAbort+ <SERR- <PERR-
	BridgeCtl: Parity- SERR- NoISA- VGA- VGA16- MAbort- >Reset- FastB2B-
		PriDiscTmr- SecDiscTmr- DiscTmrStat- DiscTmrSERREn-
	Capabilities: <access denied>
	Kernel driver in use: pcieport
	Kernel modules: shpchp

00:1d.0 USB controller [0c03]: Intel Corporation 82801JD/DO (ICH10 Family) USB UHCI Controller #1 [8086:3a64] (rev 02) (prog-if 00 [UHCI])
	Subsystem: Fujitsu Technology Solutions Device [1734:114d]
	Control: I/O+ Mem- BusMaster+ SpecCycle- MemWINV- VGASnoop- ParErr- Stepping- SERR- FastB2B- DisINTx-
	Status: Cap+ 66MHz- UDF- FastB2B+ ParErr- DEVSEL=medium >TAbort- <TAbort- <MAbort- >SERR- <PERR- INTx-
	Latency: 0
	Interrupt: pin A routed to IRQ 20
	Region 4: I/O ports at 18a0 [size=32]
	Capabilities: <access denied>
	Kernel driver in use: uhci_hcd

00:1d.1 USB controller [0c03]: Intel Corporation 82801JD/DO (ICH10 Family) USB UHCI Controller #2 [8086:3a65] (rev 02) (prog-if 00 [UHCI])
	Subsystem: Fujitsu Technology Solutions Device [1734:114d]
	Control: I/O+ Mem- BusMaster+ SpecCycle- MemWINV- VGASnoop- ParErr- Stepping- SERR- FastB2B- DisINTx-
	Status: Cap+ 66MHz- UDF- FastB2B+ ParErr- DEVSEL=medium >TAbort- <TAbort- <MAbort- >SERR- <PERR- INTx-
	Latency: 0
	Interrupt: pin B routed to IRQ 22
	Region 4: I/O ports at 18c0 [size=32]
	Capabilities: <access denied>
	Kernel driver in use: uhci_hcd

00:1d.2 USB controller [0c03]: Intel Corporation 82801JD/DO (ICH10 Family) USB UHCI Controller #3 [8086:3a66] (rev 02) (prog-if 00 [UHCI])
	Subsystem: Fujitsu Technology Solutions Device [1734:114d]
	Control: I/O+ Mem- BusMaster+ SpecCycle- MemWINV- VGASnoop- ParErr- Stepping- SERR- FastB2B- DisINTx-
	Status: Cap+ 66MHz- UDF- FastB2B+ ParErr- DEVSEL=medium >TAbort- <TAbort- <MAbort- >SERR- <PERR- INTx-
	Latency: 0
	Interrupt: pin C routed to IRQ 21
	Region 4: I/O ports at 18e0 [size=32]
	Capabilities: <access denied>
	Kernel driver in use: uhci_hcd

00:1d.7 USB controller [0c03]: Intel Corporation 82801JD/DO (ICH10 Family) USB2 EHCI Controller #1 [8086:3a6a] (rev 02) (prog-if 20 [EHCI])
	Subsystem: Fujitsu Technology Solutions Device [1734:114d]
	Control: I/O- Mem+ BusMaster+ SpecCycle- MemWINV- VGASnoop- ParErr- Stepping- SERR+ FastB2B- DisINTx-
	Status: Cap+ 66MHz- UDF- FastB2B+ ParErr- DEVSEL=medium >TAbort- <TAbort- <MAbort- >SERR- <PERR- INTx-
	Latency: 0
	Interrupt: pin A routed to IRQ 20
	Region 0: Memory at fc229000 (32-bit, non-prefetchable) [size=1K]
	Capabilities: <access denied>
	Kernel driver in use: ehci-pci

00:1e.0 PCI bridge [0604]: Intel Corporation 82801 PCI Bridge [8086:244e] (rev a2) (prog-if 01 [Subtractive decode])
	Control: I/O+ Mem+ BusMaster+ SpecCycle- MemWINV- VGASnoop- ParErr- Stepping- SERR+ FastB2B- DisINTx-
	Status: Cap+ 66MHz- UDF- FastB2B- ParErr- DEVSEL=fast >TAbort- <TAbort- <MAbort- >SERR- <PERR- INTx-
	Latency: 0
	Bus: primary=00, secondary=04, subordinate=04, sec-latency=32
	I/O behind bridge: None
	Memory behind bridge: None
	Prefetchable memory behind bridge: None
	Secondary status: 66MHz- FastB2B+ ParErr- DEVSEL=medium >TAbort- <TAbort- <MAbort+ <SERR- <PERR-
	BridgeCtl: Parity- SERR- NoISA+ VGA- VGA16- MAbort- >Reset- FastB2B-
		PriDiscTmr- SecDiscTmr- DiscTmrStat- DiscTmrSERREn-
	Capabilities: <access denied>

00:1f.0 ISA bridge [0601]: Intel Corporation 82801JD (ICH10D) LPC Interface Controller [8086:3a1a] (rev 02)
	Subsystem: Fujitsu Technology Solutions Device [1734:114d]
	Control: I/O+ Mem+ BusMaster+ SpecCycle- MemWINV- VGASnoop- ParErr- Stepping- SERR- FastB2B- DisINTx-
	Status: Cap+ 66MHz- UDF- FastB2B- ParErr- DEVSEL=medium >TAbort- <TAbort- <MAbort- >SERR- <PERR- INTx-
	Latency: 0
	Capabilities: <access denied>
	Kernel driver in use: lpc_ich
	Kernel modules: lpc_ich

00:1f.2 IDE interface [0101]: Intel Corporation 82801JD/DO (ICH10 Family) 4-port SATA IDE Controller [8086:3a00] (rev 02) (prog-if 8a [ISA Compatibility mode controller, supports both channels switched to PCI native mode, supports bus mastering])
	Subsystem: Fujitsu Technology Solutions Device [1734:114d]
	Control: I/O+ Mem+ BusMaster+ SpecCycle- MemWINV- VGASnoop- ParErr- Stepping- SERR- FastB2B- DisINTx-
	Status: Cap+ 66MHz+ UDF- FastB2B+ ParErr- DEVSEL=medium >TAbort- <TAbort- <MAbort- >SERR- <PERR- INTx-
	Latency: 0
	Interrupt: pin B routed to IRQ 19
	Region 0: [virtual] Memory at 000001f0 (32-bit, non-prefetchable) [size=8]
	Region 1: [virtual] Memory at 000003f0 (type 3, non-prefetchable)
	Region 2: [virtual] Memory at 00000170 (32-bit, non-prefetchable) [size=8]
	Region 3: [virtual] Memory at 00000370 (type 3, non-prefetchable)
	Region 4: I/O ports at 1c40 [size=16]
	Region 5: I/O ports at 1c30 [size=16]
	Capabilities: <access denied>
	Kernel driver in use: ata_piix
	Kernel modules: pata_acpi

00:1f.3 SMBus [0c05]: Intel Corporation 82801JD/DO (ICH10 Family) SMBus Controller [8086:3a60] (rev 02)
	Subsystem: Fujitsu Technology Solutions Device [1734:114d]
	Control: I/O+ Mem- BusMaster- SpecCycle- MemWINV- VGASnoop- ParErr- Stepping- SERR- FastB2B- DisINTx-
	Status: Cap- 66MHz- UDF- FastB2B+ ParErr- DEVSEL=medium >TAbort- <TAbort- <MAbort- >SERR- <PERR- INTx-
	Interrupt: pin B routed to IRQ 11
	Region 0: Memory at fc22a000 (64-bit, non-prefetchable) [disabled] [size=256]
	Region 4: I/O ports at 1100 [size=32]
	Kernel modules: i2c_i801

00:1f.5 IDE interface [0101]: Intel Corporation 82801JD/DO (ICH10 Family) 2-port SATA IDE Controller [8086:3a06] (rev 02) (prog-if 85 [PCI native mode-only controller, supports bus mastering])
	Subsystem: Fujitsu Technology Solutions Device [1734:114d]
	Control: I/O+ Mem- BusMaster+ SpecCycle- MemWINV- VGASnoop- ParErr- Stepping- SERR- FastB2B- DisINTx-
	Status: Cap+ 66MHz+ UDF- FastB2B+ ParErr- DEVSEL=medium >TAbort- <TAbort- <MAbort- >SERR- <PERR- INTx-
	Latency: 0
	Interrupt: pin C routed to IRQ 22
	Region 0: I/O ports at 1cb8 [size=8]
	Region 1: I/O ports at 1cac [size=4]
	Region 2: I/O ports at 1cb0 [size=8]
	Region 3: I/O ports at 1ca8 [size=4]
	Region 4: I/O ports at 1c60 [size=16]
	Region 5: I/O ports at 1c50 [size=16]
	Capabilities: <access denied>
	Kernel driver in use: ata_piix
	Kernel modules: pata_acpi

01:00.0 VGA compatible controller [0300]: NVIDIA Corporation G98 [GeForce 9300 GE] [10de:06e0] (rev a1) (prog-if 00 [VGA controller])
	Subsystem: Pegatron Device [1b0a:9008]
	Control: I/O+ Mem+ BusMaster+ SpecCycle- MemWINV- VGASnoop- ParErr- Stepping- SERR+ FastB2B- DisINTx+
	Status: Cap+ 66MHz- UDF- FastB2B- ParErr- DEVSEL=fast >TAbort- <TAbort- <MAbort- >SERR- <PERR- INTx-
	Latency: 0, Cache Line Size: 32 bytes
	Interrupt: pin A routed to IRQ 27
	Region 0: Memory at dd000000 (32-bit, non-prefetchable) [size=16M]
	Region 1: Memory at e0000000 (64-bit, prefetchable) [size=256M]
	Region 3: Memory at de000000 (64-bit, non-prefetchable) [size=32M]
	Region 5: I/O ports at 2000 [size=128]
	[virtual] Expansion ROM at 000c0000 [disabled] [size=128K]
	Capabilities: <access denied>
	Kernel driver in use: nouveau
	Kernel modules: nvidiafb, nouveau

