00:00.0 RAM memory [0500]: NVIDIA Corporation MCP55 Memory Controller [10de:0369] (rev a2)
	Subsystem: Tyan Computer Device [10f1:2915]
	Control: I/O- Mem+ BusMaster+ SpecCycle- MemWINV- VGASnoop- ParErr- Stepping- SERR- FastB2B- DisINTx-
	Status: Cap+ 66MHz+ UDF- FastB2B+ ParErr- DEVSEL=fast >TAbort- <TAbort- <MAbort- >SERR- <PERR- INTx-
	Latency: 0
	NUMA node: 0
	Capabilities: <access denied>

00:01.0 ISA bridge [0601]: NVIDIA Corporation MCP55 LPC Bridge [10de:0364] (rev a3)
	Subsystem: Tyan Computer Device [10f1:2915]
	Control: I/O+ Mem+ BusMaster+ SpecCycle+ MemWINV- VGASnoop- ParErr- Stepping- SERR- FastB2B- DisINTx-
	Status: Cap- 66MHz+ UDF- FastB2B+ ParErr- DEVSEL=fast >TAbort- <TAbort- <MAbort- >SERR- <PERR- INTx-
	Latency: 0
	NUMA node: 0
	Region 0: I/O ports at 1c00 [size=128]

00:01.1 SMBus [0c05]: NVIDIA Corporation MCP55 SMBus Controller [10de:0368] (rev a3)
	Subsystem: Tyan Computer Device [10f1:2915]
	Control: I/O+ Mem- BusMaster- SpecCycle- MemWINV- VGASnoop- ParErr- Stepping- SERR- FastB2B- DisINTx-
	Status: Cap+ 66MHz+ UDF- FastB2B+ ParErr- DEVSEL=fast >TAbort- <TAbort- <MAbort- >SERR- <PERR- INTx-
	Interrupt: pin A routed to IRQ 255
	NUMA node: 0
	Region 0: I/O ports at 2000 [size=64]
	Region 4: I/O ports at 2440 [size=64]
	Region 5: I/O ports at 2400 [size=64]
	Capabilities: <access denied>
	Kernel driver in use: nForce2_smbus
	Kernel modules: i2c_nforce2, nv_tco

00:02.0 USB controller [0c03]: NVIDIA Corporation MCP55 USB Controller [10de:036c] (rev a1) (prog-if 10 [OHCI])
	Subsystem: Tyan Computer Device [10f1:2915]
	Control: I/O+ Mem+ BusMaster+ SpecCycle- MemWINV- VGASnoop- ParErr- Stepping- SERR- FastB2B- DisINTx-
	Status: Cap+ 66MHz+ UDF- FastB2B+ ParErr- DEVSEL=fast >TAbort- <TAbort- <MAbort- >SERR- <PERR- INTx-
	Latency: 0 (750ns min, 250ns max)
	Interrupt: pin A routed to IRQ 23
	NUMA node: 0
	Region 0: Memory at b0004000 (32-bit, non-prefetchable) [size=4K]
	Capabilities: <access denied>
	Kernel driver in use: ohci-pci

00:02.1 USB controller [0c03]: NVIDIA Corporation MCP55 USB Controller [10de:036d] (rev a2) (prog-if 20 [EHCI])
	Subsystem: Tyan Computer Device [10f1:2915]
	Control: I/O- Mem+ BusMaster+ SpecCycle- MemWINV- VGASnoop- ParErr- Stepping- SERR- FastB2B- DisINTx-
	Status: Cap+ 66MHz+ UDF- FastB2B+ ParErr- DEVSEL=fast >TAbort- <TAbort- <MAbort- >SERR- <PERR- INTx-
	Latency: 0 (750ns min, 250ns max)
	Interrupt: pin B routed to IRQ 22
	NUMA node: 0
	Region 0: Memory at b0005000 (32-bit, non-prefetchable) [size=256]
	Capabilities: <access denied>
	Kernel driver in use: ehci-pci

00:04.0 IDE interface [0101]: NVIDIA Corporation MCP55 IDE [10de:036e] (rev a1) (prog-if 8a [ISA Compatibility mode controller, supports both channels switched to PCI native mode, supports bus mastering])
	Subsystem: Tyan Computer Device [10f1:2915]
	Control: I/O+ Mem- BusMaster+ SpecCycle- MemWINV- VGASnoop- ParErr- Stepping- SERR- FastB2B- DisINTx-
	Status: Cap+ 66MHz+ UDF- FastB2B+ ParErr- DEVSEL=fast >TAbort- <TAbort- <MAbort- >SERR- <PERR- INTx-
	Latency: 0 (750ns min, 250ns max)
	NUMA node: 0
	Region 0: [virtual] Memory at 000001f0 (32-bit, non-prefetchable) [size=8]
	Region 1: [virtual] Memory at 000003f0 (type 3, non-prefetchable)
	Region 2: [virtual] Memory at 00000170 (32-bit, non-prefetchable) [size=8]
	Region 3: [virtual] Memory at 00000370 (type 3, non-prefetchable)
	Region 4: I/O ports at 2480 [size=16]
	Capabilities: <access denied>
	Kernel driver in use: pata_amd
	Kernel modules: pata_amd, pata_acpi

00:05.0 IDE interface [0101]: NVIDIA Corporation MCP55 SATA Controller [10de:037f] (rev a3) (prog-if 85 [PCI native mode-only controller, supports bus mastering])
	Subsystem: Tyan Computer Device [10f1:2915]
	Control: I/O+ Mem+ BusMaster+ SpecCycle- MemWINV- VGASnoop- ParErr- Stepping- SERR- FastB2B- DisINTx-
	Status: Cap+ 66MHz+ UDF- FastB2B+ ParErr- DEVSEL=fast >TAbort- <TAbort- <MAbort- >SERR- <PERR- INTx-
	Latency: 0 (750ns min, 250ns max)
	Interrupt: pin A routed to IRQ 21
	NUMA node: 0
	Region 0: I/O ports at 24d0 [size=8]
	Region 1: I/O ports at 24c4 [size=4]
	Region 2: I/O ports at 24c8 [size=8]
	Region 3: I/O ports at 24c0 [size=4]
	Region 4: I/O ports at 2490 [size=16]
	Region 5: Memory at b0006000 (32-bit, non-prefetchable) [size=4K]
	Capabilities: <access denied>
	Kernel driver in use: sata_nv
	Kernel modules: sata_nv, pata_acpi

00:05.1 IDE interface [0101]: NVIDIA Corporation MCP55 SATA Controller [10de:037f] (rev a3) (prog-if 85 [PCI native mode-only controller, supports bus mastering])
	Subsystem: Tyan Computer Device [10f1:2915]
	Control: I/O+ Mem+ BusMaster+ SpecCycle- MemWINV- VGASnoop- ParErr- Stepping- SERR- FastB2B- DisINTx-
	Status: Cap+ 66MHz+ UDF- FastB2B+ ParErr- DEVSEL=fast >TAbort- <TAbort- <MAbort- >SERR- <PERR- INTx-
	Latency: 0 (750ns min, 250ns max)
	Interrupt: pin B routed to IRQ 18
	NUMA node: 0
	Region 0: I/O ports at 24e8 [size=8]
	Region 1: I/O ports at 24dc [size=4]
	Region 2: I/O ports at 24e0 [size=8]
	Region 3: I/O ports at 24d8 [size=4]
	Region 4: I/O ports at 24a0 [size=16]
	Region 5: Memory at b0007000 (32-bit, non-prefetchable) [size=4K]
	Capabilities: <access denied>
	Kernel driver in use: sata_nv
	Kernel modules: sata_nv, pata_acpi

00:05.2 IDE interface [0101]: NVIDIA Corporation MCP55 SATA Controller [10de:037f] (rev a3) (prog-if 85 [PCI native mode-only controller, supports bus mastering])
	Subsystem: Tyan Computer Device [10f1:2915]
	Control: I/O+ Mem+ BusMaster+ SpecCycle- MemWINV- VGASnoop- ParErr- Stepping- SERR- FastB2B- DisINTx-
	Status: Cap+ 66MHz+ UDF- FastB2B+ ParErr- DEVSEL=fast >TAbort- <TAbort- <MAbort- >SERR- <PERR- INTx-
	Latency: 0 (750ns min, 250ns max)
	Interrupt: pin C routed to IRQ 17
	NUMA node: 0
	Region 0: I/O ports at 2800 [size=8]
	Region 1: I/O ports at 24f4 [size=4]
	Region 2: I/O ports at 24f8 [size=8]
	Region 3: I/O ports at 24f0 [size=4]
	Region 4: I/O ports at 24b0 [size=16]
	Region 5: Memory at b0008000 (32-bit, non-prefetchable) [size=4K]
	Capabilities: <access denied>
	Kernel driver in use: sata_nv
	Kernel modules: sata_nv, pata_acpi

00:06.0 PCI bridge [0604]: NVIDIA Corporation MCP55 PCI bridge [10de:0370] (rev a2) (prog-if 01 [Subtractive decode])
	Control: I/O+ Mem+ BusMaster+ SpecCycle- MemWINV- VGASnoop- ParErr- Stepping- SERR+ FastB2B- DisINTx-
	Status: Cap+ 66MHz+ UDF- FastB2B+ ParErr- DEVSEL=fast >TAbort- <TAbort- <MAbort- >SERR- <PERR- INTx-
	Latency: 0
	NUMA node: 0
	Bus: primary=00, secondary=01, subordinate=01, sec-latency=64
	I/O behind bridge: None
	Memory behind bridge: b0100000-b01fffff [size=1M]
	Prefetchable memory behind bridge: None
	Secondary status: 66MHz- FastB2B+ ParErr- DEVSEL=medium >TAbort- <TAbort- <MAbort- <SERR- <PERR-
	BridgeCtl: Parity- SERR+ NoISA+ VGA- VGA16- MAbort- >Reset- FastB2B-
		PriDiscTmr- SecDiscTmr+ DiscTmrStat- DiscTmrSERREn+
	Capabilities: <access denied>

00:06.1 Audio device [0403]: NVIDIA Corporation MCP55 High Definition Audio [10de:0371] (rev a2)
	Subsystem: Tyan Computer Device [10f1:2915]
	Control: I/O- Mem+ BusMaster+ SpecCycle- MemWINV- VGASnoop- ParErr- Stepping- SERR- FastB2B- DisINTx-
	Status: Cap+ 66MHz+ UDF- FastB2B+ ParErr- DEVSEL=fast >TAbort- <TAbort- <MAbort- >SERR- <PERR- INTx-
	Latency: 0 (500ns min, 1250ns max)
	Interrupt: pin B routed to IRQ 23
	NUMA node: 0
	Region 0: Memory at b0000000 (32-bit, non-prefetchable) [size=16K]
	Capabilities: <access denied>
	Kernel driver in use: snd_hda_intel
	Kernel modules: snd_hda_intel

00:08.0 Bridge [0680]: NVIDIA Corporation MCP55 Ethernet [10de:0373] (rev a3)
	Subsystem: Tyan Computer Device [10f1:2915]
	Control: I/O+ Mem+ BusMaster+ SpecCycle- MemWINV- VGASnoop- ParErr- Stepping- SERR- FastB2B- DisINTx+
	Status: Cap+ 66MHz+ UDF- FastB2B+ ParErr- DEVSEL=fast >TAbort- <TAbort- <MAbort- >SERR- <PERR- INTx-
	Latency: 0 (250ns min, 5000ns max)
	Interrupt: pin A routed to IRQ 28
	NUMA node: 0
	Region 0: Memory at b0009000 (32-bit, non-prefetchable) [size=4K]
	Region 1: I/O ports at 2808 [size=8]
	Region 2: Memory at b0005800 (32-bit, non-prefetchable) [size=256]
	Region 3: Memory at b0005400 (32-bit, non-prefetchable) [size=16]
	Capabilities: <access denied>
	Kernel driver in use: forcedeth
	Kernel modules: forcedeth

00:09.0 Bridge [0680]: NVIDIA Corporation MCP55 Ethernet [10de:0373] (rev a3)
	Subsystem: Tyan Computer Device [10f1:2915]
	Control: I/O+ Mem+ BusMaster+ SpecCycle- MemWINV- VGASnoop- ParErr- Stepping- SERR- FastB2B- DisINTx+
	Status: Cap+ 66MHz+ UDF- FastB2B+ ParErr- DEVSEL=fast >TAbort- <TAbort- <MAbort- >SERR- <PERR- INTx-
	Latency: 0 (250ns min, 5000ns max)
	Interrupt: pin A routed to IRQ 29
	NUMA node: 0
	Region 0: Memory at b000b000 (32-bit, non-prefetchable) [size=4K]
	Region 1: I/O ports at 2810 [size=8]
	Region 2: Memory at b000a000 (32-bit, non-prefetchable) [size=256]
	Region 3: Memory at b0005c00 (32-bit, non-prefetchable) [size=16]
	Capabilities: <access denied>
	Kernel driver in use: forcedeth
	Kernel modules: forcedeth

00:0a.0 PCI bridge [0604]: NVIDIA Corporation MCP55 PCI Express bridge [10de:0376] (rev a3) (prog-if 00 [Normal decode])
	Control: I/O+ Mem+ BusMaster+ SpecCycle- MemWINV- VGASnoop- ParErr+ Stepping- SERR+ FastB2B- DisINTx-
	Status: Cap+ 66MHz- UDF- FastB2B- ParErr- DEVSEL=fast >TAbort- <TAbort- <MAbort- >SERR- <PERR- INTx-
	Latency: 0, Cache Line Size: 64 bytes
	NUMA node: 0
	Bus: primary=00, secondary=02, subordinate=02, sec-latency=0
	I/O behind bridge: None
	Memory behind bridge: None
	Prefetchable memory behind bridge: None
	Secondary status: 66MHz- FastB2B- ParErr- DEVSEL=fast >TAbort- <TAbort- <MAbort- <SERR- <PERR-
	BridgeCtl: Parity- SERR+ NoISA+ VGA- VGA16- MAbort- >Reset- FastB2B-
		PriDiscTmr- SecDiscTmr- DiscTmrStat- DiscTmrSERREn-
	Capabilities: <access denied>
	Kernel driver in use: pcieport

00:0d.0 PCI bridge [0604]: NVIDIA Corporation MCP55 PCI Express bridge [10de:0378] (rev a3) (prog-if 00 [Normal decode])
	Control: I/O+ Mem+ BusMaster+ SpecCycle- MemWINV- VGASnoop- ParErr+ Stepping- SERR+ FastB2B- DisINTx-
	Status: Cap+ 66MHz- UDF- FastB2B- ParErr- DEVSEL=fast >TAbort- <TAbort- <MAbort- >SERR- <PERR- INTx-
	Latency: 0, Cache Line Size: 64 bytes
	NUMA node: 0
	Bus: primary=00, secondary=03, subordinate=05, sec-latency=0
	I/O behind bridge: None
	Memory behind bridge: b0200000-b02fffff [size=1M]
	Prefetchable memory behind bridge: None
	Secondary status: 66MHz- FastB2B- ParErr- DEVSEL=fast >TAbort- <TAbort- <MAbort+ <SERR- <PERR-
	BridgeCtl: Parity- SERR+ NoISA+ VGA- VGA16- MAbort- >Reset- FastB2B-
		PriDiscTmr- SecDiscTmr- DiscTmrStat- DiscTmrSERREn-
	Capabilities: <access denied>
	Kernel driver in use: pcieport

00:0f.0 PCI bridge [0604]: NVIDIA Corporation MCP55 PCI Express bridge [10de:0377] (rev a3) (prog-if 00 [Normal decode])
	Control: I/O+ Mem+ BusMaster+ SpecCycle- MemWINV- VGASnoop- ParErr+ Stepping- SERR+ FastB2B- DisINTx-
	Status: Cap+ 66MHz- UDF- FastB2B- ParErr- DEVSEL=fast >TAbort- <TAbort- <MAbort- >SERR- <PERR- INTx-
	Latency: 0, Cache Line Size: 64 bytes
	NUMA node: 0
	Bus: primary=00, secondary=06, subordinate=06, sec-latency=0
	I/O behind bridge: None
	Memory behind bridge: None
	Prefetchable memory behind bridge: None
	Secondary status: 66MHz- FastB2B- ParErr- DEVSEL=fast >TAbort- <TAbort- <MAbort- <SERR- <PERR-
	BridgeCtl: Parity- SERR+ NoISA+ VGA- VGA16- MAbort- >Reset- FastB2B-
		PriDiscTmr- SecDiscTmr- DiscTmrStat- DiscTmrSERREn-
	Capabilities: <access denied>
	Kernel driver in use: pcieport

00:18.0 Host bridge [0600]: Advanced Micro Devices, Inc. [AMD] Family 10h Processor HyperTransport Configuration [1022:1200]
	Control: I/O- Mem- BusMaster- SpecCycle- MemWINV- VGASnoop- ParErr- Stepping- SERR- FastB2B- DisINTx-
	Status: Cap+ 66MHz- UDF- FastB2B- ParErr- DEVSEL=fast >TAbort- <TAbort- <MAbort- >SERR- <PERR- INTx-
	NUMA node: 0
	Capabilities: <access denied>

00:18.1 Host bridge [0600]: Advanced Micro Devices, Inc. [AMD] Family 10h Processor Address Map [1022:1201]
	Control: I/O- Mem- BusMaster- SpecCycle- MemWINV- VGASnoop- ParErr- Stepping- SERR- FastB2B- DisINTx-
	Status: Cap- 66MHz- UDF- FastB2B- ParErr- DEVSEL=fast >TAbort- <TAbort- <MAbort- >SERR- <PERR- INTx-
	NUMA node: 0

00:18.2 Host bridge [0600]: Advanced Micro Devices, Inc. [AMD] Family 10h Processor DRAM Controller [1022:1202]
	Control: I/O- Mem- BusMaster- SpecCycle- MemWINV- VGASnoop- ParErr- Stepping- SERR- FastB2B- DisINTx-
	Status: Cap- 66MHz- UDF- FastB2B- ParErr- DEVSEL=fast >TAbort- <TAbort- <MAbort- >SERR- <PERR- INTx-
	NUMA node: 0

00:18.3 Host bridge [0600]: Advanced Micro Devices, Inc. [AMD] Family 10h Processor Miscellaneous Control [1022:1203]
	Control: I/O- Mem- BusMaster- SpecCycle- MemWINV- VGASnoop- ParErr- Stepping- SERR- FastB2B- DisINTx-
	Status: Cap+ 66MHz- UDF- FastB2B- ParErr- DEVSEL=fast >TAbort- <TAbort- <MAbort- >SERR- <PERR- INTx-
	NUMA node: 0
	Capabilities: <access denied>
	Kernel modules: k10temp

00:18.4 Host bridge [0600]: Advanced Micro Devices, Inc. [AMD] Family 10h Processor Link Control [1022:1204]
	Control: I/O- Mem- BusMaster- SpecCycle- MemWINV- VGASnoop- ParErr- Stepping- SERR- FastB2B- DisINTx-
	Status: Cap- 66MHz- UDF- FastB2B- ParErr- DEVSEL=fast >TAbort- <TAbort- <MAbort- >SERR- <PERR- INTx-
	NUMA node: 0

00:19.0 Host bridge [0600]: Advanced Micro Devices, Inc. [AMD] Family 10h Processor HyperTransport Configuration [1022:1200]
	Control: I/O- Mem- BusMaster- SpecCycle- MemWINV- VGASnoop- ParErr- Stepping- SERR- FastB2B- DisINTx-
	Status: Cap+ 66MHz- UDF- FastB2B- ParErr- DEVSEL=fast >TAbort- <TAbort- <MAbort- >SERR- <PERR- INTx-
	NUMA node: 0
	Capabilities: <access denied>

00:19.1 Host bridge [0600]: Advanced Micro Devices, Inc. [AMD] Family 10h Processor Address Map [1022:1201]
	Control: I/O- Mem- BusMaster- SpecCycle- MemWINV- VGASnoop- ParErr- Stepping- SERR- FastB2B- DisINTx-
	Status: Cap- 66MHz- UDF- FastB2B- ParErr- DEVSEL=fast >TAbort- <TAbort- <MAbort- >SERR- <PERR- INTx-
	NUMA node: 0

00:19.2 Host bridge [0600]: Advanced Micro Devices, Inc. [AMD] Family 10h Processor DRAM Controller [1022:1202]
	Control: I/O- Mem- BusMaster- SpecCycle- MemWINV- VGASnoop- ParErr- Stepping- SERR- FastB2B- DisINTx-
	Status: Cap- 66MHz- UDF- FastB2B- ParErr- DEVSEL=fast >TAbort- <TAbort- <MAbort- >SERR- <PERR- INTx-
	NUMA node: 0

00:19.3 Host bridge [0600]: Advanced Micro Devices, Inc. [AMD] Family 10h Processor Miscellaneous Control [1022:1203]
	Control: I/O- Mem- BusMaster- SpecCycle- MemWINV- VGASnoop- ParErr- Stepping- SERR- FastB2B- DisINTx-
	Status: Cap+ 66MHz- UDF- FastB2B- ParErr- DEVSEL=fast >TAbort- <TAbort- <MAbort- >SERR- <PERR- INTx-
	NUMA node: 0
	Capabilities: <access denied>
	Kernel modules: k10temp

00:19.4 Host bridge [0600]: Advanced Micro Devices, Inc. [AMD] Family 10h Processor Link Control [1022:1204]
	Control: I/O- Mem- BusMaster- SpecCycle- MemWINV- VGASnoop- ParErr- Stepping- SERR- FastB2B- DisINTx-
	Status: Cap- 66MHz- UDF- FastB2B- ParErr- DEVSEL=fast >TAbort- <TAbort- <MAbort- >SERR- <PERR- INTx-
	NUMA node: 0

01:05.0 FireWire (IEEE 1394) [0c00]: Texas Instruments TSB43AB22A IEEE-1394a-2000 Controller (PHY/Link) [iOHCI-Lynx] [104c:8023] (prog-if 10 [OHCI])
	Subsystem: Tyan Computer Device [10f1:2915]
	Control: I/O- Mem+ BusMaster+ SpecCycle- MemWINV+ VGASnoop- ParErr+ Stepping- SERR+ FastB2B- DisINTx-
	Status: Cap+ 66MHz- UDF- FastB2B- ParErr- DEVSEL=medium >TAbort- <TAbort- <MAbort- >SERR- <PERR- INTx-
	Latency: 64 (500ns min, 1000ns max), Cache Line Size: 64 bytes
	Interrupt: pin A routed to IRQ 19
	NUMA node: 0
	Region 0: Memory at b0104000 (32-bit, non-prefetchable) [size=2K]
	Region 1: Memory at b0100000 (32-bit, non-prefetchable) [size=16K]
	Capabilities: <access denied>
	Kernel driver in use: firewire_ohci
	Kernel modules: firewire_ohci

03:00.0 PCI bridge [0604]: NEC Corporation uPD720400 PCI Express - PCI/PCI-X Bridge [1033:0125] (rev 06) (prog-if 00 [Normal decode])
	Control: I/O+ Mem+ BusMaster+ SpecCycle- MemWINV- VGASnoop- ParErr+ Stepping- SERR+ FastB2B- DisINTx-
	Status: Cap+ 66MHz- UDF- FastB2B- ParErr- DEVSEL=fast >TAbort- <TAbort- <MAbort- >SERR- <PERR- INTx-
	Latency: 0, Cache Line Size: 64 bytes
	NUMA node: 0
	Bus: primary=03, secondary=04, subordinate=04, sec-latency=4
	I/O behind bridge: None
	Memory behind bridge: None
	Prefetchable memory behind bridge: None
	Secondary status: 66MHz+ FastB2B- ParErr- DEVSEL=slow >TAbort- <TAbort- <MAbort+ <SERR- <PERR-
	BridgeCtl: Parity- SERR+ NoISA+ VGA- VGA16- MAbort- >Reset- FastB2B-
		PriDiscTmr- SecDiscTmr- DiscTmrStat- DiscTmrSERREn-
	Capabilities: <access denied>

03:00.1 PCI bridge [0604]: NEC Corporation uPD720400 PCI Express - PCI/PCI-X Bridge [1033:0125] (rev 06) (prog-if 00 [Normal decode])
	Control: I/O+ Mem+ BusMaster+ SpecCycle- MemWINV- VGASnoop- ParErr+ Stepping- SERR+ FastB2B- DisINTx-
	Status: Cap+ 66MHz- UDF- FastB2B- ParErr- DEVSEL=fast >TAbort- <TAbort- <MAbort- >SERR- <PERR- INTx-
	Latency: 0, Cache Line Size: 64 bytes
	Interrupt: pin A routed to IRQ 255
	NUMA node: 0
	Region 0: Memory at b0200000 (64-bit, non-prefetchable) [size=128]
	Bus: primary=03, secondary=05, subordinate=05, sec-latency=4
	I/O behind bridge: None
	Memory behind bridge: None
	Prefetchable memory behind bridge: None
	Secondary status: 66MHz+ FastB2B- ParErr- DEVSEL=slow >TAbort- <TAbort- <MAbort+ <SERR- <PERR-
	BridgeCtl: Parity- SERR+ NoISA+ VGA- VGA16- MAbort- >Reset- FastB2B-
		PriDiscTmr- SecDiscTmr- DiscTmrStat- DiscTmrSERREn-
	Capabilities: <access denied>

80:00.0 RAM memory [0500]: NVIDIA Corporation MCP55 Memory Controller [10de:0369] (rev a2)
	Subsystem: Tyan Computer Device [10f1:2915]
	Control: I/O- Mem+ BusMaster+ SpecCycle- MemWINV- VGASnoop- ParErr- Stepping- SERR- FastB2B- DisINTx-
	Status: Cap+ 66MHz+ UDF- FastB2B+ ParErr- DEVSEL=fast >TAbort- <TAbort- <MAbort- >SERR- <PERR- INTx-
	Latency: 0
	Capabilities: <access denied>

80:01.0 RAM memory [0500]: NVIDIA Corporation MCP55 LPC Bridge [10de:0361] (rev a3)
	Subsystem: Tyan Computer Device [10f1:2915]
	Control: I/O+ Mem+ BusMaster+ SpecCycle+ MemWINV- VGASnoop- ParErr- Stepping- SERR- FastB2B- DisINTx-
	Status: Cap- 66MHz+ UDF- FastB2B+ ParErr- DEVSEL=fast >TAbort- <TAbort- <MAbort- >SERR- <PERR- INTx-
	Latency: 0
	Region 0: I/O ports at fc00 [size=128]
	Region 1: Memory at b0500000 (32-bit, non-prefetchable) [size=4K]

80:01.1 SMBus [0c05]: NVIDIA Corporation MCP55 SMBus Controller [10de:0368] (rev a3)
	Subsystem: Tyan Computer Device [10f1:2915]
	Control: I/O+ Mem- BusMaster- SpecCycle- MemWINV- VGASnoop- ParErr- Stepping- SERR- FastB2B- DisINTx-
	Status: Cap+ 66MHz+ UDF- FastB2B+ ParErr- DEVSEL=fast >TAbort- <TAbort- <MAbort- >SERR- <PERR- INTx-
	Interrupt: pin A routed to IRQ 255
	Region 0: I/O ports at 3000 [size=64]
	Region 4: I/O ports at 3440 [size=64]
	Region 5: I/O ports at 3400 [size=64]
	Capabilities: <access denied>
	Kernel driver in use: nForce2_smbus
	Kernel modules: i2c_nforce2, nv_tco

80:0a.0 PCI bridge [0604]: NVIDIA Corporation MCP55 PCI Express bridge [10de:0376] (rev a3) (prog-if 00 [Normal decode])
	Control: I/O+ Mem+ BusMaster+ SpecCycle- MemWINV- VGASnoop- ParErr+ Stepping- SERR+ FastB2B- DisINTx-
	Status: Cap+ 66MHz- UDF- FastB2B- ParErr- DEVSEL=fast >TAbort- <TAbort- <MAbort- >SERR- <PERR- INTx-
	Latency: 0, Cache Line Size: 64 bytes
	Bus: primary=80, secondary=81, subordinate=81, sec-latency=0
	I/O behind bridge: None
	Memory behind bridge: None
	Prefetchable memory behind bridge: None
	Secondary status: 66MHz- FastB2B- ParErr- DEVSEL=fast >TAbort- <TAbort- <MAbort- <SERR- <PERR-
	BridgeCtl: Parity- SERR+ NoISA+ VGA- VGA16- MAbort- >Reset- FastB2B-
		PriDiscTmr- SecDiscTmr- DiscTmrStat- DiscTmrSERREn-
	Capabilities: <access denied>
	Kernel driver in use: pcieport

80:0d.0 PCI bridge [0604]: NVIDIA Corporation MCP55 PCI Express bridge [10de:0378] (rev a3) (prog-if 00 [Normal decode])
	Control: I/O+ Mem+ BusMaster+ SpecCycle- MemWINV- VGASnoop- ParErr+ Stepping- SERR+ FastB2B- DisINTx-
	Status: Cap+ 66MHz- UDF- FastB2B- ParErr- DEVSEL=fast >TAbort- <TAbort- <MAbort- >SERR- <PERR- INTx-
	Latency: 0, Cache Line Size: 64 bytes
	Bus: primary=80, secondary=82, subordinate=82, sec-latency=0
	I/O behind bridge: None
	Memory behind bridge: None
	Prefetchable memory behind bridge: None
	Secondary status: 66MHz- FastB2B- ParErr- DEVSEL=fast >TAbort- <TAbort- <MAbort- <SERR- <PERR-
	BridgeCtl: Parity- SERR+ NoISA+ VGA- VGA16- MAbort- >Reset- FastB2B-
		PriDiscTmr- SecDiscTmr- DiscTmrStat- DiscTmrSERREn-
	Capabilities: <access denied>
	Kernel driver in use: pcieport

80:0f.0 PCI bridge [0604]: NVIDIA Corporation MCP55 PCI Express bridge [10de:0377] (rev a3) (prog-if 00 [Normal decode])
	Control: I/O+ Mem+ BusMaster+ SpecCycle- MemWINV- VGASnoop- ParErr+ Stepping- SERR+ FastB2B- DisINTx-
	Status: Cap+ 66MHz- UDF- FastB2B- ParErr- DEVSEL=fast >TAbort- <TAbort- <MAbort- >SERR- <PERR- INTx-
	Latency: 0, Cache Line Size: 64 bytes
	Bus: primary=80, secondary=83, subordinate=83, sec-latency=0
	I/O behind bridge: 00004000-00004fff [size=4K]
	Memory behind bridge: b0600000-b06fffff [size=1M]
	Prefetchable memory behind bridge: 00000000c0000000-00000000cfffffff [size=256M]
	Secondary status: 66MHz- FastB2B- ParErr- DEVSEL=fast >TAbort- <TAbort- <MAbort+ <SERR- <PERR-
	BridgeCtl: Parity- SERR+ NoISA+ VGA+ VGA16- MAbort- >Reset- FastB2B-
		PriDiscTmr- SecDiscTmr- DiscTmrStat- DiscTmrSERREn-
	Capabilities: <access denied>
	Kernel driver in use: pcieport

83:00.0 VGA compatible controller [0300]: Advanced Micro Devices, Inc. [AMD/ATI] Juniper XT [Radeon HD 5770] [1002:68b8] (prog-if 00 [VGA controller])
	Subsystem: Hewlett-Packard Company Device [103c:6880]
	Control: I/O+ Mem+ BusMaster+ SpecCycle- MemWINV- VGASnoop- ParErr+ Stepping- SERR+ FastB2B- DisINTx+
	Status: Cap+ 66MHz- UDF- FastB2B- ParErr- DEVSEL=fast >TAbort- <TAbort- <MAbort- >SERR- <PERR- INTx-
	Latency: 0, Cache Line Size: 64 bytes
	Interrupt: pin A routed to IRQ 27
	Region 0: Memory at c0000000 (64-bit, prefetchable) [size=256M]
	Region 2: Memory at b0620000 (64-bit, non-prefetchable) [size=128K]
	Region 4: I/O ports at 4000 [size=256]
	[virtual] Expansion ROM at 000c0000 [disabled] [size=128K]
	Capabilities: <access denied>
	Kernel driver in use: radeon
	Kernel modules: radeon

83:00.1 Audio device [0403]: Advanced Micro Devices, Inc. [AMD/ATI] Juniper HDMI Audio [Radeon HD 5700 Series] [1002:aa58]
	Subsystem: Hewlett-Packard Company Device [103c:aa58]
	Control: I/O+ Mem+ BusMaster+ SpecCycle- MemWINV- VGASnoop- ParErr+ Stepping- SERR+ FastB2B- DisINTx+
	Status: Cap+ 66MHz- UDF- FastB2B- ParErr- DEVSEL=fast >TAbort- <TAbort- <MAbort- >SERR- <PERR- INTx-
	Latency: 0, Cache Line Size: 64 bytes
	Interrupt: pin B routed to IRQ 25
	Region 0: Memory at b0600000 (64-bit, non-prefetchable) [size=16K]
	Capabilities: <access denied>
	Kernel driver in use: snd_hda_intel
	Kernel modules: snd_hda_intel

