00:00.0 Host bridge [0600]: Intel Corporation Xeon E3-1200 v2/3rd Gen Core processor DRAM Controller [8086:0150] (rev 09)
	Subsystem: ASUSTeK Computer Inc. P8 series motherboard [1043:84ca]
	Control: I/O- Mem+ BusMaster+ SpecCycle- MemWINV- VGASnoop- ParErr- Stepping- SERR- FastB2B- DisINTx-
	Status: Cap+ 66MHz- UDF- FastB2B+ ParErr- DEVSEL=fast >TAbort- <TAbort- <MAbort+ >SERR- <PERR- INTx-
	Latency: 0
	Capabilities: <access denied>
	Kernel driver in use: ivb_uncore

00:01.0 PCI bridge [0604]: Intel Corporation Xeon E3-1200 v2/3rd Gen Core processor PCI Express Root Port [8086:0151] (rev 09) (prog-if 00 [Normal decode])
	Control: I/O+ Mem+ BusMaster+ SpecCycle- MemWINV- VGASnoop- ParErr- Stepping- SERR- FastB2B- DisINTx+
	Status: Cap+ 66MHz- UDF- FastB2B- ParErr- DEVSEL=fast >TAbort- <TAbort- <MAbort- >SERR- <PERR- INTx-
	Latency: 0, Cache Line Size: 64 bytes
	Interrupt: pin A routed to IRQ 24
	Bus: primary=00, secondary=01, subordinate=01, sec-latency=0
	I/O behind bridge: 0000e000-0000efff [size=4K]
	Memory behind bridge: f6000000-f70fffff [size=17M]
	Prefetchable memory behind bridge: 00000000e0000000-00000000e9ffffff [size=160M]
	Secondary status: 66MHz- FastB2B- ParErr- DEVSEL=fast >TAbort- <TAbort- <MAbort+ <SERR- <PERR-
	BridgeCtl: Parity- SERR+ NoISA- VGA+ VGA16+ MAbort- >Reset- FastB2B-
		PriDiscTmr- SecDiscTmr- DiscTmrStat- DiscTmrSERREn-
	Capabilities: <access denied>
	Kernel driver in use: pcieport

00:02.0 Display controller [0380]: Intel Corporation Xeon E3-1200 v2/3rd Gen Core processor Graphics Controller [8086:0162] (rev 09)
	DeviceName:  Onboard IGD
	Subsystem: ASUSTeK Computer Inc. P8 series motherboard [1043:84ca]
	Control: I/O+ Mem+ BusMaster+ SpecCycle- MemWINV- VGASnoop- ParErr- Stepping- SERR- FastB2B- DisINTx+
	Status: Cap+ 66MHz- UDF- FastB2B+ ParErr- DEVSEL=fast >TAbort- <TAbort- <MAbort- >SERR- <PERR- INTx-
	Latency: 0
	Interrupt: pin A routed to IRQ 33
	Region 0: Memory at f7400000 (64-bit, non-prefetchable) [size=4M]
	Region 2: Memory at d0000000 (64-bit, prefetchable) [size=256M]
	Region 4: I/O ports at f000 [size=64]
	Capabilities: <access denied>
	Kernel driver in use: i915

00:14.0 USB controller [0c03]: Intel Corporation 7 Series/C210 Series Chipset Family USB xHCI Host Controller [8086:1e31] (rev 04) (prog-if 30 [XHCI])
	Subsystem: ASUSTeK Computer Inc. P8 series motherboard [1043:84ca]
	Control: I/O- Mem+ BusMaster+ SpecCycle- MemWINV- VGASnoop- ParErr- Stepping- SERR- FastB2B- DisINTx+
	Status: Cap+ 66MHz- UDF- FastB2B+ ParErr- DEVSEL=medium >TAbort- <TAbort- <MAbort- >SERR- <PERR- INTx-
	Latency: 0
	Interrupt: pin A routed to IRQ 26
	Region 0: Memory at f7900000 (64-bit, non-prefetchable) [size=64K]
	Capabilities: <access denied>
	Kernel driver in use: xhci_hcd

00:16.0 Communication controller [0780]: Intel Corporation 7 Series/C216 Chipset Family MEI Controller #1 [8086:1e3a] (rev 04)
	Subsystem: ASUSTeK Computer Inc. P8 series motherboard [1043:84ca]
	Control: I/O- Mem+ BusMaster+ SpecCycle- MemWINV- VGASnoop- ParErr- Stepping- SERR- FastB2B- DisINTx+
	Status: Cap+ 66MHz- UDF- FastB2B- ParErr- DEVSEL=fast >TAbort- <TAbort- <MAbort- >SERR- <PERR- INTx-
	Latency: 0
	Interrupt: pin A routed to IRQ 35
	Region 0: Memory at f791a000 (64-bit, non-prefetchable) [size=16]
	Capabilities: <access denied>
	Kernel driver in use: mei_me

00:1a.0 USB controller [0c03]: Intel Corporation 7 Series/C216 Chipset Family USB Enhanced Host Controller #2 [8086:1e2d] (rev 04) (prog-if 20 [EHCI])
	Subsystem: ASUSTeK Computer Inc. P8 series motherboard [1043:84ca]
	Control: I/O- Mem+ BusMaster+ SpecCycle- MemWINV- VGASnoop- ParErr- Stepping- SERR- FastB2B- DisINTx-
	Status: Cap+ 66MHz- UDF- FastB2B+ ParErr- DEVSEL=medium >TAbort- <TAbort- <MAbort- >SERR- <PERR- INTx-
	Latency: 0
	Interrupt: pin A routed to IRQ 23
	Region 0: Memory at f7918000 (32-bit, non-prefetchable) [size=1K]
	Capabilities: <access denied>
	Kernel driver in use: ehci-pci

00:1b.0 Audio device [0403]: Intel Corporation 7 Series/C216 Chipset Family High Definition Audio Controller [8086:1e20] (rev 04)
	Subsystem: ASUSTeK Computer Inc. Device [1043:841b]
	Control: I/O- Mem+ BusMaster+ SpecCycle- MemWINV- VGASnoop- ParErr- Stepping- SERR- FastB2B- DisINTx+
	Status: Cap+ 66MHz- UDF- FastB2B- ParErr- DEVSEL=fast >TAbort- <TAbort- <MAbort- >SERR- <PERR- INTx-
	Latency: 0, Cache Line Size: 64 bytes
	Interrupt: pin A routed to IRQ 36
	Region 0: Memory at f7910000 (64-bit, non-prefetchable) [size=16K]
	Capabilities: <access denied>
	Kernel driver in use: snd_hda_intel

00:1c.0 PCI bridge [0604]: Intel Corporation 7 Series/C216 Chipset Family PCI Express Root Port 1 [8086:1e10] (rev c4) (prog-if 00 [Normal decode])
	Control: I/O+ Mem+ BusMaster+ SpecCycle- MemWINV- VGASnoop- ParErr- Stepping- SERR- FastB2B- DisINTx-
	Status: Cap+ 66MHz- UDF- FastB2B- ParErr- DEVSEL=fast >TAbort- <TAbort- <MAbort- >SERR- <PERR- INTx-
	Latency: 0, Cache Line Size: 64 bytes
	Interrupt: pin A routed to IRQ 16
	Bus: primary=00, secondary=02, subordinate=02, sec-latency=0
	I/O behind bridge: 00002000-00002fff [size=4K]
	Memory behind bridge: cf300000-cf4fffff [size=2M]
	Prefetchable memory behind bridge: 00000000cf500000-00000000cf6fffff [size=2M]
	Secondary status: 66MHz- FastB2B- ParErr- DEVSEL=fast >TAbort- <TAbort- <MAbort+ <SERR- <PERR-
	BridgeCtl: Parity- SERR+ NoISA- VGA- VGA16+ MAbort- >Reset- FastB2B-
		PriDiscTmr- SecDiscTmr- DiscTmrStat- DiscTmrSERREn-
	Capabilities: <access denied>
	Kernel driver in use: pcieport

00:1c.4 PCI bridge [0604]: Intel Corporation 7 Series/C210 Series Chipset Family PCI Express Root Port 5 [8086:1e18] (rev c4) (prog-if 00 [Normal decode])
	Control: I/O+ Mem+ BusMaster+ SpecCycle- MemWINV- VGASnoop- ParErr- Stepping- SERR- FastB2B- DisINTx-
	Status: Cap+ 66MHz- UDF- FastB2B- ParErr- DEVSEL=fast >TAbort- <TAbort- <MAbort- >SERR- <PERR- INTx-
	Latency: 0, Cache Line Size: 64 bytes
	Interrupt: pin A routed to IRQ 16
	Bus: primary=00, secondary=03, subordinate=03, sec-latency=0
	I/O behind bridge: 0000d000-0000dfff [size=4K]
	Memory behind bridge: [disabled]
	Prefetchable memory behind bridge: 00000000ea100000-00000000ea1fffff [size=1M]
	Secondary status: 66MHz- FastB2B- ParErr- DEVSEL=fast >TAbort- <TAbort- <MAbort- <SERR- <PERR-
	BridgeCtl: Parity- SERR+ NoISA- VGA- VGA16+ MAbort- >Reset- FastB2B-
		PriDiscTmr- SecDiscTmr- DiscTmrStat- DiscTmrSERREn-
	Capabilities: <access denied>
	Kernel driver in use: pcieport

00:1c.5 PCI bridge [0604]: Intel Corporation 82801 PCI Bridge [8086:244e] (rev c4) (prog-if 01 [Subtractive decode])
	Control: I/O+ Mem+ BusMaster+ SpecCycle- MemWINV- VGASnoop- ParErr- Stepping- SERR- FastB2B- DisINTx-
	Status: Cap+ 66MHz- UDF- FastB2B- ParErr- DEVSEL=fast >TAbort- <TAbort- <MAbort- >SERR- <PERR- INTx-
	Latency: 0, Cache Line Size: 64 bytes
	Interrupt: pin B routed to IRQ 17
	Bus: primary=00, secondary=04, subordinate=05, sec-latency=0
	I/O behind bridge: [disabled]
	Memory behind bridge: [disabled]
	Prefetchable memory behind bridge: [disabled]
	Secondary status: 66MHz- FastB2B- ParErr- DEVSEL=fast >TAbort- <TAbort- <MAbort+ <SERR- <PERR-
	BridgeCtl: Parity- SERR+ NoISA- VGA- VGA16+ MAbort- >Reset- FastB2B-
		PriDiscTmr- SecDiscTmr- DiscTmrStat- DiscTmrSERREn-
	Capabilities: <access denied>
	Kernel driver in use: pcieport

00:1c.7 PCI bridge [0604]: Intel Corporation 7 Series/C210 Series Chipset Family PCI Express Root Port 8 [8086:1e1e] (rev c4) (prog-if 00 [Normal decode])
	Control: I/O+ Mem+ BusMaster+ SpecCycle- MemWINV- VGASnoop- ParErr- Stepping- SERR- FastB2B- DisINTx-
	Status: Cap+ 66MHz- UDF- FastB2B- ParErr- DEVSEL=fast >TAbort- <TAbort- <MAbort- >SERR- <PERR- INTx-
	Latency: 0, Cache Line Size: 64 bytes
	Interrupt: pin D routed to IRQ 19
	Bus: primary=00, secondary=06, subordinate=06, sec-latency=0
	I/O behind bridge: [disabled]
	Memory behind bridge: f7800000-f78fffff [size=1M]
	Prefetchable memory behind bridge: [disabled]
	Secondary status: 66MHz- FastB2B- ParErr- DEVSEL=fast >TAbort- <TAbort- <MAbort- <SERR- <PERR-
	BridgeCtl: Parity- SERR+ NoISA- VGA- VGA16+ MAbort- >Reset- FastB2B-
		PriDiscTmr- SecDiscTmr- DiscTmrStat- DiscTmrSERREn-
	Capabilities: <access denied>
	Kernel driver in use: pcieport

00:1d.0 USB controller [0c03]: Intel Corporation 7 Series/C216 Chipset Family USB Enhanced Host Controller #1 [8086:1e26] (rev 04) (prog-if 20 [EHCI])
	Subsystem: ASUSTeK Computer Inc. P8 series motherboard [1043:84ca]
	Control: I/O- Mem+ BusMaster+ SpecCycle- MemWINV- VGASnoop- ParErr- Stepping- SERR- FastB2B- DisINTx-
	Status: Cap+ 66MHz- UDF- FastB2B+ ParErr- DEVSEL=medium >TAbort- <TAbort- <MAbort- >SERR- <PERR- INTx-
	Latency: 0
	Interrupt: pin A routed to IRQ 23
	Region 0: Memory at f7917000 (32-bit, non-prefetchable) [size=1K]
	Capabilities: <access denied>
	Kernel driver in use: ehci-pci

00:1f.0 ISA bridge [0601]: Intel Corporation Z77 Express Chipset LPC Controller [8086:1e44] (rev 04)
	Subsystem: ASUSTeK Computer Inc. P8 series motherboard [1043:84ca]
	Control: I/O+ Mem+ BusMaster+ SpecCycle- MemWINV- VGASnoop- ParErr- Stepping- SERR- FastB2B- DisINTx-
	Status: Cap+ 66MHz- UDF- FastB2B- ParErr- DEVSEL=medium >TAbort- <TAbort- <MAbort- >SERR- <PERR- INTx-
	Latency: 0
	Capabilities: <access denied>
	Kernel driver in use: lpc_ich

00:1f.2 RAID bus controller [0104]: Intel Corporation SATA Controller [RAID mode] [8086:2822] (rev 04)
	Subsystem: ASUSTeK Computer Inc. Device [1043:84ca]
	Control: I/O+ Mem+ BusMaster+ SpecCycle- MemWINV- VGASnoop- ParErr- Stepping- SERR- FastB2B- DisINTx+
	Status: Cap+ 66MHz+ UDF- FastB2B+ ParErr- DEVSEL=medium >TAbort- <TAbort- <MAbort- >SERR- <PERR- INTx-
	Latency: 0
	Interrupt: pin B routed to IRQ 25
	Region 0: I/O ports at f0b0 [size=8]
	Region 1: I/O ports at f0a0 [size=4]
	Region 2: I/O ports at f090 [size=8]
	Region 3: I/O ports at f080 [size=4]
	Region 4: I/O ports at f060 [size=32]
	Region 5: Memory at f7916000 (32-bit, non-prefetchable) [size=2K]
	Capabilities: <access denied>
	Kernel driver in use: ahci

00:1f.3 SMBus [0c05]: Intel Corporation 7 Series/C216 Chipset Family SMBus Controller [8086:1e22] (rev 04)
	Subsystem: ASUSTeK Computer Inc. P8 series motherboard [1043:84ca]
	Control: I/O+ Mem+ BusMaster- SpecCycle- MemWINV- VGASnoop- ParErr- Stepping- SERR- FastB2B- DisINTx-
	Status: Cap- 66MHz- UDF- FastB2B+ ParErr- DEVSEL=medium >TAbort- <TAbort- <MAbort- >SERR- <PERR- INTx-
	Interrupt: pin C routed to IRQ 18
	Region 0: Memory at f7915000 (64-bit, non-prefetchable) [size=256]
	Region 4: I/O ports at f040 [size=32]
	Kernel driver in use: i801_smbus

01:00.0 VGA compatible controller [0300]: NVIDIA Corporation GK104 [GeForce GTX 680] [10de:1180] (rev a1) (prog-if 00 [VGA controller])
	Subsystem: ZOTAC International (MCO) Ltd. Device [19da:1260]
	Control: I/O+ Mem+ BusMaster+ SpecCycle- MemWINV- VGASnoop- ParErr- Stepping- SERR- FastB2B- DisINTx+
	Status: Cap+ 66MHz- UDF- FastB2B- ParErr- DEVSEL=fast >TAbort- <TAbort- <MAbort- >SERR- <PERR- INTx-
	Latency: 0, Cache Line Size: 64 bytes
	Interrupt: pin A routed to IRQ 32
	Region 0: Memory at f6000000 (32-bit, non-prefetchable) [size=16M]
	Region 1: Memory at e0000000 (64-bit, prefetchable) [size=128M]
	Region 3: Memory at e8000000 (64-bit, prefetchable) [size=32M]
	Region 5: I/O ports at e000 [size=128]
	Expansion ROM at 000c0000 [disabled] [size=128K]
	Capabilities: <access denied>
	Kernel driver in use: nouveau

01:00.1 Audio device [0403]: NVIDIA Corporation GK104 HDMI Audio Controller [10de:0e0a] (rev a1)
	Subsystem: ZOTAC International (MCO) Ltd. Device [19da:1260]
	Control: I/O- Mem+ BusMaster+ SpecCycle- MemWINV- VGASnoop- ParErr- Stepping- SERR- FastB2B- DisINTx-
	Status: Cap+ 66MHz- UDF- FastB2B- ParErr- DEVSEL=fast >TAbort- <TAbort- <MAbort- >SERR- <PERR- INTx-
	Latency: 0, Cache Line Size: 64 bytes
	Interrupt: pin B routed to IRQ 17
	Region 0: Memory at f7080000 (32-bit, non-prefetchable) [size=16K]
	Capabilities: <access denied>
	Kernel driver in use: snd_hda_intel

03:00.0 Ethernet controller [0200]: Realtek Semiconductor Co., Ltd. RTL8111/8168/8411 PCI Express Gigabit Ethernet Controller [10ec:8168] (rev 09)
	Subsystem: ASUSTeK Computer Inc. P8 series motherboard [1043:8505]
	Control: I/O+ Mem+ BusMaster+ SpecCycle- MemWINV- VGASnoop- ParErr- Stepping- SERR- FastB2B- DisINTx+
	Status: Cap+ 66MHz- UDF- FastB2B- ParErr- DEVSEL=fast >TAbort- <TAbort- <MAbort- >SERR- <PERR- INTx-
	Latency: 0, Cache Line Size: 64 bytes
	Interrupt: pin A routed to IRQ 16
	Region 0: I/O ports at d000 [size=256]
	Region 2: Memory at ea104000 (64-bit, prefetchable) [size=4K]
	Region 4: Memory at ea100000 (64-bit, prefetchable) [size=16K]
	Capabilities: <access denied>
	Kernel driver in use: r8169

04:00.0 PCI bridge [0604]: ASMedia Technology Inc. ASM1083/1085 PCIe to PCI Bridge [1b21:1080] (rev 03) (prog-if 01 [Subtractive decode])
	Control: I/O+ Mem+ BusMaster+ SpecCycle- MemWINV- VGASnoop- ParErr- Stepping- SERR- FastB2B- DisINTx-
	Status: Cap+ 66MHz- UDF- FastB2B- ParErr- DEVSEL=fast >TAbort- <TAbort- <MAbort- >SERR- <PERR- INTx-
	Latency: 0, Cache Line Size: 64 bytes
	Interrupt: pin A routed to IRQ 10
	Bus: primary=04, secondary=05, subordinate=05, sec-latency=32
	I/O behind bridge: [disabled]
	Memory behind bridge: [disabled]
	Prefetchable memory behind bridge: [disabled]
	Secondary status: 66MHz+ FastB2B- ParErr- DEVSEL=fast >TAbort- <TAbort- <MAbort+ <SERR- <PERR-
	BridgeCtl: Parity- SERR+ NoISA- VGA- VGA16+ MAbort- >Reset- FastB2B-
		PriDiscTmr- SecDiscTmr- DiscTmrStat- DiscTmrSERREn-
	Capabilities: <access denied>

06:00.0 USB controller [0c03]: ASMedia Technology Inc. ASM1042 SuperSpeed USB Host Controller [1b21:1042] (prog-if 30 [XHCI])
	Subsystem: ASUSTeK Computer Inc. P8B WS Motherboard [1043:8488]
	Control: I/O- Mem+ BusMaster+ SpecCycle- MemWINV- VGASnoop- ParErr- Stepping- SERR- FastB2B- DisINTx+
	Status: Cap+ 66MHz- UDF- FastB2B- ParErr- DEVSEL=fast >TAbort- <TAbort- <MAbort- >SERR- <PERR- INTx-
	Latency: 0, Cache Line Size: 64 bytes
	Interrupt: pin A routed to IRQ 19
	Region 0: Memory at f7800000 (64-bit, non-prefetchable) [size=32K]
	Capabilities: <access denied>
	Kernel driver in use: xhci_hcd

