00:00.0 Host bridge [0600]: Intel Corporation Xeon E7 v2/Xeon E5 v2/Core i7 DMI2 [8086:0e00] (rev 04)
	Subsystem: Gigabyte Technology Co., Ltd Device [1458:0000]
	Control: I/O- Mem- BusMaster- SpecCycle- MemWINV- VGASnoop- ParErr- Stepping- SERR- FastB2B- DisINTx-
	Status: Cap+ 66MHz- UDF- FastB2B- ParErr- DEVSEL=fast >TAbort- <TAbort- <MAbort- >SERR- <PERR- INTx-
	Interrupt: pin A routed to IRQ 0
	NUMA node: 0
	Capabilities: <access denied>

00:01.0 PCI bridge [0604]: Intel Corporation Xeon E7 v2/Xeon E5 v2/Core i7 PCI Express Root Port 1a [8086:0e02] (rev 04) (prog-if 00 [Normal decode])
	Control: I/O+ Mem+ BusMaster+ SpecCycle- MemWINV- VGASnoop- ParErr- Stepping- SERR- FastB2B- DisINTx+
	Status: Cap+ 66MHz- UDF- FastB2B- ParErr- DEVSEL=fast >TAbort- <TAbort- <MAbort- >SERR- <PERR- INTx-
	Latency: 0, Cache Line Size: 64 bytes
	Interrupt: pin A routed to IRQ 27
	NUMA node: 0
	Bus: primary=00, secondary=01, subordinate=01, sec-latency=0
	I/O behind bridge: 00008000-00008fff [size=4K]
	Memory behind bridge: deb00000-decfffff [size=2M]
	Prefetchable memory behind bridge: [disabled]
	Secondary status: 66MHz- FastB2B- ParErr- DEVSEL=fast >TAbort- <TAbort- <MAbort+ <SERR- <PERR-
	BridgeCtl: Parity- SERR+ NoISA- VGA- VGA16+ MAbort- >Reset- FastB2B-
		PriDiscTmr- SecDiscTmr- DiscTmrStat- DiscTmrSERREn-
	Capabilities: <access denied>
	Kernel driver in use: pcieport

00:03.0 PCI bridge [0604]: Intel Corporation Xeon E7 v2/Xeon E5 v2/Core i7 PCI Express Root Port 3a [8086:0e08] (rev 04) (prog-if 00 [Normal decode])
	Control: I/O+ Mem+ BusMaster+ SpecCycle- MemWINV- VGASnoop- ParErr- Stepping- SERR- FastB2B- DisINTx+
	Status: Cap+ 66MHz- UDF- FastB2B- ParErr- DEVSEL=fast >TAbort- <TAbort- <MAbort- >SERR- <PERR- INTx-
	Latency: 0, Cache Line Size: 64 bytes
	Interrupt: pin A routed to IRQ 28
	NUMA node: 0
	Bus: primary=00, secondary=02, subordinate=02, sec-latency=0
	I/O behind bridge: 00007000-00007fff [size=4K]
	Memory behind bridge: dd000000-de0fffff [size=17M]
	Prefetchable memory behind bridge: 0000380fe0000000-0000380ff20fffff [size=289M]
	Secondary status: 66MHz- FastB2B- ParErr- DEVSEL=fast >TAbort- <TAbort- <MAbort+ <SERR- <PERR-
	BridgeCtl: Parity- SERR+ NoISA- VGA- VGA16+ MAbort- >Reset- FastB2B-
		PriDiscTmr- SecDiscTmr- DiscTmrStat- DiscTmrSERREn-
	Capabilities: <access denied>
	Kernel driver in use: pcieport

00:04.0 System peripheral [0880]: Intel Corporation Xeon E7 v2/Xeon E5 v2/Core i7 Crystal Beach DMA Channel 0 [8086:0e20] (rev 04)
	Subsystem: Gigabyte Technology Co., Ltd Device [1458:0000]
	Control: I/O- Mem+ BusMaster+ SpecCycle- MemWINV- VGASnoop- ParErr- Stepping- SERR- FastB2B- DisINTx+
	Status: Cap+ 66MHz- UDF- FastB2B- ParErr- DEVSEL=fast >TAbort- <TAbort- <MAbort- >SERR- <PERR- INTx-
	Latency: 0, Cache Line Size: 64 bytes
	Interrupt: pin A routed to IRQ 96
	NUMA node: 0
	Region 0: Memory at 380ffff1c000 (64-bit, non-prefetchable) [size=16K]
	Capabilities: <access denied>
	Kernel driver in use: ioatdma

00:04.1 System peripheral [0880]: Intel Corporation Xeon E7 v2/Xeon E5 v2/Core i7 Crystal Beach DMA Channel 1 [8086:0e21] (rev 04)
	Subsystem: Gigabyte Technology Co., Ltd Device [1458:0000]
	Control: I/O- Mem+ BusMaster+ SpecCycle- MemWINV- VGASnoop- ParErr- Stepping- SERR- FastB2B- DisINTx+
	Status: Cap+ 66MHz- UDF- FastB2B- ParErr- DEVSEL=fast >TAbort- <TAbort- <MAbort- >SERR- <PERR- INTx-
	Latency: 0, Cache Line Size: 64 bytes
	Interrupt: pin B routed to IRQ 98
	NUMA node: 0
	Region 0: Memory at 380ffff18000 (64-bit, non-prefetchable) [size=16K]
	Capabilities: <access denied>
	Kernel driver in use: ioatdma

00:04.2 System peripheral [0880]: Intel Corporation Xeon E7 v2/Xeon E5 v2/Core i7 Crystal Beach DMA Channel 2 [8086:0e22] (rev 04)
	Subsystem: Gigabyte Technology Co., Ltd Device [1458:0000]
	Control: I/O- Mem+ BusMaster+ SpecCycle- MemWINV- VGASnoop- ParErr- Stepping- SERR- FastB2B- DisINTx+
	Status: Cap+ 66MHz- UDF- FastB2B- ParErr- DEVSEL=fast >TAbort- <TAbort- <MAbort- >SERR- <PERR- INTx-
	Latency: 0, Cache Line Size: 64 bytes
	Interrupt: pin C routed to IRQ 96
	NUMA node: 0
	Region 0: Memory at 380ffff14000 (64-bit, non-prefetchable) [size=16K]
	Capabilities: <access denied>
	Kernel driver in use: ioatdma

00:04.3 System peripheral [0880]: Intel Corporation Xeon E7 v2/Xeon E5 v2/Core i7 Crystal Beach DMA Channel 3 [8086:0e23] (rev 04)
	Subsystem: Gigabyte Technology Co., Ltd Device [1458:0000]
	Control: I/O- Mem+ BusMaster+ SpecCycle- MemWINV- VGASnoop- ParErr- Stepping- SERR- FastB2B- DisINTx+
	Status: Cap+ 66MHz- UDF- FastB2B- ParErr- DEVSEL=fast >TAbort- <TAbort- <MAbort- >SERR- <PERR- INTx-
	Latency: 0, Cache Line Size: 64 bytes
	Interrupt: pin D routed to IRQ 98
	NUMA node: 0
	Region 0: Memory at 380ffff10000 (64-bit, non-prefetchable) [size=16K]
	Capabilities: <access denied>
	Kernel driver in use: ioatdma

00:04.4 System peripheral [0880]: Intel Corporation Xeon E7 v2/Xeon E5 v2/Core i7 Crystal Beach DMA Channel 4 [8086:0e24] (rev 04)
	Subsystem: Gigabyte Technology Co., Ltd Device [1458:0000]
	Control: I/O- Mem+ BusMaster+ SpecCycle- MemWINV- VGASnoop- ParErr- Stepping- SERR- FastB2B- DisINTx+
	Status: Cap+ 66MHz- UDF- FastB2B- ParErr- DEVSEL=fast >TAbort- <TAbort- <MAbort- >SERR- <PERR- INTx-
	Latency: 0, Cache Line Size: 64 bytes
	Interrupt: pin A routed to IRQ 96
	NUMA node: 0
	Region 0: Memory at 380ffff0c000 (64-bit, non-prefetchable) [size=16K]
	Capabilities: <access denied>
	Kernel driver in use: ioatdma

00:04.5 System peripheral [0880]: Intel Corporation Xeon E7 v2/Xeon E5 v2/Core i7 Crystal Beach DMA Channel 5 [8086:0e25] (rev 04)
	Subsystem: Gigabyte Technology Co., Ltd Device [1458:0000]
	Control: I/O- Mem+ BusMaster+ SpecCycle- MemWINV- VGASnoop- ParErr- Stepping- SERR- FastB2B- DisINTx+
	Status: Cap+ 66MHz- UDF- FastB2B- ParErr- DEVSEL=fast >TAbort- <TAbort- <MAbort- >SERR- <PERR- INTx-
	Latency: 0, Cache Line Size: 64 bytes
	Interrupt: pin B routed to IRQ 98
	NUMA node: 0
	Region 0: Memory at 380ffff08000 (64-bit, non-prefetchable) [size=16K]
	Capabilities: <access denied>
	Kernel driver in use: ioatdma

00:04.6 System peripheral [0880]: Intel Corporation Xeon E7 v2/Xeon E5 v2/Core i7 Crystal Beach DMA Channel 6 [8086:0e26] (rev 04)
	Subsystem: Gigabyte Technology Co., Ltd Device [1458:0000]
	Control: I/O- Mem+ BusMaster+ SpecCycle- MemWINV- VGASnoop- ParErr- Stepping- SERR- FastB2B- DisINTx+
	Status: Cap+ 66MHz- UDF- FastB2B- ParErr- DEVSEL=fast >TAbort- <TAbort- <MAbort- >SERR- <PERR- INTx-
	Latency: 0, Cache Line Size: 64 bytes
	Interrupt: pin C routed to IRQ 96
	NUMA node: 0
	Region 0: Memory at 380ffff04000 (64-bit, non-prefetchable) [size=16K]
	Capabilities: <access denied>
	Kernel driver in use: ioatdma

00:04.7 System peripheral [0880]: Intel Corporation Xeon E7 v2/Xeon E5 v2/Core i7 Crystal Beach DMA Channel 7 [8086:0e27] (rev 04)
	Subsystem: Gigabyte Technology Co., Ltd Device [1458:0000]
	Control: I/O- Mem+ BusMaster+ SpecCycle- MemWINV- VGASnoop- ParErr- Stepping- SERR- FastB2B- DisINTx+
	Status: Cap+ 66MHz- UDF- FastB2B- ParErr- DEVSEL=fast >TAbort- <TAbort- <MAbort- >SERR- <PERR- INTx-
	Latency: 0, Cache Line Size: 64 bytes
	Interrupt: pin D routed to IRQ 98
	NUMA node: 0
	Region 0: Memory at 380ffff00000 (64-bit, non-prefetchable) [size=16K]
	Capabilities: <access denied>
	Kernel driver in use: ioatdma

00:05.0 System peripheral [0880]: Intel Corporation Xeon E7 v2/Xeon E5 v2/Core i7 VTd/Memory Map/Misc [8086:0e28] (rev 04)
	Subsystem: Gigabyte Technology Co., Ltd Device [1458:0000]
	Control: I/O- Mem- BusMaster- SpecCycle- MemWINV- VGASnoop- ParErr- Stepping- SERR- FastB2B- DisINTx-
	Status: Cap+ 66MHz- UDF- FastB2B- ParErr- DEVSEL=fast >TAbort- <TAbort- <MAbort- >SERR- <PERR- INTx-
	NUMA node: 0
	Capabilities: <access denied>

00:05.2 System peripheral [0880]: Intel Corporation Xeon E7 v2/Xeon E5 v2/Core i7 IIO RAS [8086:0e2a] (rev 04)
	Subsystem: Gigabyte Technology Co., Ltd Device [1458:0000]
	Control: I/O- Mem- BusMaster- SpecCycle- MemWINV- VGASnoop- ParErr- Stepping- SERR- FastB2B- DisINTx-
	Status: Cap+ 66MHz- UDF- FastB2B- ParErr- DEVSEL=fast >TAbort- <TAbort- <MAbort- >SERR- <PERR- INTx-
	NUMA node: 0
	Capabilities: <access denied>

00:05.4 PIC [0800]: Intel Corporation Xeon E7 v2/Xeon E5 v2/Core i7 IOAPIC [8086:0e2c] (rev 04) (prog-if 20 [IO(X)-APIC])
	Subsystem: Gigabyte Technology Co., Ltd Device [1458:0000]
	Control: I/O- Mem+ BusMaster+ SpecCycle- MemWINV- VGASnoop- ParErr- Stepping- SERR- FastB2B- DisINTx-
	Status: Cap+ 66MHz- UDF- FastB2B- ParErr- DEVSEL=fast >TAbort- <TAbort- <MAbort- >SERR- <PERR- INTx-
	Latency: 0, Cache Line Size: 64 bytes
	NUMA node: 0
	Region 0: Memory at df105000 (32-bit, non-prefetchable) [size=4K]
	Capabilities: <access denied>

00:11.0 PCI bridge [0604]: Intel Corporation C600/X79 series chipset PCI Express Virtual Root Port [8086:1d3e] (rev 06) (prog-if 00 [Normal decode])
	Control: I/O+ Mem+ BusMaster+ SpecCycle- MemWINV- VGASnoop- ParErr- Stepping- SERR- FastB2B- DisINTx+
	Status: Cap+ 66MHz- UDF- FastB2B- ParErr- DEVSEL=fast >TAbort- <TAbort- <MAbort- >SERR- <PERR- INTx-
	Latency: 0, Cache Line Size: 64 bytes
	Interrupt: pin A routed to IRQ 29
	NUMA node: 0
	Bus: primary=00, secondary=03, subordinate=03, sec-latency=0
	I/O behind bridge: 00006000-00006fff [size=4K]
	Memory behind bridge: df000000-df0fffff [size=1M]
	Prefetchable memory behind bridge: 0000380ff2400000-0000380ff28fffff [size=5M]
	Secondary status: 66MHz- FastB2B- ParErr- DEVSEL=fast >TAbort- <TAbort- <MAbort+ <SERR- <PERR-
	BridgeCtl: Parity- SERR+ NoISA- VGA- VGA16+ MAbort- >Reset- FastB2B-
		PriDiscTmr- SecDiscTmr- DiscTmrStat- DiscTmrSERREn-
	Capabilities: <access denied>
	Kernel driver in use: pcieport

00:16.0 Communication controller [0780]: Intel Corporation C600/X79 series chipset MEI Controller #1 [8086:1d3a] (rev 05)
	Subsystem: Gigabyte Technology Co., Ltd Device [1458:0000]
	Control: I/O- Mem+ BusMaster+ SpecCycle- MemWINV- VGASnoop- ParErr- Stepping- SERR- FastB2B- DisINTx-
	Status: Cap+ 66MHz- UDF- FastB2B- ParErr- DEVSEL=fast >TAbort- <TAbort- <MAbort- >SERR- <PERR- INTx-
	Latency: 0
	Interrupt: pin A routed to IRQ 255
	NUMA node: 0
	Region 0: Memory at df104000 (64-bit, non-prefetchable) [size=16]
	Capabilities: <access denied>

00:16.1 Communication controller [0780]: Intel Corporation C600/X79 series chipset MEI Controller #2 [8086:1d3b] (rev 05)
	Subsystem: Gigabyte Technology Co., Ltd Device [1458:0000]
	Control: I/O- Mem+ BusMaster+ SpecCycle- MemWINV- VGASnoop- ParErr- Stepping- SERR- FastB2B- DisINTx-
	Status: Cap+ 66MHz- UDF- FastB2B- ParErr- DEVSEL=fast >TAbort- <TAbort- <MAbort- >SERR- <PERR- INTx-
	Latency: 0
	Interrupt: pin B routed to IRQ 255
	NUMA node: 0
	Region 0: Memory at df103000 (64-bit, non-prefetchable) [size=16]
	Capabilities: <access denied>

00:1a.0 USB controller [0c03]: Intel Corporation C600/X79 series chipset USB2 Enhanced Host Controller #2 [8086:1d2d] (rev 06) (prog-if 20 [EHCI])
	Subsystem: Gigabyte Technology Co., Ltd Device [1458:0000]
	Control: I/O- Mem+ BusMaster+ SpecCycle- MemWINV- VGASnoop- ParErr- Stepping- SERR- FastB2B- DisINTx-
	Status: Cap+ 66MHz- UDF- FastB2B+ ParErr- DEVSEL=medium >TAbort- <TAbort- <MAbort- >SERR- <PERR- INTx-
	Latency: 0
	Interrupt: pin A routed to IRQ 16
	NUMA node: 0
	Region 0: Memory at df102000 (32-bit, non-prefetchable) [size=1K]
	Capabilities: <access denied>
	Kernel driver in use: ehci-pci

00:1c.0 PCI bridge [0604]: Intel Corporation C600/X79 series chipset PCI Express Root Port 1 [8086:1d10] (rev b6) (prog-if 00 [Normal decode])
	Control: I/O+ Mem+ BusMaster+ SpecCycle- MemWINV- VGASnoop- ParErr- Stepping- SERR- FastB2B- DisINTx+
	Status: Cap+ 66MHz- UDF- FastB2B- ParErr- DEVSEL=fast >TAbort- <TAbort- <MAbort- >SERR- <PERR- INTx-
	Latency: 0, Cache Line Size: 64 bytes
	Interrupt: pin A routed to IRQ 30
	NUMA node: 0
	Bus: primary=00, secondary=04, subordinate=04, sec-latency=0
	I/O behind bridge: 00005000-00005fff [size=4K]
	Memory behind bridge: de500000-deafffff [size=6M]
	Prefetchable memory behind bridge: [disabled]
	Secondary status: 66MHz- FastB2B- ParErr- DEVSEL=fast >TAbort- <TAbort- <MAbort+ <SERR- <PERR-
	BridgeCtl: Parity- SERR+ NoISA- VGA- VGA16+ MAbort- >Reset- FastB2B-
		PriDiscTmr- SecDiscTmr- DiscTmrStat- DiscTmrSERREn-
	Capabilities: <access denied>
	Kernel driver in use: pcieport

00:1c.4 PCI bridge [0604]: Intel Corporation C600/X79 series chipset PCI Express Root Port 5 [8086:1d18] (rev b6) (prog-if 00 [Normal decode])
	Control: I/O+ Mem+ BusMaster+ SpecCycle- MemWINV- VGASnoop- ParErr- Stepping- SERR- FastB2B- DisINTx+
	Status: Cap+ 66MHz- UDF- FastB2B- ParErr- DEVSEL=fast >TAbort- <TAbort- <MAbort- >SERR- <PERR- INTx-
	Latency: 0, Cache Line Size: 64 bytes
	Interrupt: pin A routed to IRQ 31
	NUMA node: 0
	Bus: primary=00, secondary=05, subordinate=05, sec-latency=0
	I/O behind bridge: [disabled]
	Memory behind bridge: de200000-de4fffff [size=3M]
	Prefetchable memory behind bridge: [disabled]
	Secondary status: 66MHz- FastB2B- ParErr- DEVSEL=fast >TAbort- <TAbort- <MAbort+ <SERR- <PERR-
	BridgeCtl: Parity- SERR+ NoISA- VGA- VGA16+ MAbort- >Reset- FastB2B-
		PriDiscTmr- SecDiscTmr- DiscTmrStat- DiscTmrSERREn-
	Capabilities: <access denied>
	Kernel driver in use: pcieport

00:1c.5 PCI bridge [0604]: Intel Corporation C600/X79 series chipset PCI Express Root Port 6 [8086:1d1a] (rev b6) (prog-if 00 [Normal decode])
	Control: I/O+ Mem+ BusMaster+ SpecCycle- MemWINV- VGASnoop- ParErr- Stepping- SERR- FastB2B- DisINTx+
	Status: Cap+ 66MHz- UDF- FastB2B- ParErr- DEVSEL=fast >TAbort- <TAbort- <MAbort- >SERR- <PERR- INTx-
	Latency: 0, Cache Line Size: 64 bytes
	Interrupt: pin B routed to IRQ 32
	NUMA node: 0
	Bus: primary=00, secondary=06, subordinate=06, sec-latency=0
	I/O behind bridge: 00004000-00004fff [size=4K]
	Memory behind bridge: def00000-deffffff [size=1M]
	Prefetchable memory behind bridge: [disabled]
	Secondary status: 66MHz- FastB2B- ParErr- DEVSEL=fast >TAbort- <TAbort- <MAbort+ <SERR- <PERR-
	BridgeCtl: Parity- SERR+ NoISA- VGA- VGA16+ MAbort- >Reset- FastB2B-
		PriDiscTmr- SecDiscTmr- DiscTmrStat- DiscTmrSERREn-
	Capabilities: <access denied>
	Kernel driver in use: pcieport

00:1c.6 PCI bridge [0604]: Intel Corporation C600/X79 series chipset PCI Express Root Port 7 [8086:1d1c] (rev b6) (prog-if 00 [Normal decode])
	Control: I/O+ Mem+ BusMaster+ SpecCycle- MemWINV- VGASnoop- ParErr- Stepping- SERR- FastB2B- DisINTx+
	Status: Cap+ 66MHz- UDF- FastB2B- ParErr- DEVSEL=fast >TAbort- <TAbort- <MAbort- >SERR- <PERR- INTx-
	Latency: 0, Cache Line Size: 64 bytes
	Interrupt: pin C routed to IRQ 33
	NUMA node: 0
	Bus: primary=00, secondary=07, subordinate=07, sec-latency=0
	I/O behind bridge: 00003000-00003fff [size=4K]
	Memory behind bridge: dee00000-deefffff [size=1M]
	Prefetchable memory behind bridge: [disabled]
	Secondary status: 66MHz- FastB2B- ParErr- DEVSEL=fast >TAbort- <TAbort- <MAbort+ <SERR- <PERR-
	BridgeCtl: Parity- SERR+ NoISA- VGA- VGA16+ MAbort- >Reset- FastB2B-
		PriDiscTmr- SecDiscTmr- DiscTmrStat- DiscTmrSERREn-
	Capabilities: <access denied>
	Kernel driver in use: pcieport

00:1c.7 PCI bridge [0604]: Intel Corporation C600/X79 series chipset PCI Express Root Port 8 [8086:1d1e] (rev b6) (prog-if 00 [Normal decode])
	Control: I/O+ Mem+ BusMaster+ SpecCycle- MemWINV- VGASnoop- ParErr- Stepping- SERR- FastB2B- DisINTx+
	Status: Cap+ 66MHz- UDF- FastB2B- ParErr- DEVSEL=fast >TAbort- <TAbort- <MAbort- >SERR- <PERR- INTx-
	Latency: 0, Cache Line Size: 64 bytes
	Interrupt: pin D routed to IRQ 34
	NUMA node: 0
	Bus: primary=00, secondary=08, subordinate=09, sec-latency=0
	I/O behind bridge: 00002000-00002fff [size=4K]
	Memory behind bridge: ded00000-dedfffff [size=1M]
	Prefetchable memory behind bridge: 00000000dc000000-00000000dcffffff [size=16M]
	Secondary status: 66MHz- FastB2B- ParErr- DEVSEL=fast >TAbort- <TAbort- <MAbort+ <SERR- <PERR-
	BridgeCtl: Parity- SERR+ NoISA- VGA+ VGA16+ MAbort- >Reset- FastB2B-
		PriDiscTmr- SecDiscTmr- DiscTmrStat- DiscTmrSERREn-
	Capabilities: <access denied>
	Kernel driver in use: pcieport

00:1d.0 USB controller [0c03]: Intel Corporation C600/X79 series chipset USB2 Enhanced Host Controller #1 [8086:1d26] (rev 06) (prog-if 20 [EHCI])
	Subsystem: Gigabyte Technology Co., Ltd Device [1458:0000]
	Control: I/O- Mem+ BusMaster+ SpecCycle- MemWINV- VGASnoop- ParErr- Stepping- SERR- FastB2B- DisINTx-
	Status: Cap+ 66MHz- UDF- FastB2B+ ParErr- DEVSEL=medium >TAbort- <TAbort- <MAbort- >SERR- <PERR- INTx-
	Latency: 0
	Interrupt: pin A routed to IRQ 23
	NUMA node: 0
	Region 0: Memory at df101000 (32-bit, non-prefetchable) [size=1K]
	Capabilities: <access denied>
	Kernel driver in use: ehci-pci

00:1e.0 PCI bridge [0604]: Intel Corporation 82801 PCI Bridge [8086:244e] (rev a6) (prog-if 01 [Subtractive decode])
	Control: I/O+ Mem+ BusMaster+ SpecCycle- MemWINV- VGASnoop- ParErr- Stepping- SERR- FastB2B- DisINTx-
	Status: Cap+ 66MHz- UDF- FastB2B- ParErr- DEVSEL=fast >TAbort- <TAbort- <MAbort- >SERR- <PERR- INTx-
	Latency: 0
	NUMA node: 0
	Bus: primary=00, secondary=0a, subordinate=0a, sec-latency=32
	I/O behind bridge: [disabled]
	Memory behind bridge: [disabled]
	Prefetchable memory behind bridge: [disabled]
	Secondary status: 66MHz- FastB2B+ ParErr- DEVSEL=medium >TAbort- <TAbort- <MAbort+ <SERR- <PERR-
	BridgeCtl: Parity- SERR+ NoISA- VGA- VGA16+ MAbort- >Reset- FastB2B-
		PriDiscTmr- SecDiscTmr- DiscTmrStat- DiscTmrSERREn-
	Capabilities: <access denied>

00:1f.0 ISA bridge [0601]: Intel Corporation C600/X79 series chipset LPC Controller [8086:1d41] (rev 06)
	Subsystem: Gigabyte Technology Co., Ltd Device [1458:0000]
	Control: I/O+ Mem+ BusMaster+ SpecCycle- MemWINV- VGASnoop- ParErr- Stepping- SERR- FastB2B- DisINTx-
	Status: Cap+ 66MHz- UDF- FastB2B- ParErr- DEVSEL=medium >TAbort- <TAbort- <MAbort- >SERR- <PERR- INTx-
	Latency: 0
	NUMA node: 0
	Capabilities: <access denied>
	Kernel driver in use: lpc_ich

00:1f.2 SATA controller [0106]: Intel Corporation C600/X79 series chipset 6-Port SATA AHCI Controller [8086:1d02] (rev 06) (prog-if 01 [AHCI 1.0])
	Subsystem: Gigabyte Technology Co., Ltd Device [1458:0000]
	Control: I/O+ Mem+ BusMaster+ SpecCycle- MemWINV- VGASnoop- ParErr- Stepping- SERR- FastB2B- DisINTx+
	Status: Cap+ 66MHz+ UDF- FastB2B+ ParErr- DEVSEL=medium >TAbort- <TAbort- <MAbort- >SERR- <PERR- INTx-
	Latency: 0
	Interrupt: pin B routed to IRQ 89
	NUMA node: 0
	Region 0: I/O ports at 9070 [size=8]
	Region 1: I/O ports at 9060 [size=4]
	Region 2: I/O ports at 9050 [size=8]
	Region 3: I/O ports at 9040 [size=4]
	Region 4: I/O ports at 9020 [size=32]
	Region 5: Memory at df100000 (32-bit, non-prefetchable) [size=2K]
	Capabilities: <access denied>
	Kernel driver in use: ahci

00:1f.3 SMBus [0c05]: Intel Corporation C600/X79 series chipset SMBus Host Controller [8086:1d22] (rev 06)
	Subsystem: Gigabyte Technology Co., Ltd Device [1458:0000]
	Control: I/O+ Mem+ BusMaster- SpecCycle- MemWINV- VGASnoop- ParErr- Stepping- SERR- FastB2B- DisINTx-
	Status: Cap- 66MHz- UDF- FastB2B+ ParErr- DEVSEL=medium >TAbort- <TAbort- <MAbort- >SERR- <PERR- INTx-
	Interrupt: pin C routed to IRQ 18
	NUMA node: 0
	Region 0: Memory at 380ffff21000 (64-bit, non-prefetchable) [size=256]
	Region 4: I/O ports at 9000 [size=32]
	Kernel driver in use: i801_smbus

00:1f.6 Signal processing controller [1180]: Intel Corporation C600/X79 series chipset Thermal Management Controller [8086:1d24] (rev 06)
	Subsystem: Gigabyte Technology Co., Ltd Device [1458:0000]
	Control: I/O- Mem- BusMaster- SpecCycle- MemWINV- VGASnoop- ParErr- Stepping- SERR- FastB2B- DisINTx-
	Status: Cap+ 66MHz- UDF- FastB2B- ParErr- DEVSEL=fast >TAbort- <TAbort- <MAbort- >SERR- <PERR- INTx-
	Interrupt: pin C routed to IRQ 255
	NUMA node: 0
	Region 0: Memory at 380ffff20000 (64-bit, non-prefetchable) [disabled] [size=4K]
	Capabilities: <access denied>

01:00.0 Serial Attached SCSI controller [0107]: Broadcom / LSI SAS3008 PCI-Express Fusion-MPT SAS-3 [1000:0097] (rev 02)
	Subsystem: Broadcom / LSI SAS9311-8i [1000:3090]
	Control: I/O- Mem+ BusMaster+ SpecCycle- MemWINV- VGASnoop- ParErr- Stepping- SERR- FastB2B- DisINTx+
	Status: Cap+ 66MHz- UDF- FastB2B- ParErr- DEVSEL=fast >TAbort- <TAbort- <MAbort- >SERR- <PERR- INTx-
	Latency: 0, Cache Line Size: 64 bytes
	Interrupt: pin A routed to IRQ 16
	NUMA node: 0
	Region 0: I/O ports at 8000 [disabled] [size=256]
	Region 1: Memory at dec40000 (64-bit, non-prefetchable) [size=64K]
	Region 3: Memory at dec00000 (64-bit, non-prefetchable) [size=256K]
	Expansion ROM at deb00000 [disabled] [size=1M]
	Capabilities: <access denied>
	Kernel driver in use: mpt3sas

02:00.0 VGA compatible controller [0300]: NVIDIA Corporation TU102 [GeForce RTX 2080 Ti] [10de:1e04] (rev a1) (prog-if 00 [VGA controller])
	Subsystem: ASUSTeK Computer Inc. Device [1043:874a]
	Control: I/O+ Mem+ BusMaster+ SpecCycle- MemWINV- VGASnoop- ParErr- Stepping- SERR- FastB2B- DisINTx+
	Status: Cap+ 66MHz- UDF- FastB2B- ParErr- DEVSEL=fast >TAbort- <TAbort- <MAbort- >SERR- <PERR- INTx-
	Latency: 0
	Interrupt: pin A routed to IRQ 118
	NUMA node: 0
	Region 0: Memory at dd000000 (32-bit, non-prefetchable) [size=16M]
	Region 1: Memory at 380fe0000000 (64-bit, prefetchable) [size=256M]
	Region 3: Memory at 380ff0000000 (64-bit, prefetchable) [size=32M]
	Region 5: I/O ports at 7000 [size=128]
	Expansion ROM at de000000 [virtual] [disabled] [size=512K]
	Capabilities: <access denied>
	Kernel driver in use: nvidia

02:00.1 Audio device [0403]: NVIDIA Corporation TU102 High Definition Audio Controller [10de:10f7] (rev a1)
	Subsystem: ASUSTeK Computer Inc. Device [1043:874a]
	Control: I/O- Mem+ BusMaster+ SpecCycle- MemWINV- VGASnoop- ParErr- Stepping- SERR- FastB2B- DisINTx-
	Status: Cap+ 66MHz- UDF- FastB2B- ParErr- DEVSEL=fast >TAbort- <TAbort- <MAbort- >SERR- <PERR- INTx+
	Latency: 0, Cache Line Size: 64 bytes
	Interrupt: pin B routed to IRQ 17
	NUMA node: 0
	Region 0: Memory at de080000 (32-bit, non-prefetchable) [size=16K]
	Capabilities: <access denied>
	Kernel driver in use: snd_hda_intel

02:00.2 USB controller [0c03]: NVIDIA Corporation TU102 USB 3.1 Host Controller [10de:1ad6] (rev a1) (prog-if 30 [XHCI])
	Subsystem: ASUSTeK Computer Inc. Device [1043:874a]
	Control: I/O- Mem+ BusMaster- SpecCycle- MemWINV- VGASnoop- ParErr- Stepping- SERR- FastB2B- DisINTx+
	Status: Cap+ 66MHz- UDF- FastB2B- ParErr- DEVSEL=fast >TAbort- <TAbort- <MAbort- >SERR- <PERR- INTx-
	Interrupt: pin C routed to IRQ 38
	NUMA node: 0
	Region 0: Memory at 380ff2000000 (64-bit, prefetchable) [size=256K]
	Region 3: Memory at 380ff2040000 (64-bit, prefetchable) [size=64K]
	Capabilities: <access denied>
	Kernel driver in use: xhci_hcd

02:00.3 Serial bus controller [0c80]: NVIDIA Corporation TU102 USB Type-C UCSI Controller [10de:1ad7] (rev a1)
	Subsystem: ASUSTeK Computer Inc. Device [1043:874a]
	Control: I/O- Mem+ BusMaster+ SpecCycle- MemWINV- VGASnoop- ParErr- Stepping- SERR- FastB2B- DisINTx+
	Status: Cap+ 66MHz- UDF- FastB2B- ParErr- DEVSEL=fast >TAbort- <TAbort- <MAbort- >SERR- <PERR- INTx-
	Latency: 0, Cache Line Size: 64 bytes
	Interrupt: pin D routed to IRQ 39
	NUMA node: 0
	Region 0: Memory at de084000 (32-bit, non-prefetchable) [size=4K]
	Capabilities: <access denied>
	Kernel driver in use: nvidia-gpu

03:00.0 Serial Attached SCSI controller [0107]: Intel Corporation C602 chipset 4-Port SATA Storage Control Unit [8086:1d6b] (rev 06)
	Subsystem: Gigabyte Technology Co., Ltd Device [1458:1d6b]
	Control: I/O+ Mem+ BusMaster+ SpecCycle- MemWINV- VGASnoop- ParErr- Stepping- SERR- FastB2B- DisINTx+
	Status: Cap+ 66MHz- UDF- FastB2B- ParErr- DEVSEL=fast >TAbort- <TAbort- <MAbort- >SERR- <PERR- INTx-
	Latency: 0, Cache Line Size: 64 bytes
	Interrupt: pin A routed to IRQ 16
	NUMA node: 0
	Region 0: Memory at 380ff287c000 (64-bit, prefetchable) [size=16K]
	Region 2: Memory at 380ff2400000 (64-bit, prefetchable) [size=4M]
	Region 4: I/O ports at 6000 [size=256]
	Capabilities: <access denied>
	Kernel driver in use: isci

04:00.0 Serial Attached SCSI controller [0107]: Broadcom / LSI SAS2008 PCI-Express Fusion-MPT SAS-2 [Falcon] [1000:0072] (rev 03)
	Subsystem: Gigabyte Technology Co., Ltd Device [1458:0072]
	Control: I/O- Mem+ BusMaster+ SpecCycle- MemWINV- VGASnoop- ParErr- Stepping- SERR- FastB2B- DisINTx+
	Status: Cap+ 66MHz- UDF- FastB2B- ParErr- DEVSEL=fast >TAbort- <TAbort- <MAbort- >SERR- <PERR- INTx-
	Latency: 0, Cache Line Size: 64 bytes
	Interrupt: pin A routed to IRQ 16
	NUMA node: 0
	Region 0: I/O ports at 5000 [disabled] [size=256]
	Region 1: Memory at dea00000 (64-bit, non-prefetchable) [size=16K]
	Region 3: Memory at de980000 (64-bit, non-prefetchable) [size=256K]
	Expansion ROM at de500000 [disabled] [size=512K]
	Capabilities: <access denied>
	Kernel driver in use: mpt3sas

05:00.0 Network controller [0280]: Broadcom Inc. and subsidiaries BCM4360 802.11ac Wireless Network Adapter [14e4:43a0] (rev 03)
	Subsystem: ASUSTeK Computer Inc. Device [1043:85df]
	Control: I/O- Mem+ BusMaster+ SpecCycle- MemWINV- VGASnoop- ParErr- Stepping- SERR- FastB2B- DisINTx-
	Status: Cap+ 66MHz- UDF- FastB2B- ParErr- DEVSEL=fast >TAbort- <TAbort- <MAbort- >SERR- <PERR- INTx-
	Latency: 0, Cache Line Size: 64 bytes
	Interrupt: pin A routed to IRQ 16
	NUMA node: 0
	Region 0: Memory at de400000 (64-bit, non-prefetchable) [size=32K]
	Region 2: Memory at de200000 (64-bit, non-prefetchable) [size=2M]
	Capabilities: <access denied>
	Kernel driver in use: wl

06:00.0 Ethernet controller [0200]: Intel Corporation 82574L Gigabit Network Connection [8086:10d3]
	Subsystem: Gigabyte Technology Co., Ltd Device [1458:0000]
	Control: I/O+ Mem+ BusMaster+ SpecCycle- MemWINV- VGASnoop- ParErr- Stepping- SERR- FastB2B- DisINTx+
	Status: Cap+ 66MHz- UDF- FastB2B- ParErr- DEVSEL=fast >TAbort- <TAbort- <MAbort- >SERR- <PERR- INTx-
	Latency: 0, Cache Line Size: 64 bytes
	Interrupt: pin A routed to IRQ 17
	NUMA node: 0
	Region 0: Memory at def00000 (32-bit, non-prefetchable) [size=128K]
	Region 2: I/O ports at 4000 [size=32]
	Region 3: Memory at def20000 (32-bit, non-prefetchable) [size=16K]
	Capabilities: <access denied>
	Kernel driver in use: e1000e

07:00.0 Ethernet controller [0200]: Intel Corporation 82574L Gigabit Network Connection [8086:10d3]
	Subsystem: Gigabyte Technology Co., Ltd Device [1458:0000]
	Control: I/O+ Mem+ BusMaster+ SpecCycle- MemWINV- VGASnoop- ParErr- Stepping- SERR- FastB2B- DisINTx+
	Status: Cap+ 66MHz- UDF- FastB2B- ParErr- DEVSEL=fast >TAbort- <TAbort- <MAbort- >SERR- <PERR- INTx-
	Latency: 0, Cache Line Size: 64 bytes
	Interrupt: pin A routed to IRQ 18
	NUMA node: 0
	Region 0: Memory at dee00000 (32-bit, non-prefetchable) [size=128K]
	Region 2: I/O ports at 3000 [size=32]
	Region 3: Memory at dee20000 (32-bit, non-prefetchable) [size=16K]
	Capabilities: <access denied>
	Kernel driver in use: e1000e

08:00.0 PCI bridge [0604]: ASPEED Technology, Inc. AST1150 PCI-to-PCI Bridge [1a03:1150] (rev 02) (prog-if 00 [Normal decode])
	Control: I/O+ Mem+ BusMaster+ SpecCycle- MemWINV- VGASnoop- ParErr- Stepping- SERR- FastB2B- DisINTx-
	Status: Cap+ 66MHz- UDF- FastB2B- ParErr- DEVSEL=fast >TAbort- <TAbort- <MAbort- >SERR- <PERR- INTx-
	Latency: 0, Cache Line Size: 64 bytes
	Interrupt: pin A routed to IRQ 255
	NUMA node: 0
	Bus: primary=08, secondary=09, subordinate=09, sec-latency=32
	I/O behind bridge: 00002000-00002fff [size=4K]
	Memory behind bridge: ded00000-dedfffff [size=1M]
	Prefetchable memory behind bridge: 00000000dc000000-00000000dcffffff [size=16M]
	Secondary status: 66MHz+ FastB2B- ParErr- DEVSEL=medium >TAbort- <TAbort- <MAbort- <SERR- <PERR-
	BridgeCtl: Parity- SERR+ NoISA- VGA+ VGA16+ MAbort- >Reset- FastB2B-
		PriDiscTmr- SecDiscTmr- DiscTmrStat- DiscTmrSERREn-
	Capabilities: <access denied>

09:00.0 VGA compatible controller [0300]: ASPEED Technology, Inc. ASPEED Graphics Family [1a03:2000] (rev 21) (prog-if 00 [VGA controller])
	Subsystem: Gigabyte Technology Co., Ltd Device [1458:2000]
	Control: I/O+ Mem+ BusMaster- SpecCycle- MemWINV- VGASnoop- ParErr- Stepping- SERR- FastB2B- DisINTx-
	Status: Cap+ 66MHz- UDF- FastB2B- ParErr- DEVSEL=medium >TAbort- <TAbort- <MAbort- >SERR- <PERR- INTx-
	Interrupt: pin A routed to IRQ 255
	NUMA node: 0
	Region 0: Memory at dc000000 (32-bit, prefetchable) [size=16M]
	Region 1: Memory at ded00000 (32-bit, non-prefetchable) [size=128K]
	Region 2: I/O ports at 2000 [size=128]
	Expansion ROM at 000c0000 [virtual] [disabled] [size=128K]
	Capabilities: <access denied>

7f:08.0 System peripheral [0880]: Intel Corporation Xeon E7 v2/Xeon E5 v2/Core i7 QPI Link 0 [8086:0e80] (rev 04)
	Subsystem: Gigabyte Technology Co., Ltd Device [1458:0000]
	Control: I/O- Mem- BusMaster- SpecCycle- MemWINV- VGASnoop- ParErr- Stepping- SERR- FastB2B- DisINTx-
	Status: Cap- 66MHz- UDF- FastB2B- ParErr- DEVSEL=fast >TAbort- <TAbort- <MAbort- >SERR- <PERR- INTx-
	NUMA node: 0

7f:09.0 System peripheral [0880]: Intel Corporation Xeon E7 v2/Xeon E5 v2/Core i7 QPI Link 1 [8086:0e90] (rev 04)
	Subsystem: Gigabyte Technology Co., Ltd Device [1458:0000]
	Control: I/O- Mem- BusMaster- SpecCycle- MemWINV- VGASnoop- ParErr- Stepping- SERR- FastB2B- DisINTx-
	Status: Cap- 66MHz- UDF- FastB2B- ParErr- DEVSEL=fast >TAbort- <TAbort- <MAbort- >SERR- <PERR- INTx-
	NUMA node: 0

7f:0a.0 System peripheral [0880]: Intel Corporation Xeon E7 v2/Xeon E5 v2/Core i7 Power Control Unit 0 [8086:0ec0] (rev 04)
	Subsystem: Gigabyte Technology Co., Ltd Device [1458:0000]
	Control: I/O- Mem- BusMaster- SpecCycle- MemWINV- VGASnoop- ParErr- Stepping- SERR- FastB2B- DisINTx-
	Status: Cap- 66MHz- UDF- FastB2B- ParErr- DEVSEL=fast >TAbort- <TAbort- <MAbort- >SERR- <PERR- INTx-
	NUMA node: 0

7f:0a.1 System peripheral [0880]: Intel Corporation Xeon E7 v2/Xeon E5 v2/Core i7 Power Control Unit 1 [8086:0ec1] (rev 04)
	Subsystem: Gigabyte Technology Co., Ltd Device [1458:0000]
	Control: I/O- Mem- BusMaster- SpecCycle- MemWINV- VGASnoop- ParErr- Stepping- SERR- FastB2B- DisINTx-
	Status: Cap- 66MHz- UDF- FastB2B- ParErr- DEVSEL=fast >TAbort- <TAbort- <MAbort- >SERR- <PERR- INTx-
	NUMA node: 0

7f:0a.2 System peripheral [0880]: Intel Corporation Xeon E7 v2/Xeon E5 v2/Core i7 Power Control Unit 2 [8086:0ec2] (rev 04)
	Subsystem: Gigabyte Technology Co., Ltd Device [1458:0000]
	Control: I/O- Mem- BusMaster- SpecCycle- MemWINV- VGASnoop- ParErr- Stepping- SERR- FastB2B- DisINTx-
	Status: Cap- 66MHz- UDF- FastB2B- ParErr- DEVSEL=fast >TAbort- <TAbort- <MAbort- >SERR- <PERR- INTx-
	NUMA node: 0

7f:0a.3 System peripheral [0880]: Intel Corporation Xeon E7 v2/Xeon E5 v2/Core i7 Power Control Unit 3 [8086:0ec3] (rev 04)
	Subsystem: Gigabyte Technology Co., Ltd Device [1458:0000]
	Control: I/O- Mem- BusMaster- SpecCycle- MemWINV- VGASnoop- ParErr- Stepping- SERR- FastB2B- DisINTx-
	Status: Cap- 66MHz- UDF- FastB2B- ParErr- DEVSEL=fast >TAbort- <TAbort- <MAbort- >SERR- <PERR- INTx-
	NUMA node: 0

7f:0b.0 System peripheral [0880]: Intel Corporation Xeon E7 v2/Xeon E5 v2/Core i7 UBOX Registers [8086:0e1e] (rev 04)
	Subsystem: Gigabyte Technology Co., Ltd Device [1458:0000]
	Control: I/O- Mem- BusMaster- SpecCycle- MemWINV- VGASnoop- ParErr- Stepping- SERR- FastB2B- DisINTx-
	Status: Cap- 66MHz- UDF- FastB2B- ParErr- DEVSEL=fast >TAbort- <TAbort- <MAbort- >SERR- <PERR- INTx-
	NUMA node: 0

7f:0b.3 System peripheral [0880]: Intel Corporation Xeon E7 v2/Xeon E5 v2/Core i7 UBOX Registers [8086:0e1f] (rev 04)
	Subsystem: Gigabyte Technology Co., Ltd Device [1458:0000]
	Control: I/O- Mem- BusMaster- SpecCycle- MemWINV- VGASnoop- ParErr- Stepping- SERR- FastB2B- DisINTx-
	Status: Cap- 66MHz- UDF- FastB2B- ParErr- DEVSEL=fast >TAbort- <TAbort- <MAbort- >SERR- <PERR- INTx-
	NUMA node: 0

7f:0c.0 System peripheral [0880]: Intel Corporation Xeon E7 v2/Xeon E5 v2/Core i7 Unicast Registers [8086:0ee0] (rev 04)
	Subsystem: Gigabyte Technology Co., Ltd Device [1458:0000]
	Control: I/O- Mem- BusMaster- SpecCycle- MemWINV- VGASnoop- ParErr- Stepping- SERR- FastB2B- DisINTx-
	Status: Cap- 66MHz- UDF- FastB2B- ParErr- DEVSEL=fast >TAbort- <TAbort- <MAbort- >SERR- <PERR- INTx-
	NUMA node: 0

7f:0c.1 System peripheral [0880]: Intel Corporation Xeon E7 v2/Xeon E5 v2/Core i7 Unicast Registers [8086:0ee2] (rev 04)
	Subsystem: Gigabyte Technology Co., Ltd Device [1458:0000]
	Control: I/O- Mem- BusMaster- SpecCycle- MemWINV- VGASnoop- ParErr- Stepping- SERR- FastB2B- DisINTx-
	Status: Cap- 66MHz- UDF- FastB2B- ParErr- DEVSEL=fast >TAbort- <TAbort- <MAbort- >SERR- <PERR- INTx-
	NUMA node: 0

7f:0c.2 System peripheral [0880]: Intel Corporation Xeon E7 v2/Xeon E5 v2/Core i7 Unicast Registers [8086:0ee4] (rev 04)
	Subsystem: Gigabyte Technology Co., Ltd Device [1458:0000]
	Control: I/O- Mem- BusMaster- SpecCycle- MemWINV- VGASnoop- ParErr- Stepping- SERR- FastB2B- DisINTx-
	Status: Cap- 66MHz- UDF- FastB2B- ParErr- DEVSEL=fast >TAbort- <TAbort- <MAbort- >SERR- <PERR- INTx-
	NUMA node: 0

7f:0c.3 System peripheral [0880]: Intel Corporation Xeon E7 v2/Xeon E5 v2/Core i7 Unicast Registers [8086:0ee6] (rev 04)
	Subsystem: Gigabyte Technology Co., Ltd Device [1458:0000]
	Control: I/O- Mem- BusMaster- SpecCycle- MemWINV- VGASnoop- ParErr- Stepping- SERR- FastB2B- DisINTx-
	Status: Cap- 66MHz- UDF- FastB2B- ParErr- DEVSEL=fast >TAbort- <TAbort- <MAbort- >SERR- <PERR- INTx-
	NUMA node: 0

7f:0c.4 System peripheral [0880]: Intel Corporation Xeon E7 v2/Xeon E5 v2/Core i7 Unicast Registers [8086:0ee8] (rev 04)
	Subsystem: Gigabyte Technology Co., Ltd Device [1458:0000]
	Control: I/O- Mem- BusMaster- SpecCycle- MemWINV- VGASnoop- ParErr- Stepping- SERR- FastB2B- DisINTx-
	Status: Cap- 66MHz- UDF- FastB2B- ParErr- DEVSEL=fast >TAbort- <TAbort- <MAbort- >SERR- <PERR- INTx-
	NUMA node: 0

7f:0d.0 System peripheral [0880]: Intel Corporation Xeon E7 v2/Xeon E5 v2/Core i7 Unicast Registers [8086:0ee1] (rev 04)
	Subsystem: Gigabyte Technology Co., Ltd Device [1458:0000]
	Control: I/O- Mem- BusMaster- SpecCycle- MemWINV- VGASnoop- ParErr- Stepping- SERR- FastB2B- DisINTx-
	Status: Cap- 66MHz- UDF- FastB2B- ParErr- DEVSEL=fast >TAbort- <TAbort- <MAbort- >SERR- <PERR- INTx-
	NUMA node: 0

7f:0d.1 System peripheral [0880]: Intel Corporation Xeon E7 v2/Xeon E5 v2/Core i7 Unicast Registers [8086:0ee3] (rev 04)
	Subsystem: Gigabyte Technology Co., Ltd Device [1458:0000]
	Control: I/O- Mem- BusMaster- SpecCycle- MemWINV- VGASnoop- ParErr- Stepping- SERR- FastB2B- DisINTx-
	Status: Cap- 66MHz- UDF- FastB2B- ParErr- DEVSEL=fast >TAbort- <TAbort- <MAbort- >SERR- <PERR- INTx-
	NUMA node: 0

7f:0d.2 System peripheral [0880]: Intel Corporation Xeon E7 v2/Xeon E5 v2/Core i7 Unicast Registers [8086:0ee5] (rev 04)
	Subsystem: Gigabyte Technology Co., Ltd Device [1458:0000]
	Control: I/O- Mem- BusMaster- SpecCycle- MemWINV- VGASnoop- ParErr- Stepping- SERR- FastB2B- DisINTx-
	Status: Cap- 66MHz- UDF- FastB2B- ParErr- DEVSEL=fast >TAbort- <TAbort- <MAbort- >SERR- <PERR- INTx-
	NUMA node: 0

7f:0d.3 System peripheral [0880]: Intel Corporation Xeon E7 v2/Xeon E5 v2/Core i7 Unicast Registers [8086:0ee7] (rev 04)
	Subsystem: Gigabyte Technology Co., Ltd Device [1458:0000]
	Control: I/O- Mem- BusMaster- SpecCycle- MemWINV- VGASnoop- ParErr- Stepping- SERR- FastB2B- DisINTx-
	Status: Cap- 66MHz- UDF- FastB2B- ParErr- DEVSEL=fast >TAbort- <TAbort- <MAbort- >SERR- <PERR- INTx-
	NUMA node: 0

7f:0d.4 System peripheral [0880]: Intel Corporation Xeon E7 v2/Xeon E5 v2/Core i7 Unicast Registers [8086:0ee9] (rev 04)
	Subsystem: Gigabyte Technology Co., Ltd Device [1458:0000]
	Control: I/O- Mem- BusMaster- SpecCycle- MemWINV- VGASnoop- ParErr- Stepping- SERR- FastB2B- DisINTx-
	Status: Cap- 66MHz- UDF- FastB2B- ParErr- DEVSEL=fast >TAbort- <TAbort- <MAbort- >SERR- <PERR- INTx-
	NUMA node: 0

7f:0e.0 System peripheral [0880]: Intel Corporation Xeon E7 v2/Xeon E5 v2/Core i7 Home Agent 0 [8086:0ea0] (rev 04)
	Subsystem: Gigabyte Technology Co., Ltd Device [1458:0000]
	Control: I/O- Mem- BusMaster- SpecCycle- MemWINV- VGASnoop- ParErr- Stepping- SERR- FastB2B- DisINTx-
	Status: Cap- 66MHz- UDF- FastB2B- ParErr- DEVSEL=fast >TAbort- <TAbort- <MAbort- >SERR- <PERR- INTx-
	NUMA node: 0

7f:0e.1 Performance counters [1101]: Intel Corporation Xeon E7 v2/Xeon E5 v2/Core i7 Home Agent 0 [8086:0e30] (rev 04)
	Subsystem: Gigabyte Technology Co., Ltd Device [1458:0000]
	Control: I/O- Mem- BusMaster- SpecCycle- MemWINV- VGASnoop- ParErr- Stepping- SERR- FastB2B- DisINTx-
	Status: Cap- 66MHz- UDF- FastB2B- ParErr- DEVSEL=fast >TAbort- <TAbort- <MAbort- >SERR- <PERR- INTx-
	NUMA node: 0
	Kernel driver in use: ivbep_uncore

7f:0f.0 System peripheral [0880]: Intel Corporation Xeon E7 v2/Xeon E5 v2/Core i7 Integrated Memory Controller 0 Target Address/Thermal Registers [8086:0ea8] (rev 04)
	Subsystem: Gigabyte Technology Co., Ltd Device [1458:0000]
	Control: I/O- Mem- BusMaster- SpecCycle- MemWINV- VGASnoop- ParErr- Stepping- SERR- FastB2B- DisINTx-
	Status: Cap+ 66MHz- UDF- FastB2B- ParErr- DEVSEL=fast >TAbort- <TAbort- <MAbort- >SERR- <PERR- INTx-
	NUMA node: 0
	Capabilities: <access denied>

7f:0f.1 System peripheral [0880]: Intel Corporation Xeon E7 v2/Xeon E5 v2/Core i7 Integrated Memory Controller 0 RAS Registers [8086:0e71] (rev 04)
	Subsystem: Gigabyte Technology Co., Ltd Device [1458:0000]
	Control: I/O- Mem- BusMaster- SpecCycle- MemWINV- VGASnoop- ParErr- Stepping- SERR- FastB2B- DisINTx-
	Status: Cap+ 66MHz- UDF- FastB2B- ParErr- DEVSEL=fast >TAbort- <TAbort- <MAbort- >SERR- <PERR- INTx-
	NUMA node: 0
	Capabilities: <access denied>

7f:0f.2 System peripheral [0880]: Intel Corporation Xeon E7 v2/Xeon E5 v2/Core i7 Integrated Memory Controller 0 Channel Target Address Decoder Registers [808... (rev 04)
	Subsystem: Gigabyte Technology Co., Ltd Device [1458:0000]
	Control: I/O- Mem- BusMaster- SpecCycle- MemWINV- VGASnoop- ParErr- Stepping- SERR- FastB2B- DisINTx-
	Status: Cap+ 66MHz- UDF- FastB2B- ParErr- DEVSEL=fast >TAbort- <TAbort- <MAbort- >SERR- <PERR- INTx-
	NUMA node: 0
	Capabilities: <access denied>

7f:0f.3 System peripheral [0880]: Intel Corporation Xeon E7 v2/Xeon E5 v2/Core i7 Integrated Memory Controller 0 Channel Target Address Decoder Registers [808... (rev 04)
	Subsystem: Gigabyte Technology Co., Ltd Device [1458:0000]
	Control: I/O- Mem- BusMaster- SpecCycle- MemWINV- VGASnoop- ParErr- Stepping- SERR- FastB2B- DisINTx-
	Status: Cap+ 66MHz- UDF- FastB2B- ParErr- DEVSEL=fast >TAbort- <TAbort- <MAbort- >SERR- <PERR- INTx-
	NUMA node: 0
	Capabilities: <access denied>

7f:0f.4 System peripheral [0880]: Intel Corporation Xeon E7 v2/Xeon E5 v2/Core i7 Integrated Memory Controller 0 Channel Target Address Decoder Registers [808... (rev 04)
	Subsystem: Gigabyte Technology Co., Ltd Device [1458:0000]
	Control: I/O- Mem- BusMaster- SpecCycle- MemWINV- VGASnoop- ParErr- Stepping- SERR- FastB2B- DisINTx-
	Status: Cap+ 66MHz- UDF- FastB2B- ParErr- DEVSEL=fast >TAbort- <TAbort- <MAbort- >SERR- <PERR- INTx-
	NUMA node: 0
	Capabilities: <access denied>

7f:0f.5 System peripheral [0880]: Intel Corporation Xeon E7 v2/Xeon E5 v2/Core i7 Integrated Memory Controller 0 Channel Target Address Decoder Registers [808... (rev 04)
	Subsystem: Gigabyte Technology Co., Ltd Device [1458:0000]
	Control: I/O- Mem- BusMaster- SpecCycle- MemWINV- VGASnoop- ParErr- Stepping- SERR- FastB2B- DisINTx-
	Status: Cap+ 66MHz- UDF- FastB2B- ParErr- DEVSEL=fast >TAbort- <TAbort- <MAbort- >SERR- <PERR- INTx-
	NUMA node: 0
	Capabilities: <access denied>

7f:10.0 System peripheral [0880]: Intel Corporation Xeon E7 v2/Xeon E5 v2/Core i7 Integrated Memory Controller 1 Channel 0-3 Thermal Control 0 [8086:0eb0] (rev 04)
	Subsystem: Gigabyte Technology Co., Ltd Device [1458:0000]
	Control: I/O- Mem- BusMaster- SpecCycle- MemWINV- VGASnoop- ParErr- Stepping- SERR- FastB2B- DisINTx-
	Status: Cap+ 66MHz- UDF- FastB2B- ParErr- DEVSEL=fast >TAbort- <TAbort- <MAbort- >SERR- <PERR- INTx-
	NUMA node: 0
	Capabilities: <access denied>
	Kernel driver in use: ivbep_uncore

7f:10.1 System peripheral [0880]: Intel Corporation Xeon E7 v2/Xeon E5 v2/Core i7 Integrated Memory Controller 1 Channel 0-3 Thermal Control 1 [8086:0eb1] (rev 04)
	Subsystem: Gigabyte Technology Co., Ltd Device [1458:0000]
	Control: I/O- Mem- BusMaster- SpecCycle- MemWINV- VGASnoop- ParErr- Stepping- SERR- FastB2B- DisINTx-
	Status: Cap+ 66MHz- UDF- FastB2B- ParErr- DEVSEL=fast >TAbort- <TAbort- <MAbort- >SERR- <PERR- INTx-
	NUMA node: 0
	Capabilities: <access denied>
	Kernel driver in use: ivbep_uncore

7f:10.2 System peripheral [0880]: Intel Corporation Xeon E7 v2/Xeon E5 v2/Core i7 Integrated Memory Controller 1 Channel 0-3 ERROR Registers 0 [8086:0eb2] (rev 04)
	Subsystem: Gigabyte Technology Co., Ltd Device [1458:0000]
	Control: I/O- Mem- BusMaster- SpecCycle- MemWINV- VGASnoop- ParErr- Stepping- SERR- FastB2B- DisINTx-
	Status: Cap+ 66MHz- UDF- FastB2B- ParErr- DEVSEL=fast >TAbort- <TAbort- <MAbort- >SERR- <PERR- INTx-
	NUMA node: 0
	Capabilities: <access denied>

7f:10.3 System peripheral [0880]: Intel Corporation Xeon E7 v2/Xeon E5 v2/Core i7 Integrated Memory Controller 1 Channel 0-3 ERROR Registers 1 [8086:0eb3] (rev 04)
	Subsystem: Gigabyte Technology Co., Ltd Device [1458:0000]
	Control: I/O- Mem- BusMaster- SpecCycle- MemWINV- VGASnoop- ParErr- Stepping- SERR- FastB2B- DisINTx-
	Status: Cap+ 66MHz- UDF- FastB2B- ParErr- DEVSEL=fast >TAbort- <TAbort- <MAbort- >SERR- <PERR- INTx-
	NUMA node: 0
	Capabilities: <access denied>

7f:10.4 System peripheral [0880]: Intel Corporation Xeon E7 v2/Xeon E5 v2/Core i7 Integrated Memory Controller 1 Channel 0-3 Thermal Control 2 [8086:0eb4] (rev 04)
	Subsystem: Gigabyte Technology Co., Ltd Device [1458:0000]
	Control: I/O- Mem- BusMaster- SpecCycle- MemWINV- VGASnoop- ParErr- Stepping- SERR- FastB2B- DisINTx-
	Status: Cap+ 66MHz- UDF- FastB2B- ParErr- DEVSEL=fast >TAbort- <TAbort- <MAbort- >SERR- <PERR- INTx-
	NUMA node: 0
	Capabilities: <access denied>
	Kernel driver in use: ivbep_uncore

7f:10.5 System peripheral [0880]: Intel Corporation Xeon E7 v2/Xeon E5 v2/Core i7 Integrated Memory Controller 1 Channel 0-3 Thermal Control 3 [8086:0eb5] (rev 04)
	Subsystem: Gigabyte Technology Co., Ltd Device [1458:0000]
	Control: I/O- Mem- BusMaster- SpecCycle- MemWINV- VGASnoop- ParErr- Stepping- SERR- FastB2B- DisINTx-
	Status: Cap+ 66MHz- UDF- FastB2B- ParErr- DEVSEL=fast >TAbort- <TAbort- <MAbort- >SERR- <PERR- INTx-
	NUMA node: 0
	Capabilities: <access denied>
	Kernel driver in use: ivbep_uncore

7f:10.6 System peripheral [0880]: Intel Corporation Xeon E7 v2/Xeon E5 v2/Core i7 Integrated Memory Controller 1 Channel 0-3 ERROR Registers 2 [8086:0eb6] (rev 04)
	Subsystem: Gigabyte Technology Co., Ltd Device [1458:0000]
	Control: I/O- Mem- BusMaster- SpecCycle- MemWINV- VGASnoop- ParErr- Stepping- SERR- FastB2B- DisINTx-
	Status: Cap+ 66MHz- UDF- FastB2B- ParErr- DEVSEL=fast >TAbort- <TAbort- <MAbort- >SERR- <PERR- INTx-
	NUMA node: 0
	Capabilities: <access denied>

7f:10.7 System peripheral [0880]: Intel Corporation Xeon E7 v2/Xeon E5 v2/Core i7 Integrated Memory Controller 1 Channel 0-3 ERROR Registers 3 [8086:0eb7] (rev 04)
	Subsystem: Gigabyte Technology Co., Ltd Device [1458:0000]
	Control: I/O- Mem- BusMaster- SpecCycle- MemWINV- VGASnoop- ParErr- Stepping- SERR- FastB2B- DisINTx-
	Status: Cap+ 66MHz- UDF- FastB2B- ParErr- DEVSEL=fast >TAbort- <TAbort- <MAbort- >SERR- <PERR- INTx-
	NUMA node: 0
	Capabilities: <access denied>

7f:13.0 System peripheral [0880]: Intel Corporation Xeon E7 v2/Xeon E5 v2/Core i7 R2PCIe [8086:0e1d] (rev 04)
	Subsystem: Gigabyte Technology Co., Ltd Device [1458:0000]
	Control: I/O- Mem- BusMaster- SpecCycle- MemWINV- VGASnoop- ParErr- Stepping- SERR- FastB2B- DisINTx-
	Status: Cap- 66MHz- UDF- FastB2B- ParErr- DEVSEL=fast >TAbort- <TAbort- <MAbort- >SERR- <PERR- INTx-
	NUMA node: 0

7f:13.1 Performance counters [1101]: Intel Corporation Xeon E7 v2/Xeon E5 v2/Core i7 R2PCIe [8086:0e34] (rev 04)
	Subsystem: Gigabyte Technology Co., Ltd Device [1458:0000]
	Control: I/O- Mem- BusMaster- SpecCycle- MemWINV- VGASnoop- ParErr- Stepping- SERR- FastB2B- DisINTx-
	Status: Cap- 66MHz- UDF- FastB2B- ParErr- DEVSEL=fast >TAbort- <TAbort- <MAbort- >SERR- <PERR- INTx-
	NUMA node: 0
	Kernel driver in use: ivbep_uncore

7f:13.4 System peripheral [0880]: Intel Corporation Xeon E7 v2/Xeon E5 v2/Core i7 QPI Ring Registers [8086:0e81] (rev 04)
	Subsystem: Gigabyte Technology Co., Ltd Device [1458:0000]
	Control: I/O- Mem- BusMaster- SpecCycle- MemWINV- VGASnoop- ParErr- Stepping- SERR- FastB2B- DisINTx-
	Status: Cap- 66MHz- UDF- FastB2B- ParErr- DEVSEL=fast >TAbort- <TAbort- <MAbort- >SERR- <PERR- INTx-
	NUMA node: 0

7f:13.5 Performance counters [1101]: Intel Corporation Xeon E7 v2/Xeon E5 v2/Core i7 QPI Ring Performance Ring Monitoring [8086:0e36] (rev 04)
	Subsystem: Gigabyte Technology Co., Ltd Device [1458:0000]
	Control: I/O- Mem- BusMaster- SpecCycle- MemWINV- VGASnoop- ParErr- Stepping- SERR- FastB2B- DisINTx-
	Status: Cap- 66MHz- UDF- FastB2B- ParErr- DEVSEL=fast >TAbort- <TAbort- <MAbort- >SERR- <PERR- INTx-
	NUMA node: 0
	Kernel driver in use: ivbep_uncore

7f:16.0 System peripheral [0880]: Intel Corporation Xeon E7 v2/Xeon E5 v2/Core i7 System Address Decoder [8086:0ec8] (rev 04)
	Subsystem: Gigabyte Technology Co., Ltd Device [1458:0000]
	Control: I/O- Mem- BusMaster- SpecCycle- MemWINV- VGASnoop- ParErr- Stepping- SERR- FastB2B- DisINTx-
	Status: Cap- 66MHz- UDF- FastB2B- ParErr- DEVSEL=fast >TAbort- <TAbort- <MAbort- >SERR- <PERR- INTx-
	NUMA node: 0

7f:16.1 System peripheral [0880]: Intel Corporation Xeon E7 v2/Xeon E5 v2/Core i7 Broadcast Registers [8086:0ec9] (rev 04)
	Subsystem: Gigabyte Technology Co., Ltd Device [1458:0000]
	Control: I/O- Mem- BusMaster- SpecCycle- MemWINV- VGASnoop- ParErr- Stepping- SERR- FastB2B- DisINTx-
	Status: Cap- 66MHz- UDF- FastB2B- ParErr- DEVSEL=fast >TAbort- <TAbort- <MAbort- >SERR- <PERR- INTx-
	NUMA node: 0

7f:16.2 System peripheral [0880]: Intel Corporation Xeon E7 v2/Xeon E5 v2/Core i7 Broadcast Registers [8086:0eca] (rev 04)
	Subsystem: Gigabyte Technology Co., Ltd Device [1458:0000]
	Control: I/O- Mem- BusMaster- SpecCycle- MemWINV- VGASnoop- ParErr- Stepping- SERR- FastB2B- DisINTx-
	Status: Cap- 66MHz- UDF- FastB2B- ParErr- DEVSEL=fast >TAbort- <TAbort- <MAbort- >SERR- <PERR- INTx-
	NUMA node: 0

80:00.0 PCI bridge [0604]: Intel Corporation Xeon E7 v2/Xeon E5 v2/Core i7 PCI Express Root Port in DMI2 Mode [8086:0e01] (rev 04) (prog-if 00 [Normal decode])
	Control: I/O+ Mem+ BusMaster+ SpecCycle- MemWINV- VGASnoop- ParErr- Stepping- SERR- FastB2B- DisINTx+
	Status: Cap+ 66MHz- UDF- FastB2B- ParErr- DEVSEL=fast >TAbort- <TAbort- <MAbort- >SERR- <PERR- INTx-
	Latency: 0, Cache Line Size: 64 bytes
	Interrupt: pin A routed to IRQ 36
	NUMA node: 1
	Bus: primary=80, secondary=81, subordinate=81, sec-latency=0
	I/O behind bridge: [disabled]
	Memory behind bridge: [disabled]
	Prefetchable memory behind bridge: [disabled]
	Secondary status: 66MHz- FastB2B- ParErr- DEVSEL=fast >TAbort- <TAbort- <MAbort- <SERR- <PERR-
	BridgeCtl: Parity- SERR+ NoISA- VGA- VGA16+ MAbort- >Reset- FastB2B-
		PriDiscTmr- SecDiscTmr- DiscTmrStat- DiscTmrSERREn-
	Capabilities: <access denied>
	Kernel driver in use: pcieport

80:03.0 PCI bridge [0604]: Intel Corporation Xeon E7 v2/Xeon E5 v2/Core i7 PCI Express Root Port 3a [8086:0e08] (rev 04) (prog-if 00 [Normal decode])
	Control: I/O+ Mem+ BusMaster+ SpecCycle- MemWINV- VGASnoop- ParErr- Stepping- SERR- FastB2B- DisINTx+
	Status: Cap+ 66MHz- UDF- FastB2B- ParErr- DEVSEL=fast >TAbort- <TAbort- <MAbort- >SERR- <PERR- INTx-
	Latency: 0, Cache Line Size: 64 bytes
	Interrupt: pin A routed to IRQ 37
	NUMA node: 1
	Bus: primary=80, secondary=82, subordinate=82, sec-latency=0
	I/O behind bridge: 0000f000-0000ffff [size=4K]
	Memory behind bridge: fa000000-fb0fffff [size=17M]
	Prefetchable memory behind bridge: 0000381fe0000000-0000381ff20fffff [size=289M]
	Secondary status: 66MHz- FastB2B- ParErr- DEVSEL=fast >TAbort- <TAbort- <MAbort+ <SERR- <PERR-
	BridgeCtl: Parity- SERR+ NoISA- VGA- VGA16+ MAbort- >Reset- FastB2B-
		PriDiscTmr- SecDiscTmr- DiscTmrStat- DiscTmrSERREn-
	Capabilities: <access denied>
	Kernel driver in use: pcieport

80:04.0 System peripheral [0880]: Intel Corporation Xeon E7 v2/Xeon E5 v2/Core i7 Crystal Beach DMA Channel 0 [8086:0e20] (rev 04)
	Subsystem: Gigabyte Technology Co., Ltd Device [1458:0000]
	Control: I/O- Mem+ BusMaster+ SpecCycle- MemWINV- VGASnoop- ParErr- Stepping- SERR- FastB2B- DisINTx+
	Status: Cap+ 66MHz- UDF- FastB2B- ParErr- DEVSEL=fast >TAbort- <TAbort- <MAbort- >SERR- <PERR- INTx-
	Latency: 0, Cache Line Size: 64 bytes
	Interrupt: pin A routed to IRQ 106
	NUMA node: 1
	Region 0: Memory at 381ffff1c000 (64-bit, non-prefetchable) [size=16K]
	Capabilities: <access denied>
	Kernel driver in use: ioatdma

80:04.1 System peripheral [0880]: Intel Corporation Xeon E7 v2/Xeon E5 v2/Core i7 Crystal Beach DMA Channel 1 [8086:0e21] (rev 04)
	Subsystem: Gigabyte Technology Co., Ltd Device [1458:0000]
	Control: I/O- Mem+ BusMaster+ SpecCycle- MemWINV- VGASnoop- ParErr- Stepping- SERR- FastB2B- DisINTx+
	Status: Cap+ 66MHz- UDF- FastB2B- ParErr- DEVSEL=fast >TAbort- <TAbort- <MAbort- >SERR- <PERR- INTx-
	Latency: 0, Cache Line Size: 64 bytes
	Interrupt: pin B routed to IRQ 108
	NUMA node: 1
	Region 0: Memory at 381ffff18000 (64-bit, non-prefetchable) [size=16K]
	Capabilities: <access denied>
	Kernel driver in use: ioatdma

80:04.2 System peripheral [0880]: Intel Corporation Xeon E7 v2/Xeon E5 v2/Core i7 Crystal Beach DMA Channel 2 [8086:0e22] (rev 04)
	Subsystem: Gigabyte Technology Co., Ltd Device [1458:0000]
	Control: I/O- Mem+ BusMaster+ SpecCycle- MemWINV- VGASnoop- ParErr- Stepping- SERR- FastB2B- DisINTx+
	Status: Cap+ 66MHz- UDF- FastB2B- ParErr- DEVSEL=fast >TAbort- <TAbort- <MAbort- >SERR- <PERR- INTx-
	Latency: 0, Cache Line Size: 64 bytes
	Interrupt: pin C routed to IRQ 106
	NUMA node: 1
	Region 0: Memory at 381ffff14000 (64-bit, non-prefetchable) [size=16K]
	Capabilities: <access denied>
	Kernel driver in use: ioatdma

80:04.3 System peripheral [0880]: Intel Corporation Xeon E7 v2/Xeon E5 v2/Core i7 Crystal Beach DMA Channel 3 [8086:0e23] (rev 04)
	Subsystem: Gigabyte Technology Co., Ltd Device [1458:0000]
	Control: I/O- Mem+ BusMaster+ SpecCycle- MemWINV- VGASnoop- ParErr- Stepping- SERR- FastB2B- DisINTx+
	Status: Cap+ 66MHz- UDF- FastB2B- ParErr- DEVSEL=fast >TAbort- <TAbort- <MAbort- >SERR- <PERR- INTx-
	Latency: 0, Cache Line Size: 64 bytes
	Interrupt: pin D routed to IRQ 108
	NUMA node: 1
	Region 0: Memory at 381ffff10000 (64-bit, non-prefetchable) [size=16K]
	Capabilities: <access denied>
	Kernel driver in use: ioatdma

80:04.4 System peripheral [0880]: Intel Corporation Xeon E7 v2/Xeon E5 v2/Core i7 Crystal Beach DMA Channel 4 [8086:0e24] (rev 04)
	Subsystem: Gigabyte Technology Co., Ltd Device [1458:0000]
	Control: I/O- Mem+ BusMaster+ SpecCycle- MemWINV- VGASnoop- ParErr- Stepping- SERR- FastB2B- DisINTx+
	Status: Cap+ 66MHz- UDF- FastB2B- ParErr- DEVSEL=fast >TAbort- <TAbort- <MAbort- >SERR- <PERR- INTx-
	Latency: 0, Cache Line Size: 64 bytes
	Interrupt: pin A routed to IRQ 106
	NUMA node: 1
	Region 0: Memory at 381ffff0c000 (64-bit, non-prefetchable) [size=16K]
	Capabilities: <access denied>
	Kernel driver in use: ioatdma

80:04.5 System peripheral [0880]: Intel Corporation Xeon E7 v2/Xeon E5 v2/Core i7 Crystal Beach DMA Channel 5 [8086:0e25] (rev 04)
	Subsystem: Gigabyte Technology Co., Ltd Device [1458:0000]
	Control: I/O- Mem+ BusMaster+ SpecCycle- MemWINV- VGASnoop- ParErr- Stepping- SERR- FastB2B- DisINTx+
	Status: Cap+ 66MHz- UDF- FastB2B- ParErr- DEVSEL=fast >TAbort- <TAbort- <MAbort- >SERR- <PERR- INTx-
	Latency: 0, Cache Line Size: 64 bytes
	Interrupt: pin B routed to IRQ 108
	NUMA node: 1
	Region 0: Memory at 381ffff08000 (64-bit, non-prefetchable) [size=16K]
	Capabilities: <access denied>
	Kernel driver in use: ioatdma

80:04.6 System peripheral [0880]: Intel Corporation Xeon E7 v2/Xeon E5 v2/Core i7 Crystal Beach DMA Channel 6 [8086:0e26] (rev 04)
	Subsystem: Gigabyte Technology Co., Ltd Device [1458:0000]
	Control: I/O- Mem+ BusMaster+ SpecCycle- MemWINV- VGASnoop- ParErr- Stepping- SERR- FastB2B- DisINTx+
	Status: Cap+ 66MHz- UDF- FastB2B- ParErr- DEVSEL=fast >TAbort- <TAbort- <MAbort- >SERR- <PERR- INTx-
	Latency: 0, Cache Line Size: 64 bytes
	Interrupt: pin C routed to IRQ 106
	NUMA node: 1
	Region 0: Memory at 381ffff04000 (64-bit, non-prefetchable) [size=16K]
	Capabilities: <access denied>
	Kernel driver in use: ioatdma

80:04.7 System peripheral [0880]: Intel Corporation Xeon E7 v2/Xeon E5 v2/Core i7 Crystal Beach DMA Channel 7 [8086:0e27] (rev 04)
	Subsystem: Gigabyte Technology Co., Ltd Device [1458:0000]
	Control: I/O- Mem+ BusMaster+ SpecCycle- MemWINV- VGASnoop- ParErr- Stepping- SERR- FastB2B- DisINTx+
	Status: Cap+ 66MHz- UDF- FastB2B- ParErr- DEVSEL=fast >TAbort- <TAbort- <MAbort- >SERR- <PERR- INTx-
	Latency: 0, Cache Line Size: 64 bytes
	Interrupt: pin D routed to IRQ 108
	NUMA node: 1
	Region 0: Memory at 381ffff00000 (64-bit, non-prefetchable) [size=16K]
	Capabilities: <access denied>
	Kernel driver in use: ioatdma

80:05.0 System peripheral [0880]: Intel Corporation Xeon E7 v2/Xeon E5 v2/Core i7 VTd/Memory Map/Misc [8086:0e28] (rev 04)
	Subsystem: Gigabyte Technology Co., Ltd Device [1458:0000]
	Control: I/O- Mem- BusMaster- SpecCycle- MemWINV- VGASnoop- ParErr- Stepping- SERR- FastB2B- DisINTx-
	Status: Cap+ 66MHz- UDF- FastB2B- ParErr- DEVSEL=fast >TAbort- <TAbort- <MAbort- >SERR- <PERR- INTx-
	NUMA node: 1
	Capabilities: <access denied>

80:05.2 System peripheral [0880]: Intel Corporation Xeon E7 v2/Xeon E5 v2/Core i7 IIO RAS [8086:0e2a] (rev 04)
	Subsystem: Gigabyte Technology Co., Ltd Device [1458:0000]
	Control: I/O- Mem- BusMaster- SpecCycle- MemWINV- VGASnoop- ParErr- Stepping- SERR- FastB2B- DisINTx-
	Status: Cap+ 66MHz- UDF- FastB2B- ParErr- DEVSEL=fast >TAbort- <TAbort- <MAbort- >SERR- <PERR- INTx-
	NUMA node: 1
	Capabilities: <access denied>

80:05.4 PIC [0800]: Intel Corporation Xeon E7 v2/Xeon E5 v2/Core i7 IOAPIC [8086:0e2c] (rev 04) (prog-if 20 [IO(X)-APIC])
	Subsystem: Gigabyte Technology Co., Ltd Device [1458:0000]
	Control: I/O- Mem+ BusMaster+ SpecCycle- MemWINV- VGASnoop- ParErr- Stepping- SERR- FastB2B- DisINTx-
	Status: Cap+ 66MHz- UDF- FastB2B- ParErr- DEVSEL=fast >TAbort- <TAbort- <MAbort- >SERR- <PERR- INTx-
	Latency: 0, Cache Line Size: 64 bytes
	NUMA node: 1
	Region 0: Memory at fb100000 (32-bit, non-prefetchable) [size=4K]
	Capabilities: <access denied>

82:00.0 VGA compatible controller [0300]: NVIDIA Corporation TU102 [GeForce RTX 2080 Ti] [10de:1e04] (rev a1) (prog-if 00 [VGA controller])
	Subsystem: ASUSTeK Computer Inc. Device [1043:8675]
	Control: I/O+ Mem+ BusMaster+ SpecCycle- MemWINV- VGASnoop- ParErr- Stepping- SERR- FastB2B- DisINTx+
	Status: Cap+ 66MHz- UDF- FastB2B- ParErr- DEVSEL=fast >TAbort- <TAbort- <MAbort- >SERR- <PERR- INTx-
	Latency: 0
	Interrupt: pin A routed to IRQ 119
	NUMA node: 1
	Region 0: Memory at fa000000 (32-bit, non-prefetchable) [size=16M]
	Region 1: Memory at 381fe0000000 (64-bit, prefetchable) [size=256M]
	Region 3: Memory at 381ff0000000 (64-bit, prefetchable) [size=32M]
	Region 5: I/O ports at f000 [size=128]
	Expansion ROM at fb000000 [virtual] [disabled] [size=512K]
	Capabilities: <access denied>
	Kernel driver in use: nvidia

82:00.1 Audio device [0403]: NVIDIA Corporation TU102 High Definition Audio Controller [10de:10f7] (rev a1)
	Subsystem: ASUSTeK Computer Inc. Device [1043:8675]
	Control: I/O- Mem+ BusMaster+ SpecCycle- MemWINV- VGASnoop- ParErr- Stepping- SERR- FastB2B- DisINTx-
	Status: Cap+ 66MHz- UDF- FastB2B- ParErr- DEVSEL=fast >TAbort- <TAbort- <MAbort- >SERR- <PERR- INTx-
	Latency: 0, Cache Line Size: 64 bytes
	Interrupt: pin B routed to IRQ 116
	NUMA node: 1
	Region 0: Memory at fb080000 (32-bit, non-prefetchable) [size=16K]
	Capabilities: <access denied>
	Kernel driver in use: snd_hda_intel

82:00.2 USB controller [0c03]: NVIDIA Corporation TU102 USB 3.1 Host Controller [10de:1ad6] (rev a1) (prog-if 30 [XHCI])
	Subsystem: ASUSTeK Computer Inc. Device [1043:8675]
	Control: I/O- Mem+ BusMaster- SpecCycle- MemWINV- VGASnoop- ParErr- Stepping- SERR- FastB2B- DisINTx+
	Status: Cap+ 66MHz- UDF- FastB2B- ParErr- DEVSEL=fast >TAbort- <TAbort- <MAbort- >SERR- <PERR- INTx-
	Interrupt: pin C routed to IRQ 43
	NUMA node: 1
	Region 0: Memory at 381ff2000000 (64-bit, prefetchable) [size=256K]
	Region 3: Memory at 381ff2040000 (64-bit, prefetchable) [size=64K]
	Capabilities: <access denied>
	Kernel driver in use: xhci_hcd

82:00.3 Serial bus controller [0c80]: NVIDIA Corporation TU102 USB Type-C UCSI Controller [10de:1ad7] (rev a1)
	Subsystem: ASUSTeK Computer Inc. Device [1043:8675]
	Control: I/O- Mem+ BusMaster+ SpecCycle- MemWINV- VGASnoop- ParErr- Stepping- SERR- FastB2B- DisINTx+
	Status: Cap+ 66MHz- UDF- FastB2B- ParErr- DEVSEL=fast >TAbort- <TAbort- <MAbort- >SERR- <PERR- INTx-
	Latency: 0, Cache Line Size: 64 bytes
	Interrupt: pin D routed to IRQ 41
	NUMA node: 1
	Region 0: Memory at fb084000 (32-bit, non-prefetchable) [size=4K]
	Capabilities: <access denied>
	Kernel driver in use: nvidia-gpu

ff:08.0 System peripheral [0880]: Intel Corporation Xeon E7 v2/Xeon E5 v2/Core i7 QPI Link 0 [8086:0e80] (rev 04)
	Subsystem: Gigabyte Technology Co., Ltd Device [1458:0000]
	Control: I/O- Mem- BusMaster- SpecCycle- MemWINV- VGASnoop- ParErr- Stepping- SERR- FastB2B- DisINTx-
	Status: Cap- 66MHz- UDF- FastB2B- ParErr- DEVSEL=fast >TAbort- <TAbort- <MAbort- >SERR- <PERR- INTx-
	NUMA node: 1

ff:09.0 System peripheral [0880]: Intel Corporation Xeon E7 v2/Xeon E5 v2/Core i7 QPI Link 1 [8086:0e90] (rev 04)
	Subsystem: Gigabyte Technology Co., Ltd Device [1458:0000]
	Control: I/O- Mem- BusMaster- SpecCycle- MemWINV- VGASnoop- ParErr- Stepping- SERR- FastB2B- DisINTx-
	Status: Cap- 66MHz- UDF- FastB2B- ParErr- DEVSEL=fast >TAbort- <TAbort- <MAbort- >SERR- <PERR- INTx-
	NUMA node: 1

ff:0a.0 System peripheral [0880]: Intel Corporation Xeon E7 v2/Xeon E5 v2/Core i7 Power Control Unit 0 [8086:0ec0] (rev 04)
	Subsystem: Gigabyte Technology Co., Ltd Device [1458:0000]
	Control: I/O- Mem- BusMaster- SpecCycle- MemWINV- VGASnoop- ParErr- Stepping- SERR- FastB2B- DisINTx-
	Status: Cap- 66MHz- UDF- FastB2B- ParErr- DEVSEL=fast >TAbort- <TAbort- <MAbort- >SERR- <PERR- INTx-
	NUMA node: 1

ff:0a.1 System peripheral [0880]: Intel Corporation Xeon E7 v2/Xeon E5 v2/Core i7 Power Control Unit 1 [8086:0ec1] (rev 04)
	Subsystem: Gigabyte Technology Co., Ltd Device [1458:0000]
	Control: I/O- Mem- BusMaster- SpecCycle- MemWINV- VGASnoop- ParErr- Stepping- SERR- FastB2B- DisINTx-
	Status: Cap- 66MHz- UDF- FastB2B- ParErr- DEVSEL=fast >TAbort- <TAbort- <MAbort- >SERR- <PERR- INTx-
	NUMA node: 1

ff:0a.2 System peripheral [0880]: Intel Corporation Xeon E7 v2/Xeon E5 v2/Core i7 Power Control Unit 2 [8086:0ec2] (rev 04)
	Subsystem: Gigabyte Technology Co., Ltd Device [1458:0000]
	Control: I/O- Mem- BusMaster- SpecCycle- MemWINV- VGASnoop- ParErr- Stepping- SERR- FastB2B- DisINTx-
	Status: Cap- 66MHz- UDF- FastB2B- ParErr- DEVSEL=fast >TAbort- <TAbort- <MAbort- >SERR- <PERR- INTx-
	NUMA node: 1

ff:0a.3 System peripheral [0880]: Intel Corporation Xeon E7 v2/Xeon E5 v2/Core i7 Power Control Unit 3 [8086:0ec3] (rev 04)
	Subsystem: Gigabyte Technology Co., Ltd Device [1458:0000]
	Control: I/O- Mem- BusMaster- SpecCycle- MemWINV- VGASnoop- ParErr- Stepping- SERR- FastB2B- DisINTx-
	Status: Cap- 66MHz- UDF- FastB2B- ParErr- DEVSEL=fast >TAbort- <TAbort- <MAbort- >SERR- <PERR- INTx-
	NUMA node: 1

ff:0b.0 System peripheral [0880]: Intel Corporation Xeon E7 v2/Xeon E5 v2/Core i7 UBOX Registers [8086:0e1e] (rev 04)
	Subsystem: Gigabyte Technology Co., Ltd Device [1458:0000]
	Control: I/O- Mem- BusMaster- SpecCycle- MemWINV- VGASnoop- ParErr- Stepping- SERR- FastB2B- DisINTx-
	Status: Cap- 66MHz- UDF- FastB2B- ParErr- DEVSEL=fast >TAbort- <TAbort- <MAbort- >SERR- <PERR- INTx-
	NUMA node: 1

ff:0b.3 System peripheral [0880]: Intel Corporation Xeon E7 v2/Xeon E5 v2/Core i7 UBOX Registers [8086:0e1f] (rev 04)
	Subsystem: Gigabyte Technology Co., Ltd Device [1458:0000]
	Control: I/O- Mem- BusMaster- SpecCycle- MemWINV- VGASnoop- ParErr- Stepping- SERR- FastB2B- DisINTx-
	Status: Cap- 66MHz- UDF- FastB2B- ParErr- DEVSEL=fast >TAbort- <TAbort- <MAbort- >SERR- <PERR- INTx-
	NUMA node: 1

ff:0c.0 System peripheral [0880]: Intel Corporation Xeon E7 v2/Xeon E5 v2/Core i7 Unicast Registers [8086:0ee0] (rev 04)
	Subsystem: Gigabyte Technology Co., Ltd Device [1458:0000]
	Control: I/O- Mem- BusMaster- SpecCycle- MemWINV- VGASnoop- ParErr- Stepping- SERR- FastB2B- DisINTx-
	Status: Cap- 66MHz- UDF- FastB2B- ParErr- DEVSEL=fast >TAbort- <TAbort- <MAbort- >SERR- <PERR- INTx-
	NUMA node: 1

ff:0c.1 System peripheral [0880]: Intel Corporation Xeon E7 v2/Xeon E5 v2/Core i7 Unicast Registers [8086:0ee2] (rev 04)
	Subsystem: Gigabyte Technology Co., Ltd Device [1458:0000]
	Control: I/O- Mem- BusMaster- SpecCycle- MemWINV- VGASnoop- ParErr- Stepping- SERR- FastB2B- DisINTx-
	Status: Cap- 66MHz- UDF- FastB2B- ParErr- DEVSEL=fast >TAbort- <TAbort- <MAbort- >SERR- <PERR- INTx-
	NUMA node: 1

ff:0c.2 System peripheral [0880]: Intel Corporation Xeon E7 v2/Xeon E5 v2/Core i7 Unicast Registers [8086:0ee4] (rev 04)
	Subsystem: Gigabyte Technology Co., Ltd Device [1458:0000]
	Control: I/O- Mem- BusMaster- SpecCycle- MemWINV- VGASnoop- ParErr- Stepping- SERR- FastB2B- DisINTx-
	Status: Cap- 66MHz- UDF- FastB2B- ParErr- DEVSEL=fast >TAbort- <TAbort- <MAbort- >SERR- <PERR- INTx-
	NUMA node: 1

ff:0c.3 System peripheral [0880]: Intel Corporation Xeon E7 v2/Xeon E5 v2/Core i7 Unicast Registers [8086:0ee6] (rev 04)
	Subsystem: Gigabyte Technology Co., Ltd Device [1458:0000]
	Control: I/O- Mem- BusMaster- SpecCycle- MemWINV- VGASnoop- ParErr- Stepping- SERR- FastB2B- DisINTx-
	Status: Cap- 66MHz- UDF- FastB2B- ParErr- DEVSEL=fast >TAbort- <TAbort- <MAbort- >SERR- <PERR- INTx-
	NUMA node: 1

ff:0c.4 System peripheral [0880]: Intel Corporation Xeon E7 v2/Xeon E5 v2/Core i7 Unicast Registers [8086:0ee8] (rev 04)
	Subsystem: Gigabyte Technology Co., Ltd Device [1458:0000]
	Control: I/O- Mem- BusMaster- SpecCycle- MemWINV- VGASnoop- ParErr- Stepping- SERR- FastB2B- DisINTx-
	Status: Cap- 66MHz- UDF- FastB2B- ParErr- DEVSEL=fast >TAbort- <TAbort- <MAbort- >SERR- <PERR- INTx-
	NUMA node: 1

ff:0d.0 System peripheral [0880]: Intel Corporation Xeon E7 v2/Xeon E5 v2/Core i7 Unicast Registers [8086:0ee1] (rev 04)
	Subsystem: Gigabyte Technology Co., Ltd Device [1458:0000]
	Control: I/O- Mem- BusMaster- SpecCycle- MemWINV- VGASnoop- ParErr- Stepping- SERR- FastB2B- DisINTx-
	Status: Cap- 66MHz- UDF- FastB2B- ParErr- DEVSEL=fast >TAbort- <TAbort- <MAbort- >SERR- <PERR- INTx-
	NUMA node: 1

ff:0d.1 System peripheral [0880]: Intel Corporation Xeon E7 v2/Xeon E5 v2/Core i7 Unicast Registers [8086:0ee3] (rev 04)
	Subsystem: Gigabyte Technology Co., Ltd Device [1458:0000]
	Control: I/O- Mem- BusMaster- SpecCycle- MemWINV- VGASnoop- ParErr- Stepping- SERR- FastB2B- DisINTx-
	Status: Cap- 66MHz- UDF- FastB2B- ParErr- DEVSEL=fast >TAbort- <TAbort- <MAbort- >SERR- <PERR- INTx-
	NUMA node: 1

ff:0d.2 System peripheral [0880]: Intel Corporation Xeon E7 v2/Xeon E5 v2/Core i7 Unicast Registers [8086:0ee5] (rev 04)
	Subsystem: Gigabyte Technology Co., Ltd Device [1458:0000]
	Control: I/O- Mem- BusMaster- SpecCycle- MemWINV- VGASnoop- ParErr- Stepping- SERR- FastB2B- DisINTx-
	Status: Cap- 66MHz- UDF- FastB2B- ParErr- DEVSEL=fast >TAbort- <TAbort- <MAbort- >SERR- <PERR- INTx-
	NUMA node: 1

ff:0d.3 System peripheral [0880]: Intel Corporation Xeon E7 v2/Xeon E5 v2/Core i7 Unicast Registers [8086:0ee7] (rev 04)
	Subsystem: Gigabyte Technology Co., Ltd Device [1458:0000]
	Control: I/O- Mem- BusMaster- SpecCycle- MemWINV- VGASnoop- ParErr- Stepping- SERR- FastB2B- DisINTx-
	Status: Cap- 66MHz- UDF- FastB2B- ParErr- DEVSEL=fast >TAbort- <TAbort- <MAbort- >SERR- <PERR- INTx-
	NUMA node: 1

ff:0d.4 System peripheral [0880]: Intel Corporation Xeon E7 v2/Xeon E5 v2/Core i7 Unicast Registers [8086:0ee9] (rev 04)
	Subsystem: Gigabyte Technology Co., Ltd Device [1458:0000]
	Control: I/O- Mem- BusMaster- SpecCycle- MemWINV- VGASnoop- ParErr- Stepping- SERR- FastB2B- DisINTx-
	Status: Cap- 66MHz- UDF- FastB2B- ParErr- DEVSEL=fast >TAbort- <TAbort- <MAbort- >SERR- <PERR- INTx-
	NUMA node: 1

ff:0e.0 System peripheral [0880]: Intel Corporation Xeon E7 v2/Xeon E5 v2/Core i7 Home Agent 0 [8086:0ea0] (rev 04)
	Subsystem: Gigabyte Technology Co., Ltd Device [1458:0000]
	Control: I/O- Mem- BusMaster- SpecCycle- MemWINV- VGASnoop- ParErr- Stepping- SERR- FastB2B- DisINTx-
	Status: Cap- 66MHz- UDF- FastB2B- ParErr- DEVSEL=fast >TAbort- <TAbort- <MAbort- >SERR- <PERR- INTx-
	NUMA node: 1

ff:0e.1 Performance counters [1101]: Intel Corporation Xeon E7 v2/Xeon E5 v2/Core i7 Home Agent 0 [8086:0e30] (rev 04)
	Subsystem: Gigabyte Technology Co., Ltd Device [1458:0000]
	Control: I/O- Mem- BusMaster- SpecCycle- MemWINV- VGASnoop- ParErr- Stepping- SERR- FastB2B- DisINTx-
	Status: Cap- 66MHz- UDF- FastB2B- ParErr- DEVSEL=fast >TAbort- <TAbort- <MAbort- >SERR- <PERR- INTx-
	NUMA node: 1
	Kernel driver in use: ivbep_uncore

ff:0f.0 System peripheral [0880]: Intel Corporation Xeon E7 v2/Xeon E5 v2/Core i7 Integrated Memory Controller 0 Target Address/Thermal Registers [8086:0ea8] (rev 04)
	Subsystem: Gigabyte Technology Co., Ltd Device [1458:0000]
	Control: I/O- Mem- BusMaster- SpecCycle- MemWINV- VGASnoop- ParErr- Stepping- SERR- FastB2B- DisINTx-
	Status: Cap+ 66MHz- UDF- FastB2B- ParErr- DEVSEL=fast >TAbort- <TAbort- <MAbort- >SERR- <PERR- INTx-
	NUMA node: 1
	Capabilities: <access denied>

ff:0f.1 System peripheral [0880]: Intel Corporation Xeon E7 v2/Xeon E5 v2/Core i7 Integrated Memory Controller 0 RAS Registers [8086:0e71] (rev 04)
	Subsystem: Gigabyte Technology Co., Ltd Device [1458:0000]
	Control: I/O- Mem- BusMaster- SpecCycle- MemWINV- VGASnoop- ParErr- Stepping- SERR- FastB2B- DisINTx-
	Status: Cap+ 66MHz- UDF- FastB2B- ParErr- DEVSEL=fast >TAbort- <TAbort- <MAbort- >SERR- <PERR- INTx-
	NUMA node: 1
	Capabilities: <access denied>

ff:0f.2 System peripheral [0880]: Intel Corporation Xeon E7 v2/Xeon E5 v2/Core i7 Integrated Memory Controller 0 Channel Target Address Decoder Registers [808... (rev 04)
	Subsystem: Gigabyte Technology Co., Ltd Device [1458:0000]
	Control: I/O- Mem- BusMaster- SpecCycle- MemWINV- VGASnoop- ParErr- Stepping- SERR- FastB2B- DisINTx-
	Status: Cap+ 66MHz- UDF- FastB2B- ParErr- DEVSEL=fast >TAbort- <TAbort- <MAbort- >SERR- <PERR- INTx-
	NUMA node: 1
	Capabilities: <access denied>

ff:0f.3 System peripheral [0880]: Intel Corporation Xeon E7 v2/Xeon E5 v2/Core i7 Integrated Memory Controller 0 Channel Target Address Decoder Registers [808... (rev 04)
	Subsystem: Gigabyte Technology Co., Ltd Device [1458:0000]
	Control: I/O- Mem- BusMaster- SpecCycle- MemWINV- VGASnoop- ParErr- Stepping- SERR- FastB2B- DisINTx-
	Status: Cap+ 66MHz- UDF- FastB2B- ParErr- DEVSEL=fast >TAbort- <TAbort- <MAbort- >SERR- <PERR- INTx-
	NUMA node: 1
	Capabilities: <access denied>

ff:0f.4 System peripheral [0880]: Intel Corporation Xeon E7 v2/Xeon E5 v2/Core i7 Integrated Memory Controller 0 Channel Target Address Decoder Registers [808... (rev 04)
	Subsystem: Gigabyte Technology Co., Ltd Device [1458:0000]
	Control: I/O- Mem- BusMaster- SpecCycle- MemWINV- VGASnoop- ParErr- Stepping- SERR- FastB2B- DisINTx-
	Status: Cap+ 66MHz- UDF- FastB2B- ParErr- DEVSEL=fast >TAbort- <TAbort- <MAbort- >SERR- <PERR- INTx-
	NUMA node: 1
	Capabilities: <access denied>

ff:0f.5 System peripheral [0880]: Intel Corporation Xeon E7 v2/Xeon E5 v2/Core i7 Integrated Memory Controller 0 Channel Target Address Decoder Registers [808... (rev 04)
	Subsystem: Gigabyte Technology Co., Ltd Device [1458:0000]
	Control: I/O- Mem- BusMaster- SpecCycle- MemWINV- VGASnoop- ParErr- Stepping- SERR- FastB2B- DisINTx-
	Status: Cap+ 66MHz- UDF- FastB2B- ParErr- DEVSEL=fast >TAbort- <TAbort- <MAbort- >SERR- <PERR- INTx-
	NUMA node: 1
	Capabilities: <access denied>

ff:10.0 System peripheral [0880]: Intel Corporation Xeon E7 v2/Xeon E5 v2/Core i7 Integrated Memory Controller 1 Channel 0-3 Thermal Control 0 [8086:0eb0] (rev 04)
	Subsystem: Gigabyte Technology Co., Ltd Device [1458:0000]
	Control: I/O- Mem- BusMaster- SpecCycle- MemWINV- VGASnoop- ParErr- Stepping- SERR- FastB2B- DisINTx-
	Status: Cap+ 66MHz- UDF- FastB2B- ParErr- DEVSEL=fast >TAbort- <TAbort- <MAbort- >SERR- <PERR- INTx-
	NUMA node: 1
	Capabilities: <access denied>
	Kernel driver in use: ivbep_uncore

ff:10.1 System peripheral [0880]: Intel Corporation Xeon E7 v2/Xeon E5 v2/Core i7 Integrated Memory Controller 1 Channel 0-3 Thermal Control 1 [8086:0eb1] (rev 04)
	Subsystem: Gigabyte Technology Co., Ltd Device [1458:0000]
	Control: I/O- Mem- BusMaster- SpecCycle- MemWINV- VGASnoop- ParErr- Stepping- SERR- FastB2B- DisINTx-
	Status: Cap+ 66MHz- UDF- FastB2B- ParErr- DEVSEL=fast >TAbort- <TAbort- <MAbort- >SERR- <PERR- INTx-
	NUMA node: 1
	Capabilities: <access denied>
	Kernel driver in use: ivbep_uncore

ff:10.2 System peripheral [0880]: Intel Corporation Xeon E7 v2/Xeon E5 v2/Core i7 Integrated Memory Controller 1 Channel 0-3 ERROR Registers 0 [8086:0eb2] (rev 04)
	Subsystem: Gigabyte Technology Co., Ltd Device [1458:0000]
	Control: I/O- Mem- BusMaster- SpecCycle- MemWINV- VGASnoop- ParErr- Stepping- SERR- FastB2B- DisINTx-
	Status: Cap+ 66MHz- UDF- FastB2B- ParErr- DEVSEL=fast >TAbort- <TAbort- <MAbort- >SERR- <PERR- INTx-
	NUMA node: 1
	Capabilities: <access denied>

ff:10.3 System peripheral [0880]: Intel Corporation Xeon E7 v2/Xeon E5 v2/Core i7 Integrated Memory Controller 1 Channel 0-3 ERROR Registers 1 [8086:0eb3] (rev 04)
	Subsystem: Gigabyte Technology Co., Ltd Device [1458:0000]
	Control: I/O- Mem- BusMaster- SpecCycle- MemWINV- VGASnoop- ParErr- Stepping- SERR- FastB2B- DisINTx-
	Status: Cap+ 66MHz- UDF- FastB2B- ParErr- DEVSEL=fast >TAbort- <TAbort- <MAbort- >SERR- <PERR- INTx-
	NUMA node: 1
	Capabilities: <access denied>

ff:10.4 System peripheral [0880]: Intel Corporation Xeon E7 v2/Xeon E5 v2/Core i7 Integrated Memory Controller 1 Channel 0-3 Thermal Control 2 [8086:0eb4] (rev 04)
	Subsystem: Gigabyte Technology Co., Ltd Device [1458:0000]
	Control: I/O- Mem- BusMaster- SpecCycle- MemWINV- VGASnoop- ParErr- Stepping- SERR- FastB2B- DisINTx-
	Status: Cap+ 66MHz- UDF- FastB2B- ParErr- DEVSEL=fast >TAbort- <TAbort- <MAbort- >SERR- <PERR- INTx-
	NUMA node: 1
	Capabilities: <access denied>
	Kernel driver in use: ivbep_uncore

ff:10.5 System peripheral [0880]: Intel Corporation Xeon E7 v2/Xeon E5 v2/Core i7 Integrated Memory Controller 1 Channel 0-3 Thermal Control 3 [8086:0eb5] (rev 04)
	Subsystem: Gigabyte Technology Co., Ltd Device [1458:0000]
	Control: I/O- Mem- BusMaster- SpecCycle- MemWINV- VGASnoop- ParErr- Stepping- SERR- FastB2B- DisINTx-
	Status: Cap+ 66MHz- UDF- FastB2B- ParErr- DEVSEL=fast >TAbort- <TAbort- <MAbort- >SERR- <PERR- INTx-
	NUMA node: 1
	Capabilities: <access denied>
	Kernel driver in use: ivbep_uncore

ff:10.6 System peripheral [0880]: Intel Corporation Xeon E7 v2/Xeon E5 v2/Core i7 Integrated Memory Controller 1 Channel 0-3 ERROR Registers 2 [8086:0eb6] (rev 04)
	Subsystem: Gigabyte Technology Co., Ltd Device [1458:0000]
	Control: I/O- Mem- BusMaster- SpecCycle- MemWINV- VGASnoop- ParErr- Stepping- SERR- FastB2B- DisINTx-
	Status: Cap+ 66MHz- UDF- FastB2B- ParErr- DEVSEL=fast >TAbort- <TAbort- <MAbort- >SERR- <PERR- INTx-
	NUMA node: 1
	Capabilities: <access denied>

ff:10.7 System peripheral [0880]: Intel Corporation Xeon E7 v2/Xeon E5 v2/Core i7 Integrated Memory Controller 1 Channel 0-3 ERROR Registers 3 [8086:0eb7] (rev 04)
	Subsystem: Gigabyte Technology Co., Ltd Device [1458:0000]
	Control: I/O- Mem- BusMaster- SpecCycle- MemWINV- VGASnoop- ParErr- Stepping- SERR- FastB2B- DisINTx-
	Status: Cap+ 66MHz- UDF- FastB2B- ParErr- DEVSEL=fast >TAbort- <TAbort- <MAbort- >SERR- <PERR- INTx-
	NUMA node: 1
	Capabilities: <access denied>

ff:13.0 System peripheral [0880]: Intel Corporation Xeon E7 v2/Xeon E5 v2/Core i7 R2PCIe [8086:0e1d] (rev 04)
	Subsystem: Gigabyte Technology Co., Ltd Device [1458:0000]
	Control: I/O- Mem- BusMaster- SpecCycle- MemWINV- VGASnoop- ParErr- Stepping- SERR- FastB2B- DisINTx-
	Status: Cap- 66MHz- UDF- FastB2B- ParErr- DEVSEL=fast >TAbort- <TAbort- <MAbort- >SERR- <PERR- INTx-
	NUMA node: 1

ff:13.1 Performance counters [1101]: Intel Corporation Xeon E7 v2/Xeon E5 v2/Core i7 R2PCIe [8086:0e34] (rev 04)
	Subsystem: Gigabyte Technology Co., Ltd Device [1458:0000]
	Control: I/O- Mem- BusMaster- SpecCycle- MemWINV- VGASnoop- ParErr- Stepping- SERR- FastB2B- DisINTx-
	Status: Cap- 66MHz- UDF- FastB2B- ParErr- DEVSEL=fast >TAbort- <TAbort- <MAbort- >SERR- <PERR- INTx-
	NUMA node: 1
	Kernel driver in use: ivbep_uncore

ff:13.4 System peripheral [0880]: Intel Corporation Xeon E7 v2/Xeon E5 v2/Core i7 QPI Ring Registers [8086:0e81] (rev 04)
	Subsystem: Gigabyte Technology Co., Ltd Device [1458:0000]
	Control: I/O- Mem- BusMaster- SpecCycle- MemWINV- VGASnoop- ParErr- Stepping- SERR- FastB2B- DisINTx-
	Status: Cap- 66MHz- UDF- FastB2B- ParErr- DEVSEL=fast >TAbort- <TAbort- <MAbort- >SERR- <PERR- INTx-
	NUMA node: 1

ff:13.5 Performance counters [1101]: Intel Corporation Xeon E7 v2/Xeon E5 v2/Core i7 QPI Ring Performance Ring Monitoring [8086:0e36] (rev 04)
	Subsystem: Gigabyte Technology Co., Ltd Device [1458:0000]
	Control: I/O- Mem- BusMaster- SpecCycle- MemWINV- VGASnoop- ParErr- Stepping- SERR- FastB2B- DisINTx-
	Status: Cap- 66MHz- UDF- FastB2B- ParErr- DEVSEL=fast >TAbort- <TAbort- <MAbort- >SERR- <PERR- INTx-
	NUMA node: 1
	Kernel driver in use: ivbep_uncore

ff:16.0 System peripheral [0880]: Intel Corporation Xeon E7 v2/Xeon E5 v2/Core i7 System Address Decoder [8086:0ec8] (rev 04)
	Subsystem: Gigabyte Technology Co., Ltd Device [1458:0000]
	Control: I/O- Mem- BusMaster- SpecCycle- MemWINV- VGASnoop- ParErr- Stepping- SERR- FastB2B- DisINTx-
	Status: Cap- 66MHz- UDF- FastB2B- ParErr- DEVSEL=fast >TAbort- <TAbort- <MAbort- >SERR- <PERR- INTx-
	NUMA node: 1

ff:16.1 System peripheral [0880]: Intel Corporation Xeon E7 v2/Xeon E5 v2/Core i7 Broadcast Registers [8086:0ec9] (rev 04)
	Subsystem: Gigabyte Technology Co., Ltd Device [1458:0000]
	Control: I/O- Mem- BusMaster- SpecCycle- MemWINV- VGASnoop- ParErr- Stepping- SERR- FastB2B- DisINTx-
	Status: Cap- 66MHz- UDF- FastB2B- ParErr- DEVSEL=fast >TAbort- <TAbort- <MAbort- >SERR- <PERR- INTx-
	NUMA node: 1

ff:16.2 System peripheral [0880]: Intel Corporation Xeon E7 v2/Xeon E5 v2/Core i7 Broadcast Registers [8086:0eca] (rev 04)
	Subsystem: Gigabyte Technology Co., Ltd Device [1458:0000]
	Control: I/O- Mem- BusMaster- SpecCycle- MemWINV- VGASnoop- ParErr- Stepping- SERR- FastB2B- DisINTx-
	Status: Cap- 66MHz- UDF- FastB2B- ParErr- DEVSEL=fast >TAbort- <TAbort- <MAbort- >SERR- <PERR- INTx-
	NUMA node: 1

