00:00.0 Host bridge [0600]: Advanced Micro Devices, Inc. [AMD] Family 15h (Models 10h-1fh) Processor Root Complex [1022:1410]
	Subsystem: ASUSTeK Computer Inc. Device [1043:8526]
	Control: I/O- Mem+ BusMaster+ SpecCycle- MemWINV- VGASnoop- ParErr- Stepping- SERR- FastB2B- DisINTx-
	Status: Cap- 66MHz+ UDF- FastB2B- ParErr- DEVSEL=medium >TAbort- <TAbort- <MAbort- >SERR- <PERR- INTx-
	Latency: 0

00:01.0 VGA compatible controller [0300]: Advanced Micro Devices, Inc. [AMD/ATI] Trinity 2 [Radeon HD 7480D] [1002:9993] (prog-if 00 [VGA controller])
	Subsystem: ASUSTeK Computer Inc. Device [1043:8526]
	Control: I/O+ Mem+ BusMaster+ SpecCycle- MemWINV- VGASnoop- ParErr- Stepping- SERR- FastB2B- DisINTx+
	Status: Cap+ 66MHz- UDF- FastB2B- ParErr- DEVSEL=fast >TAbort- <TAbort- <MAbort- >SERR- <PERR- INTx-
	Latency: 0, Cache Line Size: 64 bytes
	Interrupt: pin A routed to IRQ 24
	Region 0: Memory at d0000000 (32-bit, prefetchable) [size=256M]
	Region 1: I/O ports at f000 [size=256]
	Region 2: Memory at fef00000 (32-bit, non-prefetchable) [size=256K]
	Expansion ROM at 000c0000 [virtual] [disabled] [size=128K]
	Capabilities: [50] Power Management version 3
		Flags: PMEClk- DSI- D1+ D2+ AuxCurrent=0mA PME(D0-,D1-,D2-,D3hot-,D3cold-)
		Status: D0 NoSoftRst- PME-Enable- DSel=0 DScale=0 PME-
	Capabilities: [58] Express (v2) Root Complex Integrated Endpoint, MSI 00
		DevCap:	MaxPayload 128 bytes, PhantFunc 0
			ExtTag+ RBE+ FLReset-
		DevCtl:	CorrErr- NonFatalErr- FatalErr- UnsupReq-
			RlxdOrd+ ExtTag+ PhantFunc- AuxPwr- NoSnoop+
			MaxPayload 128 bytes, MaxReadReq 128 bytes
		DevSta:	CorrErr- NonFatalErr- FatalErr- UnsupReq- AuxPwr- TransPend-
		DevCap2: Completion Timeout: Not Supported, TimeoutDis- NROPrPrP- LTR-
			 10BitTagComp- 10BitTagReq- OBFF Not Supported, ExtFmt- EETLPPrefix-
			 EmergencyPowerReduction Not Supported, EmergencyPowerReductionInit-
			 FRS-
			 AtomicOpsCap: 32bit- 64bit- 128bitCAS-
		DevCtl2: Completion Timeout: 50us to 50ms, TimeoutDis- LTR- OBFF Disabled,
			 AtomicOpsCtl: ReqEn-
	Capabilities: [a0] MSI: Enable+ Count=1/1 Maskable- 64bit+
		Address: 00000000fee02004  Data: 4022
	Capabilities: [100 v1] Vendor Specific Information: ID=0001 Rev=1 Len=010 <?>
	Kernel driver in use: radeon
	Kernel modules: radeon

00:11.0 SATA controller [0106]: Advanced Micro Devices, Inc. [AMD] FCH SATA Controller [AHCI mode] [1022:7801] (rev 40) (prog-if 01 [AHCI 1.0])
	Subsystem: ASUSTeK Computer Inc. Device [1043:8527]
	Control: I/O+ Mem+ BusMaster+ SpecCycle- MemWINV- VGASnoop- ParErr- Stepping- SERR- FastB2B- DisINTx+
	Status: Cap+ 66MHz+ UDF- FastB2B- ParErr- DEVSEL=medium >TAbort- <TAbort- <MAbort- >SERR- <PERR- INTx-
	Latency: 32
	Interrupt: pin A routed to IRQ 25
	Region 0: I/O ports at f140 [size=8]
	Region 1: I/O ports at f130 [size=4]
	Region 2: I/O ports at f120 [size=8]
	Region 3: I/O ports at f110 [size=4]
	Region 4: I/O ports at f100 [size=16]
	Region 5: Memory at fef48000 (32-bit, non-prefetchable) [size=2K]
	Capabilities: [50] MSI: Enable+ Count=1/8 Maskable- 64bit+
		Address: 00000000fee02004  Data: 4023
	Capabilities: [70] SATA HBA v1.0 InCfgSpace
	Kernel driver in use: ahci
	Kernel modules: ahci

00:12.0 USB controller [0c03]: Advanced Micro Devices, Inc. [AMD] FCH USB OHCI Controller [1022:7807] (rev 11) (prog-if 10 [OHCI])
	Subsystem: ASUSTeK Computer Inc. Device [1043:8527]
	Control: I/O- Mem+ BusMaster+ SpecCycle- MemWINV- VGASnoop- ParErr- Stepping- SERR- FastB2B- DisINTx-
	Status: Cap- 66MHz+ UDF- FastB2B+ ParErr- DEVSEL=medium >TAbort- <TAbort- <MAbort- >SERR- <PERR- INTx-
	Latency: 32, Cache Line Size: 64 bytes
	Interrupt: pin A routed to IRQ 18
	Region 0: Memory at fef47000 (32-bit, non-prefetchable) [size=4K]
	Kernel driver in use: ohci-pci
	Kernel modules: ohci_pci

00:12.2 USB controller [0c03]: Advanced Micro Devices, Inc. [AMD] FCH USB EHCI Controller [1022:7808] (rev 11) (prog-if 20 [EHCI])
	Subsystem: ASUSTeK Computer Inc. Device [1043:8527]
	Control: I/O- Mem+ BusMaster+ SpecCycle- MemWINV+ VGASnoop- ParErr- Stepping- SERR- FastB2B- DisINTx-
	Status: Cap+ 66MHz+ UDF- FastB2B+ ParErr- DEVSEL=medium >TAbort- <TAbort- <MAbort- >SERR- <PERR- INTx-
	Latency: 32, Cache Line Size: 64 bytes
	Interrupt: pin B routed to IRQ 17
	Region 0: Memory at fef46000 (32-bit, non-prefetchable) [size=256]
	Capabilities: [c0] Power Management version 2
		Flags: PMEClk- DSI- D1+ D2+ AuxCurrent=0mA PME(D0+,D1+,D2+,D3hot+,D3cold-)
		Status: D0 NoSoftRst- PME-Enable- DSel=0 DScale=0 PME-
		Bridge: PM- B3+
	Capabilities: [e4] Debug port: BAR=1 offset=00e0
	Kernel driver in use: ehci-pci
	Kernel modules: ehci_pci

00:13.0 USB controller [0c03]: Advanced Micro Devices, Inc. [AMD] FCH USB OHCI Controller [1022:7807] (rev 11) (prog-if 10 [OHCI])
	Subsystem: ASUSTeK Computer Inc. Device [1043:8527]
	Control: I/O- Mem+ BusMaster+ SpecCycle- MemWINV- VGASnoop- ParErr- Stepping- SERR- FastB2B- DisINTx-
	Status: Cap- 66MHz+ UDF- FastB2B+ ParErr- DEVSEL=medium >TAbort- <TAbort- <MAbort- >SERR- <PERR- INTx-
	Latency: 32, Cache Line Size: 64 bytes
	Interrupt: pin A routed to IRQ 18
	Region 0: Memory at fef45000 (32-bit, non-prefetchable) [size=4K]
	Kernel driver in use: ohci-pci
	Kernel modules: ohci_pci

00:13.2 USB controller [0c03]: Advanced Micro Devices, Inc. [AMD] FCH USB EHCI Controller [1022:7808] (rev 11) (prog-if 20 [EHCI])
	Subsystem: ASUSTeK Computer Inc. Device [1043:8527]
	Control: I/O- Mem+ BusMaster+ SpecCycle- MemWINV+ VGASnoop- ParErr- Stepping- SERR- FastB2B- DisINTx-
	Status: Cap+ 66MHz+ UDF- FastB2B+ ParErr- DEVSEL=medium >TAbort- <TAbort- <MAbort- >SERR- <PERR- INTx-
	Latency: 32, Cache Line Size: 64 bytes
	Interrupt: pin B routed to IRQ 17
	Region 0: Memory at fef44000 (32-bit, non-prefetchable) [size=256]
	Capabilities: [c0] Power Management version 2
		Flags: PMEClk- DSI- D1+ D2+ AuxCurrent=0mA PME(D0+,D1+,D2+,D3hot+,D3cold-)
		Status: D0 NoSoftRst- PME-Enable- DSel=0 DScale=0 PME-
		Bridge: PM- B3+
	Capabilities: [e4] Debug port: BAR=1 offset=00e0
	Kernel driver in use: ehci-pci
	Kernel modules: ehci_pci

00:14.0 SMBus [0c05]: Advanced Micro Devices, Inc. [AMD] FCH SMBus Controller [1022:780b] (rev 14)
	Subsystem: ASUSTeK Computer Inc. Device [1043:8527]
	Control: I/O- Mem- BusMaster- SpecCycle- MemWINV- VGASnoop- ParErr- Stepping- SERR- FastB2B- DisINTx+
	Status: Cap- 66MHz+ UDF- FastB2B- ParErr- DEVSEL=medium >TAbort- <TAbort- <MAbort- >SERR- <PERR- INTx-
	Kernel driver in use: piix4_smbus
	Kernel modules: i2c_piix4, sp5100_tco

00:14.2 Audio device [0403]: Advanced Micro Devices, Inc. [AMD] FCH Azalia Controller [1022:780d] (rev 01)
	Subsystem: ASUSTeK Computer Inc. Device [1043:8445]
	Control: I/O- Mem+ BusMaster+ SpecCycle- MemWINV- VGASnoop- ParErr- Stepping- SERR- FastB2B- DisINTx-
	Status: Cap+ 66MHz- UDF- FastB2B- ParErr- DEVSEL=slow >TAbort- <TAbort- <MAbort- >SERR- <PERR- INTx-
	Latency: 32, Cache Line Size: 64 bytes
	Interrupt: pin A routed to IRQ 16
	Region 0: Memory at fef40000 (64-bit, non-prefetchable) [size=16K]
	Capabilities: [50] Power Management version 2
		Flags: PMEClk- DSI- D1- D2- AuxCurrent=55mA PME(D0+,D1-,D2-,D3hot+,D3cold+)
		Status: D0 NoSoftRst- PME-Enable- DSel=0 DScale=0 PME-
	Kernel driver in use: snd_hda_intel
	Kernel modules: snd_hda_intel

00:14.3 ISA bridge [0601]: Advanced Micro Devices, Inc. [AMD] FCH LPC Bridge [1022:780e] (rev 11)
	Subsystem: ASUSTeK Computer Inc. Device [1043:8527]
	Control: I/O+ Mem+ BusMaster+ SpecCycle+ MemWINV- VGASnoop- ParErr- Stepping- SERR- FastB2B- DisINTx-
	Status: Cap- 66MHz+ UDF- FastB2B- ParErr- DEVSEL=medium >TAbort- <TAbort- <MAbort- >SERR- <PERR- INTx-
	Latency: 0

00:14.4 PCI bridge [0604]: Advanced Micro Devices, Inc. [AMD] FCH PCI Bridge [1022:780f] (rev 40) (prog-if 01 [Subtractive decode])
	Control: I/O+ Mem+ BusMaster+ SpecCycle- MemWINV- VGASnoop+ ParErr- Stepping- SERR- FastB2B- DisINTx-
	Status: Cap- 66MHz+ UDF- FastB2B+ ParErr- DEVSEL=medium >TAbort- <TAbort- <MAbort- >SERR- <PERR- INTx-
	Latency: 64
	Bus: primary=00, secondary=01, subordinate=01, sec-latency=64
	I/O behind bridge: [disabled]
	Memory behind bridge: [disabled]
	Prefetchable memory behind bridge: [disabled]
	Secondary status: 66MHz- FastB2B+ ParErr- DEVSEL=medium >TAbort- <TAbort- <MAbort+ <SERR- <PERR-
	BridgeCtl: Parity- SERR+ NoISA- VGA- VGA16+ MAbort- >Reset- FastB2B-
		PriDiscTmr- SecDiscTmr- DiscTmrStat- DiscTmrSERREn-

00:18.0 Host bridge [0600]: Advanced Micro Devices, Inc. [AMD] Family 15h (Models 10h-1fh) Processor Function 0 [1022:1400]
	Control: I/O- Mem- BusMaster- SpecCycle- MemWINV- VGASnoop- ParErr- Stepping- SERR- FastB2B- DisINTx-
	Status: Cap+ 66MHz- UDF- FastB2B- ParErr- DEVSEL=fast >TAbort- <TAbort- <MAbort- >SERR- <PERR- INTx-

00:18.1 Host bridge [0600]: Advanced Micro Devices, Inc. [AMD] Family 15h (Models 10h-1fh) Processor Function 1 [1022:1401]
	Control: I/O- Mem- BusMaster- SpecCycle- MemWINV- VGASnoop- ParErr- Stepping- SERR- FastB2B- DisINTx-
	Status: Cap- 66MHz- UDF- FastB2B- ParErr- DEVSEL=fast >TAbort- <TAbort- <MAbort- >SERR- <PERR- INTx-

00:18.2 Host bridge [0600]: Advanced Micro Devices, Inc. [AMD] Family 15h (Models 10h-1fh) Processor Function 2 [1022:1402]
	Control: I/O- Mem- BusMaster- SpecCycle- MemWINV- VGASnoop- ParErr- Stepping- SERR- FastB2B- DisINTx-
	Status: Cap- 66MHz- UDF- FastB2B- ParErr- DEVSEL=fast >TAbort- <TAbort- <MAbort- >SERR- <PERR- INTx-

00:18.3 Host bridge [0600]: Advanced Micro Devices, Inc. [AMD] Family 15h (Models 10h-1fh) Processor Function 3 [1022:1403]
	Control: I/O- Mem- BusMaster- SpecCycle- MemWINV- VGASnoop- ParErr- Stepping- SERR- FastB2B- DisINTx-
	Status: Cap+ 66MHz- UDF- FastB2B- ParErr- DEVSEL=fast >TAbort- <TAbort- <MAbort- >SERR- <PERR- INTx-
	Capabilities: [f0] Secure device <?>
	Kernel driver in use: k10temp
	Kernel modules: k10temp

00:18.4 Host bridge [0600]: Advanced Micro Devices, Inc. [AMD] Family 15h (Models 10h-1fh) Processor Function 4 [1022:1404]
	Control: I/O- Mem- BusMaster- SpecCycle- MemWINV- VGASnoop- ParErr- Stepping- SERR- FastB2B- DisINTx-
	Status: Cap- 66MHz- UDF- FastB2B- ParErr- DEVSEL=fast >TAbort- <TAbort- <MAbort- >SERR- <PERR- INTx-

00:18.5 Host bridge [0600]: Advanced Micro Devices, Inc. [AMD] Family 15h (Models 10h-1fh) Processor Function 5 [1022:1405]
	Control: I/O- Mem- BusMaster- SpecCycle- MemWINV- VGASnoop- ParErr- Stepping- SERR- FastB2B- DisINTx-
	Status: Cap- 66MHz- UDF- FastB2B- ParErr- DEVSEL=fast >TAbort- <TAbort- <MAbort- >SERR- <PERR- INTx-

