00:00.0 Host bridge [0600]: Intel Corporation 82865G/PE/P DRAM Controller/Host-Hub Interface [8086:2570] (rev 02)
	Subsystem: Intel Corporation 82865G/PE/P DRAM Controller/Host-Hub Interface [8086:2570]
	Control: I/O- Mem+ BusMaster+ SpecCycle- MemWINV- VGASnoop- ParErr- Stepping- SERR- FastB2B- DisINTx-
	Status: Cap+ 66MHz- UDF- FastB2B+ ParErr- DEVSEL=fast >TAbort- <TAbort- <MAbort+ >SERR- <PERR- INTx-
	Latency: 0
	Region 0: Memory at e8000000 (32-bit, prefetchable) [size=128M]
	Capabilities: [e4] Vendor Specific Information: Len=06 <?>
	Capabilities: [a0] AGP version 3.0
		Status: RQ=32 Iso- ArqSz=2 Cal=2 SBA+ ITACoh- GART64- HTrans- 64bit- FW+ AGP3+ Rate=x4,x8
		Command: RQ=1 ArqSz=0 Cal=2 SBA+ AGP- GART64- 64bit- FW- Rate=<none>
	Kernel driver in use: agpgart-intel

00:01.0 PCI bridge [0604]: Intel Corporation 82865G/PE/P AGP Bridge [8086:2571] (rev 02) (prog-if 00 [Normal decode])
	Control: I/O+ Mem+ BusMaster+ SpecCycle- MemWINV- VGASnoop- ParErr- Stepping- SERR+ FastB2B- DisINTx-
	Status: Cap- 66MHz+ UDF- FastB2B+ ParErr- DEVSEL=fast >TAbort- <TAbort- <MAbort- >SERR- <PERR- INTx-
	Latency: 64
	Bus: primary=00, secondary=01, subordinate=01, sec-latency=32
	Memory behind bridge: f8000000-f9ffffff
	Prefetchable memory behind bridge: f0000000-f7ffffff
	Secondary status: 66MHz+ FastB2B+ ParErr- DEVSEL=medium >TAbort- <TAbort- <MAbort+ <SERR- <PERR-
	BridgeCtl: Parity- SERR- NoISA- VGA+ MAbort- >Reset- FastB2B-
		PriDiscTmr- SecDiscTmr- DiscTmrStat- DiscTmrSERREn-
	Kernel modules: shpchp

00:06.0 System peripheral [0880]: Intel Corporation 82865G/PE/P Processor to I/O Memory Interface [8086:2576] (rev 02)
	Control: I/O- Mem+ BusMaster- SpecCycle- MemWINV- VGASnoop- ParErr- Stepping- SERR- FastB2B- DisINTx-
	Status: Cap- 66MHz- UDF- FastB2B+ ParErr- DEVSEL=fast >TAbort- <TAbort- <MAbort- >SERR- <PERR- INTx-
	Region 0: Memory at 60000000 (32-bit, non-prefetchable) [size=4K]

00:1d.0 USB controller [0c03]: Intel Corporation 82801EB/ER (ICH5/ICH5R) USB UHCI Controller #1 [8086:24d2] (rev 02) (prog-if 00 [UHCI])
	Subsystem: Foxconn International, Inc. Device [105b:0c3d]
	Control: I/O+ Mem- BusMaster+ SpecCycle- MemWINV- VGASnoop- ParErr- Stepping- SERR- FastB2B- DisINTx-
	Status: Cap- 66MHz- UDF- FastB2B+ ParErr- DEVSEL=medium >TAbort- <TAbort- <MAbort- >SERR- <PERR- INTx-
	Latency: 0
	Interrupt: pin A routed to IRQ 16
	Region 4: I/O ports at e300 [size=32]
	Kernel driver in use: uhci_hcd

00:1d.1 USB controller [0c03]: Intel Corporation 82801EB/ER (ICH5/ICH5R) USB UHCI Controller #2 [8086:24d4] (rev 02) (prog-if 00 [UHCI])
	Subsystem: Foxconn International, Inc. Device [105b:0c3d]
	Control: I/O+ Mem- BusMaster+ SpecCycle- MemWINV- VGASnoop- ParErr- Stepping- SERR- FastB2B- DisINTx-
	Status: Cap- 66MHz- UDF- FastB2B+ ParErr- DEVSEL=medium >TAbort- <TAbort- <MAbort- >SERR- <PERR- INTx-
	Latency: 0
	Interrupt: pin B routed to IRQ 19
	Region 4: I/O ports at e000 [size=32]
	Kernel driver in use: uhci_hcd

00:1d.2 USB controller [0c03]: Intel Corporation 82801EB/ER (ICH5/ICH5R) USB UHCI Controller #3 [8086:24d7] (rev 02) (prog-if 00 [UHCI])
	Subsystem: Foxconn International, Inc. Device [105b:0c3d]
	Control: I/O+ Mem- BusMaster+ SpecCycle- MemWINV- VGASnoop- ParErr- Stepping- SERR- FastB2B- DisINTx-
	Status: Cap- 66MHz- UDF- FastB2B+ ParErr- DEVSEL=medium >TAbort- <TAbort- <MAbort- >SERR- <PERR- INTx-
	Latency: 0
	Interrupt: pin C routed to IRQ 18
	Region 4: I/O ports at e100 [size=32]
	Kernel driver in use: uhci_hcd

00:1d.3 USB controller [0c03]: Intel Corporation 82801EB/ER (ICH5/ICH5R) USB UHCI Controller #4 [8086:24de] (rev 02) (prog-if 00 [UHCI])
	Subsystem: Foxconn International, Inc. Device [105b:0c3d]
	Control: I/O+ Mem- BusMaster+ SpecCycle- MemWINV- VGASnoop- ParErr- Stepping- SERR- FastB2B- DisINTx-
	Status: Cap- 66MHz- UDF- FastB2B+ ParErr- DEVSEL=medium >TAbort- <TAbort- <MAbort- >SERR- <PERR- INTx-
	Latency: 0
	Interrupt: pin A routed to IRQ 16
	Region 4: I/O ports at e200 [size=32]
	Kernel driver in use: uhci_hcd

00:1d.7 USB controller [0c03]: Intel Corporation 82801EB/ER (ICH5/ICH5R) USB2 EHCI Controller [8086:24dd] (rev 02) (prog-if 20 [EHCI])
	Subsystem: Foxconn International, Inc. Device [105b:0c3d]
	Control: I/O- Mem+ BusMaster+ SpecCycle- MemWINV- VGASnoop- ParErr- Stepping- SERR- FastB2B- DisINTx-
	Status: Cap+ 66MHz- UDF- FastB2B+ ParErr- DEVSEL=medium >TAbort- <TAbort- <MAbort- >SERR- <PERR- INTx-
	Latency: 0
	Interrupt: pin D routed to IRQ 23
	Region 0: Memory at fa100000 (32-bit, non-prefetchable) [size=1K]
	Capabilities: [50] Power Management version 2
		Flags: PMEClk- DSI- D1- D2- AuxCurrent=375mA PME(D0+,D1-,D2-,D3hot+,D3cold+)
		Status: D0 NoSoftRst- PME-Enable- DSel=0 DScale=0 PME-
	Kernel driver in use: ehci-pci

00:1e.0 PCI bridge [0604]: Intel Corporation 82801 PCI Bridge [8086:244e] (rev c2) (prog-if 00 [Normal decode])
	Control: I/O+ Mem+ BusMaster+ SpecCycle- MemWINV- VGASnoop- ParErr- Stepping- SERR+ FastB2B- DisINTx-
	Status: Cap- 66MHz- UDF- FastB2B+ ParErr- DEVSEL=fast >TAbort- <TAbort- <MAbort- >SERR- <PERR- INTx-
	Latency: 0
	Bus: primary=00, secondary=02, subordinate=02, sec-latency=32
	I/O behind bridge: 0000d000-0000dfff
	Memory behind bridge: fa000000-fa0fffff
	Secondary status: 66MHz- FastB2B+ ParErr- DEVSEL=medium >TAbort- <TAbort- <MAbort+ <SERR- <PERR-
	BridgeCtl: Parity- SERR+ NoISA- VGA- MAbort- >Reset- FastB2B-
		PriDiscTmr- SecDiscTmr- DiscTmrStat- DiscTmrSERREn-
	Kernel modules: shpchp

00:1f.0 ISA bridge [0601]: Intel Corporation 82801EB/ER (ICH5/ICH5R) LPC Interface Bridge [8086:24d0] (rev 02)
	Control: I/O+ Mem+ BusMaster+ SpecCycle+ MemWINV- VGASnoop- ParErr- Stepping- SERR- FastB2B- DisINTx-
	Status: Cap- 66MHz- UDF- FastB2B+ ParErr- DEVSEL=medium >TAbort- <TAbort- <MAbort- >SERR- <PERR- INTx-
	Latency: 0
	Kernel driver in use: lpc_ich
	Kernel modules: intel_rng, lpc_ich

00:1f.1 IDE interface [0101]: Intel Corporation 82801EB/ER (ICH5/ICH5R) IDE Controller [8086:24db] (rev 02) (prog-if 8a [Master SecP PriP])
	Subsystem: Foxconn International, Inc. Device [105b:0c3d]
	Control: I/O+ Mem+ BusMaster+ SpecCycle- MemWINV- VGASnoop- ParErr- Stepping- SERR- FastB2B- DisINTx-
	Status: Cap- 66MHz- UDF- FastB2B+ ParErr- DEVSEL=medium >TAbort- <TAbort- <MAbort- >SERR- <PERR- INTx+
	Latency: 0
	Interrupt: pin A routed to IRQ 18
	Region 0: I/O ports at 01f0 [size=8]
	Region 1: I/O ports at 03f4
	Region 2: I/O ports at 0170 [size=8]
	Region 3: I/O ports at 0374
	Region 4: I/O ports at f000 [size=16]
	Region 5: Memory at 60001000 (32-bit, non-prefetchable) [size=1K]
	Kernel driver in use: ata_piix
	Kernel modules: pata_acpi

00:1f.2 IDE interface [0101]: Intel Corporation 82801EB (ICH5) SATA Controller [8086:24d1] (rev 02) (prog-if 8f [Master SecP SecO PriP PriO])
	Subsystem: Foxconn International, Inc. Device [105b:0c3d]
	Control: I/O+ Mem- BusMaster+ SpecCycle- MemWINV- VGASnoop- ParErr- Stepping- SERR- FastB2B- DisINTx-
	Status: Cap- 66MHz+ UDF- FastB2B+ ParErr- DEVSEL=medium >TAbort- <TAbort- <MAbort- >SERR- <PERR- INTx-
	Latency: 0
	Interrupt: pin A routed to IRQ 18
	Region 0: I/O ports at e400 [size=8]
	Region 1: I/O ports at e500 [size=4]
	Region 2: I/O ports at e600 [size=8]
	Region 3: I/O ports at e700 [size=4]
	Region 4: I/O ports at e800 [size=16]
	Kernel driver in use: ata_piix
	Kernel modules: pata_acpi

00:1f.3 SMBus [0c05]: Intel Corporation 82801EB/ER (ICH5/ICH5R) SMBus Controller [8086:24d3] (rev 02)
	Subsystem: Foxconn International, Inc. Device [105b:0c3d]
	Control: I/O+ Mem- BusMaster- SpecCycle- MemWINV- VGASnoop- ParErr- Stepping- SERR- FastB2B- DisINTx-
	Status: Cap- 66MHz- UDF- FastB2B+ ParErr- DEVSEL=medium >TAbort- <TAbort- <MAbort- >SERR- <PERR- INTx-
	Interrupt: pin B routed to IRQ 17
	Region 4: I/O ports at 0500 [size=32]
	Kernel driver in use: i801_smbus
	Kernel modules: i2c_i801

00:1f.5 Multimedia audio controller [0401]: Intel Corporation 82801EB/ER (ICH5/ICH5R) AC'97 Audio Controller [8086:24d5] (rev 02)
	Subsystem: Foxconn International, Inc. Device [105b:0c3d]
	Control: I/O+ Mem+ BusMaster+ SpecCycle- MemWINV- VGASnoop- ParErr- Stepping- SERR- FastB2B- DisINTx-
	Status: Cap+ 66MHz- UDF- FastB2B+ ParErr- DEVSEL=medium >TAbort- <TAbort- <MAbort- >SERR- <PERR- INTx-
	Latency: 0
	Interrupt: pin B routed to IRQ 17
	Region 0: I/O ports at ea00 [size=256]
	Region 1: I/O ports at eb00 [size=64]
	Region 2: Memory at fa101000 (32-bit, non-prefetchable) [size=512]
	Region 3: Memory at fa102000 (32-bit, non-prefetchable) [size=256]
	Capabilities: [50] Power Management version 2
		Flags: PMEClk- DSI- D1- D2- AuxCurrent=375mA PME(D0+,D1-,D2-,D3hot+,D3cold+)
		Status: D0 NoSoftRst- PME-Enable- DSel=0 DScale=0 PME-
	Kernel driver in use: snd_intel8x0
	Kernel modules: snd_intel8x0

01:00.0 VGA compatible controller [0300]: NVIDIA Corporation NV34 [GeForce FX 5200] [10de:0322] (rev a1) (prog-if 00 [VGA controller])
	Subsystem: Micro-Star International Co., Ltd. [MSI] MS-8936 (FX5200-T128) [1462:9360]
	Control: I/O+ Mem+ BusMaster+ SpecCycle- MemWINV- VGASnoop- ParErr- Stepping- SERR- FastB2B- DisINTx-
	Status: Cap+ 66MHz+ UDF- FastB2B+ ParErr- DEVSEL=medium >TAbort- <TAbort- <MAbort- >SERR- <PERR- INTx-
	Latency: 32 (1250ns min, 250ns max)
	Interrupt: pin A routed to IRQ 12
	Region 0: Memory at f8000000 (32-bit, non-prefetchable) [size=16M]
	Region 1: Memory at f0000000 (32-bit, prefetchable) [size=128M]
	[virtual] Expansion ROM at 000c0000 [disabled] [size=128K]
	Capabilities: [60] Power Management version 2
		Flags: PMEClk- DSI- D1- D2- AuxCurrent=0mA PME(D0-,D1-,D2-,D3hot-,D3cold-)
		Status: D0 NoSoftRst- PME-Enable- DSel=0 DScale=0 PME-
	Capabilities: [44] AGP version 3.0
		Status: RQ=32 Iso- ArqSz=0 Cal=3 SBA+ ITACoh- GART64- HTrans- 64bit- FW+ AGP3+ Rate=x4,x8
		Command: RQ=1 ArqSz=0 Cal=0 SBA- AGP- GART64- 64bit- FW- Rate=<none>
	Kernel modules: nvidiafb, nouveau

02:06.0 Ethernet controller [0200]: Realtek Semiconductor Co., Ltd. RTL-8100/8101L/8139 PCI Fast Ethernet Adapter [10ec:8139] (rev 10)
	Subsystem: Foxconn International, Inc. Device [105b:0c3d]
	Control: I/O+ Mem+ BusMaster+ SpecCycle- MemWINV- VGASnoop- ParErr- Stepping- SERR- FastB2B- DisINTx-
	Status: Cap+ 66MHz- UDF- FastB2B+ ParErr- DEVSEL=medium >TAbort- <TAbort- <MAbort- >SERR- <PERR- INTx-
	Latency: 32 (8000ns min, 16000ns max)
	Interrupt: pin A routed to IRQ 23
	Region 0: I/O ports at d000 [size=256]
	Region 1: Memory at fa000000 (32-bit, non-prefetchable) [size=256]
	Capabilities: [50] Power Management version 2
		Flags: PMEClk- DSI- D1+ D2+ AuxCurrent=375mA PME(D0-,D1+,D2+,D3hot+,D3cold+)
		Status: D0 NoSoftRst- PME-Enable- DSel=0 DScale=0 PME-
	Kernel driver in use: 8139too
	Kernel modules: 8139cp, 8139too

