00:00.0 Host bridge [0600]: Intel Corporation 5100 Chipset Memory Controller Hub [8086:65c0] (rev 90)
	Subsystem: QUANTA Computer Inc Device [152d:8960]
	Control: I/O- Mem- BusMaster+ SpecCycle- MemWINV- VGASnoop- ParErr+ Stepping- SERR+ FastB2B- DisINTx-
	Status: Cap+ 66MHz- UDF- FastB2B- ParErr- DEVSEL=fast >TAbort- <TAbort- <MAbort- >SERR- <PERR- INTx-
	Latency: 0
	Capabilities: [50] Power Management version 2
		Flags: PMEClk- DSI- D1- D2- AuxCurrent=0mA PME(D0+,D1-,D2-,D3hot+,D3cold+)
		Status: D0 NoSoftRst- PME-Enable- DSel=0 DScale=0 PME-
	Capabilities: [58] MSI: Enable- Count=1/1 Maskable- 64bit-
		Address: fee00000  Data: 0000
	Capabilities: [6c] Express (v1) Root Port (Slot-), MSI 00
		DevCap:	MaxPayload 256 bytes, PhantFunc 0
			ExtTag- RBE-
		DevCtl:	Report errors: Correctable+ Non-Fatal+ Fatal+ Unsupported-
			RlxdOrd- ExtTag- PhantFunc- AuxPwr- NoSnoop+
			MaxPayload 256 bytes, MaxReadReq 128 bytes
		DevSta:	CorrErr- UncorrErr- FatalErr- UnsuppReq- AuxPwr- TransPend-
		LnkCap:	Port #0, Speed 2.5GT/s, Width x4, ASPM L0s, Exit Latency L0s unlimited
			ClockPM- Surprise+ LLActRep+ BwNot- ASPMOptComp-
		LnkCtl:	ASPM Disabled; RCB 64 bytes Disabled- CommClk-
			ExtSynch- ClockPM- AutWidDis- BWInt- AutBWInt-
		LnkSta:	Speed 2.5GT/s, Width x4, TrErr- Train- SlotClk+ DLActive+ BWMgmt- ABWMgmt-
		RootCtl: ErrCorrectable+ ErrNon-Fatal+ ErrFatal+ PMEIntEna- CRSVisible-
		RootCap: CRSVisible-
		RootSta: PME ReqID 0000, PMEStatus- PMEPending-
	Capabilities: [100 v1] Advanced Error Reporting
		UESta:	DLP- SDES- TLP- FCP- CmpltTO- CmpltAbrt- UnxCmplt- RxOF- MalfTLP- ECRC- UnsupReq- ACSViol-
		UEMsk:	DLP- SDES- TLP- FCP- CmpltTO- CmpltAbrt- UnxCmplt- RxOF- MalfTLP- ECRC- UnsupReq+ ACSViol-
		UESvrt:	DLP+ SDES+ TLP- FCP+ CmpltTO- CmpltAbrt- UnxCmplt- RxOF+ MalfTLP+ ECRC- UnsupReq- ACSViol+
		CESta:	RxErr- BadTLP- BadDLLP- Rollover- Timeout- NonFatalErr-
		CEMsk:	RxErr- BadTLP- BadDLLP- Rollover- Timeout- NonFatalErr-
		AERCap:	First Error Pointer: 00, ECRCGenCap- ECRCGenEn- ECRCChkCap- ECRCChkEn-
			MultHdrRecCap- MultHdrRecEn- TLPPfxPres- HdrLogCap-
		HeaderLog: 00000000 00000000 00000000 00000000
		RootCmd: CERptEn+ NFERptEn+ FERptEn+
		RootSta: CERcvd- MultCERcvd- UERcvd- MultUERcvd-
			 FirstFatal- NonFatalMsg- FatalMsg- IntMsg 0
		ErrorSrc: ERR_COR: 0000 ERR_FATAL/NONFATAL: 0000

00:04.0 PCI bridge [0604]: Intel Corporation 5100 Chipset PCI Express x16 Port 4-7 [8086:65fa] (rev 90) (prog-if 00 [Normal decode])
	Control: I/O+ Mem+ BusMaster+ SpecCycle- MemWINV- VGASnoop- ParErr+ Stepping- SERR+ FastB2B- DisINTx+
	Status: Cap+ 66MHz- UDF- FastB2B- ParErr- DEVSEL=fast >TAbort- <TAbort- <MAbort- >SERR- <PERR- INTx-
	Latency: 0, Cache Line Size: 64 bytes
	Interrupt: pin ? routed to IRQ 24
	Bus: primary=00, secondary=01, subordinate=01, sec-latency=0
	I/O behind bridge: 00001000-00001fff [size=4K]
	Memory behind bridge: c0000000-c01fffff [size=2M]
	Prefetchable memory behind bridge: 00000000c0200000-00000000c03fffff [size=2M]
	Secondary status: 66MHz- FastB2B- ParErr- DEVSEL=fast >TAbort- <TAbort- <MAbort- <SERR- <PERR-
	BridgeCtl: Parity+ SERR+ NoISA- VGA- MAbort- >Reset- FastB2B-
		PriDiscTmr- SecDiscTmr- DiscTmrStat- DiscTmrSERREn-
	Capabilities: [50] Power Management version 2
		Flags: PMEClk- DSI- D1- D2- AuxCurrent=0mA PME(D0+,D1-,D2-,D3hot+,D3cold+)
		Status: D0 NoSoftRst- PME-Enable- DSel=0 DScale=0 PME-
	Capabilities: [58] MSI: Enable+ Count=1/1 Maskable- 64bit-
		Address: fee04004  Data: 4021
	Capabilities: [6c] Express (v1) Root Port (Slot+), MSI 00
		DevCap:	MaxPayload 256 bytes, PhantFunc 0
			ExtTag- RBE-
		DevCtl:	Report errors: Correctable+ Non-Fatal+ Fatal+ Unsupported+
			RlxdOrd- ExtTag- PhantFunc- AuxPwr- NoSnoop+
			MaxPayload 256 bytes, MaxReadReq 128 bytes
		DevSta:	CorrErr- UncorrErr- FatalErr- UnsuppReq- AuxPwr- TransPend-
		LnkCap:	Port #4, Speed 2.5GT/s, Width x16, ASPM L0s, Exit Latency L0s unlimited
			ClockPM- Surprise+ LLActRep+ BwNot- ASPMOptComp-
		LnkCtl:	ASPM Disabled; RCB 64 bytes Disabled- CommClk-
			ExtSynch- ClockPM- AutWidDis- BWInt- AutBWInt-
		LnkSta:	Speed 2.5GT/s, Width x4, TrErr- Train- SlotClk+ DLActive- BWMgmt- ABWMgmt-
		SltCap:	AttnBtn+ PwrCtrl+ MRL+ AttnInd+ PwrInd+ HotPlug+ Surprise-
			Slot #5, PowerLimit 25.000W; Interlock- NoCompl-
		SltCtl:	Enable: AttnBtn+ PwrFlt- MRL+ PresDet- CmdCplt+ HPIrq+ LinkChg-
			Control: AttnInd Off, PwrInd Off, Power+ Interlock-
		SltSta:	Status: AttnBtn- PowerFlt- MRL+ CmdCplt- PresDet- Interlock-
			Changed: MRL- PresDet- LinkState-
		RootCtl: ErrCorrectable- ErrNon-Fatal- ErrFatal- PMEIntEna+ CRSVisible-
		RootCap: CRSVisible-
		RootSta: PME ReqID 0000, PMEStatus- PMEPending-
	Capabilities: [100 v1] Advanced Error Reporting
		UESta:	DLP- SDES- TLP- FCP- CmpltTO- CmpltAbrt- UnxCmplt- RxOF- MalfTLP- ECRC- UnsupReq- ACSViol-
		UEMsk:	DLP- SDES+ TLP- FCP- CmpltTO- CmpltAbrt- UnxCmplt- RxOF- MalfTLP- ECRC- UnsupReq+ ACSViol-
		UESvrt:	DLP+ SDES+ TLP- FCP+ CmpltTO- CmpltAbrt- UnxCmplt- RxOF+ MalfTLP+ ECRC- UnsupReq- ACSViol-
		CESta:	RxErr- BadTLP- BadDLLP- Rollover- Timeout- NonFatalErr-
		CEMsk:	RxErr- BadTLP- BadDLLP- Rollover- Timeout- NonFatalErr-
		AERCap:	First Error Pointer: 00, ECRCGenCap- ECRCGenEn- ECRCChkCap- ECRCChkEn-
			MultHdrRecCap- MultHdrRecEn- TLPPfxPres- HdrLogCap-
		HeaderLog: 00000000 00000000 00000000 00000000
		RootCmd: CERptEn+ NFERptEn+ FERptEn+
		RootSta: CERcvd- MultCERcvd- UERcvd- MultUERcvd-
			 FirstFatal- NonFatalMsg- FatalMsg- IntMsg 0
		ErrorSrc: ERR_COR: 0000 ERR_FATAL/NONFATAL: 0000
	Kernel driver in use: pcieport

00:05.0 PCI bridge [0604]: Intel Corporation 5100 Chipset PCI Express x4 Port 5 [8086:65e5] (rev 90) (prog-if 00 [Normal decode])
	Control: I/O- Mem- BusMaster+ SpecCycle- MemWINV- VGASnoop- ParErr+ Stepping- SERR+ FastB2B- DisINTx+
	Status: Cap+ 66MHz- UDF- FastB2B- ParErr- DEVSEL=fast >TAbort- <TAbort- <MAbort- >SERR- <PERR- INTx-
	Latency: 0, Cache Line Size: 64 bytes
	Interrupt: pin ? routed to IRQ 25
	Bus: primary=00, secondary=02, subordinate=02, sec-latency=0
	I/O behind bridge: None
	Memory behind bridge: None
	Prefetchable memory behind bridge: None
	Secondary status: 66MHz- FastB2B- ParErr- DEVSEL=fast >TAbort- <TAbort- <MAbort- <SERR- <PERR-
	BridgeCtl: Parity+ SERR+ NoISA- VGA- MAbort- >Reset- FastB2B-
		PriDiscTmr- SecDiscTmr- DiscTmrStat- DiscTmrSERREn-
	Capabilities: [50] Power Management version 2
		Flags: PMEClk- DSI- D1- D2- AuxCurrent=0mA PME(D0+,D1-,D2-,D3hot+,D3cold+)
		Status: D0 NoSoftRst- PME-Enable- DSel=0 DScale=0 PME-
	Capabilities: [58] MSI: Enable+ Count=1/1 Maskable- 64bit-
		Address: fee08004  Data: 4021
	Capabilities: [6c] Express (v1) Root Port (Slot-), MSI 00
		DevCap:	MaxPayload 256 bytes, PhantFunc 0
			ExtTag- RBE-
		DevCtl:	Report errors: Correctable+ Non-Fatal+ Fatal+ Unsupported+
			RlxdOrd- ExtTag- PhantFunc- AuxPwr- NoSnoop+
			MaxPayload 256 bytes, MaxReadReq 128 bytes
		DevSta:	CorrErr- UncorrErr- FatalErr- UnsuppReq- AuxPwr- TransPend-
		LnkCap:	Port #5, Speed 2.5GT/s, Width x4, ASPM L0s, Exit Latency L0s unlimited
			ClockPM- Surprise+ LLActRep+ BwNot- ASPMOptComp-
		LnkCtl:	ASPM Disabled; RCB 64 bytes Disabled- CommClk-
			ExtSynch- ClockPM- AutWidDis- BWInt- AutBWInt-
		LnkSta:	Speed 2.5GT/s, Width x0, TrErr- Train- SlotClk+ DLActive- BWMgmt- ABWMgmt-
		RootCtl: ErrCorrectable- ErrNon-Fatal- ErrFatal- PMEIntEna+ CRSVisible-
		RootCap: CRSVisible-
		RootSta: PME ReqID 0000, PMEStatus- PMEPending-
	Capabilities: [100 v1] Advanced Error Reporting
		UESta:	DLP- SDES- TLP- FCP- CmpltTO- CmpltAbrt- UnxCmplt- RxOF- MalfTLP- ECRC- UnsupReq- ACSViol-
		UEMsk:	DLP- SDES- TLP- FCP- CmpltTO- CmpltAbrt- UnxCmplt- RxOF- MalfTLP- ECRC- UnsupReq- ACSViol-
		UESvrt:	DLP+ SDES+ TLP- FCP+ CmpltTO- CmpltAbrt- UnxCmplt- RxOF+ MalfTLP+ ECRC- UnsupReq- ACSViol-
		CESta:	RxErr- BadTLP- BadDLLP- Rollover- Timeout- NonFatalErr-
		CEMsk:	RxErr- BadTLP- BadDLLP- Rollover- Timeout- NonFatalErr-
		AERCap:	First Error Pointer: 00, ECRCGenCap- ECRCGenEn- ECRCChkCap- ECRCChkEn-
			MultHdrRecCap- MultHdrRecEn- TLPPfxPres- HdrLogCap-
		HeaderLog: 00000000 00000000 00000000 00000000
		RootCmd: CERptEn+ NFERptEn+ FERptEn+
		RootSta: CERcvd- MultCERcvd- UERcvd- MultUERcvd-
			 FirstFatal- NonFatalMsg- FatalMsg- IntMsg 0
		ErrorSrc: ERR_COR: 0000 ERR_FATAL/NONFATAL: 0000
	Kernel driver in use: pcieport

00:06.0 PCI bridge [0604]: Intel Corporation 5100 Chipset PCI Express x4 Port 6 [8086:65e6] (rev 90) (prog-if 00 [Normal decode])
	Control: I/O+ Mem+ BusMaster+ SpecCycle- MemWINV- VGASnoop- ParErr+ Stepping- SERR+ FastB2B- DisINTx+
	Status: Cap+ 66MHz- UDF- FastB2B- ParErr- DEVSEL=fast >TAbort- <TAbort- <MAbort- >SERR- <PERR- INTx-
	Latency: 0, Cache Line Size: 64 bytes
	Interrupt: pin ? routed to IRQ 26
	Bus: primary=00, secondary=03, subordinate=03, sec-latency=0
	I/O behind bridge: 00002000-00002fff [size=4K]
	Memory behind bridge: c0400000-c05fffff [size=2M]
	Prefetchable memory behind bridge: 00000000c0600000-00000000c07fffff [size=2M]
	Secondary status: 66MHz- FastB2B- ParErr- DEVSEL=fast >TAbort- <TAbort- <MAbort- <SERR- <PERR-
	BridgeCtl: Parity+ SERR+ NoISA- VGA- MAbort- >Reset- FastB2B-
		PriDiscTmr- SecDiscTmr- DiscTmrStat- DiscTmrSERREn-
	Capabilities: [50] Power Management version 2
		Flags: PMEClk- DSI- D1- D2- AuxCurrent=0mA PME(D0+,D1-,D2-,D3hot+,D3cold+)
		Status: D0 NoSoftRst- PME-Enable- DSel=0 DScale=0 PME-
	Capabilities: [58] MSI: Enable+ Count=1/1 Maskable- 64bit-
		Address: fee10004  Data: 4021
	Capabilities: [6c] Express (v1) Root Port (Slot+), MSI 00
		DevCap:	MaxPayload 256 bytes, PhantFunc 0
			ExtTag- RBE-
		DevCtl:	Report errors: Correctable+ Non-Fatal+ Fatal+ Unsupported+
			RlxdOrd- ExtTag- PhantFunc- AuxPwr- NoSnoop+
			MaxPayload 256 bytes, MaxReadReq 128 bytes
		DevSta:	CorrErr- UncorrErr- FatalErr- UnsuppReq- AuxPwr- TransPend-
		LnkCap:	Port #6, Speed 2.5GT/s, Width x4, ASPM L0s, Exit Latency L0s unlimited
			ClockPM- Surprise+ LLActRep+ BwNot- ASPMOptComp-
		LnkCtl:	ASPM Disabled; RCB 64 bytes Disabled- CommClk-
			ExtSynch- ClockPM- AutWidDis- BWInt- AutBWInt-
		LnkSta:	Speed 2.5GT/s, Width x0, TrErr- Train- SlotClk+ DLActive- BWMgmt- ABWMgmt-
		SltCap:	AttnBtn+ PwrCtrl+ MRL+ AttnInd+ PwrInd+ HotPlug+ Surprise-
			Slot #6, PowerLimit 25.000W; Interlock- NoCompl-
		SltCtl:	Enable: AttnBtn+ PwrFlt- MRL+ PresDet- CmdCplt+ HPIrq+ LinkChg-
			Control: AttnInd Off, PwrInd Off, Power+ Interlock-
		SltSta:	Status: AttnBtn- PowerFlt- MRL+ CmdCplt- PresDet- Interlock-
			Changed: MRL- PresDet- LinkState-
		RootCtl: ErrCorrectable- ErrNon-Fatal- ErrFatal- PMEIntEna+ CRSVisible-
		RootCap: CRSVisible-
		RootSta: PME ReqID 0000, PMEStatus- PMEPending-
	Capabilities: [100 v1] Advanced Error Reporting
		UESta:	DLP- SDES- TLP- FCP- CmpltTO- CmpltAbrt- UnxCmplt- RxOF- MalfTLP- ECRC- UnsupReq- ACSViol-
		UEMsk:	DLP- SDES- TLP- FCP- CmpltTO- CmpltAbrt- UnxCmplt- RxOF- MalfTLP- ECRC- UnsupReq- ACSViol-
		UESvrt:	DLP+ SDES+ TLP- FCP+ CmpltTO- CmpltAbrt- UnxCmplt- RxOF+ MalfTLP+ ECRC- UnsupReq- ACSViol-
		CESta:	RxErr- BadTLP- BadDLLP- Rollover- Timeout- NonFatalErr-
		CEMsk:	RxErr- BadTLP- BadDLLP- Rollover- Timeout- NonFatalErr-
		AERCap:	First Error Pointer: 00, ECRCGenCap- ECRCGenEn- ECRCChkCap- ECRCChkEn-
			MultHdrRecCap- MultHdrRecEn- TLPPfxPres- HdrLogCap-
		HeaderLog: 00000000 00000000 00000000 00000000
		RootCmd: CERptEn+ NFERptEn+ FERptEn+
		RootSta: CERcvd- MultCERcvd- UERcvd- MultUERcvd-
			 FirstFatal- NonFatalMsg- FatalMsg- IntMsg 0
		ErrorSrc: ERR_COR: 0000 ERR_FATAL/NONFATAL: 0000
	Kernel driver in use: pcieport

00:07.0 PCI bridge [0604]: Intel Corporation 5100 Chipset PCI Express x4 Port 7 [8086:65e7] (rev 90) (prog-if 00 [Normal decode])
	Control: I/O- Mem- BusMaster+ SpecCycle- MemWINV- VGASnoop- ParErr+ Stepping- SERR+ FastB2B- DisINTx+
	Status: Cap+ 66MHz- UDF- FastB2B- ParErr- DEVSEL=fast >TAbort- <TAbort- <MAbort- >SERR- <PERR- INTx-
	Latency: 0, Cache Line Size: 64 bytes
	Interrupt: pin ? routed to IRQ 27
	Bus: primary=00, secondary=04, subordinate=04, sec-latency=0
	I/O behind bridge: None
	Memory behind bridge: None
	Prefetchable memory behind bridge: None
	Secondary status: 66MHz- FastB2B- ParErr- DEVSEL=fast >TAbort- <TAbort- <MAbort- <SERR- <PERR-
	BridgeCtl: Parity+ SERR+ NoISA- VGA- MAbort- >Reset- FastB2B-
		PriDiscTmr- SecDiscTmr- DiscTmrStat- DiscTmrSERREn-
	Capabilities: [50] Power Management version 2
		Flags: PMEClk- DSI- D1- D2- AuxCurrent=0mA PME(D0+,D1-,D2-,D3hot+,D3cold+)
		Status: D0 NoSoftRst- PME-Enable- DSel=0 DScale=0 PME-
	Capabilities: [58] MSI: Enable+ Count=1/1 Maskable- 64bit-
		Address: fee20004  Data: 4021
	Capabilities: [6c] Express (v1) Root Port (Slot-), MSI 00
		DevCap:	MaxPayload 256 bytes, PhantFunc 0
			ExtTag- RBE-
		DevCtl:	Report errors: Correctable+ Non-Fatal+ Fatal+ Unsupported+
			RlxdOrd- ExtTag- PhantFunc- AuxPwr- NoSnoop+
			MaxPayload 256 bytes, MaxReadReq 128 bytes
		DevSta:	CorrErr- UncorrErr- FatalErr- UnsuppReq- AuxPwr- TransPend-
		LnkCap:	Port #7, Speed 2.5GT/s, Width x4, ASPM L0s, Exit Latency L0s unlimited
			ClockPM- Surprise+ LLActRep+ BwNot- ASPMOptComp-
		LnkCtl:	ASPM Disabled; RCB 64 bytes Disabled- CommClk-
			ExtSynch- ClockPM- AutWidDis- BWInt- AutBWInt-
		LnkSta:	Speed 2.5GT/s, Width x0, TrErr- Train- SlotClk+ DLActive- BWMgmt- ABWMgmt-
		RootCtl: ErrCorrectable- ErrNon-Fatal- ErrFatal- PMEIntEna+ CRSVisible-
		RootCap: CRSVisible-
		RootSta: PME ReqID 0000, PMEStatus- PMEPending-
	Capabilities: [100 v1] Advanced Error Reporting
		UESta:	DLP- SDES- TLP- FCP- CmpltTO- CmpltAbrt- UnxCmplt- RxOF- MalfTLP- ECRC- UnsupReq- ACSViol-
		UEMsk:	DLP- SDES- TLP- FCP- CmpltTO- CmpltAbrt- UnxCmplt- RxOF- MalfTLP- ECRC- UnsupReq- ACSViol-
		UESvrt:	DLP+ SDES+ TLP- FCP+ CmpltTO- CmpltAbrt- UnxCmplt- RxOF+ MalfTLP+ ECRC- UnsupReq- ACSViol-
		CESta:	RxErr- BadTLP- BadDLLP- Rollover- Timeout- NonFatalErr-
		CEMsk:	RxErr- BadTLP- BadDLLP- Rollover- Timeout- NonFatalErr-
		AERCap:	First Error Pointer: 00, ECRCGenCap- ECRCGenEn- ECRCChkCap- ECRCChkEn-
			MultHdrRecCap- MultHdrRecEn- TLPPfxPres- HdrLogCap-
		HeaderLog: 00000000 00000000 00000000 00000000
		RootCmd: CERptEn+ NFERptEn+ FERptEn+
		RootSta: CERcvd- MultCERcvd- UERcvd- MultUERcvd-
			 FirstFatal- NonFatalMsg- FatalMsg- IntMsg 0
		ErrorSrc: ERR_COR: 0000 ERR_FATAL/NONFATAL: 0000
	Kernel driver in use: pcieport

00:10.0 Host bridge [0600]: Intel Corporation 5100 Chipset FSB Registers [8086:65f0] (rev 90)
	Subsystem: QUANTA Computer Inc Device [152d:8960]
	Control: I/O- Mem- BusMaster- SpecCycle- MemWINV- VGASnoop- ParErr- Stepping- SERR- FastB2B- DisINTx-
	Status: Cap- 66MHz- UDF- FastB2B- ParErr- DEVSEL=fast >TAbort- <TAbort- <MAbort- >SERR- <PERR- INTx-

00:10.1 Host bridge [0600]: Intel Corporation 5100 Chipset FSB Registers [8086:65f0] (rev 90)
	Subsystem: QUANTA Computer Inc Device [152d:8960]
	Control: I/O- Mem- BusMaster- SpecCycle- MemWINV- VGASnoop- ParErr- Stepping- SERR- FastB2B- DisINTx-
	Status: Cap- 66MHz- UDF- FastB2B- ParErr- DEVSEL=fast >TAbort- <TAbort- <MAbort- >SERR- <PERR- INTx-
	Kernel driver in use: i5100_edac

00:10.2 Host bridge [0600]: Intel Corporation 5100 Chipset FSB Registers [8086:65f0] (rev 90)
	Subsystem: QUANTA Computer Inc Device [152d:8960]
	Control: I/O- Mem- BusMaster- SpecCycle- MemWINV- VGASnoop- ParErr- Stepping- SERR- FastB2B- DisINTx-
	Status: Cap- 66MHz- UDF- FastB2B- ParErr- DEVSEL=fast >TAbort- <TAbort- <MAbort- >SERR- <PERR- INTx-

00:11.0 Host bridge [0600]: Intel Corporation 5100 Chipset Reserved Registers [8086:65f1] (rev 90)
	Subsystem: QUANTA Computer Inc Device [152d:8960]
	Control: I/O- Mem- BusMaster- SpecCycle- MemWINV- VGASnoop- ParErr- Stepping- SERR- FastB2B- DisINTx-
	Status: Cap- 66MHz- UDF- FastB2B- ParErr- DEVSEL=fast >TAbort- <TAbort- <MAbort- >SERR- <PERR- INTx-

00:13.0 Host bridge [0600]: Intel Corporation 5100 Chipset Reserved Registers [8086:65f3] (rev 90)
	Subsystem: QUANTA Computer Inc Device [152d:8960]
	Control: I/O- Mem- BusMaster- SpecCycle- MemWINV- VGASnoop- ParErr- Stepping- SERR- FastB2B- DisINTx-
	Status: Cap- 66MHz- UDF- FastB2B- ParErr- DEVSEL=fast >TAbort- <TAbort- <MAbort- >SERR- <PERR- INTx-

00:15.0 Host bridge [0600]: Intel Corporation 5100 Chipset DDR Channel 0 Registers [8086:65f5] (rev 90)
	Subsystem: QUANTA Computer Inc Device [152d:8960]
	Control: I/O- Mem- BusMaster- SpecCycle- MemWINV- VGASnoop- ParErr- Stepping- SERR- FastB2B- DisINTx-
	Status: Cap- 66MHz- UDF- FastB2B- ParErr- DEVSEL=fast >TAbort- <TAbort- <MAbort- >SERR- <PERR- INTx-

00:16.0 Host bridge [0600]: Intel Corporation 5100 Chipset DDR Channel 1 Registers [8086:65f6] (rev 90)
	Subsystem: QUANTA Computer Inc Device [152d:8960]
	Control: I/O- Mem- BusMaster- SpecCycle- MemWINV- VGASnoop- ParErr- Stepping- SERR- FastB2B- DisINTx-
	Status: Cap- 66MHz- UDF- FastB2B- ParErr- DEVSEL=fast >TAbort- <TAbort- <MAbort- >SERR- <PERR- INTx-

00:19.0 Ethernet controller [0200]: Intel Corporation 82566DM-2 Gigabit Network Connection [8086:10bd] (rev 02)
	Subsystem: Intel Corporation Device [8086:0000]
	Control: I/O+ Mem+ BusMaster+ SpecCycle- MemWINV- VGASnoop- ParErr+ Stepping- SERR+ FastB2B- DisINTx+
	Status: Cap+ 66MHz- UDF- FastB2B- ParErr- DEVSEL=fast >TAbort- <TAbort- <MAbort- >SERR- <PERR- INTx-
	Latency: 0
	Interrupt: pin A routed to IRQ 30
	Region 0: Memory at df6e0000 (32-bit, non-prefetchable) [size=128K]
	Region 1: Memory at df6df000 (32-bit, non-prefetchable) [size=4K]
	Region 2: I/O ports at dc00 [size=32]
	Capabilities: [c8] Power Management version 2
		Flags: PMEClk- DSI+ D1- D2- AuxCurrent=0mA PME(D0+,D1-,D2-,D3hot+,D3cold+)
		Status: D0 NoSoftRst- PME-Enable- DSel=0 DScale=1 PME-
	Capabilities: [d0] MSI: Enable+ Count=1/1 Maskable- 64bit+
		Address: 00000000fee80004  Data: 4022
	Capabilities: [e0] PCI Advanced Features
		AFCap: TP+ FLR+
		AFCtrl: FLR-
		AFStatus: TP-
	Kernel driver in use: e1000e

00:1a.0 USB controller [0c03]: Intel Corporation 82801I (ICH9 Family) USB UHCI Controller #4 [8086:2937] (rev 02) (prog-if 00 [UHCI])
	Subsystem: Intel Corporation Optiplex 755 [8086:2937]
	Control: I/O+ Mem- BusMaster+ SpecCycle- MemWINV- VGASnoop- ParErr- Stepping- SERR- FastB2B- DisINTx-
	Status: Cap+ 66MHz- UDF- FastB2B+ ParErr- DEVSEL=medium >TAbort- <TAbort- <MAbort- >SERR- <PERR- INTx-
	Latency: 0
	Interrupt: pin A routed to IRQ 23
	Region 4: I/O ports at d880 [size=32]
	Capabilities: [50] PCI Advanced Features
		AFCap: TP+ FLR+
		AFCtrl: FLR-
		AFStatus: TP-
	Kernel driver in use: uhci_hcd

00:1a.7 USB controller [0c03]: Intel Corporation 82801I (ICH9 Family) USB2 EHCI Controller #2 [8086:293c] (rev 02) (prog-if 20 [EHCI])
	Subsystem: QUANTA Computer Inc Device [152d:8960]
	Control: I/O- Mem+ BusMaster+ SpecCycle- MemWINV- VGASnoop- ParErr- Stepping- SERR+ FastB2B- DisINTx-
	Status: Cap+ 66MHz- UDF- FastB2B+ ParErr- DEVSEL=medium >TAbort- <TAbort- <MAbort- >SERR- <PERR- INTx-
	Latency: 0
	Interrupt: pin C routed to IRQ 21
	Region 0: Memory at df6dec00 (32-bit, non-prefetchable) [size=1K]
	Capabilities: [50] Power Management version 2
		Flags: PMEClk- DSI- D1- D2- AuxCurrent=375mA PME(D0+,D1-,D2-,D3hot+,D3cold+)
		Status: D0 NoSoftRst- PME-Enable- DSel=0 DScale=0 PME-
	Capabilities: [58] Debug port: BAR=1 offset=00a0
	Capabilities: [98] PCI Advanced Features
		AFCap: TP+ FLR+
		AFCtrl: FLR-
		AFStatus: TP-
	Kernel driver in use: ehci-pci

00:1c.0 PCI bridge [0604]: Intel Corporation 82801I (ICH9 Family) PCI Express Port 5 [8086:2948] (rev 02) (prog-if 00 [Normal decode])
	Control: I/O+ Mem+ BusMaster+ SpecCycle- MemWINV- VGASnoop- ParErr+ Stepping- SERR+ FastB2B- DisINTx+
	Status: Cap+ 66MHz- UDF- FastB2B- ParErr- DEVSEL=fast >TAbort- <TAbort- <MAbort- >SERR- <PERR- INTx-
	Latency: 0, Cache Line Size: 64 bytes
	Interrupt: pin A routed to IRQ 28
	Bus: primary=00, secondary=06, subordinate=06, sec-latency=0
	I/O behind bridge: 00003000-00003fff [size=4K]
	Memory behind bridge: c0800000-c09fffff [size=2M]
	Prefetchable memory behind bridge: 00000000c0a00000-00000000c0bfffff [size=2M]
	Secondary status: 66MHz- FastB2B- ParErr- DEVSEL=fast >TAbort- <TAbort- <MAbort+ <SERR- <PERR-
	BridgeCtl: Parity+ SERR+ NoISA- VGA- MAbort- >Reset- FastB2B-
		PriDiscTmr- SecDiscTmr- DiscTmrStat- DiscTmrSERREn-
	Capabilities: [40] Express (v1) Root Port (Slot+), MSI 00
		DevCap:	MaxPayload 128 bytes, PhantFunc 0
			ExtTag- RBE+
		DevCtl:	Report errors: Correctable- Non-Fatal- Fatal- Unsupported-
			RlxdOrd- ExtTag- PhantFunc- AuxPwr- NoSnoop-
			MaxPayload 128 bytes, MaxReadReq 128 bytes
		DevSta:	CorrErr+ UncorrErr- FatalErr- UnsuppReq- AuxPwr+ TransPend-
		LnkCap:	Port #5, Speed 2.5GT/s, Width x1, ASPM L0s L1, Exit Latency L0s <256ns, L1 <4us
			ClockPM- Surprise- LLActRep+ BwNot- ASPMOptComp-
		LnkCtl:	ASPM Disabled; RCB 64 bytes Disabled- CommClk+
			ExtSynch- ClockPM- AutWidDis- BWInt- AutBWInt-
		LnkSta:	Speed 2.5GT/s, Width x1, TrErr- Train- SlotClk+ DLActive- BWMgmt- ABWMgmt-
		SltCap:	AttnBtn- PwrCtrl- MRL- AttnInd- PwrInd- HotPlug+ Surprise+
			Slot #0, PowerLimit 10.000W; Interlock- NoCompl-
		SltCtl:	Enable: AttnBtn- PwrFlt- MRL- PresDet+ CmdCplt+ HPIrq+ LinkChg+
			Control: AttnInd Unknown, PwrInd Unknown, Power- Interlock-
		SltSta:	Status: AttnBtn- PowerFlt- MRL- CmdCplt- PresDet- Interlock-
			Changed: MRL- PresDet+ LinkState-
		RootCtl: ErrCorrectable- ErrNon-Fatal- ErrFatal- PMEIntEna+ CRSVisible-
		RootCap: CRSVisible-
		RootSta: PME ReqID 0000, PMEStatus- PMEPending-
	Capabilities: [80] MSI: Enable+ Count=1/1 Maskable- 64bit-
		Address: fee40004  Data: 4021
	Capabilities: [90] Subsystem: Intel Corporation 82801I (ICH9 Family) PCI Express Port 5 [8086:2948]
	Capabilities: [a0] Power Management version 2
		Flags: PMEClk- DSI- D1- D2- AuxCurrent=0mA PME(D0+,D1-,D2-,D3hot+,D3cold+)
		Status: D0 NoSoftRst- PME-Enable- DSel=0 DScale=0 PME-
	Capabilities: [100 v1] Virtual Channel
		Caps:	LPEVC=0 RefClk=100ns PATEntryBits=1
		Arb:	Fixed+ WRR32- WRR64- WRR128-
		Ctrl:	ArbSelect=Fixed
		Status:	InProgress-
		VC0:	Caps:	PATOffset=00 MaxTimeSlots=1 RejSnoopTrans-
			Arb:	Fixed+ WRR32- WRR64- WRR128- TWRR128- WRR256-
			Ctrl:	Enable+ ID=0 ArbSelect=Fixed TC/VC=01
			Status:	NegoPending- InProgress-
	Capabilities: [180 v1] Root Complex Link
		Desc:	PortNumber=05 ComponentID=00 EltType=Config
		Link0:	Desc:	TargetPort=00 TargetComponent=00 AssocRCRB- LinkType=MemMapped LinkValid+
			Addr:	00000000fed1c000
	Kernel driver in use: pcieport

00:1d.0 USB controller [0c03]: Intel Corporation 82801I (ICH9 Family) USB UHCI Controller #1 [8086:2934] (rev 02) (prog-if 00 [UHCI])
	Subsystem: Intel Corporation 82801I (ICH9 Family) USB UHCI Controller #1 [8086:2934]
	Control: I/O+ Mem- BusMaster+ SpecCycle- MemWINV- VGASnoop- ParErr- Stepping- SERR- FastB2B- DisINTx-
	Status: Cap+ 66MHz- UDF- FastB2B+ ParErr- DEVSEL=medium >TAbort- <TAbort- <MAbort- >SERR- <PERR- INTx-
	Latency: 0
	Interrupt: pin A routed to IRQ 23
	Region 4: I/O ports at d800 [size=32]
	Capabilities: [50] PCI Advanced Features
		AFCap: TP+ FLR+
		AFCtrl: FLR-
		AFStatus: TP-
	Kernel driver in use: uhci_hcd

00:1d.1 USB controller [0c03]: Intel Corporation 82801I (ICH9 Family) USB UHCI Controller #2 [8086:2935] (rev 02) (prog-if 00 [UHCI])
	Subsystem: Intel Corporation 82801I (ICH9 Family) USB UHCI Controller #2 [8086:2935]
	Control: I/O+ Mem- BusMaster+ SpecCycle- MemWINV- VGASnoop- ParErr- Stepping- SERR- FastB2B- DisINTx-
	Status: Cap+ 66MHz- UDF- FastB2B+ ParErr- DEVSEL=medium >TAbort- <TAbort- <MAbort- >SERR- <PERR- INTx-
	Latency: 0
	Interrupt: pin B routed to IRQ 22
	Region 4: I/O ports at d480 [size=32]
	Capabilities: [50] PCI Advanced Features
		AFCap: TP+ FLR+
		AFCtrl: FLR-
		AFStatus: TP-
	Kernel driver in use: uhci_hcd

00:1d.2 USB controller [0c03]: Intel Corporation 82801I (ICH9 Family) USB UHCI Controller #3 [8086:2936] (rev 02) (prog-if 00 [UHCI])
	Subsystem: Intel Corporation 82801I (ICH9 Family) USB UHCI Controller #3 [8086:2936]
	Control: I/O+ Mem- BusMaster+ SpecCycle- MemWINV- VGASnoop- ParErr- Stepping- SERR- FastB2B- DisINTx-
	Status: Cap+ 66MHz- UDF- FastB2B+ ParErr- DEVSEL=medium >TAbort- <TAbort- <MAbort- >SERR- <PERR- INTx-
	Latency: 0
	Interrupt: pin C routed to IRQ 21
	Region 4: I/O ports at d400 [size=32]
	Capabilities: [50] PCI Advanced Features
		AFCap: TP+ FLR+
		AFCtrl: FLR-
		AFStatus: TP-
	Kernel driver in use: uhci_hcd

00:1d.7 USB controller [0c03]: Intel Corporation 82801I (ICH9 Family) USB2 EHCI Controller #1 [8086:293a] (rev 02) (prog-if 20 [EHCI])
	Subsystem: QUANTA Computer Inc Device [152d:8960]
	Control: I/O- Mem+ BusMaster+ SpecCycle- MemWINV- VGASnoop- ParErr- Stepping- SERR+ FastB2B- DisINTx-
	Status: Cap+ 66MHz- UDF- FastB2B+ ParErr- DEVSEL=medium >TAbort- <TAbort- <MAbort- >SERR- <PERR- INTx-
	Latency: 0
	Interrupt: pin A routed to IRQ 23
	Region 0: Memory at df6de800 (32-bit, non-prefetchable) [size=1K]
	Capabilities: [50] Power Management version 2
		Flags: PMEClk- DSI- D1- D2- AuxCurrent=375mA PME(D0+,D1-,D2-,D3hot+,D3cold+)
		Status: D0 NoSoftRst- PME-Enable- DSel=0 DScale=0 PME-
	Capabilities: [58] Debug port: BAR=1 offset=00a0
	Capabilities: [98] PCI Advanced Features
		AFCap: TP+ FLR+
		AFCtrl: FLR-
		AFStatus: TP-
	Kernel driver in use: ehci-pci

00:1e.0 PCI bridge [0604]: Intel Corporation 82801 PCI Bridge [8086:244e] (rev 92) (prog-if 01 [Subtractive decode])
	Control: I/O+ Mem+ BusMaster+ SpecCycle- MemWINV- VGASnoop- ParErr+ Stepping- SERR+ FastB2B- DisINTx-
	Status: Cap+ 66MHz- UDF- FastB2B- ParErr- DEVSEL=fast >TAbort- <TAbort- <MAbort- >SERR- <PERR- INTx-
	Latency: 0
	Bus: primary=00, secondary=07, subordinate=07, sec-latency=32
	I/O behind bridge: 0000e000-0000efff [size=4K]
	Memory behind bridge: df700000-dfffffff [size=9M]
	Prefetchable memory behind bridge: None
	Secondary status: 66MHz- FastB2B+ ParErr- DEVSEL=medium >TAbort- <TAbort- <MAbort+ <SERR- <PERR-
	BridgeCtl: Parity+ SERR+ NoISA- VGA+ MAbort- >Reset- FastB2B-
		PriDiscTmr- SecDiscTmr- DiscTmrStat- DiscTmrSERREn-
	Capabilities: [50] Subsystem: Intel Corporation 82801 PCI Bridge [8086:244e]

00:1f.0 ISA bridge [0601]: Intel Corporation 82801IR (ICH9R) LPC Interface Controller [8086:2916] (rev 02)
	Subsystem: Intel Corporation 82801IR (ICH9R) LPC Interface Controller [8086:2916]
	Control: I/O+ Mem+ BusMaster+ SpecCycle- MemWINV- VGASnoop- ParErr+ Stepping- SERR+ FastB2B- DisINTx-
	Status: Cap+ 66MHz- UDF- FastB2B- ParErr- DEVSEL=medium >TAbort- <TAbort- <MAbort- >SERR- <PERR- INTx-
	Latency: 0
	Capabilities: [e0] Vendor Specific Information: Len=0c <?>
	Kernel driver in use: lpc_ich

00:1f.2 SATA controller [0106]: Intel Corporation 82801IR/IO/IH (ICH9R/DO/DH) 6 port SATA Controller [AHCI mode] [8086:2922] (rev 02) (prog-if 01 [AHCI 1.0])
	Subsystem: Intel Corporation 82801IR/IO/IH (ICH9R/DO/DH) 6 port SATA Controller [AHCI mode] [8086:2922]
	Control: I/O+ Mem+ BusMaster+ SpecCycle- MemWINV- VGASnoop- ParErr+ Stepping- SERR- FastB2B- DisINTx+
	Status: Cap+ 66MHz+ UDF- FastB2B+ ParErr- DEVSEL=medium >TAbort- <TAbort- <MAbort- >SERR- <PERR- INTx-
	Latency: 0
	Interrupt: pin B routed to IRQ 29
	Region 0: I/O ports at d080 [size=8]
	Region 1: I/O ports at d000 [size=4]
	Region 2: I/O ports at cc00 [size=8]
	Region 3: I/O ports at c880 [size=4]
	Region 4: I/O ports at c800 [size=32]
	Region 5: Memory at df6de000 (32-bit, non-prefetchable) [size=2K]
	Capabilities: [80] MSI: Enable+ Count=1/16 Maskable- 64bit-
		Address: fee08004  Data: 4023
	Capabilities: [70] Power Management version 3
		Flags: PMEClk- DSI- D1- D2- AuxCurrent=0mA PME(D0-,D1-,D2-,D3hot+,D3cold-)
		Status: D0 NoSoftRst+ PME-Enable- DSel=0 DScale=0 PME-
	Capabilities: [a8] SATA HBA v1.0 BAR4 Offset=00000004
	Capabilities: [b0] PCI Advanced Features
		AFCap: TP+ FLR+
		AFCtrl: FLR-
		AFStatus: TP-
	Kernel driver in use: ahci

00:1f.3 SMBus [0c05]: Intel Corporation 82801I (ICH9 Family) SMBus Controller [8086:2930] (rev 02)
	Subsystem: Intel Corporation 82801I (ICH9 Family) SMBus Controller [8086:2930]
	Control: I/O+ Mem+ BusMaster- SpecCycle- MemWINV- VGASnoop- ParErr- Stepping- SERR+ FastB2B- DisINTx-
	Status: Cap- 66MHz- UDF- FastB2B+ ParErr- DEVSEL=medium >TAbort- <TAbort- <MAbort- >SERR- <PERR- INTx-
	Interrupt: pin C routed to IRQ 11
	Region 0: Memory at df6ddc00 (64-bit, non-prefetchable) [size=256]
	Region 4: I/O ports at 0400 [size=32]

07:03.0 VGA compatible controller [0300]: ASPEED Technology, Inc. ASPEED Graphics Family [1a03:2000] (prog-if 00 [VGA controller])
	Subsystem: ASPEED Technology, Inc. ASPEED Graphics Family [1a03:2000]
	Control: I/O+ Mem+ BusMaster- SpecCycle- MemWINV- VGASnoop- ParErr- Stepping- SERR- FastB2B- DisINTx-
	Status: Cap+ 66MHz+ UDF- FastB2B- ParErr- DEVSEL=medium >TAbort- <TAbort- <MAbort- >SERR- <PERR- INTx-
	Interrupt: pin A routed to IRQ 18
	Region 0: Memory at df800000 (32-bit, non-prefetchable) [size=8M]
	Region 1: Memory at df7e0000 (32-bit, non-prefetchable) [size=128K]
	Region 2: I/O ports at ec00 [size=128]
	[virtual] Expansion ROM at 000c0000 [disabled] [size=128K]
	Capabilities: [40] Power Management version 2
		Flags: PMEClk- DSI- D1+ D2+ AuxCurrent=0mA PME(D0-,D1-,D2-,D3hot-,D3cold-)
		Status: D0 NoSoftRst- PME-Enable- DSel=0 DScale=0 PME-
	Kernel driver in use: ast

