00:01.0 Host bridge [0600]: Advanced Micro Devices, Inc. [AMD] CS5536 [Geode companion] Host Bridge [1022:2080] (rev 33)
	Subsystem: Advanced Micro Devices, Inc. [AMD] CS5536 [Geode companion] Host Bridge [1022:2080]
	Control: I/O+ Mem- BusMaster+ SpecCycle- MemWINV- VGASnoop- ParErr- Stepping- SERR- FastB2B- DisINTx-
	Status: Cap- 66MHz+ UDF- FastB2B- ParErr- DEVSEL=medium >TAbort- <TAbort- <MAbort- >SERR- <PERR- INTx-
	Latency: 248, Cache Line Size: 32 bytes

00:01.1 VGA compatible controller [0300]: Advanced Micro Devices, Inc. [AMD] Geode LX Video [1022:2081] (prog-if 00 [VGA controller])
	Subsystem: Advanced Micro Devices, Inc. [AMD] Geode LX Video [1022:2081]
	Control: I/O+ Mem+ BusMaster- SpecCycle- MemWINV- VGASnoop- ParErr- Stepping- SERR- FastB2B- DisINTx-
	Status: Cap- 66MHz+ UDF- FastB2B- ParErr- DEVSEL=medium >TAbort- <TAbort- <MAbort- >SERR- <PERR- INTx-
	Interrupt: pin A routed to IRQ 11
	Region 0: Memory at e0000000 (32-bit, non-prefetchable) [size=16M]
	Region 1: Memory at e1000000 (32-bit, non-prefetchable) [size=16K]
	Region 2: Memory at e1004000 (32-bit, non-prefetchable) [size=16K]
	Region 3: Memory at e1008000 (32-bit, non-prefetchable) [size=16K]
	Region 4: Memory at e100c000 (32-bit, non-prefetchable) [size=16K]
	Expansion ROM at 000c0000 [virtual] [disabled] [size=128K]
	Kernel driver in use: lxfb
	Kernel modules: lxfb

00:01.2 Entertainment encryption device [1010]: Advanced Micro Devices, Inc. [AMD] Geode LX AES Security Block [1022:2082]
	Subsystem: Advanced Micro Devices, Inc. [AMD] Geode LX AES Security Block [1022:2082]
	Control: I/O- Mem+ BusMaster+ SpecCycle- MemWINV- VGASnoop- ParErr- Stepping- SERR- FastB2B- DisINTx-
	Status: Cap- 66MHz+ UDF- FastB2B+ ParErr- DEVSEL=medium >TAbort- <TAbort- <MAbort- >SERR- <PERR- INTx-
	Latency: 0, Cache Line Size: 32 bytes
	Interrupt: pin A routed to IRQ 11
	Region 0: Memory at e1010000 (32-bit, non-prefetchable) [size=16K]
	Kernel driver in use: Geode LX AES
	Kernel modules: geode_rng, geode_aes

00:0d.0 Ethernet controller [0200]: Realtek Semiconductor Co., Ltd. RTL-8100/8101L/8139 PCI Fast Ethernet Adapter [10ec:8139] (rev 10)
	Subsystem: Realtek Semiconductor Co., Ltd. RTL-8100/8101L/8139 PCI Fast Ethernet Adapter [10ec:8139]
	Control: I/O+ Mem+ BusMaster+ SpecCycle- MemWINV- VGASnoop- ParErr- Stepping- SERR- FastB2B- DisINTx-
	Status: Cap+ 66MHz- UDF- FastB2B+ ParErr- DEVSEL=medium >TAbort- <TAbort- <MAbort- >SERR- <PERR+ INTx-
	Latency: 64 (8000ns min, 16000ns max)
	Interrupt: pin A routed to IRQ 10
	Region 0: I/O ports at f800 [size=256]
	Region 1: Memory at e1014000 (32-bit, non-prefetchable) [size=256]
	Capabilities: [50] Power Management version 2
		Flags: PMEClk- DSI- D1+ D2+ AuxCurrent=0mA PME(D0-,D1+,D2+,D3hot+,D3cold-)
		Status: D0 NoSoftRst- PME-Enable- DSel=0 DScale=0 PME-
	Kernel driver in use: 8139too
	Kernel modules: 8139cp, 8139too

00:0e.0 Ethernet controller [0200]: Realtek Semiconductor Co., Ltd. RTL-8100/8101L/8139 PCI Fast Ethernet Adapter [10ec:8139] (rev 10)
	Subsystem: Realtek Semiconductor Co., Ltd. RTL-8100/8101L/8139 PCI Fast Ethernet Adapter [10ec:8139]
	Control: I/O+ Mem+ BusMaster+ SpecCycle- MemWINV- VGASnoop- ParErr- Stepping- SERR- FastB2B- DisINTx-
	Status: Cap+ 66MHz- UDF- FastB2B+ ParErr- DEVSEL=medium >TAbort- <TAbort- <MAbort- >SERR- <PERR- INTx-
	Latency: 64 (8000ns min, 16000ns max)
	Interrupt: pin A routed to IRQ 5
	Region 0: I/O ports at f400 [size=256]
	Region 1: Memory at e1014100 (32-bit, non-prefetchable) [size=256]
	Capabilities: [50] Power Management version 2
		Flags: PMEClk- DSI- D1+ D2+ AuxCurrent=0mA PME(D0-,D1+,D2+,D3hot+,D3cold-)
		Status: D0 NoSoftRst- PME-Enable- DSel=0 DScale=0 PME-
	Kernel driver in use: 8139too
	Kernel modules: 8139cp, 8139too

00:0f.0 ISA bridge [0601]: Advanced Micro Devices, Inc. [AMD] CS5536 [Geode companion] ISA [1022:2090] (rev 03)
	Subsystem: Advanced Micro Devices, Inc. [AMD] CS5536 [Geode companion] ISA [1022:2090]
	Control: I/O+ Mem- BusMaster- SpecCycle+ MemWINV- VGASnoop- ParErr- Stepping- SERR- FastB2B- DisINTx-
	Status: Cap- 66MHz+ UDF- FastB2B+ ParErr- DEVSEL=medium >TAbort- <TAbort- <MAbort- >SERR- <PERR- INTx-
	Region 0: I/O ports at f000 [size=8]
	Region 1: I/O ports at ec00 [size=256]
	Region 2: I/O ports at e800 [size=64]
	Region 3: I/O ports at e400 [size=32]
	Region 4: I/O ports at e000 [size=128]
	Region 5: I/O ports at 9c40 [size=64]
	Kernel driver in use: cs5535-mfd
	Kernel modules: cs5535_mfd

00:0f.2 IDE interface [0101]: Advanced Micro Devices, Inc. [AMD] CS5536 [Geode companion] IDE [1022:209a] (rev 01) (prog-if 80 [ISA Compatibility mode-only controller, supports bus mastering])
	Subsystem: Advanced Micro Devices, Inc. [AMD] CS5536 [Geode companion] IDE [1022:209a]
	Control: I/O+ Mem- BusMaster+ SpecCycle- MemWINV- VGASnoop- ParErr- Stepping- SERR- FastB2B- DisINTx-
	Status: Cap- 66MHz+ UDF- FastB2B+ ParErr- DEVSEL=medium >TAbort- <TAbort- <MAbort- >SERR- <PERR- INTx-
	Latency: 0, Cache Line Size: 32 bytes
	Region 0: Memory at 000001f0 (32-bit, non-prefetchable) [virtual] [size=8]
	Region 1: Memory at 000003f0 (type 3, non-prefetchable) [virtual]
	Region 2: Memory at 00000170 (32-bit, non-prefetchable) [virtual] [size=8]
	Region 3: Memory at 00000370 (type 3, non-prefetchable) [virtual]
	Region 4: I/O ports at d800 [virtual] [size=16]
	Kernel driver in use: pata_amd
	Kernel modules: pata_amd, pata_cs5536, ata_generic

00:0f.3 Multimedia audio controller [0401]: Advanced Micro Devices, Inc. [AMD] CS5536 [Geode companion] Audio [1022:2093] (rev 01)
	Subsystem: Advanced Micro Devices, Inc. [AMD] CS5536 [Geode companion] Audio [1022:2093]
	Control: I/O+ Mem- BusMaster+ SpecCycle- MemWINV- VGASnoop- ParErr- Stepping- SERR- FastB2B- DisINTx-
	Status: Cap- 66MHz+ UDF- FastB2B+ ParErr- DEVSEL=medium >TAbort- <TAbort- <MAbort- >SERR- <PERR- INTx-
	Latency: 0, Cache Line Size: 32 bytes
	Interrupt: pin B routed to IRQ 10
	Region 0: I/O ports at d400 [size=128]
	Kernel driver in use: snd_cs5535audio
	Kernel modules: snd_cs5535audio

00:0f.4 USB controller [0c03]: Advanced Micro Devices, Inc. [AMD] CS5536 [Geode companion] OHC [1022:2094] (rev 02) (prog-if 10 [OHCI])
	Subsystem: Advanced Micro Devices, Inc. [AMD] CS5536 [Geode companion] OHC [1022:2094]
	Control: I/O+ Mem+ BusMaster+ SpecCycle- MemWINV- VGASnoop- ParErr- Stepping- SERR- FastB2B- DisINTx-
	Status: Cap- 66MHz+ UDF- FastB2B- ParErr- DEVSEL=medium >TAbort- <TAbort- <MAbort- >SERR- <PERR- INTx-
	Latency: 0, Cache Line Size: 32 bytes
	Interrupt: pin D routed to IRQ 11
	Region 0: Memory at e1015000 (32-bit, non-prefetchable) [size=4K]
	Kernel driver in use: ohci-pci
	Kernel modules: ohci_pci

00:0f.5 USB controller [0c03]: Advanced Micro Devices, Inc. [AMD] CS5536 [Geode companion] EHC [1022:2095] (rev 02) (prog-if 20 [EHCI])
	Subsystem: Advanced Micro Devices, Inc. [AMD] CS5536 [Geode companion] EHC [1022:2095]
	Control: I/O+ Mem+ BusMaster+ SpecCycle- MemWINV+ VGASnoop- ParErr- Stepping- SERR- FastB2B- DisINTx-
	Status: Cap- 66MHz+ UDF- FastB2B- ParErr- DEVSEL=medium >TAbort- <TAbort- <MAbort- >SERR- <PERR- INTx-
	Latency: 0, Cache Line Size: 32 bytes
	Interrupt: pin D routed to IRQ 11
	Region 0: Memory at e1016000 (32-bit, non-prefetchable) [size=4K]
	Kernel driver in use: ehci-pci
	Kernel modules: ehci_pci

