00:00.0 PCI bridge [0604]: Apple Inc. Device [106b:100c] (rev 01) (prog-if 00 [Normal decode])
	Device tree node: /sys/firmware/devicetree/base/soc/pcie@580000000/pci@0,0
	Control: I/O- Mem+ BusMaster+ SpecCycle- MemWINV- VGASnoop- ParErr- Stepping- SERR- FastB2B- DisINTx+
	Status: Cap+ 66MHz- UDF- FastB2B- ParErr- DEVSEL=fast >TAbort- <TAbort- <MAbort- >SERR- <PERR- INTx-
	Latency: 0, Cache Line Size: 32 bytes
	Interrupt: pin A routed to IRQ 112
	Bus: primary=00, secondary=01, subordinate=01, sec-latency=0
	I/O behind bridge: [disabled]
	Memory behind bridge: c0000000-c27fffff [size=40M]
	Prefetchable memory behind bridge: [disabled]
	Secondary status: 66MHz- FastB2B- ParErr- DEVSEL=fast >TAbort- <TAbort- <MAbort- <SERR- <PERR-
	BridgeCtl: Parity- SERR+ NoISA- VGA- VGA16- MAbort- >Reset- FastB2B-
		PriDiscTmr- SecDiscTmr- DiscTmrStat- DiscTmrSERREn-
	Capabilities: <access denied>
	Kernel driver in use: pcieport

00:01.0 PCI bridge [0604]: Apple Inc. Device [106b:100c] (rev 01) (prog-if 00 [Normal decode])
	Device tree node: /sys/firmware/devicetree/base/soc/pcie@580000000/pci@1,0
	Control: I/O- Mem+ BusMaster+ SpecCycle- MemWINV- VGASnoop- ParErr- Stepping- SERR- FastB2B- DisINTx+
	Status: Cap+ 66MHz- UDF- FastB2B- ParErr- DEVSEL=fast >TAbort- <TAbort- <MAbort- >SERR- <PERR- INTx-
	Latency: 0, Cache Line Size: 32 bytes
	Interrupt: pin A routed to IRQ 114
	Bus: primary=00, secondary=02, subordinate=02, sec-latency=0
	I/O behind bridge: [disabled]
	Memory behind bridge: c2800000-c28fffff [size=1M]
	Prefetchable memory behind bridge: [disabled]
	Secondary status: 66MHz- FastB2B- ParErr- DEVSEL=fast >TAbort- <TAbort- <MAbort- <SERR- <PERR-
	BridgeCtl: Parity- SERR+ NoISA- VGA- VGA16- MAbort- >Reset- FastB2B-
		PriDiscTmr- SecDiscTmr- DiscTmrStat- DiscTmrSERREn-
	Capabilities: <access denied>
	Kernel driver in use: pcieport

01:00.0 Network controller [0280]: Broadcom Inc. and subsidiaries Device [14e4:4434] (rev 04)
	Subsystem: Apple Inc. Device [106b:4388]
	Device tree node: /sys/firmware/devicetree/base/soc/pcie@580000000/pci@0,0/wifi@0,0
	Control: I/O- Mem+ BusMaster+ SpecCycle- MemWINV- VGASnoop- ParErr- Stepping- SERR- FastB2B- DisINTx+
	Status: Cap+ 66MHz- UDF- FastB2B- ParErr- DEVSEL=fast >TAbort- <TAbort- <MAbort- >SERR- <PERR- INTx-
	Latency: 0
	Interrupt: pin A routed to IRQ 124
	IOMMU group: 12
	Region 0: Memory at 5c2000000 (64-bit, non-prefetchable) [size=64K]
	Region 2: Memory at 5c0000000 (64-bit, non-prefetchable) [size=16M]
	Capabilities: <access denied>
	Kernel driver in use: brcmfmac

01:00.1 Network controller [0280]: Broadcom Inc. and subsidiaries Device [14e4:5f72] (rev 04)
	Subsystem: Apple Inc. Device [106b:4388]
	Device tree node: /sys/firmware/devicetree/base/soc/pcie@580000000/pci@0,0/network@0,1
	Control: I/O- Mem+ BusMaster+ SpecCycle- MemWINV- VGASnoop- ParErr- Stepping- SERR- FastB2B- DisINTx+
	Status: Cap+ 66MHz- UDF- FastB2B- ParErr- DEVSEL=fast >TAbort- <TAbort- <MAbort- >SERR- <PERR- INTx-
	Latency: 0
	Interrupt: pin B routed to IRQ 125
	IOMMU group: 12
	Region 0: Memory at 5c2010000 (64-bit, non-prefetchable) [size=32K]
	Region 2: Memory at 5c1000000 (64-bit, non-prefetchable) [size=16M]
	Capabilities: <access denied>
	Kernel driver in use: hci_bcm4377

02:00.0 SD Host controller [0805]: Genesys Logic, Inc Device [17a0:9755] (rev 01) (prog-if 01)
	Subsystem: Genesys Logic, Inc Device [17a0:9755]
	Device tree node: /sys/firmware/devicetree/base/soc/pcie@580000000/pci@1,0/mmc@0,0
	Control: I/O- Mem+ BusMaster+ SpecCycle- MemWINV- VGASnoop- ParErr- Stepping- SERR- FastB2B- DisINTx+
	Status: Cap+ 66MHz- UDF- FastB2B- ParErr- DEVSEL=fast >TAbort- <TAbort- <MAbort- >SERR- <PERR- INTx-
	Latency: 0
	Interrupt: pin A routed to IRQ 123
	IOMMU group: 13
	Region 0: Memory at 5c2800000 (32-bit, non-prefetchable) [size=4K]
	Capabilities: <access denied>
	Kernel driver in use: sdhci-pci

