00:00.0 Host bridge [0600]: Intel Corporation 82845 845 [Brookdale] Chipset Host Bridge [8086:1a30] (rev 04)
	Subsystem: Intel Corporation 82845 845 [Brookdale] Chipset Host Bridge [8086:1a30]
	Control: I/O- Mem+ BusMaster+ SpecCycle- MemWINV- VGASnoop- ParErr- Stepping- SERR- FastB2B- DisINTx-
	Status: Cap+ 66MHz- UDF- FastB2B+ ParErr- DEVSEL=fast >TAbort- <TAbort- <MAbort+ >SERR- <PERR- INTx-
	Latency: 0
	Region 0: Memory at d0000000 (32-bit, prefetchable) [size=128M]
	Capabilities: <access denied>
	Kernel driver in use: agpgart-intel

00:01.0 PCI bridge [0604]: Intel Corporation 82845 845 [Brookdale] Chipset AGP Bridge [8086:1a31] (rev 04) (prog-if 00 [Normal decode])
	Control: I/O+ Mem+ BusMaster+ SpecCycle- MemWINV- VGASnoop- ParErr- Stepping- SERR+ FastB2B- DisINTx-
	Status: Cap- 66MHz+ UDF- FastB2B+ ParErr- DEVSEL=fast >TAbort- <TAbort- <MAbort- >SERR- <PERR- INTx-
	Latency: 64
	Bus: primary=00, secondary=01, subordinate=01, sec-latency=32
	I/O behind bridge: 00009000-00009fff [size=4K]
	Memory behind bridge: e8000000-e9ffffff [size=32M]
	Prefetchable memory behind bridge: d8000000-e7ffffff [size=256M]
	Secondary status: 66MHz+ FastB2B+ ParErr- DEVSEL=medium >TAbort- <TAbort- <MAbort+ <SERR- <PERR-
	BridgeCtl: Parity- SERR+ NoISA+ VGA+ VGA16- MAbort- >Reset- FastB2B-
		PriDiscTmr- SecDiscTmr- DiscTmrStat- DiscTmrSERREn-
	Kernel modules: shpchp

00:1e.0 PCI bridge [0604]: Intel Corporation 82801 PCI Bridge [8086:244e] (rev 05) (prog-if 00 [Normal decode])
	Control: I/O+ Mem+ BusMaster+ SpecCycle- MemWINV- VGASnoop- ParErr- Stepping- SERR+ FastB2B- DisINTx-
	Status: Cap- 66MHz- UDF- FastB2B+ ParErr- DEVSEL=fast >TAbort- <TAbort- <MAbort- >SERR- <PERR- INTx-
	Latency: 0
	Bus: primary=00, secondary=02, subordinate=02, sec-latency=32
	I/O behind bridge: 0000a000-0000afff [size=4K]
	Memory behind bridge: ea000000-ea0fffff [size=1M]
	Prefetchable memory behind bridge: None
	Secondary status: 66MHz- FastB2B+ ParErr- DEVSEL=medium >TAbort- <TAbort- <MAbort+ <SERR- <PERR-
	BridgeCtl: Parity- SERR+ NoISA+ VGA- VGA16- MAbort- >Reset- FastB2B-
		PriDiscTmr- SecDiscTmr- DiscTmrStat- DiscTmrSERREn-
	Kernel modules: shpchp

00:1f.0 ISA bridge [0601]: Intel Corporation 82801BA ISA Bridge (LPC) [8086:2440] (rev 05)
	Control: I/O+ Mem+ BusMaster+ SpecCycle+ MemWINV- VGASnoop- ParErr- Stepping- SERR- FastB2B- DisINTx-
	Status: Cap- 66MHz- UDF- FastB2B+ ParErr- DEVSEL=medium >TAbort- <TAbort- <MAbort- >SERR- <PERR- INTx-
	Latency: 0
	Kernel driver in use: lpc_ich
	Kernel modules: intel_rng, lpc_ich

00:1f.1 IDE interface [0101]: Intel Corporation 82801BA IDE U100 Controller [8086:244b] (rev 05) (prog-if 80 [ISA Compatibility mode-only controller, supports bus mastering])
	Subsystem: Intel Corporation Device [8086:2442]
	Control: I/O+ Mem- BusMaster+ SpecCycle- MemWINV- VGASnoop- ParErr- Stepping- SERR- FastB2B- DisINTx-
	Status: Cap- 66MHz- UDF- FastB2B+ ParErr- DEVSEL=medium >TAbort- <TAbort- <MAbort- >SERR- <PERR- INTx-
	Latency: 0
	Region 0: [virtual] Memory at 000001f0 (32-bit, non-prefetchable) [size=8]
	Region 1: [virtual] Memory at 000003f0 (type 3, non-prefetchable)
	Region 2: [virtual] Memory at 00000170 (32-bit, non-prefetchable) [size=8]
	Region 3: [virtual] Memory at 00000370 (type 3, non-prefetchable)
	Region 4: I/O ports at f000 [size=16]
	Kernel driver in use: ata_piix
	Kernel modules: pata_acpi

00:1f.2 USB controller [0c03]: Intel Corporation 82801BA/BAM UHCI USB 1.1 Controller #1 [8086:2442] (rev 05) (prog-if 00 [UHCI])
	Subsystem: Intel Corporation 82801BA/BAM UHCI USB 1.1 Controller #1 [8086:2442]
	Control: I/O+ Mem- BusMaster+ SpecCycle- MemWINV- VGASnoop- ParErr- Stepping- SERR- FastB2B- DisINTx-
	Status: Cap- 66MHz- UDF- FastB2B+ ParErr- DEVSEL=medium >TAbort- <TAbort- <MAbort- >SERR- <PERR- INTx-
	Latency: 0
	Interrupt: pin D routed to IRQ 19
	Region 4: I/O ports at b000 [size=32]
	Kernel driver in use: uhci_hcd

00:1f.3 SMBus [0c05]: Intel Corporation 82801BA/BAM SMBus Controller [8086:2443] (rev 05)
	Subsystem: Intel Corporation Device [8086:2442]
	Control: I/O+ Mem- BusMaster- SpecCycle- MemWINV- VGASnoop- ParErr- Stepping- SERR- FastB2B- DisINTx-
	Status: Cap- 66MHz- UDF- FastB2B+ ParErr- DEVSEL=medium >TAbort- <TAbort- <MAbort- >SERR- <PERR- INTx-
	Interrupt: pin B routed to IRQ 5
	Region 4: I/O ports at 5000 [size=16]
	Kernel modules: i2c_i801

00:1f.4 USB controller [0c03]: Intel Corporation 82801BA/BAM UHCI USB 1.1 Controller #2 [8086:2444] (rev 05) (prog-if 00 [UHCI])
	Subsystem: Intel Corporation Device [8086:2442]
	Control: I/O+ Mem- BusMaster+ SpecCycle- MemWINV- VGASnoop- ParErr- Stepping- SERR- FastB2B- DisINTx-
	Status: Cap- 66MHz- UDF- FastB2B+ ParErr- DEVSEL=medium >TAbort- <TAbort- <MAbort- >SERR- <PERR- INTx-
	Latency: 0
	Interrupt: pin C routed to IRQ 23
	Region 4: I/O ports at b800 [size=32]
	Kernel driver in use: uhci_hcd

00:1f.5 Multimedia audio controller [0401]: Intel Corporation 82801BA/BAM AC'97 Audio Controller [8086:2445] (rev 05)
	Subsystem: Gigabyte Technology Co., Ltd Device [1458:a002]
	Control: I/O+ Mem- BusMaster+ SpecCycle- MemWINV- VGASnoop- ParErr- Stepping- SERR- FastB2B- DisINTx-
	Status: Cap- 66MHz- UDF- FastB2B+ ParErr- DEVSEL=medium >TAbort- <TAbort- <MAbort- >SERR- <PERR- INTx-
	Latency: 0
	Interrupt: pin B routed to IRQ 17
	Region 0: I/O ports at bc00 [size=256]
	Region 1: I/O ports at c000 [size=64]
	Kernel driver in use: snd_intel8x0
	Kernel modules: snd_intel8x0

01:00.0 VGA compatible controller [0300]: Advanced Micro Devices, Inc. [AMD/ATI] RV360 [Radeon 9600/X1050 Series] [1002:4152] (prog-if 00 [VGA controller])
	Subsystem: PC Partner Limited / Sapphire Technology Radeon 9600XT [174b:7c29]
	Control: I/O+ Mem+ BusMaster+ SpecCycle- MemWINV- VGASnoop- ParErr- Stepping- SERR- FastB2B- DisINTx-
	Status: Cap+ 66MHz+ UDF- FastB2B+ ParErr- DEVSEL=medium >TAbort- <TAbort- <MAbort- >SERR- <PERR- INTx-
	Latency: 32 (2000ns min), Cache Line Size: 32 bytes
	Interrupt: pin A routed to IRQ 16
	Region 0: Memory at d8000000 (32-bit, prefetchable) [size=128M]
	Region 1: I/O ports at 9000 [size=256]
	Region 2: Memory at e9000000 (32-bit, non-prefetchable) [size=64K]
	[virtual] Expansion ROM at 000c0000 [disabled] [size=128K]
	Capabilities: <access denied>
	Kernel driver in use: radeon
	Kernel modules: radeonfb, radeon

01:00.1 Display controller [0380]: Advanced Micro Devices, Inc. [AMD/ATI] RV350 [Radeon 9600/X1050 Series] (Secondary) [1002:4172]
	Subsystem: PC Partner Limited / Sapphire Technology Radeon 9600XT (Secondary) [174b:7c28]
	Control: I/O+ Mem+ BusMaster+ SpecCycle- MemWINV- VGASnoop- ParErr- Stepping- SERR- FastB2B- DisINTx-
	Status: Cap+ 66MHz+ UDF- FastB2B+ ParErr- DEVSEL=medium >TAbort- <TAbort- <MAbort- >SERR- <PERR- INTx-
	Latency: 32 (2000ns min), Cache Line Size: 32 bytes
	Region 0: Memory at e0000000 (32-bit, prefetchable) [size=128M]
	Region 1: Memory at e9010000 (32-bit, non-prefetchable) [size=64K]
	Capabilities: <access denied>

02:01.0 USB controller [0c03]: VIA Technologies, Inc. VT82xx/62xx/VX700/8x0/900 UHCI USB 1.1 Controller [1106:3038] (rev 62) (prog-if 00 [UHCI])
	Subsystem: VIA Technologies, Inc. VT82xx/62xx/VX700/8x0/900 UHCI USB 1.1 Controller [1106:3038]
	Control: I/O+ Mem+ BusMaster+ SpecCycle- MemWINV- VGASnoop- ParErr- Stepping- SERR- FastB2B- DisINTx-
	Status: Cap+ 66MHz- UDF- FastB2B- ParErr- DEVSEL=medium >TAbort- <TAbort- <MAbort- >SERR- <PERR- INTx-
	Latency: 32, Cache Line Size: 32 bytes
	Interrupt: pin A routed to IRQ 21
	Region 4: I/O ports at a000 [size=32]
	Capabilities: <access denied>
	Kernel driver in use: uhci_hcd

02:01.1 USB controller [0c03]: VIA Technologies, Inc. VT82xx/62xx/VX700/8x0/900 UHCI USB 1.1 Controller [1106:3038] (rev 62) (prog-if 00 [UHCI])
	Subsystem: VIA Technologies, Inc. VT82xx/62xx/VX700/8x0/900 UHCI USB 1.1 Controller [1106:3038]
	Control: I/O+ Mem+ BusMaster+ SpecCycle- MemWINV- VGASnoop- ParErr- Stepping- SERR- FastB2B- DisINTx-
	Status: Cap+ 66MHz- UDF- FastB2B- ParErr- DEVSEL=medium >TAbort- <TAbort- <MAbort- >SERR- <PERR- INTx-
	Latency: 32, Cache Line Size: 32 bytes
	Interrupt: pin B routed to IRQ 22
	Region 4: I/O ports at a400 [size=32]
	Capabilities: <access denied>
	Kernel driver in use: uhci_hcd

02:01.2 USB controller [0c03]: VIA Technologies, Inc. USB 2.0 EHCI-Compliant Host-Controller [1106:3104] (rev 65) (prog-if 20 [EHCI])
	Subsystem: VIA Technologies, Inc. USB 2.0 Controller [1106:3104]
	Control: I/O+ Mem+ BusMaster+ SpecCycle- MemWINV+ VGASnoop- ParErr- Stepping- SERR- FastB2B- DisINTx-
	Status: Cap+ 66MHz- UDF- FastB2B- ParErr- DEVSEL=medium >TAbort- <TAbort- <MAbort- >SERR- <PERR- INTx-
	Latency: 32, Cache Line Size: 32 bytes
	Interrupt: pin C routed to IRQ 16
	Region 0: Memory at ea000000 (32-bit, non-prefetchable) [size=256]
	Capabilities: <access denied>
	Kernel driver in use: ehci-pci

02:03.0 Ethernet controller [0200]: VIA Technologies, Inc. VT6105/VT6106S [Rhine-III] [1106:3106] (rev 8b)
	Subsystem: D-Link System Inc DFE-520TX Fast Ethernet PCI Adapter [1186:1405]
	Control: I/O+ Mem+ BusMaster+ SpecCycle- MemWINV- VGASnoop- ParErr- Stepping- SERR- FastB2B- DisINTx-
	Status: Cap+ 66MHz- UDF- FastB2B- ParErr- DEVSEL=medium >TAbort- <TAbort- <MAbort- >SERR- <PERR- INTx-
	Latency: 32 (750ns min, 2000ns max), Cache Line Size: 32 bytes
	Interrupt: pin A routed to IRQ 16
	Region 0: I/O ports at a800 [size=256]
	Region 1: Memory at ea001000 (32-bit, non-prefetchable) [size=256]
	Capabilities: <access denied>
	Kernel driver in use: via-rhine
	Kernel modules: via_rhine

