00:00.0 Host bridge [0600]: Intel Corporation 4 Series Chipset DRAM Controller [8086:2e20] (rev 03)
	Subsystem: Acer Incorporated [ALI] 4 Series Chipset DRAM Controller [1025:0250]
	Control: I/O- Mem+ BusMaster+ SpecCycle- MemWINV- VGASnoop- ParErr- Stepping- SERR- FastB2B- DisINTx-
	Status: Cap+ 66MHz- UDF- FastB2B+ ParErr- DEVSEL=fast >TAbort- <TAbort- <MAbort+ >SERR- <PERR- INTx-
	Latency: 0
	Capabilities: [e0] Vendor Specific Information: Len=0c <?>

00:02.0 VGA compatible controller [0300]: Intel Corporation 4 Series Chipset Integrated Graphics Controller [8086:2e22] (rev 03) (prog-if 00 [VGA controller])
	Subsystem: Acer Incorporated [ALI] 4 Series Chipset Integrated Graphics Controller [1025:0250]
	Control: I/O+ Mem+ BusMaster+ SpecCycle- MemWINV- VGASnoop- ParErr- Stepping- SERR- FastB2B- DisINTx-
	Status: Cap+ 66MHz- UDF- FastB2B+ ParErr- DEVSEL=fast >TAbort- <TAbort- <MAbort- >SERR- <PERR- INTx-
	Latency: 0
	Interrupt: pin A routed to IRQ 10
	Region 0: Memory at fe400000 (64-bit, non-prefetchable) [size=4M]
	Region 2: Memory at d0000000 (64-bit, prefetchable) [size=256M]
	Region 4: I/O ports at dc00 [size=8]
	Expansion ROM at 000c0000 [virtual] [disabled] [size=128K]
	Capabilities: [90] MSI: Enable- Count=1/1 Maskable- 64bit-
		Address: 00000000  Data: 0000
	Capabilities: [d0] Power Management version 2
		Flags: PMEClk- DSI+ D1- D2- AuxCurrent=0mA PME(D0-,D1-,D2-,D3hot-,D3cold-)
		Status: D0 NoSoftRst- PME-Enable- DSel=0 DScale=0 PME-
	Capabilities: [a4] PCI Advanced Features
		AFCap: TP+ FLR+
		AFCtrl: FLR-
		AFStatus: TP-
	Kernel driver in use: i915
	Kernel modules: i915

00:02.1 Display controller [0380]: Intel Corporation 4 Series Chipset Integrated Graphics Controller [8086:2e23] (rev 03)
	Subsystem: Acer Incorporated [ALI] 4 Series Chipset Integrated Graphics Controller [1025:0250]
	Control: I/O+ Mem+ BusMaster+ SpecCycle- MemWINV- VGASnoop- ParErr- Stepping- SERR- FastB2B- DisINTx-
	Status: Cap+ 66MHz- UDF- FastB2B+ ParErr- DEVSEL=fast >TAbort- <TAbort- <MAbort- >SERR- <PERR- INTx-
	Latency: 0
	Region 0: Memory at fe800000 (64-bit, non-prefetchable) [size=1M]
	Capabilities: [d0] Power Management version 2
		Flags: PMEClk- DSI+ D1- D2- AuxCurrent=0mA PME(D0-,D1-,D2-,D3hot-,D3cold-)
		Status: D0 NoSoftRst- PME-Enable- DSel=0 DScale=0 PME-

00:19.0 Ethernet controller [0200]: Intel Corporation 82567V-2 Gigabit Network Connection [8086:10ce]
	Subsystem: Acer Incorporated [ALI] 82567V-2 Gigabit Network Connection [1025:0250]
	Control: I/O+ Mem+ BusMaster+ SpecCycle- MemWINV- VGASnoop- ParErr- Stepping- SERR- FastB2B- DisINTx+
	Status: Cap+ 66MHz- UDF- FastB2B- ParErr- DEVSEL=fast >TAbort- <TAbort- <MAbort- >SERR- <PERR- INTx-
	Latency: 0
	Interrupt: pin A routed to IRQ 16
	Region 0: Memory at fe9c0000 (32-bit, non-prefetchable) [size=128K]
	Region 1: Memory at fe9fa000 (32-bit, non-prefetchable) [size=4K]
	Region 2: I/O ports at d880 [size=32]
	Capabilities: [c8] Power Management version 2
		Flags: PMEClk- DSI+ D1- D2- AuxCurrent=0mA PME(D0+,D1-,D2-,D3hot+,D3cold+)
		Status: D0 NoSoftRst- PME-Enable- DSel=0 DScale=1 PME-
	Capabilities: [d0] MSI: Enable+ Count=1/1 Maskable- 64bit+
		Address: 00000000fee01004  Data: 4021
	Capabilities: [e0] PCI Advanced Features
		AFCap: TP+ FLR+
		AFCtrl: FLR-
		AFStatus: TP-
	Kernel driver in use: e1000e
	Kernel modules: e1000e

00:1a.0 USB controller [0c03]: Intel Corporation 82801JI (ICH10 Family) USB UHCI Controller #4 [8086:3a37] (prog-if 00 [UHCI])
	Subsystem: Acer Incorporated [ALI] 82801JI (ICH10 Family) USB UHCI Controller [1025:0250]
	Control: I/O+ Mem- BusMaster+ SpecCycle- MemWINV- VGASnoop- ParErr- Stepping- SERR- FastB2B- DisINTx-
	Status: Cap+ 66MHz- UDF- FastB2B+ ParErr- DEVSEL=medium >TAbort- <TAbort- <MAbort- >SERR- <PERR- INTx-
	Latency: 0
	Interrupt: pin A routed to IRQ 10
	Region 4: I/O ports at d800 [size=32]
	Capabilities: [50] PCI Advanced Features
		AFCap: TP+ FLR+
		AFCtrl: FLR-
		AFStatus: TP-
	Kernel driver in use: uhci_hcd

00:1a.1 USB controller [0c03]: Intel Corporation 82801JI (ICH10 Family) USB UHCI Controller #5 [8086:3a38] (prog-if 00 [UHCI])
	Subsystem: Acer Incorporated [ALI] 82801JI (ICH10 Family) USB UHCI Controller [1025:0250]
	Control: I/O+ Mem- BusMaster+ SpecCycle- MemWINV- VGASnoop- ParErr- Stepping- SERR- FastB2B- DisINTx-
	Status: Cap+ 66MHz- UDF- FastB2B+ ParErr- DEVSEL=medium >TAbort- <TAbort- <MAbort- >SERR- <PERR- INTx-
	Latency: 0
	Interrupt: pin B routed to IRQ 15
	Region 4: I/O ports at d480 [size=32]
	Capabilities: [50] PCI Advanced Features
		AFCap: TP+ FLR+
		AFCtrl: FLR-
		AFStatus: TP-
	Kernel driver in use: uhci_hcd

00:1a.2 USB controller [0c03]: Intel Corporation 82801JI (ICH10 Family) USB UHCI Controller #6 [8086:3a39] (prog-if 00 [UHCI])
	Subsystem: Acer Incorporated [ALI] 82801JI (ICH10 Family) USB UHCI Controller [1025:0250]
	Control: I/O+ Mem- BusMaster+ SpecCycle- MemWINV- VGASnoop- ParErr- Stepping- SERR- FastB2B- DisINTx-
	Status: Cap+ 66MHz- UDF- FastB2B+ ParErr- DEVSEL=medium >TAbort- <TAbort- <MAbort- >SERR- <PERR- INTx-
	Latency: 0
	Interrupt: pin D routed to IRQ 14
	Region 4: I/O ports at d400 [size=32]
	Capabilities: [50] PCI Advanced Features
		AFCap: TP+ FLR+
		AFCtrl: FLR-
		AFStatus: TP-
	Kernel driver in use: uhci_hcd

00:1a.7 USB controller [0c03]: Intel Corporation 82801JI (ICH10 Family) USB2 EHCI Controller #2 [8086:3a3c] (prog-if 20 [EHCI])
	Subsystem: Acer Incorporated [ALI] 82801JI (ICH10 Family) USB2 EHCI Controller [1025:0250]
	Control: I/O- Mem+ BusMaster+ SpecCycle- MemWINV- VGASnoop- ParErr- Stepping- SERR- FastB2B- DisINTx-
	Status: Cap+ 66MHz- UDF- FastB2B+ ParErr- DEVSEL=medium >TAbort- <TAbort- <MAbort- >SERR- <PERR- INTx-
	Latency: 0
	Interrupt: pin C routed to IRQ 3
	Region 0: Memory at fe9f8000 (32-bit, non-prefetchable) [size=1K]
	Capabilities: [50] Power Management version 2
		Flags: PMEClk- DSI- D1- D2- AuxCurrent=375mA PME(D0+,D1-,D2-,D3hot+,D3cold+)
		Status: D0 NoSoftRst- PME-Enable- DSel=0 DScale=0 PME-
	Capabilities: [58] Debug port: BAR=1 offset=00a0
	Capabilities: [98] PCI Advanced Features
		AFCap: TP+ FLR+
		AFCtrl: FLR-
		AFStatus: TP-
	Kernel driver in use: ehci-pci

00:1b.0 Audio device [0403]: Intel Corporation 82801JI (ICH10 Family) HD Audio Controller [8086:3a3e]
	Subsystem: Acer Incorporated [ALI] 82801JI (ICH10 Family) HD Audio Controller [1025:0250]
	Control: I/O- Mem+ BusMaster+ SpecCycle- MemWINV- VGASnoop- ParErr- Stepping- SERR- FastB2B- DisINTx+
	Status: Cap+ 66MHz- UDF- FastB2B- ParErr- DEVSEL=fast >TAbort- <TAbort- <MAbort- >SERR- <PERR- INTx-
	Latency: 0, Cache Line Size: 32 bytes
	Interrupt: pin A routed to IRQ 18
	Region 0: Memory at fe9f4000 (64-bit, non-prefetchable) [size=16K]
	Capabilities: [50] Power Management version 2
		Flags: PMEClk- DSI- D1- D2- AuxCurrent=55mA PME(D0+,D1-,D2-,D3hot+,D3cold+)
		Status: D0 NoSoftRst- PME-Enable- DSel=0 DScale=0 PME-
	Capabilities: [60] MSI: Enable+ Count=1/1 Maskable- 64bit+
		Address: 00000000fee01004  Data: 4023
	Capabilities: [70] Express (v1) Root Complex Integrated Endpoint, MSI 00
		DevCap:	MaxPayload 128 bytes, PhantFunc 0
			ExtTag- RBE- FLReset+
		DevCtl:	CorrErr- NonFatalErr- FatalErr- UnsupReq-
			RlxdOrd- ExtTag- PhantFunc- AuxPwr- NoSnoop+ FLReset-
			MaxPayload 128 bytes, MaxReadReq 128 bytes
		DevSta:	CorrErr- NonFatalErr- FatalErr- UnsupReq- AuxPwr+ TransPend-
	Capabilities: [100 v1] Virtual Channel
		Caps:	LPEVC=0 RefClk=100ns PATEntryBits=1
		Arb:	Fixed- WRR32- WRR64- WRR128-
		Ctrl:	ArbSelect=Fixed
		Status:	InProgress-
		VC0:	Caps:	PATOffset=00 MaxTimeSlots=1 RejSnoopTrans-
			Arb:	Fixed- WRR32- WRR64- WRR128- TWRR128- WRR256-
			Ctrl:	Enable+ ID=0 ArbSelect=Fixed TC/VC=01
			Status:	NegoPending- InProgress-
		VC1:	Caps:	PATOffset=00 MaxTimeSlots=1 RejSnoopTrans-
			Arb:	Fixed- WRR32- WRR64- WRR128- TWRR128- WRR256-
			Ctrl:	Enable+ ID=1 ArbSelect=Fixed TC/VC=80
			Status:	NegoPending- InProgress-
	Capabilities: [130 v1] Root Complex Link
		Desc:	PortNumber=0f ComponentID=00 EltType=Config
		Link0:	Desc:	TargetPort=00 TargetComponent=00 AssocRCRB- LinkType=MemMapped LinkValid+
			Addr:	00000000fed1c000
	Kernel driver in use: snd_hda_intel
	Kernel modules: snd_hda_intel

00:1c.0 PCI bridge [0604]: Intel Corporation 82801JI (ICH10 Family) PCI Express Root Port 1 [8086:3a40] (prog-if 00 [Normal decode])
	Control: I/O+ Mem+ BusMaster+ SpecCycle- MemWINV- VGASnoop- ParErr- Stepping- SERR+ FastB2B- DisINTx-
	Status: Cap+ 66MHz- UDF- FastB2B- ParErr- DEVSEL=fast >TAbort- <TAbort- <MAbort- >SERR- <PERR- INTx-
	Latency: 0, Cache Line Size: 32 bytes
	Interrupt: pin A routed to IRQ 5
	Bus: primary=00, secondary=01, subordinate=01, sec-latency=0
	I/O behind bridge: 0000e000-0000efff [size=4K]
	Memory behind bridge: fea00000-feafffff [size=1M]
	Prefetchable memory behind bridge: 00000000c0000000-00000000c01fffff [size=2M]
	Secondary status: 66MHz- FastB2B- ParErr- DEVSEL=fast >TAbort- <TAbort- <MAbort+ <SERR- <PERR-
	BridgeCtl: Parity- SERR+ NoISA+ VGA- VGA16- MAbort- >Reset- FastB2B-
		PriDiscTmr- SecDiscTmr- DiscTmrStat- DiscTmrSERREn-
	Capabilities: [40] Express (v1) Root Port (Slot+), MSI 00
		DevCap:	MaxPayload 128 bytes, PhantFunc 0
			ExtTag- RBE+
		DevCtl:	CorrErr- NonFatalErr- FatalErr- UnsupReq-
			RlxdOrd- ExtTag- PhantFunc- AuxPwr- NoSnoop-
			MaxPayload 128 bytes, MaxReadReq 128 bytes
		DevSta:	CorrErr- NonFatalErr- FatalErr- UnsupReq- AuxPwr+ TransPend-
		LnkCap:	Port #1, Speed 2.5GT/s, Width x1, ASPM L0s L1, Exit Latency L0s <1us, L1 <4us
			ClockPM- Surprise- LLActRep+ BwNot- ASPMOptComp-
		LnkCtl:	ASPM Disabled; RCB 64 bytes Disabled- CommClk-
			ExtSynch- ClockPM- AutWidDis- BWInt- AutBWInt-
		LnkSta:	Speed 2.5GT/s (ok), Width x1 (ok)
			TrErr- Train- SlotClk+ DLActive+ BWMgmt- ABWMgmt-
		SltCap:	AttnBtn- PwrCtrl- MRL- AttnInd- PwrInd- HotPlug+ Surprise+
			Slot #0, PowerLimit 10.000W; Interlock- NoCompl-
		SltCtl:	Enable: AttnBtn- PwrFlt- MRL- PresDet- CmdCplt- HPIrq- LinkChg-
			Control: AttnInd Unknown, PwrInd Unknown, Power- Interlock-
		SltSta:	Status: AttnBtn- PowerFlt- MRL- CmdCplt- PresDet+ Interlock-
			Changed: MRL- PresDet+ LinkState+
		RootCap: CRSVisible-
		RootCtl: ErrCorrectable- ErrNon-Fatal- ErrFatal- PMEIntEna- CRSVisible-
		RootSta: PME ReqID 0000, PMEStatus- PMEPending-
	Capabilities: [80] MSI: Enable- Count=1/1 Maskable- 64bit-
		Address: 00000000  Data: 0000
	Capabilities: [90] Subsystem: Acer Incorporated [ALI] 82801JI (ICH10 Family) PCI Express Root Port 1 [1025:0250]
	Capabilities: [a0] Power Management version 2
		Flags: PMEClk- DSI- D1- D2- AuxCurrent=0mA PME(D0+,D1-,D2-,D3hot+,D3cold+)
		Status: D0 NoSoftRst- PME-Enable- DSel=0 DScale=0 PME-
	Capabilities: [100 v1] Virtual Channel
		Caps:	LPEVC=0 RefClk=100ns PATEntryBits=1
		Arb:	Fixed+ WRR32- WRR64- WRR128-
		Ctrl:	ArbSelect=Fixed
		Status:	InProgress-
		VC0:	Caps:	PATOffset=00 MaxTimeSlots=1 RejSnoopTrans-
			Arb:	Fixed+ WRR32- WRR64- WRR128- TWRR128- WRR256-
			Ctrl:	Enable+ ID=0 ArbSelect=Fixed TC/VC=01
			Status:	NegoPending- InProgress-
	Capabilities: [180 v1] Root Complex Link
		Desc:	PortNumber=01 ComponentID=00 EltType=Config
		Link0:	Desc:	TargetPort=00 TargetComponent=00 AssocRCRB- LinkType=MemMapped LinkValid+
			Addr:	00000000fed1c000
	Kernel driver in use: pcieport

00:1c.1 PCI bridge [0604]: Intel Corporation 82801JI (ICH10 Family) PCI Express Port 2 [8086:3a42] (prog-if 00 [Normal decode])
	Control: I/O+ Mem+ BusMaster+ SpecCycle- MemWINV- VGASnoop- ParErr- Stepping- SERR+ FastB2B- DisINTx-
	Status: Cap+ 66MHz- UDF- FastB2B- ParErr- DEVSEL=fast >TAbort- <TAbort- <MAbort- >SERR- <PERR- INTx-
	Latency: 0, Cache Line Size: 32 bytes
	Interrupt: pin B routed to IRQ 10
	Bus: primary=00, secondary=02, subordinate=02, sec-latency=0
	I/O behind bridge: 00001000-00001fff [size=4K]
	Memory behind bridge: feb00000-febfffff [size=1M]
	Prefetchable memory behind bridge: 00000000c0200000-00000000c03fffff [size=2M]
	Secondary status: 66MHz- FastB2B- ParErr- DEVSEL=fast >TAbort- <TAbort- <MAbort+ <SERR- <PERR-
	BridgeCtl: Parity- SERR+ NoISA+ VGA- VGA16- MAbort- >Reset- FastB2B-
		PriDiscTmr- SecDiscTmr- DiscTmrStat- DiscTmrSERREn-
	Capabilities: [40] Express (v1) Root Port (Slot+), MSI 00
		DevCap:	MaxPayload 128 bytes, PhantFunc 0
			ExtTag- RBE+
		DevCtl:	CorrErr- NonFatalErr- FatalErr- UnsupReq-
			RlxdOrd- ExtTag- PhantFunc- AuxPwr- NoSnoop-
			MaxPayload 128 bytes, MaxReadReq 128 bytes
		DevSta:	CorrErr- NonFatalErr- FatalErr- UnsupReq- AuxPwr+ TransPend-
		LnkCap:	Port #2, Speed 2.5GT/s, Width x1, ASPM L0s L1, Exit Latency L0s <256ns, L1 <4us
			ClockPM- Surprise- LLActRep+ BwNot- ASPMOptComp-
		LnkCtl:	ASPM Disabled; RCB 64 bytes Disabled- CommClk+
			ExtSynch- ClockPM- AutWidDis- BWInt- AutBWInt-
		LnkSta:	Speed 2.5GT/s (ok), Width x1 (ok)
			TrErr- Train- SlotClk+ DLActive+ BWMgmt- ABWMgmt-
		SltCap:	AttnBtn- PwrCtrl- MRL- AttnInd- PwrInd- HotPlug+ Surprise+
			Slot #0, PowerLimit 10.000W; Interlock- NoCompl-
		SltCtl:	Enable: AttnBtn- PwrFlt- MRL- PresDet- CmdCplt- HPIrq- LinkChg-
			Control: AttnInd Unknown, PwrInd Unknown, Power- Interlock-
		SltSta:	Status: AttnBtn- PowerFlt- MRL- CmdCplt- PresDet+ Interlock-
			Changed: MRL- PresDet+ LinkState+
		RootCap: CRSVisible-
		RootCtl: ErrCorrectable- ErrNon-Fatal- ErrFatal- PMEIntEna- CRSVisible-
		RootSta: PME ReqID 0000, PMEStatus- PMEPending-
	Capabilities: [80] MSI: Enable- Count=1/1 Maskable- 64bit-
		Address: 00000000  Data: 0000
	Capabilities: [90] Subsystem: Acer Incorporated [ALI] 82801JI (ICH10 Family) PCI Express Port 2 [1025:0250]
	Capabilities: [a0] Power Management version 2
		Flags: PMEClk- DSI- D1- D2- AuxCurrent=0mA PME(D0+,D1-,D2-,D3hot+,D3cold+)
		Status: D0 NoSoftRst- PME-Enable- DSel=0 DScale=0 PME-
	Capabilities: [100 v1] Virtual Channel
		Caps:	LPEVC=0 RefClk=100ns PATEntryBits=1
		Arb:	Fixed+ WRR32- WRR64- WRR128-
		Ctrl:	ArbSelect=Fixed
		Status:	InProgress-
		VC0:	Caps:	PATOffset=00 MaxTimeSlots=1 RejSnoopTrans-
			Arb:	Fixed+ WRR32- WRR64- WRR128- TWRR128- WRR256-
			Ctrl:	Enable+ ID=0 ArbSelect=Fixed TC/VC=01
			Status:	NegoPending- InProgress-
	Capabilities: [180 v1] Root Complex Link
		Desc:	PortNumber=02 ComponentID=00 EltType=Config
		Link0:	Desc:	TargetPort=00 TargetComponent=00 AssocRCRB- LinkType=MemMapped LinkValid+
			Addr:	00000000fed1c000
	Kernel driver in use: pcieport

00:1d.0 USB controller [0c03]: Intel Corporation 82801JI (ICH10 Family) USB UHCI Controller #1 [8086:3a34] (prog-if 00 [UHCI])
	Subsystem: Acer Incorporated [ALI] 82801JI (ICH10 Family) USB UHCI Controller [1025:0250]
	Control: I/O+ Mem- BusMaster+ SpecCycle- MemWINV- VGASnoop- ParErr- Stepping- SERR- FastB2B- DisINTx-
	Status: Cap+ 66MHz- UDF- FastB2B+ ParErr- DEVSEL=medium >TAbort- <TAbort- <MAbort- >SERR- <PERR- INTx-
	Latency: 0
	Interrupt: pin A routed to IRQ 4
	Region 4: I/O ports at d080 [size=32]
	Capabilities: [50] PCI Advanced Features
		AFCap: TP+ FLR+
		AFCtrl: FLR-
		AFStatus: TP-
	Kernel driver in use: uhci_hcd

00:1d.1 USB controller [0c03]: Intel Corporation 82801JI (ICH10 Family) USB UHCI Controller #2 [8086:3a35] (prog-if 00 [UHCI])
	Subsystem: Acer Incorporated [ALI] 82801JI (ICH10 Family) USB UHCI Controller [1025:0250]
	Control: I/O+ Mem- BusMaster+ SpecCycle- MemWINV- VGASnoop- ParErr- Stepping- SERR- FastB2B- DisINTx-
	Status: Cap+ 66MHz- UDF- FastB2B+ ParErr- DEVSEL=medium >TAbort- <TAbort- <MAbort- >SERR- <PERR- INTx-
	Latency: 0
	Interrupt: pin B routed to IRQ 14
	Region 4: I/O ports at d000 [size=32]
	Capabilities: [50] PCI Advanced Features
		AFCap: TP+ FLR+
		AFCtrl: FLR-
		AFStatus: TP-
	Kernel driver in use: uhci_hcd

00:1d.2 USB controller [0c03]: Intel Corporation 82801JI (ICH10 Family) USB UHCI Controller #3 [8086:3a36] (prog-if 00 [UHCI])
	Subsystem: Acer Incorporated [ALI] 82801JI (ICH10 Family) USB UHCI Controller [1025:0250]
	Control: I/O+ Mem- BusMaster+ SpecCycle- MemWINV- VGASnoop- ParErr- Stepping- SERR- FastB2B- DisINTx-
	Status: Cap+ 66MHz- UDF- FastB2B+ ParErr- DEVSEL=medium >TAbort- <TAbort- <MAbort- >SERR- <PERR- INTx-
	Latency: 0
	Interrupt: pin C routed to IRQ 3
	Region 4: I/O ports at cc00 [size=32]
	Capabilities: [50] PCI Advanced Features
		AFCap: TP+ FLR+
		AFCtrl: FLR-
		AFStatus: TP-
	Kernel driver in use: uhci_hcd

00:1d.7 USB controller [0c03]: Intel Corporation 82801JI (ICH10 Family) USB2 EHCI Controller #1 [8086:3a3a] (prog-if 20 [EHCI])
	Subsystem: Acer Incorporated [ALI] 82801JI (ICH10 Family) USB2 EHCI Controller [1025:0250]
	Control: I/O- Mem+ BusMaster+ SpecCycle- MemWINV- VGASnoop- ParErr- Stepping- SERR- FastB2B- DisINTx-
	Status: Cap+ 66MHz- UDF- FastB2B+ ParErr- DEVSEL=medium >TAbort- <TAbort- <MAbort- >SERR- <PERR- INTx-
	Latency: 0
	Interrupt: pin A routed to IRQ 4
	Region 0: Memory at fe9f2000 (32-bit, non-prefetchable) [size=1K]
	Capabilities: [50] Power Management version 2
		Flags: PMEClk- DSI- D1- D2- AuxCurrent=375mA PME(D0+,D1-,D2-,D3hot+,D3cold+)
		Status: D0 NoSoftRst- PME-Enable- DSel=0 DScale=0 PME-
	Capabilities: [58] Debug port: BAR=1 offset=00a0
	Capabilities: [98] PCI Advanced Features
		AFCap: TP+ FLR+
		AFCtrl: FLR-
		AFStatus: TP-
	Kernel driver in use: ehci-pci

00:1e.0 PCI bridge [0604]: Intel Corporation 82801 PCI Bridge [8086:244e] (rev 90) (prog-if 01 [Subtractive decode])
	Control: I/O- Mem- BusMaster+ SpecCycle- MemWINV- VGASnoop- ParErr- Stepping- SERR+ FastB2B- DisINTx-
	Status: Cap+ 66MHz- UDF- FastB2B- ParErr- DEVSEL=fast >TAbort- <TAbort- <MAbort- >SERR- <PERR- INTx-
	Latency: 0
	Bus: primary=00, secondary=03, subordinate=03, sec-latency=32
	I/O behind bridge: [disabled]
	Memory behind bridge: [disabled]
	Prefetchable memory behind bridge: [disabled]
	Secondary status: 66MHz- FastB2B+ ParErr- DEVSEL=medium >TAbort- <TAbort- <MAbort+ <SERR- <PERR-
	BridgeCtl: Parity- SERR+ NoISA+ VGA- VGA16- MAbort- >Reset- FastB2B-
		PriDiscTmr- SecDiscTmr- DiscTmrStat- DiscTmrSERREn-
	Capabilities: [50] Subsystem: Acer Incorporated [ALI] 82801 PCI Bridge [1025:0250]

00:1f.0 ISA bridge [0601]: Intel Corporation 82801JIB (ICH10) LPC Interface Controller [8086:3a18]
	Subsystem: Acer Incorporated [ALI] 82801JIB (ICH10) LPC Interface Controller [1025:0250]
	Control: I/O+ Mem+ BusMaster+ SpecCycle- MemWINV- VGASnoop- ParErr- Stepping- SERR- FastB2B- DisINTx-
	Status: Cap+ 66MHz- UDF- FastB2B- ParErr- DEVSEL=medium >TAbort- <TAbort- <MAbort- >SERR- <PERR- INTx-
	Latency: 0
	Capabilities: [e0] Vendor Specific Information: Len=0c <?>
	Kernel driver in use: lpc_ich
	Kernel modules: lpc_ich

00:1f.2 SATA controller [0106]: Intel Corporation 82801JI (ICH10 Family) SATA AHCI Controller [8086:3a22] (prog-if 01 [AHCI 1.0])
	Subsystem: Acer Incorporated [ALI] 82801JI (ICH10 Family) SATA AHCI Controller [1025:0250]
	Control: I/O+ Mem+ BusMaster+ SpecCycle- MemWINV- VGASnoop- ParErr- Stepping- SERR- FastB2B- DisINTx+
	Status: Cap+ 66MHz+ UDF- FastB2B+ ParErr- DEVSEL=medium >TAbort- <TAbort- <MAbort- >SERR- <PERR- INTx-
	Latency: 0
	Interrupt: pin B routed to IRQ 17
	Region 0: I/O ports at c880 [size=8]
	Region 1: I/O ports at c800 [size=4]
	Region 2: I/O ports at c480 [size=8]
	Region 3: I/O ports at c400 [size=4]
	Region 4: I/O ports at c080 [size=32]
	Region 5: Memory at fe9f0000 (32-bit, non-prefetchable) [size=2K]
	Capabilities: [80] MSI: Enable+ Count=1/16 Maskable- 64bit-
		Address: fee01004  Data: 4022
	Capabilities: [70] Power Management version 3
		Flags: PMEClk- DSI- D1- D2- AuxCurrent=0mA PME(D0-,D1-,D2-,D3hot+,D3cold-)
		Status: D0 NoSoftRst+ PME-Enable- DSel=0 DScale=0 PME-
	Capabilities: [a8] SATA HBA v1.0 BAR4 Offset=00000004
	Capabilities: [b0] PCI Advanced Features
		AFCap: TP+ FLR+
		AFCtrl: FLR-
		AFStatus: TP-
	Kernel driver in use: ahci
	Kernel modules: ahci

00:1f.3 SMBus [0c05]: Intel Corporation 82801JI (ICH10 Family) SMBus Controller [8086:3a30]
	Subsystem: Acer Incorporated [ALI] 82801JI (ICH10 Family) SMBus Controller [1025:0250]
	Control: I/O+ Mem+ BusMaster- SpecCycle- MemWINV- VGASnoop- ParErr- Stepping- SERR- FastB2B- DisINTx-
	Status: Cap- 66MHz- UDF- FastB2B+ ParErr- DEVSEL=medium >TAbort- <TAbort- <MAbort- >SERR- <PERR- INTx-
	Interrupt: pin C routed to IRQ 3
	Region 0: Memory at fe9efc00 (64-bit, non-prefetchable) [size=256]
	Region 4: I/O ports at 0400 [size=32]
	Kernel driver in use: i801_smbus
	Kernel modules: i2c_i801

01:00.0 FireWire (IEEE 1394) [0c00]: VIA Technologies, Inc. VT6315 Series Firewire Controller [1106:3403] (prog-if 10 [OHCI])
	Subsystem: Acer Incorporated [ALI] VT6315 Series Firewire Controller [1025:0250]
	Control: I/O+ Mem+ BusMaster+ SpecCycle- MemWINV- VGASnoop- ParErr- Stepping- SERR- FastB2B- DisINTx-
	Status: Cap+ 66MHz- UDF- FastB2B- ParErr- DEVSEL=fast >TAbort- <TAbort- <MAbort- >SERR- <PERR- INTx-
	Latency: 0, Cache Line Size: 32 bytes
	Interrupt: pin A routed to IRQ 10
	Region 0: Memory at feaff800 (64-bit, non-prefetchable) [size=2K]
	Region 2: I/O ports at e800 [size=256]
	Capabilities: [50] Power Management version 3
		Flags: PMEClk- DSI- D1- D2+ AuxCurrent=0mA PME(D0-,D1-,D2+,D3hot+,D3cold+)
		Status: D0 NoSoftRst- PME-Enable- DSel=0 DScale=0 PME-
	Capabilities: [80] MSI: Enable- Count=1/1 Maskable+ 64bit+
		Address: 0000000000000000  Data: 0000
		Masking: 00000000  Pending: 00000000
	Capabilities: [98] Express (v1) Endpoint, MSI 00
		DevCap:	MaxPayload 128 bytes, PhantFunc 0, Latency L0s <64ns, L1 <1us
			ExtTag- AttnBtn- AttnInd- PwrInd- RBE+ FLReset- SlotPowerLimit 10.000W
		DevCtl:	CorrErr- NonFatalErr- FatalErr- UnsupReq-
			RlxdOrd- ExtTag- PhantFunc- AuxPwr- NoSnoop-
			MaxPayload 128 bytes, MaxReadReq 512 bytes
		DevSta:	CorrErr+ NonFatalErr- FatalErr- UnsupReq+ AuxPwr+ TransPend-
		LnkCap:	Port #0, Speed 2.5GT/s, Width x1, ASPM L0s L1, Exit Latency L0s <1us, L1 <64us
			ClockPM+ Surprise- LLActRep- BwNot- ASPMOptComp-
		LnkCtl:	ASPM Disabled; RCB 64 bytes Disabled- CommClk-
			ExtSynch- ClockPM- AutWidDis- BWInt- AutBWInt-
		LnkSta:	Speed 2.5GT/s (ok), Width x1 (ok)
			TrErr- Train- SlotClk- DLActive- BWMgmt- ABWMgmt-
	Capabilities: [100 v1] Advanced Error Reporting
		UESta:	DLP- SDES- TLP- FCP- CmpltTO- CmpltAbrt- UnxCmplt- RxOF- MalfTLP- ECRC- UnsupReq- ACSViol-
		UEMsk:	DLP- SDES- TLP- FCP- CmpltTO- CmpltAbrt- UnxCmplt- RxOF- MalfTLP- ECRC- UnsupReq- ACSViol-
		UESvrt:	DLP+ SDES+ TLP- FCP+ CmpltTO- CmpltAbrt- UnxCmplt- RxOF+ MalfTLP+ ECRC- UnsupReq- ACSViol-
		CESta:	RxErr- BadTLP- BadDLLP- Rollover- Timeout- AdvNonFatalErr-
		CEMsk:	RxErr- BadTLP- BadDLLP- Rollover- Timeout- AdvNonFatalErr+
		AERCap:	First Error Pointer: 14, ECRCGenCap+ ECRCGenEn- ECRCChkCap+ ECRCChkEn-
			MultHdrRecCap- MultHdrRecEn- TLPPfxPres- HdrLogCap-
		HeaderLog: 00000000 00000000 00000000 00000000
	Capabilities: [130 v1] Device Serial Number ...
	Kernel driver in use: firewire_ohci
	Kernel modules: firewire_ohci

02:00.0 Network controller [0280]: Ralink corp. RT2790 Wireless 802.11n 1T/2R PCIe [1814:0781]
	Subsystem: Lite-On Communications Inc RT2790 Wireless 802.11n 1T/2R PCIe [11ad:7600]
	Control: I/O+ Mem+ BusMaster+ SpecCycle- MemWINV- VGASnoop- ParErr- Stepping- SERR- FastB2B- DisINTx-
	Status: Cap+ 66MHz- UDF- FastB2B- ParErr- DEVSEL=fast >TAbort- <TAbort- <MAbort- >SERR- <PERR- INTx-
	Latency: 0, Cache Line Size: 32 bytes
	Interrupt: pin A routed to IRQ 5
	Region 0: Memory at febf0000 (32-bit, non-prefetchable) [size=64K]
	Capabilities: [40] Power Management version 3
		Flags: PMEClk- DSI- D1- D2- AuxCurrent=375mA PME(D0+,D1-,D2-,D3hot+,D3cold-)
		Status: D0 NoSoftRst- PME-Enable- DSel=0 DScale=0 PME-
	Capabilities: [50] MSI: Enable- Count=1/32 Maskable- 64bit+
		Address: 0000000000000000  Data: 0000
	Capabilities: [70] Express (v1) Endpoint, MSI 00
		DevCap:	MaxPayload 128 bytes, PhantFunc 0, Latency L0s <128ns, L1 <2us
			ExtTag- AttnBtn- AttnInd- PwrInd- RBE+ FLReset- SlotPowerLimit 10.000W
		DevCtl:	CorrErr- NonFatalErr- FatalErr- UnsupReq-
			RlxdOrd+ ExtTag- PhantFunc- AuxPwr- NoSnoop-
			MaxPayload 128 bytes, MaxReadReq 512 bytes
		DevSta:	CorrErr+ NonFatalErr- FatalErr- UnsupReq+ AuxPwr- TransPend-
		LnkCap:	Port #0, Speed 2.5GT/s, Width x1, ASPM L0s L1, Exit Latency L0s <512ns, L1 <64us
			ClockPM+ Surprise- LLActRep- BwNot- ASPMOptComp-
		LnkCtl:	ASPM Disabled; RCB 128 bytes Disabled- CommClk+
			ExtSynch- ClockPM- AutWidDis- BWInt- AutBWInt-
		LnkSta:	Speed 2.5GT/s (ok), Width x1 (ok)
			TrErr- Train- SlotClk+ DLActive- BWMgmt- ABWMgmt-
	Capabilities: [100 v1] Advanced Error Reporting
		UESta:	DLP- SDES- TLP- FCP- CmpltTO- CmpltAbrt- UnxCmplt- RxOF- MalfTLP- ECRC- UnsupReq- ACSViol-
		UEMsk:	DLP- SDES- TLP- FCP- CmpltTO- CmpltAbrt- UnxCmplt- RxOF- MalfTLP- ECRC- UnsupReq- ACSViol-
		UESvrt:	DLP+ SDES- TLP- FCP+ CmpltTO- CmpltAbrt- UnxCmplt- RxOF+ MalfTLP+ ECRC- UnsupReq- ACSViol-
		CESta:	RxErr- BadTLP- BadDLLP- Rollover- Timeout- AdvNonFatalErr-
		CEMsk:	RxErr- BadTLP- BadDLLP- Rollover- Timeout- AdvNonFatalErr+
		AERCap:	First Error Pointer: 00, ECRCGenCap+ ECRCGenEn- ECRCChkCap+ ECRCChkEn-
			MultHdrRecCap- MultHdrRecEn- TLPPfxPres- HdrLogCap-
		HeaderLog: 00000000 00000000 00000000 00000000
	Kernel driver in use: rt2800pci
	Kernel modules: rt2800pci

