00:00.0 Host bridge [0600]: Intel Corporation 82845 845 [Brookdale] Chipset Host Bridge [8086:1a30] (rev 04)
	Control: I/O- Mem+ BusMaster+ SpecCycle- MemWINV- VGASnoop- ParErr- Stepping- SERR+ FastB2B- DisINTx-
	Status: Cap+ 66MHz- UDF- FastB2B+ ParErr- DEVSEL=fast >TAbort- <TAbort- <MAbort+ >SERR- <PERR- INTx-
	Latency: 0
	Region 0: Memory at e0000000 (32-bit, prefetchable) [size=64M]
	Capabilities: <access denied>
	Kernel driver in use: agpgart-intel

00:01.0 PCI bridge [0604]: Intel Corporation 82845 845 [Brookdale] Chipset AGP Bridge [8086:1a31] (rev 04) (prog-if 00 [Normal decode])
	Control: I/O+ Mem+ BusMaster+ SpecCycle- MemWINV- VGASnoop- ParErr- Stepping- SERR+ FastB2B- DisINTx-
	Status: Cap- 66MHz+ UDF- FastB2B+ ParErr- DEVSEL=fast >TAbort- <TAbort- <MAbort- >SERR- <PERR- INTx-
	Latency: 96
	Bus: primary=00, secondary=01, subordinate=01, sec-latency=64
	I/O behind bridge: 00003000-00003fff [size=4K]
	Memory behind bridge: d0100000-d01fffff [size=1M]
	Prefetchable memory behind bridge: e8000000-efffffff [size=128M]
	Secondary status: 66MHz+ FastB2B+ ParErr- DEVSEL=medium >TAbort- <TAbort- <MAbort+ <SERR- <PERR-
	BridgeCtl: Parity- SERR- NoISA+ VGA+ VGA16- MAbort- >Reset- FastB2B-
		PriDiscTmr- SecDiscTmr- DiscTmrStat- DiscTmrSERREn-

00:1d.0 USB controller [0c03]: Intel Corporation 82801CA/CAM USB Controller #1 [8086:2482] (rev 02) (prog-if 00 [UHCI])
	Subsystem: IBM ThinkPad A/T/X Series [1014:0220]
	Control: I/O+ Mem- BusMaster+ SpecCycle- MemWINV- VGASnoop- ParErr- Stepping- SERR- FastB2B- DisINTx-
	Status: Cap- 66MHz- UDF- FastB2B+ ParErr- DEVSEL=medium >TAbort- <TAbort- <MAbort- >SERR- <PERR- INTx-
	Latency: 0
	Interrupt: pin A routed to IRQ 11
	Region 4: I/O ports at 1800 [size=32]
	Kernel driver in use: uhci_hcd

00:1d.1 USB controller [0c03]: Intel Corporation 82801CA/CAM USB Controller #2 [8086:2484] (rev 02) (prog-if 00 [UHCI])
	Subsystem: IBM ThinkPad A/T/X Series [1014:0220]
	Control: I/O+ Mem- BusMaster+ SpecCycle- MemWINV- VGASnoop- ParErr- Stepping- SERR- FastB2B- DisINTx-
	Status: Cap- 66MHz- UDF- FastB2B+ ParErr- DEVSEL=medium >TAbort- <TAbort- <MAbort- >SERR- <PERR- INTx-
	Latency: 0
	Interrupt: pin B routed to IRQ 11
	Region 4: I/O ports at 1820 [size=32]
	Kernel driver in use: uhci_hcd

00:1d.2 USB controller [0c03]: Intel Corporation 82801CA/CAM USB Controller #3 [8086:2487] (rev 02) (prog-if 00 [UHCI])
	Subsystem: IBM ThinkPad A/T/X Series [1014:0220]
	Control: I/O+ Mem- BusMaster+ SpecCycle- MemWINV- VGASnoop- ParErr- Stepping- SERR- FastB2B- DisINTx-
	Status: Cap- 66MHz- UDF- FastB2B+ ParErr- DEVSEL=medium >TAbort- <TAbort- <MAbort- >SERR- <PERR- INTx-
	Latency: 0
	Interrupt: pin C routed to IRQ 11
	Region 4: I/O ports at 1840 [size=32]
	Kernel driver in use: uhci_hcd

00:1e.0 PCI bridge [0604]: Intel Corporation 82801 Mobile PCI Bridge [8086:2448] (rev 42) (prog-if 00 [Normal decode])
	Control: I/O+ Mem+ BusMaster+ SpecCycle- MemWINV- VGASnoop- ParErr- Stepping- SERR+ FastB2B- DisINTx-
	Status: Cap- 66MHz- UDF- FastB2B+ ParErr- DEVSEL=fast >TAbort- <TAbort- <MAbort- >SERR- <PERR- INTx-
	Latency: 0
	Bus: primary=00, secondary=02, subordinate=08, sec-latency=64
	I/O behind bridge: 00004000-00008fff [size=20K]
	Memory behind bridge: d0200000-dfffffff [size=254M]
	Prefetchable memory behind bridge: f0000000-f7ffffff [size=128M]
	Secondary status: 66MHz- FastB2B+ ParErr- DEVSEL=medium >TAbort- <TAbort- <MAbort+ <SERR- <PERR-
	BridgeCtl: Parity- SERR- NoISA+ VGA- VGA16- MAbort- >Reset- FastB2B-
		PriDiscTmr- SecDiscTmr- DiscTmrStat- DiscTmrSERREn-

00:1f.0 ISA bridge [0601]: Intel Corporation 82801CAM ISA Bridge (LPC) [8086:248c] (rev 02)
	Control: I/O+ Mem+ BusMaster+ SpecCycle+ MemWINV- VGASnoop- ParErr- Stepping- SERR- FastB2B- DisINTx-
	Status: Cap- 66MHz- UDF- FastB2B+ ParErr- DEVSEL=medium >TAbort- <TAbort- <MAbort- >SERR- <PERR- INTx-
	Latency: 0
	Kernel driver in use: lpc_ich

00:1f.1 IDE interface [0101]: Intel Corporation 82801CAM IDE U100 Controller [8086:248a] (rev 02) (prog-if 8a [ISA Compatibility mode controller, supports both channels switched to PCI native mode, supports bus mastering])
	Subsystem: IBM ThinkPad A/T/X Series [1014:0220]
	Control: I/O+ Mem+ BusMaster+ SpecCycle- MemWINV- VGASnoop- ParErr- Stepping- SERR- FastB2B- DisINTx-
	Status: Cap- 66MHz- UDF- FastB2B+ ParErr- DEVSEL=medium >TAbort- <TAbort- <MAbort- >SERR- <PERR- INTx-
	Latency: 0
	Interrupt: pin A routed to IRQ 11
	Region 0: I/O ports at 01f0 [size=8]
	Region 1: I/O ports at 03f4
	Region 2: I/O ports at 0170 [size=8]
	Region 3: I/O ports at 0374
	Region 4: I/O ports at 1860 [size=16]
	Region 5: Memory at 40000000 (32-bit, non-prefetchable) [size=1K]
	Kernel driver in use: ata_piix

00:1f.3 SMBus [0c05]: Intel Corporation 82801CA/CAM SMBus Controller [8086:2483] (rev 02)
	Subsystem: IBM ThinkPad A/T/X Series [1014:0220]
	Control: I/O+ Mem- BusMaster- SpecCycle- MemWINV- VGASnoop- ParErr- Stepping- SERR- FastB2B- DisINTx-
	Status: Cap- 66MHz- UDF- FastB2B+ ParErr- DEVSEL=medium >TAbort- <TAbort- <MAbort- >SERR- <PERR- INTx-
	Interrupt: pin B routed to IRQ 5
	Region 4: I/O ports at 1880 [size=32]
	Kernel driver in use: i801_smbus

00:1f.5 Multimedia audio controller [0401]: Intel Corporation 82801CA/CAM AC'97 Audio Controller [8086:2485] (rev 02)
	Subsystem: IBM ThinkPad T30 [1014:0508]
	Control: I/O+ Mem- BusMaster+ SpecCycle- MemWINV- VGASnoop- ParErr- Stepping- SERR- FastB2B- DisINTx-
	Status: Cap- 66MHz- UDF- FastB2B+ ParErr- DEVSEL=medium >TAbort- <TAbort- <MAbort- >SERR- <PERR- INTx-
	Latency: 0
	Interrupt: pin B routed to IRQ 5
	Region 0: I/O ports at 1c00 [size=256]
	Region 1: I/O ports at 18c0 [size=64]
	Kernel driver in use: snd_intel8x0

00:1f.6 Modem [0703]: Intel Corporation 82801CA/CAM AC'97 Modem Controller [8086:2486] (rev 02) (prog-if 00 [Generic])
	Subsystem: IBM ThinkPad A/T/X Series [1014:0223]
	Control: I/O+ Mem- BusMaster+ SpecCycle- MemWINV- VGASnoop- ParErr- Stepping- SERR- FastB2B- DisINTx-
	Status: Cap- 66MHz- UDF- FastB2B+ ParErr- DEVSEL=medium >TAbort- <TAbort- <MAbort- >SERR- <PERR- INTx-
	Latency: 0
	Interrupt: pin B routed to IRQ 5
	Region 0: I/O ports at 2400 [size=256]
	Region 1: I/O ports at 2000 [size=128]
	Kernel driver in use: snd_intel8x0m

01:00.0 VGA compatible controller [0300]: Advanced Micro Devices, Inc. [AMD/ATI] RV200/M7 [Mobility Radeon 7500] [1002:4c57] (prog-if 00 [VGA controller])
	Subsystem: IBM Device [1014:0509]
	Control: I/O+ Mem+ BusMaster+ SpecCycle- MemWINV- VGASnoop- ParErr- Stepping+ SERR+ FastB2B+ DisINTx-
	Status: Cap+ 66MHz+ UDF- FastB2B+ ParErr- DEVSEL=medium >TAbort- <TAbort- <MAbort- >SERR- <PERR- INTx-
	Latency: 66 (2000ns min), Cache Line Size: 32 bytes
	Interrupt: pin A routed to IRQ 11
	Region 0: Memory at e8000000 (32-bit, prefetchable) [size=128M]
	Region 1: I/O ports at 3000 [size=256]
	Region 2: Memory at d0100000 (32-bit, non-prefetchable) [size=64K]
	[virtual] Expansion ROM at 000c0000 [disabled] [size=128K]
	Capabilities: <access denied>
	Kernel driver in use: radeon

02:00.0 CardBus bridge [0607]: Ricoh Co Ltd RL5c476 II [1180:0476] (rev 80)
	Subsystem: IBM ThinkPad A/T/X Series [1014:0185]
	Physical Slot: 1
	Control: I/O+ Mem+ BusMaster+ SpecCycle- MemWINV- VGASnoop- ParErr- Stepping- SERR- FastB2B- DisINTx-
	Status: Cap+ 66MHz- UDF- FastB2B- ParErr- DEVSEL=medium >TAbort- <TAbort- <MAbort- >SERR- <PERR- INTx-
	Latency: 168
	Interrupt: pin A routed to IRQ 11
	Region 0: Memory at 50000000 (32-bit, non-prefetchable) [size=4K]
	Bus: primary=02, secondary=03, subordinate=06, sec-latency=176
	Memory window 0: f0000000-f3ffffff (prefetchable)
	Memory window 1: d4000000-d7ffffff
	I/O window 0: 00004000-000040ff
	I/O window 1: 00004400-000044ff
	BridgeCtl: Parity- SERR- ISA- VGA- MAbort- >Reset- 16bInt+ PostWrite+
	16-bit legacy interface ports at 0001
	Capabilities: <access denied>
	Kernel driver in use: yenta_cardbus

02:00.1 CardBus bridge [0607]: Ricoh Co Ltd RL5c476 II [1180:0476] (rev 80)
	Subsystem: IBM ThinkPad A/T/X Series [1014:0185]
	Physical Slot: 1
	Control: I/O+ Mem+ BusMaster+ SpecCycle- MemWINV- VGASnoop- ParErr- Stepping- SERR- FastB2B- DisINTx-
	Status: Cap+ 66MHz- UDF- FastB2B- ParErr- DEVSEL=medium >TAbort- <TAbort- <MAbort- >SERR- <PERR- INTx-
	Latency: 168
	Interrupt: pin B routed to IRQ 5
	Region 0: Memory at 50100000 (32-bit, non-prefetchable) [size=4K]
	Bus: primary=02, secondary=07, subordinate=07, sec-latency=176
	Memory window 0: f4000000-f7ffffff (prefetchable)
	Memory window 1: d8000000-dbffffff
	I/O window 0: 00004800-000048ff
	I/O window 1: 00004c00-00004cff
	BridgeCtl: Parity- SERR- ISA- VGA- MAbort- >Reset- 16bInt- PostWrite+
	16-bit legacy interface ports at 0001
	Capabilities: <access denied>
	Kernel driver in use: yenta_cardbus

02:08.0 Ethernet controller [0200]: Intel Corporation 82801CAM (ICH3) PRO/100 VE (LOM) Ethernet Controller [8086:1031] (rev 42)
	Subsystem: IBM ThinkPad A/T/X Series [1014:0209]
	Control: I/O+ Mem+ BusMaster+ SpecCycle- MemWINV+ VGASnoop- ParErr- Stepping- SERR+ FastB2B- DisINTx-
	Status: Cap+ 66MHz- UDF- FastB2B+ ParErr- DEVSEL=medium >TAbort- <TAbort- <MAbort- >SERR- <PERR- INTx-
	Latency: 66 (2000ns min, 14000ns max), Cache Line Size: 32 bytes
	Interrupt: pin A routed to IRQ 11
	Region 0: Memory at d0200000 (32-bit, non-prefetchable) [size=4K]
	Region 1: I/O ports at 8000 [size=64]
	Capabilities: <access denied>
	Kernel driver in use: e100

07:00.0 Mass storage controller [0180]: Silicon Image, Inc. SiI 3512 [SATALink/SATARaid] Serial ATA Controller [1095:3512] (rev 01)
	Subsystem: Silicon Image, Inc. SiI 3512 SATALink Controller [1095:3512]
	Control: I/O+ Mem+ BusMaster+ SpecCycle- MemWINV- VGASnoop- ParErr- Stepping- SERR- FastB2B- DisINTx-
	Status: Cap+ 66MHz+ UDF- FastB2B+ ParErr- DEVSEL=medium >TAbort- <TAbort- <MAbort- >SERR- <PERR- INTx-
	Latency: 64, Cache Line Size: 32 bytes
	Interrupt: pin A routed to IRQ 5
	Region 0: I/O ports at 4810 [size=8]
	Region 1: I/O ports at 4820 [size=4]
	Region 2: I/O ports at 4818 [size=8]
	Region 3: I/O ports at 4824 [size=4]
	Region 4: I/O ports at 4800 [size=16]
	Region 5: Memory at d8000000 (32-bit, non-prefetchable) [size=512]
	[virtual] Expansion ROM at f4000000 [disabled] [size=512K]
	Capabilities: <access denied>
	Kernel driver in use: sata_sil

