00:00.0 Host bridge [0600]: Advanced Micro Devices, Inc. [AMD/ATI] RS690 Host Bridge [1002:7910]
	Subsystem: Gateway, Inc. Device [107b:0184]
	Control: I/O- Mem+ BusMaster+ SpecCycle- MemWINV- VGASnoop- ParErr- Stepping- SERR- FastB2B- DisINTx-
	Status: Cap- 66MHz+ UDF- FastB2B- ParErr- DEVSEL=medium >TAbort- <TAbort- <MAbort+ >SERR- <PERR- INTx-
	Latency: 64
	Kernel modules: ati_agp

00:01.0 PCI bridge [0604]: Advanced Micro Devices, Inc. [AMD/ATI] RS690/RS740 PCI to PCI Bridge (Internal gfx) [1002:7912] (prog-if 00 [Normal decode])
	Control: I/O+ Mem+ BusMaster+ SpecCycle- MemWINV- VGASnoop- ParErr- Stepping- SERR- FastB2B- DisINTx-
	Status: Cap+ 66MHz+ UDF- FastB2B- ParErr- DEVSEL=medium >TAbort- <TAbort- <MAbort- >SERR- <PERR- INTx-
	Latency: 64
	Bus: primary=00, secondary=01, subordinate=01, sec-latency=64
	I/O behind bridge: 00009000-00009fff [size=4K]
	Memory behind bridge: f0000000-f01fffff [size=2M]
	Prefetchable memory behind bridge: 00000000d0000000-00000000dfffffff [size=256M]
	Secondary status: 66MHz+ FastB2B- ParErr- DEVSEL=medium >TAbort- <TAbort- <MAbort+ <SERR- <PERR-
	BridgeCtl: Parity- SERR+ NoISA+ VGA+ VGA16- MAbort- >Reset- FastB2B-
		PriDiscTmr- SecDiscTmr- DiscTmrStat- DiscTmrSERREn-
	Capabilities: <access denied>

00:06.0 PCI bridge [0604]: Advanced Micro Devices, Inc. [AMD/ATI] RS690 PCI to PCI Bridge (PCI Express Port 2) [1002:7916] (prog-if 00 [Normal decode])
	Control: I/O+ Mem+ BusMaster+ SpecCycle- MemWINV- VGASnoop- ParErr- Stepping- SERR- FastB2B- DisINTx-
	Status: Cap+ 66MHz- UDF- FastB2B- ParErr- DEVSEL=fast >TAbort- <TAbort- <MAbort- >SERR- <PERR- INTx-
	Latency: 0, Cache Line Size: 32 bytes
	Bus: primary=00, secondary=02, subordinate=04, sec-latency=0
	I/O behind bridge: None
	Memory behind bridge: f0200000-f02fffff [size=1M]
	Prefetchable memory behind bridge: None
	Secondary status: 66MHz- FastB2B- ParErr- DEVSEL=fast >TAbort- <TAbort- <MAbort+ <SERR- <PERR-
	BridgeCtl: Parity- SERR+ NoISA+ VGA- VGA16- MAbort- >Reset- FastB2B-
		PriDiscTmr- SecDiscTmr- DiscTmrStat- DiscTmrSERREn-
	Capabilities: <access denied>
	Kernel driver in use: pcieport

00:07.0 PCI bridge [0604]: Advanced Micro Devices, Inc. [AMD/ATI] RS690 PCI to PCI Bridge (PCI Express Port 3) [1002:7917] (prog-if 00 [Normal decode])
	Control: I/O+ Mem+ BusMaster+ SpecCycle- MemWINV- VGASnoop- ParErr- Stepping- SERR- FastB2B- DisINTx-
	Status: Cap+ 66MHz- UDF- FastB2B- ParErr- DEVSEL=fast >TAbort- <TAbort- <MAbort- >SERR- <PERR- INTx-
	Latency: 0, Cache Line Size: 32 bytes
	Bus: primary=00, secondary=05, subordinate=07, sec-latency=0
	I/O behind bridge: 0000a000-0000afff [size=4K]
	Memory behind bridge: 80000000-800fffff [size=1M]
	Prefetchable memory behind bridge: 00000000cfd00000-00000000cfdfffff [size=1M]
	Secondary status: 66MHz- FastB2B- ParErr- DEVSEL=fast >TAbort- <TAbort- <MAbort+ <SERR- <PERR-
	BridgeCtl: Parity- SERR+ NoISA+ VGA- VGA16- MAbort- >Reset- FastB2B-
		PriDiscTmr- SecDiscTmr- DiscTmrStat- DiscTmrSERREn-
	Capabilities: <access denied>
	Kernel driver in use: pcieport

00:12.0 SATA controller [0106]: Advanced Micro Devices, Inc. [AMD/ATI] SB600 Non-Raid-5 SATA [1002:4380] (prog-if 01 [AHCI 1.0])
	Subsystem: Gateway, Inc. Device [107b:0184]
	Control: I/O+ Mem+ BusMaster+ SpecCycle- MemWINV- VGASnoop- ParErr- Stepping- SERR- FastB2B- DisINTx-
	Status: Cap+ 66MHz+ UDF- FastB2B- ParErr- DEVSEL=medium >TAbort- <TAbort- <MAbort- >SERR- <PERR- INTx-
	Latency: 64
	Interrupt: pin A routed to IRQ 22
	Region 0: I/O ports at 8440 [size=8]
	Region 1: I/O ports at 8434 [size=4]
	Region 2: I/O ports at 8438 [size=8]
	Region 3: I/O ports at 8430 [size=4]
	Region 4: I/O ports at 8400 [size=16]
	Region 5: Memory at f0507000 (32-bit, non-prefetchable) [size=1K]
	Capabilities: <access denied>
	Kernel driver in use: ahci
	Kernel modules: ahci

00:13.0 USB controller [0c03]: Advanced Micro Devices, Inc. [AMD/ATI] SB600 USB (OHCI0) [1002:4387] (prog-if 10 [OHCI])
	Subsystem: Gateway, Inc. Device [107b:0184]
	Control: I/O+ Mem+ BusMaster+ SpecCycle- MemWINV+ VGASnoop- ParErr- Stepping- SERR- FastB2B- DisINTx-
	Status: Cap- 66MHz+ UDF- FastB2B+ ParErr- DEVSEL=medium >TAbort- <TAbort- <MAbort- >SERR- <PERR- INTx-
	Latency: 64, Cache Line Size: 32 bytes
	Interrupt: pin A routed to IRQ 16
	Region 0: Memory at f0504000 (32-bit, non-prefetchable) [size=4K]
	Kernel driver in use: ohci-pci

00:13.1 USB controller [0c03]: Advanced Micro Devices, Inc. [AMD/ATI] SB600 USB (OHCI1) [1002:4388] (prog-if 10 [OHCI])
	Subsystem: Gateway, Inc. Device [107b:0184]
	Control: I/O+ Mem+ BusMaster+ SpecCycle- MemWINV+ VGASnoop- ParErr- Stepping- SERR- FastB2B- DisINTx-
	Status: Cap- 66MHz+ UDF- FastB2B+ ParErr- DEVSEL=medium >TAbort- <TAbort- <MAbort- >SERR- <PERR- INTx-
	Latency: 64, Cache Line Size: 32 bytes
	Interrupt: pin B routed to IRQ 17
	Region 0: Memory at f0505000 (32-bit, non-prefetchable) [size=4K]
	Kernel driver in use: ohci-pci

00:13.4 USB controller [0c03]: Advanced Micro Devices, Inc. [AMD/ATI] SB600 USB (OHCI4) [1002:438b] (prog-if 10 [OHCI])
	Subsystem: Gateway, Inc. Device [107b:0184]
	Control: I/O+ Mem+ BusMaster+ SpecCycle- MemWINV+ VGASnoop- ParErr- Stepping- SERR- FastB2B- DisINTx-
	Status: Cap- 66MHz+ UDF- FastB2B+ ParErr- DEVSEL=medium >TAbort- <TAbort- <MAbort- >SERR- <PERR- INTx-
	Latency: 64, Cache Line Size: 32 bytes
	Interrupt: pin C routed to IRQ 18
	Region 0: Memory at f0506000 (32-bit, non-prefetchable) [size=4K]
	Kernel driver in use: ohci-pci

00:13.5 USB controller [0c03]: Advanced Micro Devices, Inc. [AMD/ATI] SB600 USB Controller (EHCI) [1002:4386] (prog-if 20 [EHCI])
	Subsystem: Gateway, Inc. Device [107b:0184]
	Control: I/O+ Mem+ BusMaster+ SpecCycle- MemWINV+ VGASnoop- ParErr- Stepping- SERR- FastB2B- DisINTx-
	Status: Cap+ 66MHz+ UDF- FastB2B+ ParErr- DEVSEL=medium >TAbort- <TAbort- <MAbort- >SERR- <PERR- INTx-
	Latency: 64, Cache Line Size: 32 bytes
	Interrupt: pin D routed to IRQ 19
	Region 0: Memory at f0507400 (32-bit, non-prefetchable) [size=256]
	Capabilities: <access denied>
	Kernel driver in use: ehci-pci

00:14.0 SMBus [0c05]: Advanced Micro Devices, Inc. [AMD/ATI] SBx00 SMBus Controller [1002:4385] (rev 14)
	Subsystem: Advanced Micro Devices, Inc. [AMD/ATI] SBx00 SMBus Controller [1002:4385]
	Control: I/O+ Mem+ BusMaster- SpecCycle- MemWINV- VGASnoop- ParErr- Stepping- SERR- FastB2B- DisINTx-
	Status: Cap+ 66MHz+ UDF- FastB2B- ParErr- DEVSEL=medium >TAbort- <TAbort- <MAbort- >SERR- <PERR- INTx-
	Region 0: I/O ports at 8410 [size=16]
	Capabilities: <access denied>
	Kernel driver in use: piix4_smbus
	Kernel modules: i2c_piix4, sp5100_tco

00:14.1 IDE interface [0101]: Advanced Micro Devices, Inc. [AMD/ATI] SB600 IDE [1002:438c] (prog-if 8a [ISA Compatibility mode controller, supports both channels switched to PCI native mode, supports bus mastering])
	Subsystem: Advanced Micro Devices, Inc. [AMD/ATI] SB600 IDE [1002:438c]
	Control: I/O+ Mem- BusMaster+ SpecCycle- MemWINV+ VGASnoop- ParErr- Stepping- SERR- FastB2B- DisINTx-
	Status: Cap- 66MHz+ UDF- FastB2B- ParErr- DEVSEL=medium >TAbort- <TAbort- <MAbort- >SERR- <PERR- INTx-
	Latency: 64
	Interrupt: pin A routed to IRQ 16
	Region 0: I/O ports at 01f0 [size=8]
	Region 1: I/O ports at 03f4
	Region 2: [virtual] Memory at 00000170 (32-bit, non-prefetchable) [size=8]
	Region 3: [virtual] Memory at 00000370 (type 3, non-prefetchable)
	Region 4: I/O ports at 8420 [size=16]
	Kernel driver in use: pata_atiixp
	Kernel modules: pata_atiixp, pata_acpi

00:14.2 Audio device [0403]: Advanced Micro Devices, Inc. [AMD/ATI] SBx00 Azalia (Intel HDA) [1002:4383]
	Subsystem: Gateway, Inc. Device [107b:0184]
	Control: I/O- Mem+ BusMaster+ SpecCycle- MemWINV- VGASnoop- ParErr- Stepping- SERR- FastB2B- DisINTx-
	Status: Cap+ 66MHz- UDF- FastB2B- ParErr- DEVSEL=slow >TAbort- <TAbort- <MAbort- >SERR- <PERR- INTx-
	Latency: 64, Cache Line Size: 32 bytes
	Interrupt: pin A routed to IRQ 16
	Region 0: Memory at f0500000 (64-bit, non-prefetchable) [size=16K]
	Capabilities: <access denied>
	Kernel driver in use: snd_hda_intel
	Kernel modules: snd_hda_intel

00:14.3 ISA bridge [0601]: Advanced Micro Devices, Inc. [AMD/ATI] SB600 PCI to LPC Bridge [1002:438d]
	Subsystem: Advanced Micro Devices, Inc. [AMD/ATI] SB600 PCI to LPC Bridge [1002:438d]
	Control: I/O+ Mem+ BusMaster+ SpecCycle+ MemWINV- VGASnoop- ParErr- Stepping- SERR- FastB2B- DisINTx-
	Status: Cap- 66MHz+ UDF- FastB2B- ParErr- DEVSEL=medium >TAbort- <TAbort- <MAbort- >SERR- <PERR- INTx-
	Latency: 0

00:14.4 PCI bridge [0604]: Advanced Micro Devices, Inc. [AMD/ATI] SBx00 PCI to PCI Bridge [1002:4384] (prog-if 01 [Subtractive decode])
	Control: I/O+ Mem+ BusMaster+ SpecCycle- MemWINV- VGASnoop- ParErr- Stepping- SERR- FastB2B- DisINTx-
	Status: Cap- 66MHz+ UDF- FastB2B+ ParErr- DEVSEL=medium >TAbort- <TAbort- <MAbort- >SERR- <PERR- INTx-
	Latency: 64
	Bus: primary=00, secondary=08, subordinate=0a, sec-latency=64
	I/O behind bridge: None
	Memory behind bridge: None
	Prefetchable memory behind bridge: None
	Secondary status: 66MHz- FastB2B+ ParErr- DEVSEL=medium >TAbort- <TAbort- <MAbort+ <SERR- <PERR-
	BridgeCtl: Parity- SERR+ NoISA- VGA- VGA16- MAbort- >Reset- FastB2B-
		PriDiscTmr- SecDiscTmr- DiscTmrStat- DiscTmrSERREn-

00:18.0 Host bridge [0600]: Advanced Micro Devices, Inc. [AMD] K8 [Athlon64/Opteron] HyperTransport Technology Configuration [1022:1100]
	Control: I/O- Mem- BusMaster- SpecCycle- MemWINV- VGASnoop- ParErr- Stepping- SERR- FastB2B- DisINTx-
	Status: Cap+ 66MHz- UDF- FastB2B- ParErr- DEVSEL=fast >TAbort- <TAbort- <MAbort- >SERR- <PERR- INTx-
	Capabilities: <access denied>

00:18.1 Host bridge [0600]: Advanced Micro Devices, Inc. [AMD] K8 [Athlon64/Opteron] Address Map [1022:1101]
	Control: I/O- Mem- BusMaster- SpecCycle- MemWINV- VGASnoop- ParErr- Stepping- SERR- FastB2B- DisINTx-
	Status: Cap- 66MHz- UDF- FastB2B- ParErr- DEVSEL=fast >TAbort- <TAbort- <MAbort- >SERR- <PERR- INTx-

00:18.2 Host bridge [0600]: Advanced Micro Devices, Inc. [AMD] K8 [Athlon64/Opteron] DRAM Controller [1022:1102]
	Control: I/O- Mem- BusMaster- SpecCycle- MemWINV- VGASnoop- ParErr- Stepping- SERR- FastB2B- DisINTx-
	Status: Cap- 66MHz- UDF- FastB2B- ParErr- DEVSEL=fast >TAbort- <TAbort- <MAbort- >SERR- <PERR- INTx-

00:18.3 Host bridge [0600]: Advanced Micro Devices, Inc. [AMD] K8 [Athlon64/Opteron] Miscellaneous Control [1022:1103]
	Control: I/O- Mem- BusMaster- SpecCycle- MemWINV- VGASnoop- ParErr- Stepping- SERR- FastB2B- DisINTx-
	Status: Cap+ 66MHz- UDF- FastB2B- ParErr- DEVSEL=fast >TAbort- <TAbort- <MAbort- >SERR- <PERR- INTx-
	Capabilities: <access denied>
	Kernel driver in use: k8temp
	Kernel modules: k8temp

01:05.0 VGA compatible controller [0300]: Advanced Micro Devices, Inc. [AMD/ATI] RS690M [Radeon Xpress 1200/1250/1270] [1002:791f] (prog-if 00 [VGA controller])
	Subsystem: Gateway, Inc. Device [107b:0184]
	Control: I/O+ Mem+ BusMaster+ SpecCycle- MemWINV- VGASnoop- ParErr- Stepping- SERR- FastB2B- DisINTx+
	Status: Cap+ 66MHz- UDF- FastB2B- ParErr- DEVSEL=fast >TAbort- <TAbort- <MAbort- >SERR- <PERR- INTx-
	Latency: 64, Cache Line Size: 32 bytes
	Interrupt: pin A routed to IRQ 24
	Region 0: Memory at d0000000 (64-bit, prefetchable) [size=256M]
	Region 2: Memory at f0100000 (64-bit, non-prefetchable) [size=64K]
	Region 4: I/O ports at 9400 [size=256]
	Region 5: Memory at f0000000 (32-bit, non-prefetchable) [size=1M]
	[virtual] Expansion ROM at 000c0000 [disabled] [size=128K]
	Capabilities: <access denied>
	Kernel driver in use: radeon
	Kernel modules: radeon

02:00.0 Ethernet controller [0200]: Qualcomm Atheros AR242x / AR542x Wireless Network Adapter (PCI-Express) [168c:001c] (rev 01)
	Subsystem: AMBIT Microsystem Corp. AR5BXB63 802.11bg NIC [1468:0428]
	Control: I/O+ Mem+ BusMaster+ SpecCycle- MemWINV- VGASnoop- ParErr- Stepping- SERR- FastB2B- DisINTx-
	Status: Cap+ 66MHz- UDF- FastB2B- ParErr- DEVSEL=fast >TAbort- <TAbort- <MAbort- >SERR- <PERR- INTx-
	Latency: 0, Cache Line Size: 32 bytes
	Interrupt: pin A routed to IRQ 18
	Region 0: Memory at f0200000 (64-bit, non-prefetchable) [size=64K]
	Capabilities: <access denied>
	Kernel driver in use: ath5k
	Kernel modules: ath5k

05:00.0 Ethernet controller [0200]: Realtek Semiconductor Co., Ltd. RTL810xE PCI Express Fast Ethernet controller [10ec:8136] (rev 02)
	Subsystem: Gateway, Inc. Device [107b:0184]
	Control: I/O+ Mem+ BusMaster+ SpecCycle- MemWINV- VGASnoop- ParErr- Stepping- SERR- FastB2B- DisINTx-
	Status: Cap+ 66MHz- UDF- FastB2B- ParErr- DEVSEL=fast >TAbort- <TAbort- <MAbort- >SERR- <PERR- INTx-
	Latency: 0, Cache Line Size: 32 bytes
	Interrupt: pin A routed to IRQ 19
	Region 0: I/O ports at a400 [size=256]
	Region 2: Memory at cfdef000 (64-bit, prefetchable) [size=4K]
	Region 4: Memory at cfdf0000 (64-bit, prefetchable) [size=64K]
	[virtual] Expansion ROM at 80000000 [disabled] [size=128K]
	Capabilities: <access denied>
	Kernel driver in use: r8169
	Kernel modules: r8169

