00:00.0 Host bridge [0600]: Advanced Micro Devices, Inc. [AMD] Family 15h (Models 30h-3fh) Processor Root Complex [1022:1422]
	Subsystem: ASRock Incorporation Device [1849:1422]
	Control: I/O- Mem- BusMaster+ SpecCycle- MemWINV- VGASnoop- ParErr- Stepping- SERR- FastB2B- DisINTx-
	Status: Cap- 66MHz- UDF- FastB2B- ParErr- DEVSEL=fast >TAbort- <TAbort- <MAbort- >SERR- <PERR- INTx-
	Latency: 0

00:01.0 VGA compatible controller [0300]: Advanced Micro Devices, Inc. [AMD/ATI] Kaveri [Radeon R7 Graphics] [1002:130f] (prog-if 00 [VGA controller])
	Subsystem: ASRock Incorporation Device [1849:130f]
	Control: I/O+ Mem+ BusMaster+ SpecCycle- MemWINV- VGASnoop- ParErr- Stepping- SERR- FastB2B- DisINTx+
	Status: Cap+ 66MHz- UDF- FastB2B- ParErr- DEVSEL=fast >TAbort- <TAbort- <MAbort- >SERR- <PERR- INTx-
	Latency: 0, Cache Line Size: 64 bytes
	Interrupt: pin A routed to IRQ 44
	Region 0: Memory at c0000000 (64-bit, prefetchable) [size=256M]
	Region 2: Memory at d0000000 (64-bit, prefetchable) [size=8M]
	Region 4: I/O ports at f000 [size=256]
	Region 5: Memory at feb00000 (32-bit, non-prefetchable) [size=256K]
	Expansion ROM at 000c0000 [disabled] [size=128K]
	Capabilities: <access denied>
	Kernel driver in use: radeon
	Kernel modules: radeon, amdgpu

00:01.1 Audio device [0403]: Advanced Micro Devices, Inc. [AMD/ATI] Kaveri HDMI/DP Audio Controller [1002:1308]
	Subsystem: ASRock Incorporation Device [1849:1308]
	Control: I/O+ Mem+ BusMaster+ SpecCycle- MemWINV- VGASnoop- ParErr- Stepping- SERR- FastB2B- DisINTx+
	Status: Cap+ 66MHz- UDF- FastB2B- ParErr- DEVSEL=fast >TAbort- <TAbort- <MAbort- >SERR- <PERR- INTx-
	Latency: 0, Cache Line Size: 64 bytes
	Interrupt: pin B routed to IRQ 46
	Region 0: Memory at feb64000 (64-bit, non-prefetchable) [size=16K]
	Capabilities: <access denied>
	Kernel driver in use: snd_hda_intel
	Kernel modules: snd_hda_intel

00:02.0 Host bridge [0600]: Advanced Micro Devices, Inc. [AMD] Family 15h (Models 30h-3fh) Processor Root Port [1022:1424]
	Control: I/O- Mem- BusMaster- SpecCycle- MemWINV- VGASnoop- ParErr- Stepping- SERR- FastB2B- DisINTx-
	Status: Cap- 66MHz- UDF- FastB2B- ParErr- DEVSEL=fast >TAbort- <TAbort- <MAbort- >SERR- <PERR- INTx-

00:03.0 Host bridge [0600]: Advanced Micro Devices, Inc. [AMD] Family 15h (Models 30h-3fh) Processor Root Port [1022:1424]
	Control: I/O- Mem- BusMaster- SpecCycle- MemWINV- VGASnoop- ParErr- Stepping- SERR- FastB2B- DisINTx-
	Status: Cap- 66MHz- UDF- FastB2B- ParErr- DEVSEL=fast >TAbort- <TAbort- <MAbort- >SERR- <PERR- INTx-

00:04.0 Host bridge [0600]: Advanced Micro Devices, Inc. [AMD] Family 15h (Models 30h-3fh) Processor Root Port [1022:1424]
	Control: I/O- Mem- BusMaster- SpecCycle- MemWINV- VGASnoop- ParErr- Stepping- SERR- FastB2B- DisINTx-
	Status: Cap- 66MHz- UDF- FastB2B- ParErr- DEVSEL=fast >TAbort- <TAbort- <MAbort- >SERR- <PERR- INTx-

00:10.0 USB controller [0c03]: Advanced Micro Devices, Inc. [AMD] FCH USB XHCI Controller [1022:7814] (rev 09) (prog-if 30 [XHCI])
	Subsystem: ASRock Incorporation QC5000-ITX/PH [1849:7814]
	Control: I/O- Mem+ BusMaster+ SpecCycle- MemWINV- VGASnoop- ParErr- Stepping- SERR- FastB2B- DisINTx+
	Status: Cap+ 66MHz- UDF- FastB2B- ParErr- DEVSEL=fast >TAbort- <TAbort- <MAbort- >SERR- <PERR- INTx-
	Latency: 0, Cache Line Size: 64 bytes
	Interrupt: pin A routed to IRQ 18
	Region 0: Memory at feb6a000 (64-bit, non-prefetchable) [size=8K]
	Capabilities: <access denied>
	Kernel driver in use: xhci_hcd

00:10.1 USB controller [0c03]: Advanced Micro Devices, Inc. [AMD] FCH USB XHCI Controller [1022:7814] (rev 09) (prog-if 30 [XHCI])
	Subsystem: ASRock Incorporation QC5000-ITX/PH [1849:7814]
	Control: I/O- Mem+ BusMaster+ SpecCycle- MemWINV- VGASnoop- ParErr- Stepping- SERR- FastB2B- DisINTx+
	Status: Cap+ 66MHz- UDF- FastB2B- ParErr- DEVSEL=fast >TAbort- <TAbort- <MAbort- >SERR- <PERR- INTx-
	Latency: 0, Cache Line Size: 64 bytes
	Interrupt: pin B routed to IRQ 17
	Region 0: Memory at feb68000 (64-bit, non-prefetchable) [size=8K]
	Capabilities: <access denied>
	Kernel driver in use: xhci_hcd

00:11.0 SATA controller [0106]: Advanced Micro Devices, Inc. [AMD] FCH SATA Controller [AHCI mode] [1022:7801] (rev 40) (prog-if 01 [AHCI 1.0])
	Subsystem: ASRock Incorporation QC5000-ITX/PH [1849:7801]
	Control: I/O+ Mem+ BusMaster+ SpecCycle- MemWINV- VGASnoop- ParErr- Stepping- SERR- FastB2B- DisINTx+
	Status: Cap+ 66MHz+ UDF- FastB2B- ParErr- DEVSEL=medium >TAbort- <TAbort- <MAbort- >SERR- <PERR- INTx-
	Latency: 32
	Interrupt: pin A routed to IRQ 42
	Region 0: I/O ports at f140 [size=8]
	Region 1: I/O ports at f130 [size=4]
	Region 2: I/O ports at f120 [size=8]
	Region 3: I/O ports at f110 [size=4]
	Region 4: I/O ports at f100 [size=16]
	Region 5: Memory at feb71000 (32-bit, non-prefetchable) [size=2K]
	Capabilities: <access denied>
	Kernel driver in use: ahci
	Kernel modules: ahci

00:12.0 USB controller [0c03]: Advanced Micro Devices, Inc. [AMD] FCH USB OHCI Controller [1022:7807] (rev 11) (prog-if 10 [OHCI])
	Subsystem: ASRock Incorporation QC5000-ITX/PH [1849:7807]
	Control: I/O+ Mem+ BusMaster+ SpecCycle- MemWINV- VGASnoop- ParErr- Stepping- SERR- FastB2B- DisINTx-
	Status: Cap- 66MHz+ UDF- FastB2B+ ParErr- DEVSEL=medium >TAbort- <TAbort- <MAbort- >SERR- <PERR- INTx-
	Latency: 32, Cache Line Size: 64 bytes
	Interrupt: pin A routed to IRQ 18
	Region 0: Memory at feb70000 (32-bit, non-prefetchable) [size=4K]
	Kernel driver in use: ohci-pci

00:12.2 USB controller [0c03]: Advanced Micro Devices, Inc. [AMD] FCH USB EHCI Controller [1022:7808] (rev 11) (prog-if 20 [EHCI])
	Subsystem: ASRock Incorporation QC5000-ITX/PH [1849:7808]
	Control: I/O+ Mem+ BusMaster+ SpecCycle- MemWINV+ VGASnoop- ParErr- Stepping- SERR- FastB2B- DisINTx-
	Status: Cap+ 66MHz+ UDF- FastB2B+ ParErr- DEVSEL=medium >TAbort- <TAbort- <MAbort- >SERR- <PERR- INTx-
	Latency: 32, Cache Line Size: 64 bytes
	Interrupt: pin B routed to IRQ 17
	Region 0: Memory at feb6f000 (32-bit, non-prefetchable) [size=256]
	Capabilities: <access denied>
	Kernel driver in use: ehci-pci

00:13.0 USB controller [0c03]: Advanced Micro Devices, Inc. [AMD] FCH USB OHCI Controller [1022:7807] (rev 11) (prog-if 10 [OHCI])
	Subsystem: ASRock Incorporation QC5000-ITX/PH [1849:7807]
	Control: I/O+ Mem+ BusMaster+ SpecCycle- MemWINV- VGASnoop- ParErr- Stepping- SERR- FastB2B- DisINTx-
	Status: Cap- 66MHz+ UDF- FastB2B+ ParErr- DEVSEL=medium >TAbort- <TAbort- <MAbort- >SERR- <PERR- INTx-
	Latency: 32, Cache Line Size: 64 bytes
	Interrupt: pin A routed to IRQ 18
	Region 0: Memory at feb6e000 (32-bit, non-prefetchable) [size=4K]
	Kernel driver in use: ohci-pci

00:13.2 USB controller [0c03]: Advanced Micro Devices, Inc. [AMD] FCH USB EHCI Controller [1022:7808] (rev 11) (prog-if 20 [EHCI])
	Subsystem: ASRock Incorporation QC5000-ITX/PH [1849:7808]
	Control: I/O+ Mem+ BusMaster+ SpecCycle- MemWINV+ VGASnoop- ParErr- Stepping- SERR- FastB2B- DisINTx-
	Status: Cap+ 66MHz+ UDF- FastB2B+ ParErr- DEVSEL=medium >TAbort- <TAbort- <MAbort- >SERR- <PERR- INTx-
	Latency: 32, Cache Line Size: 64 bytes
	Interrupt: pin B routed to IRQ 17
	Region 0: Memory at feb6d000 (32-bit, non-prefetchable) [size=256]
	Capabilities: <access denied>
	Kernel driver in use: ehci-pci

00:14.0 SMBus [0c05]: Advanced Micro Devices, Inc. [AMD] FCH SMBus Controller [1022:780b] (rev 16)
	Subsystem: ASRock Incorporation QC5000-ITX/PH [1849:780b]
	Control: I/O+ Mem+ BusMaster- SpecCycle- MemWINV- VGASnoop- ParErr- Stepping- SERR- FastB2B- DisINTx+
	Status: Cap- 66MHz+ UDF- FastB2B- ParErr- DEVSEL=medium >TAbort- <TAbort- <MAbort- >SERR- <PERR- INTx-
	Kernel driver in use: piix4_smbus
	Kernel modules: i2c_piix4, sp5100_tco

00:14.2 Audio device [0403]: Advanced Micro Devices, Inc. [AMD] FCH Azalia Controller [1022:780d] (rev 01)
	Subsystem: ASRock Incorporation Device [1849:1151]
	Control: I/O- Mem+ BusMaster+ SpecCycle- MemWINV- VGASnoop- ParErr- Stepping- SERR- FastB2B- DisINTx-
	Status: Cap+ 66MHz- UDF- FastB2B- ParErr- DEVSEL=slow >TAbort- <TAbort- <MAbort- >SERR- <PERR- INTx-
	Latency: 32, Cache Line Size: 64 bytes
	Interrupt: pin A routed to IRQ 16
	Region 0: Memory at feb60000 (64-bit, non-prefetchable) [size=16K]
	Capabilities: <access denied>
	Kernel driver in use: snd_hda_intel
	Kernel modules: snd_hda_intel

00:14.3 ISA bridge [0601]: Advanced Micro Devices, Inc. [AMD] FCH LPC Bridge [1022:780e] (rev 11)
	Subsystem: ASRock Incorporation QC5000-ITX/PH [1849:780e]
	Control: I/O+ Mem+ BusMaster+ SpecCycle+ MemWINV- VGASnoop- ParErr- Stepping- SERR- FastB2B- DisINTx-
	Status: Cap- 66MHz+ UDF- FastB2B- ParErr- DEVSEL=medium >TAbort- <TAbort- <MAbort- >SERR- <PERR- INTx-
	Latency: 0

00:14.4 PCI bridge [0604]: Advanced Micro Devices, Inc. [AMD] FCH PCI Bridge [1022:780f] (rev 40) (prog-if 01 [Subtractive decode])
	Control: I/O+ Mem+ BusMaster+ SpecCycle- MemWINV- VGASnoop- ParErr- Stepping- SERR- FastB2B- DisINTx-
	Status: Cap- 66MHz+ UDF- FastB2B+ ParErr- DEVSEL=medium >TAbort- <TAbort- <MAbort- >SERR- <PERR- INTx-
	Latency: 64
	Bus: primary=00, secondary=01, subordinate=01, sec-latency=64
	I/O behind bridge: None
	Memory behind bridge: None
	Prefetchable memory behind bridge: None
	Secondary status: 66MHz- FastB2B+ ParErr- DEVSEL=medium >TAbort- <TAbort- <MAbort+ <SERR- <PERR-
	BridgeCtl: Parity- SERR+ NoISA- VGA- VGA16+ MAbort- >Reset- FastB2B-
		PriDiscTmr- SecDiscTmr- DiscTmrStat- DiscTmrSERREn-

00:14.5 USB controller [0c03]: Advanced Micro Devices, Inc. [AMD] FCH USB OHCI Controller [1022:7809] (rev 11) (prog-if 10 [OHCI])
	Subsystem: ASRock Incorporation Device [1849:7809]
	Control: I/O+ Mem+ BusMaster+ SpecCycle- MemWINV- VGASnoop- ParErr- Stepping- SERR- FastB2B- DisINTx-
	Status: Cap- 66MHz+ UDF- FastB2B+ ParErr- DEVSEL=medium >TAbort- <TAbort- <MAbort- >SERR- <PERR- INTx-
	Latency: 32, Cache Line Size: 64 bytes
	Interrupt: pin C routed to IRQ 18
	Region 0: Memory at feb6c000 (32-bit, non-prefetchable) [size=4K]
	Kernel driver in use: ohci-pci

00:15.0 PCI bridge [0604]: Advanced Micro Devices, Inc. [AMD] Hudson PCI to PCI bridge (PCIE port 0) [1022:43a0] (prog-if 00 [Normal decode])
	Control: I/O+ Mem+ BusMaster+ SpecCycle- MemWINV- VGASnoop- ParErr- Stepping- SERR- FastB2B- DisINTx+
	Status: Cap+ 66MHz- UDF- FastB2B- ParErr- DEVSEL=fast >TAbort- <TAbort- <MAbort- >SERR- <PERR- INTx-
	Latency: 0, Cache Line Size: 64 bytes
	Interrupt: pin A routed to IRQ 24
	Bus: primary=00, secondary=02, subordinate=02, sec-latency=0
	I/O behind bridge: None
	Memory behind bridge: None
	Prefetchable memory behind bridge: None
	Secondary status: 66MHz- FastB2B- ParErr- DEVSEL=fast >TAbort- <TAbort- <MAbort- <SERR- <PERR-
	BridgeCtl: Parity- SERR+ NoISA- VGA- VGA16+ MAbort- >Reset- FastB2B-
		PriDiscTmr- SecDiscTmr- DiscTmrStat- DiscTmrSERREn-
	Capabilities: <access denied>
	Kernel driver in use: pcieport

00:15.2 PCI bridge [0604]: Advanced Micro Devices, Inc. [AMD] Hudson PCI to PCI bridge (PCIE port 2) [1022:43a2] (prog-if 00 [Normal decode])
	Control: I/O+ Mem+ BusMaster+ SpecCycle- MemWINV- VGASnoop- ParErr- Stepping- SERR- FastB2B- DisINTx+
	Status: Cap+ 66MHz- UDF- FastB2B- ParErr- DEVSEL=fast >TAbort- <TAbort- <MAbort- >SERR- <PERR- INTx-
	Latency: 0, Cache Line Size: 64 bytes
	Interrupt: pin A routed to IRQ 25
	Bus: primary=00, secondary=03, subordinate=03, sec-latency=0
	I/O behind bridge: None
	Memory behind bridge: fea00000-feafffff [size=1M]
	Prefetchable memory behind bridge: None
	Secondary status: 66MHz- FastB2B- ParErr- DEVSEL=fast >TAbort- <TAbort- <MAbort- <SERR- <PERR-
	BridgeCtl: Parity- SERR+ NoISA- VGA- VGA16+ MAbort- >Reset- FastB2B-
		PriDiscTmr- SecDiscTmr- DiscTmrStat- DiscTmrSERREn-
	Capabilities: <access denied>
	Kernel driver in use: pcieport

00:15.3 PCI bridge [0604]: Advanced Micro Devices, Inc. [AMD] Hudson PCI to PCI bridge (PCIE port 3) [1022:43a3] (prog-if 00 [Normal decode])
	Control: I/O+ Mem+ BusMaster+ SpecCycle- MemWINV- VGASnoop- ParErr- Stepping- SERR- FastB2B- DisINTx+
	Status: Cap+ 66MHz- UDF- FastB2B- ParErr- DEVSEL=fast >TAbort- <TAbort- <MAbort- >SERR- <PERR- INTx-
	Latency: 0, Cache Line Size: 64 bytes
	Interrupt: pin A routed to IRQ 26
	Bus: primary=00, secondary=04, subordinate=04, sec-latency=0
	I/O behind bridge: 0000e000-0000efff [size=4K]
	Memory behind bridge: fe900000-fe9fffff [size=1M]
	Prefetchable memory behind bridge: None
	Secondary status: 66MHz- FastB2B- ParErr- DEVSEL=fast >TAbort- <TAbort- <MAbort- <SERR- <PERR-
	BridgeCtl: Parity- SERR+ NoISA- VGA- VGA16+ MAbort- >Reset- FastB2B-
		PriDiscTmr- SecDiscTmr- DiscTmrStat- DiscTmrSERREn-
	Capabilities: <access denied>
	Kernel driver in use: pcieport

00:18.0 Host bridge [0600]: Advanced Micro Devices, Inc. [AMD] Family 15h (Models 30h-3fh) Processor Function 0 [1022:141a]
	Control: I/O- Mem- BusMaster- SpecCycle- MemWINV- VGASnoop- ParErr- Stepping- SERR- FastB2B- DisINTx-
	Status: Cap+ 66MHz- UDF- FastB2B- ParErr- DEVSEL=fast >TAbort- <TAbort- <MAbort- >SERR- <PERR- INTx-

00:18.1 Host bridge [0600]: Advanced Micro Devices, Inc. [AMD] Family 15h (Models 30h-3fh) Processor Function 1 [1022:141b]
	Control: I/O- Mem- BusMaster- SpecCycle- MemWINV- VGASnoop- ParErr- Stepping- SERR- FastB2B- DisINTx-
	Status: Cap- 66MHz- UDF- FastB2B- ParErr- DEVSEL=fast >TAbort- <TAbort- <MAbort- >SERR- <PERR- INTx-

00:18.2 Host bridge [0600]: Advanced Micro Devices, Inc. [AMD] Family 15h (Models 30h-3fh) Processor Function 2 [1022:141c]
	Control: I/O- Mem- BusMaster- SpecCycle- MemWINV- VGASnoop- ParErr- Stepping- SERR- FastB2B- DisINTx-
	Status: Cap- 66MHz- UDF- FastB2B- ParErr- DEVSEL=fast >TAbort- <TAbort- <MAbort- >SERR- <PERR- INTx-

00:18.3 Host bridge [0600]: Advanced Micro Devices, Inc. [AMD] Family 15h (Models 30h-3fh) Processor Function 3 [1022:141d]
	Control: I/O- Mem- BusMaster- SpecCycle- MemWINV- VGASnoop- ParErr- Stepping- SERR- FastB2B- DisINTx-
	Status: Cap+ 66MHz- UDF- FastB2B- ParErr- DEVSEL=fast >TAbort- <TAbort- <MAbort- >SERR- <PERR- INTx-
	Capabilities: <access denied>
	Kernel driver in use: k10temp
	Kernel modules: k10temp

00:18.4 Host bridge [0600]: Advanced Micro Devices, Inc. [AMD] Family 15h (Models 30h-3fh) Processor Function 4 [1022:141e]
	Control: I/O- Mem- BusMaster- SpecCycle- MemWINV- VGASnoop- ParErr- Stepping- SERR- FastB2B- DisINTx-
	Status: Cap- 66MHz- UDF- FastB2B- ParErr- DEVSEL=fast >TAbort- <TAbort- <MAbort- >SERR- <PERR- INTx-
	Kernel driver in use: fam15h_power
	Kernel modules: fam15h_power

00:18.5 Host bridge [0600]: Advanced Micro Devices, Inc. [AMD] Family 15h (Models 30h-3fh) Processor Function 5 [1022:141f]
	Control: I/O- Mem- BusMaster- SpecCycle- MemWINV- VGASnoop- ParErr- Stepping- SERR- FastB2B- DisINTx-
	Status: Cap- 66MHz- UDF- FastB2B- ParErr- DEVSEL=fast >TAbort- <TAbort- <MAbort- >SERR- <PERR- INTx-

03:00.0 USB controller [0c03]: ASMedia Technology Inc. ASM1042 SuperSpeed USB Host Controller [1b21:1042] (prog-if 30 [XHCI])
	Subsystem: ASRock Incorporation Motherboard [1849:1042]
	Control: I/O- Mem+ BusMaster+ SpecCycle- MemWINV- VGASnoop- ParErr- Stepping- SERR- FastB2B- DisINTx+
	Status: Cap+ 66MHz- UDF- FastB2B- ParErr- DEVSEL=fast >TAbort- <TAbort- <MAbort- >SERR- <PERR- INTx-
	Latency: 0, Cache Line Size: 64 bytes
	Interrupt: pin A routed to IRQ 16
	Region 0: Memory at fea00000 (64-bit, non-prefetchable) [size=32K]
	Capabilities: <access denied>
	Kernel driver in use: xhci_hcd

04:00.0 Ethernet controller [0200]: Qualcomm Atheros QCA8171 Gigabit Ethernet [1969:10a1] (rev 10)
	Subsystem: ASRock Incorporation Device [1849:10a1]
	Control: I/O+ Mem+ BusMaster+ SpecCycle- MemWINV- VGASnoop- ParErr- Stepping- SERR- FastB2B- DisINTx-
	Status: Cap+ 66MHz- UDF- FastB2B- ParErr- DEVSEL=fast >TAbort- <TAbort- <MAbort- >SERR- <PERR- INTx-
	Latency: 0, Cache Line Size: 64 bytes
	Interrupt: pin A routed to IRQ 19
	Region 0: Memory at fe900000 (64-bit, non-prefetchable) [size=256K]
	Region 2: I/O ports at e000 [size=128]
	Capabilities: <access denied>
	Kernel driver in use: alx
	Kernel modules: alx

