00:00.0 Host bridge [0600]: Intel Corporation Core Processor DRAM Controller [8086:0044] (rev 12)
	Subsystem: Dell Device [1028:0434]
	Control: I/O- Mem+ BusMaster+ SpecCycle- MemWINV- VGASnoop- ParErr- Stepping- SERR+ FastB2B- DisINTx-
	Status: Cap+ 66MHz- UDF- FastB2B+ ParErr- DEVSEL=fast >TAbort- <TAbort- <MAbort+ >SERR- <PERR- INTx-
	Latency: 0
	Capabilities: <access denied>

00:02.0 VGA compatible controller [0300]: Intel Corporation Core Processor Integrated Graphics Controller [8086:0046] (rev 12) (prog-if 00 [VGA controller])
	Subsystem: Dell Device [1028:0434]
	Control: I/O+ Mem+ BusMaster+ SpecCycle- MemWINV- VGASnoop- ParErr- Stepping- SERR- FastB2B- DisINTx+
	Status: Cap+ 66MHz- UDF- FastB2B+ ParErr- DEVSEL=fast >TAbort- <TAbort- <MAbort- >SERR- <PERR- INTx-
	Latency: 0
	Interrupt: pin A routed to IRQ 27
	Region 0: Memory at f0000000 (64-bit, non-prefetchable) [size=4M]
	Region 2: Memory at d0000000 (64-bit, prefetchable) [size=256M]
	Region 4: I/O ports at 1800 [size=8]
	[virtual] Expansion ROM at 000c0000 [disabled] [size=128K]
	Capabilities: <access denied>
	Kernel driver in use: i915
	Kernel modules: i915

00:16.0 Communication controller [0780]: Intel Corporation 5 Series/3400 Series Chipset HECI Controller [8086:3b64] (rev 06)
	Subsystem: Dell Device [1028:0434]
	Control: I/O- Mem+ BusMaster+ SpecCycle- MemWINV- VGASnoop- ParErr- Stepping- SERR- FastB2B- DisINTx+
	Status: Cap+ 66MHz- UDF- FastB2B- ParErr- DEVSEL=fast >TAbort- <TAbort- <MAbort- >SERR- <PERR- INTx-
	Latency: 0
	Interrupt: pin A routed to IRQ 28
	Region 0: Memory at f0705800 (64-bit, non-prefetchable) [size=16]
	Capabilities: <access denied>
	Kernel driver in use: mei_me
	Kernel modules: mei_me

00:1a.0 USB controller [0c03]: Intel Corporation 5 Series/3400 Series Chipset USB2 Enhanced Host Controller [8086:3b3c] (rev 06) (prog-if 20 [EHCI])
	Subsystem: Dell Device [1028:0434]
	Control: I/O- Mem+ BusMaster+ SpecCycle- MemWINV- VGASnoop- ParErr- Stepping- SERR+ FastB2B- DisINTx-
	Status: Cap+ 66MHz- UDF- FastB2B+ ParErr- DEVSEL=medium >TAbort- <TAbort- <MAbort- >SERR- <PERR- INTx-
	Latency: 0
	Interrupt: pin A routed to IRQ 16
	Region 0: Memory at f0706000 (32-bit, non-prefetchable) [size=1K]
	Capabilities: <access denied>
	Kernel driver in use: ehci-pci

00:1b.0 Audio device [0403]: Intel Corporation 5 Series/3400 Series Chipset High Definition Audio [8086:3b56] (rev 06)
	Subsystem: Dell Device [1028:0434]
	Control: I/O- Mem+ BusMaster+ SpecCycle- MemWINV- VGASnoop- ParErr- Stepping- SERR+ FastB2B- DisINTx+
	Status: Cap+ 66MHz- UDF- FastB2B- ParErr- DEVSEL=fast >TAbort- <TAbort- <MAbort- >SERR- <PERR- INTx-
	Latency: 0, Cache Line Size: 64 bytes
	Interrupt: pin A routed to IRQ 29
	Region 0: Memory at f0500000 (64-bit, non-prefetchable) [size=16K]
	Capabilities: <access denied>
	Kernel driver in use: snd_hda_intel
	Kernel modules: snd_hda_intel

00:1c.0 PCI bridge [0604]: Intel Corporation 5 Series/3400 Series Chipset PCI Express Root Port 1 [8086:3b42] (rev 06) (prog-if 00 [Normal decode])
	Control: I/O+ Mem+ BusMaster+ SpecCycle- MemWINV- VGASnoop- ParErr- Stepping- SERR+ FastB2B- DisINTx+
	Status: Cap+ 66MHz- UDF- FastB2B- ParErr- DEVSEL=fast >TAbort- <TAbort- <MAbort- >SERR- <PERR- INTx-
	Latency: 0, Cache Line Size: 64 bytes
	Interrupt: pin A routed to IRQ 24
	Bus: primary=00, secondary=02, subordinate=02, sec-latency=0
	I/O behind bridge: 00002000-00002fff [size=4K]
	Memory behind bridge: c0000000-c01fffff [size=2M]
	Prefetchable memory behind bridge: 00000000c0200000-00000000c03fffff [size=2M]
	Secondary status: 66MHz- FastB2B- ParErr- DEVSEL=fast >TAbort- <TAbort- <MAbort+ <SERR- <PERR-
	BridgeCtl: Parity- SERR+ NoISA+ VGA- VGA16- MAbort- >Reset- FastB2B-
		PriDiscTmr- SecDiscTmr- DiscTmrStat- DiscTmrSERREn-
	Capabilities: <access denied>
	Kernel driver in use: pcieport

00:1c.1 PCI bridge [0604]: Intel Corporation 5 Series/3400 Series Chipset PCI Express Root Port 2 [8086:3b44] (rev 06) (prog-if 00 [Normal decode])
	Control: I/O+ Mem+ BusMaster+ SpecCycle- MemWINV- VGASnoop- ParErr- Stepping- SERR+ FastB2B- DisINTx+
	Status: Cap+ 66MHz- UDF- FastB2B- ParErr- DEVSEL=fast >TAbort- <TAbort- <MAbort- >SERR- <PERR- INTx-
	Latency: 0, Cache Line Size: 64 bytes
	Interrupt: pin B routed to IRQ 25
	Bus: primary=00, secondary=03, subordinate=03, sec-latency=0
	I/O behind bridge: 00003000-00003fff [size=4K]
	Memory behind bridge: f0400000-f04fffff [size=1M]
	Prefetchable memory behind bridge: 00000000c0400000-00000000c05fffff [size=2M]
	Secondary status: 66MHz- FastB2B- ParErr- DEVSEL=fast >TAbort- <TAbort- <MAbort+ <SERR- <PERR-
	BridgeCtl: Parity- SERR+ NoISA+ VGA- VGA16- MAbort- >Reset- FastB2B-
		PriDiscTmr- SecDiscTmr- DiscTmrStat- DiscTmrSERREn-
	Capabilities: <access denied>
	Kernel driver in use: pcieport

00:1d.0 USB controller [0c03]: Intel Corporation 5 Series/3400 Series Chipset USB2 Enhanced Host Controller [8086:3b34] (rev 06) (prog-if 20 [EHCI])
	Subsystem: Dell Device [1028:0434]
	Control: I/O- Mem+ BusMaster+ SpecCycle- MemWINV- VGASnoop- ParErr- Stepping- SERR+ FastB2B- DisINTx-
	Status: Cap+ 66MHz- UDF- FastB2B+ ParErr- DEVSEL=medium >TAbort- <TAbort- <MAbort- >SERR- <PERR- INTx-
	Latency: 0
	Interrupt: pin A routed to IRQ 23
	Region 0: Memory at f0706400 (32-bit, non-prefetchable) [size=1K]
	Capabilities: <access denied>
	Kernel driver in use: ehci-pci

00:1e.0 PCI bridge [0604]: Intel Corporation 82801 Mobile PCI Bridge [8086:2448] (rev a6) (prog-if 01 [Subtractive decode])
	Control: I/O+ Mem+ BusMaster+ SpecCycle- MemWINV- VGASnoop- ParErr- Stepping- SERR+ FastB2B- DisINTx-
	Status: Cap+ 66MHz- UDF- FastB2B- ParErr- DEVSEL=fast >TAbort- <TAbort- <MAbort- >SERR- <PERR- INTx-
	Latency: 0
	Bus: primary=00, secondary=04, subordinate=04, sec-latency=0
	I/O behind bridge: None
	Memory behind bridge: None
	Prefetchable memory behind bridge: None
	Secondary status: 66MHz- FastB2B+ ParErr- DEVSEL=medium >TAbort- <TAbort- <MAbort+ <SERR- <PERR-
	BridgeCtl: Parity- SERR+ NoISA+ VGA- VGA16- MAbort- >Reset- FastB2B-
		PriDiscTmr- SecDiscTmr- DiscTmrStat- DiscTmrSERREn-
	Capabilities: <access denied>

00:1f.0 ISA bridge [0601]: Intel Corporation HM55 Chipset LPC Interface Controller [8086:3b09] (rev 06)
	Subsystem: Dell Device [1028:0434]
	Control: I/O+ Mem+ BusMaster+ SpecCycle- MemWINV- VGASnoop- ParErr- Stepping- SERR- FastB2B- DisINTx-
	Status: Cap+ 66MHz- UDF- FastB2B- ParErr- DEVSEL=medium >TAbort- <TAbort- <MAbort- >SERR- <PERR- INTx-
	Latency: 0
	Capabilities: <access denied>
	Kernel driver in use: lpc_ich
	Kernel modules: lpc_ich

00:1f.2 SATA controller [0106]: Intel Corporation 5 Series/3400 Series Chipset 4 port SATA AHCI Controller [8086:3b29] (rev 06) (prog-if 01 [AHCI 1.0])
	Subsystem: Dell Device [1028:0434]
	Control: I/O+ Mem+ BusMaster+ SpecCycle- MemWINV- VGASnoop- ParErr- Stepping- SERR- FastB2B- DisINTx+
	Status: Cap+ 66MHz+ UDF- FastB2B+ ParErr- DEVSEL=medium >TAbort- <TAbort- <MAbort- >SERR- <PERR- INTx-
	Latency: 0
	Interrupt: pin B routed to IRQ 26
	Region 0: I/O ports at 1818 [size=8]
	Region 1: I/O ports at 180c [size=4]
	Region 2: I/O ports at 1810 [size=8]
	Region 3: I/O ports at 1808 [size=4]
	Region 4: I/O ports at 1820 [size=32]
	Region 5: Memory at f0705000 (32-bit, non-prefetchable) [size=2K]
	Capabilities: <access denied>
	Kernel driver in use: ahci
	Kernel modules: ahci

00:1f.3 SMBus [0c05]: Intel Corporation 5 Series/3400 Series Chipset SMBus Controller [8086:3b30] (rev 06)
	Subsystem: Dell Device [1028:0434]
	Control: I/O+ Mem+ BusMaster- SpecCycle- MemWINV- VGASnoop- ParErr- Stepping- SERR+ FastB2B- DisINTx-
	Status: Cap- 66MHz- UDF- FastB2B+ ParErr- DEVSEL=medium >TAbort- <TAbort- <MAbort- >SERR- <PERR- INTx-
	Interrupt: pin C routed to IRQ 18
	Region 0: Memory at f0706800 (64-bit, non-prefetchable) [size=256]
	Region 4: I/O ports at 1840 [size=32]
	Kernel driver in use: i801_smbus
	Kernel modules: i2c_i801

00:1f.6 Signal processing controller [1180]: Intel Corporation 5 Series/3400 Series Chipset Thermal Subsystem [8086:3b32] (rev 06)
	Subsystem: Dell Device [1028:0434]
	Control: I/O- Mem+ BusMaster- SpecCycle- MemWINV- VGASnoop- ParErr- Stepping- SERR- FastB2B- DisINTx-
	Status: Cap+ 66MHz- UDF- FastB2B- ParErr- DEVSEL=fast >TAbort- <TAbort- <MAbort- >SERR- <PERR- INTx-
	Interrupt: pin C routed to IRQ 18
	Region 0: Memory at f0504000 (64-bit, non-prefetchable) [size=4K]
	Capabilities: <access denied>
	Kernel driver in use: intel ips
	Kernel modules: intel_ips

03:00.0 Network controller [0280]: Qualcomm Atheros AR9285 Wireless Network Adapter (PCI-Express) [168c:002b] (rev 01)
	Subsystem: Wistron NeWeb Corp. Device [185f:30a1]
	Control: I/O+ Mem+ BusMaster+ SpecCycle- MemWINV- VGASnoop- ParErr- Stepping- SERR+ FastB2B- DisINTx-
	Status: Cap+ 66MHz- UDF- FastB2B- ParErr- DEVSEL=fast >TAbort- <TAbort- <MAbort- >SERR- <PERR- INTx-
	Latency: 0, Cache Line Size: 64 bytes
	Interrupt: pin A routed to IRQ 17
	Region 0: Memory at f0400000 (64-bit, non-prefetchable) [size=64K]
	Capabilities: <access denied>
	Kernel driver in use: ath9k
	Kernel modules: ath9k

ff:00.0 Host bridge [0600]: Intel Corporation Core Processor QuickPath Architecture Generic Non-core Registers [8086:2c62] (rev 02)
	Subsystem: Intel Corporation Device [8086:8086]
	Control: I/O- Mem+ BusMaster+ SpecCycle- MemWINV- VGASnoop- ParErr- Stepping- SERR- FastB2B- DisINTx-
	Status: Cap- 66MHz- UDF- FastB2B- ParErr- DEVSEL=fast >TAbort- <TAbort- <MAbort- >SERR- <PERR- INTx-
	Latency: 0

ff:00.1 Host bridge [0600]: Intel Corporation Core Processor QuickPath Architecture System Address Decoder [8086:2d01] (rev 02)
	Subsystem: Intel Corporation Device [8086:8086]
	Control: I/O- Mem+ BusMaster+ SpecCycle- MemWINV- VGASnoop- ParErr- Stepping- SERR- FastB2B- DisINTx-
	Status: Cap- 66MHz- UDF- FastB2B- ParErr- DEVSEL=fast >TAbort- <TAbort- <MAbort- >SERR- <PERR- INTx-
	Latency: 0

ff:02.0 Host bridge [0600]: Intel Corporation Core Processor QPI Link 0 [8086:2d10] (rev 02)
	Subsystem: Intel Corporation Device [8086:8086]
	Control: I/O- Mem+ BusMaster+ SpecCycle- MemWINV- VGASnoop- ParErr- Stepping- SERR- FastB2B- DisINTx-
	Status: Cap- 66MHz- UDF- FastB2B- ParErr- DEVSEL=fast >TAbort- <TAbort- <MAbort- >SERR- <PERR- INTx-
	Latency: 0

ff:02.1 Host bridge [0600]: Intel Corporation 1st Generation Core i3/5/7 Processor QPI Physical 0 [8086:2d11] (rev 02)
	Subsystem: Intel Corporation Device [8086:8086]
	Control: I/O- Mem+ BusMaster+ SpecCycle- MemWINV- VGASnoop- ParErr- Stepping- SERR- FastB2B- DisINTx-
	Status: Cap- 66MHz- UDF- FastB2B- ParErr- DEVSEL=fast >TAbort- <TAbort- <MAbort- >SERR- <PERR- INTx-
	Latency: 0

ff:02.2 Host bridge [0600]: Intel Corporation 1st Generation Core i3/5/7 Processor Reserved [8086:2d12] (rev 02)
	Subsystem: Intel Corporation Device [8086:8086]
	Control: I/O- Mem+ BusMaster+ SpecCycle- MemWINV- VGASnoop- ParErr- Stepping- SERR- FastB2B- DisINTx-
	Status: Cap- 66MHz- UDF- FastB2B- ParErr- DEVSEL=fast >TAbort- <TAbort- <MAbort- >SERR- <PERR- INTx-
	Latency: 0

ff:02.3 Host bridge [0600]: Intel Corporation 1st Generation Core i3/5/7 Processor Reserved [8086:2d13] (rev 02)
	Subsystem: Intel Corporation Device [8086:8086]
	Control: I/O- Mem+ BusMaster+ SpecCycle- MemWINV- VGASnoop- ParErr- Stepping- SERR- FastB2B- DisINTx-
	Status: Cap- 66MHz- UDF- FastB2B- ParErr- DEVSEL=fast >TAbort- <TAbort- <MAbort- >SERR- <PERR- INTx-
	Latency: 0

