00:00.0 PCI bridge [0604]: Apple Inc. Device [106b:100c] (rev 01) (prog-if 00 [Normal decode])
	Device tree node: /sys/firmware/devicetree/base/soc/pcie@690000000/pci@0,0
	Control: I/O- Mem+ BusMaster+ SpecCycle- MemWINV- VGASnoop- ParErr- Stepping- SERR- FastB2B- DisINTx+
	Status: Cap+ 66MHz- UDF- FastB2B- ParErr- DEVSEL=fast >TAbort- <TAbort- <MAbort- >SERR- <PERR- INTx-
	Latency: 0, Cache Line Size: 32 bytes
	Interrupt: pin A routed to IRQ 101
	Bus: primary=00, secondary=01, subordinate=01, sec-latency=0
	I/O behind bridge: [disabled]
	Memory behind bridge: c0000000-c0dfffff [size=14M]
	Prefetchable memory behind bridge: [disabled]
	Secondary status: 66MHz- FastB2B- ParErr- DEVSEL=fast >TAbort- <TAbort- <MAbort- <SERR- <PERR-
	BridgeCtl: Parity- SERR+ NoISA- VGA- VGA16- MAbort- >Reset- FastB2B-
		PriDiscTmr- SecDiscTmr- DiscTmrStat- DiscTmrSERREn-
	Capabilities: <access denied>
	Kernel driver in use: pcieport

01:00.0 Network controller [0280]: Broadcom Inc. and subsidiaries Device [14e4:4425] (rev 03)
	Subsystem: Apple Inc. Device [106b:4378]
	Device tree node: /sys/firmware/devicetree/base/soc/pcie@690000000/pci@0,0/network@0,0
	Control: I/O- Mem+ BusMaster+ SpecCycle- MemWINV- VGASnoop- ParErr- Stepping- SERR- FastB2B- DisINTx+
	Status: Cap+ 66MHz- UDF- FastB2B- ParErr- DEVSEL=fast >TAbort- <TAbort- <MAbort- >SERR- <PERR- INTx-
	Latency: 0
	Interrupt: pin A routed to IRQ 105
	IOMMU group: 7
	Region 0: Memory at 6c0c00000 (64-bit, non-prefetchable) [size=64K]
	Region 2: Memory at 6c0000000 (64-bit, non-prefetchable) [size=8M]
	Capabilities: <access denied>
	Kernel driver in use: brcmfmac

01:00.1 Network controller [0280]: Broadcom Inc. and subsidiaries Device [14e4:5f69] (rev 03)
	Subsystem: Apple Inc. Device [106b:4378]
	Device tree node: /sys/firmware/devicetree/base/soc/pcie@690000000/pci@0,0/bluetooth@0,1
	Control: I/O- Mem+ BusMaster+ SpecCycle- MemWINV- VGASnoop- ParErr- Stepping- SERR- FastB2B- DisINTx+
	Status: Cap+ 66MHz- UDF- FastB2B- ParErr- DEVSEL=fast >TAbort- <TAbort- <MAbort- >SERR- <PERR- INTx-
	Latency: 0
	Interrupt: pin B routed to IRQ 106
	IOMMU group: 7
	Region 0: Memory at 6c0c10000 (64-bit, non-prefetchable) [size=32K]
	Region 2: Memory at 6c0800000 (64-bit, non-prefetchable) [size=4M]
	Capabilities: <access denied>
	Kernel driver in use: hci_bcm4377

