00:00.0 RAM memory [0500]: NVIDIA Corporation MCP65 Memory Controller [10de:0444] (rev a1)
	Subsystem: ABIT Computer Corp. Device [147b:1c36]
	Control: I/O- Mem+ BusMaster+ SpecCycle- MemWINV- VGASnoop- ParErr- Stepping- SERR- FastB2B- DisINTx-
	Status: Cap+ 66MHz+ UDF- FastB2B+ ParErr- DEVSEL=fast >TAbort- <TAbort- <MAbort- >SERR- <PERR- INTx-
	Latency: 0
	Capabilities: [44] HyperTransport: Slave or Primary Interface
		Command: BaseUnitID=0 UnitCnt=15 MastHost- DefDir- DUL-
		Link Control 0: CFlE- CST- CFE- <LkFail- Init+ EOC- TXO- <CRCErr=0 IsocEn- LSEn- ExtCTL- 64b-
		Link Config 0: MLWI=16bit DwFcIn- MLWO=16bit DwFcOut- LWI=16bit DwFcInEn- LWO=16bit DwFcOutEn-
		Link Control 1: CFlE- CST- CFE- <LkFail+ Init- EOC+ TXO+ <CRCErr=0 IsocEn- LSEn- ExtCTL- 64b-
		Link Config 1: MLWI=8bit DwFcIn- MLWO=8bit DwFcOut- LWI=8bit DwFcInEn- LWO=8bit DwFcOutEn-
		Revision ID: 1.03
		Link Frequency 0: 1.0GHz
		Link Error 0: <Prot- <Ovfl- <EOC- CTLTm-
		Link Frequency Capability 0: 200MHz+ 300MHz+ 400MHz+ 500MHz+ 600MHz+ 800MHz+ 1.0GHz+ 1.2GHz- 1.4GHz- 1.6GHz- Vend-
		Feature Capability: IsocFC+ LDTSTOP+ CRCTM- ECTLT- 64bA- UIDRD-
		Link Frequency 1: 200MHz
		Link Error 1: <Prot- <Ovfl- <EOC- CTLTm-
		Link Frequency Capability 1: 200MHz- 300MHz- 400MHz- 500MHz- 600MHz- 800MHz- 1.0GHz- 1.2GHz- 1.4GHz- 1.6GHz- Vend-
		Error Handling: PFlE+ OFlE+ PFE- OFE- EOCFE- RFE- CRCFE- SERRFE- CF- RE- PNFE- ONFE- EOCNFE- RNFE- CRCNFE- SERRNFE-
		Prefetchable memory behind bridge Upper: 00-00
		Bus Number: 00
	Capabilities: [dc] HyperTransport: MSI Mapping Enable+ Fixed-
		Mapping Address Base: 00000000fee00000

00:01.0 ISA bridge [0601]: NVIDIA Corporation MCP65 LPC Bridge [10de:0441] (rev a2)
	Subsystem: ABIT Computer Corp. Device [147b:1c36]
	Control: I/O+ Mem+ BusMaster+ SpecCycle+ MemWINV- VGASnoop- ParErr- Stepping- SERR- FastB2B- DisINTx-
	Status: Cap- 66MHz+ UDF- FastB2B+ ParErr- DEVSEL=fast >TAbort- <TAbort- <MAbort+ >SERR- <PERR- INTx-
	Latency: 0
	Region 2: I/O ports at 0800 [size=256]

00:01.1 SMBus [0c05]: NVIDIA Corporation MCP65 SMBus [10de:0446] (rev a1)
	Subsystem: ABIT Computer Corp. Device [147b:1c36]
	Control: I/O+ Mem- BusMaster- SpecCycle- MemWINV- VGASnoop- ParErr- Stepping- SERR- FastB2B- DisINTx-
	Status: Cap+ 66MHz+ UDF- FastB2B+ ParErr- DEVSEL=fast >TAbort- <TAbort- <MAbort- >SERR- <PERR- INTx-
	Interrupt: pin A routed to IRQ 11
	Region 0: I/O ports at fc00 [size=64]
	Region 4: I/O ports at 1c00 [size=64]
	Region 5: I/O ports at f400 [size=64]
	Capabilities: [44] Power Management version 2
		Flags: PMEClk- DSI- D1- D2- AuxCurrent=0mA PME(D0-,D1-,D2-,D3hot+,D3cold+)
		Status: D0 NoSoftRst- PME-Enable- DSel=0 DScale=0 PME-
	Kernel driver in use: nForce2_smbus
	Kernel modules: i2c_nforce2

00:01.2 RAM memory [0500]: NVIDIA Corporation MCP65 Memory Controller [10de:0445] (rev a1)
	Subsystem: ABIT Computer Corp. Device [147b:1c36]
	Control: I/O- Mem- BusMaster- SpecCycle- MemWINV- VGASnoop- ParErr- Stepping- SERR- FastB2B- DisINTx+
	Status: Cap- 66MHz+ UDF- FastB2B+ ParErr- DEVSEL=fast >TAbort- <TAbort- <MAbort- >SERR- <PERR- INTx-

00:02.0 USB controller [0c03]: NVIDIA Corporation MCP65 USB 1.1 OHCI Controller [10de:0454] (rev a1) (prog-if 10 [OHCI])
	Subsystem: ABIT Computer Corp. Device [147b:1c36]
	Control: I/O+ Mem+ BusMaster+ SpecCycle- MemWINV- VGASnoop- ParErr- Stepping- SERR- FastB2B- DisINTx-
	Status: Cap+ 66MHz+ UDF- FastB2B+ ParErr- DEVSEL=fast >TAbort- <TAbort- <MAbort- >SERR- <PERR- INTx-
	Latency: 0 (750ns min, 250ns max)
	Interrupt: pin A routed to IRQ 23
	Region 0: Memory at fe02f000 (32-bit, non-prefetchable) [size=4K]
	Capabilities: [44] Power Management version 2
		Flags: PMEClk- DSI- D1+ D2+ AuxCurrent=0mA PME(D0+,D1+,D2+,D3hot+,D3cold+)
		Status: D0 NoSoftRst- PME-Enable- DSel=0 DScale=0 PME-
	Kernel driver in use: ohci-pci
	Kernel modules: ohci_pci

00:02.1 USB controller [0c03]: NVIDIA Corporation MCP65 USB 2.0 EHCI Controller [10de:0455] (rev a1) (prog-if 20 [EHCI])
	Subsystem: ABIT Computer Corp. Device [147b:1c36]
	Control: I/O- Mem+ BusMaster+ SpecCycle- MemWINV- VGASnoop- ParErr- Stepping- SERR- FastB2B- DisINTx-
	Status: Cap+ 66MHz+ UDF- FastB2B+ ParErr- DEVSEL=fast >TAbort- <TAbort- <MAbort- >SERR- <PERR- INTx-
	Latency: 0 (750ns min, 250ns max)
	Interrupt: pin B routed to IRQ 22
	Region 0: Memory at fe02e000 (32-bit, non-prefetchable) [size=256]
	Capabilities: [44] Debug port: BAR=1 offset=0098
	Capabilities: [80] Power Management version 2
		Flags: PMEClk- DSI- D1+ D2+ AuxCurrent=0mA PME(D0+,D1+,D2+,D3hot+,D3cold+)
		Status: D0 NoSoftRst- PME-Enable- DSel=0 DScale=0 PME-
	Kernel driver in use: ehci-pci
	Kernel modules: ehci_pci

00:07.0 Audio device [0403]: NVIDIA Corporation MCP65 High Definition Audio [10de:044a] (rev a1)
	Subsystem: ABIT Computer Corp. Device [147b:1c36]
	Control: I/O- Mem+ BusMaster+ SpecCycle- MemWINV- VGASnoop- ParErr- Stepping- SERR- FastB2B- DisINTx-
	Status: Cap+ 66MHz+ UDF- FastB2B+ ParErr- DEVSEL=fast >TAbort- <TAbort- <MAbort- >SERR- <PERR- INTx-
	Latency: 0 (500ns min, 1250ns max)
	Interrupt: pin B routed to IRQ 20
	Region 0: Memory at fe024000 (32-bit, non-prefetchable) [size=16K]
	Capabilities: [44] Power Management version 2
		Flags: PMEClk- DSI- D1- D2- AuxCurrent=0mA PME(D0-,D1-,D2-,D3hot+,D3cold+)
		Status: D0 NoSoftRst- PME-Enable- DSel=0 DScale=0 PME-
	Capabilities: [50] MSI: Enable- Count=1/1 Maskable+ 64bit+
		Address: 0000000000000000  Data: 0000
		Masking: 00000000  Pending: 00000000
	Capabilities: [6c] HyperTransport: MSI Mapping Enable- Fixed+
	Kernel driver in use: snd_hda_intel
	Kernel modules: snd_hda_intel

00:08.0 PCI bridge [0604]: NVIDIA Corporation MCP65 PCI bridge [10de:0449] (rev a1) (prog-if 01 [Subtractive decode])
	Control: I/O+ Mem+ BusMaster+ SpecCycle- MemWINV- VGASnoop- ParErr- Stepping- SERR- FastB2B- DisINTx-
	Status: Cap+ 66MHz+ UDF- FastB2B+ ParErr- DEVSEL=fast >TAbort- <TAbort- <MAbort- >SERR- <PERR- INTx-
	Latency: 0
	Bus: primary=00, secondary=01, subordinate=01, sec-latency=32
	I/O behind bridge: 0000c000-0000cfff
	Memory behind bridge: fde00000-fdefffff
	Prefetchable memory behind bridge: fdf00000-fdffffff
	Secondary status: 66MHz- FastB2B+ ParErr- DEVSEL=medium >TAbort- <TAbort- <MAbort+ <SERR- <PERR-
	BridgeCtl: Parity- SERR- NoISA+ VGA- MAbort- >Reset- FastB2B-
		PriDiscTmr- SecDiscTmr+ DiscTmrStat- DiscTmrSERREn-
	Capabilities: [b8] Subsystem: NVIDIA Corporation HP Pavilion dv9668eg Laptop [10de:cb84]
	Capabilities: [8c] HyperTransport: MSI Mapping Enable- Fixed-
		Mapping Address Base: 00000000fee00000

00:09.0 IDE interface [0101]: NVIDIA Corporation MCP65 IDE [10de:0448] (rev a1) (prog-if 8a [Master SecP PriP])
	Subsystem: ABIT Computer Corp. Device [147b:1c36]
	Control: I/O+ Mem- BusMaster+ SpecCycle- MemWINV- VGASnoop- ParErr- Stepping- SERR- FastB2B- DisINTx-
	Status: Cap+ 66MHz+ UDF- FastB2B+ ParErr- DEVSEL=fast >TAbort- <TAbort- <MAbort- >SERR- <PERR- INTx-
	Latency: 0 (750ns min, 250ns max)
	Region 0: [virtual] Memory at 000001f0 (32-bit, non-prefetchable) [size=8]
	Region 1: [virtual] Memory at 000003f0 (type 3, non-prefetchable)
	Region 2: [virtual] Memory at 00000170 (32-bit, non-prefetchable) [size=8]
	Region 3: [virtual] Memory at 00000370 (type 3, non-prefetchable)
	Region 4: I/O ports at ec00 [size=16]
	Capabilities: [44] Power Management version 2
		Flags: PMEClk- DSI- D1- D2- AuxCurrent=0mA PME(D0-,D1-,D2-,D3hot-,D3cold-)
		Status: D0 NoSoftRst- PME-Enable- DSel=0 DScale=0 PME-
	Kernel driver in use: pata_amd
	Kernel modules: pata_amd, pata_acpi, ata_generic, amd74xx, ide_pci_generic

00:0a.0 IDE interface [0101]: NVIDIA Corporation MCP65 SATA Controller [10de:045d] (rev a1) (prog-if 85 [Master SecO PriO])
	Subsystem: ABIT Computer Corp. Device [147b:1c36]
	Control: I/O+ Mem+ BusMaster+ SpecCycle- MemWINV- VGASnoop- ParErr- Stepping- SERR- FastB2B- DisINTx-
	Status: Cap+ 66MHz+ UDF- FastB2B+ ParErr- DEVSEL=fast >TAbort- <TAbort- <MAbort- >SERR- <PERR- INTx-
	Latency: 0 (750ns min, 250ns max)
	Interrupt: pin A routed to IRQ 21
	Region 0: I/O ports at 09f0 [size=8]
	Region 1: I/O ports at 0bf0 [size=4]
	Region 2: I/O ports at 0970 [size=8]
	Region 3: I/O ports at 0b70 [size=4]
	Region 4: I/O ports at d800 [size=16]
	Region 5: Memory at fe02a000 (32-bit, non-prefetchable) [size=8K]
	Capabilities: [44] Power Management version 2
		Flags: PMEClk- DSI- D1- D2- AuxCurrent=0mA PME(D0-,D1-,D2-,D3hot-,D3cold-)
		Status: D0 NoSoftRst- PME-Enable- DSel=0 DScale=0 PME-
	Capabilities: [b0] MSI: Enable- Count=1/8 Maskable- 64bit+
		Address: 0000000000000000  Data: 0000
	Capabilities: [cc] HyperTransport: MSI Mapping Enable- Fixed+
	Kernel driver in use: ahci
	Kernel modules: pata_acpi, ata_generic, ide_pci_generic

00:0c.0 PCI bridge [0604]: NVIDIA Corporation MCP65 PCI Express bridge [10de:045a] (rev a1) (prog-if 00 [Normal decode])
	Control: I/O+ Mem+ BusMaster+ SpecCycle- MemWINV- VGASnoop- ParErr- Stepping- SERR- FastB2B- DisINTx+
	Status: Cap+ 66MHz- UDF- FastB2B- ParErr- DEVSEL=fast >TAbort- <TAbort- <MAbort- >SERR- <PERR- INTx-
	Latency: 0, Cache Line Size: 64 bytes
	Bus: primary=00, secondary=02, subordinate=02, sec-latency=0
	I/O behind bridge: 0000b000-0000bfff
	Memory behind bridge: fdd00000-fddfffff
	Prefetchable memory behind bridge: 00000000fdc00000-00000000fdcfffff
	Secondary status: 66MHz- FastB2B- ParErr- DEVSEL=fast >TAbort- <TAbort- <MAbort- <SERR- <PERR-
	BridgeCtl: Parity- SERR- NoISA+ VGA- MAbort- >Reset- FastB2B-
		PriDiscTmr- SecDiscTmr- DiscTmrStat- DiscTmrSERREn-
	Capabilities: [40] Subsystem: NVIDIA Corporation MCP65 PCI Express bridge [10de:0000]
	Capabilities: [48] Power Management version 2
		Flags: PMEClk- DSI- D1- D2- AuxCurrent=0mA PME(D0+,D1+,D2+,D3hot+,D3cold+)
		Status: D0 NoSoftRst- PME-Enable- DSel=0 DScale=0 PME-
	Capabilities: [50] MSI: Enable+ Count=1/2 Maskable- 64bit+
		Address: 00000000fee0300c  Data: 4161
	Capabilities: [60] HyperTransport: MSI Mapping Enable- Fixed-
		Mapping Address Base: 00000000fee00000
	Capabilities: [80] Express (v1) Root Port (Slot+), MSI 00
		DevCap:	MaxPayload 256 bytes, PhantFunc 0, Latency L0s <64ns, L1 <1us
			ExtTag- RBE+ FLReset-
		DevCtl:	Report errors: Correctable- Non-Fatal- Fatal- Unsupported-
			RlxdOrd+ ExtTag- PhantFunc- AuxPwr- NoSnoop+
			MaxPayload 256 bytes, MaxReadReq 512 bytes
		DevSta:	CorrErr- UncorrErr- FatalErr- UnsuppReq- AuxPwr- TransPend-
		LnkCap:	Port #2, Speed 2.5GT/s, Width x1, ASPM L0s L1, Latency L0 <512ns, L1 <4us
			ClockPM- Surprise- LLActRep+ BwNot-
		LnkCtl:	ASPM Disabled; RCB 64 bytes Disabled- Retrain- CommClk-
			ExtSynch- ClockPM- AutWidDis- BWInt- AutBWInt-
		LnkSta:	Speed 2.5GT/s, Width x2, TrErr- Train- SlotClk+ DLActive- BWMgmt- ABWMgmt-
		SltCap:	AttnBtn- PwrCtrl- MRL- AttnInd- PwrInd- HotPlug- Surprise-
			Slot #0, PowerLimit 0.000W; Interlock- NoCompl-
		SltCtl:	Enable: AttnBtn- PwrFlt- MRL- PresDet- CmdCplt- HPIrq- LinkChg-
			Control: AttnInd Off, PwrInd On, Power- Interlock-
		SltSta:	Status: AttnBtn- PowerFlt- MRL- CmdCplt- PresDet- Interlock-
			Changed: MRL- PresDet- LinkState-
		RootCtl: ErrCorrectable- ErrNon-Fatal- ErrFatal- PMEIntEna+ CRSVisible-
		RootCap: CRSVisible-
		RootSta: PME ReqID 0000, PMEStatus- PMEPending-
	Capabilities: [100 v1] Virtual Channel
		Caps:	LPEVC=0 RefClk=100ns PATEntryBits=1
		Arb:	Fixed- WRR32- WRR64- WRR128-
		Ctrl:	ArbSelect=WRR32
		Status:	InProgress-
		VC0:	Caps:	PATOffset=00 MaxTimeSlots=1 RejSnoopTrans-
			Arb:	Fixed- WRR32- WRR64- WRR128- TWRR128- WRR256-
			Ctrl:	Enable+ ID=0 ArbSelect=Fixed TC/VC=ff
			Status:	NegoPending- InProgress-
	Kernel driver in use: pcieport
	Kernel modules: shpchp

00:0d.0 PCI bridge [0604]: NVIDIA Corporation MCP65 PCI Express bridge [10de:0458] (rev a1) (prog-if 00 [Normal decode])
	Control: I/O+ Mem+ BusMaster+ SpecCycle- MemWINV- VGASnoop- ParErr- Stepping- SERR- FastB2B- DisINTx+
	Status: Cap+ 66MHz- UDF- FastB2B- ParErr- DEVSEL=fast >TAbort- <TAbort- <MAbort- >SERR- <PERR- INTx-
	Latency: 0, Cache Line Size: 64 bytes
	Bus: primary=00, secondary=03, subordinate=03, sec-latency=0
	I/O behind bridge: 0000a000-0000afff
	Memory behind bridge: fdb00000-fdbfffff
	Prefetchable memory behind bridge: 00000000e0000000-00000000efffffff
	Secondary status: 66MHz- FastB2B- ParErr- DEVSEL=fast >TAbort- <TAbort- <MAbort+ <SERR- <PERR-
	BridgeCtl: Parity- SERR- NoISA+ VGA+ MAbort- >Reset- FastB2B-
		PriDiscTmr- SecDiscTmr- DiscTmrStat- DiscTmrSERREn-
	Capabilities: [40] Subsystem: NVIDIA Corporation MCP65 PCI Express bridge [10de:0000]
	Capabilities: [48] Power Management version 2
		Flags: PMEClk- DSI- D1- D2- AuxCurrent=0mA PME(D0+,D1+,D2+,D3hot+,D3cold+)
		Status: D0 NoSoftRst- PME-Enable- DSel=0 DScale=0 PME-
	Capabilities: [50] MSI: Enable+ Count=1/2 Maskable- 64bit+
		Address: 00000000fee0300c  Data: 4171
	Capabilities: [60] HyperTransport: MSI Mapping Enable- Fixed-
		Mapping Address Base: 00000000fee00000
	Capabilities: [80] Express (v1) Root Port (Slot+), MSI 00
		DevCap:	MaxPayload 256 bytes, PhantFunc 0, Latency L0s <64ns, L1 <1us
			ExtTag- RBE+ FLReset-
		DevCtl:	Report errors: Correctable- Non-Fatal- Fatal- Unsupported-
			RlxdOrd+ ExtTag- PhantFunc- AuxPwr- NoSnoop+
			MaxPayload 256 bytes, MaxReadReq 512 bytes
		DevSta:	CorrErr- UncorrErr- FatalErr- UnsuppReq- AuxPwr- TransPend-
		LnkCap:	Port #0, Speed 2.5GT/s, Width x16, ASPM L0s L1, Latency L0 <512ns, L1 <4us
			ClockPM- Surprise- LLActRep+ BwNot-
		LnkCtl:	ASPM Disabled; RCB 64 bytes Disabled- Retrain- CommClk+
			ExtSynch- ClockPM- AutWidDis- BWInt- AutBWInt-
		LnkSta:	Speed 2.5GT/s, Width x16, TrErr- Train- SlotClk+ DLActive+ BWMgmt- ABWMgmt-
		SltCap:	AttnBtn- PwrCtrl- MRL- AttnInd- PwrInd- HotPlug- Surprise-
			Slot #0, PowerLimit 0.000W; Interlock- NoCompl-
		SltCtl:	Enable: AttnBtn- PwrFlt- MRL- PresDet- CmdCplt- HPIrq- LinkChg-
			Control: AttnInd Off, PwrInd On, Power- Interlock-
		SltSta:	Status: AttnBtn- PowerFlt- MRL- CmdCplt- PresDet+ Interlock-
			Changed: MRL- PresDet+ LinkState+
		RootCtl: ErrCorrectable- ErrNon-Fatal- ErrFatal- PMEIntEna+ CRSVisible-
		RootCap: CRSVisible-
		RootSta: PME ReqID 0000, PMEStatus- PMEPending-
	Capabilities: [100 v1] Virtual Channel
		Caps:	LPEVC=0 RefClk=100ns PATEntryBits=1
		Arb:	Fixed- WRR32- WRR64- WRR128-
		Ctrl:	ArbSelect=WRR32
		Status:	InProgress-
		VC0:	Caps:	PATOffset=00 MaxTimeSlots=1 RejSnoopTrans-
			Arb:	Fixed- WRR32- WRR64- WRR128- TWRR128- WRR256-
			Ctrl:	Enable+ ID=0 ArbSelect=Fixed TC/VC=ff
			Status:	NegoPending- InProgress-
	Kernel driver in use: pcieport
	Kernel modules: shpchp

00:0e.0 PCI bridge [0604]: NVIDIA Corporation MCP65 PCI Express bridge [10de:0459] (rev a1) (prog-if 00 [Normal decode])
	Control: I/O+ Mem+ BusMaster+ SpecCycle- MemWINV- VGASnoop- ParErr- Stepping- SERR- FastB2B- DisINTx+
	Status: Cap+ 66MHz- UDF- FastB2B- ParErr- DEVSEL=fast >TAbort- <TAbort- <MAbort- >SERR- <PERR- INTx-
	Latency: 0, Cache Line Size: 64 bytes
	Bus: primary=00, secondary=04, subordinate=04, sec-latency=0
	I/O behind bridge: 00009000-00009fff
	Memory behind bridge: fda00000-fdafffff
	Prefetchable memory behind bridge: 00000000fd900000-00000000fd9fffff
	Secondary status: 66MHz- FastB2B- ParErr- DEVSEL=fast >TAbort- <TAbort- <MAbort- <SERR- <PERR-
	BridgeCtl: Parity- SERR- NoISA+ VGA- MAbort- >Reset- FastB2B-
		PriDiscTmr- SecDiscTmr- DiscTmrStat- DiscTmrSERREn-
	Capabilities: [40] Subsystem: NVIDIA Corporation MCP65 PCI Express bridge [10de:0000]
	Capabilities: [48] Power Management version 2
		Flags: PMEClk- DSI- D1- D2- AuxCurrent=0mA PME(D0+,D1+,D2+,D3hot+,D3cold+)
		Status: D0 NoSoftRst- PME-Enable- DSel=0 DScale=0 PME-
	Capabilities: [50] MSI: Enable+ Count=1/2 Maskable- 64bit+
		Address: 00000000fee0300c  Data: 4181
	Capabilities: [60] HyperTransport: MSI Mapping Enable- Fixed-
		Mapping Address Base: 00000000fee00000
	Capabilities: [80] Express (v1) Root Port (Slot+), MSI 00
		DevCap:	MaxPayload 256 bytes, PhantFunc 0, Latency L0s <64ns, L1 <1us
			ExtTag- RBE+ FLReset-
		DevCtl:	Report errors: Correctable- Non-Fatal- Fatal- Unsupported-
			RlxdOrd+ ExtTag- PhantFunc- AuxPwr- NoSnoop+
			MaxPayload 256 bytes, MaxReadReq 512 bytes
		DevSta:	CorrErr- UncorrErr- FatalErr- UnsuppReq- AuxPwr- TransPend-
		LnkCap:	Port #1, Speed 2.5GT/s, Width x1, ASPM L0s L1, Latency L0 <512ns, L1 <4us
			ClockPM- Surprise- LLActRep+ BwNot-
		LnkCtl:	ASPM Disabled; RCB 64 bytes Disabled- Retrain- CommClk-
			ExtSynch- ClockPM- AutWidDis- BWInt- AutBWInt-
		LnkSta:	Speed 2.5GT/s, Width x8, TrErr- Train- SlotClk+ DLActive- BWMgmt- ABWMgmt-
		SltCap:	AttnBtn- PwrCtrl- MRL- AttnInd- PwrInd- HotPlug- Surprise-
			Slot #0, PowerLimit 0.000W; Interlock- NoCompl-
		SltCtl:	Enable: AttnBtn- PwrFlt- MRL- PresDet- CmdCplt- HPIrq- LinkChg-
			Control: AttnInd Off, PwrInd On, Power- Interlock-
		SltSta:	Status: AttnBtn- PowerFlt- MRL- CmdCplt- PresDet- Interlock-
			Changed: MRL- PresDet- LinkState-
		RootCtl: ErrCorrectable- ErrNon-Fatal- ErrFatal- PMEIntEna+ CRSVisible-
		RootCap: CRSVisible-
		RootSta: PME ReqID 0000, PMEStatus- PMEPending-
	Capabilities: [100 v1] Virtual Channel
		Caps:	LPEVC=0 RefClk=100ns PATEntryBits=1
		Arb:	Fixed- WRR32- WRR64- WRR128-
		Ctrl:	ArbSelect=WRR32
		Status:	InProgress-
		VC0:	Caps:	PATOffset=00 MaxTimeSlots=1 RejSnoopTrans-
			Arb:	Fixed- WRR32- WRR64- WRR128- TWRR128- WRR256-
			Ctrl:	Enable+ ID=0 ArbSelect=Fixed TC/VC=ff
			Status:	NegoPending- InProgress-
	Kernel driver in use: pcieport
	Kernel modules: shpchp

00:18.0 Host bridge [0600]: Advanced Micro Devices, Inc. [AMD] K8 [Athlon64/Opteron] HyperTransport Technology Configuration [1022:1100]
	Control: I/O- Mem- BusMaster- SpecCycle- MemWINV- VGASnoop- ParErr- Stepping- SERR- FastB2B- DisINTx-
	Status: Cap+ 66MHz- UDF- FastB2B- ParErr- DEVSEL=fast >TAbort- <TAbort- <MAbort- >SERR- <PERR- INTx-
	Capabilities: [80] HyperTransport: Host or Secondary Interface
		Command: WarmRst+ DblEnd- DevNum=0 ChainSide- HostHide+ Slave- <EOCErr- DUL-
		Link Control: CFlE- CST- CFE- <LkFail- Init+ EOC- TXO- <CRCErr=0 IsocEn- LSEn- ExtCTL- 64b-
		Link Config: MLWI=16bit DwFcIn- MLWO=16bit DwFcOut- LWI=16bit DwFcInEn- LWO=16bit DwFcOutEn-
		Revision ID: 1.02
		Link Frequency: 1.0GHz
		Link Error: <Prot- <Ovfl- <EOC- CTLTm-
		Link Frequency Capability: 200MHz+ 300MHz- 400MHz+ 500MHz- 600MHz+ 800MHz+ 1.0GHz+ 1.2GHz- 1.4GHz- 1.6GHz- Vend-
		Feature Capability: IsocFC- LDTSTOP+ CRCTM- ECTLT- 64bA- UIDRD- ExtRS- UCnfE-

00:18.1 Host bridge [0600]: Advanced Micro Devices, Inc. [AMD] K8 [Athlon64/Opteron] Address Map [1022:1101]
	Control: I/O- Mem- BusMaster- SpecCycle- MemWINV- VGASnoop- ParErr- Stepping- SERR- FastB2B- DisINTx-
	Status: Cap- 66MHz- UDF- FastB2B- ParErr- DEVSEL=fast >TAbort- <TAbort- <MAbort- >SERR- <PERR- INTx-

00:18.2 Host bridge [0600]: Advanced Micro Devices, Inc. [AMD] K8 [Athlon64/Opteron] DRAM Controller [1022:1102]
	Control: I/O- Mem- BusMaster- SpecCycle- MemWINV- VGASnoop- ParErr- Stepping- SERR- FastB2B- DisINTx-
	Status: Cap- 66MHz- UDF- FastB2B- ParErr- DEVSEL=fast >TAbort- <TAbort- <MAbort- >SERR- <PERR- INTx-

00:18.3 Host bridge [0600]: Advanced Micro Devices, Inc. [AMD] K8 [Athlon64/Opteron] Miscellaneous Control [1022:1103]
	Control: I/O- Mem- BusMaster- SpecCycle- MemWINV- VGASnoop- ParErr- Stepping- SERR- FastB2B- DisINTx-
	Status: Cap+ 66MHz- UDF- FastB2B- ParErr- DEVSEL=fast >TAbort- <TAbort- <MAbort- >SERR- <PERR- INTx-
	Capabilities: [f0] Secure device <?>
	Kernel driver in use: k8temp
	Kernel modules: k8temp

01:09.0 Multimedia controller [0480]: Philips Semiconductors SAA7131/SAA7133/SAA7135 Video Broadcast Decoder [1131:7133] (rev d0)
	Subsystem: Avermedia Technologies Inc Device [1461:f31d]
	Control: I/O- Mem+ BusMaster+ SpecCycle- MemWINV- VGASnoop- ParErr- Stepping- SERR- FastB2B- DisINTx-
	Status: Cap+ 66MHz- UDF- FastB2B+ ParErr- DEVSEL=medium >TAbort- <TAbort- <MAbort- >SERR- <PERR- INTx-
	Latency: 255 (63750ns min, 63750ns max)
	Interrupt: pin A routed to IRQ 17
	Region 0: Memory at fdeff000 (32-bit, non-prefetchable) [size=2K]
	Capabilities: [40] Power Management version 2
		Flags: PMEClk- DSI- D1+ D2+ AuxCurrent=0mA PME(D0-,D1-,D2-,D3hot-,D3cold-)
		Status: D0 NoSoftRst- PME-Enable- DSel=0 DScale=3 PME-
	Kernel driver in use: saa7134
	Kernel modules: saa7134

01:0a.0 Ethernet controller [0200]: Realtek Semiconductor Co., Ltd. RTL-8100/8101L/8139 PCI Fast Ethernet Adapter [10ec:8139] (rev 10)
	Subsystem: Realtek Semiconductor Co., Ltd. RTL-8100/8101L/8139 PCI Fast Ethernet Adapter [10ec:8139]
	Control: I/O+ Mem+ BusMaster+ SpecCycle- MemWINV- VGASnoop- ParErr- Stepping- SERR- FastB2B- DisINTx-
	Status: Cap+ 66MHz- UDF- FastB2B+ ParErr- DEVSEL=medium >TAbort- <TAbort- <MAbort- >SERR- <PERR- INTx-
	Latency: 32 (8000ns min, 16000ns max)
	Interrupt: pin A routed to IRQ 18
	Region 0: I/O ports at cc00 [size=256]
	Region 1: Memory at fdefe000 (32-bit, non-prefetchable) [size=256]
	Capabilities: [50] Power Management version 2
		Flags: PMEClk- DSI- D1+ D2+ AuxCurrent=375mA PME(D0-,D1+,D2+,D3hot+,D3cold+)
		Status: D0 NoSoftRst- PME-Enable- DSel=0 DScale=0 PME-
	Kernel driver in use: 8139too
	Kernel modules: 8139cp, 8139too

03:00.0 VGA compatible controller [0300]: Advanced Micro Devices, Inc. [AMD/ATI] Turks XT [Radeon HD 6670/7670] [1002:6758] (prog-if 00 [VGA controller])
	Subsystem: PC Partner Limited / Sapphire Technology Device [174b:e194]
	Control: I/O+ Mem+ BusMaster+ SpecCycle- MemWINV- VGASnoop- ParErr- Stepping- SERR- FastB2B- DisINTx+
	Status: Cap+ 66MHz- UDF- FastB2B- ParErr- DEVSEL=fast >TAbort- <TAbort- <MAbort- >SERR- <PERR- INTx-
	Latency: 0, Cache Line Size: 64 bytes
	Interrupt: pin A routed to IRQ 27
	Region 0: Memory at e0000000 (64-bit, prefetchable) [size=256M]
	Region 2: Memory at fdbc0000 (64-bit, non-prefetchable) [size=128K]
	Region 4: I/O ports at ac00 [size=256]
	[virtual] Expansion ROM at 000c0000 [disabled] [size=128K]
	Capabilities: [50] Power Management version 3
		Flags: PMEClk- DSI- D1+ D2+ AuxCurrent=0mA PME(D0-,D1-,D2-,D3hot-,D3cold-)
		Status: D0 NoSoftRst- PME-Enable- DSel=0 DScale=0 PME-
	Capabilities: [58] Express (v2) Legacy Endpoint, MSI 00
		DevCap:	MaxPayload 256 bytes, PhantFunc 0, Latency L0s <4us, L1 unlimited
			ExtTag+ AttnBtn- AttnInd- PwrInd- RBE+ FLReset-
		DevCtl:	Report errors: Correctable- Non-Fatal- Fatal- Unsupported-
			RlxdOrd+ ExtTag- PhantFunc- AuxPwr- NoSnoop+
			MaxPayload 256 bytes, MaxReadReq 512 bytes
		DevSta:	CorrErr+ UncorrErr- FatalErr- UnsuppReq+ AuxPwr- TransPend-
		LnkCap:	Port #0, Speed 2.5GT/s, Width x16, ASPM L0s L1, Latency L0 <64ns, L1 <1us
			ClockPM- Surprise- LLActRep- BwNot-
		LnkCtl:	ASPM Disabled; RCB 64 bytes Disabled- Retrain- CommClk+
			ExtSynch- ClockPM- AutWidDis- BWInt- AutBWInt-
		LnkSta:	Speed 2.5GT/s, Width x16, TrErr- Train- SlotClk+ DLActive- BWMgmt- ABWMgmt-
		DevCap2: Completion Timeout: Not Supported, TimeoutDis-, LTR-, OBFF Not Supported
		DevCtl2: Completion Timeout: 50us to 50ms, TimeoutDis-, LTR-, OBFF Disabled
		LnkCtl2: Target Link Speed: 2.5GT/s, EnterCompliance- SpeedDis-
			 Transmit Margin: Normal Operating Range, EnterModifiedCompliance- ComplianceSOS-
			 Compliance De-emphasis: -6dB
		LnkSta2: Current De-emphasis Level: -6dB, EqualizationComplete-, EqualizationPhase1-
			 EqualizationPhase2-, EqualizationPhase3-, LinkEqualizationRequest-
	Capabilities: [a0] MSI: Enable+ Count=1/1 Maskable- 64bit+
		Address: 00000000fee0300c  Data: 41e1
	Capabilities: [100 v1] Vendor Specific Information: ID=0001 Rev=1 Len=010 <?>
	Capabilities: [150 v1] Advanced Error Reporting
		UESta:	DLP- SDES- TLP- FCP- CmpltTO- CmpltAbrt- UnxCmplt- RxOF- MalfTLP- ECRC- UnsupReq- ACSViol-
		UEMsk:	DLP- SDES- TLP- FCP- CmpltTO- CmpltAbrt- UnxCmplt- RxOF- MalfTLP- ECRC- UnsupReq- ACSViol-
		UESvrt:	DLP+ SDES+ TLP- FCP+ CmpltTO- CmpltAbrt- UnxCmplt- RxOF+ MalfTLP+ ECRC- UnsupReq- ACSViol-
		CESta:	RxErr- BadTLP- BadDLLP- Rollover- Timeout- NonFatalErr+
		CEMsk:	RxErr- BadTLP- BadDLLP- Rollover- Timeout- NonFatalErr+
		AERCap:	First Error Pointer: 00, GenCap+ CGenEn- ChkCap+ ChkEn-
	Kernel driver in use: radeon
	Kernel modules: radeon

03:00.1 Audio device [0403]: Advanced Micro Devices, Inc. [AMD/ATI] Turks/Whistler HDMI Audio [Radeon HD 6000 Series] [1002:aa90]
	Subsystem: PC Partner Limited / Sapphire Technology Device [174b:aa90]
	Control: I/O- Mem+ BusMaster+ SpecCycle- MemWINV- VGASnoop- ParErr- Stepping- SERR- FastB2B- DisINTx+
	Status: Cap+ 66MHz- UDF- FastB2B- ParErr- DEVSEL=fast >TAbort- <TAbort- <MAbort- >SERR- <PERR- INTx-
	Latency: 0, Cache Line Size: 64 bytes
	Interrupt: pin B routed to IRQ 28
	Region 0: Memory at fdbfc000 (64-bit, non-prefetchable) [size=16K]
	Capabilities: [50] Power Management version 3
		Flags: PMEClk- DSI- D1+ D2+ AuxCurrent=0mA PME(D0-,D1-,D2-,D3hot-,D3cold-)
		Status: D0 NoSoftRst- PME-Enable- DSel=0 DScale=0 PME-
	Capabilities: [58] Express (v2) Legacy Endpoint, MSI 00
		DevCap:	MaxPayload 256 bytes, PhantFunc 0, Latency L0s <4us, L1 unlimited
			ExtTag+ AttnBtn- AttnInd- PwrInd- RBE+ FLReset-
		DevCtl:	Report errors: Correctable- Non-Fatal- Fatal- Unsupported-
			RlxdOrd+ ExtTag- PhantFunc- AuxPwr- NoSnoop+
			MaxPayload 256 bytes, MaxReadReq 512 bytes
		DevSta:	CorrErr+ UncorrErr- FatalErr- UnsuppReq+ AuxPwr- TransPend-
		LnkCap:	Port #0, Speed 2.5GT/s, Width x16, ASPM L0s L1, Latency L0 <64ns, L1 <1us
			ClockPM- Surprise- LLActRep- BwNot-
		LnkCtl:	ASPM Disabled; RCB 64 bytes Disabled- Retrain- CommClk+
			ExtSynch- ClockPM- AutWidDis- BWInt- AutBWInt-
		LnkSta:	Speed 2.5GT/s, Width x16, TrErr- Train- SlotClk+ DLActive- BWMgmt- ABWMgmt-
		DevCap2: Completion Timeout: Not Supported, TimeoutDis-, LTR-, OBFF Not Supported
		DevCtl2: Completion Timeout: 50us to 50ms, TimeoutDis-, LTR-, OBFF Disabled
		LnkSta2: Current De-emphasis Level: -6dB, EqualizationComplete-, EqualizationPhase1-
			 EqualizationPhase2-, EqualizationPhase3-, LinkEqualizationRequest-
	Capabilities: [a0] MSI: Enable+ Count=1/1 Maskable- 64bit+
		Address: 00000000fee0300c  Data: 4142
	Capabilities: [100 v1] Vendor Specific Information: ID=0001 Rev=1 Len=010 <?>
	Capabilities: [150 v1] Advanced Error Reporting
		UESta:	DLP- SDES- TLP- FCP- CmpltTO- CmpltAbrt- UnxCmplt- RxOF- MalfTLP- ECRC- UnsupReq- ACSViol-
		UEMsk:	DLP- SDES- TLP- FCP- CmpltTO- CmpltAbrt- UnxCmplt- RxOF- MalfTLP- ECRC- UnsupReq- ACSViol-
		UESvrt:	DLP+ SDES+ TLP- FCP+ CmpltTO- CmpltAbrt- UnxCmplt- RxOF+ MalfTLP+ ECRC- UnsupReq- ACSViol-
		CESta:	RxErr- BadTLP- BadDLLP- Rollover- Timeout- NonFatalErr+
		CEMsk:	RxErr- BadTLP- BadDLLP- Rollover- Timeout- NonFatalErr+
		AERCap:	First Error Pointer: 00, GenCap+ CGenEn- ChkCap+ ChkEn-
	Kernel driver in use: snd_hda_intel
	Kernel modules: snd_hda_intel

