00:00.0 Host bridge [0600]: Intel Corporation Sky Lake-E DMI3 Registers [8086:2020] (rev 07)
	Subsystem: Hewlett Packard Enterprise Device [1590:00ea]
	Control: I/O- Mem- BusMaster- SpecCycle- MemWINV- VGASnoop- ParErr+ Stepping- SERR+ FastB2B- DisINTx+
	Status: Cap+ 66MHz- UDF- FastB2B- ParErr- DEVSEL=fast >TAbort- <TAbort- <MAbort- >SERR- <PERR- INTx-
	Interrupt: pin A routed to IRQ 0
	NUMA node: 0
	Capabilities: <access denied>

00:04.0 System peripheral [0880]: Intel Corporation Sky Lake-E CBDMA Registers [8086:2021] (rev 07)
	Subsystem: Hewlett Packard Enterprise Device [1590:00ea]
	Control: I/O- Mem+ BusMaster+ SpecCycle- MemWINV- VGASnoop- ParErr- Stepping- SERR- FastB2B- DisINTx+
	Status: Cap+ 66MHz- UDF- FastB2B- ParErr- DEVSEL=fast >TAbort- <TAbort- <MAbort- >SERR- <PERR- INTx-
	Latency: 0, Cache Line Size: 64 bytes
	Interrupt: pin A routed to IRQ 101
	NUMA node: 0
	Region 0: Memory at c3ffff1c000 (64-bit, non-prefetchable) [size=16K]
	Capabilities: <access denied>
	Kernel driver in use: ioatdma
	Kernel modules: ioatdma

00:04.1 System peripheral [0880]: Intel Corporation Sky Lake-E CBDMA Registers [8086:2021] (rev 07)
	Subsystem: Hewlett Packard Enterprise Device [1590:00ea]
	Control: I/O- Mem+ BusMaster+ SpecCycle- MemWINV- VGASnoop- ParErr- Stepping- SERR- FastB2B- DisINTx+
	Status: Cap+ 66MHz- UDF- FastB2B- ParErr- DEVSEL=fast >TAbort- <TAbort- <MAbort- >SERR- <PERR- INTx-
	Latency: 0, Cache Line Size: 64 bytes
	Interrupt: pin B routed to IRQ 103
	NUMA node: 0
	Region 0: Memory at c3ffff18000 (64-bit, non-prefetchable) [size=16K]
	Capabilities: <access denied>
	Kernel driver in use: ioatdma
	Kernel modules: ioatdma

00:04.2 System peripheral [0880]: Intel Corporation Sky Lake-E CBDMA Registers [8086:2021] (rev 07)
	Subsystem: Hewlett Packard Enterprise Device [1590:00ea]
	Control: I/O- Mem+ BusMaster+ SpecCycle- MemWINV- VGASnoop- ParErr- Stepping- SERR- FastB2B- DisINTx+
	Status: Cap+ 66MHz- UDF- FastB2B- ParErr- DEVSEL=fast >TAbort- <TAbort- <MAbort- >SERR- <PERR- INTx-
	Latency: 0, Cache Line Size: 64 bytes
	Interrupt: pin C routed to IRQ 101
	NUMA node: 0
	Region 0: Memory at c3ffff14000 (64-bit, non-prefetchable) [size=16K]
	Capabilities: <access denied>
	Kernel driver in use: ioatdma
	Kernel modules: ioatdma

00:04.3 System peripheral [0880]: Intel Corporation Sky Lake-E CBDMA Registers [8086:2021] (rev 07)
	Subsystem: Hewlett Packard Enterprise Device [1590:00ea]
	Control: I/O- Mem+ BusMaster+ SpecCycle- MemWINV- VGASnoop- ParErr- Stepping- SERR- FastB2B- DisINTx+
	Status: Cap+ 66MHz- UDF- FastB2B- ParErr- DEVSEL=fast >TAbort- <TAbort- <MAbort- >SERR- <PERR- INTx-
	Latency: 0, Cache Line Size: 64 bytes
	Interrupt: pin D routed to IRQ 103
	NUMA node: 0
	Region 0: Memory at c3ffff10000 (64-bit, non-prefetchable) [size=16K]
	Capabilities: <access denied>
	Kernel driver in use: ioatdma
	Kernel modules: ioatdma

00:04.4 System peripheral [0880]: Intel Corporation Sky Lake-E CBDMA Registers [8086:2021] (rev 07)
	Subsystem: Hewlett Packard Enterprise Device [1590:00ea]
	Control: I/O- Mem+ BusMaster+ SpecCycle- MemWINV- VGASnoop- ParErr- Stepping- SERR- FastB2B- DisINTx+
	Status: Cap+ 66MHz- UDF- FastB2B- ParErr- DEVSEL=fast >TAbort- <TAbort- <MAbort- >SERR- <PERR- INTx-
	Latency: 0, Cache Line Size: 64 bytes
	Interrupt: pin A routed to IRQ 101
	NUMA node: 0
	Region 0: Memory at c3ffff0c000 (64-bit, non-prefetchable) [size=16K]
	Capabilities: <access denied>
	Kernel driver in use: ioatdma
	Kernel modules: ioatdma

00:04.5 System peripheral [0880]: Intel Corporation Sky Lake-E CBDMA Registers [8086:2021] (rev 07)
	Subsystem: Hewlett Packard Enterprise Device [1590:00ea]
	Control: I/O- Mem+ BusMaster+ SpecCycle- MemWINV- VGASnoop- ParErr- Stepping- SERR- FastB2B- DisINTx+
	Status: Cap+ 66MHz- UDF- FastB2B- ParErr- DEVSEL=fast >TAbort- <TAbort- <MAbort- >SERR- <PERR- INTx-
	Latency: 0, Cache Line Size: 64 bytes
	Interrupt: pin B routed to IRQ 103
	NUMA node: 0
	Region 0: Memory at c3ffff08000 (64-bit, non-prefetchable) [size=16K]
	Capabilities: <access denied>
	Kernel driver in use: ioatdma
	Kernel modules: ioatdma

00:04.6 System peripheral [0880]: Intel Corporation Sky Lake-E CBDMA Registers [8086:2021] (rev 07)
	Subsystem: Hewlett Packard Enterprise Device [1590:00ea]
	Control: I/O- Mem+ BusMaster+ SpecCycle- MemWINV- VGASnoop- ParErr- Stepping- SERR- FastB2B- DisINTx+
	Status: Cap+ 66MHz- UDF- FastB2B- ParErr- DEVSEL=fast >TAbort- <TAbort- <MAbort- >SERR- <PERR- INTx-
	Latency: 0, Cache Line Size: 64 bytes
	Interrupt: pin C routed to IRQ 101
	NUMA node: 0
	Region 0: Memory at c3ffff04000 (64-bit, non-prefetchable) [size=16K]
	Capabilities: <access denied>
	Kernel driver in use: ioatdma
	Kernel modules: ioatdma

00:04.7 System peripheral [0880]: Intel Corporation Sky Lake-E CBDMA Registers [8086:2021] (rev 07)
	Subsystem: Hewlett Packard Enterprise Device [1590:00ea]
	Control: I/O- Mem+ BusMaster+ SpecCycle- MemWINV- VGASnoop- ParErr- Stepping- SERR- FastB2B- DisINTx+
	Status: Cap+ 66MHz- UDF- FastB2B- ParErr- DEVSEL=fast >TAbort- <TAbort- <MAbort- >SERR- <PERR- INTx-
	Latency: 0, Cache Line Size: 64 bytes
	Interrupt: pin D routed to IRQ 103
	NUMA node: 0
	Region 0: Memory at c3ffff00000 (64-bit, non-prefetchable) [size=16K]
	Capabilities: <access denied>
	Kernel driver in use: ioatdma
	Kernel modules: ioatdma

00:05.0 System peripheral [0880]: Intel Corporation Sky Lake-E MM/Vt-d Configuration Registers [8086:2024] (rev 07)
	Subsystem: Hewlett Packard Enterprise Device [1590:00ea]
	Control: I/O- Mem- BusMaster- SpecCycle- MemWINV- VGASnoop- ParErr- Stepping- SERR- FastB2B- DisINTx-
	Status: Cap+ 66MHz- UDF- FastB2B- ParErr- DEVSEL=fast >TAbort- <TAbort- <MAbort- >SERR- <PERR- INTx-
	NUMA node: 0
	Capabilities: <access denied>

00:05.2 System peripheral [0880]: Intel Corporation Sky Lake-E RAS [8086:2025] (rev 07)
	Subsystem: Hewlett Packard Enterprise Device [1590:00ea]
	Control: I/O- Mem- BusMaster- SpecCycle- MemWINV- VGASnoop- ParErr- Stepping- SERR- FastB2B- DisINTx-
	Status: Cap+ 66MHz- UDF- FastB2B- ParErr- DEVSEL=fast >TAbort- <TAbort- <MAbort- >SERR- <PERR- INTx-
	NUMA node: 0
	Capabilities: <access denied>

00:05.4 PIC [0800]: Intel Corporation Sky Lake-E IOAPIC [8086:2026] (rev 07) (prog-if 20 [IO(X)-APIC])
	Subsystem: Hewlett Packard Enterprise Device [1590:18a9]
	Control: I/O- Mem+ BusMaster+ SpecCycle- MemWINV- VGASnoop- ParErr- Stepping- SERR- FastB2B- DisINTx-
	Status: Cap+ 66MHz- UDF- FastB2B- ParErr- DEVSEL=fast >TAbort- <TAbort- <MAbort- >SERR- <PERR- INTx-
	Latency: 0, Cache Line Size: 64 bytes
	NUMA node: 0
	Region 0: Memory at d9d14000 (32-bit, non-prefetchable) [size=4K]
	Capabilities: <access denied>

00:08.0 System peripheral [0880]: Intel Corporation Sky Lake-E Ubox Registers [8086:2014] (rev 07)
	Subsystem: Hewlett Packard Enterprise Device [1590:00ea]
	Control: I/O- Mem- BusMaster- SpecCycle- MemWINV- VGASnoop- ParErr- Stepping- SERR- FastB2B- DisINTx-
	Status: Cap+ 66MHz- UDF- FastB2B- ParErr- DEVSEL=fast >TAbort- <TAbort- <MAbort- >SERR- <PERR- INTx-
	NUMA node: 0
	Capabilities: <access denied>

00:08.1 Performance counters [1101]: Intel Corporation Sky Lake-E Ubox Registers [8086:2015] (rev 07)
	Subsystem: Hewlett Packard Enterprise Device [1590:00ea]
	Control: I/O- Mem- BusMaster- SpecCycle- MemWINV- VGASnoop- ParErr- Stepping- SERR- FastB2B- DisINTx-
	Status: Cap- 66MHz- UDF- FastB2B- ParErr- DEVSEL=fast >TAbort- <TAbort- <MAbort- >SERR- <PERR- INTx-
	NUMA node: 0

00:08.2 System peripheral [0880]: Intel Corporation Sky Lake-E Ubox Registers [8086:2016] (rev 07)
	Subsystem: Hewlett Packard Enterprise Device [1590:00ea]
	Control: I/O- Mem- BusMaster- SpecCycle- MemWINV- VGASnoop- ParErr- Stepping- SERR- FastB2B- DisINTx-
	Status: Cap+ 66MHz- UDF- FastB2B- ParErr- DEVSEL=fast >TAbort- <TAbort- <MAbort- >SERR- <PERR- INTx-
	NUMA node: 0
	Capabilities: <access denied>

00:11.0 Unassigned class [ff00]: Intel Corporation C620 Series Chipset Family MROM 0 [8086:a1ec] (rev 09)
	Subsystem: Hewlett Packard Enterprise Device [1590:00eb]
	Control: I/O- Mem- BusMaster- SpecCycle- MemWINV- VGASnoop- ParErr+ Stepping- SERR+ FastB2B- DisINTx-
	Status: Cap+ 66MHz- UDF- FastB2B- ParErr- DEVSEL=fast >TAbort- <TAbort- <MAbort- >SERR- <PERR- INTx-
	NUMA node: 0
	Capabilities: <access denied>

00:14.0 USB controller [0c03]: Intel Corporation C620 Series Chipset Family USB 3.0 xHCI Controller [8086:a1af] (rev 09) (prog-if 30 [XHCI])
	Subsystem: Hewlett Packard Enterprise Device [1590:00eb]
	Control: I/O- Mem+ BusMaster+ SpecCycle- MemWINV- VGASnoop- ParErr+ Stepping- SERR+ FastB2B- DisINTx+
	Status: Cap+ 66MHz- UDF- FastB2B+ ParErr- DEVSEL=medium >TAbort- <TAbort- <MAbort- >SERR- <PERR- INTx-
	Latency: 0
	Interrupt: pin A routed to IRQ 37
	NUMA node: 0
	Region 0: Memory at d9d00000 (64-bit, non-prefetchable) [size=64K]
	Capabilities: <access denied>
	Kernel driver in use: xhci_hcd
	Kernel modules: xhci_pci

00:14.2 Signal processing controller [1180]: Intel Corporation C620 Series Chipset Family Thermal Subsystem [8086:a1b1] (rev 09)
	Subsystem: Hewlett Packard Enterprise Device [1590:00eb]
	Control: I/O- Mem+ BusMaster- SpecCycle- MemWINV- VGASnoop- ParErr- Stepping- SERR+ FastB2B- DisINTx-
	Status: Cap+ 66MHz- UDF- FastB2B- ParErr- DEVSEL=fast >TAbort- <TAbort- <MAbort- >SERR- <PERR- INTx-
	Interrupt: pin C routed to IRQ 18
	NUMA node: 0
	Region 0: Memory at c3ffff23000 (64-bit, non-prefetchable) [size=4K]
	Capabilities: <access denied>
	Kernel driver in use: intel_pch_thermal
	Kernel modules: intel_pch_thermal

00:16.0 Communication controller [0780]: Intel Corporation C620 Series Chipset Family MEI Controller #1 [8086:a1ba] (rev 09)
	Subsystem: Hewlett Packard Enterprise Device [1590:00eb]
	Control: I/O- Mem+ BusMaster+ SpecCycle- MemWINV- VGASnoop- ParErr- Stepping- SERR- FastB2B- DisINTx-
	Status: Cap+ 66MHz- UDF- FastB2B- ParErr- DEVSEL=fast >TAbort- <TAbort- <MAbort- >SERR- <PERR- INTx-
	Latency: 0
	Interrupt: pin A routed to IRQ 255
	NUMA node: 0
	Region 0: Memory at c3ffff22000 (64-bit, non-prefetchable) [size=4K]
	Capabilities: <access denied>
	Kernel modules: mei_me

00:16.4 Communication controller [0780]: Intel Corporation C620 Series Chipset Family MEI Controller #3 [8086:a1be] (rev 09)
	Subsystem: Hewlett Packard Enterprise Device [1590:00eb]
	Control: I/O- Mem+ BusMaster+ SpecCycle- MemWINV- VGASnoop- ParErr- Stepping- SERR- FastB2B- DisINTx-
	Status: Cap+ 66MHz- UDF- FastB2B- ParErr- DEVSEL=fast >TAbort- <TAbort- <MAbort- >SERR- <PERR- INTx-
	Latency: 0
	Interrupt: pin A routed to IRQ 255
	NUMA node: 0
	Region 0: Memory at c3ffff21000 (64-bit, non-prefetchable) [size=4K]
	Capabilities: <access denied>

00:1c.0 PCI bridge [0604]: Intel Corporation C620 Series Chipset Family PCI Express Root Port #1 [8086:a190] (rev f9) (prog-if 00 [Normal decode])
	Control: I/O+ Mem+ BusMaster+ SpecCycle- MemWINV- VGASnoop- ParErr+ Stepping- SERR+ FastB2B- DisINTx+
	Status: Cap+ 66MHz- UDF- FastB2B- ParErr- DEVSEL=fast >TAbort- <TAbort- <MAbort- >SERR- <PERR- INTx-
	Latency: 0, Cache Line Size: 64 bytes
	Interrupt: pin A routed to IRQ 24
	NUMA node: 0
	Bus: primary=00, secondary=02, subordinate=02, sec-latency=0
	I/O behind bridge: None
	Memory behind bridge: None
	Prefetchable memory behind bridge: None
	Secondary status: 66MHz- FastB2B- ParErr- DEVSEL=fast >TAbort- <TAbort- <MAbort+ <SERR- <PERR-
	BridgeCtl: Parity+ SERR+ NoISA- VGA- VGA16- MAbort- >Reset- FastB2B-
		PriDiscTmr- SecDiscTmr- DiscTmrStat- DiscTmrSERREn-
	Capabilities: <access denied>
	Kernel driver in use: pcieport

00:1c.4 PCI bridge [0604]: Intel Corporation C620 Series Chipset Family PCI Express Root Port #5 [8086:a194] (rev f9) (prog-if 00 [Normal decode])
	Control: I/O+ Mem+ BusMaster+ SpecCycle- MemWINV- VGASnoop- ParErr+ Stepping- SERR+ FastB2B- DisINTx+
	Status: Cap+ 66MHz- UDF- FastB2B- ParErr- DEVSEL=fast >TAbort- <TAbort- <MAbort- >SERR- <PERR- INTx-
	Latency: 0, Cache Line Size: 64 bytes
	Interrupt: pin A routed to IRQ 25
	NUMA node: 0
	Bus: primary=00, secondary=01, subordinate=01, sec-latency=0
	I/O behind bridge: 00001000-00001fff [size=4K]
	Memory behind bridge: d0000000-d9bfffff [size=156M]
	Prefetchable memory behind bridge: None
	Secondary status: 66MHz- FastB2B- ParErr- DEVSEL=fast >TAbort- <TAbort- <MAbort+ <SERR- <PERR-
	BridgeCtl: Parity+ SERR+ NoISA- VGA+ VGA16- MAbort- >Reset- FastB2B-
		PriDiscTmr- SecDiscTmr- DiscTmrStat- DiscTmrSERREn-
	Capabilities: <access denied>
	Kernel driver in use: pcieport

00:1f.0 ISA bridge [0601]: Intel Corporation C621 Series Chipset LPC/eSPI Controller [8086:a1c1] (rev 09)
	Subsystem: Hewlett Packard Enterprise Device [1590:00eb]
	Control: I/O+ Mem+ BusMaster- SpecCycle- MemWINV- VGASnoop- ParErr+ Stepping- SERR+ FastB2B- DisINTx+
	Status: Cap- 66MHz- UDF- FastB2B- ParErr- DEVSEL=fast >TAbort- <TAbort- <MAbort- >SERR- <PERR- INTx-
	NUMA node: 0
	Kernel modules: lpc_ich

00:1f.2 Memory controller [0580]: Intel Corporation C620 Series Chipset Family Power Management Controller [8086:a1a1] (rev 09)
	Subsystem: Hewlett Packard Enterprise Device [1590:00eb]
	Control: I/O- Mem- BusMaster- SpecCycle- MemWINV- VGASnoop- ParErr- Stepping- SERR- FastB2B- DisINTx-
	Status: Cap- 66MHz- UDF- FastB2B- ParErr- DEVSEL=fast >TAbort- <TAbort- <MAbort- >SERR- <PERR- INTx-
	NUMA node: 0
	Region 0: Memory at d9d10000 (32-bit, non-prefetchable) [disabled] [size=16K]

01:00.0 System peripheral [0880]: Hewlett-Packard Company Integrated Lights-Out Standard Slave Instrumentation & System Support [103c:3306] (rev 07)
	Subsystem: Hewlett Packard Enterprise iLO5 [1590:00e4]
	Control: I/O+ Mem+ BusMaster+ SpecCycle- MemWINV- VGASnoop- ParErr+ Stepping- SERR+ FastB2B- DisINTx-
	Status: Cap+ 66MHz- UDF- FastB2B- ParErr- DEVSEL=fast >TAbort- <TAbort- <MAbort- >SERR- <PERR- INTx-
	Latency: 0, Cache Line Size: 64 bytes
	Interrupt: pin A routed to IRQ 255
	NUMA node: 0
	Region 0: I/O ports at 1200 [size=256]
	Region 1: Memory at d9b9e000 (32-bit, non-prefetchable) [size=1K]
	Region 2: I/O ports at 1100 [size=256]
	Region 3: Memory at d4000000 (32-bit, non-prefetchable) [size=64M]
	Region 4: Memory at d9800000 (32-bit, non-prefetchable) [size=2M]
	Capabilities: <access denied>
	Kernel modules: hpwdt

01:00.1 VGA compatible controller [0300]: Matrox Electronics Systems Ltd. MGA G200eH3 [102b:0538] (rev 02) (prog-if 00 [VGA controller])
	DeviceName: Embedded Device
	Subsystem: Hewlett Packard Enterprise iLO5 VGA [1590:00e4]
	Control: I/O+ Mem+ BusMaster+ SpecCycle- MemWINV- VGASnoop- ParErr+ Stepping- SERR+ FastB2B- DisINTx-
	Status: Cap+ 66MHz- UDF- FastB2B- ParErr- DEVSEL=fast >TAbort- <TAbort- <MAbort- >SERR- <PERR- INTx-
	Latency: 0, Cache Line Size: 64 bytes
	Interrupt: pin B routed to IRQ 17
	NUMA node: 0
	Region 0: Memory at d8000000 (32-bit, prefetchable) [size=16M]
	Region 1: Memory at d9b98000 (32-bit, non-prefetchable) [size=16K]
	Region 2: Memory at d9000000 (32-bit, non-prefetchable) [size=8M]
	[virtual] Expansion ROM at 000c0000 [disabled] [size=128K]
	Capabilities: <access denied>
	Kernel driver in use: mgag200
	Kernel modules: mgag200

01:00.2 System peripheral [0880]: Hewlett-Packard Company Integrated Lights-Out Standard Management Processor Support and Messaging [103c:3307] (rev 07)
	Subsystem: Hewlett Packard Enterprise Device [1590:00e4]
	Control: I/O+ Mem+ BusMaster+ SpecCycle- MemWINV- VGASnoop- ParErr+ Stepping- SERR+ FastB2B- DisINTx-
	Status: Cap+ 66MHz- UDF- FastB2B- ParErr- DEVSEL=fast >TAbort- <TAbort- <MAbort- >SERR- <PERR- INTx-
	Latency: 0, Cache Line Size: 64 bytes
	Interrupt: pin B routed to IRQ 17
	NUMA node: 0
	Region 0: I/O ports at 1000 [size=256]
	Region 1: Memory at d9b9d000 (32-bit, non-prefetchable) [size=256]
	Region 2: Memory at d9a00000 (32-bit, non-prefetchable) [size=1M]
	Region 3: Memory at d9b00000 (32-bit, non-prefetchable) [size=512K]
	Region 4: Memory at d9b90000 (32-bit, non-prefetchable) [size=32K]
	Region 5: Memory at d9b80000 (32-bit, non-prefetchable) [size=64K]
	[virtual] Expansion ROM at d0000000 [disabled] [size=64K]
	Capabilities: <access denied>
	Kernel driver in use: hpilo
	Kernel modules: hpilo

01:00.4 USB controller [0c03]: Hewlett-Packard Company iLO5 Virtual USB Controller [103c:22f6] (prog-if 20 [EHCI])
	Subsystem: Hewlett Packard Enterprise iLO5 Standard Virtual USB Controller [1590:00e4]
	Control: I/O- Mem+ BusMaster+ SpecCycle- MemWINV- VGASnoop- ParErr+ Stepping- SERR+ FastB2B- DisINTx+
	Status: Cap+ 66MHz- UDF- FastB2B- ParErr- DEVSEL=fast >TAbort- <TAbort- <MAbort- >SERR- <PERR- INTx-
	Latency: 0, Cache Line Size: 64 bytes
	Interrupt: pin B routed to IRQ 36
	NUMA node: 0
	Region 0: Memory at d9b9c000 (32-bit, non-prefetchable) [size=256]
	Capabilities: <access denied>
	Kernel driver in use: ehci-pci

10:00.0 PCI bridge [0604]: Intel Corporation Sky Lake-E PCI Express Root Port A [8086:2030] (rev 07) (prog-if 00 [Normal decode])
	Control: I/O+ Mem+ BusMaster+ SpecCycle- MemWINV- VGASnoop- ParErr+ Stepping- SERR+ FastB2B- DisINTx+
	Status: Cap+ 66MHz- UDF- FastB2B- ParErr- DEVSEL=fast >TAbort- <TAbort- <MAbort- >SERR- <PERR- INTx-
	Latency: 0, Cache Line Size: 64 bytes
	Interrupt: pin A routed to IRQ 27
	NUMA node: 0
	Bus: primary=10, secondary=11, subordinate=11, sec-latency=0
	I/O behind bridge: None
	Memory behind bridge: None
	Prefetchable memory behind bridge: None
	Secondary status: 66MHz- FastB2B- ParErr- DEVSEL=fast >TAbort- <TAbort- <MAbort- <SERR- <PERR-
	BridgeCtl: Parity+ SERR+ NoISA- VGA- VGA16- MAbort- >Reset- FastB2B-
		PriDiscTmr- SecDiscTmr- DiscTmrStat- DiscTmrSERREn-
	Capabilities: <access denied>
	Kernel driver in use: pcieport

10:02.0 PCI bridge [0604]: Intel Corporation Sky Lake-E PCI Express Root Port C [8086:2032] (rev 07) (prog-if 00 [Normal decode])
	Control: I/O+ Mem+ BusMaster+ SpecCycle- MemWINV- VGASnoop- ParErr+ Stepping- SERR+ FastB2B- DisINTx+
	Status: Cap+ 66MHz- UDF- FastB2B- ParErr- DEVSEL=fast >TAbort- <TAbort- <MAbort- >SERR- <PERR- INTx-
	Latency: 0, Cache Line Size: 64 bytes
	Interrupt: pin A routed to IRQ 29
	NUMA node: 0
	Bus: primary=10, secondary=12, subordinate=12, sec-latency=0
	I/O behind bridge: None
	Memory behind bridge: None
	Prefetchable memory behind bridge: None
	Secondary status: 66MHz- FastB2B- ParErr- DEVSEL=fast >TAbort- <TAbort- <MAbort- <SERR- <PERR-
	BridgeCtl: Parity+ SERR+ NoISA- VGA- VGA16- MAbort- >Reset- FastB2B-
		PriDiscTmr- SecDiscTmr- DiscTmrStat- DiscTmrSERREn-
	Capabilities: <access denied>
	Kernel driver in use: pcieport

10:05.0 System peripheral [0880]: Intel Corporation Sky Lake-E VT-d [8086:2034] (rev 07)
	Subsystem: Hewlett Packard Enterprise Device [1590:00ea]
	Control: I/O- Mem- BusMaster- SpecCycle- MemWINV- VGASnoop- ParErr- Stepping- SERR- FastB2B- DisINTx-
	Status: Cap+ 66MHz- UDF- FastB2B- ParErr- DEVSEL=fast >TAbort- <TAbort- <MAbort- >SERR- <PERR- INTx-
	NUMA node: 0
	Capabilities: <access denied>

10:05.2 System peripheral [0880]: Intel Corporation Sky Lake-E RAS Configuration Registers [8086:2035] (rev 07)
	Subsystem: Hewlett Packard Enterprise Device [1590:00ea]
	Control: I/O- Mem- BusMaster- SpecCycle- MemWINV- VGASnoop- ParErr- Stepping- SERR- FastB2B- DisINTx-
	Status: Cap+ 66MHz- UDF- FastB2B- ParErr- DEVSEL=fast >TAbort- <TAbort- <MAbort- >SERR- <PERR- INTx-
	NUMA node: 0
	Capabilities: <access denied>

10:05.4 PIC [0800]: Intel Corporation Sky Lake-E IOxAPIC Configuration Registers [8086:2036] (rev 07) (prog-if 20 [IO(X)-APIC])
	Subsystem: Hewlett Packard Enterprise Device [1590:18a9]
	Control: I/O- Mem+ BusMaster+ SpecCycle- MemWINV- VGASnoop- ParErr- Stepping- SERR- FastB2B- DisINTx-
	Status: Cap+ 66MHz- UDF- FastB2B- ParErr- DEVSEL=fast >TAbort- <TAbort- <MAbort- >SERR- <PERR- INTx-
	Latency: 0, Cache Line Size: 64 bytes
	NUMA node: 0
	Region 0: Memory at e2800000 (32-bit, non-prefetchable) [size=4K]
	Capabilities: <access denied>

10:08.0 System peripheral [0880]: Intel Corporation Sky Lake-E CHA Registers [8086:208d] (rev 07)
	Subsystem: Hewlett Packard Enterprise Device [1590:00ea]
	Control: I/O- Mem- BusMaster- SpecCycle- MemWINV- VGASnoop- ParErr- Stepping- SERR- FastB2B- DisINTx-
	Status: Cap- 66MHz- UDF- FastB2B- ParErr- DEVSEL=fast >TAbort- <TAbort- <MAbort- >SERR- <PERR- INTx-
	NUMA node: 0

10:08.1 System peripheral [0880]: Intel Corporation Sky Lake-E CHA Registers [8086:208d] (rev 07)
	Subsystem: Hewlett Packard Enterprise Device [1590:00ea]
	Control: I/O- Mem- BusMaster- SpecCycle- MemWINV- VGASnoop- ParErr- Stepping- SERR- FastB2B- DisINTx-
	Status: Cap- 66MHz- UDF- FastB2B- ParErr- DEVSEL=fast >TAbort- <TAbort- <MAbort- >SERR- <PERR- INTx-
	NUMA node: 0

10:08.2 System peripheral [0880]: Intel Corporation Sky Lake-E CHA Registers [8086:208d] (rev 07)
	Subsystem: Hewlett Packard Enterprise Device [1590:00ea]
	Control: I/O- Mem- BusMaster- SpecCycle- MemWINV- VGASnoop- ParErr- Stepping- SERR- FastB2B- DisINTx-
	Status: Cap- 66MHz- UDF- FastB2B- ParErr- DEVSEL=fast >TAbort- <TAbort- <MAbort- >SERR- <PERR- INTx-
	NUMA node: 0

10:08.3 System peripheral [0880]: Intel Corporation Sky Lake-E CHA Registers [8086:208d] (rev 07)
	Subsystem: Hewlett Packard Enterprise Device [1590:00ea]
	Control: I/O- Mem- BusMaster- SpecCycle- MemWINV- VGASnoop- ParErr- Stepping- SERR- FastB2B- DisINTx-
	Status: Cap- 66MHz- UDF- FastB2B- ParErr- DEVSEL=fast >TAbort- <TAbort- <MAbort- >SERR- <PERR- INTx-
	NUMA node: 0

10:08.4 System peripheral [0880]: Intel Corporation Sky Lake-E CHA Registers [8086:208d] (rev 07)
	Subsystem: Hewlett Packard Enterprise Device [1590:00ea]
	Control: I/O- Mem- BusMaster- SpecCycle- MemWINV- VGASnoop- ParErr- Stepping- SERR- FastB2B- DisINTx-
	Status: Cap- 66MHz- UDF- FastB2B- ParErr- DEVSEL=fast >TAbort- <TAbort- <MAbort- >SERR- <PERR- INTx-
	NUMA node: 0

10:08.5 System peripheral [0880]: Intel Corporation Sky Lake-E CHA Registers [8086:208d] (rev 07)
	Subsystem: Hewlett Packard Enterprise Device [1590:00ea]
	Control: I/O- Mem- BusMaster- SpecCycle- MemWINV- VGASnoop- ParErr- Stepping- SERR- FastB2B- DisINTx-
	Status: Cap- 66MHz- UDF- FastB2B- ParErr- DEVSEL=fast >TAbort- <TAbort- <MAbort- >SERR- <PERR- INTx-
	NUMA node: 0

10:08.6 System peripheral [0880]: Intel Corporation Sky Lake-E CHA Registers [8086:208d] (rev 07)
	Subsystem: Hewlett Packard Enterprise Device [1590:00ea]
	Control: I/O- Mem- BusMaster- SpecCycle- MemWINV- VGASnoop- ParErr- Stepping- SERR- FastB2B- DisINTx-
	Status: Cap- 66MHz- UDF- FastB2B- ParErr- DEVSEL=fast >TAbort- <TAbort- <MAbort- >SERR- <PERR- INTx-
	NUMA node: 0

10:08.7 System peripheral [0880]: Intel Corporation Sky Lake-E CHA Registers [8086:208d] (rev 07)
	Subsystem: Hewlett Packard Enterprise Device [1590:00ea]
	Control: I/O- Mem- BusMaster- SpecCycle- MemWINV- VGASnoop- ParErr- Stepping- SERR- FastB2B- DisINTx-
	Status: Cap- 66MHz- UDF- FastB2B- ParErr- DEVSEL=fast >TAbort- <TAbort- <MAbort- >SERR- <PERR- INTx-
	NUMA node: 0

10:09.0 System peripheral [0880]: Intel Corporation Sky Lake-E CHA Registers [8086:208d] (rev 07)
	Subsystem: Hewlett Packard Enterprise Device [1590:00ea]
	Control: I/O- Mem- BusMaster- SpecCycle- MemWINV- VGASnoop- ParErr- Stepping- SERR- FastB2B- DisINTx-
	Status: Cap- 66MHz- UDF- FastB2B- ParErr- DEVSEL=fast >TAbort- <TAbort- <MAbort- >SERR- <PERR- INTx-
	NUMA node: 0

10:09.1 System peripheral [0880]: Intel Corporation Sky Lake-E CHA Registers [8086:208d] (rev 07)
	Subsystem: Hewlett Packard Enterprise Device [1590:00ea]
	Control: I/O- Mem- BusMaster- SpecCycle- MemWINV- VGASnoop- ParErr- Stepping- SERR- FastB2B- DisINTx-
	Status: Cap- 66MHz- UDF- FastB2B- ParErr- DEVSEL=fast >TAbort- <TAbort- <MAbort- >SERR- <PERR- INTx-
	NUMA node: 0

10:0e.0 System peripheral [0880]: Intel Corporation Sky Lake-E CHA Registers [8086:208e] (rev 07)
	Subsystem: Hewlett Packard Enterprise Device [1590:00ea]
	Control: I/O- Mem- BusMaster- SpecCycle- MemWINV- VGASnoop- ParErr- Stepping- SERR- FastB2B- DisINTx-
	Status: Cap- 66MHz- UDF- FastB2B- ParErr- DEVSEL=fast >TAbort- <TAbort- <MAbort- >SERR- <PERR- INTx-
	NUMA node: 0

10:0e.1 System peripheral [0880]: Intel Corporation Sky Lake-E CHA Registers [8086:208e] (rev 07)
	Subsystem: Hewlett Packard Enterprise Device [1590:00ea]
	Control: I/O- Mem- BusMaster- SpecCycle- MemWINV- VGASnoop- ParErr- Stepping- SERR- FastB2B- DisINTx-
	Status: Cap- 66MHz- UDF- FastB2B- ParErr- DEVSEL=fast >TAbort- <TAbort- <MAbort- >SERR- <PERR- INTx-
	NUMA node: 0

10:0e.2 System peripheral [0880]: Intel Corporation Sky Lake-E CHA Registers [8086:208e] (rev 07)
	Subsystem: Hewlett Packard Enterprise Device [1590:00ea]
	Control: I/O- Mem- BusMaster- SpecCycle- MemWINV- VGASnoop- ParErr- Stepping- SERR- FastB2B- DisINTx-
	Status: Cap- 66MHz- UDF- FastB2B- ParErr- DEVSEL=fast >TAbort- <TAbort- <MAbort- >SERR- <PERR- INTx-
	NUMA node: 0

10:0e.3 System peripheral [0880]: Intel Corporation Sky Lake-E CHA Registers [8086:208e] (rev 07)
	Subsystem: Hewlett Packard Enterprise Device [1590:00ea]
	Control: I/O- Mem- BusMaster- SpecCycle- MemWINV- VGASnoop- ParErr- Stepping- SERR- FastB2B- DisINTx-
	Status: Cap- 66MHz- UDF- FastB2B- ParErr- DEVSEL=fast >TAbort- <TAbort- <MAbort- >SERR- <PERR- INTx-
	NUMA node: 0

10:0e.4 System peripheral [0880]: Intel Corporation Sky Lake-E CHA Registers [8086:208e] (rev 07)
	Subsystem: Hewlett Packard Enterprise Device [1590:00ea]
	Control: I/O- Mem- BusMaster- SpecCycle- MemWINV- VGASnoop- ParErr- Stepping- SERR- FastB2B- DisINTx-
	Status: Cap- 66MHz- UDF- FastB2B- ParErr- DEVSEL=fast >TAbort- <TAbort- <MAbort- >SERR- <PERR- INTx-
	NUMA node: 0

10:0e.5 System peripheral [0880]: Intel Corporation Sky Lake-E CHA Registers [8086:208e] (rev 07)
	Subsystem: Hewlett Packard Enterprise Device [1590:00ea]
	Control: I/O- Mem- BusMaster- SpecCycle- MemWINV- VGASnoop- ParErr- Stepping- SERR- FastB2B- DisINTx-
	Status: Cap- 66MHz- UDF- FastB2B- ParErr- DEVSEL=fast >TAbort- <TAbort- <MAbort- >SERR- <PERR- INTx-
	NUMA node: 0

10:0e.6 System peripheral [0880]: Intel Corporation Sky Lake-E CHA Registers [8086:208e] (rev 07)
	Subsystem: Hewlett Packard Enterprise Device [1590:00ea]
	Control: I/O- Mem- BusMaster- SpecCycle- MemWINV- VGASnoop- ParErr- Stepping- SERR- FastB2B- DisINTx-
	Status: Cap- 66MHz- UDF- FastB2B- ParErr- DEVSEL=fast >TAbort- <TAbort- <MAbort- >SERR- <PERR- INTx-
	NUMA node: 0

10:0e.7 System peripheral [0880]: Intel Corporation Sky Lake-E CHA Registers [8086:208e] (rev 07)
	Subsystem: Hewlett Packard Enterprise Device [1590:00ea]
	Control: I/O- Mem- BusMaster- SpecCycle- MemWINV- VGASnoop- ParErr- Stepping- SERR- FastB2B- DisINTx-
	Status: Cap- 66MHz- UDF- FastB2B- ParErr- DEVSEL=fast >TAbort- <TAbort- <MAbort- >SERR- <PERR- INTx-
	NUMA node: 0

10:0f.0 System peripheral [0880]: Intel Corporation Sky Lake-E CHA Registers [8086:208e] (rev 07)
	Subsystem: Hewlett Packard Enterprise Device [1590:00ea]
	Control: I/O- Mem- BusMaster- SpecCycle- MemWINV- VGASnoop- ParErr- Stepping- SERR- FastB2B- DisINTx-
	Status: Cap- 66MHz- UDF- FastB2B- ParErr- DEVSEL=fast >TAbort- <TAbort- <MAbort- >SERR- <PERR- INTx-
	NUMA node: 0

10:0f.1 System peripheral [0880]: Intel Corporation Sky Lake-E CHA Registers [8086:208e] (rev 07)
	Subsystem: Hewlett Packard Enterprise Device [1590:00ea]
	Control: I/O- Mem- BusMaster- SpecCycle- MemWINV- VGASnoop- ParErr- Stepping- SERR- FastB2B- DisINTx-
	Status: Cap- 66MHz- UDF- FastB2B- ParErr- DEVSEL=fast >TAbort- <TAbort- <MAbort- >SERR- <PERR- INTx-
	NUMA node: 0

10:1d.0 System peripheral [0880]: Intel Corporation Sky Lake-E CHA Registers [8086:2054] (rev 07)
	Subsystem: Hewlett Packard Enterprise Device [1590:00ea]
	Control: I/O- Mem- BusMaster- SpecCycle- MemWINV- VGASnoop- ParErr- Stepping- SERR- FastB2B- DisINTx-
	Status: Cap- 66MHz- UDF- FastB2B- ParErr- DEVSEL=fast >TAbort- <TAbort- <MAbort- >SERR- <PERR- INTx-
	NUMA node: 0

10:1d.1 System peripheral [0880]: Intel Corporation Sky Lake-E CHA Registers [8086:2055] (rev 07)
	Subsystem: Hewlett Packard Enterprise Device [1590:00ea]
	Control: I/O- Mem- BusMaster- SpecCycle- MemWINV- VGASnoop- ParErr- Stepping- SERR- FastB2B- DisINTx-
	Status: Cap- 66MHz- UDF- FastB2B- ParErr- DEVSEL=fast >TAbort- <TAbort- <MAbort- >SERR- <PERR- INTx-
	NUMA node: 0

10:1d.2 System peripheral [0880]: Intel Corporation Sky Lake-E CHA Registers [8086:2056] (rev 07)
	Subsystem: Hewlett Packard Enterprise Device [1590:00ea]
	Control: I/O- Mem- BusMaster- SpecCycle- MemWINV- VGASnoop- ParErr- Stepping- SERR- FastB2B- DisINTx-
	Status: Cap- 66MHz- UDF- FastB2B- ParErr- DEVSEL=fast >TAbort- <TAbort- <MAbort- >SERR- <PERR- INTx-
	NUMA node: 0

10:1d.3 System peripheral [0880]: Intel Corporation Sky Lake-E CHA Registers [8086:2057] (rev 07)
	Subsystem: Hewlett Packard Enterprise Device [1590:00ea]
	Control: I/O- Mem- BusMaster- SpecCycle- MemWINV- VGASnoop- ParErr- Stepping- SERR- FastB2B- DisINTx-
	Status: Cap- 66MHz- UDF- FastB2B- ParErr- DEVSEL=fast >TAbort- <TAbort- <MAbort- >SERR- <PERR- INTx-
	NUMA node: 0

10:1e.0 System peripheral [0880]: Intel Corporation Sky Lake-E PCU Registers [8086:2080] (rev 07)
	Subsystem: Hewlett Packard Enterprise Device [1590:00ea]
	Control: I/O- Mem- BusMaster- SpecCycle- MemWINV- VGASnoop- ParErr- Stepping- SERR- FastB2B- DisINTx-
	Status: Cap- 66MHz- UDF- FastB2B- ParErr- DEVSEL=fast >TAbort- <TAbort- <MAbort- >SERR- <PERR- INTx-
	NUMA node: 0

10:1e.1 System peripheral [0880]: Intel Corporation Sky Lake-E PCU Registers [8086:2081] (rev 07)
	Subsystem: Hewlett Packard Enterprise Device [1590:00ea]
	Control: I/O- Mem- BusMaster- SpecCycle- MemWINV- VGASnoop- ParErr- Stepping- SERR- FastB2B- DisINTx-
	Status: Cap- 66MHz- UDF- FastB2B- ParErr- DEVSEL=fast >TAbort- <TAbort- <MAbort- >SERR- <PERR- INTx-
	NUMA node: 0

10:1e.2 System peripheral [0880]: Intel Corporation Sky Lake-E PCU Registers [8086:2082] (rev 07)
	Subsystem: Hewlett Packard Enterprise Device [1590:00ea]
	Control: I/O- Mem- BusMaster- SpecCycle- MemWINV- VGASnoop- ParErr- Stepping- SERR- FastB2B- DisINTx-
	Status: Cap- 66MHz- UDF- FastB2B- ParErr- DEVSEL=fast >TAbort- <TAbort- <MAbort- >SERR- <PERR- INTx-
	NUMA node: 0

10:1e.3 System peripheral [0880]: Intel Corporation Sky Lake-E PCU Registers [8086:2083] (rev 07)
	Subsystem: Hewlett Packard Enterprise Device [1590:00ea]
	Control: I/O- Mem- BusMaster- SpecCycle- MemWINV- VGASnoop- ParErr- Stepping- SERR- FastB2B- DisINTx-
	Status: Cap- 66MHz- UDF- FastB2B- ParErr- DEVSEL=fast >TAbort- <TAbort- <MAbort- >SERR- <PERR- INTx-
	NUMA node: 0

10:1e.4 System peripheral [0880]: Intel Corporation Sky Lake-E PCU Registers [8086:2084] (rev 07)
	Subsystem: Hewlett Packard Enterprise Device [1590:00ea]
	Control: I/O- Mem- BusMaster- SpecCycle- MemWINV- VGASnoop- ParErr- Stepping- SERR- FastB2B- DisINTx-
	Status: Cap- 66MHz- UDF- FastB2B- ParErr- DEVSEL=fast >TAbort- <TAbort- <MAbort- >SERR- <PERR- INTx-
	NUMA node: 0

10:1e.5 System peripheral [0880]: Intel Corporation Sky Lake-E PCU Registers [8086:2085] (rev 07)
	Subsystem: Hewlett Packard Enterprise Device [1590:00ea]
	Control: I/O- Mem- BusMaster- SpecCycle- MemWINV- VGASnoop- ParErr- Stepping- SERR- FastB2B- DisINTx-
	Status: Cap- 66MHz- UDF- FastB2B- ParErr- DEVSEL=fast >TAbort- <TAbort- <MAbort- >SERR- <PERR- INTx-
	NUMA node: 0

10:1e.6 System peripheral [0880]: Intel Corporation Sky Lake-E PCU Registers [8086:2086] (rev 07)
	Subsystem: Hewlett Packard Enterprise Device [1590:00ea]
	Control: I/O- Mem- BusMaster- SpecCycle- MemWINV- VGASnoop- ParErr- Stepping- SERR- FastB2B- DisINTx-
	Status: Cap- 66MHz- UDF- FastB2B- ParErr- DEVSEL=fast >TAbort- <TAbort- <MAbort- >SERR- <PERR- INTx-
	NUMA node: 0

60:00.0 PCI bridge [0604]: Intel Corporation Sky Lake-E PCI Express Root Port A [8086:2030] (rev 07) (prog-if 00 [Normal decode])
	Control: I/O+ Mem+ BusMaster+ SpecCycle- MemWINV- VGASnoop- ParErr+ Stepping- SERR+ FastB2B- DisINTx+
	Status: Cap+ 66MHz- UDF- FastB2B- ParErr- DEVSEL=fast >TAbort- <TAbort- <MAbort- >SERR- <PERR- INTx-
	Latency: 0, Cache Line Size: 64 bytes
	Interrupt: pin A routed to IRQ 31
	NUMA node: 0
	Bus: primary=60, secondary=61, subordinate=61, sec-latency=0
	I/O behind bridge: None
	Memory behind bridge: None
	Prefetchable memory behind bridge: None
	Secondary status: 66MHz- FastB2B- ParErr- DEVSEL=fast >TAbort- <TAbort- <MAbort- <SERR- <PERR-
	BridgeCtl: Parity+ SERR+ NoISA- VGA- VGA16- MAbort- >Reset- FastB2B-
		PriDiscTmr- SecDiscTmr- DiscTmrStat- DiscTmrSERREn-
	Capabilities: <access denied>
	Kernel driver in use: pcieport

60:05.0 System peripheral [0880]: Intel Corporation Sky Lake-E VT-d [8086:2034] (rev 07)
	Subsystem: Hewlett Packard Enterprise Device [1590:00ea]
	Control: I/O- Mem- BusMaster- SpecCycle- MemWINV- VGASnoop- ParErr- Stepping- SERR- FastB2B- DisINTx-
	Status: Cap+ 66MHz- UDF- FastB2B- ParErr- DEVSEL=fast >TAbort- <TAbort- <MAbort- >SERR- <PERR- INTx-
	NUMA node: 0
	Capabilities: <access denied>

60:05.2 System peripheral [0880]: Intel Corporation Sky Lake-E RAS Configuration Registers [8086:2035] (rev 07)
	Subsystem: Hewlett Packard Enterprise Device [1590:00ea]
	Control: I/O- Mem- BusMaster- SpecCycle- MemWINV- VGASnoop- ParErr- Stepping- SERR- FastB2B- DisINTx-
	Status: Cap+ 66MHz- UDF- FastB2B- ParErr- DEVSEL=fast >TAbort- <TAbort- <MAbort- >SERR- <PERR- INTx-
	NUMA node: 0
	Capabilities: <access denied>

60:05.4 PIC [0800]: Intel Corporation Sky Lake-E IOxAPIC Configuration Registers [8086:2036] (rev 07) (prog-if 20 [IO(X)-APIC])
	Subsystem: Hewlett Packard Enterprise Device [1590:18a9]
	Control: I/O- Mem+ BusMaster+ SpecCycle- MemWINV- VGASnoop- ParErr- Stepping- SERR- FastB2B- DisINTx-
	Status: Cap+ 66MHz- UDF- FastB2B- ParErr- DEVSEL=fast >TAbort- <TAbort- <MAbort- >SERR- <PERR- INTx-
	Latency: 0, Cache Line Size: 64 bytes
	NUMA node: 0
	Region 0: Memory at eb000000 (32-bit, non-prefetchable) [size=4K]
	Capabilities: <access denied>

60:08.0 System peripheral [0880]: Intel Corporation Sky Lake-E Integrated Memory Controller [8086:2066] (rev 07)
	Subsystem: Hewlett Packard Enterprise Device [1590:00ea]
	Control: I/O- Mem- BusMaster- SpecCycle- MemWINV- VGASnoop- ParErr- Stepping- SERR- FastB2B- DisINTx-
	Status: Cap+ 66MHz- UDF- FastB2B- ParErr- DEVSEL=fast >TAbort- <TAbort- <MAbort- >SERR- <PERR- INTx-
	NUMA node: 0
	Capabilities: <access denied>
	Kernel driver in use: skx_uncore

60:09.0 System peripheral [0880]: Intel Corporation Sky Lake-E Integrated Memory Controller [8086:2066] (rev 07)
	Subsystem: Hewlett Packard Enterprise Device [1590:00ea]
	Control: I/O- Mem- BusMaster- SpecCycle- MemWINV- VGASnoop- ParErr- Stepping- SERR- FastB2B- DisINTx-
	Status: Cap+ 66MHz- UDF- FastB2B- ParErr- DEVSEL=fast >TAbort- <TAbort- <MAbort- >SERR- <PERR- INTx-
	NUMA node: 0
	Capabilities: <access denied>
	Kernel driver in use: skx_uncore

60:0a.0 System peripheral [0880]: Intel Corporation Sky Lake-E Integrated Memory Controller [8086:2040] (rev 07)
	Subsystem: Hewlett Packard Enterprise Device [1590:00ea]
	Control: I/O- Mem- BusMaster- SpecCycle- MemWINV- VGASnoop- ParErr- Stepping- SERR- FastB2B- DisINTx-
	Status: Cap+ 66MHz- UDF- FastB2B- ParErr- DEVSEL=fast >TAbort- <TAbort- <MAbort- >SERR- <PERR- INTx-
	NUMA node: 0
	Capabilities: <access denied>

60:0a.1 System peripheral [0880]: Intel Corporation Sky Lake-E Integrated Memory Controller [8086:2041] (rev 07)
	Subsystem: Hewlett Packard Enterprise Device [1590:00ea]
	Control: I/O- Mem- BusMaster- SpecCycle- MemWINV- VGASnoop- ParErr- Stepping- SERR- FastB2B- DisINTx-
	Status: Cap+ 66MHz- UDF- FastB2B- ParErr- DEVSEL=fast >TAbort- <TAbort- <MAbort- >SERR- <PERR- INTx-
	NUMA node: 0
	Capabilities: <access denied>

60:0a.2 System peripheral [0880]: Intel Corporation Sky Lake-E Integrated Memory Controller [8086:2042] (rev 07)
	Subsystem: Hewlett Packard Enterprise Device [1590:00ea]
	Control: I/O- Mem- BusMaster- SpecCycle- MemWINV- VGASnoop- ParErr- Stepping- SERR- FastB2B- DisINTx-
	Status: Cap+ 66MHz- UDF- FastB2B- ParErr- DEVSEL=fast >TAbort- <TAbort- <MAbort- >SERR- <PERR- INTx-
	NUMA node: 0
	Capabilities: <access denied>
	Kernel driver in use: skx_uncore

60:0a.3 System peripheral [0880]: Intel Corporation Sky Lake-E Integrated Memory Controller [8086:2043] (rev 07)
	Subsystem: Hewlett Packard Enterprise Device [1590:00ea]
	Control: I/O- Mem- BusMaster- SpecCycle- MemWINV- VGASnoop- ParErr- Stepping- SERR- FastB2B- DisINTx-
	Status: Cap+ 66MHz- UDF- FastB2B- ParErr- DEVSEL=fast >TAbort- <TAbort- <MAbort- >SERR- <PERR- INTx-
	NUMA node: 0
	Capabilities: <access denied>

60:0a.4 System peripheral [0880]: Intel Corporation Sky Lake-E Integrated Memory Controller [8086:2044] (rev 07)
	Subsystem: Hewlett Packard Enterprise Device [1590:00ea]
	Control: I/O- Mem- BusMaster- SpecCycle- MemWINV- VGASnoop- ParErr- Stepping- SERR- FastB2B- DisINTx-
	Status: Cap+ 66MHz- UDF- FastB2B- ParErr- DEVSEL=fast >TAbort- <TAbort- <MAbort- >SERR- <PERR- INTx-
	NUMA node: 0
	Capabilities: <access denied>

60:0a.5 System peripheral [0880]: Intel Corporation Sky Lake-E LM Channel 1 [8086:2045] (rev 07)
	Subsystem: Hewlett Packard Enterprise Device [1590:00ea]
	Control: I/O- Mem- BusMaster- SpecCycle- MemWINV- VGASnoop- ParErr- Stepping- SERR- FastB2B- DisINTx-
	Status: Cap+ 66MHz- UDF- FastB2B- ParErr- DEVSEL=fast >TAbort- <TAbort- <MAbort- >SERR- <PERR- INTx-
	NUMA node: 0
	Capabilities: <access denied>

60:0a.6 System peripheral [0880]: Intel Corporation Sky Lake-E LMS Channel 1 [8086:2046] (rev 07)
	Subsystem: Hewlett Packard Enterprise Device [1590:00ea]
	Control: I/O- Mem- BusMaster- SpecCycle- MemWINV- VGASnoop- ParErr- Stepping- SERR- FastB2B- DisINTx-
	Status: Cap+ 66MHz- UDF- FastB2B- ParErr- DEVSEL=fast >TAbort- <TAbort- <MAbort- >SERR- <PERR- INTx-
	NUMA node: 0
	Capabilities: <access denied>
	Kernel driver in use: skx_uncore

60:0a.7 System peripheral [0880]: Intel Corporation Sky Lake-E LMDP Channel 1 [8086:2047] (rev 07)
	Subsystem: Hewlett Packard Enterprise Device [1590:00ea]
	Control: I/O- Mem- BusMaster- SpecCycle- MemWINV- VGASnoop- ParErr- Stepping- SERR- FastB2B- DisINTx-
	Status: Cap+ 66MHz- UDF- FastB2B- ParErr- DEVSEL=fast >TAbort- <TAbort- <MAbort- >SERR- <PERR- INTx-
	NUMA node: 0
	Capabilities: <access denied>

60:0b.0 System peripheral [0880]: Intel Corporation Sky Lake-E DECS Channel 2 [8086:2048] (rev 07)
	Subsystem: Hewlett Packard Enterprise Device [1590:00ea]
	Control: I/O- Mem- BusMaster- SpecCycle- MemWINV- VGASnoop- ParErr- Stepping- SERR- FastB2B- DisINTx-
	Status: Cap+ 66MHz- UDF- FastB2B- ParErr- DEVSEL=fast >TAbort- <TAbort- <MAbort- >SERR- <PERR- INTx-
	NUMA node: 0
	Capabilities: <access denied>

60:0b.1 System peripheral [0880]: Intel Corporation Sky Lake-E LM Channel 2 [8086:2049] (rev 07)
	Subsystem: Hewlett Packard Enterprise Device [1590:00ea]
	Control: I/O- Mem- BusMaster- SpecCycle- MemWINV- VGASnoop- ParErr- Stepping- SERR- FastB2B- DisINTx-
	Status: Cap+ 66MHz- UDF- FastB2B- ParErr- DEVSEL=fast >TAbort- <TAbort- <MAbort- >SERR- <PERR- INTx-
	NUMA node: 0
	Capabilities: <access denied>

60:0b.2 System peripheral [0880]: Intel Corporation Sky Lake-E LMS Channel 2 [8086:204a] (rev 07)
	Subsystem: Hewlett Packard Enterprise Device [1590:00ea]
	Control: I/O- Mem- BusMaster- SpecCycle- MemWINV- VGASnoop- ParErr- Stepping- SERR- FastB2B- DisINTx-
	Status: Cap+ 66MHz- UDF- FastB2B- ParErr- DEVSEL=fast >TAbort- <TAbort- <MAbort- >SERR- <PERR- INTx-
	NUMA node: 0
	Capabilities: <access denied>
	Kernel driver in use: skx_uncore

60:0b.3 System peripheral [0880]: Intel Corporation Sky Lake-E LMDP Channel 2 [8086:204b] (rev 07)
	Subsystem: Hewlett Packard Enterprise Device [1590:00ea]
	Control: I/O- Mem- BusMaster- SpecCycle- MemWINV- VGASnoop- ParErr- Stepping- SERR- FastB2B- DisINTx-
	Status: Cap+ 66MHz- UDF- FastB2B- ParErr- DEVSEL=fast >TAbort- <TAbort- <MAbort- >SERR- <PERR- INTx-
	NUMA node: 0
	Capabilities: <access denied>

60:0c.0 System peripheral [0880]: Intel Corporation Sky Lake-E Integrated Memory Controller [8086:2040] (rev 07)
	Subsystem: Hewlett Packard Enterprise Device [1590:00ea]
	Control: I/O- Mem- BusMaster- SpecCycle- MemWINV- VGASnoop- ParErr- Stepping- SERR- FastB2B- DisINTx-
	Status: Cap+ 66MHz- UDF- FastB2B- ParErr- DEVSEL=fast >TAbort- <TAbort- <MAbort- >SERR- <PERR- INTx-
	NUMA node: 0
	Capabilities: <access denied>

60:0c.1 System peripheral [0880]: Intel Corporation Sky Lake-E Integrated Memory Controller [8086:2041] (rev 07)
	Subsystem: Hewlett Packard Enterprise Device [1590:00ea]
	Control: I/O- Mem- BusMaster- SpecCycle- MemWINV- VGASnoop- ParErr- Stepping- SERR- FastB2B- DisINTx-
	Status: Cap+ 66MHz- UDF- FastB2B- ParErr- DEVSEL=fast >TAbort- <TAbort- <MAbort- >SERR- <PERR- INTx-
	NUMA node: 0
	Capabilities: <access denied>

60:0c.2 System peripheral [0880]: Intel Corporation Sky Lake-E Integrated Memory Controller [8086:2042] (rev 07)
	Subsystem: Hewlett Packard Enterprise Device [1590:00ea]
	Control: I/O- Mem- BusMaster- SpecCycle- MemWINV- VGASnoop- ParErr- Stepping- SERR- FastB2B- DisINTx-
	Status: Cap+ 66MHz- UDF- FastB2B- ParErr- DEVSEL=fast >TAbort- <TAbort- <MAbort- >SERR- <PERR- INTx-
	NUMA node: 0
	Capabilities: <access denied>
	Kernel driver in use: skx_uncore

60:0c.3 System peripheral [0880]: Intel Corporation Sky Lake-E Integrated Memory Controller [8086:2043] (rev 07)
	Subsystem: Hewlett Packard Enterprise Device [1590:00ea]
	Control: I/O- Mem- BusMaster- SpecCycle- MemWINV- VGASnoop- ParErr- Stepping- SERR- FastB2B- DisINTx-
	Status: Cap+ 66MHz- UDF- FastB2B- ParErr- DEVSEL=fast >TAbort- <TAbort- <MAbort- >SERR- <PERR- INTx-
	NUMA node: 0
	Capabilities: <access denied>

60:0c.4 System peripheral [0880]: Intel Corporation Sky Lake-E Integrated Memory Controller [8086:2044] (rev 07)
	Subsystem: Hewlett Packard Enterprise Device [1590:00ea]
	Control: I/O- Mem- BusMaster- SpecCycle- MemWINV- VGASnoop- ParErr- Stepping- SERR- FastB2B- DisINTx-
	Status: Cap+ 66MHz- UDF- FastB2B- ParErr- DEVSEL=fast >TAbort- <TAbort- <MAbort- >SERR- <PERR- INTx-
	NUMA node: 0
	Capabilities: <access denied>

60:0c.5 System peripheral [0880]: Intel Corporation Sky Lake-E LM Channel 1 [8086:2045] (rev 07)
	Subsystem: Hewlett Packard Enterprise Device [1590:00ea]
	Control: I/O- Mem- BusMaster- SpecCycle- MemWINV- VGASnoop- ParErr- Stepping- SERR- FastB2B- DisINTx-
	Status: Cap+ 66MHz- UDF- FastB2B- ParErr- DEVSEL=fast >TAbort- <TAbort- <MAbort- >SERR- <PERR- INTx-
	NUMA node: 0
	Capabilities: <access denied>

60:0c.6 System peripheral [0880]: Intel Corporation Sky Lake-E LMS Channel 1 [8086:2046] (rev 07)
	Subsystem: Hewlett Packard Enterprise Device [1590:00ea]
	Control: I/O- Mem- BusMaster- SpecCycle- MemWINV- VGASnoop- ParErr- Stepping- SERR- FastB2B- DisINTx-
	Status: Cap+ 66MHz- UDF- FastB2B- ParErr- DEVSEL=fast >TAbort- <TAbort- <MAbort- >SERR- <PERR- INTx-
	NUMA node: 0
	Capabilities: <access denied>
	Kernel driver in use: skx_uncore

60:0c.7 System peripheral [0880]: Intel Corporation Sky Lake-E LMDP Channel 1 [8086:2047] (rev 07)
	Subsystem: Hewlett Packard Enterprise Device [1590:00ea]
	Control: I/O- Mem- BusMaster- SpecCycle- MemWINV- VGASnoop- ParErr- Stepping- SERR- FastB2B- DisINTx-
	Status: Cap+ 66MHz- UDF- FastB2B- ParErr- DEVSEL=fast >TAbort- <TAbort- <MAbort- >SERR- <PERR- INTx-
	NUMA node: 0
	Capabilities: <access denied>

60:0d.0 System peripheral [0880]: Intel Corporation Sky Lake-E DECS Channel 2 [8086:2048] (rev 07)
	Subsystem: Hewlett Packard Enterprise Device [1590:00ea]
	Control: I/O- Mem- BusMaster- SpecCycle- MemWINV- VGASnoop- ParErr- Stepping- SERR- FastB2B- DisINTx-
	Status: Cap+ 66MHz- UDF- FastB2B- ParErr- DEVSEL=fast >TAbort- <TAbort- <MAbort- >SERR- <PERR- INTx-
	NUMA node: 0
	Capabilities: <access denied>

60:0d.1 System peripheral [0880]: Intel Corporation Sky Lake-E LM Channel 2 [8086:2049] (rev 07)
	Subsystem: Hewlett Packard Enterprise Device [1590:00ea]
	Control: I/O- Mem- BusMaster- SpecCycle- MemWINV- VGASnoop- ParErr- Stepping- SERR- FastB2B- DisINTx-
	Status: Cap+ 66MHz- UDF- FastB2B- ParErr- DEVSEL=fast >TAbort- <TAbort- <MAbort- >SERR- <PERR- INTx-
	NUMA node: 0
	Capabilities: <access denied>

60:0d.2 System peripheral [0880]: Intel Corporation Sky Lake-E LMS Channel 2 [8086:204a] (rev 07)
	Subsystem: Hewlett Packard Enterprise Device [1590:00ea]
	Control: I/O- Mem- BusMaster- SpecCycle- MemWINV- VGASnoop- ParErr- Stepping- SERR- FastB2B- DisINTx-
	Status: Cap+ 66MHz- UDF- FastB2B- ParErr- DEVSEL=fast >TAbort- <TAbort- <MAbort- >SERR- <PERR- INTx-
	NUMA node: 0
	Capabilities: <access denied>
	Kernel driver in use: skx_uncore

60:0d.3 System peripheral [0880]: Intel Corporation Sky Lake-E LMDP Channel 2 [8086:204b] (rev 07)
	Subsystem: Hewlett Packard Enterprise Device [1590:00ea]
	Control: I/O- Mem- BusMaster- SpecCycle- MemWINV- VGASnoop- ParErr- Stepping- SERR- FastB2B- DisINTx-
	Status: Cap+ 66MHz- UDF- FastB2B- ParErr- DEVSEL=fast >TAbort- <TAbort- <MAbort- >SERR- <PERR- INTx-
	NUMA node: 0
	Capabilities: <access denied>

b0:00.0 PCI bridge [0604]: Intel Corporation Sky Lake-E PCI Express Root Port A [8086:2030] (rev 07) (prog-if 00 [Normal decode])
	Control: I/O+ Mem+ BusMaster+ SpecCycle- MemWINV- VGASnoop- ParErr+ Stepping- SERR+ FastB2B- DisINTx+
	Status: Cap+ 66MHz- UDF- FastB2B- ParErr- DEVSEL=fast >TAbort- <TAbort- <MAbort- >SERR- <PERR- INTx-
	Latency: 0, Cache Line Size: 64 bytes
	Interrupt: pin A routed to IRQ 33
	NUMA node: 0
	Bus: primary=b0, secondary=b1, subordinate=b1, sec-latency=0
	I/O behind bridge: 0000c000-0000cfff [size=4K]
	Memory behind bridge: f3d00000-f3dfffff [size=1M]
	Prefetchable memory behind bridge: None
	Secondary status: 66MHz- FastB2B- ParErr- DEVSEL=fast >TAbort- <TAbort- <MAbort- <SERR- <PERR-
	BridgeCtl: Parity+ SERR+ NoISA- VGA- VGA16- MAbort- >Reset- FastB2B-
		PriDiscTmr- SecDiscTmr- DiscTmrStat- DiscTmrSERREn-
	Capabilities: <access denied>
	Kernel driver in use: pcieport

b0:02.0 PCI bridge [0604]: Intel Corporation Sky Lake-E PCI Express Root Port C [8086:2032] (rev 07) (prog-if 00 [Normal decode])
	Control: I/O+ Mem+ BusMaster+ SpecCycle- MemWINV- VGASnoop- ParErr+ Stepping- SERR+ FastB2B- DisINTx+
	Status: Cap+ 66MHz- UDF- FastB2B- ParErr- DEVSEL=fast >TAbort- <TAbort- <MAbort- >SERR- <PERR- INTx-
	Latency: 0, Cache Line Size: 64 bytes
	Interrupt: pin A routed to IRQ 35
	NUMA node: 0
	Bus: primary=b0, secondary=b2, subordinate=b2, sec-latency=0
	I/O behind bridge: None
	Memory behind bridge: f3800000-f3cfffff [size=5M]
	Prefetchable memory behind bridge: 00000cfffff00000-00000cffffffffff [size=1M]
	Secondary status: 66MHz- FastB2B- ParErr- DEVSEL=fast >TAbort- <TAbort- <MAbort+ <SERR- <PERR-
	BridgeCtl: Parity+ SERR+ NoISA- VGA- VGA16- MAbort- >Reset- FastB2B-
		PriDiscTmr- SecDiscTmr- DiscTmrStat- DiscTmrSERREn-
	Capabilities: <access denied>
	Kernel driver in use: pcieport

b0:05.0 System peripheral [0880]: Intel Corporation Sky Lake-E VT-d [8086:2034] (rev 07)
	Subsystem: Hewlett Packard Enterprise Device [1590:00ea]
	Control: I/O- Mem- BusMaster- SpecCycle- MemWINV- VGASnoop- ParErr- Stepping- SERR- FastB2B- DisINTx-
	Status: Cap+ 66MHz- UDF- FastB2B- ParErr- DEVSEL=fast >TAbort- <TAbort- <MAbort- >SERR- <PERR- INTx-
	NUMA node: 0
	Capabilities: <access denied>

b0:05.2 System peripheral [0880]: Intel Corporation Sky Lake-E RAS Configuration Registers [8086:2035] (rev 07)
	Subsystem: Hewlett Packard Enterprise Device [1590:00ea]
	Control: I/O- Mem- BusMaster- SpecCycle- MemWINV- VGASnoop- ParErr- Stepping- SERR- FastB2B- DisINTx-
	Status: Cap+ 66MHz- UDF- FastB2B- ParErr- DEVSEL=fast >TAbort- <TAbort- <MAbort- >SERR- <PERR- INTx-
	NUMA node: 0
	Capabilities: <access denied>

b0:05.4 PIC [0800]: Intel Corporation Sky Lake-E IOxAPIC Configuration Registers [8086:2036] (rev 07) (prog-if 20 [IO(X)-APIC])
	Subsystem: Hewlett Packard Enterprise Device [1590:18a9]
	Control: I/O- Mem+ BusMaster+ SpecCycle- MemWINV- VGASnoop- ParErr- Stepping- SERR- FastB2B- DisINTx-
	Status: Cap+ 66MHz- UDF- FastB2B- ParErr- DEVSEL=fast >TAbort- <TAbort- <MAbort- >SERR- <PERR- INTx-
	Latency: 0, Cache Line Size: 64 bytes
	NUMA node: 0
	Region 0: Memory at f3e00000 (32-bit, non-prefetchable) [size=4K]
	Capabilities: <access denied>

b0:0e.0 Performance counters [1101]: Intel Corporation Sky Lake-E KTI 0 [8086:2058] (rev 07)
	Subsystem: Hewlett Packard Enterprise Device [1590:00ea]
	Control: I/O- Mem- BusMaster- SpecCycle- MemWINV- VGASnoop- ParErr- Stepping- SERR- FastB2B- DisINTx-
	Status: Cap+ 66MHz- UDF- FastB2B- ParErr- DEVSEL=fast >TAbort- <TAbort- <MAbort- >SERR- <PERR- INTx-
	NUMA node: 0
	Capabilities: <access denied>
	Kernel driver in use: skx_uncore

b0:0e.1 System peripheral [0880]: Intel Corporation Sky Lake-E UPI Registers [8086:2059] (rev 07)
	Subsystem: Hewlett Packard Enterprise Device [1590:00ea]
	Control: I/O- Mem- BusMaster- SpecCycle- MemWINV- VGASnoop- ParErr- Stepping- SERR- FastB2B- DisINTx-
	Status: Cap+ 66MHz- UDF- FastB2B- ParErr- DEVSEL=fast >TAbort- <TAbort- <MAbort- >SERR- <PERR- INTx-
	NUMA node: 0
	Capabilities: <access denied>

b0:0f.0 Performance counters [1101]: Intel Corporation Sky Lake-E KTI 0 [8086:2058] (rev 07)
	Subsystem: Hewlett Packard Enterprise Device [1590:00ea]
	Control: I/O- Mem- BusMaster- SpecCycle- MemWINV- VGASnoop- ParErr- Stepping- SERR- FastB2B- DisINTx-
	Status: Cap+ 66MHz- UDF- FastB2B- ParErr- DEVSEL=fast >TAbort- <TAbort- <MAbort- >SERR- <PERR- INTx-
	NUMA node: 0
	Capabilities: <access denied>
	Kernel driver in use: skx_uncore

b0:0f.1 System peripheral [0880]: Intel Corporation Sky Lake-E UPI Registers [8086:2059] (rev 07)
	Subsystem: Hewlett Packard Enterprise Device [1590:00ea]
	Control: I/O- Mem- BusMaster- SpecCycle- MemWINV- VGASnoop- ParErr- Stepping- SERR- FastB2B- DisINTx-
	Status: Cap+ 66MHz- UDF- FastB2B- ParErr- DEVSEL=fast >TAbort- <TAbort- <MAbort- >SERR- <PERR- INTx-
	NUMA node: 0
	Capabilities: <access denied>

b0:12.0 Performance counters [1101]: Intel Corporation Sky Lake-E M3KTI Registers [8086:204c] (rev 07)
	Subsystem: Hewlett Packard Enterprise Device [1590:00ea]
	Control: I/O- Mem- BusMaster- SpecCycle- MemWINV- VGASnoop- ParErr- Stepping- SERR- FastB2B- DisINTx-
	Status: Cap+ 66MHz- UDF- FastB2B- ParErr- DEVSEL=fast >TAbort- <TAbort- <MAbort- >SERR- <PERR- INTx-
	NUMA node: 0
	Capabilities: <access denied>

b0:12.1 Performance counters [1101]: Intel Corporation Sky Lake-E M3KTI Registers [8086:204d] (rev 07)
	Subsystem: Hewlett Packard Enterprise Device [1590:00ea]
	Control: I/O- Mem- BusMaster- SpecCycle- MemWINV- VGASnoop- ParErr- Stepping- SERR- FastB2B- DisINTx-
	Status: Cap- 66MHz- UDF- FastB2B- ParErr- DEVSEL=fast >TAbort- <TAbort- <MAbort- >SERR- <PERR- INTx-
	NUMA node: 0
	Kernel driver in use: skx_uncore

b0:12.2 System peripheral [0880]: Intel Corporation Sky Lake-E M3KTI Registers [8086:204e] (rev 07)
	Subsystem: Hewlett Packard Enterprise Device [1590:00ea]
	Control: I/O- Mem- BusMaster- SpecCycle- MemWINV- VGASnoop- ParErr- Stepping- SERR- FastB2B- DisINTx-
	Status: Cap- 66MHz- UDF- FastB2B- ParErr- DEVSEL=fast >TAbort- <TAbort- <MAbort- >SERR- <PERR- INTx-
	NUMA node: 0
	Kernel driver in use: skx_uncore

b0:15.0 System peripheral [0880]: Intel Corporation Sky Lake-E M2PCI Registers [8086:2018] (rev 07)
	Subsystem: Hewlett Packard Enterprise Device [1590:00ea]
	Control: I/O- Mem- BusMaster- SpecCycle- MemWINV- VGASnoop- ParErr- Stepping- SERR- FastB2B- DisINTx-
	Status: Cap- 66MHz- UDF- FastB2B- ParErr- DEVSEL=fast >TAbort- <TAbort- <MAbort- >SERR- <PERR- INTx-
	NUMA node: 0

b0:15.1 Performance counters [1101]: Intel Corporation Sky Lake-E DDRIO Registers [8086:2088] (rev 07)
	Subsystem: Hewlett Packard Enterprise Device [1590:00ea]
	Control: I/O- Mem- BusMaster- SpecCycle- MemWINV- VGASnoop- ParErr- Stepping- SERR- FastB2B- DisINTx-
	Status: Cap- 66MHz- UDF- FastB2B- ParErr- DEVSEL=fast >TAbort- <TAbort- <MAbort- >SERR- <PERR- INTx-
	NUMA node: 0
	Kernel driver in use: skx_uncore

b0:16.0 System peripheral [0880]: Intel Corporation Sky Lake-E M2PCI Registers [8086:2018] (rev 07)
	Subsystem: Hewlett Packard Enterprise Device [1590:00ea]
	Control: I/O- Mem- BusMaster- SpecCycle- MemWINV- VGASnoop- ParErr- Stepping- SERR- FastB2B- DisINTx-
	Status: Cap- 66MHz- UDF- FastB2B- ParErr- DEVSEL=fast >TAbort- <TAbort- <MAbort- >SERR- <PERR- INTx-
	NUMA node: 0

b0:16.1 Performance counters [1101]: Intel Corporation Sky Lake-E DDRIO Registers [8086:2088] (rev 07)
	Subsystem: Hewlett Packard Enterprise Device [1590:00ea]
	Control: I/O- Mem- BusMaster- SpecCycle- MemWINV- VGASnoop- ParErr- Stepping- SERR- FastB2B- DisINTx-
	Status: Cap- 66MHz- UDF- FastB2B- ParErr- DEVSEL=fast >TAbort- <TAbort- <MAbort- >SERR- <PERR- INTx-
	NUMA node: 0
	Kernel driver in use: skx_uncore

b0:16.4 System peripheral [0880]: Intel Corporation Sky Lake-E M2PCI Registers [8086:2018] (rev 07)
	Subsystem: Hewlett Packard Enterprise Device [1590:00ea]
	Control: I/O- Mem- BusMaster- SpecCycle- MemWINV- VGASnoop- ParErr- Stepping- SERR- FastB2B- DisINTx-
	Status: Cap- 66MHz- UDF- FastB2B- ParErr- DEVSEL=fast >TAbort- <TAbort- <MAbort- >SERR- <PERR- INTx-
	NUMA node: 0

b0:16.5 Performance counters [1101]: Intel Corporation Sky Lake-E DDRIO Registers [8086:2088] (rev 07)
	Subsystem: Hewlett Packard Enterprise Device [1590:00ea]
	Control: I/O- Mem- BusMaster- SpecCycle- MemWINV- VGASnoop- ParErr- Stepping- SERR- FastB2B- DisINTx-
	Status: Cap- 66MHz- UDF- FastB2B- ParErr- DEVSEL=fast >TAbort- <TAbort- <MAbort- >SERR- <PERR- INTx-
	NUMA node: 0

b1:00.0 Serial Attached SCSI controller [0107]: Adaptec Smart Storage PQI SAS [9005:028f] (rev 01)
	DeviceName: Embedded RAID 1
	Subsystem: Hewlett-Packard Company Smart Array P408i-a SR Gen10 [103c:0602]
	Control: I/O+ Mem+ BusMaster+ SpecCycle- MemWINV- VGASnoop- ParErr+ Stepping- SERR+ FastB2B- DisINTx+
	Status: Cap+ 66MHz- UDF- FastB2B- ParErr- DEVSEL=fast >TAbort- <TAbort- <MAbort- >SERR- <PERR- INTx-
	Latency: 0, Cache Line Size: 64 bytes
	Interrupt: pin A routed to IRQ 32
	NUMA node: 0
	Region 0: Memory at f3d00000 (64-bit, non-prefetchable) [size=32K]
	Region 4: I/O ports at c000 [size=256]
	Capabilities: <access denied>
	Kernel driver in use: smartpqi
	Kernel modules: smartpqi

b2:00.0 Ethernet controller [0200]: Intel Corporation I350 Gigabit Network Connection [8086:1521] (rev 01)
	DeviceName: Embedded FlexibleLOM 1 Port 1
	Subsystem: Hewlett-Packard Company Ethernet 1Gb 4-port 366FLR Adapter [103c:17d1]
	Control: I/O- Mem+ BusMaster+ SpecCycle- MemWINV- VGASnoop- ParErr+ Stepping- SERR+ FastB2B- DisINTx+
	Status: Cap+ 66MHz- UDF- FastB2B- ParErr- DEVSEL=fast >TAbort- <TAbort- <MAbort- >SERR- <PERR- INTx-
	Latency: 0, Cache Line Size: 64 bytes
	Interrupt: pin D routed to IRQ 38
	NUMA node: 0
	Region 0: Memory at f3b00000 (32-bit, non-prefetchable) [size=1M]
	Region 3: Memory at f3c0c000 (32-bit, non-prefetchable) [size=16K]
	[virtual] Expansion ROM at f3c80000 [disabled] [size=512K]
	Capabilities: <access denied>
	Kernel driver in use: igb
	Kernel modules: igb

b2:00.1 Ethernet controller [0200]: Intel Corporation I350 Gigabit Network Connection [8086:1521] (rev 01)
	DeviceName: Embedded FlexibleLOM 1 Port 2
	Subsystem: Hewlett-Packard Company Ethernet 1Gb 4-port 366FLR Adapter [103c:17d1]
	Control: I/O- Mem+ BusMaster+ SpecCycle- MemWINV- VGASnoop- ParErr+ Stepping- SERR+ FastB2B- DisINTx+
	Status: Cap+ 66MHz- UDF- FastB2B- ParErr- DEVSEL=fast >TAbort- <TAbort- <MAbort- >SERR- <PERR- INTx-
	Latency: 0, Cache Line Size: 64 bytes
	Interrupt: pin C routed to IRQ 48
	NUMA node: 0
	Region 0: Memory at f3a00000 (32-bit, non-prefetchable) [size=1M]
	Region 3: Memory at f3c08000 (32-bit, non-prefetchable) [size=16K]
	Capabilities: <access denied>
	Kernel driver in use: igb
	Kernel modules: igb

b2:00.2 Ethernet controller [0200]: Intel Corporation I350 Gigabit Network Connection [8086:1521] (rev 01)
	DeviceName: Embedded FlexibleLOM 1 Port 3
	Subsystem: Hewlett-Packard Company Ethernet 1Gb 4-port 366FLR Adapter [103c:17d1]
	Control: I/O- Mem+ BusMaster+ SpecCycle- MemWINV- VGASnoop- ParErr+ Stepping- SERR+ FastB2B- DisINTx+
	Status: Cap+ 66MHz- UDF- FastB2B- ParErr- DEVSEL=fast >TAbort- <TAbort- <MAbort- >SERR- <PERR- INTx-
	Latency: 0, Cache Line Size: 64 bytes
	Interrupt: pin B routed to IRQ 82
	NUMA node: 0
	Region 0: Memory at f3900000 (32-bit, non-prefetchable) [size=1M]
	Region 3: Memory at f3c04000 (32-bit, non-prefetchable) [size=16K]
	Capabilities: <access denied>
	Kernel driver in use: igb
	Kernel modules: igb

b2:00.3 Ethernet controller [0200]: Intel Corporation I350 Gigabit Network Connection [8086:1521] (rev 01)
	DeviceName: Embedded FlexibleLOM 1 Port 4
	Subsystem: Hewlett-Packard Company Ethernet 1Gb 4-port 366FLR Adapter [103c:17d1]
	Control: I/O- Mem+ BusMaster+ SpecCycle- MemWINV- VGASnoop- ParErr+ Stepping- SERR+ FastB2B- DisINTx+
	Status: Cap+ 66MHz- UDF- FastB2B- ParErr- DEVSEL=fast >TAbort- <TAbort- <MAbort- >SERR- <PERR- INTx-
	Latency: 0, Cache Line Size: 64 bytes
	Interrupt: pin A routed to IRQ 34
	NUMA node: 0
	Region 0: Memory at f3800000 (32-bit, non-prefetchable) [size=1M]
	Region 3: Memory at f3c00000 (32-bit, non-prefetchable) [size=16K]
	Capabilities: <access denied>
	Kernel driver in use: igb
	Kernel modules: igb

