00:00.0 Host bridge [0600]: Silicon Integrated Systems [SiS] 671MX [1039:0671]
	Subsystem: CLEVO/KAPOK Computer Device [1558:0801]
	Control: I/O+ Mem+ BusMaster+ SpecCycle- MemWINV- VGASnoop- ParErr- Stepping- SERR- FastB2B- DisINTx-
	Status: Cap+ 66MHz- UDF- FastB2B- ParErr- DEVSEL=medium >TAbort- <TAbort- <MAbort+ >SERR- <PERR- INTx-
	Latency: 32
	Region 0: Memory at d0000000 (32-bit, non-prefetchable) [size=128M]
	Capabilities: <access denied>
	Kernel driver in use: agpgart-sis
	Kernel modules: sis_agp

00:01.0 PCI bridge [0604]: Silicon Integrated Systems [SiS] AGP Port (virtual PCI-to-PCI bridge) [1039:0003] (prog-if 00 [Normal decode])
	Control: I/O+ Mem+ BusMaster+ SpecCycle- MemWINV- VGASnoop- ParErr- Stepping- SERR- FastB2B- DisINTx-
	Status: Cap- 66MHz+ UDF- FastB2B- ParErr- DEVSEL=fast >TAbort- <TAbort- <MAbort- >SERR- <PERR- INTx-
	Latency: 0, Cache Line Size: 16 bytes
	Bus: primary=00, secondary=01, subordinate=01, sec-latency=0
	I/O behind bridge: 00009000-00009fff [size=4K]
	Memory behind bridge: d8000000-d80fffff [size=1M]
	Prefetchable memory behind bridge: c0000000-cfffffff [size=256M]
	Secondary status: 66MHz+ FastB2B- ParErr- DEVSEL=fast >TAbort- <TAbort- <MAbort+ <SERR- <PERR-
	BridgeCtl: Parity- SERR+ NoISA+ VGA+ VGA16- MAbort- >Reset- FastB2B-
		PriDiscTmr- SecDiscTmr- DiscTmrStat- DiscTmrSERREn-

00:02.0 ISA bridge [0601]: Silicon Integrated Systems [SiS] SiS968 [MuTIOL Media IO] [1039:0968] (rev 01)
	Subsystem: CLEVO/KAPOK Computer Device [1558:0801]
	Control: I/O+ Mem+ BusMaster+ SpecCycle+ MemWINV- VGASnoop- ParErr- Stepping- SERR- FastB2B- DisINTx-
	Status: Cap- 66MHz- UDF- FastB2B- ParErr- DEVSEL=medium >TAbort- <TAbort- <MAbort- >SERR- <PERR- INTx-
	Latency: 0

00:02.5 IDE interface [0101]: Silicon Integrated Systems [SiS] 5513 IDE Controller [1039:5513] (rev 01) (prog-if 80 [ISA Compatibility mode-only controller, supports bus mastering])
	Subsystem: CLEVO/KAPOK Computer Device [1558:0801]
	Control: I/O+ Mem- BusMaster+ SpecCycle- MemWINV- VGASnoop- ParErr- Stepping- SERR- FastB2B- DisINTx-
	Status: Cap+ 66MHz- UDF- FastB2B- ParErr- DEVSEL=medium >TAbort- <TAbort- <MAbort- >SERR- <PERR- INTx-
	Latency: 128
	Interrupt: pin ? routed to IRQ 16
	Region 0: [virtual] Memory at 000001f0 (32-bit, non-prefetchable) [size=8]
	Region 1: [virtual] Memory at 000003f0 (type 3, non-prefetchable)
	Region 2: [virtual] Memory at 00000170 (32-bit, non-prefetchable) [size=8]
	Region 3: [virtual] Memory at 00000370 (type 3, non-prefetchable)
	Region 4: I/O ports at 1080 [size=16]
	Capabilities: <access denied>
	Kernel driver in use: pata_sis
	Kernel modules: pata_acpi

00:03.0 USB controller [0c03]: Silicon Integrated Systems [SiS] USB 1.1 Controller [1039:7001] (rev 0f) (prog-if 10 [OHCI])
	Subsystem: CLEVO/KAPOK Computer Device [1558:0801]
	Control: I/O+ Mem+ BusMaster+ SpecCycle- MemWINV+ VGASnoop- ParErr- Stepping- SERR- FastB2B- DisINTx-
	Status: Cap- 66MHz- UDF- FastB2B+ ParErr- DEVSEL=medium >TAbort- <TAbort- <MAbort- >SERR- <PERR- INTx-
	Latency: 32 (20000ns max)
	Interrupt: pin A routed to IRQ 20
	Region 0: Memory at d8404000 (32-bit, non-prefetchable) [size=4K]
	Kernel driver in use: ohci-pci

00:03.1 USB controller [0c03]: Silicon Integrated Systems [SiS] USB 1.1 Controller [1039:7001] (rev 0f) (prog-if 10 [OHCI])
	Subsystem: CLEVO/KAPOK Computer Device [1558:0801]
	Control: I/O+ Mem+ BusMaster+ SpecCycle- MemWINV+ VGASnoop- ParErr- Stepping- SERR- FastB2B- DisINTx-
	Status: Cap- 66MHz- UDF- FastB2B+ ParErr- DEVSEL=medium >TAbort- <TAbort- <MAbort- >SERR- <PERR- INTx-
	Latency: 32 (20000ns max)
	Interrupt: pin B routed to IRQ 21
	Region 0: Memory at d8405000 (32-bit, non-prefetchable) [size=4K]
	Kernel driver in use: ohci-pci

00:03.3 USB controller [0c03]: Silicon Integrated Systems [SiS] USB 2.0 Controller [1039:7002] (prog-if 20 [EHCI])
	Subsystem: CLEVO/KAPOK Computer Device [1558:0801]
	Control: I/O- Mem+ BusMaster+ SpecCycle- MemWINV- VGASnoop- ParErr- Stepping- SERR- FastB2B- DisINTx-
	Status: Cap+ 66MHz- UDF- FastB2B+ ParErr- DEVSEL=medium >TAbort- <TAbort- <MAbort- >SERR- <PERR- INTx-
	Latency: 32 (20000ns max)
	Interrupt: pin C routed to IRQ 22
	Region 0: Memory at d8406000 (32-bit, non-prefetchable) [size=4K]
	Capabilities: <access denied>
	Kernel driver in use: ehci-pci

00:04.0 Ethernet controller [0200]: Silicon Integrated Systems [SiS] 191 Gigabit Ethernet Adapter [1039:0191] (rev 02)
	Subsystem: CLEVO/KAPOK Computer Device [1558:0801]
	Control: I/O+ Mem+ BusMaster+ SpecCycle- MemWINV- VGASnoop- ParErr- Stepping- SERR- FastB2B- DisINTx-
	Status: Cap+ 66MHz- UDF- FastB2B- ParErr- DEVSEL=medium >TAbort- <TAbort- <MAbort- >SERR- <PERR- INTx-
	Latency: 0
	Interrupt: pin A routed to IRQ 19
	Region 0: Memory at d8407000 (32-bit, non-prefetchable) [size=128]
	Region 1: I/O ports at 1000 [size=128]
	Capabilities: <access denied>
	Kernel driver in use: sis190
	Kernel modules: sis190

00:05.0 SATA controller [0106]: Silicon Integrated Systems [SiS] AHCI IDE Controller (0106) [1039:1185] (rev 03) (prog-if 01 [AHCI 1.0])
	Subsystem: CLEVO/KAPOK Computer Device [1558:0801]
	Control: I/O+ Mem+ BusMaster+ SpecCycle- MemWINV- VGASnoop- ParErr- Stepping- SERR- FastB2B- DisINTx-
	Status: Cap+ 66MHz- UDF- FastB2B- ParErr- DEVSEL=medium >TAbort- <TAbort- <MAbort- >SERR- <PERR- INTx-
	Latency: 32
	Interrupt: pin A routed to IRQ 17
	Region 0: I/O ports at 10c8 [size=8]
	Region 1: I/O ports at 10bc [size=4]
	Region 2: I/O ports at 10c0 [size=8]
	Region 3: I/O ports at 10b8 [size=4]
	Region 4: I/O ports at 10a0 [size=16]
	Region 5: Memory at d8407400 (32-bit, non-prefetchable) [size=512]
	Capabilities: <access denied>
	Kernel driver in use: ahci
	Kernel modules: ahci

00:06.0 PCI bridge [0604]: Silicon Integrated Systems [SiS] PCI-to-PCI bridge [1039:000a] (prog-if 00 [Normal decode])
	Control: I/O+ Mem+ BusMaster+ SpecCycle- MemWINV- VGASnoop- ParErr- Stepping- SERR- FastB2B- DisINTx-
	Status: Cap+ 66MHz- UDF- FastB2B- ParErr- DEVSEL=fast >TAbort- <TAbort- <MAbort- >SERR- <PERR- INTx-
	Latency: 0, Cache Line Size: 16 bytes
	Interrupt: pin A routed to IRQ 16
	Bus: primary=00, secondary=09, subordinate=0a, sec-latency=0
	I/O behind bridge: 00003000-00004fff [size=8K]
	Memory behind bridge: dc000000-dfffffff [size=64M]
	Prefetchable memory behind bridge: 00000000b0000000-00000000b01fffff [size=2M]
	Secondary status: 66MHz- FastB2B- ParErr- DEVSEL=fast >TAbort- <TAbort- <MAbort- <SERR- <PERR-
	BridgeCtl: Parity- SERR+ NoISA+ VGA- VGA16- MAbort- >Reset- FastB2B-
		PriDiscTmr- SecDiscTmr- DiscTmrStat- DiscTmrSERREn-
	Capabilities: <access denied>
	Kernel driver in use: pcieport

00:07.0 PCI bridge [0604]: Silicon Integrated Systems [SiS] PCI-to-PCI bridge [1039:000a] (prog-if 00 [Normal decode])
	Control: I/O+ Mem+ BusMaster+ SpecCycle- MemWINV- VGASnoop- ParErr- Stepping- SERR- FastB2B- DisINTx-
	Status: Cap+ 66MHz- UDF- FastB2B- ParErr- DEVSEL=fast >TAbort- <TAbort- <MAbort- >SERR- <PERR- INTx-
	Latency: 0, Cache Line Size: 16 bytes
	Interrupt: pin A routed to IRQ 16
	Bus: primary=00, secondary=03, subordinate=03, sec-latency=0
	I/O behind bridge: 00002000-00002fff [size=4K]
	Memory behind bridge: d8100000-d81fffff [size=1M]
	Prefetchable memory behind bridge: 00000000b0200000-00000000b03fffff [size=2M]
	Secondary status: 66MHz- FastB2B- ParErr- DEVSEL=fast >TAbort- <TAbort- <MAbort+ <SERR- <PERR-
	BridgeCtl: Parity- SERR+ NoISA+ VGA- VGA16- MAbort- >Reset- FastB2B-
		PriDiscTmr- SecDiscTmr- DiscTmrStat- DiscTmrSERREn-
	Capabilities: <access denied>
	Kernel driver in use: pcieport

00:0f.0 Audio device [0403]: Silicon Integrated Systems [SiS] Azalia Audio Controller [1039:7502]
	Subsystem: CLEVO/KAPOK Computer Device [1558:0801]
	Control: I/O- Mem+ BusMaster+ SpecCycle- MemWINV- VGASnoop- ParErr- Stepping- SERR- FastB2B- DisINTx-
	Status: Cap+ 66MHz- UDF- FastB2B- ParErr- DEVSEL=medium >TAbort- <TAbort- <MAbort- >SERR- <PERR- INTx-
	Latency: 0 (13000ns min, 2750ns max)
	Interrupt: pin A routed to IRQ 18
	Region 0: Memory at d8400000 (32-bit, non-prefetchable) [size=16K]
	Capabilities: <access denied>
	Kernel driver in use: snd_hda_intel
	Kernel modules: snd_hda_intel

00:1f.0 PCI bridge [0604]: Silicon Integrated Systems [SiS] PCI-to-PCI bridge [1039:0004] (prog-if 00 [Normal decode])
	Control: I/O+ Mem+ BusMaster+ SpecCycle- MemWINV- VGASnoop- ParErr- Stepping- SERR- FastB2B- DisINTx-
	Status: Cap+ 66MHz- UDF- FastB2B- ParErr- DEVSEL=fast >TAbort- <TAbort- <MAbort- >SERR- <PERR- INTx-
	Latency: 0, Cache Line Size: 16 bytes
	Bus: primary=00, secondary=04, subordinate=04, sec-latency=0
	I/O behind bridge: None
	Memory behind bridge: None
	Prefetchable memory behind bridge: None
	Secondary status: 66MHz- FastB2B- ParErr- DEVSEL=fast >TAbort- <TAbort- <MAbort+ <SERR- <PERR-
	BridgeCtl: Parity- SERR+ NoISA+ VGA- VGA16- MAbort- >Reset- FastB2B-
		PriDiscTmr- SecDiscTmr- DiscTmrStat- DiscTmrSERREn-
	Capabilities: <access denied>
	Kernel driver in use: pcieport

01:00.0 VGA compatible controller [0300]: Silicon Integrated Systems [SiS] 771/671 PCIE VGA Display Adapter [1039:6351] (rev 10) (prog-if 00 [VGA controller])
	Subsystem: CLEVO/KAPOK Computer Device [1558:0801]
	Control: I/O+ Mem+ BusMaster- SpecCycle- MemWINV- VGASnoop- ParErr- Stepping- SERR- FastB2B- DisINTx-
	Status: Cap+ 66MHz+ UDF- FastB2B- ParErr- DEVSEL=medium >TAbort- <TAbort- <MAbort- >SERR- <PERR- INTx-
	Interrupt: pin A routed to IRQ 9
	BIST result: 00
	Region 0: Memory at c0000000 (32-bit, prefetchable) [size=256M]
	Region 1: Memory at d8000000 (32-bit, non-prefetchable) [size=128K]
	Region 2: I/O ports at 9000 [size=128]
	[virtual] Expansion ROM at 000c0000 [disabled] [size=128K]
	Capabilities: <access denied>

03:00.0 System peripheral [0880]: JMicron Technology Corp. SD/MMC Host Controller [197b:2382]
	Subsystem: CLEVO/KAPOK Computer Device [1558:0801]
	Control: I/O+ Mem+ BusMaster+ SpecCycle- MemWINV- VGASnoop- ParErr- Stepping- SERR- FastB2B- DisINTx-
	Status: Cap+ 66MHz- UDF- FastB2B- ParErr- DEVSEL=fast >TAbort- <TAbort- <MAbort- >SERR- <PERR- INTx-
	Latency: 0, Cache Line Size: 16 bytes
	Interrupt: pin A routed to IRQ 16
	Region 0: Memory at d8100000 (32-bit, non-prefetchable) [size=256]
	[virtual] Expansion ROM at d8110000 [disabled] [size=64K]
	Capabilities: <access denied>
	Kernel driver in use: sdhci-pci
	Kernel modules: sdhci_pci

03:00.2 SD Host controller [0805]: JMicron Technology Corp. Standard SD Host Controller [197b:2381] (prog-if 01)
	Subsystem: CLEVO/KAPOK Computer Device [1558:0801]
	Control: I/O+ Mem+ BusMaster- SpecCycle- MemWINV- VGASnoop- ParErr- Stepping- SERR- FastB2B- DisINTx-
	Status: Cap+ 66MHz- UDF- FastB2B- ParErr- DEVSEL=fast >TAbort- <TAbort- <MAbort- >SERR- <PERR- INTx-
	Interrupt: pin A routed to IRQ 16
	Region 0: Memory at d8100400 (32-bit, non-prefetchable) [size=256]
	Capabilities: <access denied>
	Kernel modules: sdhci_pci

03:00.3 System peripheral [0880]: JMicron Technology Corp. MS Host Controller [197b:2383]
	Subsystem: CLEVO/KAPOK Computer Device [1558:0801]
	Control: I/O+ Mem+ BusMaster+ SpecCycle- MemWINV- VGASnoop- ParErr- Stepping- SERR- FastB2B- DisINTx-
	Status: Cap+ 66MHz- UDF- FastB2B- ParErr- DEVSEL=fast >TAbort- <TAbort- <MAbort- >SERR- <PERR- INTx-
	Latency: 0, Cache Line Size: 16 bytes
	Interrupt: pin A routed to IRQ 16
	Region 0: Memory at d8100800 (32-bit, non-prefetchable) [size=256]
	Capabilities: <access denied>
	Kernel driver in use: jmb38x_ms
	Kernel modules: jmb38x_ms

