00:00.0 Host bridge [0600]: Intel Corporation Coffee Lake HOST and DRAM Controller [8086:3e34] (rev 0c)
	Subsystem: Lenovo Device [17aa:2286]
	Control: I/O- Mem+ BusMaster+ SpecCycle- MemWINV- VGASnoop- ParErr- Stepping- SERR- FastB2B- DisINTx-
	Status: Cap+ 66MHz- UDF- FastB2B+ ParErr- DEVSEL=fast >TAbort- <TAbort- <MAbort+ >SERR- <PERR- INTx-
	Latency: 0
	IOMMU group: 1
	Capabilities: <access denied>
	Kernel driver in use: skl_uncore

00:02.0 VGA compatible controller [0300]: Intel Corporation WhiskeyLake-U GT2 [UHD Graphics 620] [8086:3ea0] (rev 02) (prog-if 00 [VGA controller])
	Subsystem: Lenovo Device [17aa:2286]
	Control: I/O+ Mem+ BusMaster+ SpecCycle- MemWINV- VGASnoop- ParErr- Stepping- SERR- FastB2B- DisINTx+
	Status: Cap+ 66MHz- UDF- FastB2B- ParErr- DEVSEL=fast >TAbort- <TAbort- <MAbort- >SERR- <PERR- INTx-
	Latency: 0
	Interrupt: pin A routed to IRQ 141
	IOMMU group: 0
	Region 0: Memory at b0000000 (64-bit, non-prefetchable) [size=16M]
	Region 2: Memory at a0000000 (64-bit, prefetchable) [size=256M]
	Region 4: I/O ports at 3000 [size=64]
	Expansion ROM at 000c0000 [virtual] [disabled] [size=128K]
	Capabilities: <access denied>
	Kernel driver in use: i915

00:04.0 Signal processing controller [1180]: Intel Corporation Xeon E3-1200 v5/E3-1500 v5/6th Gen Core Processor Thermal Subsystem [8086:1903] (rev 0c)
	Subsystem: Lenovo Device [17aa:2286]
	Control: I/O- Mem+ BusMaster- SpecCycle- MemWINV- VGASnoop- ParErr- Stepping- SERR- FastB2B- DisINTx-
	Status: Cap+ 66MHz- UDF- FastB2B+ ParErr- DEVSEL=fast >TAbort- <TAbort- <MAbort- >SERR- <PERR- INTx-
	Interrupt: pin A routed to IRQ 16
	IOMMU group: 2
	Region 0: Memory at b3d30000 (64-bit, non-prefetchable) [size=32K]
	Capabilities: <access denied>
	Kernel driver in use: proc_thermal

00:08.0 System peripheral [0880]: Intel Corporation Xeon E3-1200 v5/v6 / E3-1500 v5 / 6th/7th/8th Gen Core Processor Gaussian Mixture Model [8086:1911]
	Subsystem: Lenovo Device [17aa:2286]
	Control: I/O- Mem- BusMaster- SpecCycle- MemWINV- VGASnoop- ParErr- Stepping- SERR- FastB2B- DisINTx-
	Status: Cap+ 66MHz- UDF- FastB2B- ParErr- DEVSEL=fast >TAbort- <TAbort- <MAbort- >SERR- <PERR- INTx-
	Interrupt: pin A routed to IRQ 255
	IOMMU group: 3
	Region 0: Memory at b3d42000 (64-bit, non-prefetchable) [disabled] [size=4K]
	Capabilities: <access denied>

00:12.0 Signal processing controller [1180]: Intel Corporation Cannon Point-LP Thermal Controller [8086:9df9] (rev 30)
	Subsystem: Lenovo Device [17aa:2286]
	Control: I/O- Mem+ BusMaster- SpecCycle- MemWINV- VGASnoop- ParErr- Stepping- SERR- FastB2B- DisINTx-
	Status: Cap+ 66MHz- UDF- FastB2B- ParErr- DEVSEL=fast >TAbort- <TAbort- <MAbort- >SERR- <PERR- INTx-
	Interrupt: pin A routed to IRQ 16
	IOMMU group: 4
	Region 0: Memory at b3d43000 (64-bit, non-prefetchable) [size=4K]
	Capabilities: <access denied>
	Kernel driver in use: intel_pch_thermal

00:14.0 USB controller [0c03]: Intel Corporation Cannon Point-LP USB 3.1 xHCI Controller [8086:9ded] (rev 30) (prog-if 30 [XHCI])
	Subsystem: Lenovo Device [17aa:2286]
	Control: I/O- Mem+ BusMaster+ SpecCycle- MemWINV- VGASnoop- ParErr- Stepping- SERR- FastB2B- DisINTx+
	Status: Cap+ 66MHz- UDF- FastB2B+ ParErr- DEVSEL=medium >TAbort- <TAbort- <MAbort- >SERR- <PERR- INTx-
	Latency: 0
	Interrupt: pin A routed to IRQ 129
	IOMMU group: 5
	Region 0: Memory at b3d20000 (64-bit, non-prefetchable) [size=64K]
	Capabilities: <access denied>
	Kernel driver in use: xhci_hcd

00:14.2 RAM memory [0500]: Intel Corporation Cannon Point-LP Shared SRAM [8086:9def] (rev 30)
	Subsystem: Lenovo Device [17aa:2286]
	Control: I/O- Mem- BusMaster- SpecCycle- MemWINV- VGASnoop- ParErr- Stepping- SERR- FastB2B- DisINTx-
	Status: Cap+ 66MHz- UDF- FastB2B- ParErr- DEVSEL=fast >TAbort- <TAbort- <MAbort- >SERR- <PERR- INTx-
	IOMMU group: 5
	Region 0: Memory at b3d40000 (64-bit, non-prefetchable) [disabled] [size=8K]
	Region 2: Memory at b3d44000 (64-bit, non-prefetchable) [disabled] [size=4K]
	Capabilities: <access denied>

00:14.3 Network controller [0280]: Intel Corporation Cannon Point-LP CNVi [Wireless-AC] [8086:9df0] (rev 30)
	Subsystem: Intel Corporation Device [8086:0034]
	Control: I/O- Mem+ BusMaster+ SpecCycle- MemWINV- VGASnoop- ParErr- Stepping- SERR- FastB2B- DisINTx+
	Status: Cap+ 66MHz- UDF- FastB2B- ParErr- DEVSEL=fast >TAbort- <TAbort- <MAbort- >SERR- <PERR- INTx-
	Latency: 0
	Interrupt: pin A routed to IRQ 16
	IOMMU group: 6
	Region 0: Memory at b3d38000 (64-bit, non-prefetchable) [size=16K]
	Capabilities: <access denied>
	Kernel driver in use: iwlwifi

00:16.0 Communication controller [0780]: Intel Corporation Cannon Point-LP MEI Controller #1 [8086:9de0] (rev 30)
	Subsystem: Lenovo Device [17aa:2286]
	Control: I/O- Mem+ BusMaster+ SpecCycle- MemWINV- VGASnoop- ParErr- Stepping- SERR- FastB2B- DisINTx+
	Status: Cap+ 66MHz- UDF- FastB2B- ParErr- DEVSEL=fast >TAbort- <TAbort- <MAbort- >SERR- <PERR- INTx-
	Latency: 0
	Interrupt: pin A routed to IRQ 131
	IOMMU group: 7
	Region 0: Memory at b3d45000 (64-bit, non-prefetchable) [size=4K]
	Capabilities: <access denied>
	Kernel driver in use: mei_me

00:1c.0 PCI bridge [0604]: Intel Corporation Cannon Point-LP PCI Express Root Port #1 [8086:9db8] (rev f0) (prog-if 00 [Normal decode])
	Subsystem: Lenovo Device [17aa:2286]
	Control: I/O+ Mem+ BusMaster+ SpecCycle- MemWINV- VGASnoop- ParErr- Stepping- SERR- FastB2B- DisINTx+
	Status: Cap+ 66MHz- UDF- FastB2B- ParErr- DEVSEL=fast >TAbort- <TAbort- <MAbort- >SERR- <PERR- INTx-
	Latency: 0
	Interrupt: pin A routed to IRQ 122
	IOMMU group: 8
	Bus: primary=00, secondary=01, subordinate=01, sec-latency=0
	I/O behind bridge: [disabled] [16-bit]
	Memory behind bridge: b3c00000-b3cfffff [size=1M] [32-bit]
	Prefetchable memory behind bridge: [disabled] [64-bit]
	Secondary status: 66MHz- FastB2B- ParErr- DEVSEL=fast >TAbort- <TAbort- <MAbort- <SERR- <PERR-
	BridgeCtl: Parity- SERR+ NoISA- VGA- VGA16- MAbort- >Reset- FastB2B-
		PriDiscTmr- SecDiscTmr- DiscTmrStat- DiscTmrSERREn-
	Capabilities: <access denied>
	Kernel driver in use: pcieport

00:1c.4 PCI bridge [0604]: Intel Corporation Cannon Point-LP PCI Express Root Port #5 [8086:9dbc] (rev f0) (prog-if 00 [Normal decode])
	Subsystem: Lenovo Device [17aa:2286]
	Control: I/O+ Mem+ BusMaster+ SpecCycle- MemWINV- VGASnoop- ParErr- Stepping- SERR- FastB2B- DisINTx+
	Status: Cap+ 66MHz- UDF- FastB2B- ParErr- DEVSEL=fast >TAbort- <TAbort- <MAbort- >SERR- <PERR- INTx-
	Latency: 0
	Interrupt: pin A routed to IRQ 123
	IOMMU group: 9
	Bus: primary=00, secondary=02, subordinate=3a, sec-latency=0
	I/O behind bridge: 4000-5fff [size=8K] [16-bit]
	Memory behind bridge: b3000000-b3bfffff [size=12M] [32-bit]
	Prefetchable memory behind bridge: b1000000-b19fffff [size=10M] [32-bit]
	Secondary status: 66MHz- FastB2B- ParErr- DEVSEL=fast >TAbort- <TAbort- <MAbort+ <SERR- <PERR-
	BridgeCtl: Parity- SERR+ NoISA- VGA- VGA16- MAbort- >Reset- FastB2B-
		PriDiscTmr- SecDiscTmr- DiscTmrStat- DiscTmrSERREn-
	Capabilities: <access denied>
	Kernel driver in use: pcieport

00:1d.0 PCI bridge [0604]: Intel Corporation Cannon Point-LP PCI Express Root Port #9 [8086:9db0] (rev f0) (prog-if 00 [Normal decode])
	Subsystem: Lenovo Device [17aa:2286]
	Control: I/O+ Mem+ BusMaster+ SpecCycle- MemWINV- VGASnoop- ParErr- Stepping- SERR- FastB2B- DisINTx+
	Status: Cap+ 66MHz- UDF- FastB2B- ParErr- DEVSEL=fast >TAbort- <TAbort- <MAbort- >SERR- <PERR- INTx-
	Latency: 0
	Interrupt: pin ? routed to IRQ 124
	IOMMU group: 10
	Bus: primary=00, secondary=3c, subordinate=3c, sec-latency=0
	I/O behind bridge: 2000-2fff [size=4K] [16-bit]
	Memory behind bridge: b2600000-b2ffffff [size=10M] [32-bit]
	Prefetchable memory behind bridge: b1a00000-b23fffff [size=10M] [32-bit]
	Secondary status: 66MHz- FastB2B- ParErr- DEVSEL=fast >TAbort- <TAbort- <MAbort+ <SERR- <PERR-
	BridgeCtl: Parity- SERR+ NoISA- VGA- VGA16- MAbort- >Reset- FastB2B-
		PriDiscTmr- SecDiscTmr- DiscTmrStat- DiscTmrSERREn-
	Capabilities: <access denied>
	Kernel driver in use: pcieport

00:1d.4 PCI bridge [0604]: Intel Corporation Cannon Point-LP PCI Express Root Port #13 [8086:9db4] (rev f0) (prog-if 00 [Normal decode])
	Subsystem: Lenovo Device [17aa:2286]
	Control: I/O+ Mem+ BusMaster+ SpecCycle- MemWINV- VGASnoop- ParErr- Stepping- SERR- FastB2B- DisINTx+
	Status: Cap+ 66MHz- UDF- FastB2B- ParErr- DEVSEL=fast >TAbort- <TAbort- <MAbort- >SERR- <PERR- INTx-
	Latency: 0
	Interrupt: pin A routed to IRQ 125
	IOMMU group: 11
	Bus: primary=00, secondary=3d, subordinate=3d, sec-latency=0
	I/O behind bridge: [disabled] [16-bit]
	Memory behind bridge: b2500000-b25fffff [size=1M] [32-bit]
	Prefetchable memory behind bridge: [disabled] [64-bit]
	Secondary status: 66MHz- FastB2B- ParErr- DEVSEL=fast >TAbort- <TAbort- <MAbort- <SERR- <PERR-
	BridgeCtl: Parity- SERR+ NoISA- VGA- VGA16- MAbort- >Reset- FastB2B-
		PriDiscTmr- SecDiscTmr- DiscTmrStat- DiscTmrSERREn-
	Capabilities: <access denied>
	Kernel driver in use: pcieport

00:1f.0 ISA bridge [0601]: Intel Corporation Cannon Point-LP LPC Controller [8086:9d84] (rev 30)
	Subsystem: Lenovo Device [17aa:2286]
	Control: I/O+ Mem+ BusMaster+ SpecCycle- MemWINV- VGASnoop- ParErr- Stepping- SERR- FastB2B- DisINTx-
	Status: Cap- 66MHz- UDF- FastB2B- ParErr- DEVSEL=medium >TAbort- <TAbort- <MAbort- >SERR- <PERR- INTx-
	Latency: 0
	IOMMU group: 12

00:1f.3 Audio device [0403]: Intel Corporation Cannon Point-LP High Definition Audio Controller [8086:9dc8] (rev 30) (prog-if 80)
	Subsystem: Lenovo Device [17aa:2286]
	Control: I/O- Mem+ BusMaster+ SpecCycle- MemWINV- VGASnoop- ParErr- Stepping- SERR- FastB2B- DisINTx+
	Status: Cap+ 66MHz- UDF- FastB2B- ParErr- DEVSEL=fast >TAbort- <TAbort- <MAbort- >SERR- <PERR- INTx-
	Latency: 64
	Interrupt: pin A routed to IRQ 134
	IOMMU group: 12
	Region 0: Memory at b3d3c000 (64-bit, non-prefetchable) [size=16K]
	Region 4: Memory at b2400000 (64-bit, non-prefetchable) [size=1M]
	Capabilities: <access denied>
	Kernel driver in use: snd_hda_intel

00:1f.4 SMBus [0c05]: Intel Corporation Cannon Point-LP SMBus Controller [8086:9da3] (rev 30)
	Subsystem: Lenovo Device [17aa:2286]
	Control: I/O+ Mem+ BusMaster- SpecCycle- MemWINV- VGASnoop- ParErr- Stepping- SERR- FastB2B- DisINTx-
	Status: Cap- 66MHz- UDF- FastB2B+ ParErr- DEVSEL=medium >TAbort- <TAbort- <MAbort- >SERR- <PERR- INTx-
	Interrupt: pin A routed to IRQ 16
	IOMMU group: 12
	Region 0: Memory at b3d46000 (64-bit, non-prefetchable) [size=256]
	Region 4: I/O ports at efa0 [size=32]
	Kernel driver in use: i801_smbus

00:1f.5 Serial bus controller [0c80]: Intel Corporation Cannon Point-LP SPI Controller [8086:9da4] (rev 30)
	Subsystem: Lenovo Device [17aa:2286]
	Control: I/O- Mem+ BusMaster- SpecCycle- MemWINV- VGASnoop- ParErr- Stepping- SERR- FastB2B- DisINTx+
	Status: Cap- 66MHz- UDF- FastB2B- ParErr- DEVSEL=fast >TAbort- <TAbort- <MAbort- >SERR- <PERR- INTx-
	IOMMU group: 12
	Region 0: Memory at fe010000 (32-bit, non-prefetchable) [size=4K]

00:1f.6 Ethernet controller [0200]: Intel Corporation Ethernet Connection (6) I219-V [8086:15be] (rev 30)
	Subsystem: Lenovo Device [17aa:2286]
	Control: I/O- Mem+ BusMaster+ SpecCycle- MemWINV- VGASnoop- ParErr- Stepping- SERR- FastB2B- DisINTx+
	Status: Cap+ 66MHz- UDF- FastB2B- ParErr- DEVSEL=fast >TAbort- <TAbort- <MAbort- >SERR- <PERR- INTx-
	Latency: 0
	Interrupt: pin A routed to IRQ 166
	IOMMU group: 12
	Region 0: Memory at b3d00000 (32-bit, non-prefetchable) [size=128K]
	Capabilities: <access denied>
	Kernel driver in use: e1000e

01:00.0 SD Host controller [0805]: Genesys Logic, Inc GL9750 SD Host Controller [17a0:9750] (rev 01) (prog-if 01)
	Subsystem: Lenovo Device [17aa:2286]
	Control: I/O- Mem+ BusMaster+ SpecCycle- MemWINV- VGASnoop- ParErr- Stepping- SERR- FastB2B- DisINTx+
	Status: Cap+ 66MHz- UDF- FastB2B- ParErr- DEVSEL=fast >TAbort- <TAbort- <MAbort- >SERR- <PERR- INTx-
	Latency: 0
	Interrupt: pin A routed to IRQ 132
	IOMMU group: 13
	Region 0: Memory at b3c00000 (32-bit, non-prefetchable) [size=4K]
	Capabilities: <access denied>
	Kernel driver in use: sdhci-pci

02:00.0 PCI bridge [0604]: Intel Corporation JHL6240 Thunderbolt 3 Bridge (Low Power) [Alpine Ridge LP 2016] [8086:15c0] (rev 01) (prog-if 00 [Normal decode])
	Subsystem: Lenovo Device [17aa:2286]
	Physical Slot: 4
	Control: I/O+ Mem+ BusMaster+ SpecCycle- MemWINV- VGASnoop- ParErr- Stepping- SERR- FastB2B- DisINTx-
	Status: Cap+ 66MHz- UDF- FastB2B- ParErr- DEVSEL=fast >TAbort- <TAbort- <MAbort- >SERR- <PERR- INTx-
	Latency: 0, Cache Line Size: 128 bytes
	Interrupt: pin A routed to IRQ 16
	IOMMU group: 14
	Bus: primary=02, secondary=03, subordinate=3a, sec-latency=0
	I/O behind bridge: 4000-4fff [size=4K] [16-bit]
	Memory behind bridge: b3000000-b3bfffff [size=12M] [32-bit]
	Prefetchable memory behind bridge: b1000000-b19fffff [size=10M] [32-bit]
	Secondary status: 66MHz- FastB2B- ParErr- DEVSEL=fast >TAbort- <TAbort- <MAbort- <SERR- <PERR-
	BridgeCtl: Parity- SERR+ NoISA- VGA- VGA16- MAbort- >Reset- FastB2B-
		PriDiscTmr- SecDiscTmr- DiscTmrStat- DiscTmrSERREn-
	Capabilities: <access denied>
	Kernel driver in use: pcieport

03:00.0 PCI bridge [0604]: Intel Corporation JHL6240 Thunderbolt 3 Bridge (Low Power) [Alpine Ridge LP 2016] [8086:15c0] (rev 01) (prog-if 00 [Normal decode])
	Subsystem: Lenovo Device [17aa:2286]
	Control: I/O+ Mem+ BusMaster+ SpecCycle- MemWINV- VGASnoop- ParErr- Stepping- SERR- FastB2B- DisINTx+
	Status: Cap+ 66MHz- UDF- FastB2B- ParErr- DEVSEL=fast >TAbort- <TAbort- <MAbort- >SERR- <PERR- INTx-
	Latency: 0, Cache Line Size: 128 bytes
	Interrupt: pin A routed to IRQ 126
	IOMMU group: 15
	Bus: primary=03, secondary=04, subordinate=04, sec-latency=0
	I/O behind bridge: [disabled] [32-bit]
	Memory behind bridge: b3b00000-b3bfffff [size=1M] [32-bit]
	Prefetchable memory behind bridge: [disabled] [64-bit]
	Secondary status: 66MHz- FastB2B- ParErr- DEVSEL=fast >TAbort- <TAbort- <MAbort- <SERR- <PERR-
	BridgeCtl: Parity- SERR+ NoISA- VGA- VGA16- MAbort- >Reset- FastB2B-
		PriDiscTmr- SecDiscTmr- DiscTmrStat- DiscTmrSERREn-
	Capabilities: <access denied>
	Kernel driver in use: pcieport

03:01.0 PCI bridge [0604]: Intel Corporation JHL6240 Thunderbolt 3 Bridge (Low Power) [Alpine Ridge LP 2016] [8086:15c0] (rev 01) (prog-if 00 [Normal decode])
	Subsystem: Lenovo Device [17aa:2286]
	Control: I/O+ Mem+ BusMaster+ SpecCycle- MemWINV- VGASnoop- ParErr- Stepping- SERR- FastB2B- DisINTx+
	Status: Cap+ 66MHz- UDF- FastB2B- ParErr- DEVSEL=fast >TAbort- <TAbort- <MAbort- >SERR- <PERR- INTx-
	Latency: 0, Cache Line Size: 128 bytes
	Interrupt: pin A routed to IRQ 127
	IOMMU group: 16
	Bus: primary=03, secondary=05, subordinate=39, sec-latency=0
	I/O behind bridge: 4000-4fff [size=4K] [16-bit]
	Memory behind bridge: b3000000-b39fffff [size=10M] [32-bit]
	Prefetchable memory behind bridge: b1000000-b19fffff [size=10M] [32-bit]
	Secondary status: 66MHz- FastB2B- ParErr- DEVSEL=fast >TAbort- <TAbort- <MAbort- <SERR- <PERR-
	BridgeCtl: Parity- SERR+ NoISA- VGA- VGA16- MAbort- >Reset- FastB2B-
		PriDiscTmr- SecDiscTmr- DiscTmrStat- DiscTmrSERREn-
	Capabilities: <access denied>
	Kernel driver in use: pcieport

03:02.0 PCI bridge [0604]: Intel Corporation JHL6240 Thunderbolt 3 Bridge (Low Power) [Alpine Ridge LP 2016] [8086:15c0] (rev 01) (prog-if 00 [Normal decode])
	Subsystem: Lenovo Device [17aa:2286]
	Control: I/O+ Mem+ BusMaster+ SpecCycle- MemWINV- VGASnoop- ParErr- Stepping- SERR- FastB2B- DisINTx+
	Status: Cap+ 66MHz- UDF- FastB2B- ParErr- DEVSEL=fast >TAbort- <TAbort- <MAbort- >SERR- <PERR- INTx-
	Latency: 0, Cache Line Size: 128 bytes
	Interrupt: pin A routed to IRQ 128
	IOMMU group: 17
	Bus: primary=03, secondary=3a, subordinate=3a, sec-latency=0
	I/O behind bridge: [disabled] [32-bit]
	Memory behind bridge: b3a00000-b3afffff [size=1M] [32-bit]
	Prefetchable memory behind bridge: [disabled] [64-bit]
	Secondary status: 66MHz- FastB2B- ParErr- DEVSEL=fast >TAbort- <TAbort- <MAbort- <SERR- <PERR-
	BridgeCtl: Parity- SERR+ NoISA- VGA- VGA16- MAbort- >Reset- FastB2B-
		PriDiscTmr- SecDiscTmr- DiscTmrStat- DiscTmrSERREn-
	Capabilities: <access denied>
	Kernel driver in use: pcieport

04:00.0 System peripheral [0880]: Intel Corporation JHL6240 Thunderbolt 3 NHI (Low Power) [Alpine Ridge LP 2016] [8086:15bf] (rev 01)
	Subsystem: Lenovo Device [17aa:2286]
	Control: I/O- Mem+ BusMaster+ SpecCycle- MemWINV- VGASnoop- ParErr- Stepping- SERR- FastB2B- DisINTx+
	Status: Cap+ 66MHz- UDF- FastB2B- ParErr- DEVSEL=fast >TAbort- <TAbort- <MAbort- >SERR- <PERR- INTx-
	Latency: 0, Cache Line Size: 128 bytes
	Interrupt: pin A routed to IRQ 16
	IOMMU group: 15
	Region 0: Memory at b3b00000 (32-bit, non-prefetchable) [size=256K]
	Region 1: Memory at b3b40000 (32-bit, non-prefetchable) [size=4K]
	Capabilities: <access denied>
	Kernel driver in use: thunderbolt

3a:00.0 USB controller [0c03]: Intel Corporation JHL6240 Thunderbolt 3 USB 3.1 Controller (Low Power) [Alpine Ridge LP 2016] [8086:15c1] (rev 01) (prog-if 30 [XHCI])
	Subsystem: Lenovo Device [17aa:2286]
	Control: I/O+ Mem+ BusMaster- SpecCycle- MemWINV- VGASnoop- ParErr- Stepping- SERR- FastB2B- DisINTx+
	Status: Cap+ 66MHz- UDF- FastB2B- ParErr- DEVSEL=fast >TAbort- <TAbort- <MAbort- >SERR- <PERR- INTx-
	Interrupt: pin A routed to IRQ 130
	IOMMU group: 17
	Region 0: Memory at b3a00000 (32-bit, non-prefetchable) [size=64K]
	Capabilities: <access denied>
	Kernel driver in use: xhci_hcd

3d:00.0 Non-Volatile memory controller [0108]: Intel Corporation SSD Pro 7600p/760p/E 6100p Series [8086:f1a6] (rev 03) (prog-if 02 [NVM Express])
	Subsystem: Intel Corporation SSD Pro 7600p/760p/E 6100p Series [NVM Express] [8086:390b]
	Control: I/O- Mem+ BusMaster+ SpecCycle- MemWINV- VGASnoop- ParErr- Stepping- SERR- FastB2B- DisINTx+
	Status: Cap+ 66MHz- UDF- FastB2B- ParErr- DEVSEL=fast >TAbort- <TAbort- <MAbort- >SERR- <PERR- INTx-
	Latency: 0
	Interrupt: pin A routed to IRQ 16
	NUMA node: 0
	IOMMU group: 18
	Region 0: Memory at b2500000 (64-bit, non-prefetchable) [size=16K]
	Capabilities: <access denied>
	Kernel driver in use: nvme

