00:00.0 Host bridge [0600]: Intel Corporation Xeon E5/Core i7 DMI2 [8086:3c00] (rev 07)
	Subsystem: Hewlett-Packard Company Device [103c:158a]
	Control: I/O- Mem- BusMaster- SpecCycle- MemWINV- VGASnoop- ParErr- Stepping- SERR+ FastB2B- DisINTx-
	Status: Cap+ 66MHz- UDF- FastB2B- ParErr- DEVSEL=fast >TAbort- <TAbort- <MAbort- >SERR- <PERR- INTx-
	Interrupt: pin A routed to IRQ 0
	NUMA node: 0
	Capabilities: <access denied>

00:01.0 PCI bridge [0604]: Intel Corporation Xeon E5/Core i7 IIO PCI Express Root Port 1a [8086:3c02] (rev 07) (prog-if 00 [Normal decode])
	Control: I/O+ Mem+ BusMaster+ SpecCycle- MemWINV- VGASnoop- ParErr+ Stepping- SERR+ FastB2B- DisINTx+
	Status: Cap+ 66MHz- UDF- FastB2B- ParErr- DEVSEL=fast >TAbort- <TAbort- <MAbort- >SERR- <PERR- INTx-
	Latency: 0, Cache Line Size: 64 bytes
	Interrupt: pin A routed to IRQ 25
	NUMA node: 0
	Bus: primary=00, secondary=03, subordinate=03, sec-latency=0
	I/O behind bridge: None
	Memory behind bridge: None
	Prefetchable memory behind bridge: None
	Secondary status: 66MHz- FastB2B- ParErr- DEVSEL=fast >TAbort- <TAbort- <MAbort- <SERR- <PERR-
	BridgeCtl: Parity+ SERR+ NoISA- VGA- VGA16+ MAbort- >Reset- FastB2B-
		PriDiscTmr- SecDiscTmr- DiscTmrStat- DiscTmrSERREn-
	Capabilities: <access denied>
	Kernel driver in use: pcieport

00:02.0 PCI bridge [0604]: Intel Corporation Xeon E5/Core i7 IIO PCI Express Root Port 2a [8086:3c04] (rev 07) (prog-if 00 [Normal decode])
	Control: I/O+ Mem+ BusMaster+ SpecCycle- MemWINV- VGASnoop- ParErr+ Stepping- SERR+ FastB2B- DisINTx+
	Status: Cap+ 66MHz- UDF- FastB2B- ParErr- DEVSEL=fast >TAbort- <TAbort- <MAbort- >SERR- <PERR- INTx-
	Latency: 0, Cache Line Size: 64 bytes
	Interrupt: pin A routed to IRQ 27
	NUMA node: 0
	Bus: primary=00, secondary=05, subordinate=05, sec-latency=0
	I/O behind bridge: 0000b000-0000bfff [size=4K]
	Memory behind bridge: ee000000-ef0fffff [size=17M]
	Prefetchable memory behind bridge: 00000000e0000000-00000000e9ffffff [size=160M]
	Secondary status: 66MHz- FastB2B- ParErr- DEVSEL=fast >TAbort- <TAbort- <MAbort+ <SERR- <PERR-
	BridgeCtl: Parity+ SERR+ NoISA- VGA+ VGA16+ MAbort- >Reset- FastB2B-
		PriDiscTmr- SecDiscTmr- DiscTmrStat- DiscTmrSERREn-
	Capabilities: <access denied>
	Kernel driver in use: pcieport

00:03.0 PCI bridge [0604]: Intel Corporation Xeon E5/Core i7 IIO PCI Express Root Port 3a in PCI Express Mode [8086:3c08] (rev 07) (prog-if 00 [Normal decode])
	Control: I/O+ Mem+ BusMaster+ SpecCycle- MemWINV- VGASnoop- ParErr+ Stepping- SERR+ FastB2B- DisINTx+
	Status: Cap+ 66MHz- UDF- FastB2B- ParErr- DEVSEL=fast >TAbort- <TAbort- <MAbort- >SERR- <PERR- INTx-
	Latency: 0, Cache Line Size: 64 bytes
	Interrupt: pin A routed to IRQ 29
	NUMA node: 0
	Bus: primary=00, secondary=04, subordinate=04, sec-latency=0
	I/O behind bridge: 0000c000-0000cfff [size=4K]
	Memory behind bridge: ef300000-ef3fffff [size=1M]
	Prefetchable memory behind bridge: None
	Secondary status: 66MHz- FastB2B- ParErr- DEVSEL=fast >TAbort- <TAbort- <MAbort- <SERR- <PERR-
	BridgeCtl: Parity+ SERR+ NoISA- VGA- VGA16+ MAbort- >Reset- FastB2B-
		PriDiscTmr- SecDiscTmr- DiscTmrStat- DiscTmrSERREn-
	Capabilities: <access denied>
	Kernel driver in use: pcieport

00:05.0 System peripheral [0880]: Intel Corporation Xeon E5/Core i7 Address Map, VTd_Misc, System Management [8086:3c28] (rev 07)
	Subsystem: Hewlett-Packard Company Device [103c:158a]
	Control: I/O- Mem- BusMaster- SpecCycle- MemWINV- VGASnoop- ParErr- Stepping- SERR- FastB2B- DisINTx-
	Status: Cap+ 66MHz- UDF- FastB2B- ParErr- DEVSEL=fast >TAbort- <TAbort- <MAbort- >SERR- <PERR- INTx-
	NUMA node: 0
	Capabilities: <access denied>

00:05.2 System peripheral [0880]: Intel Corporation Xeon E5/Core i7 Control Status and Global Errors [8086:3c2a] (rev 07)
	Subsystem: Hewlett-Packard Company Device [103c:158a]
	Control: I/O- Mem- BusMaster- SpecCycle- MemWINV- VGASnoop- ParErr- Stepping- SERR- FastB2B- DisINTx-
	Status: Cap+ 66MHz- UDF- FastB2B- ParErr- DEVSEL=fast >TAbort- <TAbort- <MAbort- >SERR- <PERR- INTx-
	NUMA node: 0
	Capabilities: <access denied>

00:05.4 PIC [0800]: Intel Corporation Xeon E5/Core i7 I/O APIC [8086:3c2c] (rev 07) (prog-if 20 [IO(X)-APIC])
	Subsystem: Intel Corporation Xeon E5/Core i7 I/O APIC [8086:3c2c]
	Control: I/O- Mem+ BusMaster+ SpecCycle- MemWINV- VGASnoop- ParErr- Stepping- SERR- FastB2B- DisINTx-
	Status: Cap+ 66MHz- UDF- FastB2B- ParErr- DEVSEL=fast >TAbort- <TAbort- <MAbort- >SERR- <PERR- INTx-
	Latency: 0, Cache Line Size: 64 bytes
	NUMA node: 0
	Region 0: Memory at ef52a000 (32-bit, non-prefetchable) [size=4K]
	Capabilities: <access denied>

00:11.0 PCI bridge [0604]: Intel Corporation C600/X79 series chipset PCI Express Virtual Root Port [8086:1d3e] (rev 05) (prog-if 00 [Normal decode])
	Control: I/O+ Mem+ BusMaster+ SpecCycle- MemWINV- VGASnoop- ParErr- Stepping- SERR+ FastB2B- DisINTx+
	Status: Cap+ 66MHz- UDF- FastB2B- ParErr- DEVSEL=fast >TAbort- <TAbort- <MAbort- >SERR- <PERR- INTx-
	Latency: 0, Cache Line Size: 64 bytes
	Interrupt: pin A routed to IRQ 30
	NUMA node: 0
	Bus: primary=00, secondary=02, subordinate=02, sec-latency=0
	I/O behind bridge: 0000d000-0000dfff [size=4K]
	Memory behind bridge: None
	Prefetchable memory behind bridge: 00000000ea400000-00000000ea8fffff [size=5M]
	Secondary status: 66MHz- FastB2B- ParErr- DEVSEL=fast >TAbort- <TAbort- <MAbort+ <SERR- <PERR-
	BridgeCtl: Parity- SERR+ NoISA- VGA- VGA16+ MAbort- >Reset- FastB2B-
		PriDiscTmr- SecDiscTmr- DiscTmrStat- DiscTmrSERREn-
	Capabilities: <access denied>
	Kernel driver in use: pcieport

00:16.0 Communication controller [0780]: Intel Corporation C600/X79 series chipset MEI Controller #1 [8086:1d3a] (rev 05)
	Subsystem: Hewlett-Packard Company Device [103c:158a]
	Control: I/O- Mem+ BusMaster+ SpecCycle- MemWINV- VGASnoop- ParErr- Stepping- SERR- FastB2B- DisINTx+
	Status: Cap+ 66MHz- UDF- FastB2B- ParErr- DEVSEL=fast >TAbort- <TAbort- <MAbort- >SERR- <PERR- INTx-
	Latency: 0
	Interrupt: pin A routed to IRQ 51
	NUMA node: 0
	Region 0: Memory at ef529000 (64-bit, non-prefetchable) [size=16]
	Capabilities: <access denied>
	Kernel driver in use: mei_me
	Kernel modules: mei_me

00:16.2 IDE interface [0101]: Intel Corporation C600/X79 series chipset IDE-r Controller [8086:1d3c] (rev 05) (prog-if 85 [PCI native mode-only controller, supports bus mastering])
	Subsystem: Hewlett-Packard Company Device [103c:158a]
	Control: I/O+ Mem- BusMaster+ SpecCycle- MemWINV- VGASnoop- ParErr- Stepping- SERR- FastB2B- DisINTx-
	Status: Cap+ 66MHz+ UDF- FastB2B+ ParErr- DEVSEL=fast >TAbort- <TAbort- <MAbort- >SERR- <PERR- INTx-
	Latency: 0
	Interrupt: pin C routed to IRQ 18
	NUMA node: 0
	Region 0: I/O ports at f0b0 [size=8]
	Region 1: I/O ports at f0a0 [size=4]
	Region 2: I/O ports at f090 [size=8]
	Region 3: I/O ports at f080 [size=4]
	Region 4: I/O ports at f070 [size=16]
	Capabilities: <access denied>
	Kernel driver in use: ata_generic
	Kernel modules: pata_acpi

00:16.3 Serial controller [0700]: Intel Corporation C600/X79 series chipset KT Controller [8086:1d3d] (rev 05) (prog-if 02 [16550])
	Subsystem: Hewlett-Packard Company Device [103c:158a]
	Control: I/O+ Mem+ BusMaster- SpecCycle- MemWINV- VGASnoop- ParErr- Stepping- SERR- FastB2B- DisINTx-
	Status: Cap+ 66MHz+ UDF- FastB2B+ ParErr- DEVSEL=fast >TAbort- <TAbort- <MAbort- >SERR- <PERR- INTx-
	Interrupt: pin B routed to IRQ 17
	NUMA node: 0
	Region 0: I/O ports at f060 [size=8]
	Region 1: Memory at ef527000 (32-bit, non-prefetchable) [size=4K]
	Capabilities: <access denied>
	Kernel driver in use: serial

00:19.0 Ethernet controller [0200]: Intel Corporation 82579LM Gigabit Network Connection (Lewisville) [8086:1502] (rev 05)
	DeviceName: Onboard LAN
	Subsystem: Hewlett-Packard Company Device [103c:158a]
	Control: I/O+ Mem+ BusMaster+ SpecCycle- MemWINV- VGASnoop- ParErr- Stepping- SERR- FastB2B- DisINTx+
	Status: Cap+ 66MHz- UDF- FastB2B- ParErr- DEVSEL=fast >TAbort- <TAbort- <MAbort- >SERR- <PERR- INTx-
	Latency: 0
	Interrupt: pin A routed to IRQ 43
	NUMA node: 0
	Region 0: Memory at ef500000 (32-bit, non-prefetchable) [size=128K]
	Region 1: Memory at ef52d000 (32-bit, non-prefetchable) [size=4K]
	Region 2: I/O ports at f040 [size=32]
	Capabilities: <access denied>
	Kernel driver in use: e1000e
	Kernel modules: e1000e

00:1a.0 USB controller [0c03]: Intel Corporation C600/X79 series chipset USB2 Enhanced Host Controller #2 [8086:1d2d] (rev 05) (prog-if 20 [EHCI])
	Subsystem: Hewlett-Packard Company Device [103c:158a]
	Control: I/O- Mem+ BusMaster+ SpecCycle- MemWINV- VGASnoop- ParErr- Stepping- SERR+ FastB2B- DisINTx-
	Status: Cap+ 66MHz- UDF- FastB2B+ ParErr- DEVSEL=medium >TAbort- <TAbort- <MAbort- >SERR- <PERR- INTx-
	Latency: 0
	Interrupt: pin A routed to IRQ 16
	NUMA node: 0
	Region 0: Memory at ef52f000 (32-bit, non-prefetchable) [size=1K]
	Capabilities: <access denied>
	Kernel driver in use: ehci-pci

00:1b.0 Audio device [0403]: Intel Corporation C600/X79 series chipset High Definition Audio Controller [8086:1d20] (rev 05)
	Subsystem: Hewlett-Packard Company Device [103c:158a]
	Control: I/O- Mem+ BusMaster+ SpecCycle- MemWINV- VGASnoop- ParErr- Stepping- SERR+ FastB2B- DisINTx+
	Status: Cap+ 66MHz- UDF- FastB2B- ParErr- DEVSEL=fast >TAbort- <TAbort- <MAbort- >SERR- <PERR- INTx-
	Latency: 0, Cache Line Size: 64 bytes
	Interrupt: pin A routed to IRQ 52
	NUMA node: 0
	Region 0: Memory at ef520000 (64-bit, non-prefetchable) [size=16K]
	Capabilities: <access denied>
	Kernel driver in use: snd_hda_intel
	Kernel modules: snd_hda_intel

00:1c.0 PCI bridge [0604]: Intel Corporation C600/X79 series chipset PCI Express Root Port 2 [8086:1d12] (rev b5) (prog-if 00 [Normal decode])
	Control: I/O+ Mem+ BusMaster+ SpecCycle- MemWINV- VGASnoop- ParErr+ Stepping- SERR- FastB2B- DisINTx+
	Status: Cap+ 66MHz- UDF- FastB2B- ParErr- DEVSEL=fast >TAbort- <TAbort- <MAbort- >SERR- <PERR- INTx-
	Latency: 0, Cache Line Size: 64 bytes
	Interrupt: pin B routed to IRQ 31
	NUMA node: 0
	Bus: primary=00, secondary=01, subordinate=01, sec-latency=0
	I/O behind bridge: 0000e000-0000efff [size=4K]
	Memory behind bridge: ef400000-ef4fffff [size=1M]
	Prefetchable memory behind bridge: None
	Secondary status: 66MHz- FastB2B- ParErr- DEVSEL=fast >TAbort- <TAbort- <MAbort+ <SERR- <PERR-
	BridgeCtl: Parity+ SERR+ NoISA- VGA- VGA16+ MAbort- >Reset- FastB2B-
		PriDiscTmr- SecDiscTmr- DiscTmrStat- DiscTmrSERREn-
	Capabilities: <access denied>
	Kernel driver in use: pcieport

00:1c.5 PCI bridge [0604]: Intel Corporation C600/X79 series chipset PCI Express Root Port 5 [8086:1d18] (rev b5) (prog-if 00 [Normal decode])
	Control: I/O+ Mem+ BusMaster+ SpecCycle- MemWINV- VGASnoop- ParErr+ Stepping- SERR+ FastB2B- DisINTx+
	Status: Cap+ 66MHz- UDF- FastB2B- ParErr- DEVSEL=fast >TAbort- <TAbort- <MAbort- >SERR- <PERR- INTx-
	Latency: 0, Cache Line Size: 64 bytes
	Interrupt: pin A routed to IRQ 32
	NUMA node: 0
	Bus: primary=00, secondary=06, subordinate=07, sec-latency=0
	I/O behind bridge: 0000a000-0000afff [size=4K]
	Memory behind bridge: None
	Prefetchable memory behind bridge: None
	Secondary status: 66MHz- FastB2B- ParErr- DEVSEL=fast >TAbort- <TAbort- <MAbort+ <SERR- <PERR-
	BridgeCtl: Parity+ SERR+ NoISA- VGA- VGA16+ MAbort- >Reset- FastB2B-
		PriDiscTmr- SecDiscTmr- DiscTmrStat- DiscTmrSERREn-
	Capabilities: <access denied>
	Kernel driver in use: pcieport

00:1c.6 PCI bridge [0604]: Intel Corporation C600/X79 series chipset PCI Express Root Port 3 [8086:1d14] (rev b5) (prog-if 00 [Normal decode])
	Control: I/O+ Mem+ BusMaster+ SpecCycle- MemWINV- VGASnoop- ParErr+ Stepping- SERR+ FastB2B- DisINTx+
	Status: Cap+ 66MHz- UDF- FastB2B- ParErr- DEVSEL=fast >TAbort- <TAbort- <MAbort- >SERR- <PERR- INTx-
	Latency: 0, Cache Line Size: 64 bytes
	Interrupt: pin C routed to IRQ 33
	NUMA node: 0
	Bus: primary=00, secondary=08, subordinate=08, sec-latency=0
	I/O behind bridge: None
	Memory behind bridge: None
	Prefetchable memory behind bridge: None
	Secondary status: 66MHz- FastB2B- ParErr- DEVSEL=fast >TAbort- <TAbort- <MAbort+ <SERR- <PERR-
	BridgeCtl: Parity+ SERR+ NoISA- VGA- VGA16+ MAbort- >Reset- FastB2B-
		PriDiscTmr- SecDiscTmr- DiscTmrStat- DiscTmrSERREn-
	Capabilities: <access denied>
	Kernel driver in use: pcieport

00:1c.7 PCI bridge [0604]: Intel Corporation C600/X79 series chipset PCI Express Root Port 4 [8086:1d16] (rev b5) (prog-if 00 [Normal decode])
	Control: I/O+ Mem+ BusMaster+ SpecCycle- MemWINV- VGASnoop- ParErr- Stepping- SERR+ FastB2B- DisINTx+
	Status: Cap+ 66MHz- UDF- FastB2B- ParErr- DEVSEL=fast >TAbort- <TAbort- <MAbort- >SERR- <PERR- INTx-
	Latency: 0, Cache Line Size: 64 bytes
	Interrupt: pin D routed to IRQ 34
	NUMA node: 0
	Bus: primary=00, secondary=09, subordinate=09, sec-latency=0
	I/O behind bridge: None
	Memory behind bridge: ef200000-ef2fffff [size=1M]
	Prefetchable memory behind bridge: None
	Secondary status: 66MHz- FastB2B- ParErr- DEVSEL=fast >TAbort- <TAbort- <MAbort+ <SERR- <PERR-
	BridgeCtl: Parity- SERR+ NoISA- VGA- VGA16+ MAbort- >Reset- FastB2B-
		PriDiscTmr- SecDiscTmr- DiscTmrStat- DiscTmrSERREn-
	Capabilities: <access denied>
	Kernel driver in use: pcieport

00:1d.0 USB controller [0c03]: Intel Corporation C600/X79 series chipset USB2 Enhanced Host Controller #1 [8086:1d26] (rev 05) (prog-if 20 [EHCI])
	Subsystem: Hewlett-Packard Company Device [103c:158a]
	Control: I/O- Mem+ BusMaster+ SpecCycle- MemWINV- VGASnoop- ParErr- Stepping- SERR+ FastB2B- DisINTx-
	Status: Cap+ 66MHz- UDF- FastB2B+ ParErr- DEVSEL=medium >TAbort- <TAbort- <MAbort- >SERR- <PERR- INTx-
	Latency: 0
	Interrupt: pin A routed to IRQ 23
	NUMA node: 0
	Region 0: Memory at ef52e000 (32-bit, non-prefetchable) [size=1K]
	Capabilities: <access denied>
	Kernel driver in use: ehci-pci

00:1e.0 PCI bridge [0604]: Intel Corporation 82801 PCI Bridge [8086:244e] (rev a5) (prog-if 01 [Subtractive decode])
	Control: I/O+ Mem+ BusMaster+ SpecCycle- MemWINV- VGASnoop- ParErr+ Stepping- SERR+ FastB2B- DisINTx-
	Status: Cap+ 66MHz- UDF- FastB2B- ParErr- DEVSEL=fast >TAbort- <TAbort- <MAbort- >SERR- <PERR- INTx-
	Latency: 0
	NUMA node: 0
	Bus: primary=00, secondary=0a, subordinate=0a, sec-latency=128
	I/O behind bridge: None
	Memory behind bridge: ef100000-ef1fffff [size=1M]
	Prefetchable memory behind bridge: None
	Secondary status: 66MHz- FastB2B+ ParErr- DEVSEL=medium >TAbort- <TAbort- <MAbort+ <SERR- <PERR-
	BridgeCtl: Parity+ SERR+ NoISA- VGA- VGA16+ MAbort- >Reset- FastB2B-
		PriDiscTmr- SecDiscTmr- DiscTmrStat- DiscTmrSERREn-
	Capabilities: <access denied>

00:1f.0 ISA bridge [0601]: Intel Corporation C600/X79 series chipset LPC Controller [8086:1d41] (rev 05)
	Subsystem: Hewlett-Packard Company Device [103c:158a]
	Control: I/O+ Mem+ BusMaster+ SpecCycle- MemWINV- VGASnoop- ParErr- Stepping- SERR+ FastB2B- DisINTx-
	Status: Cap+ 66MHz- UDF- FastB2B- ParErr- DEVSEL=medium >TAbort- <TAbort- <MAbort- >SERR- <PERR- INTx-
	Latency: 0
	NUMA node: 0
	Capabilities: <access denied>
	Kernel driver in use: lpc_ich
	Kernel modules: lpc_ich

00:1f.2 RAID bus controller [0104]: Intel Corporation C600/X79 series chipset SATA RAID Controller [8086:2826] (rev 05)
	Subsystem: Hewlett-Packard Company Device [103c:158a]
	Control: I/O+ Mem+ BusMaster+ SpecCycle- MemWINV- VGASnoop- ParErr- Stepping- SERR- FastB2B- DisINTx+
	Status: Cap+ 66MHz+ UDF- FastB2B+ ParErr- DEVSEL=medium >TAbort- <TAbort- <MAbort- >SERR- <PERR- INTx-
	Latency: 0
	Interrupt: pin B routed to IRQ 44
	NUMA node: 0
	Region 0: I/O ports at f0f0 [size=8]
	Region 1: I/O ports at f0e0 [size=4]
	Region 2: I/O ports at f0d0 [size=8]
	Region 3: I/O ports at f0c0 [size=4]
	Region 4: I/O ports at f020 [size=32]
	Region 5: Memory at ef52c000 (32-bit, non-prefetchable) [size=2K]
	Capabilities: <access denied>
	Kernel driver in use: ahci
	Kernel modules: ahci

00:1f.3 SMBus [0c05]: Intel Corporation C600/X79 series chipset SMBus Host Controller [8086:1d22] (rev 05)
	Subsystem: Hewlett-Packard Company Device [103c:158a]
	Control: I/O+ Mem+ BusMaster- SpecCycle- MemWINV- VGASnoop- ParErr- Stepping- SERR+ FastB2B- DisINTx-
	Status: Cap- 66MHz- UDF- FastB2B+ ParErr- DEVSEL=medium >TAbort- <TAbort- <MAbort- >SERR- <PERR- INTx-
	Interrupt: pin C routed to IRQ 18
	NUMA node: 0
	Region 0: Memory at ef52b000 (64-bit, non-prefetchable) [size=256]
	Region 4: I/O ports at f000 [size=32]
	Kernel driver in use: i801_smbus
	Kernel modules: i2c_i801

01:00.0 Ethernet controller [0200]: Intel Corporation 82574L Gigabit Network Connection [8086:10d3]
	Subsystem: Hewlett-Packard Company Device [103c:158a]
	Control: I/O+ Mem+ BusMaster+ SpecCycle- MemWINV- VGASnoop- ParErr- Stepping- SERR- FastB2B- DisINTx+
	Status: Cap+ 66MHz- UDF- FastB2B- ParErr- DEVSEL=fast >TAbort- <TAbort- <MAbort- >SERR- <PERR- INTx-
	Latency: 0, Cache Line Size: 64 bytes
	Interrupt: pin A routed to IRQ 17
	NUMA node: 0
	Region 0: Memory at ef400000 (32-bit, non-prefetchable) [size=128K]
	Region 2: I/O ports at e000 [size=32]
	Region 3: Memory at ef420000 (32-bit, non-prefetchable) [size=16K]
	Capabilities: <access denied>
	Kernel driver in use: e1000e
	Kernel modules: e1000e

02:00.0 Serial Attached SCSI controller [0107]: Intel Corporation C602 chipset 4-Port SATA Storage Control Unit [8086:1d6b] (rev 05)
	Subsystem: Hewlett-Packard Company Device [103c:158a]
	Control: I/O+ Mem+ BusMaster+ SpecCycle- MemWINV- VGASnoop- ParErr- Stepping- SERR+ FastB2B- DisINTx+
	Status: Cap+ 66MHz- UDF- FastB2B- ParErr- DEVSEL=fast >TAbort- <TAbort- <MAbort- >SERR- <PERR- INTx-
	Latency: 0, Cache Line Size: 64 bytes
	Interrupt: pin A routed to IRQ 16
	NUMA node: 0
	Region 0: Memory at ea800000 (64-bit, prefetchable) [size=16K]
	Region 2: Memory at ea400000 (64-bit, prefetchable) [size=4M]
	Region 4: I/O ports at d000 [size=256]
	Capabilities: <access denied>
	Kernel driver in use: isci
	Kernel modules: isci

04:00.0 Serial Attached SCSI controller [0107]: Broadcom / LSI SAS2008 PCI-Express Fusion-MPT SAS-2 [Falcon] [1000:0072] (rev 03)
	Subsystem: Broadcom / LSI Device [1000:30f0]
	Physical Slot: 5
	Control: I/O+ Mem+ BusMaster+ SpecCycle- MemWINV- VGASnoop- ParErr- Stepping- SERR+ FastB2B- DisINTx+
	Status: Cap+ 66MHz- UDF- FastB2B- ParErr- DEVSEL=fast >TAbort- <TAbort- <MAbort- >SERR- <PERR- INTx-
	Latency: 0, Cache Line Size: 64 bytes
	Interrupt: pin A routed to IRQ 28
	NUMA node: 0
	Region 0: I/O ports at c000 [size=256]
	Region 1: Memory at ef3c0000 (64-bit, non-prefetchable) [size=16K]
	Region 3: Memory at ef380000 (64-bit, non-prefetchable) [size=256K]
	Expansion ROM at ef300000 [disabled] [size=512K]
	Capabilities: <access denied>
	Kernel driver in use: mpt3sas
	Kernel modules: mpt3sas

05:00.0 VGA compatible controller [0300]: NVIDIA Corporation GK208B [GeForce GT 710] [10de:128b] (rev a1) (prog-if 00 [VGA controller])
	Subsystem: Micro-Star International Co., Ltd. [MSI] Device [1462:8c93]
	Physical Slot: 2
	Control: I/O+ Mem+ BusMaster+ SpecCycle- MemWINV- VGASnoop- ParErr- Stepping- SERR+ FastB2B- DisINTx+
	Status: Cap+ 66MHz- UDF- FastB2B- ParErr- DEVSEL=fast >TAbort- <TAbort- <MAbort- >SERR- <PERR- INTx-
	Latency: 0
	Interrupt: pin A routed to IRQ 54
	NUMA node: 0
	Region 0: Memory at ee000000 (32-bit, non-prefetchable) [size=16M]
	Region 1: Memory at e0000000 (64-bit, prefetchable) [size=128M]
	Region 3: Memory at e8000000 (64-bit, prefetchable) [size=32M]
	Region 5: I/O ports at b000 [size=128]
	[virtual] Expansion ROM at 000c0000 [disabled] [size=128K]
	Capabilities: <access denied>
	Kernel driver in use: nvidia
	Kernel modules: nvidiafb, nouveau, nvidia_drm, nvidia

05:00.1 Audio device [0403]: NVIDIA Corporation GK208 HDMI/DP Audio Controller [10de:0e0f] (rev a1)
	Subsystem: Micro-Star International Co., Ltd. [MSI] Device [1462:8c93]
	Physical Slot: 2
	Control: I/O- Mem+ BusMaster+ SpecCycle- MemWINV- VGASnoop- ParErr- Stepping- SERR+ FastB2B- DisINTx-
	Status: Cap+ 66MHz- UDF- FastB2B- ParErr- DEVSEL=fast >TAbort- <TAbort- <MAbort- >SERR- <PERR- INTx-
	Latency: 0, Cache Line Size: 64 bytes
	Interrupt: pin B routed to IRQ 53
	NUMA node: 0
	Region 0: Memory at ef080000 (32-bit, non-prefetchable) [size=16K]
	Capabilities: <access denied>
	Kernel driver in use: snd_hda_intel
	Kernel modules: snd_hda_intel

06:00.0 PCI bridge [0604]: ASMedia Technology Inc. ASM1083/1085 PCIe to PCI Bridge [1b21:1080] (rev 01) (prog-if 00 [Normal decode])
	Physical Slot: 3
	Control: I/O+ Mem+ BusMaster+ SpecCycle- MemWINV- VGASnoop- ParErr- Stepping- SERR+ FastB2B- DisINTx-
	Status: Cap+ 66MHz- UDF- FastB2B- ParErr- DEVSEL=fast >TAbort- <TAbort- <MAbort- >SERR- <PERR- INTx-
	Latency: 0, Cache Line Size: 64 bytes
	Interrupt: pin A routed to IRQ 16
	NUMA node: 0
	Bus: primary=06, secondary=07, subordinate=07, sec-latency=128
	I/O behind bridge: 0000a000-0000afff [size=4K]
	Memory behind bridge: None
	Prefetchable memory behind bridge: None
	Secondary status: 66MHz+ FastB2B- ParErr- DEVSEL=fast >TAbort- <TAbort- <MAbort+ <SERR- <PERR-
	BridgeCtl: Parity- SERR+ NoISA- VGA- VGA16+ MAbort- >Reset- FastB2B-
		PriDiscTmr- SecDiscTmr- DiscTmrStat- DiscTmrSERREn-
	Capabilities: <access denied>

07:00.0 Multimedia audio controller [0401]: C-Media Electronics Inc CMI8738/CMI8768 PCI Audio [13f6:0111] (rev 10)
	Subsystem: C-Media Electronics Inc CMI8738/C3DX PCI Audio Device [13f6:0111]
	Control: I/O+ Mem- BusMaster+ SpecCycle- MemWINV- VGASnoop- ParErr- Stepping+ SERR+ FastB2B- DisINTx-
	Status: Cap+ 66MHz- UDF- FastB2B- ParErr- DEVSEL=medium >TAbort- <TAbort- <MAbort- >SERR- <PERR- INTx-
	Latency: 128 (500ns min, 6000ns max)
	Interrupt: pin A routed to IRQ 16
	NUMA node: 0
	Region 0: I/O ports at a000 [size=256]
	Capabilities: <access denied>
	Kernel driver in use: snd_cmipci
	Kernel modules: snd_cmipci

09:00.0 USB controller [0c03]: Texas Instruments TUSB73x0 SuperSpeed USB 3.0 xHCI Host Controller [104c:8241] (rev 02) (prog-if 30 [XHCI])
	Subsystem: Hewlett-Packard Company Device [103c:158a]
	Control: I/O- Mem+ BusMaster+ SpecCycle- MemWINV- VGASnoop- ParErr- Stepping- SERR+ FastB2B- DisINTx+
	Status: Cap+ 66MHz- UDF- FastB2B- ParErr- DEVSEL=fast >TAbort- <TAbort- <MAbort- >SERR- <PERR- INTx-
	Latency: 0, Cache Line Size: 64 bytes
	Interrupt: pin A routed to IRQ 19
	NUMA node: 0
	Region 0: Memory at ef200000 (64-bit, non-prefetchable) [size=64K]
	Region 2: Memory at ef210000 (64-bit, non-prefetchable) [size=8K]
	Capabilities: <access denied>
	Kernel driver in use: xhci_hcd

0a:04.0 Network controller [0280]: Ralink corp. RT5360 Wireless 802.11n 1T/1R [1814:5360]
	Subsystem: D-Link System Inc DWA-525 Wireless N 150 Desktop Adapter (rev.A2) [1186:3c05]
	Control: I/O- Mem+ BusMaster+ SpecCycle- MemWINV+ VGASnoop- ParErr- Stepping- SERR+ FastB2B- DisINTx-
	Status: Cap+ 66MHz- UDF- FastB2B- ParErr- DEVSEL=slow >TAbort- <TAbort- <MAbort- >SERR- <PERR- INTx-
	Latency: 128 (500ns min, 1000ns max), Cache Line Size: 64 bytes
	Interrupt: pin A routed to IRQ 20
	NUMA node: 0
	Region 0: Memory at ef100000 (32-bit, non-prefetchable) [size=64K]
	Capabilities: <access denied>
	Kernel driver in use: rt2800pci
	Kernel modules: rt2800pci

0a:05.0 FireWire (IEEE 1394) [0c00]: LSI Corporation FW322/323 [TrueFire] 1394a Controller [11c1:5811] (rev 70) (prog-if 10 [OHCI])
	Subsystem: Hewlett-Packard Company Device [103c:158a]
	Control: I/O- Mem+ BusMaster+ SpecCycle- MemWINV- VGASnoop- ParErr- Stepping- SERR+ FastB2B- DisINTx-
	Status: Cap+ 66MHz- UDF- FastB2B+ ParErr- DEVSEL=medium >TAbort- <TAbort- <MAbort- >SERR- <PERR- INTx-
	Latency: 128 (3000ns min, 6000ns max), Cache Line Size: 64 bytes
	Interrupt: pin A routed to IRQ 19
	NUMA node: 0
	Region 0: Memory at ef110000 (32-bit, non-prefetchable) [size=4K]
	Capabilities: <access denied>
	Kernel driver in use: firewire_ohci
	Kernel modules: firewire_ohci

3f:08.0 System peripheral [0880]: Intel Corporation Xeon E5/Core i7 QPI Link 0 [8086:3c80] (rev 07)
	Subsystem: Intel Corporation Device [8086:0000]
	Control: I/O- Mem- BusMaster- SpecCycle- MemWINV- VGASnoop- ParErr- Stepping- SERR- FastB2B- DisINTx-
	Status: Cap- 66MHz- UDF- FastB2B- ParErr- DEVSEL=fast >TAbort- <TAbort- <MAbort- >SERR- <PERR- INTx-

3f:08.3 System peripheral [0880]: Intel Corporation Xeon E5/Core i7 QPI Link Reut 0 [8086:3c83] (rev 07)
	Subsystem: Intel Corporation Device [8086:0000]
	Control: I/O- Mem- BusMaster- SpecCycle- MemWINV- VGASnoop- ParErr- Stepping- SERR- FastB2B- DisINTx-
	Status: Cap+ 66MHz- UDF- FastB2B- ParErr- DEVSEL=fast >TAbort- <TAbort- <MAbort- >SERR- <PERR- INTx-
	Capabilities: <access denied>

3f:08.4 System peripheral [0880]: Intel Corporation Xeon E5/Core i7 QPI Link Reut 0 [8086:3c84] (rev 07)
	Subsystem: Intel Corporation Device [8086:0000]
	Control: I/O- Mem- BusMaster- SpecCycle- MemWINV- VGASnoop- ParErr- Stepping- SERR- FastB2B- DisINTx-
	Status: Cap+ 66MHz- UDF- FastB2B- ParErr- DEVSEL=fast >TAbort- <TAbort- <MAbort- >SERR- <PERR- INTx-
	Capabilities: <access denied>

3f:09.0 System peripheral [0880]: Intel Corporation Xeon E5/Core i7 QPI Link 1 [8086:3c90] (rev 07)
	Subsystem: Intel Corporation Device [8086:0000]
	Control: I/O- Mem- BusMaster- SpecCycle- MemWINV- VGASnoop- ParErr- Stepping- SERR- FastB2B- DisINTx-
	Status: Cap- 66MHz- UDF- FastB2B- ParErr- DEVSEL=fast >TAbort- <TAbort- <MAbort- >SERR- <PERR- INTx-

3f:09.3 System peripheral [0880]: Intel Corporation Xeon E5/Core i7 QPI Link Reut 1 [8086:3c93] (rev 07)
	Subsystem: Intel Corporation Device [8086:0000]
	Control: I/O- Mem- BusMaster- SpecCycle- MemWINV- VGASnoop- ParErr- Stepping- SERR- FastB2B- DisINTx-
	Status: Cap+ 66MHz- UDF- FastB2B- ParErr- DEVSEL=fast >TAbort- <TAbort- <MAbort- >SERR- <PERR- INTx-
	Capabilities: <access denied>

3f:09.4 System peripheral [0880]: Intel Corporation Xeon E5/Core i7 QPI Link Reut 1 [8086:3c94] (rev 07)
	Subsystem: Intel Corporation Device [8086:0000]
	Control: I/O- Mem- BusMaster- SpecCycle- MemWINV- VGASnoop- ParErr- Stepping- SERR- FastB2B- DisINTx-
	Status: Cap+ 66MHz- UDF- FastB2B- ParErr- DEVSEL=fast >TAbort- <TAbort- <MAbort- >SERR- <PERR- INTx-
	Capabilities: <access denied>

3f:0a.0 System peripheral [0880]: Intel Corporation Xeon E5/Core i7 Power Control Unit 0 [8086:3cc0] (rev 07)
	Subsystem: Intel Corporation Device [8086:0000]
	Control: I/O- Mem- BusMaster- SpecCycle- MemWINV- VGASnoop- ParErr- Stepping- SERR- FastB2B- DisINTx-
	Status: Cap- 66MHz- UDF- FastB2B- ParErr- DEVSEL=fast >TAbort- <TAbort- <MAbort- >SERR- <PERR- INTx-

3f:0a.1 System peripheral [0880]: Intel Corporation Xeon E5/Core i7 Power Control Unit 1 [8086:3cc1] (rev 07)
	Subsystem: Intel Corporation Device [8086:0000]
	Control: I/O- Mem- BusMaster- SpecCycle- MemWINV- VGASnoop- ParErr- Stepping- SERR- FastB2B- DisINTx-
	Status: Cap- 66MHz- UDF- FastB2B- ParErr- DEVSEL=fast >TAbort- <TAbort- <MAbort- >SERR- <PERR- INTx-

3f:0a.2 System peripheral [0880]: Intel Corporation Xeon E5/Core i7 Power Control Unit 2 [8086:3cc2] (rev 07)
	Subsystem: Intel Corporation Device [8086:0000]
	Control: I/O- Mem- BusMaster- SpecCycle- MemWINV- VGASnoop- ParErr- Stepping- SERR- FastB2B- DisINTx-
	Status: Cap- 66MHz- UDF- FastB2B- ParErr- DEVSEL=fast >TAbort- <TAbort- <MAbort- >SERR- <PERR- INTx-

3f:0a.3 System peripheral [0880]: Intel Corporation Xeon E5/Core i7 Power Control Unit 3 [8086:3cd0] (rev 07)
	Subsystem: Intel Corporation Device [8086:0000]
	Control: I/O- Mem- BusMaster- SpecCycle- MemWINV- VGASnoop- ParErr- Stepping- SERR- FastB2B- DisINTx-
	Status: Cap- 66MHz- UDF- FastB2B- ParErr- DEVSEL=fast >TAbort- <TAbort- <MAbort- >SERR- <PERR- INTx-

3f:0b.0 System peripheral [0880]: Intel Corporation Xeon E5/Core i7 Interrupt Control Registers [8086:3ce0] (rev 07)
	Subsystem: Intel Corporation Device [8086:0000]
	Control: I/O- Mem- BusMaster- SpecCycle- MemWINV- VGASnoop- ParErr- Stepping- SERR- FastB2B- DisINTx-
	Status: Cap- 66MHz- UDF- FastB2B- ParErr- DEVSEL=fast >TAbort- <TAbort- <MAbort- >SERR- <PERR- INTx-

3f:0b.3 System peripheral [0880]: Intel Corporation Xeon E5/Core i7 Semaphore and Scratchpad Configuration Registers [8086:3ce3] (rev 07)
	Subsystem: Intel Corporation Device [8086:0000]
	Control: I/O- Mem- BusMaster- SpecCycle- MemWINV- VGASnoop- ParErr- Stepping- SERR- FastB2B- DisINTx-
	Status: Cap- 66MHz- UDF- FastB2B- ParErr- DEVSEL=fast >TAbort- <TAbort- <MAbort- >SERR- <PERR- INTx-

3f:0c.0 System peripheral [0880]: Intel Corporation Xeon E5/Core i7 Unicast Register 0 [8086:3ce8] (rev 07)
	Subsystem: Intel Corporation Device [8086:0000]
	Control: I/O- Mem- BusMaster- SpecCycle- MemWINV- VGASnoop- ParErr- Stepping- SERR- FastB2B- DisINTx-
	Status: Cap- 66MHz- UDF- FastB2B- ParErr- DEVSEL=fast >TAbort- <TAbort- <MAbort- >SERR- <PERR- INTx-

3f:0c.1 System peripheral [0880]: Intel Corporation Xeon E5/Core i7 Unicast Register 0 [8086:3ce8] (rev 07)
	Subsystem: Intel Corporation Device [8086:0000]
	Control: I/O- Mem- BusMaster- SpecCycle- MemWINV- VGASnoop- ParErr- Stepping- SERR- FastB2B- DisINTx-
	Status: Cap- 66MHz- UDF- FastB2B- ParErr- DEVSEL=fast >TAbort- <TAbort- <MAbort- >SERR- <PERR- INTx-

3f:0c.2 System peripheral [0880]: Intel Corporation Xeon E5/Core i7 Unicast Register 0 [8086:3ce8] (rev 07)
	Subsystem: Intel Corporation Device [8086:0000]
	Control: I/O- Mem- BusMaster- SpecCycle- MemWINV- VGASnoop- ParErr- Stepping- SERR- FastB2B- DisINTx-
	Status: Cap- 66MHz- UDF- FastB2B- ParErr- DEVSEL=fast >TAbort- <TAbort- <MAbort- >SERR- <PERR- INTx-

3f:0c.6 System peripheral [0880]: Intel Corporation Xeon E5/Core i7 Integrated Memory Controller System Address Decoder 0 [8086:3cf4] (rev 07)
	Subsystem: Intel Corporation Device [8086:0000]
	Control: I/O- Mem- BusMaster- SpecCycle- MemWINV- VGASnoop- ParErr- Stepping- SERR- FastB2B- DisINTx-
	Status: Cap- 66MHz- UDF- FastB2B- ParErr- DEVSEL=fast >TAbort- <TAbort- <MAbort- >SERR- <PERR- INTx-

3f:0c.7 System peripheral [0880]: Intel Corporation Xeon E5/Core i7 System Address Decoder [8086:3cf6] (rev 07)
	Subsystem: Intel Corporation Device [8086:0000]
	Control: I/O- Mem- BusMaster- SpecCycle- MemWINV- VGASnoop- ParErr- Stepping- SERR- FastB2B- DisINTx-
	Status: Cap- 66MHz- UDF- FastB2B- ParErr- DEVSEL=fast >TAbort- <TAbort- <MAbort- >SERR- <PERR- INTx-

3f:0d.0 System peripheral [0880]: Intel Corporation Xeon E5/Core i7 Unicast Register 0 [8086:3ce8] (rev 07)
	Subsystem: Intel Corporation Device [8086:0000]
	Control: I/O- Mem- BusMaster- SpecCycle- MemWINV- VGASnoop- ParErr- Stepping- SERR- FastB2B- DisINTx-
	Status: Cap- 66MHz- UDF- FastB2B- ParErr- DEVSEL=fast >TAbort- <TAbort- <MAbort- >SERR- <PERR- INTx-

3f:0d.1 System peripheral [0880]: Intel Corporation Xeon E5/Core i7 Unicast Register 0 [8086:3ce8] (rev 07)
	Subsystem: Intel Corporation Device [8086:0000]
	Control: I/O- Mem- BusMaster- SpecCycle- MemWINV- VGASnoop- ParErr- Stepping- SERR- FastB2B- DisINTx-
	Status: Cap- 66MHz- UDF- FastB2B- ParErr- DEVSEL=fast >TAbort- <TAbort- <MAbort- >SERR- <PERR- INTx-

3f:0d.2 System peripheral [0880]: Intel Corporation Xeon E5/Core i7 Unicast Register 0 [8086:3ce8] (rev 07)
	Subsystem: Intel Corporation Device [8086:0000]
	Control: I/O- Mem- BusMaster- SpecCycle- MemWINV- VGASnoop- ParErr- Stepping- SERR- FastB2B- DisINTx-
	Status: Cap- 66MHz- UDF- FastB2B- ParErr- DEVSEL=fast >TAbort- <TAbort- <MAbort- >SERR- <PERR- INTx-

3f:0d.6 System peripheral [0880]: Intel Corporation Xeon E5/Core i7 Integrated Memory Controller System Address Decoder 1 [8086:3cf5] (rev 07)
	Subsystem: Intel Corporation Device [8086:0000]
	Control: I/O- Mem- BusMaster- SpecCycle- MemWINV- VGASnoop- ParErr- Stepping- SERR- FastB2B- DisINTx-
	Status: Cap- 66MHz- UDF- FastB2B- ParErr- DEVSEL=fast >TAbort- <TAbort- <MAbort- >SERR- <PERR- INTx-

3f:0e.0 System peripheral [0880]: Intel Corporation Xeon E5/Core i7 Processor Home Agent [8086:3ca0] (rev 07)
	Control: I/O- Mem- BusMaster- SpecCycle- MemWINV- VGASnoop- ParErr- Stepping- SERR- FastB2B- DisINTx-
	Status: Cap- 66MHz- UDF- FastB2B- ParErr- DEVSEL=fast >TAbort- <TAbort- <MAbort- >SERR- <PERR- INTx-

3f:0e.1 Performance counters [1101]: Intel Corporation Xeon E5/Core i7 Processor Home Agent Performance Monitoring [8086:3c46] (rev 07)
	Control: I/O- Mem- BusMaster- SpecCycle- MemWINV- VGASnoop- ParErr- Stepping- SERR- FastB2B- DisINTx-
	Status: Cap- 66MHz- UDF- FastB2B- ParErr- DEVSEL=fast >TAbort- <TAbort- <MAbort- >SERR- <PERR- INTx-
	Kernel driver in use: snbep_uncore

3f:0f.0 System peripheral [0880]: Intel Corporation Xeon E5/Core i7 Integrated Memory Controller Registers [8086:3ca8] (rev 07)
	Subsystem: Intel Corporation Device [8086:0000]
	Control: I/O- Mem- BusMaster- SpecCycle- MemWINV- VGASnoop- ParErr- Stepping- SERR- FastB2B- DisINTx-
	Status: Cap+ 66MHz- UDF- FastB2B- ParErr- DEVSEL=fast >TAbort- <TAbort- <MAbort- >SERR- <PERR- INTx-
	Capabilities: <access denied>

3f:0f.1 System peripheral [0880]: Intel Corporation Xeon E5/Core i7 Integrated Memory Controller RAS Registers [8086:3c71] (rev 07)
	Subsystem: Intel Corporation Device [8086:0000]
	Control: I/O- Mem- BusMaster- SpecCycle- MemWINV- VGASnoop- ParErr- Stepping- SERR- FastB2B- DisINTx-
	Status: Cap+ 66MHz- UDF- FastB2B- ParErr- DEVSEL=fast >TAbort- <TAbort- <MAbort- >SERR- <PERR- INTx-
	Capabilities: <access denied>

3f:0f.2 System peripheral [0880]: Intel Corporation Xeon E5/Core i7 Integrated Memory Controller Target Address Decoder 0 [8086:3caa] (rev 07)
	Subsystem: Intel Corporation Device [8086:0000]
	Control: I/O- Mem- BusMaster- SpecCycle- MemWINV- VGASnoop- ParErr- Stepping- SERR- FastB2B- DisINTx-
	Status: Cap+ 66MHz- UDF- FastB2B- ParErr- DEVSEL=fast >TAbort- <TAbort- <MAbort- >SERR- <PERR- INTx-
	Capabilities: <access denied>

3f:0f.3 System peripheral [0880]: Intel Corporation Xeon E5/Core i7 Integrated Memory Controller Target Address Decoder 1 [8086:3cab] (rev 07)
	Subsystem: Intel Corporation Device [8086:0000]
	Control: I/O- Mem- BusMaster- SpecCycle- MemWINV- VGASnoop- ParErr- Stepping- SERR- FastB2B- DisINTx-
	Status: Cap+ 66MHz- UDF- FastB2B- ParErr- DEVSEL=fast >TAbort- <TAbort- <MAbort- >SERR- <PERR- INTx-
	Capabilities: <access denied>

3f:0f.4 System peripheral [0880]: Intel Corporation Xeon E5/Core i7 Integrated Memory Controller Target Address Decoder 2 [8086:3cac] (rev 07)
	Subsystem: Intel Corporation Device [8086:0000]
	Control: I/O- Mem- BusMaster- SpecCycle- MemWINV- VGASnoop- ParErr- Stepping- SERR- FastB2B- DisINTx-
	Status: Cap+ 66MHz- UDF- FastB2B- ParErr- DEVSEL=fast >TAbort- <TAbort- <MAbort- >SERR- <PERR- INTx-
	Capabilities: <access denied>

3f:0f.5 System peripheral [0880]: Intel Corporation Xeon E5/Core i7 Integrated Memory Controller Target Address Decoder 3 [8086:3cad] (rev 07)
	Subsystem: Intel Corporation Device [8086:0000]
	Control: I/O- Mem- BusMaster- SpecCycle- MemWINV- VGASnoop- ParErr- Stepping- SERR- FastB2B- DisINTx-
	Status: Cap+ 66MHz- UDF- FastB2B- ParErr- DEVSEL=fast >TAbort- <TAbort- <MAbort- >SERR- <PERR- INTx-
	Capabilities: <access denied>

3f:0f.6 System peripheral [0880]: Intel Corporation Xeon E5/Core i7 Integrated Memory Controller Target Address Decoder 4 [8086:3cae] (rev 07)
	Subsystem: Intel Corporation Device [8086:0000]
	Control: I/O- Mem- BusMaster- SpecCycle- MemWINV+ VGASnoop- ParErr- Stepping- SERR- FastB2B- DisINTx-
	Status: Cap- 66MHz- UDF- FastB2B- ParErr- DEVSEL=fast >TAbort- <TAbort- <MAbort- >SERR- <PERR- INTx-

3f:10.0 System peripheral [0880]: Intel Corporation Xeon E5/Core i7 Integrated Memory Controller Channel 0-3 Thermal Control 0 [8086:3cb0] (rev 07)
	Subsystem: Intel Corporation Device [8086:0000]
	Control: I/O- Mem- BusMaster- SpecCycle- MemWINV- VGASnoop- ParErr- Stepping- SERR- FastB2B- DisINTx-
	Status: Cap+ 66MHz- UDF- FastB2B- ParErr- DEVSEL=fast >TAbort- <TAbort- <MAbort- >SERR- <PERR- INTx-
	Capabilities: <access denied>
	Kernel driver in use: snbep_uncore

3f:10.1 System peripheral [0880]: Intel Corporation Xeon E5/Core i7 Integrated Memory Controller Channel 0-3 Thermal Control 1 [8086:3cb1] (rev 07)
	Subsystem: Intel Corporation Device [8086:0000]
	Control: I/O- Mem- BusMaster- SpecCycle- MemWINV- VGASnoop- ParErr- Stepping- SERR- FastB2B- DisINTx-
	Status: Cap+ 66MHz- UDF- FastB2B- ParErr- DEVSEL=fast >TAbort- <TAbort- <MAbort- >SERR- <PERR- INTx-
	Capabilities: <access denied>
	Kernel driver in use: snbep_uncore

3f:10.2 System peripheral [0880]: Intel Corporation Xeon E5/Core i7 Integrated Memory Controller ERROR Registers 0 [8086:3cb2] (rev 07)
	Subsystem: Intel Corporation Device [8086:0000]
	Control: I/O- Mem- BusMaster- SpecCycle- MemWINV- VGASnoop- ParErr- Stepping- SERR- FastB2B- DisINTx-
	Status: Cap+ 66MHz- UDF- FastB2B- ParErr- DEVSEL=fast >TAbort- <TAbort- <MAbort- >SERR- <PERR- INTx-
	Capabilities: <access denied>

3f:10.3 System peripheral [0880]: Intel Corporation Xeon E5/Core i7 Integrated Memory Controller ERROR Registers 1 [8086:3cb3] (rev 07)
	Subsystem: Intel Corporation Device [8086:0000]
	Control: I/O- Mem- BusMaster- SpecCycle- MemWINV- VGASnoop- ParErr- Stepping- SERR- FastB2B- DisINTx-
	Status: Cap+ 66MHz- UDF- FastB2B- ParErr- DEVSEL=fast >TAbort- <TAbort- <MAbort- >SERR- <PERR- INTx-
	Capabilities: <access denied>

3f:10.4 System peripheral [0880]: Intel Corporation Xeon E5/Core i7 Integrated Memory Controller Channel 0-3 Thermal Control 2 [8086:3cb4] (rev 07)
	Subsystem: Intel Corporation Device [8086:0000]
	Control: I/O- Mem- BusMaster- SpecCycle- MemWINV- VGASnoop- ParErr- Stepping- SERR- FastB2B- DisINTx-
	Status: Cap+ 66MHz- UDF- FastB2B- ParErr- DEVSEL=fast >TAbort- <TAbort- <MAbort- >SERR- <PERR- INTx-
	Capabilities: <access denied>
	Kernel driver in use: snbep_uncore

3f:10.5 System peripheral [0880]: Intel Corporation Xeon E5/Core i7 Integrated Memory Controller Channel 0-3 Thermal Control 3 [8086:3cb5] (rev 07)
	Subsystem: Intel Corporation Device [8086:0000]
	Control: I/O- Mem- BusMaster- SpecCycle- MemWINV- VGASnoop- ParErr- Stepping- SERR- FastB2B- DisINTx-
	Status: Cap+ 66MHz- UDF- FastB2B- ParErr- DEVSEL=fast >TAbort- <TAbort- <MAbort- >SERR- <PERR- INTx-
	Capabilities: <access denied>
	Kernel driver in use: snbep_uncore

3f:10.6 System peripheral [0880]: Intel Corporation Xeon E5/Core i7 Integrated Memory Controller ERROR Registers 2 [8086:3cb6] (rev 07)
	Subsystem: Intel Corporation Device [8086:0000]
	Control: I/O- Mem- BusMaster- SpecCycle- MemWINV- VGASnoop- ParErr- Stepping- SERR- FastB2B- DisINTx-
	Status: Cap+ 66MHz- UDF- FastB2B- ParErr- DEVSEL=fast >TAbort- <TAbort- <MAbort- >SERR- <PERR- INTx-
	Capabilities: <access denied>

3f:10.7 System peripheral [0880]: Intel Corporation Xeon E5/Core i7 Integrated Memory Controller ERROR Registers 3 [8086:3cb7] (rev 07)
	Subsystem: Intel Corporation Device [8086:0000]
	Control: I/O- Mem- BusMaster- SpecCycle- MemWINV- VGASnoop- ParErr- Stepping- SERR- FastB2B- DisINTx-
	Status: Cap+ 66MHz- UDF- FastB2B- ParErr- DEVSEL=fast >TAbort- <TAbort- <MAbort- >SERR- <PERR- INTx-
	Capabilities: <access denied>

3f:11.0 System peripheral [0880]: Intel Corporation Xeon E5/Core i7 DDRIO [8086:3cb8] (rev 07)
	Subsystem: Intel Corporation Device [8086:0000]
	Control: I/O- Mem- BusMaster- SpecCycle- MemWINV+ VGASnoop- ParErr- Stepping- SERR- FastB2B- DisINTx-
	Status: Cap- 66MHz- UDF- FastB2B- ParErr- DEVSEL=fast >TAbort- <TAbort- <MAbort- >SERR- <PERR- INTx-

3f:13.0 System peripheral [0880]: Intel Corporation Xeon E5/Core i7 R2PCIe [8086:3ce4] (rev 07)
	Subsystem: Intel Corporation Device [8086:0000]
	Control: I/O- Mem- BusMaster- SpecCycle- MemWINV- VGASnoop- ParErr- Stepping- SERR- FastB2B- DisINTx-
	Status: Cap- 66MHz- UDF- FastB2B- ParErr- DEVSEL=fast >TAbort- <TAbort- <MAbort- >SERR- <PERR- INTx-

3f:13.1 Performance counters [1101]: Intel Corporation Xeon E5/Core i7 Ring to PCI Express Performance Monitor [8086:3c43] (rev 07)
	Subsystem: Intel Corporation Device [8086:0000]
	Control: I/O- Mem- BusMaster- SpecCycle- MemWINV- VGASnoop- ParErr- Stepping- SERR- FastB2B- DisINTx-
	Status: Cap- 66MHz- UDF- FastB2B- ParErr- DEVSEL=fast >TAbort- <TAbort- <MAbort- >SERR- <PERR- INTx-
	Kernel driver in use: snbep_uncore

3f:13.4 Performance counters [1101]: Intel Corporation Xeon E5/Core i7 QuickPath Interconnect Agent Ring Registers [8086:3ce6] (rev 07)
	Subsystem: Intel Corporation Device [8086:0000]
	Control: I/O- Mem- BusMaster- SpecCycle- MemWINV- VGASnoop- ParErr- Stepping- SERR- FastB2B- DisINTx-
	Status: Cap- 66MHz- UDF- FastB2B- ParErr- DEVSEL=fast >TAbort- <TAbort- <MAbort- >SERR- <PERR- INTx-

3f:13.5 Performance counters [1101]: Intel Corporation Xeon E5/Core i7 Ring to QuickPath Interconnect Link 0 Performance Monitor [8086:3c44] (rev 07)
	Subsystem: Intel Corporation Device [8086:0000]
	Control: I/O- Mem- BusMaster- SpecCycle- MemWINV- VGASnoop- ParErr- Stepping- SERR- FastB2B- DisINTx-
	Status: Cap- 66MHz- UDF- FastB2B- ParErr- DEVSEL=fast >TAbort- <TAbort- <MAbort- >SERR- <PERR- INTx-
	Kernel driver in use: snbep_uncore

3f:13.6 System peripheral [0880]: Intel Corporation Xeon E5/Core i7 Ring to QuickPath Interconnect Link 1 Performance Monitor [8086:3c45] (rev 07)
	Subsystem: Intel Corporation Device [8086:0000]
	Control: I/O- Mem- BusMaster- SpecCycle- MemWINV- VGASnoop- ParErr- Stepping- SERR- FastB2B- DisINTx-
	Status: Cap- 66MHz- UDF- FastB2B- ParErr- DEVSEL=fast >TAbort- <TAbort- <MAbort- >SERR- <PERR- INTx-
	Kernel driver in use: snbep_uncore

40:05.0 System peripheral [0880]: Intel Corporation Xeon E5/Core i7 Address Map, VTd_Misc, System Management [8086:3c28] (rev 07)
	Subsystem: Hewlett-Packard Company Device [103c:158a]
	Control: I/O- Mem- BusMaster- SpecCycle- MemWINV- VGASnoop- ParErr- Stepping- SERR- FastB2B- DisINTx-
	Status: Cap+ 66MHz- UDF- FastB2B- ParErr- DEVSEL=fast >TAbort- <TAbort- <MAbort- >SERR- <PERR- INTx-
	NUMA node: 1
	Capabilities: <access denied>

40:05.2 System peripheral [0880]: Intel Corporation Xeon E5/Core i7 Control Status and Global Errors [8086:3c2a] (rev 07)
	Subsystem: Hewlett-Packard Company Device [103c:158a]
	Control: I/O- Mem- BusMaster- SpecCycle- MemWINV- VGASnoop- ParErr- Stepping- SERR- FastB2B- DisINTx-
	Status: Cap+ 66MHz- UDF- FastB2B- ParErr- DEVSEL=fast >TAbort- <TAbort- <MAbort- >SERR- <PERR- INTx-
	NUMA node: 1
	Capabilities: <access denied>

40:05.4 PIC [0800]: Intel Corporation Xeon E5/Core i7 I/O APIC [8086:3c2c] (rev 07) (prog-if 20 [IO(X)-APIC])
	Subsystem: Intel Corporation Xeon E5/Core i7 I/O APIC [8086:3c2c]
	Control: I/O- Mem+ BusMaster+ SpecCycle- MemWINV- VGASnoop- ParErr- Stepping- SERR- FastB2B- DisINTx-
	Status: Cap+ 66MHz- UDF- FastB2B- ParErr- DEVSEL=fast >TAbort- <TAbort- <MAbort- >SERR- <PERR- INTx-
	Latency: 0, Cache Line Size: 64 bytes
	NUMA node: 1
	Region 0: Memory at fbf02000 (32-bit, non-prefetchable) [size=4K]
	Capabilities: <access denied>

7f:08.0 System peripheral [0880]: Intel Corporation Xeon E5/Core i7 QPI Link 0 [8086:3c80] (rev 07)
	Subsystem: Intel Corporation Device [8086:0000]
	Control: I/O- Mem- BusMaster- SpecCycle- MemWINV- VGASnoop- ParErr- Stepping- SERR- FastB2B- DisINTx-
	Status: Cap- 66MHz- UDF- FastB2B- ParErr- DEVSEL=fast >TAbort- <TAbort- <MAbort- >SERR- <PERR- INTx-

7f:08.3 System peripheral [0880]: Intel Corporation Xeon E5/Core i7 QPI Link Reut 0 [8086:3c83] (rev 07)
	Subsystem: Intel Corporation Device [8086:0000]
	Control: I/O- Mem- BusMaster- SpecCycle- MemWINV- VGASnoop- ParErr- Stepping- SERR- FastB2B- DisINTx-
	Status: Cap+ 66MHz- UDF- FastB2B- ParErr- DEVSEL=fast >TAbort- <TAbort- <MAbort- >SERR- <PERR- INTx-
	Capabilities: <access denied>

7f:08.4 System peripheral [0880]: Intel Corporation Xeon E5/Core i7 QPI Link Reut 0 [8086:3c84] (rev 07)
	Subsystem: Intel Corporation Device [8086:0000]
	Control: I/O- Mem- BusMaster- SpecCycle- MemWINV- VGASnoop- ParErr- Stepping- SERR- FastB2B- DisINTx-
	Status: Cap+ 66MHz- UDF- FastB2B- ParErr- DEVSEL=fast >TAbort- <TAbort- <MAbort- >SERR- <PERR- INTx-
	Capabilities: <access denied>

7f:09.0 System peripheral [0880]: Intel Corporation Xeon E5/Core i7 QPI Link 1 [8086:3c90] (rev 07)
	Subsystem: Intel Corporation Device [8086:0000]
	Control: I/O- Mem- BusMaster- SpecCycle- MemWINV- VGASnoop- ParErr- Stepping- SERR- FastB2B- DisINTx-
	Status: Cap- 66MHz- UDF- FastB2B- ParErr- DEVSEL=fast >TAbort- <TAbort- <MAbort- >SERR- <PERR- INTx-

7f:09.3 System peripheral [0880]: Intel Corporation Xeon E5/Core i7 QPI Link Reut 1 [8086:3c93] (rev 07)
	Subsystem: Intel Corporation Device [8086:0000]
	Control: I/O- Mem- BusMaster- SpecCycle- MemWINV- VGASnoop- ParErr- Stepping- SERR- FastB2B- DisINTx-
	Status: Cap+ 66MHz- UDF- FastB2B- ParErr- DEVSEL=fast >TAbort- <TAbort- <MAbort- >SERR- <PERR- INTx-
	Capabilities: <access denied>

7f:09.4 System peripheral [0880]: Intel Corporation Xeon E5/Core i7 QPI Link Reut 1 [8086:3c94] (rev 07)
	Subsystem: Intel Corporation Device [8086:0000]
	Control: I/O- Mem- BusMaster- SpecCycle- MemWINV- VGASnoop- ParErr- Stepping- SERR- FastB2B- DisINTx-
	Status: Cap+ 66MHz- UDF- FastB2B- ParErr- DEVSEL=fast >TAbort- <TAbort- <MAbort- >SERR- <PERR- INTx-
	Capabilities: <access denied>

7f:0a.0 System peripheral [0880]: Intel Corporation Xeon E5/Core i7 Power Control Unit 0 [8086:3cc0] (rev 07)
	Subsystem: Intel Corporation Device [8086:0000]
	Control: I/O- Mem- BusMaster- SpecCycle- MemWINV- VGASnoop- ParErr- Stepping- SERR- FastB2B- DisINTx-
	Status: Cap- 66MHz- UDF- FastB2B- ParErr- DEVSEL=fast >TAbort- <TAbort- <MAbort- >SERR- <PERR- INTx-

7f:0a.1 System peripheral [0880]: Intel Corporation Xeon E5/Core i7 Power Control Unit 1 [8086:3cc1] (rev 07)
	Subsystem: Intel Corporation Device [8086:0000]
	Control: I/O- Mem- BusMaster- SpecCycle- MemWINV- VGASnoop- ParErr- Stepping- SERR- FastB2B- DisINTx-
	Status: Cap- 66MHz- UDF- FastB2B- ParErr- DEVSEL=fast >TAbort- <TAbort- <MAbort- >SERR- <PERR- INTx-

7f:0a.2 System peripheral [0880]: Intel Corporation Xeon E5/Core i7 Power Control Unit 2 [8086:3cc2] (rev 07)
	Subsystem: Intel Corporation Device [8086:0000]
	Control: I/O- Mem- BusMaster- SpecCycle- MemWINV- VGASnoop- ParErr- Stepping- SERR- FastB2B- DisINTx-
	Status: Cap- 66MHz- UDF- FastB2B- ParErr- DEVSEL=fast >TAbort- <TAbort- <MAbort- >SERR- <PERR- INTx-

7f:0a.3 System peripheral [0880]: Intel Corporation Xeon E5/Core i7 Power Control Unit 3 [8086:3cd0] (rev 07)
	Subsystem: Intel Corporation Device [8086:0000]
	Control: I/O- Mem- BusMaster- SpecCycle- MemWINV- VGASnoop- ParErr- Stepping- SERR- FastB2B- DisINTx-
	Status: Cap- 66MHz- UDF- FastB2B- ParErr- DEVSEL=fast >TAbort- <TAbort- <MAbort- >SERR- <PERR- INTx-

7f:0b.0 System peripheral [0880]: Intel Corporation Xeon E5/Core i7 Interrupt Control Registers [8086:3ce0] (rev 07)
	Subsystem: Intel Corporation Device [8086:0000]
	Control: I/O- Mem- BusMaster- SpecCycle- MemWINV- VGASnoop- ParErr- Stepping- SERR- FastB2B- DisINTx-
	Status: Cap- 66MHz- UDF- FastB2B- ParErr- DEVSEL=fast >TAbort- <TAbort- <MAbort- >SERR- <PERR- INTx-

7f:0b.3 System peripheral [0880]: Intel Corporation Xeon E5/Core i7 Semaphore and Scratchpad Configuration Registers [8086:3ce3] (rev 07)
	Subsystem: Intel Corporation Device [8086:0000]
	Control: I/O- Mem- BusMaster- SpecCycle- MemWINV- VGASnoop- ParErr- Stepping- SERR- FastB2B- DisINTx-
	Status: Cap- 66MHz- UDF- FastB2B- ParErr- DEVSEL=fast >TAbort- <TAbort- <MAbort- >SERR- <PERR- INTx-

7f:0c.0 System peripheral [0880]: Intel Corporation Xeon E5/Core i7 Unicast Register 0 [8086:3ce8] (rev 07)
	Subsystem: Intel Corporation Device [8086:0000]
	Control: I/O- Mem- BusMaster- SpecCycle- MemWINV- VGASnoop- ParErr- Stepping- SERR- FastB2B- DisINTx-
	Status: Cap- 66MHz- UDF- FastB2B- ParErr- DEVSEL=fast >TAbort- <TAbort- <MAbort- >SERR- <PERR- INTx-

7f:0c.1 System peripheral [0880]: Intel Corporation Xeon E5/Core i7 Unicast Register 0 [8086:3ce8] (rev 07)
	Subsystem: Intel Corporation Device [8086:0000]
	Control: I/O- Mem- BusMaster- SpecCycle- MemWINV- VGASnoop- ParErr- Stepping- SERR- FastB2B- DisINTx-
	Status: Cap- 66MHz- UDF- FastB2B- ParErr- DEVSEL=fast >TAbort- <TAbort- <MAbort- >SERR- <PERR- INTx-

7f:0c.2 System peripheral [0880]: Intel Corporation Xeon E5/Core i7 Unicast Register 0 [8086:3ce8] (rev 07)
	Subsystem: Intel Corporation Device [8086:0000]
	Control: I/O- Mem- BusMaster- SpecCycle- MemWINV- VGASnoop- ParErr- Stepping- SERR- FastB2B- DisINTx-
	Status: Cap- 66MHz- UDF- FastB2B- ParErr- DEVSEL=fast >TAbort- <TAbort- <MAbort- >SERR- <PERR- INTx-

7f:0c.6 System peripheral [0880]: Intel Corporation Xeon E5/Core i7 Integrated Memory Controller System Address Decoder 0 [8086:3cf4] (rev 07)
	Subsystem: Intel Corporation Device [8086:0000]
	Control: I/O- Mem- BusMaster- SpecCycle- MemWINV- VGASnoop- ParErr- Stepping- SERR- FastB2B- DisINTx-
	Status: Cap- 66MHz- UDF- FastB2B- ParErr- DEVSEL=fast >TAbort- <TAbort- <MAbort- >SERR- <PERR- INTx-

7f:0c.7 System peripheral [0880]: Intel Corporation Xeon E5/Core i7 System Address Decoder [8086:3cf6] (rev 07)
	Subsystem: Intel Corporation Device [8086:0000]
	Control: I/O- Mem- BusMaster- SpecCycle- MemWINV- VGASnoop- ParErr- Stepping- SERR- FastB2B- DisINTx-
	Status: Cap- 66MHz- UDF- FastB2B- ParErr- DEVSEL=fast >TAbort- <TAbort- <MAbort- >SERR- <PERR- INTx-

7f:0d.0 System peripheral [0880]: Intel Corporation Xeon E5/Core i7 Unicast Register 0 [8086:3ce8] (rev 07)
	Subsystem: Intel Corporation Device [8086:0000]
	Control: I/O- Mem- BusMaster- SpecCycle- MemWINV- VGASnoop- ParErr- Stepping- SERR- FastB2B- DisINTx-
	Status: Cap- 66MHz- UDF- FastB2B- ParErr- DEVSEL=fast >TAbort- <TAbort- <MAbort- >SERR- <PERR- INTx-

7f:0d.1 System peripheral [0880]: Intel Corporation Xeon E5/Core i7 Unicast Register 0 [8086:3ce8] (rev 07)
	Subsystem: Intel Corporation Device [8086:0000]
	Control: I/O- Mem- BusMaster- SpecCycle- MemWINV- VGASnoop- ParErr- Stepping- SERR- FastB2B- DisINTx-
	Status: Cap- 66MHz- UDF- FastB2B- ParErr- DEVSEL=fast >TAbort- <TAbort- <MAbort- >SERR- <PERR- INTx-

7f:0d.2 System peripheral [0880]: Intel Corporation Xeon E5/Core i7 Unicast Register 0 [8086:3ce8] (rev 07)
	Subsystem: Intel Corporation Device [8086:0000]
	Control: I/O- Mem- BusMaster- SpecCycle- MemWINV- VGASnoop- ParErr- Stepping- SERR- FastB2B- DisINTx-
	Status: Cap- 66MHz- UDF- FastB2B- ParErr- DEVSEL=fast >TAbort- <TAbort- <MAbort- >SERR- <PERR- INTx-

7f:0d.6 System peripheral [0880]: Intel Corporation Xeon E5/Core i7 Integrated Memory Controller System Address Decoder 1 [8086:3cf5] (rev 07)
	Subsystem: Intel Corporation Device [8086:0000]
	Control: I/O- Mem- BusMaster- SpecCycle- MemWINV- VGASnoop- ParErr- Stepping- SERR- FastB2B- DisINTx-
	Status: Cap- 66MHz- UDF- FastB2B- ParErr- DEVSEL=fast >TAbort- <TAbort- <MAbort- >SERR- <PERR- INTx-

7f:0e.0 System peripheral [0880]: Intel Corporation Xeon E5/Core i7 Processor Home Agent [8086:3ca0] (rev 07)
	Control: I/O- Mem- BusMaster- SpecCycle- MemWINV- VGASnoop- ParErr- Stepping- SERR- FastB2B- DisINTx-
	Status: Cap- 66MHz- UDF- FastB2B- ParErr- DEVSEL=fast >TAbort- <TAbort- <MAbort- >SERR- <PERR- INTx-

7f:0e.1 Performance counters [1101]: Intel Corporation Xeon E5/Core i7 Processor Home Agent Performance Monitoring [8086:3c46] (rev 07)
	Control: I/O- Mem- BusMaster- SpecCycle- MemWINV- VGASnoop- ParErr- Stepping- SERR- FastB2B- DisINTx-
	Status: Cap- 66MHz- UDF- FastB2B- ParErr- DEVSEL=fast >TAbort- <TAbort- <MAbort- >SERR- <PERR- INTx-
	Kernel driver in use: snbep_uncore

7f:0f.0 System peripheral [0880]: Intel Corporation Xeon E5/Core i7 Integrated Memory Controller Registers [8086:3ca8] (rev 07)
	Subsystem: Intel Corporation Device [8086:0000]
	Control: I/O- Mem- BusMaster- SpecCycle- MemWINV- VGASnoop- ParErr- Stepping- SERR- FastB2B- DisINTx-
	Status: Cap+ 66MHz- UDF- FastB2B- ParErr- DEVSEL=fast >TAbort- <TAbort- <MAbort- >SERR- <PERR- INTx-
	Capabilities: <access denied>

7f:0f.1 System peripheral [0880]: Intel Corporation Xeon E5/Core i7 Integrated Memory Controller RAS Registers [8086:3c71] (rev 07)
	Subsystem: Intel Corporation Device [8086:0000]
	Control: I/O- Mem- BusMaster- SpecCycle- MemWINV- VGASnoop- ParErr- Stepping- SERR- FastB2B- DisINTx-
	Status: Cap+ 66MHz- UDF- FastB2B- ParErr- DEVSEL=fast >TAbort- <TAbort- <MAbort- >SERR- <PERR- INTx-
	Capabilities: <access denied>

7f:0f.2 System peripheral [0880]: Intel Corporation Xeon E5/Core i7 Integrated Memory Controller Target Address Decoder 0 [8086:3caa] (rev 07)
	Subsystem: Intel Corporation Device [8086:0000]
	Control: I/O- Mem- BusMaster- SpecCycle- MemWINV- VGASnoop- ParErr- Stepping- SERR- FastB2B- DisINTx-
	Status: Cap+ 66MHz- UDF- FastB2B- ParErr- DEVSEL=fast >TAbort- <TAbort- <MAbort- >SERR- <PERR- INTx-
	Capabilities: <access denied>

7f:0f.3 System peripheral [0880]: Intel Corporation Xeon E5/Core i7 Integrated Memory Controller Target Address Decoder 1 [8086:3cab] (rev 07)
	Subsystem: Intel Corporation Device [8086:0000]
	Control: I/O- Mem- BusMaster- SpecCycle- MemWINV- VGASnoop- ParErr- Stepping- SERR- FastB2B- DisINTx-
	Status: Cap+ 66MHz- UDF- FastB2B- ParErr- DEVSEL=fast >TAbort- <TAbort- <MAbort- >SERR- <PERR- INTx-
	Capabilities: <access denied>

7f:0f.4 System peripheral [0880]: Intel Corporation Xeon E5/Core i7 Integrated Memory Controller Target Address Decoder 2 [8086:3cac] (rev 07)
	Subsystem: Intel Corporation Device [8086:0000]
	Control: I/O- Mem- BusMaster- SpecCycle- MemWINV- VGASnoop- ParErr- Stepping- SERR- FastB2B- DisINTx-
	Status: Cap+ 66MHz- UDF- FastB2B- ParErr- DEVSEL=fast >TAbort- <TAbort- <MAbort- >SERR- <PERR- INTx-
	Capabilities: <access denied>

7f:0f.5 System peripheral [0880]: Intel Corporation Xeon E5/Core i7 Integrated Memory Controller Target Address Decoder 3 [8086:3cad] (rev 07)
	Subsystem: Intel Corporation Device [8086:0000]
	Control: I/O- Mem- BusMaster- SpecCycle- MemWINV- VGASnoop- ParErr- Stepping- SERR- FastB2B- DisINTx-
	Status: Cap+ 66MHz- UDF- FastB2B- ParErr- DEVSEL=fast >TAbort- <TAbort- <MAbort- >SERR- <PERR- INTx-
	Capabilities: <access denied>

7f:0f.6 System peripheral [0880]: Intel Corporation Xeon E5/Core i7 Integrated Memory Controller Target Address Decoder 4 [8086:3cae] (rev 07)
	Subsystem: Intel Corporation Device [8086:0000]
	Control: I/O- Mem- BusMaster- SpecCycle- MemWINV+ VGASnoop- ParErr- Stepping- SERR- FastB2B- DisINTx-
	Status: Cap- 66MHz- UDF- FastB2B- ParErr- DEVSEL=fast >TAbort- <TAbort- <MAbort- >SERR- <PERR- INTx-

7f:10.0 System peripheral [0880]: Intel Corporation Xeon E5/Core i7 Integrated Memory Controller Channel 0-3 Thermal Control 0 [8086:3cb0] (rev 07)
	Subsystem: Intel Corporation Device [8086:0000]
	Control: I/O- Mem- BusMaster- SpecCycle- MemWINV- VGASnoop- ParErr- Stepping- SERR- FastB2B- DisINTx-
	Status: Cap+ 66MHz- UDF- FastB2B- ParErr- DEVSEL=fast >TAbort- <TAbort- <MAbort- >SERR- <PERR- INTx-
	Capabilities: <access denied>
	Kernel driver in use: snbep_uncore

7f:10.1 System peripheral [0880]: Intel Corporation Xeon E5/Core i7 Integrated Memory Controller Channel 0-3 Thermal Control 1 [8086:3cb1] (rev 07)
	Subsystem: Intel Corporation Device [8086:0000]
	Control: I/O- Mem- BusMaster- SpecCycle- MemWINV- VGASnoop- ParErr- Stepping- SERR- FastB2B- DisINTx-
	Status: Cap+ 66MHz- UDF- FastB2B- ParErr- DEVSEL=fast >TAbort- <TAbort- <MAbort- >SERR- <PERR- INTx-
	Capabilities: <access denied>
	Kernel driver in use: snbep_uncore

7f:10.2 System peripheral [0880]: Intel Corporation Xeon E5/Core i7 Integrated Memory Controller ERROR Registers 0 [8086:3cb2] (rev 07)
	Subsystem: Intel Corporation Device [8086:0000]
	Control: I/O- Mem- BusMaster- SpecCycle- MemWINV- VGASnoop- ParErr- Stepping- SERR- FastB2B- DisINTx-
	Status: Cap+ 66MHz- UDF- FastB2B- ParErr- DEVSEL=fast >TAbort- <TAbort- <MAbort- >SERR- <PERR- INTx-
	Capabilities: <access denied>

7f:10.3 System peripheral [0880]: Intel Corporation Xeon E5/Core i7 Integrated Memory Controller ERROR Registers 1 [8086:3cb3] (rev 07)
	Subsystem: Intel Corporation Device [8086:0000]
	Control: I/O- Mem- BusMaster- SpecCycle- MemWINV- VGASnoop- ParErr- Stepping- SERR- FastB2B- DisINTx-
	Status: Cap+ 66MHz- UDF- FastB2B- ParErr- DEVSEL=fast >TAbort- <TAbort- <MAbort- >SERR- <PERR- INTx-
	Capabilities: <access denied>

7f:10.4 System peripheral [0880]: Intel Corporation Xeon E5/Core i7 Integrated Memory Controller Channel 0-3 Thermal Control 2 [8086:3cb4] (rev 07)
	Subsystem: Intel Corporation Device [8086:0000]
	Control: I/O- Mem- BusMaster- SpecCycle- MemWINV- VGASnoop- ParErr- Stepping- SERR- FastB2B- DisINTx-
	Status: Cap+ 66MHz- UDF- FastB2B- ParErr- DEVSEL=fast >TAbort- <TAbort- <MAbort- >SERR- <PERR- INTx-
	Capabilities: <access denied>
	Kernel driver in use: snbep_uncore

7f:10.5 System peripheral [0880]: Intel Corporation Xeon E5/Core i7 Integrated Memory Controller Channel 0-3 Thermal Control 3 [8086:3cb5] (rev 07)
	Subsystem: Intel Corporation Device [8086:0000]
	Control: I/O- Mem- BusMaster- SpecCycle- MemWINV- VGASnoop- ParErr- Stepping- SERR- FastB2B- DisINTx-
	Status: Cap+ 66MHz- UDF- FastB2B- ParErr- DEVSEL=fast >TAbort- <TAbort- <MAbort- >SERR- <PERR- INTx-
	Capabilities: <access denied>
	Kernel driver in use: snbep_uncore

7f:10.6 System peripheral [0880]: Intel Corporation Xeon E5/Core i7 Integrated Memory Controller ERROR Registers 2 [8086:3cb6] (rev 07)
	Subsystem: Intel Corporation Device [8086:0000]
	Control: I/O- Mem- BusMaster- SpecCycle- MemWINV- VGASnoop- ParErr- Stepping- SERR- FastB2B- DisINTx-
	Status: Cap+ 66MHz- UDF- FastB2B- ParErr- DEVSEL=fast >TAbort- <TAbort- <MAbort- >SERR- <PERR- INTx-
	Capabilities: <access denied>

7f:10.7 System peripheral [0880]: Intel Corporation Xeon E5/Core i7 Integrated Memory Controller ERROR Registers 3 [8086:3cb7] (rev 07)
	Subsystem: Intel Corporation Device [8086:0000]
	Control: I/O- Mem- BusMaster- SpecCycle- MemWINV- VGASnoop- ParErr- Stepping- SERR- FastB2B- DisINTx-
	Status: Cap+ 66MHz- UDF- FastB2B- ParErr- DEVSEL=fast >TAbort- <TAbort- <MAbort- >SERR- <PERR- INTx-
	Capabilities: <access denied>

7f:11.0 System peripheral [0880]: Intel Corporation Xeon E5/Core i7 DDRIO [8086:3cb8] (rev 07)
	Subsystem: Intel Corporation Device [8086:0000]
	Control: I/O- Mem- BusMaster- SpecCycle- MemWINV+ VGASnoop- ParErr- Stepping- SERR- FastB2B- DisINTx-
	Status: Cap- 66MHz- UDF- FastB2B- ParErr- DEVSEL=fast >TAbort- <TAbort- <MAbort- >SERR- <PERR- INTx-

7f:13.0 System peripheral [0880]: Intel Corporation Xeon E5/Core i7 R2PCIe [8086:3ce4] (rev 07)
	Subsystem: Intel Corporation Device [8086:0000]
	Control: I/O- Mem- BusMaster- SpecCycle- MemWINV- VGASnoop- ParErr- Stepping- SERR- FastB2B- DisINTx-
	Status: Cap- 66MHz- UDF- FastB2B- ParErr- DEVSEL=fast >TAbort- <TAbort- <MAbort- >SERR- <PERR- INTx-

7f:13.1 Performance counters [1101]: Intel Corporation Xeon E5/Core i7 Ring to PCI Express Performance Monitor [8086:3c43] (rev 07)
	Subsystem: Intel Corporation Device [8086:0000]
	Control: I/O- Mem- BusMaster- SpecCycle- MemWINV- VGASnoop- ParErr- Stepping- SERR- FastB2B- DisINTx-
	Status: Cap- 66MHz- UDF- FastB2B- ParErr- DEVSEL=fast >TAbort- <TAbort- <MAbort- >SERR- <PERR- INTx-
	Kernel driver in use: snbep_uncore

7f:13.4 Performance counters [1101]: Intel Corporation Xeon E5/Core i7 QuickPath Interconnect Agent Ring Registers [8086:3ce6] (rev 07)
	Subsystem: Intel Corporation Device [8086:0000]
	Control: I/O- Mem- BusMaster- SpecCycle- MemWINV- VGASnoop- ParErr- Stepping- SERR- FastB2B- DisINTx-
	Status: Cap- 66MHz- UDF- FastB2B- ParErr- DEVSEL=fast >TAbort- <TAbort- <MAbort- >SERR- <PERR- INTx-

7f:13.5 Performance counters [1101]: Intel Corporation Xeon E5/Core i7 Ring to QuickPath Interconnect Link 0 Performance Monitor [8086:3c44] (rev 07)
	Subsystem: Intel Corporation Device [8086:0000]
	Control: I/O- Mem- BusMaster- SpecCycle- MemWINV- VGASnoop- ParErr- Stepping- SERR- FastB2B- DisINTx-
	Status: Cap- 66MHz- UDF- FastB2B- ParErr- DEVSEL=fast >TAbort- <TAbort- <MAbort- >SERR- <PERR- INTx-
	Kernel driver in use: snbep_uncore

7f:13.6 System peripheral [0880]: Intel Corporation Xeon E5/Core i7 Ring to QuickPath Interconnect Link 1 Performance Monitor [8086:3c45] (rev 07)
	Subsystem: Intel Corporation Device [8086:0000]
	Control: I/O- Mem- BusMaster- SpecCycle- MemWINV- VGASnoop- ParErr- Stepping- SERR- FastB2B- DisINTx-
	Status: Cap- 66MHz- UDF- FastB2B- ParErr- DEVSEL=fast >TAbort- <TAbort- <MAbort- >SERR- <PERR- INTx-
	Kernel driver in use: snbep_uncore

