00:00.0 RAM memory [0500]: NVIDIA Corporation C51 Host Bridge [10de:02f3] (rev a2)
	Subsystem: Acer Incorporated [ALI] Device [1025:0112]
	Control: I/O- Mem+ BusMaster+ SpecCycle- MemWINV- VGASnoop- ParErr- Stepping- SERR- FastB2B- DisINTx-
	Status: Cap+ 66MHz+ UDF- FastB2B+ ParErr- DEVSEL=fast >TAbort- <TAbort- <MAbort- >SERR- <PERR- INTx-
	Latency: 0
	NUMA node: 0
	Capabilities: [44] HyperTransport: Slave or Primary Interface
		Command: BaseUnitID=0 UnitCnt=15 MastHost- DefDir- DUL-
		Link Control 0: CFlE+ CST- CFE- <LkFail- Init+ EOC- TXO- <CRCErr=0 IsocEn- LSEn+ ExtCTL- 64b-
		Link Config 0: MLWI=16bit DwFcIn- MLWO=16bit DwFcOut- LWI=16bit DwFcInEn- LWO=16bit DwFcOutEn-
		Link Control 1: CFlE+ CST- CFE- <LkFail- Init+ EOC- TXO- <CRCErr=0 IsocEn- LSEn+ ExtCTL- 64b-
		Link Config 1: MLWI=16bit DwFcIn- MLWO=16bit DwFcOut- LWI=8bit DwFcInEn- LWO=8bit DwFcOutEn-
		Revision ID: 1.03
		Link Frequency 0: 800MHz
		Link Error 0: <Prot- <Ovfl- <EOC- CTLTm-
		Link Frequency Capability 0: 200MHz+ 300MHz+ 400MHz+ 500MHz+ 600MHz+ 800MHz+ 1.0GHz+ 1.2GHz- 1.4GHz- 1.6GHz- Vend-
		Feature Capability: IsocFC+ LDTSTOP+ CRCTM- ECTLT- 64bA- UIDRD-
		Link Frequency 1: 800MHz
		Link Error 1: <Prot- <Ovfl- <EOC- CTLTm-
		Link Frequency Capability 1: 200MHz+ 300MHz+ 400MHz+ 500MHz+ 600MHz+ 800MHz+ 1.0GHz+ 1.2GHz- 1.4GHz- 1.6GHz- Vend-
		Error Handling: PFlE+ OFlE+ PFE- OFE- EOCFE- RFE- CRCFE- SERRFE- CF- RE- PNFE- ONFE- EOCNFE- RNFE- CRCNFE- SERRNFE-
		Prefetchable memory behind bridge Upper: 00-00
		Bus Number: 00
	Capabilities: [e0] HyperTransport: MSI Mapping Enable+ Fixed-
		Mapping Address Base: 00000000fee00000

00:00.1 RAM memory [0500]: NVIDIA Corporation C51 Memory Controller 0 [10de:02fa] (rev a2)
	Subsystem: Acer Incorporated [ALI] Device [1025:0112]
	Control: I/O- Mem- BusMaster- SpecCycle- MemWINV- VGASnoop- ParErr- Stepping- SERR+ FastB2B- DisINTx-
	Status: Cap- 66MHz+ UDF- FastB2B- ParErr- DEVSEL=fast >TAbort- <TAbort- <MAbort- >SERR- <PERR- INTx-
	NUMA node: 0

00:00.2 RAM memory [0500]: NVIDIA Corporation C51 Memory Controller 1 [10de:02fe] (rev a2)
	Subsystem: Acer Incorporated [ALI] Device [1025:0112]
	Control: I/O- Mem- BusMaster- SpecCycle- MemWINV- VGASnoop- ParErr- Stepping- SERR- FastB2B- DisINTx-
	Status: Cap- 66MHz+ UDF- FastB2B- ParErr- DEVSEL=fast >TAbort- <TAbort- <MAbort- >SERR- <PERR- INTx-
	NUMA node: 0

00:00.3 RAM memory [0500]: NVIDIA Corporation C51 Memory Controller 5 [10de:02f8] (rev a2)
	Subsystem: Acer Incorporated [ALI] Device [1025:0112]
	Control: I/O- Mem- BusMaster- SpecCycle- MemWINV- VGASnoop- ParErr- Stepping- SERR- FastB2B- DisINTx-
	Status: Cap- 66MHz+ UDF- FastB2B+ ParErr- DEVSEL=fast >TAbort- <TAbort- <MAbort- >SERR- <PERR- INTx-
	NUMA node: 0

00:00.4 RAM memory [0500]: NVIDIA Corporation C51 Memory Controller 4 [10de:02f9] (rev a2)
	Subsystem: Acer Incorporated [ALI] Device [1025:0112]
	Control: I/O- Mem+ BusMaster+ SpecCycle- MemWINV- VGASnoop- ParErr- Stepping- SERR- FastB2B- DisINTx-
	Status: Cap- 66MHz+ UDF- FastB2B+ ParErr- DEVSEL=fast >TAbort- <TAbort- <MAbort- >SERR- <PERR- INTx-
	Latency: 0
	NUMA node: 0

00:00.5 RAM memory [0500]: NVIDIA Corporation C51 Host Bridge [10de:02ff] (rev a2)
	Subsystem: Acer Incorporated [ALI] Device [1025:0112]
	Control: I/O- Mem+ BusMaster+ SpecCycle- MemWINV- VGASnoop- ParErr- Stepping- SERR- FastB2B- DisINTx-
	Status: Cap+ 66MHz+ UDF- FastB2B+ ParErr- DEVSEL=fast >TAbort- <TAbort- <MAbort- >SERR- <PERR- INTx-
	Latency: 0
	NUMA node: 0
	Capabilities: [44] Null
	Capabilities: [fc] Null

00:00.6 RAM memory [0500]: NVIDIA Corporation C51 Memory Controller 3 [10de:027f] (rev a2)
	Subsystem: Acer Incorporated [ALI] Device [1025:0112]
	Control: I/O- Mem- BusMaster- SpecCycle- MemWINV- VGASnoop- ParErr- Stepping- SERR+ FastB2B- DisINTx-
	Status: Cap- 66MHz+ UDF- FastB2B- ParErr- DEVSEL=fast >TAbort- <TAbort- <MAbort- >SERR- <PERR- INTx-
	NUMA node: 0

00:00.7 RAM memory [0500]: NVIDIA Corporation C51 Memory Controller 2 [10de:027e] (rev a2)
	Subsystem: Acer Incorporated [ALI] Device [1025:0112]
	Control: I/O- Mem- BusMaster- SpecCycle- MemWINV- VGASnoop- ParErr- Stepping- SERR- FastB2B- DisINTx-
	Status: Cap- 66MHz+ UDF- FastB2B- ParErr- DEVSEL=fast >TAbort- <TAbort- <MAbort- >SERR- <PERR- INTx-
	NUMA node: 0

00:02.0 PCI bridge [0604]: NVIDIA Corporation C51 PCI Express Bridge [10de:02fc] (rev a1) (prog-if 00 [Normal decode])
	Control: I/O+ Mem+ BusMaster+ SpecCycle- MemWINV- VGASnoop- ParErr- Stepping- SERR- FastB2B- DisINTx+
	Status: Cap+ 66MHz- UDF- FastB2B- ParErr- DEVSEL=fast >TAbort- <TAbort- <MAbort- >SERR- <PERR- INTx-
	Latency: 0, Cache Line Size: 64 bytes
	Interrupt: pin ? routed to IRQ 24
	NUMA node: 0
	Bus: primary=00, secondary=01, subordinate=01, sec-latency=0
	I/O behind bridge: None
	Memory behind bridge: None
	Prefetchable memory behind bridge: None
	Secondary status: 66MHz- FastB2B- ParErr- DEVSEL=fast >TAbort- <TAbort- <MAbort- <SERR- <PERR-
	BridgeCtl: Parity- SERR+ NoISA+ VGA- VGA16- MAbort- >Reset- FastB2B-
		PriDiscTmr- SecDiscTmr- DiscTmrStat- DiscTmrSERREn-
	Capabilities: [40] Subsystem: NVIDIA Corporation Device [10de:0000]
	Capabilities: [48] Power Management version 2
		Flags: PMEClk- DSI- D1- D2- AuxCurrent=0mA PME(D0+,D1+,D2+,D3hot+,D3cold+)
		Status: D0 NoSoftRst- PME-Enable- DSel=0 DScale=0 PME-
	Capabilities: [50] MSI: Enable+ Count=1/2 Maskable- 64bit+
		Address: 0000000000000000  Data: 0000
	Capabilities: [60] HyperTransport: MSI Mapping Enable- Fixed-
		Mapping Address Base: 00000000fee00000
	Capabilities: [80] Express (v1) Root Port (Slot+), MSI 00
		DevCap:	MaxPayload 128 bytes, PhantFunc 0
			ExtTag- RBE-
		DevCtl:	CorrErr- NonFatalErr- FatalErr- UnsupReq-
			RlxdOrd+ ExtTag- PhantFunc- AuxPwr- NoSnoop+
			MaxPayload 128 bytes, MaxReadReq 512 bytes
		DevSta:	CorrErr- NonFatalErr- FatalErr- UnsupReq- AuxPwr- TransPend-
		LnkCap:	Port #2, Speed 2.5GT/s, Width x1, ASPM L0s L1, Exit Latency L0s <512ns, L1 <4us
			ClockPM- Surprise- LLActRep+ BwNot- ASPMOptComp-
		LnkCtl:	ASPM L0s L1 Enabled; RCB 64 bytes Disabled- CommClk-
			ExtSynch- ClockPM- AutWidDis- BWInt- AutBWInt-
		LnkSta:	Speed 2.5GT/s (ok), Width x1 (ok)
			TrErr- Train- SlotClk+ DLActive- BWMgmt- ABWMgmt-
		SltCap:	AttnBtn- PwrCtrl- MRL- AttnInd- PwrInd- HotPlug- Surprise-
			Slot #0, PowerLimit 0.000W; Interlock- NoCompl-
		SltCtl:	Enable: AttnBtn+ PwrFlt+ MRL- PresDet- CmdCplt- HPIrq+ LinkChg+
			Control: AttnInd Off, PwrInd On, Power- Interlock-
		SltSta:	Status: AttnBtn- PowerFlt- MRL- CmdCplt- PresDet+ Interlock-
			Changed: MRL- PresDet- LinkState-
		RootCtl: ErrCorrectable- ErrNon-Fatal- ErrFatal- PMEIntEna- CRSVisible-
		RootCap: CRSVisible-
		RootSta: PME ReqID 0000, PMEStatus- PMEPending-
	Capabilities: [100 v1] Virtual Channel
		Caps:	LPEVC=0 RefClk=100ns PATEntryBits=1
		Arb:	Fixed- WRR32- WRR64- WRR128-
		Ctrl:	ArbSelect=WRR32
		Status:	InProgress-
		VC0:	Caps:	PATOffset=00 MaxTimeSlots=1 RejSnoopTrans-
			Arb:	Fixed- WRR32- WRR64- WRR128- TWRR128- WRR256-
			Ctrl:	Enable+ ID=0 ArbSelect=Fixed TC/VC=ff
			Status:	NegoPending- InProgress-
	Kernel driver in use: pcieport

00:03.0 PCI bridge [0604]: NVIDIA Corporation C51 PCI Express Bridge [10de:02fd] (rev a1) (prog-if 00 [Normal decode])
	Control: I/O+ Mem+ BusMaster+ SpecCycle- MemWINV- VGASnoop- ParErr- Stepping- SERR- FastB2B- DisINTx+
	Status: Cap+ 66MHz- UDF- FastB2B- ParErr- DEVSEL=fast >TAbort- <TAbort- <MAbort- >SERR- <PERR- INTx-
	Latency: 0, Cache Line Size: 64 bytes
	Interrupt: pin ? routed to IRQ 25
	NUMA node: 0
	Bus: primary=00, secondary=02, subordinate=02, sec-latency=0
	I/O behind bridge: 00004000-00004fff [size=4K]
	Memory behind bridge: c4000000-c40fffff [size=1M]
	Prefetchable memory behind bridge: None
	Secondary status: 66MHz- FastB2B- ParErr- DEVSEL=fast >TAbort- <TAbort- <MAbort- <SERR- <PERR-
	BridgeCtl: Parity- SERR+ NoISA+ VGA- VGA16- MAbort- >Reset- FastB2B-
		PriDiscTmr- SecDiscTmr- DiscTmrStat- DiscTmrSERREn-
	Capabilities: [40] Subsystem: NVIDIA Corporation Device [10de:0000]
	Capabilities: [48] Power Management version 2
		Flags: PMEClk- DSI- D1- D2- AuxCurrent=0mA PME(D0+,D1+,D2+,D3hot+,D3cold+)
		Status: D0 NoSoftRst- PME-Enable- DSel=0 DScale=0 PME-
	Capabilities: [50] MSI: Enable+ Count=1/2 Maskable- 64bit+
		Address: 0000000000000000  Data: 0000
	Capabilities: [60] HyperTransport: MSI Mapping Enable- Fixed-
		Mapping Address Base: 00000000fee00000
	Capabilities: [80] Express (v1) Root Port (Slot+), MSI 00
		DevCap:	MaxPayload 128 bytes, PhantFunc 0
			ExtTag- RBE-
		DevCtl:	CorrErr- NonFatalErr- FatalErr- UnsupReq-
			RlxdOrd+ ExtTag- PhantFunc- AuxPwr- NoSnoop+
			MaxPayload 128 bytes, MaxReadReq 512 bytes
		DevSta:	CorrErr- NonFatalErr- FatalErr- UnsupReq- AuxPwr- TransPend-
		LnkCap:	Port #1, Speed 2.5GT/s, Width x1, ASPM L0s L1, Exit Latency L0s <512ns, L1 <4us
			ClockPM- Surprise- LLActRep+ BwNot- ASPMOptComp-
		LnkCtl:	ASPM L0s L1 Enabled; RCB 64 bytes Disabled- CommClk-
			ExtSynch- ClockPM- AutWidDis- BWInt- AutBWInt-
		LnkSta:	Speed 2.5GT/s (ok), Width x1 (ok)
			TrErr- Train- SlotClk+ DLActive- BWMgmt- ABWMgmt-
		SltCap:	AttnBtn- PwrCtrl- MRL- AttnInd- PwrInd- HotPlug- Surprise-
			Slot #0, PowerLimit 0.000W; Interlock- NoCompl-
		SltCtl:	Enable: AttnBtn+ PwrFlt+ MRL- PresDet- CmdCplt- HPIrq+ LinkChg+
			Control: AttnInd Off, PwrInd On, Power- Interlock-
		SltSta:	Status: AttnBtn- PowerFlt- MRL- CmdCplt- PresDet- Interlock-
			Changed: MRL- PresDet- LinkState-
		RootCtl: ErrCorrectable- ErrNon-Fatal- ErrFatal- PMEIntEna- CRSVisible-
		RootCap: CRSVisible-
		RootSta: PME ReqID 0000, PMEStatus- PMEPending-
	Capabilities: [100 v1] Virtual Channel
		Caps:	LPEVC=0 RefClk=100ns PATEntryBits=1
		Arb:	Fixed- WRR32- WRR64- WRR128-
		Ctrl:	ArbSelect=WRR32
		Status:	InProgress-
		VC0:	Caps:	PATOffset=00 MaxTimeSlots=1 RejSnoopTrans-
			Arb:	Fixed- WRR32- WRR64- WRR128- TWRR128- WRR256-
			Ctrl:	Enable+ ID=0 ArbSelect=Fixed TC/VC=ff
			Status:	NegoPending- InProgress-
	Kernel driver in use: pcieport

00:04.0 PCI bridge [0604]: NVIDIA Corporation C51 PCI Express Bridge [10de:02fb] (rev a1) (prog-if 00 [Normal decode])
	Control: I/O+ Mem+ BusMaster+ SpecCycle- MemWINV- VGASnoop- ParErr- Stepping- SERR- FastB2B- DisINTx+
	Status: Cap+ 66MHz- UDF- FastB2B- ParErr- DEVSEL=fast >TAbort- <TAbort- <MAbort- >SERR- <PERR- INTx-
	Latency: 0, Cache Line Size: 64 bytes
	Interrupt: pin ? routed to IRQ 26
	NUMA node: 0
	Bus: primary=00, secondary=03, subordinate=03, sec-latency=0
	I/O behind bridge: None
	Memory behind bridge: None
	Prefetchable memory behind bridge: None
	Secondary status: 66MHz- FastB2B- ParErr- DEVSEL=fast >TAbort- <TAbort- <MAbort- <SERR- <PERR-
	BridgeCtl: Parity- SERR+ NoISA+ VGA- VGA16- MAbort- >Reset- FastB2B-
		PriDiscTmr- SecDiscTmr- DiscTmrStat- DiscTmrSERREn-
	Capabilities: [40] Subsystem: NVIDIA Corporation Device [10de:0000]
	Capabilities: [48] Power Management version 2
		Flags: PMEClk- DSI- D1- D2- AuxCurrent=0mA PME(D0+,D1+,D2+,D3hot+,D3cold+)
		Status: D0 NoSoftRst- PME-Enable- DSel=0 DScale=0 PME-
	Capabilities: [50] MSI: Enable+ Count=1/2 Maskable- 64bit+
		Address: 0000000000000000  Data: 0000
	Capabilities: [60] HyperTransport: MSI Mapping Enable- Fixed-
		Mapping Address Base: 00000000fee00000
	Capabilities: [80] Express (v1) Root Port (Slot+), MSI 00
		DevCap:	MaxPayload 128 bytes, PhantFunc 0
			ExtTag- RBE-
		DevCtl:	CorrErr- NonFatalErr- FatalErr- UnsupReq-
			RlxdOrd+ ExtTag- PhantFunc- AuxPwr- NoSnoop+
			MaxPayload 128 bytes, MaxReadReq 512 bytes
		DevSta:	CorrErr- NonFatalErr- FatalErr- UnsupReq- AuxPwr- TransPend-
		LnkCap:	Port #0, Speed 2.5GT/s, Width x16, ASPM L0s L1, Exit Latency L0s <512ns, L1 <4us
			ClockPM- Surprise- LLActRep+ BwNot- ASPMOptComp-
		LnkCtl:	ASPM L0s L1 Enabled; RCB 64 bytes Disabled- CommClk-
			ExtSynch- ClockPM- AutWidDis- BWInt- AutBWInt-
		LnkSta:	Speed 2.5GT/s (ok), Width x16 (ok)
			TrErr- Train- SlotClk+ DLActive- BWMgmt- ABWMgmt-
		SltCap:	AttnBtn- PwrCtrl- MRL- AttnInd- PwrInd- HotPlug- Surprise-
			Slot #0, PowerLimit 0.000W; Interlock- NoCompl-
		SltCtl:	Enable: AttnBtn- PwrFlt- MRL- PresDet- CmdCplt- HPIrq- LinkChg-
			Control: AttnInd Off, PwrInd On, Power- Interlock-
		SltSta:	Status: AttnBtn- PowerFlt- MRL- CmdCplt- PresDet- Interlock-
			Changed: MRL- PresDet- LinkState+
		RootCtl: ErrCorrectable- ErrNon-Fatal- ErrFatal- PMEIntEna- CRSVisible-
		RootCap: CRSVisible-
		RootSta: PME ReqID 0000, PMEStatus- PMEPending-
	Capabilities: [100 v1] Virtual Channel
		Caps:	LPEVC=0 RefClk=100ns PATEntryBits=1
		Arb:	Fixed- WRR32- WRR64- WRR128-
		Ctrl:	ArbSelect=WRR32
		Status:	InProgress-
		VC0:	Caps:	PATOffset=00 MaxTimeSlots=1 RejSnoopTrans-
			Arb:	Fixed- WRR32- WRR64- WRR128- TWRR128- WRR256-
			Ctrl:	Enable+ ID=0 ArbSelect=Fixed TC/VC=ff
			Status:	NegoPending- InProgress-
	Kernel driver in use: pcieport

00:05.0 VGA compatible controller [0300]: NVIDIA Corporation C51 [GeForce Go 6100] [10de:0247] (rev a2) (prog-if 00 [VGA controller])
	Subsystem: Acer Incorporated [ALI] Device [1025:0112]
	Control: I/O+ Mem+ BusMaster+ SpecCycle- MemWINV- VGASnoop- ParErr- Stepping- SERR- FastB2B- DisINTx-
	Status: Cap+ 66MHz+ UDF- FastB2B+ ParErr- DEVSEL=fast >TAbort- <TAbort- <MAbort- >SERR- <PERR- INTx-
	Latency: 0
	Interrupt: pin A routed to IRQ 18
	NUMA node: 0
	Region 0: Memory at c2000000 (32-bit, non-prefetchable) [size=16M]
	Region 1: Memory at d0000000 (64-bit, prefetchable) [size=256M]
	Region 3: Memory at c1000000 (64-bit, non-prefetchable) [size=16M]
	[virtual] Expansion ROM at 000c0000 [disabled] [size=128K]
	Capabilities: [48] Power Management version 2
		Flags: PMEClk- DSI- D1- D2- AuxCurrent=0mA PME(D0-,D1-,D2-,D3hot-,D3cold-)
		Status: D0 NoSoftRst- PME-Enable- DSel=0 DScale=0 PME-
	Capabilities: [50] MSI: Enable- Count=1/1 Maskable- 64bit+
		Address: 0000000000000000  Data: 0000
	Kernel driver in use: nouveau
	Kernel modules: nvidiafb, nouveau

00:09.0 RAM memory [0500]: NVIDIA Corporation MCP51 Host Bridge [10de:0270] (rev a2)
	Subsystem: Acer Incorporated [ALI] Device [1025:0112]
	Control: I/O- Mem+ BusMaster+ SpecCycle- MemWINV- VGASnoop- ParErr- Stepping- SERR- FastB2B- DisINTx-
	Status: Cap+ 66MHz+ UDF- FastB2B+ ParErr- DEVSEL=fast >TAbort- <TAbort- <MAbort- >SERR- <PERR- INTx-
	Latency: 0
	NUMA node: 0
	Capabilities: [44] HyperTransport: Slave or Primary Interface
		Command: BaseUnitID=9 UnitCnt=15 MastHost- DefDir- DUL-
		Link Control 0: CFlE+ CST- CFE- <LkFail- Init+ EOC- TXO- <CRCErr=0 IsocEn- LSEn+ ExtCTL- 64b-
		Link Config 0: MLWI=8bit DwFcIn- MLWO=8bit DwFcOut- LWI=8bit DwFcInEn- LWO=8bit DwFcOutEn-
		Link Control 1: CFlE- CST- CFE- <LkFail+ Init- EOC+ TXO+ <CRCErr=0 IsocEn- LSEn- ExtCTL- 64b-
		Link Config 1: MLWI=8bit DwFcIn- MLWO=8bit DwFcOut- LWI=8bit DwFcInEn- LWO=8bit DwFcOutEn-
		Revision ID: 1.03
		Link Frequency 0: 800MHz
		Link Error 0: <Prot- <Ovfl- <EOC- CTLTm-
		Link Frequency Capability 0: 200MHz+ 300MHz+ 400MHz+ 500MHz+ 600MHz+ 800MHz+ 1.0GHz+ 1.2GHz- 1.4GHz- 1.6GHz- Vend-
		Feature Capability: IsocFC+ LDTSTOP+ CRCTM- ECTLT- 64bA- UIDRD-
		Link Frequency 1: 200MHz
		Link Error 1: <Prot- <Ovfl- <EOC- CTLTm-
		Link Frequency Capability 1: 200MHz- 300MHz- 400MHz- 500MHz- 600MHz- 800MHz- 1.0GHz- 1.2GHz- 1.4GHz- 1.6GHz- Vend-
		Error Handling: PFlE+ OFlE+ PFE- OFE- EOCFE- RFE- CRCFE- SERRFE- CF- RE- PNFE- ONFE- EOCNFE- RNFE- CRCNFE- SERRNFE-
		Prefetchable memory behind bridge Upper: 00-00
		Bus Number: 00
	Capabilities: [e0] HyperTransport: MSI Mapping Enable+ Fixed-
		Mapping Address Base: 00000000fee00000

00:0a.0 ISA bridge [0601]: NVIDIA Corporation MCP51 LPC Bridge [10de:0260] (rev a3)
	Subsystem: Acer Incorporated [ALI] Device [1025:0112]
	Control: I/O+ Mem+ BusMaster+ SpecCycle+ MemWINV- VGASnoop- ParErr- Stepping- SERR- FastB2B- DisINTx-
	Status: Cap- 66MHz+ UDF- FastB2B+ ParErr- DEVSEL=fast >TAbort- <TAbort- <MAbort- >SERR- <PERR- INTx-
	Latency: 0
	NUMA node: 0

00:0a.1 SMBus [0c05]: NVIDIA Corporation MCP51 SMBus [10de:0264] (rev a3)
	Subsystem: Acer Incorporated [ALI] Device [1025:0112]
	Control: I/O+ Mem- BusMaster- SpecCycle- MemWINV- VGASnoop- ParErr- Stepping- SERR- FastB2B- DisINTx-
	Status: Cap+ 66MHz+ UDF- FastB2B+ ParErr- DEVSEL=fast >TAbort- <TAbort- <MAbort- >SERR- <PERR- INTx-
	Interrupt: pin A routed to IRQ 10
	NUMA node: 0
	Region 4: I/O ports at 3040 [size=64]
	Region 5: I/O ports at 3000 [size=64]
	Capabilities: [44] Power Management version 2
		Flags: PMEClk- DSI- D1- D2- AuxCurrent=0mA PME(D0-,D1-,D2-,D3hot+,D3cold+)
		Status: D0 NoSoftRst- PME-Enable- DSel=0 DScale=0 PME-
	Kernel driver in use: nForce2_smbus
	Kernel modules: i2c_nforce2, nv_tco

00:0a.3 Co-processor [0b40]: NVIDIA Corporation MCP51 PMU [10de:0271] (rev a3)
	Subsystem: Acer Incorporated [ALI] Device [1025:0112]
	Control: I/O- Mem+ BusMaster+ SpecCycle- MemWINV- VGASnoop- ParErr- Stepping- SERR- FastB2B- DisINTx-
	Status: Cap- 66MHz+ UDF- FastB2B+ ParErr- DEVSEL=fast >TAbort- <TAbort- <MAbort- >SERR- <PERR- INTx-
	Latency: 0 (750ns min, 250ns max)
	Interrupt: pin B routed to IRQ 11
	NUMA node: 0
	Region 0: Memory at c0040000 (32-bit, non-prefetchable) [size=256K]

00:0b.0 USB controller [0c03]: NVIDIA Corporation MCP51 USB Controller [10de:026d] (rev a3) (prog-if 10 [OHCI])
	Subsystem: Acer Incorporated [ALI] Device [1025:0112]
	Control: I/O+ Mem+ BusMaster+ SpecCycle- MemWINV- VGASnoop- ParErr- Stepping- SERR- FastB2B- DisINTx-
	Status: Cap+ 66MHz+ UDF- FastB2B+ ParErr- DEVSEL=fast >TAbort- <TAbort- <MAbort- >SERR- <PERR- INTx-
	Latency: 0 (750ns min, 250ns max)
	Interrupt: pin A routed to IRQ 23
	NUMA node: 0
	Region 0: Memory at c0004000 (32-bit, non-prefetchable) [size=4K]
	Capabilities: [44] Power Management version 2
		Flags: PMEClk- DSI- D1+ D2+ AuxCurrent=0mA PME(D0+,D1+,D2+,D3hot+,D3cold+)
		Status: D0 NoSoftRst- PME-Enable- DSel=0 DScale=0 PME-
	Kernel driver in use: ohci-pci

00:0b.1 USB controller [0c03]: NVIDIA Corporation MCP51 USB Controller [10de:026e] (rev a3) (prog-if 20 [EHCI])
	Subsystem: Acer Incorporated [ALI] Device [1025:0112]
	Control: I/O- Mem+ BusMaster+ SpecCycle- MemWINV- VGASnoop- ParErr- Stepping- SERR- FastB2B- DisINTx-
	Status: Cap+ 66MHz+ UDF- FastB2B+ ParErr- DEVSEL=fast >TAbort- <TAbort- <MAbort- >SERR- <PERR- INTx-
	Latency: 0 (750ns min, 250ns max)
	Interrupt: pin B routed to IRQ 22
	NUMA node: 0
	Region 0: Memory at c0005000 (32-bit, non-prefetchable) [size=256]
	Capabilities: [44] Debug port: BAR=1 offset=0098
	Capabilities: [80] Power Management version 2
		Flags: PMEClk- DSI- D1+ D2+ AuxCurrent=0mA PME(D0+,D1+,D2+,D3hot+,D3cold+)
		Status: D0 NoSoftRst- PME-Enable- DSel=0 DScale=0 PME-
	Kernel driver in use: ehci-pci

00:0d.0 IDE interface [0101]: NVIDIA Corporation MCP51 IDE [10de:0265] (rev f1) (prog-if 8a [ISA Compatibility mode controller, supports both channels switched to PCI native mode, supports bus mastering])
	Subsystem: Acer Incorporated [ALI] Device [1025:0112]
	Control: I/O+ Mem- BusMaster+ SpecCycle- MemWINV- VGASnoop- ParErr- Stepping- SERR- FastB2B- DisINTx-
	Status: Cap+ 66MHz+ UDF- FastB2B+ ParErr- DEVSEL=fast >TAbort- <TAbort- <MAbort- >SERR- <PERR- INTx-
	Latency: 0 (750ns min, 250ns max)
	NUMA node: 0
	Region 0: [virtual] Memory at 000001f0 (32-bit, non-prefetchable) [size=8]
	Region 1: [virtual] Memory at 000003f0 (type 3, non-prefetchable)
	Region 2: [virtual] Memory at 00000170 (32-bit, non-prefetchable) [size=8]
	Region 3: [virtual] Memory at 00000370 (type 3, non-prefetchable)
	Region 4: I/O ports at 3080 [size=16]
	Capabilities: [44] Power Management version 2
		Flags: PMEClk- DSI- D1- D2- AuxCurrent=0mA PME(D0-,D1-,D2-,D3hot-,D3cold-)
		Status: D0 NoSoftRst- PME-Enable- DSel=0 DScale=0 PME-
	Kernel driver in use: pata_amd
	Kernel modules: pata_amd, pata_acpi

00:0e.0 IDE interface [0101]: NVIDIA Corporation MCP51 Serial ATA Controller [10de:0266] (rev f1) (prog-if 85 [PCI native mode-only controller, supports bus mastering])
	Subsystem: Acer Incorporated [ALI] Device [1025:0112]
	Control: I/O+ Mem+ BusMaster+ SpecCycle- MemWINV- VGASnoop- ParErr- Stepping- SERR- FastB2B- DisINTx-
	Status: Cap+ 66MHz+ UDF- FastB2B+ ParErr- DEVSEL=fast >TAbort- <TAbort- <MAbort- >SERR- <PERR- INTx-
	Latency: 0 (750ns min, 250ns max)
	Interrupt: pin A routed to IRQ 21
	NUMA node: 0
	Region 0: I/O ports at 30b0 [size=8]
	Region 1: I/O ports at 30a4 [size=4]
	Region 2: I/O ports at 30a8 [size=8]
	Region 3: I/O ports at 30a0 [size=4]
	Region 4: I/O ports at 3090 [size=16]
	Region 5: Memory at c0006000 (32-bit, non-prefetchable) [size=4K]
	Capabilities: [44] Power Management version 2
		Flags: PMEClk- DSI- D1- D2- AuxCurrent=0mA PME(D0-,D1-,D2-,D3hot-,D3cold-)
		Status: D0 NoSoftRst- PME-Enable- DSel=0 DScale=0 PME-
	Capabilities: [b0] MSI: Enable- Count=1/4 Maskable- 64bit+
		Address: 0000000000000000  Data: 0000
	Capabilities: [cc] HyperTransport: MSI Mapping Enable- Fixed+
	Kernel driver in use: sata_nv
	Kernel modules: sata_nv, pata_acpi

00:10.0 PCI bridge [0604]: NVIDIA Corporation MCP51 PCI Bridge [10de:026f] (rev a2) (prog-if 01 [Subtractive decode])
	Control: I/O+ Mem+ BusMaster+ SpecCycle- MemWINV- VGASnoop- ParErr- Stepping- SERR- FastB2B- DisINTx-
	Status: Cap+ 66MHz+ UDF- FastB2B+ ParErr- DEVSEL=fast >TAbort- <TAbort- <MAbort- >SERR- <PERR- INTx-
	Latency: 0
	NUMA node: 0
	Bus: primary=00, secondary=04, subordinate=05, sec-latency=64
	I/O behind bridge: 00005000-00005fff [size=4K]
	Memory behind bridge: c3000000-c30fffff [size=1M]
	Prefetchable memory behind bridge: 60000000-67ffffff [size=128M]
	Secondary status: 66MHz- FastB2B+ ParErr- DEVSEL=medium >TAbort- <TAbort- <MAbort- <SERR- <PERR-
	BridgeCtl: Parity- SERR+ NoISA+ VGA- VGA16- MAbort- >Reset- FastB2B-
		PriDiscTmr- SecDiscTmr+ DiscTmrStat- DiscTmrSERREn-
	Capabilities: [b8] Subsystem: Device [0000:0000]
	Capabilities: [8c] HyperTransport: MSI Mapping Enable- Fixed-
		Mapping Address Base: 00000000fee00000

00:10.1 Audio device [0403]: NVIDIA Corporation MCP51 High Definition Audio [10de:026c] (rev a2)
	Subsystem: Acer Incorporated [ALI] Device [1025:0112]
	Control: I/O- Mem+ BusMaster+ SpecCycle- MemWINV- VGASnoop- ParErr- Stepping- SERR- FastB2B- DisINTx-
	Status: Cap+ 66MHz+ UDF- FastB2B+ ParErr- DEVSEL=fast >TAbort- <TAbort- <MAbort- >SERR- <PERR- INTx-
	Latency: 0 (500ns min, 1250ns max)
	Interrupt: pin B routed to IRQ 17
	NUMA node: 0
	Region 0: Memory at c0000000 (32-bit, non-prefetchable) [size=16K]
	Capabilities: [44] Power Management version 2
		Flags: PMEClk- DSI- D1- D2- AuxCurrent=0mA PME(D0-,D1-,D2-,D3hot+,D3cold+)
		Status: D0 NoSoftRst- PME-Enable- DSel=0 DScale=0 PME-
	Capabilities: [50] MSI: Enable- Count=1/1 Maskable+ 64bit+
		Address: 0000000000000000  Data: 0000
		Masking: 00000000  Pending: 00000000
	Capabilities: [6c] HyperTransport: MSI Mapping Enable- Fixed+
	Kernel driver in use: snd_hda_intel
	Kernel modules: snd_hda_intel

00:14.0 Bridge [0680]: NVIDIA Corporation MCP51 Ethernet Controller [10de:0269] (rev a3)
	Subsystem: Acer Incorporated [ALI] Device [1025:0112]
	Control: I/O+ Mem+ BusMaster+ SpecCycle- MemWINV- VGASnoop- ParErr- Stepping- SERR- FastB2B- DisINTx-
	Status: Cap+ 66MHz+ UDF- FastB2B+ ParErr- DEVSEL=fast >TAbort- <TAbort- <MAbort- >SERR- <PERR- INTx-
	Latency: 0 (250ns min, 5000ns max)
	Interrupt: pin A routed to IRQ 20
	NUMA node: 0
	Region 0: Memory at c0007000 (32-bit, non-prefetchable) [size=4K]
	Region 1: I/O ports at 30b8 [size=8]
	Capabilities: [44] Power Management version 2
		Flags: PMEClk- DSI- D1+ D2+ AuxCurrent=0mA PME(D0+,D1+,D2+,D3hot+,D3cold+)
		Status: D0 NoSoftRst- PME-Enable+ DSel=0 DScale=0 PME-
	Kernel driver in use: forcedeth
	Kernel modules: forcedeth

00:18.0 Host bridge [0600]: Advanced Micro Devices, Inc. [AMD] K8 [Athlon64/Opteron] HyperTransport Technology Configuration [1022:1100]
	Control: I/O- Mem- BusMaster- SpecCycle- MemWINV- VGASnoop- ParErr- Stepping- SERR- FastB2B- DisINTx-
	Status: Cap+ 66MHz- UDF- FastB2B- ParErr- DEVSEL=fast >TAbort- <TAbort- <MAbort- >SERR- <PERR- INTx-
	NUMA node: 0
	Capabilities: [80] HyperTransport: Host or Secondary Interface
		Command: WarmRst+ DblEnd- DevNum=0 ChainSide- HostHide+ Slave- <EOCErr- DUL-
		Link Control: CFlE- CST- CFE- <LkFail- Init+ EOC- TXO- <CRCErr=8 IsocEn- LSEn+ ExtCTL- 64b+
		Link Config: MLWI=16bit DwFcIn- MLWO=16bit DwFcOut- LWI=16bit DwFcInEn- LWO=16bit DwFcOutEn-
		Revision ID: 1.02
		Link Frequency: 800MHz
		Link Error: <Prot- <Ovfl- <EOC- CTLTm-
		Link Frequency Capability: 200MHz+ 300MHz- 400MHz+ 500MHz- 600MHz+ 800MHz+ 1.0GHz- 1.2GHz- 1.4GHz- 1.6GHz- Vend-
		Feature Capability: IsocFC- LDTSTOP+ CRCTM- ECTLT- 64bA- UIDRD- ExtRS- UCnfE-

00:18.1 Host bridge [0600]: Advanced Micro Devices, Inc. [AMD] K8 [Athlon64/Opteron] Address Map [1022:1101]
	Control: I/O- Mem- BusMaster- SpecCycle- MemWINV- VGASnoop- ParErr- Stepping- SERR- FastB2B- DisINTx-
	Status: Cap- 66MHz- UDF- FastB2B- ParErr- DEVSEL=fast >TAbort- <TAbort- <MAbort- >SERR- <PERR- INTx-
	NUMA node: 0

00:18.2 Host bridge [0600]: Advanced Micro Devices, Inc. [AMD] K8 [Athlon64/Opteron] DRAM Controller [1022:1102]
	Control: I/O- Mem- BusMaster- SpecCycle- MemWINV- VGASnoop- ParErr- Stepping- SERR- FastB2B- DisINTx-
	Status: Cap- 66MHz- UDF- FastB2B- ParErr- DEVSEL=fast >TAbort- <TAbort- <MAbort- >SERR- <PERR- INTx-
	NUMA node: 0

00:18.3 Host bridge [0600]: Advanced Micro Devices, Inc. [AMD] K8 [Athlon64/Opteron] Miscellaneous Control [1022:1103]
	Control: I/O- Mem- BusMaster- SpecCycle- MemWINV- VGASnoop- ParErr- Stepping- SERR- FastB2B- DisINTx-
	Status: Cap- 66MHz- UDF- FastB2B- ParErr- DEVSEL=fast >TAbort- <TAbort- <MAbort- >SERR- <PERR- INTx-
	NUMA node: 0
	Kernel driver in use: k8temp
	Kernel modules: k8temp

04:05.0 Network controller [0280]: Broadcom Inc. and subsidiaries BCM4318 [AirForce One 54g] 802.11g Wireless LAN Controller [14e4:4318] (rev 02)
	Subsystem: AMBIT Microsystem Corp. TravelMate 2410 [1468:0312]
	Control: I/O- Mem+ BusMaster+ SpecCycle- MemWINV- VGASnoop- ParErr- Stepping- SERR- FastB2B- DisINTx-
	Status: Cap- 66MHz- UDF- FastB2B- ParErr- DEVSEL=fast >TAbort- <TAbort- <MAbort- >SERR- <PERR- INTx-
	Latency: 64
	Interrupt: pin A routed to IRQ 19
	NUMA node: 0
	Region 0: Memory at c3000000 (32-bit, non-prefetchable) [size=8K]
	Kernel driver in use: b43-pci-bridge
	Kernel modules: ssb

04:06.0 CardBus bridge [0607]: Texas Instruments PCIxx12 Cardbus Controller [104c:8039]
	Subsystem: Acer Incorporated [ALI] Device [1025:0112]
	Control: I/O+ Mem+ BusMaster+ SpecCycle- MemWINV- VGASnoop- ParErr- Stepping- SERR- FastB2B- DisINTx-
	Status: Cap+ 66MHz- UDF- FastB2B- ParErr- DEVSEL=medium >TAbort- <TAbort- <MAbort- >SERR- <PERR- INTx-
	Latency: 168, Cache Line Size: 64 bytes
	Interrupt: pin A routed to IRQ 11
	NUMA node: 0
	Region 0: Memory at c3002000 (32-bit, non-prefetchable) [size=4K]
	Bus: primary=04, secondary=05, subordinate=05, sec-latency=176
	Memory window 0: 60000000-63ffffff (prefetchable)
	Memory window 1: 6c000000-6fffffff
	I/O window 0: 00005000-000050ff
	I/O window 1: 00005400-000054ff
	BridgeCtl: Parity- SERR- ISA- VGA- MAbort- >Reset+ 16bInt+ PostWrite+
	16-bit legacy interface ports at 0001
	Capabilities: [a0] Power Management version 2
		Flags: PMEClk- DSI- D1+ D2+ AuxCurrent=0mA PME(D0+,D1+,D2+,D3hot+,D3cold+)
		Status: D0 NoSoftRst- PME-Enable- DSel=0 DScale=0 PME-
		Bridge: PM- B3+
	Kernel driver in use: yenta_cardbus
	Kernel modules: yenta_socket

04:06.2 Mass storage controller [0180]: Texas Instruments PCIxx12 Flash Media Controller [104c:803b]
	Subsystem: Acer Incorporated [ALI] Device [1025:0112]
	Control: I/O- Mem+ BusMaster+ SpecCycle- MemWINV- VGASnoop- ParErr- Stepping- SERR- FastB2B- DisINTx-
	Status: Cap+ 66MHz- UDF- FastB2B- ParErr- DEVSEL=medium >TAbort- <TAbort- <MAbort- >SERR- <PERR- INTx-
	Latency: 64 (1750ns min, 1000ns max), Cache Line Size: 64 bytes
	Interrupt: pin A routed to IRQ 11
	NUMA node: 0
	Region 0: Memory at c3008000 (32-bit, non-prefetchable) [size=4K]
	Capabilities: [44] Power Management version 2
		Flags: PMEClk- DSI- D1+ D2+ AuxCurrent=0mA PME(D0+,D1+,D2+,D3hot+,D3cold-)
		Status: D0 NoSoftRst- PME-Enable- DSel=0 DScale=0 PME-
	Kernel driver in use: tifm_7xx1
	Kernel modules: tifm_7xx1

