00:00.0 Host bridge [0600]: Intel Corporation Mobile 945GM/PM/GMS, 943/940GML and 945GT Express Memory Controller Hub [8086:27a0] (rev 03)
	Subsystem: Toshiba America Info Systems Device [1179:ff00]
	Control: I/O- Mem+ BusMaster+ SpecCycle- MemWINV- VGASnoop- ParErr- Stepping- SERR+ FastB2B- DisINTx-
	Status: Cap+ 66MHz- UDF- FastB2B+ ParErr- DEVSEL=fast >TAbort- <TAbort- <MAbort+ >SERR- <PERR- INTx-
	Latency: 0
	Capabilities: [e0] Vendor Specific Information: Len=09 <?>

00:01.0 PCI bridge [0604]: Intel Corporation Mobile 945GM/PM/GMS, 943/940GML and 945GT Express PCI Express Root Port [8086:27a1] (rev 03) (prog-if 00 [Normal decode])
	Control: I/O+ Mem+ BusMaster+ SpecCycle- MemWINV- VGASnoop- ParErr- Stepping- SERR- FastB2B- DisINTx+
	Status: Cap+ 66MHz- UDF- FastB2B- ParErr- DEVSEL=fast >TAbort- <TAbort- <MAbort- >SERR- <PERR- INTx-
	Latency: 0, Cache Line Size: 64 bytes
	Bus: primary=00, secondary=01, subordinate=01, sec-latency=0
	I/O behind bridge: 00002000-00002fff
	Memory behind bridge: d8000000-d80fffff
	Prefetchable memory behind bridge: 00000000c0000000-00000000cfffffff
	Secondary status: 66MHz- FastB2B- ParErr- DEVSEL=fast >TAbort- <TAbort- <MAbort+ <SERR- <PERR-
	BridgeCtl: Parity- SERR- NoISA- VGA+ MAbort- >Reset- FastB2B-
		PriDiscTmr- SecDiscTmr- DiscTmrStat- DiscTmrSERREn-
	Capabilities: [88] Subsystem: Toshiba America Info Systems Device [1179:ff00]
	Capabilities: [80] Power Management version 2
		Flags: PMEClk- DSI- D1- D2- AuxCurrent=0mA PME(D0+,D1-,D2-,D3hot+,D3cold+)
		Status: D0 NoSoftRst- PME-Enable- DSel=0 DScale=0 PME-
	Capabilities: [90] MSI: Enable+ Count=1/1 Maskable- 64bit-
		Address: 00000000  Data: 0000
	Capabilities: [a0] Express (v1) Root Port (Slot+), MSI 00
		DevCap:	MaxPayload 128 bytes, PhantFunc 0, Latency L0s <64ns, L1 <1us
			ExtTag- RBE- FLReset-
		DevCtl:	Report errors: Correctable- Non-Fatal- Fatal- Unsupported-
			RlxdOrd- ExtTag- PhantFunc- AuxPwr- NoSnoop-
			MaxPayload 128 bytes, MaxReadReq 128 bytes
		DevSta:	CorrErr+ UncorrErr- FatalErr- UnsuppReq- AuxPwr- TransPend-
		LnkCap:	Port #2, Speed 2.5GT/s, Width x16, ASPM L0s L1, Latency L0 <256ns, L1 <4us
			ClockPM- Surprise- LLActRep- BwNot-
		LnkCtl:	ASPM Disabled; RCB 64 bytes Disabled- Retrain- CommClk+
			ExtSynch- ClockPM- AutWidDis- BWInt- AutBWInt-
		LnkSta:	Speed 2.5GT/s, Width x16, TrErr- Train- SlotClk+ DLActive- BWMgmt- ABWMgmt-
		SltCap:	AttnBtn- PwrCtrl- MRL- AttnInd- PwrInd- HotPlug- Surprise-
			Slot #1, PowerLimit 75.000W; Interlock- NoCompl-
		SltCtl:	Enable: AttnBtn- PwrFlt- MRL- PresDet- CmdCplt- HPIrq- LinkChg-
			Control: AttnInd Off, PwrInd On, Power- Interlock-
		SltSta:	Status: AttnBtn- PowerFlt- MRL- CmdCplt- PresDet+ Interlock-
			Changed: MRL- PresDet+ LinkState-
		RootCtl: ErrCorrectable- ErrNon-Fatal- ErrFatal- PMEIntEna- CRSVisible-
		RootCap: CRSVisible-
		RootSta: PME ReqID 0000, PMEStatus- PMEPending-
	Capabilities: [100 v1] Virtual Channel
		Caps:	LPEVC=0 RefClk=100ns PATEntryBits=1
		Arb:	Fixed+ WRR32- WRR64- WRR128-
		Ctrl:	ArbSelect=Fixed
		Status:	InProgress-
		VC0:	Caps:	PATOffset=00 MaxTimeSlots=1 RejSnoopTrans-
			Arb:	Fixed- WRR32- WRR64- WRR128- TWRR128- WRR256-
			Ctrl:	Enable+ ID=0 ArbSelect=Fixed TC/VC=01
			Status:	NegoPending- InProgress-
	Capabilities: [140 v1] Root Complex Link
		Desc:	PortNumber=02 ComponentID=01 EltType=Config
		Link0:	Desc:	TargetPort=00 TargetComponent=01 AssocRCRB- LinkType=MemMapped LinkValid+
			Addr:	00000000fed19000
	Kernel driver in use: pcieport
	Kernel modules: shpchp

00:1b.0 Audio device [0403]: Intel Corporation NM10/ICH7 Family High Definition Audio Controller [8086:27d8] (rev 02)
	Subsystem: Toshiba America Info Systems Device [1179:ff00]
	Control: I/O- Mem+ BusMaster+ SpecCycle- MemWINV- VGASnoop- ParErr- Stepping- SERR- FastB2B- DisINTx+
	Status: Cap+ 66MHz- UDF- FastB2B- ParErr- DEVSEL=fast >TAbort- <TAbort- <MAbort- >SERR- <PERR- INTx-
	Latency: 0, Cache Line Size: 64 bytes
	Interrupt: pin A routed to IRQ 27
	Region 0: Memory at d8400000 (64-bit, non-prefetchable) [size=16K]
	Capabilities: [50] Power Management version 2
		Flags: PMEClk- DSI- D1- D2- AuxCurrent=55mA PME(D0+,D1-,D2-,D3hot+,D3cold+)
		Status: D0 NoSoftRst- PME-Enable- DSel=0 DScale=0 PME-
	Capabilities: [60] MSI: Enable+ Count=1/1 Maskable- 64bit+
		Address: 00000000fee0300c  Data: 4172
	Capabilities: [70] Express (v1) Root Complex Integrated Endpoint, MSI 00
		DevCap:	MaxPayload 128 bytes, PhantFunc 0, Latency L0s <64ns, L1 <1us
			ExtTag- RBE- FLReset-
		DevCtl:	Report errors: Correctable- Non-Fatal- Fatal- Unsupported-
			RlxdOrd- ExtTag- PhantFunc- AuxPwr- NoSnoop+
			MaxPayload 128 bytes, MaxReadReq 128 bytes
		DevSta:	CorrErr- UncorrErr- FatalErr- UnsuppReq- AuxPwr+ TransPend-
		LnkCap:	Port #0, Speed unknown, Width x0, ASPM not supported, Latency L0 <64ns, L1 <1us
			ClockPM- Surprise- LLActRep- BwNot-
		LnkCtl:	ASPM Disabled; Disabled- Retrain- CommClk-
			ExtSynch- ClockPM- AutWidDis- BWInt- AutBWInt-
		LnkSta:	Speed unknown, Width x0, TrErr- Train- SlotClk- DLActive- BWMgmt- ABWMgmt-
	Capabilities: [100 v1] Virtual Channel
		Caps:	LPEVC=0 RefClk=100ns PATEntryBits=1
		Arb:	Fixed- WRR32- WRR64- WRR128-
		Ctrl:	ArbSelect=Fixed
		Status:	InProgress-
		VC0:	Caps:	PATOffset=00 MaxTimeSlots=1 RejSnoopTrans-
			Arb:	Fixed- WRR32- WRR64- WRR128- TWRR128- WRR256-
			Ctrl:	Enable+ ID=0 ArbSelect=Fixed TC/VC=01
			Status:	NegoPending- InProgress-
		VC1:	Caps:	PATOffset=00 MaxTimeSlots=1 RejSnoopTrans-
			Arb:	Fixed- WRR32- WRR64- WRR128- TWRR128- WRR256-
			Ctrl:	Enable+ ID=1 ArbSelect=Fixed TC/VC=80
			Status:	NegoPending- InProgress-
	Capabilities: [130 v1] Root Complex Link
		Desc:	PortNumber=0f ComponentID=02 EltType=Config
		Link0:	Desc:	TargetPort=00 TargetComponent=02 AssocRCRB- LinkType=MemMapped LinkValid+
			Addr:	00000000fed1c000
	Kernel driver in use: snd_hda_intel
	Kernel modules: snd_hda_intel

00:1c.0 PCI bridge [0604]: Intel Corporation NM10/ICH7 Family PCI Express Port 1 [8086:27d0] (rev 02) (prog-if 00 [Normal decode])
	Control: I/O+ Mem+ BusMaster+ SpecCycle- MemWINV- VGASnoop- ParErr- Stepping- SERR- FastB2B- DisINTx+
	Status: Cap+ 66MHz- UDF- FastB2B- ParErr- DEVSEL=fast >TAbort- <TAbort- <MAbort- >SERR- <PERR- INTx-
	Latency: 0, Cache Line Size: 64 bytes
	Bus: primary=00, secondary=02, subordinate=02, sec-latency=0
	I/O behind bridge: 00003000-00003fff
	Memory behind bridge: d4000000-d5ffffff
	Prefetchable memory behind bridge: 00000000d0000000-00000000d1ffffff
	Secondary status: 66MHz- FastB2B- ParErr- DEVSEL=fast >TAbort- <TAbort- <MAbort+ <SERR- <PERR-
	BridgeCtl: Parity- SERR- NoISA+ VGA- MAbort- >Reset- FastB2B-
		PriDiscTmr- SecDiscTmr- DiscTmrStat- DiscTmrSERREn-
	Capabilities: [40] Express (v1) Root Port (Slot+), MSI 00
		DevCap:	MaxPayload 128 bytes, PhantFunc 0, Latency L0s unlimited, L1 unlimited
			ExtTag- RBE- FLReset-
		DevCtl:	Report errors: Correctable- Non-Fatal- Fatal- Unsupported-
			RlxdOrd- ExtTag- PhantFunc- AuxPwr- NoSnoop-
			MaxPayload 128 bytes, MaxReadReq 128 bytes
		DevSta:	CorrErr- UncorrErr- FatalErr- UnsuppReq- AuxPwr+ TransPend-
		LnkCap:	Port #1, Speed 2.5GT/s, Width x1, ASPM L0s L1, Latency L0 <1us, L1 <4us
			ClockPM- Surprise- LLActRep+ BwNot-
		LnkCtl:	ASPM Disabled; RCB 64 bytes Disabled- Retrain- CommClk-
			ExtSynch- ClockPM- AutWidDis- BWInt- AutBWInt-
		LnkSta:	Speed 2.5GT/s, Width x0, TrErr- Train- SlotClk+ DLActive- BWMgmt- ABWMgmt-
		SltCap:	AttnBtn- PwrCtrl- MRL- AttnInd- PwrInd- HotPlug+ Surprise+
			Slot #2, PowerLimit 6.500W; Interlock- NoCompl-
		SltCtl:	Enable: AttnBtn- PwrFlt- MRL- PresDet+ CmdCplt- HPIrq- LinkChg-
			Control: AttnInd Unknown, PwrInd Unknown, Power- Interlock-
		SltSta:	Status: AttnBtn- PowerFlt- MRL- CmdCplt- PresDet- Interlock-
			Changed: MRL- PresDet- LinkState-
		RootCtl: ErrCorrectable- ErrNon-Fatal- ErrFatal- PMEIntEna- CRSVisible-
		RootCap: CRSVisible-
		RootSta: PME ReqID 0000, PMEStatus- PMEPending-
	Capabilities: [80] MSI: Enable+ Count=1/1 Maskable- 64bit-
		Address: 00000000  Data: 0000
	Capabilities: [90] Subsystem: Toshiba America Info Systems Device [1179:ff00]
	Capabilities: [a0] Power Management version 2
		Flags: PMEClk- DSI- D1- D2- AuxCurrent=0mA PME(D0+,D1-,D2-,D3hot+,D3cold+)
		Status: D0 NoSoftRst- PME-Enable- DSel=0 DScale=0 PME-
	Capabilities: [100 v1] Virtual Channel
		Caps:	LPEVC=0 RefClk=100ns PATEntryBits=1
		Arb:	Fixed+ WRR32- WRR64- WRR128-
		Ctrl:	ArbSelect=Fixed
		Status:	InProgress-
		VC0:	Caps:	PATOffset=00 MaxTimeSlots=1 RejSnoopTrans-
			Arb:	Fixed+ WRR32- WRR64- WRR128- TWRR128- WRR256-
			Ctrl:	Enable+ ID=0 ArbSelect=Fixed TC/VC=ff
			Status:	NegoPending- InProgress-
		VC1:	Caps:	PATOffset=00 MaxTimeSlots=1 RejSnoopTrans-
			Arb:	Fixed+ WRR32- WRR64- WRR128- TWRR128- WRR256-
			Ctrl:	Enable- ID=0 ArbSelect=Fixed TC/VC=00
			Status:	NegoPending- InProgress-
	Capabilities: [180 v1] Root Complex Link
		Desc:	PortNumber=01 ComponentID=02 EltType=Config
		Link0:	Desc:	TargetPort=00 TargetComponent=02 AssocRCRB- LinkType=MemMapped LinkValid+
			Addr:	00000000fed1c001
	Kernel driver in use: pcieport
	Kernel modules: shpchp

00:1c.1 PCI bridge [0604]: Intel Corporation NM10/ICH7 Family PCI Express Port 2 [8086:27d2] (rev 02) (prog-if 00 [Normal decode])
	Control: I/O+ Mem+ BusMaster+ SpecCycle- MemWINV- VGASnoop- ParErr- Stepping- SERR- FastB2B- DisINTx+
	Status: Cap+ 66MHz- UDF- FastB2B- ParErr- DEVSEL=fast >TAbort- <TAbort- <MAbort- >SERR- <PERR- INTx-
	Latency: 0, Cache Line Size: 64 bytes
	Bus: primary=00, secondary=03, subordinate=03, sec-latency=0
	I/O behind bridge: 00004000-00004fff
	Memory behind bridge: d6000000-d7ffffff
	Prefetchable memory behind bridge: 00000000d2000000-00000000d3ffffff
	Secondary status: 66MHz- FastB2B- ParErr- DEVSEL=fast >TAbort- <TAbort- <MAbort+ <SERR- <PERR-
	BridgeCtl: Parity- SERR- NoISA+ VGA- MAbort- >Reset- FastB2B-
		PriDiscTmr- SecDiscTmr- DiscTmrStat- DiscTmrSERREn-
	Capabilities: [40] Express (v1) Root Port (Slot+), MSI 00
		DevCap:	MaxPayload 128 bytes, PhantFunc 0, Latency L0s unlimited, L1 unlimited
			ExtTag- RBE- FLReset-
		DevCtl:	Report errors: Correctable- Non-Fatal- Fatal- Unsupported-
			RlxdOrd- ExtTag- PhantFunc- AuxPwr- NoSnoop-
			MaxPayload 128 bytes, MaxReadReq 128 bytes
		DevSta:	CorrErr- UncorrErr- FatalErr- UnsuppReq- AuxPwr+ TransPend-
		LnkCap:	Port #2, Speed 2.5GT/s, Width x1, ASPM L0s L1, Latency L0 <256ns, L1 <4us
			ClockPM- Surprise- LLActRep+ BwNot-
		LnkCtl:	ASPM Disabled; RCB 64 bytes Disabled- Retrain- CommClk+
			ExtSynch- ClockPM- AutWidDis- BWInt- AutBWInt-
		LnkSta:	Speed 2.5GT/s, Width x1, TrErr- Train- SlotClk+ DLActive+ BWMgmt- ABWMgmt-
		SltCap:	AttnBtn- PwrCtrl- MRL- AttnInd- PwrInd- HotPlug+ Surprise+
			Slot #3, PowerLimit 6.500W; Interlock- NoCompl-
		SltCtl:	Enable: AttnBtn- PwrFlt- MRL- PresDet+ CmdCplt- HPIrq- LinkChg-
			Control: AttnInd Unknown, PwrInd Unknown, Power- Interlock-
		SltSta:	Status: AttnBtn- PowerFlt- MRL- CmdCplt- PresDet+ Interlock-
			Changed: MRL- PresDet- LinkState-
		RootCtl: ErrCorrectable- ErrNon-Fatal- ErrFatal- PMEIntEna- CRSVisible-
		RootCap: CRSVisible-
		RootSta: PME ReqID 0000, PMEStatus- PMEPending-
	Capabilities: [80] MSI: Enable+ Count=1/1 Maskable- 64bit-
		Address: 00000000  Data: 0000
	Capabilities: [90] Subsystem: Toshiba America Info Systems Device [1179:ff00]
	Capabilities: [a0] Power Management version 2
		Flags: PMEClk- DSI- D1- D2- AuxCurrent=0mA PME(D0+,D1-,D2-,D3hot+,D3cold+)
		Status: D0 NoSoftRst- PME-Enable- DSel=0 DScale=0 PME-
	Capabilities: [100 v1] Virtual Channel
		Caps:	LPEVC=0 RefClk=100ns PATEntryBits=1
		Arb:	Fixed+ WRR32- WRR64- WRR128-
		Ctrl:	ArbSelect=Fixed
		Status:	InProgress-
		VC0:	Caps:	PATOffset=00 MaxTimeSlots=1 RejSnoopTrans-
			Arb:	Fixed+ WRR32- WRR64- WRR128- TWRR128- WRR256-
			Ctrl:	Enable+ ID=0 ArbSelect=Fixed TC/VC=01
			Status:	NegoPending- InProgress-
		VC1:	Caps:	PATOffset=00 MaxTimeSlots=1 RejSnoopTrans-
			Arb:	Fixed+ WRR32- WRR64- WRR128- TWRR128- WRR256-
			Ctrl:	Enable- ID=0 ArbSelect=Fixed TC/VC=00
			Status:	NegoPending- InProgress-
	Capabilities: [180 v1] Root Complex Link
		Desc:	PortNumber=02 ComponentID=02 EltType=Config
		Link0:	Desc:	TargetPort=00 TargetComponent=02 AssocRCRB- LinkType=MemMapped LinkValid+
			Addr:	00000000fed1c001
	Kernel driver in use: pcieport
	Kernel modules: shpchp

00:1d.0 USB controller [0c03]: Intel Corporation NM10/ICH7 Family USB UHCI Controller #1 [8086:27c8] (rev 02) (prog-if 00 [UHCI])
	Subsystem: Toshiba America Info Systems Device [1179:ff00]
	Control: I/O+ Mem- BusMaster+ SpecCycle- MemWINV- VGASnoop- ParErr- Stepping- SERR- FastB2B- DisINTx-
	Status: Cap- 66MHz- UDF- FastB2B+ ParErr- DEVSEL=medium >TAbort- <TAbort- <MAbort- >SERR- <PERR- INTx-
	Latency: 0
	Interrupt: pin A routed to IRQ 23
	Region 4: I/O ports at 1800 [size=32]
	Kernel driver in use: uhci_hcd
	Kernel modules: uhci_hcd

00:1d.1 USB controller [0c03]: Intel Corporation NM10/ICH7 Family USB UHCI Controller #2 [8086:27c9] (rev 02) (prog-if 00 [UHCI])
	Subsystem: Toshiba America Info Systems Device [1179:ff00]
	Control: I/O+ Mem- BusMaster+ SpecCycle- MemWINV- VGASnoop- ParErr- Stepping- SERR- FastB2B- DisINTx-
	Status: Cap- 66MHz- UDF- FastB2B+ ParErr- DEVSEL=medium >TAbort- <TAbort- <MAbort- >SERR- <PERR- INTx-
	Latency: 0
	Interrupt: pin B routed to IRQ 19
	Region 4: I/O ports at 1820 [size=32]
	Kernel driver in use: uhci_hcd
	Kernel modules: uhci_hcd

00:1d.2 USB controller [0c03]: Intel Corporation NM10/ICH7 Family USB UHCI Controller #3 [8086:27ca] (rev 02) (prog-if 00 [UHCI])
	Subsystem: Toshiba America Info Systems Device [1179:ff00]
	Control: I/O+ Mem- BusMaster+ SpecCycle- MemWINV- VGASnoop- ParErr- Stepping- SERR- FastB2B- DisINTx-
	Status: Cap- 66MHz- UDF- FastB2B+ ParErr- DEVSEL=medium >TAbort- <TAbort- <MAbort- >SERR- <PERR- INTx-
	Latency: 0
	Interrupt: pin C routed to IRQ 18
	Region 4: I/O ports at 1840 [size=32]
	Kernel driver in use: uhci_hcd
	Kernel modules: uhci_hcd

00:1d.3 USB controller [0c03]: Intel Corporation NM10/ICH7 Family USB UHCI Controller #4 [8086:27cb] (rev 02) (prog-if 00 [UHCI])
	Subsystem: Toshiba America Info Systems Device [1179:ff00]
	Control: I/O+ Mem- BusMaster+ SpecCycle- MemWINV- VGASnoop- ParErr- Stepping- SERR- FastB2B- DisINTx-
	Status: Cap- 66MHz- UDF- FastB2B+ ParErr- DEVSEL=medium >TAbort- <TAbort- <MAbort- >SERR- <PERR- INTx-
	Latency: 0
	Interrupt: pin D routed to IRQ 16
	Region 4: I/O ports at 1860 [size=32]
	Kernel driver in use: uhci_hcd
	Kernel modules: uhci_hcd

00:1d.7 USB controller [0c03]: Intel Corporation NM10/ICH7 Family USB2 EHCI Controller [8086:27cc] (rev 02) (prog-if 20 [EHCI])
	Subsystem: Toshiba America Info Systems Device [1179:ff00]
	Control: I/O- Mem+ BusMaster+ SpecCycle- MemWINV- VGASnoop- ParErr- Stepping- SERR- FastB2B- DisINTx-
	Status: Cap+ 66MHz- UDF- FastB2B+ ParErr- DEVSEL=medium >TAbort- <TAbort- <MAbort- >SERR- <PERR- INTx-
	Latency: 0
	Interrupt: pin A routed to IRQ 23
	Region 0: Memory at d8404000 (32-bit, non-prefetchable) [size=1K]
	Capabilities: [50] Power Management version 2
		Flags: PMEClk- DSI- D1- D2- AuxCurrent=375mA PME(D0+,D1-,D2-,D3hot+,D3cold+)
		Status: D0 NoSoftRst- PME-Enable- DSel=0 DScale=0 PME-
	Capabilities: [58] Debug port: BAR=1 offset=00a0
	Kernel driver in use: ehci-pci
	Kernel modules: ehci_pci

00:1e.0 PCI bridge [0604]: Intel Corporation 82801 Mobile PCI Bridge [8086:2448] (rev e2) (prog-if 01 [Subtractive decode])
	Control: I/O+ Mem+ BusMaster+ SpecCycle- MemWINV- VGASnoop- ParErr- Stepping- SERR- FastB2B- DisINTx-
	Status: Cap+ 66MHz- UDF- FastB2B- ParErr- DEVSEL=fast >TAbort- <TAbort- <MAbort- >SERR- <PERR- INTx-
	Latency: 0
	Bus: primary=00, secondary=05, subordinate=09, sec-latency=64
	I/O behind bridge: 00005000-00005fff
	Memory behind bridge: d8100000-d81fffff
	Secondary status: 66MHz- FastB2B+ ParErr- DEVSEL=medium >TAbort- <TAbort- <MAbort+ <SERR- <PERR-
	BridgeCtl: Parity- SERR- NoISA+ VGA- MAbort- >Reset- FastB2B-
		PriDiscTmr- SecDiscTmr- DiscTmrStat- DiscTmrSERREn-
	Capabilities: [50] Subsystem: Toshiba America Info Systems Device [1179:ff00]

00:1f.0 ISA bridge [0601]: Intel Corporation 82801GBM (ICH7-M) LPC Interface Bridge [8086:27b9] (rev 02)
	Subsystem: Toshiba America Info Systems Device [1179:ff00]
	Control: I/O+ Mem+ BusMaster+ SpecCycle- MemWINV- VGASnoop- ParErr- Stepping- SERR- FastB2B- DisINTx-
	Status: Cap+ 66MHz- UDF- FastB2B- ParErr- DEVSEL=medium >TAbort- <TAbort- <MAbort- >SERR- <PERR- INTx-
	Latency: 0
	Capabilities: [e0] Vendor Specific Information: Len=0c <?>
	Kernel driver in use: lpc_ich
	Kernel modules: intel_rng, lpc_ich, leds_ss4200

00:1f.2 IDE interface [0101]: Intel Corporation 82801GBM/GHM (ICH7-M Family) SATA Controller [IDE mode] [8086:27c4] (rev 02) (prog-if 80 [Master])
	Subsystem: Toshiba America Info Systems Device [1179:ff00]
	Control: I/O+ Mem- BusMaster+ SpecCycle- MemWINV- VGASnoop- ParErr- Stepping- SERR- FastB2B- DisINTx-
	Status: Cap+ 66MHz+ UDF- FastB2B+ ParErr- DEVSEL=medium >TAbort- <TAbort- <MAbort- >SERR- <PERR- INTx-
	Latency: 0
	Interrupt: pin B routed to IRQ 19
	Region 0: I/O ports at 01f0 [size=8]
	Region 1: I/O ports at 03f4
	Region 2: I/O ports at 0170 [size=8]
	Region 3: I/O ports at 0374
	Region 4: I/O ports at 18b0 [size=16]
	Capabilities: [70] Power Management version 2
		Flags: PMEClk- DSI- D1- D2- AuxCurrent=0mA PME(D0-,D1-,D2-,D3hot+,D3cold-)
		Status: D0 NoSoftRst- PME-Enable- DSel=0 DScale=0 PME-
	Kernel driver in use: ata_piix
	Kernel modules: ata_piix, pata_acpi, ata_generic, ide_pci_generic

00:1f.3 SMBus [0c05]: Intel Corporation NM10/ICH7 Family SMBus Controller [8086:27da] (rev 02)
	Subsystem: Toshiba America Info Systems Device [1179:ff00]
	Control: I/O+ Mem- BusMaster- SpecCycle- MemWINV- VGASnoop- ParErr- Stepping- SERR- FastB2B- DisINTx-
	Status: Cap- 66MHz- UDF- FastB2B+ ParErr- DEVSEL=medium >TAbort- <TAbort- <MAbort- >SERR- <PERR- INTx-
	Interrupt: pin B routed to IRQ 19
	Region 4: I/O ports at 18c0 [size=32]
	Kernel driver in use: i801_smbus
	Kernel modules: i2c_i801

01:00.0 VGA compatible controller [0300]: Advanced Micro Devices, Inc. [AMD/ATI] RV515/M54 [Mobility Radeon X1400] [1002:7145] (prog-if 00 [VGA controller])
	Subsystem: Toshiba America Info Systems Device [1179:ff00]
	Control: I/O+ Mem+ BusMaster+ SpecCycle- MemWINV- VGASnoop- ParErr- Stepping- SERR- FastB2B- DisINTx-
	Status: Cap+ 66MHz- UDF- FastB2B- ParErr- DEVSEL=fast >TAbort- <TAbort- <MAbort- >SERR- <PERR- INTx-
	Latency: 0, Cache Line Size: 64 bytes
	Interrupt: pin A routed to IRQ 16
	Region 0: Memory at c0000000 (32-bit, prefetchable) [size=256M]
	Region 1: I/O ports at 2000 [size=256]
	Region 2: Memory at d8000000 (32-bit, non-prefetchable) [size=64K]
	[virtual] Expansion ROM at 000c0000 [disabled] [size=128K]
	Capabilities: [50] Power Management version 2
		Flags: PMEClk- DSI- D1+ D2+ AuxCurrent=0mA PME(D0-,D1-,D2-,D3hot-,D3cold-)
		Status: D0 NoSoftRst- PME-Enable- DSel=0 DScale=0 PME-
	Capabilities: [58] Express (v1) Legacy Endpoint, MSI 00
		DevCap:	MaxPayload 128 bytes, PhantFunc 0, Latency L0s <4us, L1 unlimited
			ExtTag+ AttnBtn- AttnInd- PwrInd- RBE- FLReset-
		DevCtl:	Report errors: Correctable- Non-Fatal- Fatal- Unsupported-
			RlxdOrd+ ExtTag- PhantFunc- AuxPwr- NoSnoop+
			MaxPayload 128 bytes, MaxReadReq 128 bytes
		DevSta:	CorrErr- UncorrErr- FatalErr- UnsuppReq- AuxPwr- TransPend-
		LnkCap:	Port #0, Speed 2.5GT/s, Width x16, ASPM L0s L1, Latency L0 <64ns, L1 <1us
			ClockPM- Surprise- LLActRep- BwNot-
		LnkCtl:	ASPM Disabled; RCB 64 bytes Disabled- Retrain- CommClk+
			ExtSynch- ClockPM- AutWidDis- BWInt- AutBWInt-
		LnkSta:	Speed 2.5GT/s, Width x16, TrErr- Train- SlotClk+ DLActive- BWMgmt- ABWMgmt-
	Capabilities: [80] MSI: Enable- Count=1/1 Maskable- 64bit+
		Address: 0000000000000000  Data: 0000
	Kernel driver in use: radeon
	Kernel modules: radeon

03:00.0 Network controller [0280]: Intel Corporation PRO/Wireless 3945ABG [Golan] Network Connection [8086:4222] (rev 02)
	Subsystem: Intel Corporation PRO/Wireless 3945BG Network Connection [8086:1044]
	Control: I/O- Mem+ BusMaster+ SpecCycle- MemWINV- VGASnoop- ParErr- Stepping- SERR- FastB2B- DisINTx+
	Status: Cap+ 66MHz- UDF- FastB2B- ParErr- DEVSEL=fast >TAbort- <TAbort- <MAbort- >SERR- <PERR- INTx-
	Latency: 0, Cache Line Size: 64 bytes
	Interrupt: pin A routed to IRQ 28
	Region 0: Memory at d6000000 (32-bit, non-prefetchable) [size=4K]
	Capabilities: [c8] Power Management version 2
		Flags: PMEClk- DSI+ D1- D2- AuxCurrent=0mA PME(D0+,D1-,D2-,D3hot+,D3cold+)
		Status: D0 NoSoftRst- PME-Enable- DSel=0 DScale=0 PME-
	Capabilities: [d0] MSI: Enable+ Count=1/1 Maskable- 64bit+
		Address: 00000000fee0300c  Data: 4182
	Capabilities: [e0] Express (v1) Legacy Endpoint, MSI 00
		DevCap:	MaxPayload 128 bytes, PhantFunc 0, Latency L0s <512ns, L1 unlimited
			ExtTag- AttnBtn- AttnInd- PwrInd- RBE- FLReset-
		DevCtl:	Report errors: Correctable- Non-Fatal- Fatal- Unsupported-
			RlxdOrd+ ExtTag- PhantFunc- AuxPwr- NoSnoop+
			MaxPayload 128 bytes, MaxReadReq 128 bytes
		DevSta:	CorrErr- UncorrErr+ FatalErr- UnsuppReq+ AuxPwr+ TransPend-
		LnkCap:	Port #0, Speed 2.5GT/s, Width x1, ASPM L0s L1, Latency L0 <128ns, L1 <64us
			ClockPM+ Surprise- LLActRep- BwNot-
		LnkCtl:	ASPM Disabled; RCB 64 bytes Disabled- Retrain- CommClk+
			ExtSynch- ClockPM- AutWidDis- BWInt- AutBWInt-
		LnkSta:	Speed 2.5GT/s, Width x1, TrErr- Train- SlotClk+ DLActive- BWMgmt- ABWMgmt-
	Capabilities: [100 v1] Advanced Error Reporting
		UESta:	DLP- SDES- TLP- FCP- CmpltTO- CmpltAbrt- UnxCmplt- RxOF- MalfTLP- ECRC- UnsupReq- ACSViol-
		UEMsk:	DLP- SDES- TLP- FCP- CmpltTO- CmpltAbrt- UnxCmplt- RxOF- MalfTLP- ECRC- UnsupReq- ACSViol-
		UESvrt:	DLP+ SDES- TLP- FCP+ CmpltTO- CmpltAbrt- UnxCmplt- RxOF+ MalfTLP+ ECRC- UnsupReq- ACSViol-
		CESta:	RxErr- BadTLP- BadDLLP- Rollover- Timeout- NonFatalErr-
		CEMsk:	RxErr- BadTLP- BadDLLP- Rollover- Timeout- NonFatalErr-
		AERCap:	First Error Pointer: 14, GenCap- CGenEn- ChkCap- ChkEn-
	Capabilities: [140 v1] Device Serial Number ...
	Kernel driver in use: iwl3945
	Kernel modules: iwl3945

05:06.0 CardBus bridge [0607]: Texas Instruments PCIxx12 Cardbus Controller [104c:8039]
	Subsystem: Toshiba America Info Systems Device [1179:ff00]
	Control: I/O+ Mem+ BusMaster+ SpecCycle- MemWINV- VGASnoop- ParErr- Stepping- SERR- FastB2B- DisINTx-
	Status: Cap+ 66MHz- UDF- FastB2B- ParErr- DEVSEL=medium >TAbort- <TAbort- <MAbort- >SERR- <PERR- INTx-
	Latency: 168, Cache Line Size: 64 bytes
	Interrupt: pin A routed to IRQ 16
	Region 0: Memory at d8100000 (32-bit, non-prefetchable) [size=4K]
	Bus: primary=05, secondary=06, subordinate=09, sec-latency=176
	Memory window 0: 80000000-83ffffff (prefetchable)
	Memory window 1: 84000000-87ffffff
	I/O window 0: 00005400-000054ff
	I/O window 1: 00005800-000058ff
	BridgeCtl: Parity- SERR- ISA- VGA- MAbort- >Reset+ 16bInt+ PostWrite+
	16-bit legacy interface ports at 0001
	Capabilities: [a0] Power Management version 2
		Flags: PMEClk- DSI- D1+ D2+ AuxCurrent=0mA PME(D0+,D1+,D2+,D3hot+,D3cold+)
		Status: D0 NoSoftRst- PME-Enable- DSel=0 DScale=0 PME-
		Bridge: PM- B3+
	Kernel driver in use: yenta_cardbus
	Kernel modules: yenta_socket

05:06.1 FireWire (IEEE 1394) [0c00]: Texas Instruments PCIxx12 OHCI Compliant IEEE 1394 Host Controller [104c:803a] (prog-if 10 [OHCI])
	Subsystem: Toshiba America Info Systems Device [1179:ff00]
	Control: I/O- Mem+ BusMaster+ SpecCycle- MemWINV+ VGASnoop- ParErr- Stepping- SERR- FastB2B- DisINTx-
	Status: Cap+ 66MHz- UDF- FastB2B- ParErr- DEVSEL=medium >TAbort- <TAbort- <MAbort- >SERR- <PERR- INTx-
	Latency: 32 (500ns min, 1000ns max), Cache Line Size: 64 bytes
	Interrupt: pin B routed to IRQ 17
	Region 0: Memory at d8103000 (32-bit, non-prefetchable) [size=2K]
	Region 1: Memory at d8104000 (32-bit, non-prefetchable) [size=16K]
	Capabilities: [44] Power Management version 2
		Flags: PMEClk- DSI- D1+ D2+ AuxCurrent=0mA PME(D0+,D1+,D2+,D3hot+,D3cold-)
		Status: D0 NoSoftRst- PME-Enable- DSel=0 DScale=0 PME+
	Kernel driver in use: firewire_ohci
	Kernel modules: firewire_ohci

05:06.2 Mass storage controller [0180]: Texas Instruments 5-in-1 Multimedia Card Reader (SD/MMC/MS/MS PRO/xD) [104c:803b]
	Subsystem: Toshiba America Info Systems Device [1179:ff00]
	Control: I/O- Mem+ BusMaster+ SpecCycle- MemWINV- VGASnoop- ParErr- Stepping- SERR- FastB2B- DisINTx-
	Status: Cap+ 66MHz- UDF- FastB2B- ParErr- DEVSEL=medium >TAbort- <TAbort- <MAbort- >SERR- <PERR- INTx-
	Latency: 57 (1750ns min, 1000ns max), Cache Line Size: 64 bytes
	Interrupt: pin C routed to IRQ 18
	Region 0: Memory at d8101000 (32-bit, non-prefetchable) [size=4K]
	Capabilities: [44] Power Management version 2
		Flags: PMEClk- DSI- D1+ D2+ AuxCurrent=0mA PME(D0+,D1+,D2+,D3hot+,D3cold-)
		Status: D0 NoSoftRst- PME-Enable- DSel=0 DScale=0 PME-
	Kernel driver in use: tifm_7xx1
	Kernel modules: tifm_7xx1

05:06.3 SD Host controller [0805]: Texas Instruments PCIxx12 SDA Standard Compliant SD Host Controller [104c:803c] (prog-if 01)
	Subsystem: Toshiba America Info Systems Device [1179:ff00]
	Control: I/O- Mem+ BusMaster+ SpecCycle- MemWINV- VGASnoop- ParErr- Stepping- SERR- FastB2B- DisINTx-
	Status: Cap+ 66MHz- UDF- FastB2B- ParErr- DEVSEL=medium >TAbort- <TAbort- <MAbort- >SERR- <PERR- INTx-
	Latency: 57 (1750ns min, 1000ns max), Cache Line Size: 64 bytes
	Interrupt: pin D routed to IRQ 19
	Region 0: Memory at d8103800 (32-bit, non-prefetchable) [size=256]
	Capabilities: [80] Power Management version 2
		Flags: PMEClk- DSI- D1+ D2+ AuxCurrent=0mA PME(D0+,D1+,D2+,D3hot+,D3cold-)
		Status: D0 NoSoftRst- PME-Enable- DSel=0 DScale=0 PME-
	Kernel driver in use: sdhci-pci
	Kernel modules: sdhci_pci

05:08.0 Ethernet controller [0200]: Intel Corporation PRO/100 VM Network Connection [8086:1093] (rev 02)
	Subsystem: Toshiba America Info Systems Device [1179:ff00]
	Control: I/O+ Mem+ BusMaster+ SpecCycle- MemWINV+ VGASnoop- ParErr- Stepping- SERR- FastB2B- DisINTx-
	Status: Cap+ 66MHz- UDF- FastB2B+ ParErr- DEVSEL=medium >TAbort- <TAbort- <MAbort- >SERR- <PERR- INTx-
	Latency: 66 (2000ns min, 14000ns max), Cache Line Size: 64 bytes
	Interrupt: pin A routed to IRQ 20
	Region 0: Memory at d8102000 (32-bit, non-prefetchable) [size=4K]
	Region 1: I/O ports at 5000 [size=64]
	Capabilities: [dc] Power Management version 2
		Flags: PMEClk- DSI+ D1+ D2+ AuxCurrent=0mA PME(D0+,D1+,D2+,D3hot+,D3cold+)
		Status: D0 NoSoftRst- PME-Enable- DSel=0 DScale=2 PME-
	Kernel driver in use: e100
	Kernel modules: e100

