00:00.0 Host bridge [0600]: Intel Corporation Xeon E5/Core i7 DMI2 [8086:3c00] (rev 07)
	Subsystem: Hewlett-Packard Company Device [103c:1589]
	Control: I/O- Mem- BusMaster- SpecCycle- MemWINV- VGASnoop- ParErr- Stepping- SERR- FastB2B- DisINTx-
	Status: Cap+ 66MHz- UDF- FastB2B- ParErr- DEVSEL=fast >TAbort- <TAbort- <MAbort+ >SERR- <PERR- INTx-
	Interrupt: pin A routed to IRQ 0
	IOMMU group: 0
	Capabilities: <access denied>

00:01.0 PCI bridge [0604]: Intel Corporation Xeon E5/Core i7 IIO PCI Express Root Port 1a [8086:3c02] (rev 07) (prog-if 00 [Normal decode])
	Control: I/O+ Mem+ BusMaster+ SpecCycle- MemWINV- VGASnoop- ParErr+ Stepping- SERR+ FastB2B- DisINTx+
	Status: Cap+ 66MHz- UDF- FastB2B- ParErr- DEVSEL=fast >TAbort- <TAbort- <MAbort- >SERR- <PERR- INTx-
	Latency: 0, Cache Line Size: 64 bytes
	Interrupt: pin A routed to IRQ 25
	IOMMU group: 1
	Bus: primary=00, secondary=03, subordinate=03, sec-latency=0
	I/O behind bridge: [disabled]
	Memory behind bridge: [disabled]
	Prefetchable memory behind bridge: [disabled]
	Secondary status: 66MHz- FastB2B- ParErr- DEVSEL=fast >TAbort- <TAbort- <MAbort- <SERR- <PERR-
	BridgeCtl: Parity+ SERR+ NoISA- VGA- VGA16+ MAbort- >Reset- FastB2B-
		PriDiscTmr- SecDiscTmr- DiscTmrStat- DiscTmrSERREn-
	Capabilities: <access denied>
	Kernel driver in use: pcieport

00:02.0 PCI bridge [0604]: Intel Corporation Xeon E5/Core i7 IIO PCI Express Root Port 2a [8086:3c04] (rev 07) (prog-if 00 [Normal decode])
	Control: I/O+ Mem+ BusMaster+ SpecCycle- MemWINV- VGASnoop- ParErr+ Stepping- SERR+ FastB2B- DisINTx+
	Status: Cap+ 66MHz- UDF- FastB2B- ParErr- DEVSEL=fast >TAbort- <TAbort- <MAbort- >SERR- <PERR- INTx-
	Latency: 0, Cache Line Size: 64 bytes
	Interrupt: pin A routed to IRQ 27
	IOMMU group: 2
	Bus: primary=00, secondary=05, subordinate=05, sec-latency=0
	I/O behind bridge: 0000c000-0000cfff [size=4K]
	Memory behind bridge: efe00000-efefffff [size=1M]
	Prefetchable memory behind bridge: 00000000d0000000-00000000e01fffff [size=258M]
	Secondary status: 66MHz- FastB2B- ParErr- DEVSEL=fast >TAbort- <TAbort- <MAbort+ <SERR- <PERR-
	BridgeCtl: Parity+ SERR+ NoISA- VGA+ VGA16+ MAbort- >Reset- FastB2B-
		PriDiscTmr- SecDiscTmr- DiscTmrStat- DiscTmrSERREn-
	Capabilities: <access denied>
	Kernel driver in use: pcieport

00:03.0 PCI bridge [0604]: Intel Corporation Xeon E5/Core i7 IIO PCI Express Root Port 3a in PCI Express Mode [8086:3c08] (rev 07) (prog-if 00 [Normal decode])
	Control: I/O+ Mem+ BusMaster+ SpecCycle- MemWINV- VGASnoop- ParErr+ Stepping- SERR+ FastB2B- DisINTx+
	Status: Cap+ 66MHz- UDF- FastB2B- ParErr- DEVSEL=fast >TAbort- <TAbort- <MAbort- >SERR- <PERR- INTx-
	Latency: 0, Cache Line Size: 64 bytes
	Interrupt: pin A routed to IRQ 29
	IOMMU group: 3
	Bus: primary=00, secondary=04, subordinate=04, sec-latency=0
	I/O behind bridge: [disabled]
	Memory behind bridge: [disabled]
	Prefetchable memory behind bridge: [disabled]
	Secondary status: 66MHz- FastB2B- ParErr- DEVSEL=fast >TAbort- <TAbort- <MAbort- <SERR- <PERR-
	BridgeCtl: Parity+ SERR+ NoISA- VGA- VGA16+ MAbort- >Reset- FastB2B-
		PriDiscTmr- SecDiscTmr- DiscTmrStat- DiscTmrSERREn-
	Capabilities: <access denied>
	Kernel driver in use: pcieport

00:04.0 System peripheral [0880]: Intel Corporation Xeon E5/Core i7 DMA Channel 0 [8086:3c20] (rev 07)
	Subsystem: Hewlett-Packard Company Device [103c:1589]
	Control: I/O- Mem+ BusMaster+ SpecCycle- MemWINV- VGASnoop- ParErr- Stepping- SERR- FastB2B- DisINTx+
	Status: Cap+ 66MHz- UDF- FastB2B- ParErr- DEVSEL=fast >TAbort- <TAbort- <MAbort- >SERR- <PERR- INTx-
	Latency: 0, Cache Line Size: 64 bytes
	Interrupt: pin A routed to IRQ 34
	IOMMU group: 4
	Region 0: Memory at eff3c000 (64-bit, non-prefetchable) [size=16K]
	Capabilities: <access denied>
	Kernel driver in use: ioatdma

00:04.1 System peripheral [0880]: Intel Corporation Xeon E5/Core i7 DMA Channel 1 [8086:3c21] (rev 07)
	Subsystem: Hewlett-Packard Company Device [103c:1589]
	Control: I/O- Mem+ BusMaster+ SpecCycle- MemWINV- VGASnoop- ParErr- Stepping- SERR- FastB2B- DisINTx+
	Status: Cap+ 66MHz- UDF- FastB2B- ParErr- DEVSEL=fast >TAbort- <TAbort- <MAbort- >SERR- <PERR- INTx-
	Latency: 0, Cache Line Size: 64 bytes
	Interrupt: pin B routed to IRQ 36
	IOMMU group: 5
	Region 0: Memory at eff38000 (64-bit, non-prefetchable) [size=16K]
	Capabilities: <access denied>
	Kernel driver in use: ioatdma

00:04.2 System peripheral [0880]: Intel Corporation Xeon E5/Core i7 DMA Channel 2 [8086:3c22] (rev 07)
	Subsystem: Hewlett-Packard Company Device [103c:1589]
	Control: I/O- Mem+ BusMaster+ SpecCycle- MemWINV- VGASnoop- ParErr- Stepping- SERR- FastB2B- DisINTx+
	Status: Cap+ 66MHz- UDF- FastB2B- ParErr- DEVSEL=fast >TAbort- <TAbort- <MAbort- >SERR- <PERR- INTx-
	Latency: 0, Cache Line Size: 64 bytes
	Interrupt: pin C routed to IRQ 34
	IOMMU group: 6
	Region 0: Memory at eff34000 (64-bit, non-prefetchable) [size=16K]
	Capabilities: <access denied>
	Kernel driver in use: ioatdma

00:04.3 System peripheral [0880]: Intel Corporation Xeon E5/Core i7 DMA Channel 3 [8086:3c23] (rev 07)
	Subsystem: Hewlett-Packard Company Device [103c:1589]
	Control: I/O- Mem+ BusMaster+ SpecCycle- MemWINV- VGASnoop- ParErr- Stepping- SERR- FastB2B- DisINTx+
	Status: Cap+ 66MHz- UDF- FastB2B- ParErr- DEVSEL=fast >TAbort- <TAbort- <MAbort- >SERR- <PERR- INTx-
	Latency: 0, Cache Line Size: 64 bytes
	Interrupt: pin D routed to IRQ 36
	IOMMU group: 7
	Region 0: Memory at eff30000 (64-bit, non-prefetchable) [size=16K]
	Capabilities: <access denied>
	Kernel driver in use: ioatdma

00:04.4 System peripheral [0880]: Intel Corporation Xeon E5/Core i7 DMA Channel 4 [8086:3c24] (rev 07)
	Subsystem: Hewlett-Packard Company Device [103c:1589]
	Control: I/O- Mem+ BusMaster+ SpecCycle- MemWINV- VGASnoop- ParErr- Stepping- SERR- FastB2B- DisINTx+
	Status: Cap+ 66MHz- UDF- FastB2B- ParErr- DEVSEL=fast >TAbort- <TAbort- <MAbort- >SERR- <PERR- INTx-
	Latency: 0, Cache Line Size: 64 bytes
	Interrupt: pin A routed to IRQ 34
	IOMMU group: 8
	Region 0: Memory at eff2c000 (64-bit, non-prefetchable) [size=16K]
	Capabilities: <access denied>
	Kernel driver in use: ioatdma

00:04.5 System peripheral [0880]: Intel Corporation Xeon E5/Core i7 DMA Channel 5 [8086:3c25] (rev 07)
	Subsystem: Hewlett-Packard Company Device [103c:1589]
	Control: I/O- Mem+ BusMaster+ SpecCycle- MemWINV- VGASnoop- ParErr- Stepping- SERR- FastB2B- DisINTx+
	Status: Cap+ 66MHz- UDF- FastB2B- ParErr- DEVSEL=fast >TAbort- <TAbort- <MAbort- >SERR- <PERR- INTx-
	Latency: 0, Cache Line Size: 64 bytes
	Interrupt: pin B routed to IRQ 36
	IOMMU group: 9
	Region 0: Memory at eff28000 (64-bit, non-prefetchable) [size=16K]
	Capabilities: <access denied>
	Kernel driver in use: ioatdma

00:04.6 System peripheral [0880]: Intel Corporation Xeon E5/Core i7 DMA Channel 6 [8086:3c26] (rev 07)
	Subsystem: Hewlett-Packard Company Device [103c:1589]
	Control: I/O- Mem+ BusMaster+ SpecCycle- MemWINV- VGASnoop- ParErr- Stepping- SERR- FastB2B- DisINTx+
	Status: Cap+ 66MHz- UDF- FastB2B- ParErr- DEVSEL=fast >TAbort- <TAbort- <MAbort- >SERR- <PERR- INTx-
	Latency: 0, Cache Line Size: 64 bytes
	Interrupt: pin C routed to IRQ 34
	IOMMU group: 10
	Region 0: Memory at eff24000 (64-bit, non-prefetchable) [size=16K]
	Capabilities: <access denied>
	Kernel driver in use: ioatdma

00:04.7 System peripheral [0880]: Intel Corporation Xeon E5/Core i7 DMA Channel 7 [8086:3c27] (rev 07)
	Subsystem: Hewlett-Packard Company Device [103c:1589]
	Control: I/O- Mem+ BusMaster+ SpecCycle- MemWINV- VGASnoop- ParErr- Stepping- SERR- FastB2B- DisINTx+
	Status: Cap+ 66MHz- UDF- FastB2B- ParErr- DEVSEL=fast >TAbort- <TAbort- <MAbort- >SERR- <PERR- INTx-
	Latency: 0, Cache Line Size: 64 bytes
	Interrupt: pin D routed to IRQ 36
	IOMMU group: 11
	Region 0: Memory at eff20000 (64-bit, non-prefetchable) [size=16K]
	Capabilities: <access denied>
	Kernel driver in use: ioatdma

00:05.0 System peripheral [0880]: Intel Corporation Xeon E5/Core i7 Address Map, VTd_Misc, System Management [8086:3c28] (rev 07)
	Subsystem: Hewlett-Packard Company Device [103c:1589]
	Control: I/O- Mem- BusMaster- SpecCycle- MemWINV- VGASnoop- ParErr- Stepping- SERR- FastB2B- DisINTx-
	Status: Cap+ 66MHz- UDF- FastB2B- ParErr- DEVSEL=fast >TAbort- <TAbort- <MAbort- >SERR- <PERR- INTx-
	IOMMU group: 12
	Capabilities: <access denied>

00:05.2 System peripheral [0880]: Intel Corporation Xeon E5/Core i7 Control Status and Global Errors [8086:3c2a] (rev 07)
	Subsystem: Hewlett-Packard Company Device [103c:1589]
	Control: I/O- Mem- BusMaster- SpecCycle- MemWINV- VGASnoop- ParErr- Stepping- SERR- FastB2B- DisINTx-
	Status: Cap+ 66MHz- UDF- FastB2B- ParErr- DEVSEL=fast >TAbort- <TAbort- <MAbort- >SERR- <PERR- INTx-
	IOMMU group: 13
	Capabilities: <access denied>

00:05.4 PIC [0800]: Intel Corporation Xeon E5/Core i7 I/O APIC [8086:3c2c] (rev 07) (prog-if 20 [IO(X)-APIC])
	Subsystem: Intel Corporation Xeon E5/Core i7 I/O APIC [8086:3c2c]
	Control: I/O- Mem+ BusMaster+ SpecCycle- MemWINV- VGASnoop- ParErr- Stepping- SERR- FastB2B- DisINTx-
	Status: Cap+ 66MHz- UDF- FastB2B- ParErr- DEVSEL=fast >TAbort- <TAbort- <MAbort- >SERR- <PERR- INTx-
	Latency: 0, Cache Line Size: 64 bytes
	IOMMU group: 14
	Region 0: Memory at eff46000 (32-bit, non-prefetchable) [size=4K]
	Capabilities: <access denied>

00:11.0 PCI bridge [0604]: Intel Corporation C600/X79 series chipset PCI Express Virtual Root Port [8086:1d3e] (rev 05) (prog-if 00 [Normal decode])
	Control: I/O+ Mem+ BusMaster+ SpecCycle- MemWINV- VGASnoop- ParErr- Stepping- SERR+ FastB2B- DisINTx-
	Status: Cap+ 66MHz- UDF- FastB2B- ParErr- DEVSEL=fast >TAbort- <TAbort- <MAbort- >SERR- <PERR- INTx-
	Latency: 0, Cache Line Size: 64 bytes
	Interrupt: pin A routed to IRQ 16
	IOMMU group: 15
	Bus: primary=00, secondary=02, subordinate=02, sec-latency=0
	I/O behind bridge: 0000d000-0000dfff [size=4K]
	Memory behind bridge: [disabled]
	Prefetchable memory behind bridge: 00000000e0400000-00000000e08fffff [size=5M]
	Secondary status: 66MHz- FastB2B- ParErr- DEVSEL=fast >TAbort- <TAbort- <MAbort+ <SERR- <PERR-
	BridgeCtl: Parity- SERR+ NoISA- VGA- VGA16+ MAbort- >Reset- FastB2B-
		PriDiscTmr- SecDiscTmr- DiscTmrStat- DiscTmrSERREn-
	Capabilities: <access denied>
	Kernel driver in use: pcieport

00:16.0 Communication controller [0780]: Intel Corporation C600/X79 series chipset MEI Controller #1 [8086:1d3a] (rev 05)
	Subsystem: Hewlett-Packard Company Device [103c:1589]
	Control: I/O- Mem+ BusMaster+ SpecCycle- MemWINV- VGASnoop- ParErr- Stepping- SERR- FastB2B- DisINTx+
	Status: Cap+ 66MHz- UDF- FastB2B- ParErr- DEVSEL=fast >TAbort- <TAbort- <MAbort- >SERR- <PERR- INTx-
	Latency: 0
	Interrupt: pin A routed to IRQ 38
	IOMMU group: 16
	Region 0: Memory at eff45000 (64-bit, non-prefetchable) [size=16]
	Capabilities: <access denied>
	Kernel driver in use: mei_me

00:16.2 IDE interface [0101]: Intel Corporation C600/X79 series chipset IDE-r Controller [8086:1d3c] (rev 05) (prog-if 85 [PCI native mode-only controller, supports bus mastering])
	Subsystem: Hewlett-Packard Company Device [103c:1589]
	Control: I/O+ Mem- BusMaster+ SpecCycle- MemWINV- VGASnoop- ParErr- Stepping- SERR- FastB2B- DisINTx-
	Status: Cap+ 66MHz+ UDF- FastB2B+ ParErr- DEVSEL=fast >TAbort- <TAbort- <MAbort- >SERR- <PERR- INTx-
	Latency: 0
	Interrupt: pin C routed to IRQ 18
	IOMMU group: 16
	Region 0: I/O ports at e090 [size=8]
	Region 1: I/O ports at e080 [size=4]
	Region 2: I/O ports at e070 [size=8]
	Region 3: I/O ports at e060 [size=4]
	Region 4: I/O ports at e050 [size=16]
	Capabilities: <access denied>
	Kernel driver in use: ata_generic

00:16.3 Serial controller [0700]: Intel Corporation C600/X79 series chipset KT Controller [8086:1d3d] (rev 05) (prog-if 02 [16550])
	Subsystem: Hewlett-Packard Company Device [103c:1589]
	Control: I/O+ Mem+ BusMaster- SpecCycle- MemWINV- VGASnoop- ParErr- Stepping- SERR- FastB2B- DisINTx-
	Status: Cap+ 66MHz+ UDF- FastB2B+ ParErr- DEVSEL=fast >TAbort- <TAbort- <MAbort- >SERR- <PERR- INTx-
	Interrupt: pin B routed to IRQ 17
	IOMMU group: 16
	Region 0: I/O ports at e040 [size=8]
	Region 1: Memory at eff44000 (32-bit, non-prefetchable) [size=4K]
	Capabilities: <access denied>
	Kernel driver in use: serial

00:19.0 Ethernet controller [0200]: Intel Corporation 82579LM Gigabit Network Connection (Lewisville) [8086:1502] (rev 05)
	DeviceName: Onboard LAN
	Subsystem: Hewlett-Packard Company Device [103c:1589]
	Control: I/O+ Mem+ BusMaster+ SpecCycle- MemWINV- VGASnoop- ParErr- Stepping- SERR- FastB2B- DisINTx+
	Status: Cap+ 66MHz- UDF- FastB2B- ParErr- DEVSEL=fast >TAbort- <TAbort- <MAbort- >SERR- <PERR- INTx-
	Latency: 0
	Interrupt: pin A routed to IRQ 30
	IOMMU group: 17
	Region 0: Memory at eff00000 (32-bit, non-prefetchable) [size=128K]
	Region 1: Memory at eff48000 (32-bit, non-prefetchable) [size=4K]
	Region 2: I/O ports at e020 [size=32]
	Capabilities: <access denied>
	Kernel driver in use: e1000e

00:1a.0 USB controller [0c03]: Intel Corporation C600/X79 series chipset USB2 Enhanced Host Controller #2 [8086:1d2d] (rev 05) (prog-if 20 [EHCI])
	Subsystem: Hewlett-Packard Company Device [103c:1589]
	Control: I/O- Mem+ BusMaster+ SpecCycle- MemWINV- VGASnoop- ParErr- Stepping- SERR+ FastB2B- DisINTx-
	Status: Cap+ 66MHz- UDF- FastB2B+ ParErr- DEVSEL=medium >TAbort- <TAbort- <MAbort- >SERR- <PERR- INTx-
	Latency: 0
	Interrupt: pin A routed to IRQ 16
	IOMMU group: 18
	Region 0: Memory at eff4a000 (32-bit, non-prefetchable) [size=1K]
	Capabilities: <access denied>
	Kernel driver in use: ehci-pci

00:1b.0 Audio device [0403]: Intel Corporation C600/X79 series chipset High Definition Audio Controller [8086:1d20] (rev 05)
	Subsystem: Hewlett-Packard Company Device [103c:1589]
	Control: I/O- Mem+ BusMaster+ SpecCycle- MemWINV- VGASnoop- ParErr- Stepping- SERR+ FastB2B- DisINTx+
	Status: Cap+ 66MHz- UDF- FastB2B- ParErr- DEVSEL=fast >TAbort- <TAbort- <MAbort- >SERR- <PERR- INTx-
	Latency: 0, Cache Line Size: 64 bytes
	Interrupt: pin A routed to IRQ 45
	IOMMU group: 19
	Region 0: Memory at eff40000 (64-bit, non-prefetchable) [size=16K]
	Capabilities: <access denied>
	Kernel driver in use: snd_hda_intel

00:1c.0 PCI bridge [0604]: Intel Corporation C600/X79 series chipset PCI Express Root Port 2 [8086:1d12] (rev b5) (prog-if 00 [Normal decode])
	Control: I/O+ Mem+ BusMaster+ SpecCycle- MemWINV- VGASnoop- ParErr- Stepping- SERR+ FastB2B- DisINTx-
	Status: Cap+ 66MHz- UDF- FastB2B- ParErr- DEVSEL=fast >TAbort- <TAbort- <MAbort- >SERR- <PERR- INTx-
	Latency: 0, Cache Line Size: 64 bytes
	Interrupt: pin B routed to IRQ 16
	IOMMU group: 20
	Bus: primary=00, secondary=01, subordinate=01, sec-latency=0
	I/O behind bridge: [disabled]
	Memory behind bridge: [disabled]
	Prefetchable memory behind bridge: [disabled]
	Secondary status: 66MHz- FastB2B- ParErr- DEVSEL=fast >TAbort- <TAbort- <MAbort+ <SERR- <PERR-
	BridgeCtl: Parity- SERR+ NoISA- VGA- VGA16+ MAbort- >Reset- FastB2B-
		PriDiscTmr- SecDiscTmr- DiscTmrStat- DiscTmrSERREn-
	Capabilities: <access denied>
	Kernel driver in use: pcieport

00:1c.5 PCI bridge [0604]: Intel Corporation C600/X79 series chipset PCI Express Root Port 5 [8086:1d18] (rev b5) (prog-if 00 [Normal decode])
	Control: I/O+ Mem+ BusMaster+ SpecCycle- MemWINV- VGASnoop- ParErr+ Stepping- SERR+ FastB2B- DisINTx-
	Status: Cap+ 66MHz- UDF- FastB2B- ParErr- DEVSEL=fast >TAbort- <TAbort- <MAbort- >SERR- <PERR- INTx-
	Latency: 0, Cache Line Size: 64 bytes
	Interrupt: pin A routed to IRQ 17
	IOMMU group: 21
	Bus: primary=00, secondary=06, subordinate=06, sec-latency=0
	I/O behind bridge: [disabled]
	Memory behind bridge: [disabled]
	Prefetchable memory behind bridge: [disabled]
	Secondary status: 66MHz- FastB2B- ParErr- DEVSEL=fast >TAbort- <TAbort- <MAbort+ <SERR- <PERR-
	BridgeCtl: Parity+ SERR+ NoISA- VGA- VGA16+ MAbort- >Reset- FastB2B-
		PriDiscTmr- SecDiscTmr- DiscTmrStat- DiscTmrSERREn-
	Capabilities: <access denied>
	Kernel driver in use: pcieport

00:1c.6 PCI bridge [0604]: Intel Corporation C600/X79 series chipset PCI Express Root Port 3 [8086:1d14] (rev b5) (prog-if 00 [Normal decode])
	Control: I/O+ Mem+ BusMaster+ SpecCycle- MemWINV- VGASnoop- ParErr+ Stepping- SERR+ FastB2B- DisINTx-
	Status: Cap+ 66MHz- UDF- FastB2B- ParErr- DEVSEL=fast >TAbort- <TAbort- <MAbort- >SERR- <PERR- INTx-
	Latency: 0, Cache Line Size: 64 bytes
	Interrupt: pin C routed to IRQ 18
	IOMMU group: 22
	Bus: primary=00, secondary=07, subordinate=07, sec-latency=0
	I/O behind bridge: [disabled]
	Memory behind bridge: [disabled]
	Prefetchable memory behind bridge: [disabled]
	Secondary status: 66MHz- FastB2B- ParErr- DEVSEL=fast >TAbort- <TAbort- <MAbort+ <SERR- <PERR-
	BridgeCtl: Parity+ SERR+ NoISA- VGA- VGA16+ MAbort- >Reset- FastB2B-
		PriDiscTmr- SecDiscTmr- DiscTmrStat- DiscTmrSERREn-
	Capabilities: <access denied>
	Kernel driver in use: pcieport

00:1c.7 PCI bridge [0604]: Intel Corporation C600/X79 series chipset PCI Express Root Port 4 [8086:1d16] (rev b5) (prog-if 00 [Normal decode])
	Control: I/O+ Mem+ BusMaster+ SpecCycle- MemWINV- VGASnoop- ParErr- Stepping- SERR+ FastB2B- DisINTx-
	Status: Cap+ 66MHz- UDF- FastB2B- ParErr- DEVSEL=fast >TAbort- <TAbort- <MAbort+ >SERR- <PERR- INTx-
	Latency: 0, Cache Line Size: 64 bytes
	Interrupt: pin D routed to IRQ 19
	IOMMU group: 23
	Bus: primary=00, secondary=08, subordinate=08, sec-latency=0
	I/O behind bridge: [disabled]
	Memory behind bridge: efd00000-efdfffff [size=1M]
	Prefetchable memory behind bridge: [disabled]
	Secondary status: 66MHz- FastB2B- ParErr- DEVSEL=fast >TAbort- <TAbort- <MAbort+ <SERR- <PERR-
	BridgeCtl: Parity- SERR+ NoISA- VGA- VGA16+ MAbort- >Reset- FastB2B-
		PriDiscTmr- SecDiscTmr- DiscTmrStat- DiscTmrSERREn-
	Capabilities: <access denied>
	Kernel driver in use: pcieport

00:1d.0 USB controller [0c03]: Intel Corporation C600/X79 series chipset USB2 Enhanced Host Controller #1 [8086:1d26] (rev 05) (prog-if 20 [EHCI])
	Subsystem: Hewlett-Packard Company Device [103c:1589]
	Control: I/O- Mem+ BusMaster+ SpecCycle- MemWINV- VGASnoop- ParErr- Stepping- SERR+ FastB2B- DisINTx-
	Status: Cap+ 66MHz- UDF- FastB2B+ ParErr- DEVSEL=medium >TAbort- <TAbort- <MAbort- >SERR- <PERR- INTx-
	Latency: 0
	Interrupt: pin A routed to IRQ 23
	IOMMU group: 24
	Region 0: Memory at eff49000 (32-bit, non-prefetchable) [size=1K]
	Capabilities: <access denied>
	Kernel driver in use: ehci-pci

00:1e.0 PCI bridge [0604]: Intel Corporation 82801 PCI Bridge [8086:244e] (rev a5) (prog-if 01 [Subtractive decode])
	Control: I/O+ Mem+ BusMaster+ SpecCycle- MemWINV- VGASnoop- ParErr+ Stepping- SERR+ FastB2B- DisINTx-
	Status: Cap+ 66MHz- UDF- FastB2B- ParErr- DEVSEL=fast >TAbort- <TAbort- <MAbort- >SERR- <PERR- INTx-
	Latency: 0
	IOMMU group: 25
	Bus: primary=00, secondary=09, subordinate=09, sec-latency=128
	I/O behind bridge: [disabled]
	Memory behind bridge: efc00000-efcfffff [size=1M]
	Prefetchable memory behind bridge: [disabled]
	Secondary status: 66MHz- FastB2B+ ParErr- DEVSEL=medium >TAbort- <TAbort- <MAbort+ <SERR- <PERR-
	BridgeCtl: Parity+ SERR+ NoISA- VGA- VGA16+ MAbort- >Reset- FastB2B-
		PriDiscTmr- SecDiscTmr- DiscTmrStat- DiscTmrSERREn-
	Capabilities: <access denied>

00:1f.0 ISA bridge [0601]: Intel Corporation C600/X79 series chipset LPC Controller [8086:1d41] (rev 05)
	Subsystem: Hewlett-Packard Company Device [103c:1589]
	Control: I/O+ Mem+ BusMaster+ SpecCycle- MemWINV- VGASnoop- ParErr- Stepping- SERR+ FastB2B- DisINTx-
	Status: Cap+ 66MHz- UDF- FastB2B- ParErr- DEVSEL=medium >TAbort- <TAbort- <MAbort- >SERR- <PERR- INTx-
	Latency: 0
	IOMMU group: 26
	Capabilities: <access denied>
	Kernel driver in use: lpc_ich

00:1f.2 IDE interface [0101]: Intel Corporation C600/X79 series chipset 4-Port SATA IDE Controller [8086:1d00] (rev 05) (prog-if 8a [ISA Compatibility mode controller, supports both channels switched to PCI native mode, supports bus mastering])
	Subsystem: Hewlett-Packard Company Device [103c:1589]
	Control: I/O+ Mem+ BusMaster+ SpecCycle- MemWINV- VGASnoop- ParErr- Stepping- SERR- FastB2B- DisINTx-
	Status: Cap+ 66MHz+ UDF- FastB2B+ ParErr- DEVSEL=medium >TAbort- <TAbort- <MAbort- >SERR- <PERR- INTx-
	Latency: 0
	Interrupt: pin B routed to IRQ 19
	IOMMU group: 26
	Region 0: I/O ports at 01f0 [size=8]
	Region 1: I/O ports at 03f4
	Region 2: I/O ports at 0170 [size=8]
	Region 3: I/O ports at 0374
	Region 4: I/O ports at e110 [size=16]
	Region 5: I/O ports at e100 [size=16]
	Capabilities: <access denied>
	Kernel driver in use: ata_piix

00:1f.3 SMBus [0c05]: Intel Corporation C600/X79 series chipset SMBus Host Controller [8086:1d22] (rev 05)
	Subsystem: Hewlett-Packard Company Device [103c:1589]
	Control: I/O+ Mem+ BusMaster- SpecCycle- MemWINV- VGASnoop- ParErr- Stepping- SERR+ FastB2B- DisINTx-
	Status: Cap- 66MHz- UDF- FastB2B+ ParErr- DEVSEL=medium >TAbort- <TAbort- <MAbort- >SERR- <PERR- INTx-
	Interrupt: pin C routed to IRQ 18
	IOMMU group: 26
	Region 0: Memory at eff47000 (64-bit, non-prefetchable) [size=256]
	Region 4: I/O ports at e000 [size=32]
	Kernel driver in use: i801_smbus

00:1f.5 IDE interface [0101]: Intel Corporation C600/X79 series chipset 2-Port SATA IDE Controller [8086:1d08] (rev 05) (prog-if 85 [PCI native mode-only controller, supports bus mastering])
	Subsystem: Hewlett-Packard Company Device [103c:1589]
	Control: I/O+ Mem- BusMaster+ SpecCycle- MemWINV- VGASnoop- ParErr- Stepping- SERR- FastB2B- DisINTx-
	Status: Cap+ 66MHz+ UDF- FastB2B+ ParErr- DEVSEL=medium >TAbort- <TAbort- <MAbort- >SERR- <PERR- INTx-
	Latency: 0
	Interrupt: pin B routed to IRQ 19
	IOMMU group: 26
	Region 0: I/O ports at e0f0 [size=8]
	Region 1: I/O ports at e0e0 [size=4]
	Region 2: I/O ports at e0d0 [size=8]
	Region 3: I/O ports at e0c0 [size=4]
	Region 4: I/O ports at e0b0 [size=16]
	Region 5: I/O ports at e0a0 [size=16]
	Capabilities: <access denied>
	Kernel driver in use: ata_piix

02:00.0 Serial Attached SCSI controller [0107]: Intel Corporation C602 chipset 4-Port SATA Storage Control Unit [8086:1d6b] (rev 05)
	Subsystem: Hewlett-Packard Company Device [103c:1589]
	Control: I/O+ Mem+ BusMaster+ SpecCycle- MemWINV- VGASnoop- ParErr- Stepping- SERR+ FastB2B- DisINTx+
	Status: Cap+ 66MHz- UDF- FastB2B- ParErr- DEVSEL=fast >TAbort- <TAbort- <MAbort- >SERR- <PERR- INTx-
	Latency: 0, Cache Line Size: 64 bytes
	Interrupt: pin A routed to IRQ 16
	IOMMU group: 28
	Region 0: Memory at e087c000 (64-bit, prefetchable) [size=16K]
	Region 2: Memory at e0400000 (64-bit, prefetchable) [size=4M]
	Region 4: I/O ports at d000 [size=256]
	Capabilities: <access denied>
	Kernel driver in use: isci

05:00.0 VGA compatible controller [0300]: Advanced Micro Devices, Inc. [AMD/ATI] Ellesmere [Radeon RX 470/480/570/570X/580/580X/590] [1002:67df] (rev e7) (prog-if 00 [VGA controller])
	Subsystem: Micro-Star International Co., Ltd. [MSI] Radeon RX 580 Armor 4G OC [1462:3418]
	Physical Slot: 2
	Control: I/O+ Mem+ BusMaster+ SpecCycle- MemWINV- VGASnoop- ParErr- Stepping- SERR+ FastB2B- DisINTx+
	Status: Cap+ 66MHz- UDF- FastB2B- ParErr- DEVSEL=fast >TAbort- <TAbort- <MAbort- >SERR- <PERR- INTx-
	Latency: 0, Cache Line Size: 64 bytes
	Interrupt: pin A routed to IRQ 33
	IOMMU group: 27
	Region 0: Memory at d0000000 (64-bit, prefetchable) [size=256M]
	Region 2: Memory at e0000000 (64-bit, prefetchable) [size=2M]
	Region 4: I/O ports at c000 [size=256]
	Region 5: Memory at efe00000 (32-bit, non-prefetchable) [size=256K]
	Expansion ROM at 000c0000 [disabled] [size=128K]
	Capabilities: <access denied>
	Kernel driver in use: amdgpu

05:00.1 Audio device [0403]: Advanced Micro Devices, Inc. [AMD/ATI] Ellesmere HDMI Audio [Radeon RX 470/480 / 570/580/590] [1002:aaf0]
	Subsystem: Micro-Star International Co., Ltd. [MSI] Device [1462:aaf0]
	Physical Slot: 2
	Control: I/O- Mem+ BusMaster+ SpecCycle- MemWINV- VGASnoop- ParErr- Stepping- SERR+ FastB2B- DisINTx+
	Status: Cap+ 66MHz- UDF- FastB2B- ParErr- DEVSEL=fast >TAbort- <TAbort- <MAbort- >SERR- <PERR- INTx-
	Latency: 0, Cache Line Size: 64 bytes
	Interrupt: pin B routed to IRQ 47
	IOMMU group: 27
	Region 0: Memory at efe60000 (64-bit, non-prefetchable) [size=16K]
	Capabilities: <access denied>
	Kernel driver in use: snd_hda_intel

08:00.0 USB controller [0c03]: Texas Instruments TUSB73x0 SuperSpeed USB 3.0 xHCI Host Controller [104c:8241] (rev 02) (prog-if 30 [XHCI])
	Subsystem: Hewlett-Packard Company Device [103c:1589]
	Control: I/O- Mem+ BusMaster- SpecCycle- MemWINV- VGASnoop- ParErr- Stepping- SERR+ FastB2B- DisINTx-
	Status: Cap+ 66MHz- UDF- FastB2B- ParErr- DEVSEL=fast >TAbort- <TAbort- <MAbort+ >SERR- <PERR- INTx-
	Interrupt: pin A routed to IRQ 19
	IOMMU group: 29
	Region 0: Memory at efd00000 (64-bit, non-prefetchable) [size=64K]
	Region 2: Memory at efd10000 (64-bit, non-prefetchable) [size=8K]
	Capabilities: <access denied>

09:05.0 FireWire (IEEE 1394) [0c00]: LSI Corporation FW322/323 [TrueFire] 1394a Controller [11c1:5811] (rev 70) (prog-if 10 [OHCI])
	Subsystem: Hewlett-Packard Company Device [103c:1589]
	Control: I/O- Mem+ BusMaster+ SpecCycle- MemWINV- VGASnoop- ParErr- Stepping- SERR+ FastB2B- DisINTx-
	Status: Cap+ 66MHz- UDF- FastB2B+ ParErr- DEVSEL=medium >TAbort- <TAbort- <MAbort- >SERR- <PERR- INTx-
	Latency: 128 (3000ns min, 6000ns max), Cache Line Size: 64 bytes
	Interrupt: pin A routed to IRQ 19
	IOMMU group: 25
	Region 0: Memory at efc00000 (32-bit, non-prefetchable) [size=4K]
	Capabilities: <access denied>
	Kernel driver in use: firewire_ohci

7f:08.0 System peripheral [0880]: Intel Corporation Xeon E5/Core i7 QPI Link 0 [8086:3c80] (rev 07)
	Subsystem: Intel Corporation Device [8086:0000]
	Control: I/O- Mem- BusMaster- SpecCycle- MemWINV- VGASnoop- ParErr- Stepping- SERR- FastB2B- DisINTx-
	Status: Cap- 66MHz- UDF- FastB2B- ParErr- DEVSEL=fast >TAbort- <TAbort- <MAbort- >SERR- <PERR- INTx-
	IOMMU group: 30

7f:08.3 System peripheral [0880]: Intel Corporation Xeon E5/Core i7 QPI Link Reut 0 [8086:3c83] (rev 07)
	Subsystem: Intel Corporation Device [8086:0000]
	Control: I/O- Mem- BusMaster- SpecCycle- MemWINV- VGASnoop- ParErr- Stepping- SERR- FastB2B- DisINTx-
	Status: Cap+ 66MHz- UDF- FastB2B- ParErr- DEVSEL=fast >TAbort- <TAbort- <MAbort- >SERR- <PERR- INTx-
	IOMMU group: 31
	Capabilities: <access denied>

7f:08.4 System peripheral [0880]: Intel Corporation Xeon E5/Core i7 QPI Link Reut 0 [8086:3c84] (rev 07)
	Subsystem: Intel Corporation Device [8086:0000]
	Control: I/O- Mem- BusMaster- SpecCycle- MemWINV- VGASnoop- ParErr- Stepping- SERR- FastB2B- DisINTx-
	Status: Cap+ 66MHz- UDF- FastB2B- ParErr- DEVSEL=fast >TAbort- <TAbort- <MAbort- >SERR- <PERR- INTx-
	IOMMU group: 32
	Capabilities: <access denied>

7f:09.0 System peripheral [0880]: Intel Corporation Xeon E5/Core i7 QPI Link 1 [8086:3c90] (rev 07)
	Subsystem: Intel Corporation Device [8086:0000]
	Control: I/O- Mem- BusMaster- SpecCycle- MemWINV- VGASnoop- ParErr- Stepping- SERR- FastB2B- DisINTx-
	Status: Cap- 66MHz- UDF- FastB2B- ParErr- DEVSEL=fast >TAbort- <TAbort- <MAbort- >SERR- <PERR- INTx-
	IOMMU group: 33

7f:09.3 System peripheral [0880]: Intel Corporation Xeon E5/Core i7 QPI Link Reut 1 [8086:3c93] (rev 07)
	Subsystem: Intel Corporation Device [8086:0000]
	Control: I/O- Mem- BusMaster- SpecCycle- MemWINV- VGASnoop- ParErr- Stepping- SERR- FastB2B- DisINTx-
	Status: Cap+ 66MHz- UDF- FastB2B- ParErr- DEVSEL=fast >TAbort- <TAbort- <MAbort- >SERR- <PERR- INTx-
	IOMMU group: 34
	Capabilities: <access denied>

7f:09.4 System peripheral [0880]: Intel Corporation Xeon E5/Core i7 QPI Link Reut 1 [8086:3c94] (rev 07)
	Subsystem: Intel Corporation Device [8086:0000]
	Control: I/O- Mem- BusMaster- SpecCycle- MemWINV- VGASnoop- ParErr- Stepping- SERR- FastB2B- DisINTx-
	Status: Cap+ 66MHz- UDF- FastB2B- ParErr- DEVSEL=fast >TAbort- <TAbort- <MAbort- >SERR- <PERR- INTx-
	IOMMU group: 35
	Capabilities: <access denied>

7f:0a.0 System peripheral [0880]: Intel Corporation Xeon E5/Core i7 Power Control Unit 0 [8086:3cc0] (rev 07)
	Subsystem: Intel Corporation Device [8086:0000]
	Control: I/O- Mem- BusMaster- SpecCycle- MemWINV- VGASnoop- ParErr- Stepping- SERR- FastB2B- DisINTx-
	Status: Cap- 66MHz- UDF- FastB2B- ParErr- DEVSEL=fast >TAbort- <TAbort- <MAbort- >SERR- <PERR- INTx-
	IOMMU group: 36

7f:0a.1 System peripheral [0880]: Intel Corporation Xeon E5/Core i7 Power Control Unit 1 [8086:3cc1] (rev 07)
	Subsystem: Intel Corporation Device [8086:0000]
	Control: I/O- Mem- BusMaster- SpecCycle- MemWINV- VGASnoop- ParErr- Stepping- SERR- FastB2B- DisINTx-
	Status: Cap- 66MHz- UDF- FastB2B- ParErr- DEVSEL=fast >TAbort- <TAbort- <MAbort- >SERR- <PERR- INTx-
	IOMMU group: 36

7f:0a.2 System peripheral [0880]: Intel Corporation Xeon E5/Core i7 Power Control Unit 2 [8086:3cc2] (rev 07)
	Subsystem: Intel Corporation Device [8086:0000]
	Control: I/O- Mem- BusMaster- SpecCycle- MemWINV- VGASnoop- ParErr- Stepping- SERR- FastB2B- DisINTx-
	Status: Cap- 66MHz- UDF- FastB2B- ParErr- DEVSEL=fast >TAbort- <TAbort- <MAbort- >SERR- <PERR- INTx-
	IOMMU group: 36

7f:0a.3 System peripheral [0880]: Intel Corporation Xeon E5/Core i7 Power Control Unit 3 [8086:3cd0] (rev 07)
	Subsystem: Intel Corporation Device [8086:0000]
	Control: I/O- Mem- BusMaster- SpecCycle- MemWINV- VGASnoop- ParErr- Stepping- SERR- FastB2B- DisINTx-
	Status: Cap- 66MHz- UDF- FastB2B- ParErr- DEVSEL=fast >TAbort- <TAbort- <MAbort- >SERR- <PERR- INTx-
	IOMMU group: 36

7f:0b.0 System peripheral [0880]: Intel Corporation Xeon E5/Core i7 Interrupt Control Registers [8086:3ce0] (rev 07)
	Subsystem: Intel Corporation Device [8086:0000]
	Control: I/O- Mem- BusMaster- SpecCycle- MemWINV- VGASnoop- ParErr- Stepping- SERR- FastB2B- DisINTx-
	Status: Cap- 66MHz- UDF- FastB2B- ParErr- DEVSEL=fast >TAbort- <TAbort- <MAbort- >SERR- <PERR- INTx-
	IOMMU group: 37

7f:0b.3 System peripheral [0880]: Intel Corporation Xeon E5/Core i7 Semaphore and Scratchpad Configuration Registers [8086:3ce3] (rev 07)
	Subsystem: Intel Corporation Device [8086:0000]
	Control: I/O- Mem- BusMaster- SpecCycle- MemWINV- VGASnoop- ParErr- Stepping- SERR- FastB2B- DisINTx-
	Status: Cap- 66MHz- UDF- FastB2B- ParErr- DEVSEL=fast >TAbort- <TAbort- <MAbort- >SERR- <PERR- INTx-
	IOMMU group: 37

7f:0c.0 System peripheral [0880]: Intel Corporation Xeon E5/Core i7 Unicast Register 0 [8086:3ce8] (rev 07)
	Subsystem: Intel Corporation Device [8086:0000]
	Control: I/O- Mem- BusMaster- SpecCycle- MemWINV- VGASnoop- ParErr- Stepping- SERR- FastB2B- DisINTx-
	Status: Cap- 66MHz- UDF- FastB2B- ParErr- DEVSEL=fast >TAbort- <TAbort- <MAbort- >SERR- <PERR- INTx-
	IOMMU group: 38

7f:0c.1 System peripheral [0880]: Intel Corporation Xeon E5/Core i7 Unicast Register 0 [8086:3ce8] (rev 07)
	Subsystem: Intel Corporation Device [8086:0000]
	Control: I/O- Mem- BusMaster- SpecCycle- MemWINV- VGASnoop- ParErr- Stepping- SERR- FastB2B- DisINTx-
	Status: Cap- 66MHz- UDF- FastB2B- ParErr- DEVSEL=fast >TAbort- <TAbort- <MAbort- >SERR- <PERR- INTx-
	IOMMU group: 38

7f:0c.6 System peripheral [0880]: Intel Corporation Xeon E5/Core i7 Integrated Memory Controller System Address Decoder 0 [8086:3cf4] (rev 07)
	Subsystem: Intel Corporation Device [8086:0000]
	Control: I/O- Mem- BusMaster- SpecCycle- MemWINV- VGASnoop- ParErr- Stepping- SERR- FastB2B- DisINTx-
	Status: Cap- 66MHz- UDF- FastB2B- ParErr- DEVSEL=fast >TAbort- <TAbort- <MAbort- >SERR- <PERR- INTx-
	IOMMU group: 38

7f:0c.7 System peripheral [0880]: Intel Corporation Xeon E5/Core i7 System Address Decoder [8086:3cf6] (rev 07)
	Subsystem: Intel Corporation Device [8086:0000]
	Control: I/O- Mem- BusMaster- SpecCycle- MemWINV- VGASnoop- ParErr- Stepping- SERR- FastB2B- DisINTx-
	Status: Cap- 66MHz- UDF- FastB2B- ParErr- DEVSEL=fast >TAbort- <TAbort- <MAbort- >SERR- <PERR- INTx-
	IOMMU group: 38

7f:0d.0 System peripheral [0880]: Intel Corporation Xeon E5/Core i7 Unicast Register 0 [8086:3ce8] (rev 07)
	Subsystem: Intel Corporation Device [8086:0000]
	Control: I/O- Mem- BusMaster- SpecCycle- MemWINV- VGASnoop- ParErr- Stepping- SERR- FastB2B- DisINTx-
	Status: Cap- 66MHz- UDF- FastB2B- ParErr- DEVSEL=fast >TAbort- <TAbort- <MAbort- >SERR- <PERR- INTx-
	IOMMU group: 39

7f:0d.1 System peripheral [0880]: Intel Corporation Xeon E5/Core i7 Unicast Register 0 [8086:3ce8] (rev 07)
	Subsystem: Intel Corporation Device [8086:0000]
	Control: I/O- Mem- BusMaster- SpecCycle- MemWINV- VGASnoop- ParErr- Stepping- SERR- FastB2B- DisINTx-
	Status: Cap- 66MHz- UDF- FastB2B- ParErr- DEVSEL=fast >TAbort- <TAbort- <MAbort- >SERR- <PERR- INTx-
	IOMMU group: 39

7f:0d.6 System peripheral [0880]: Intel Corporation Xeon E5/Core i7 Integrated Memory Controller System Address Decoder 1 [8086:3cf5] (rev 07)
	Subsystem: Intel Corporation Device [8086:0000]
	Control: I/O- Mem- BusMaster- SpecCycle- MemWINV- VGASnoop- ParErr- Stepping- SERR- FastB2B- DisINTx-
	Status: Cap- 66MHz- UDF- FastB2B- ParErr- DEVSEL=fast >TAbort- <TAbort- <MAbort- >SERR- <PERR- INTx-
	IOMMU group: 39

7f:0e.0 System peripheral [0880]: Intel Corporation Xeon E5/Core i7 Processor Home Agent [8086:3ca0] (rev 07)
	Control: I/O- Mem- BusMaster- SpecCycle- MemWINV- VGASnoop- ParErr- Stepping- SERR- FastB2B- DisINTx-
	Status: Cap- 66MHz- UDF- FastB2B- ParErr- DEVSEL=fast >TAbort- <TAbort- <MAbort- >SERR- <PERR- INTx-
	IOMMU group: 40

7f:0e.1 Performance counters [1101]: Intel Corporation Xeon E5/Core i7 Processor Home Agent Performance Monitoring [8086:3c46] (rev 07)
	Control: I/O- Mem- BusMaster- SpecCycle- MemWINV- VGASnoop- ParErr- Stepping- SERR- FastB2B- DisINTx-
	Status: Cap- 66MHz- UDF- FastB2B- ParErr- DEVSEL=fast >TAbort- <TAbort- <MAbort- >SERR- <PERR- INTx-
	IOMMU group: 40
	Kernel driver in use: snbep_uncore

7f:0f.0 System peripheral [0880]: Intel Corporation Xeon E5/Core i7 Integrated Memory Controller Registers [8086:3ca8] (rev 07)
	Subsystem: Intel Corporation Device [8086:0000]
	Control: I/O- Mem- BusMaster- SpecCycle- MemWINV- VGASnoop- ParErr- Stepping- SERR- FastB2B- DisINTx-
	Status: Cap+ 66MHz- UDF- FastB2B- ParErr- DEVSEL=fast >TAbort- <TAbort- <MAbort- >SERR- <PERR- INTx-
	IOMMU group: 41
	Capabilities: <access denied>

7f:0f.1 System peripheral [0880]: Intel Corporation Xeon E5/Core i7 Integrated Memory Controller RAS Registers [8086:3c71] (rev 07)
	Subsystem: Intel Corporation Device [8086:0000]
	Control: I/O- Mem- BusMaster- SpecCycle- MemWINV- VGASnoop- ParErr- Stepping- SERR- FastB2B- DisINTx-
	Status: Cap+ 66MHz- UDF- FastB2B- ParErr- DEVSEL=fast >TAbort- <TAbort- <MAbort- >SERR- <PERR- INTx-
	IOMMU group: 42
	Capabilities: <access denied>

7f:0f.2 System peripheral [0880]: Intel Corporation Xeon E5/Core i7 Integrated Memory Controller Target Address Decoder 0 [8086:3caa] (rev 07)
	Subsystem: Intel Corporation Device [8086:0000]
	Control: I/O- Mem- BusMaster- SpecCycle- MemWINV- VGASnoop- ParErr- Stepping- SERR- FastB2B- DisINTx-
	Status: Cap+ 66MHz- UDF- FastB2B- ParErr- DEVSEL=fast >TAbort- <TAbort- <MAbort- >SERR- <PERR- INTx-
	IOMMU group: 43
	Capabilities: <access denied>

7f:0f.3 System peripheral [0880]: Intel Corporation Xeon E5/Core i7 Integrated Memory Controller Target Address Decoder 1 [8086:3cab] (rev 07)
	Subsystem: Intel Corporation Device [8086:0000]
	Control: I/O- Mem- BusMaster- SpecCycle- MemWINV- VGASnoop- ParErr- Stepping- SERR- FastB2B- DisINTx-
	Status: Cap+ 66MHz- UDF- FastB2B- ParErr- DEVSEL=fast >TAbort- <TAbort- <MAbort- >SERR- <PERR- INTx-
	IOMMU group: 44
	Capabilities: <access denied>

7f:0f.4 System peripheral [0880]: Intel Corporation Xeon E5/Core i7 Integrated Memory Controller Target Address Decoder 2 [8086:3cac] (rev 07)
	Subsystem: Intel Corporation Device [8086:0000]
	Control: I/O- Mem- BusMaster- SpecCycle- MemWINV- VGASnoop- ParErr- Stepping- SERR- FastB2B- DisINTx-
	Status: Cap+ 66MHz- UDF- FastB2B- ParErr- DEVSEL=fast >TAbort- <TAbort- <MAbort- >SERR- <PERR- INTx-
	IOMMU group: 45
	Capabilities: <access denied>

7f:0f.5 System peripheral [0880]: Intel Corporation Xeon E5/Core i7 Integrated Memory Controller Target Address Decoder 3 [8086:3cad] (rev 07)
	Subsystem: Intel Corporation Device [8086:0000]
	Control: I/O- Mem- BusMaster- SpecCycle- MemWINV- VGASnoop- ParErr- Stepping- SERR- FastB2B- DisINTx-
	Status: Cap+ 66MHz- UDF- FastB2B- ParErr- DEVSEL=fast >TAbort- <TAbort- <MAbort- >SERR- <PERR- INTx-
	IOMMU group: 46
	Capabilities: <access denied>

7f:0f.6 System peripheral [0880]: Intel Corporation Xeon E5/Core i7 Integrated Memory Controller Target Address Decoder 4 [8086:3cae] (rev 07)
	Subsystem: Intel Corporation Device [8086:0000]
	Control: I/O- Mem- BusMaster- SpecCycle- MemWINV+ VGASnoop- ParErr- Stepping- SERR- FastB2B- DisINTx-
	Status: Cap- 66MHz- UDF- FastB2B- ParErr- DEVSEL=fast >TAbort- <TAbort- <MAbort- >SERR- <PERR- INTx-
	IOMMU group: 47

7f:10.0 System peripheral [0880]: Intel Corporation Xeon E5/Core i7 Integrated Memory Controller Channel 0-3 Thermal Control 0 [8086:3cb0] (rev 07)
	Subsystem: Intel Corporation Device [8086:0000]
	Control: I/O- Mem- BusMaster- SpecCycle- MemWINV- VGASnoop- ParErr- Stepping- SERR- FastB2B- DisINTx-
	Status: Cap+ 66MHz- UDF- FastB2B- ParErr- DEVSEL=fast >TAbort- <TAbort- <MAbort- >SERR- <PERR- INTx-
	IOMMU group: 48
	Capabilities: <access denied>
	Kernel driver in use: snbep_uncore

7f:10.1 System peripheral [0880]: Intel Corporation Xeon E5/Core i7 Integrated Memory Controller Channel 0-3 Thermal Control 1 [8086:3cb1] (rev 07)
	Subsystem: Intel Corporation Device [8086:0000]
	Control: I/O- Mem- BusMaster- SpecCycle- MemWINV- VGASnoop- ParErr- Stepping- SERR- FastB2B- DisINTx-
	Status: Cap+ 66MHz- UDF- FastB2B- ParErr- DEVSEL=fast >TAbort- <TAbort- <MAbort- >SERR- <PERR- INTx-
	IOMMU group: 49
	Capabilities: <access denied>
	Kernel driver in use: snbep_uncore

7f:10.2 System peripheral [0880]: Intel Corporation Xeon E5/Core i7 Integrated Memory Controller ERROR Registers 0 [8086:3cb2] (rev 07)
	Subsystem: Intel Corporation Device [8086:0000]
	Control: I/O- Mem- BusMaster- SpecCycle- MemWINV- VGASnoop- ParErr- Stepping- SERR- FastB2B- DisINTx-
	Status: Cap+ 66MHz- UDF- FastB2B- ParErr- DEVSEL=fast >TAbort- <TAbort- <MAbort- >SERR- <PERR- INTx-
	IOMMU group: 50
	Capabilities: <access denied>

7f:10.3 System peripheral [0880]: Intel Corporation Xeon E5/Core i7 Integrated Memory Controller ERROR Registers 1 [8086:3cb3] (rev 07)
	Subsystem: Intel Corporation Device [8086:0000]
	Control: I/O- Mem- BusMaster- SpecCycle- MemWINV- VGASnoop- ParErr- Stepping- SERR- FastB2B- DisINTx-
	Status: Cap+ 66MHz- UDF- FastB2B- ParErr- DEVSEL=fast >TAbort- <TAbort- <MAbort- >SERR- <PERR- INTx-
	IOMMU group: 51
	Capabilities: <access denied>

7f:10.4 System peripheral [0880]: Intel Corporation Xeon E5/Core i7 Integrated Memory Controller Channel 0-3 Thermal Control 2 [8086:3cb4] (rev 07)
	Subsystem: Intel Corporation Device [8086:0000]
	Control: I/O- Mem- BusMaster- SpecCycle- MemWINV- VGASnoop- ParErr- Stepping- SERR- FastB2B- DisINTx-
	Status: Cap+ 66MHz- UDF- FastB2B- ParErr- DEVSEL=fast >TAbort- <TAbort- <MAbort- >SERR- <PERR- INTx-
	IOMMU group: 52
	Capabilities: <access denied>
	Kernel driver in use: snbep_uncore

7f:10.5 System peripheral [0880]: Intel Corporation Xeon E5/Core i7 Integrated Memory Controller Channel 0-3 Thermal Control 3 [8086:3cb5] (rev 07)
	Subsystem: Intel Corporation Device [8086:0000]
	Control: I/O- Mem- BusMaster- SpecCycle- MemWINV- VGASnoop- ParErr- Stepping- SERR- FastB2B- DisINTx-
	Status: Cap+ 66MHz- UDF- FastB2B- ParErr- DEVSEL=fast >TAbort- <TAbort- <MAbort- >SERR- <PERR- INTx-
	IOMMU group: 53
	Capabilities: <access denied>
	Kernel driver in use: snbep_uncore

7f:10.6 System peripheral [0880]: Intel Corporation Xeon E5/Core i7 Integrated Memory Controller ERROR Registers 2 [8086:3cb6] (rev 07)
	Subsystem: Intel Corporation Device [8086:0000]
	Control: I/O- Mem- BusMaster- SpecCycle- MemWINV- VGASnoop- ParErr- Stepping- SERR- FastB2B- DisINTx-
	Status: Cap+ 66MHz- UDF- FastB2B- ParErr- DEVSEL=fast >TAbort- <TAbort- <MAbort- >SERR- <PERR- INTx-
	IOMMU group: 54
	Capabilities: <access denied>

7f:10.7 System peripheral [0880]: Intel Corporation Xeon E5/Core i7 Integrated Memory Controller ERROR Registers 3 [8086:3cb7] (rev 07)
	Subsystem: Intel Corporation Device [8086:0000]
	Control: I/O- Mem- BusMaster- SpecCycle- MemWINV- VGASnoop- ParErr- Stepping- SERR- FastB2B- DisINTx-
	Status: Cap+ 66MHz- UDF- FastB2B- ParErr- DEVSEL=fast >TAbort- <TAbort- <MAbort- >SERR- <PERR- INTx-
	IOMMU group: 55
	Capabilities: <access denied>

7f:11.0 System peripheral [0880]: Intel Corporation Xeon E5/Core i7 DDRIO [8086:3cb8] (rev 07)
	Subsystem: Intel Corporation Device [8086:0000]
	Control: I/O- Mem- BusMaster- SpecCycle- MemWINV+ VGASnoop- ParErr- Stepping- SERR- FastB2B- DisINTx-
	Status: Cap- 66MHz- UDF- FastB2B- ParErr- DEVSEL=fast >TAbort- <TAbort- <MAbort- >SERR- <PERR- INTx-
	IOMMU group: 56

7f:13.0 System peripheral [0880]: Intel Corporation Xeon E5/Core i7 R2PCIe [8086:3ce4] (rev 07)
	Subsystem: Intel Corporation Device [8086:0000]
	Control: I/O- Mem- BusMaster- SpecCycle- MemWINV- VGASnoop- ParErr- Stepping- SERR- FastB2B- DisINTx-
	Status: Cap- 66MHz- UDF- FastB2B- ParErr- DEVSEL=fast >TAbort- <TAbort- <MAbort- >SERR- <PERR- INTx-
	IOMMU group: 57

7f:13.1 Performance counters [1101]: Intel Corporation Xeon E5/Core i7 Ring to PCI Express Performance Monitor [8086:3c43] (rev 07)
	Subsystem: Intel Corporation Device [8086:0000]
	Control: I/O- Mem- BusMaster- SpecCycle- MemWINV- VGASnoop- ParErr- Stepping- SERR- FastB2B- DisINTx-
	Status: Cap- 66MHz- UDF- FastB2B- ParErr- DEVSEL=fast >TAbort- <TAbort- <MAbort- >SERR- <PERR- INTx-
	IOMMU group: 57
	Kernel driver in use: snbep_uncore

7f:13.4 Performance counters [1101]: Intel Corporation Xeon E5/Core i7 QuickPath Interconnect Agent Ring Registers [8086:3ce6] (rev 07)
	Subsystem: Intel Corporation Device [8086:0000]
	Control: I/O- Mem- BusMaster- SpecCycle- MemWINV- VGASnoop- ParErr- Stepping- SERR- FastB2B- DisINTx-
	Status: Cap- 66MHz- UDF- FastB2B- ParErr- DEVSEL=fast >TAbort- <TAbort- <MAbort- >SERR- <PERR- INTx-
	IOMMU group: 57

7f:13.5 Performance counters [1101]: Intel Corporation Xeon E5/Core i7 Ring to QuickPath Interconnect Link 0 Performance Monitor [8086:3c44] (rev 07)
	Subsystem: Intel Corporation Device [8086:0000]
	Control: I/O- Mem- BusMaster- SpecCycle- MemWINV- VGASnoop- ParErr- Stepping- SERR- FastB2B- DisINTx-
	Status: Cap- 66MHz- UDF- FastB2B- ParErr- DEVSEL=fast >TAbort- <TAbort- <MAbort- >SERR- <PERR- INTx-
	IOMMU group: 57
	Kernel driver in use: snbep_uncore

7f:13.6 System peripheral [0880]: Intel Corporation Xeon E5/Core i7 Ring to QuickPath Interconnect Link 1 Performance Monitor [8086:3c45] (rev 07)
	Subsystem: Intel Corporation Device [8086:0000]
	Control: I/O- Mem- BusMaster- SpecCycle- MemWINV- VGASnoop- ParErr- Stepping- SERR- FastB2B- DisINTx-
	Status: Cap- 66MHz- UDF- FastB2B- ParErr- DEVSEL=fast >TAbort- <TAbort- <MAbort- >SERR- <PERR- INTx-
	IOMMU group: 57
	Kernel driver in use: snbep_uncore

