00:00.0 Host bridge [0600]: Intel Corporation 82Q35 Express DRAM Controller [8086:29b0] (rev 02)
	Subsystem: Intel Corporation 82Q35 Express DRAM Controller [8086:29b0]
	Control: I/O- Mem+ BusMaster+ SpecCycle- MemWINV- VGASnoop- ParErr- Stepping- SERR- FastB2B- DisINTx-
	Status: Cap+ 66MHz- UDF- FastB2B+ ParErr- DEVSEL=fast >TAbort- <TAbort- <MAbort+ >SERR- <PERR- INTx-
	Latency: 0
	Capabilities: <access denied>

00:01.0 PCI bridge [0604]: Intel Corporation 82Q35 Express PCI Express Root Port [8086:29b1] (rev 02) (prog-if 00 [Normal decode])
	Control: I/O+ Mem+ BusMaster+ SpecCycle- MemWINV- VGASnoop- ParErr- Stepping- SERR+ FastB2B- DisINTx+
	Status: Cap+ 66MHz- UDF- FastB2B- ParErr- DEVSEL=fast >TAbort- <TAbort- <MAbort- >SERR- <PERR- INTx-
	Latency: 0, Cache Line Size: 32 bytes
	Interrupt: pin A routed to IRQ 24
	Bus: primary=00, secondary=01, subordinate=01, sec-latency=0
	I/O behind bridge: None
	Memory behind bridge: feb00000-febfffff [size=1M]
	Prefetchable memory behind bridge: 00000000f0000000-00000000f7ffffff [size=128M]
	Secondary status: 66MHz- FastB2B- ParErr- DEVSEL=fast >TAbort- <TAbort- <MAbort+ <SERR- <PERR-
	BridgeCtl: Parity- SERR+ NoISA- VGA+ VGA16+ MAbort- >Reset- FastB2B-
		PriDiscTmr- SecDiscTmr- DiscTmrStat- DiscTmrSERREn-
	Capabilities: <access denied>
	Kernel driver in use: pcieport

00:03.0 Communication controller [0780]: Intel Corporation 82Q35 Express MEI Controller [8086:29b4] (rev 02)
	Subsystem: Intel Corporation 82Q35 Express MEI Controller [8086:29b4]
	Control: I/O- Mem+ BusMaster+ SpecCycle- MemWINV- VGASnoop- ParErr- Stepping- SERR- FastB2B- DisINTx+
	Status: Cap+ 66MHz- UDF- FastB2B- ParErr- DEVSEL=fast >TAbort- <TAbort- <MAbort- >SERR- <PERR- INTx-
	Latency: 0
	Interrupt: pin A routed to IRQ 27
	Region 0: Memory at feaffc00 (64-bit, non-prefetchable) [size=16]
	Capabilities: <access denied>
	Kernel driver in use: mei_me
	Kernel modules: mei_me

00:19.0 Ethernet controller [0200]: Intel Corporation 82566DM-2 Gigabit Network Connection [8086:10bd] (rev 02)
	Subsystem: Intel Corporation Device [8086:0000]
	Control: I/O+ Mem+ BusMaster+ SpecCycle- MemWINV- VGASnoop- ParErr- Stepping- SERR- FastB2B- DisINTx+
	Status: Cap+ 66MHz- UDF- FastB2B- ParErr- DEVSEL=fast >TAbort- <TAbort- <MAbort- >SERR- <PERR- INTx-
	Latency: 0
	Interrupt: pin A routed to IRQ 25
	Region 0: Memory at feac0000 (32-bit, non-prefetchable) [size=128K]
	Region 1: Memory at feafe000 (32-bit, non-prefetchable) [size=4K]
	Region 2: I/O ports at ec00 [size=32]
	Capabilities: <access denied>
	Kernel driver in use: e1000e
	Kernel modules: e1000e

00:1a.0 USB controller [0c03]: Intel Corporation 82801I (ICH9 Family) USB UHCI Controller #4 [8086:2937] (rev 02) (prog-if 00 [UHCI])
	Subsystem: Intel Corporation Optiplex 755 [8086:2937]
	Control: I/O+ Mem- BusMaster+ SpecCycle- MemWINV- VGASnoop- ParErr- Stepping- SERR- FastB2B- DisINTx-
	Status: Cap+ 66MHz- UDF- FastB2B+ ParErr- DEVSEL=medium >TAbort- <TAbort- <MAbort- >SERR- <PERR- INTx-
	Latency: 0
	Interrupt: pin A routed to IRQ 16
	Region 4: I/O ports at e880 [size=32]
	Capabilities: <access denied>
	Kernel driver in use: uhci_hcd

00:1a.1 USB controller [0c03]: Intel Corporation 82801I (ICH9 Family) USB UHCI Controller #5 [8086:2938] (rev 02) (prog-if 00 [UHCI])
	Subsystem: Intel Corporation Optiplex 755 [8086:2938]
	Control: I/O+ Mem- BusMaster+ SpecCycle- MemWINV- VGASnoop- ParErr- Stepping- SERR- FastB2B- DisINTx-
	Status: Cap+ 66MHz- UDF- FastB2B+ ParErr- DEVSEL=medium >TAbort- <TAbort- <MAbort- >SERR- <PERR- INTx-
	Latency: 0
	Interrupt: pin B routed to IRQ 21
	Region 4: I/O ports at e800 [size=32]
	Capabilities: <access denied>
	Kernel driver in use: uhci_hcd

00:1a.2 USB controller [0c03]: Intel Corporation 82801I (ICH9 Family) USB UHCI Controller #6 [8086:2939] (rev 02) (prog-if 00 [UHCI])
	Subsystem: Intel Corporation 82801I (ICH9 Family) USB UHCI Controller #6 [8086:2939]
	Control: I/O+ Mem- BusMaster+ SpecCycle- MemWINV- VGASnoop- ParErr- Stepping- SERR- FastB2B- DisINTx-
	Status: Cap+ 66MHz- UDF- FastB2B+ ParErr- DEVSEL=medium >TAbort- <TAbort- <MAbort- >SERR- <PERR- INTx-
	Latency: 0
	Interrupt: pin D routed to IRQ 19
	Region 4: I/O ports at e480 [size=32]
	Capabilities: <access denied>
	Kernel driver in use: uhci_hcd

00:1a.7 USB controller [0c03]: Intel Corporation 82801I (ICH9 Family) USB2 EHCI Controller #2 [8086:293c] (rev 02) (prog-if 20 [EHCI])
	Subsystem: Intel Corporation Optiplex 755 [8086:293c]
	Control: I/O- Mem+ BusMaster+ SpecCycle- MemWINV- VGASnoop- ParErr- Stepping- SERR- FastB2B- DisINTx-
	Status: Cap+ 66MHz- UDF- FastB2B+ ParErr- DEVSEL=medium >TAbort- <TAbort- <MAbort- >SERR- <PERR- INTx-
	Latency: 0
	Interrupt: pin C routed to IRQ 18
	Region 0: Memory at feaff800 (32-bit, non-prefetchable) [size=1K]
	Capabilities: <access denied>
	Kernel driver in use: ehci-pci

00:1b.0 Audio device [0403]: Intel Corporation 82801I (ICH9 Family) HD Audio Controller [8086:293e] (rev 02)
	Subsystem: Intel Corporation Optiplex 755 [8086:293e]
	Control: I/O- Mem+ BusMaster+ SpecCycle- MemWINV- VGASnoop- ParErr- Stepping- SERR- FastB2B- DisINTx+
	Status: Cap+ 66MHz- UDF- FastB2B- ParErr- DEVSEL=fast >TAbort- <TAbort- <MAbort- >SERR- <PERR- INTx-
	Latency: 0, Cache Line Size: 32 bytes
	Interrupt: pin A routed to IRQ 28
	Region 0: Memory at feaf8000 (64-bit, non-prefetchable) [size=16K]
	Capabilities: <access denied>
	Kernel driver in use: snd_hda_intel
	Kernel modules: snd_hda_intel

00:1d.0 USB controller [0c03]: Intel Corporation 82801I (ICH9 Family) USB UHCI Controller #1 [8086:2934] (rev 02) (prog-if 00 [UHCI])
	Subsystem: Intel Corporation 82801I (ICH9 Family) USB UHCI Controller #1 [8086:2934]
	Control: I/O+ Mem- BusMaster+ SpecCycle- MemWINV- VGASnoop- ParErr- Stepping- SERR- FastB2B- DisINTx-
	Status: Cap+ 66MHz- UDF- FastB2B+ ParErr- DEVSEL=medium >TAbort- <TAbort- <MAbort- >SERR- <PERR- INTx-
	Latency: 0
	Interrupt: pin A routed to IRQ 23
	Region 4: I/O ports at e400 [size=32]
	Capabilities: <access denied>
	Kernel driver in use: uhci_hcd

00:1d.1 USB controller [0c03]: Intel Corporation 82801I (ICH9 Family) USB UHCI Controller #2 [8086:2935] (rev 02) (prog-if 00 [UHCI])
	Subsystem: Intel Corporation 82801I (ICH9 Family) USB UHCI Controller #2 [8086:2935]
	Control: I/O+ Mem- BusMaster+ SpecCycle- MemWINV- VGASnoop- ParErr- Stepping- SERR- FastB2B- DisINTx-
	Status: Cap+ 66MHz- UDF- FastB2B+ ParErr- DEVSEL=medium >TAbort- <TAbort- <MAbort- >SERR- <PERR- INTx-
	Latency: 0
	Interrupt: pin B routed to IRQ 19
	Region 4: I/O ports at e080 [size=32]
	Capabilities: <access denied>
	Kernel driver in use: uhci_hcd

00:1d.2 USB controller [0c03]: Intel Corporation 82801I (ICH9 Family) USB UHCI Controller #3 [8086:2936] (rev 02) (prog-if 00 [UHCI])
	Subsystem: Intel Corporation 82801I (ICH9 Family) USB UHCI Controller #3 [8086:2936]
	Control: I/O+ Mem- BusMaster+ SpecCycle- MemWINV- VGASnoop- ParErr- Stepping- SERR- FastB2B- DisINTx-
	Status: Cap+ 66MHz- UDF- FastB2B+ ParErr- DEVSEL=medium >TAbort- <TAbort- <MAbort- >SERR- <PERR- INTx-
	Latency: 0
	Interrupt: pin C routed to IRQ 18
	Region 4: I/O ports at e000 [size=32]
	Capabilities: <access denied>
	Kernel driver in use: uhci_hcd

00:1d.7 USB controller [0c03]: Intel Corporation 82801I (ICH9 Family) USB2 EHCI Controller #1 [8086:293a] (rev 02) (prog-if 20 [EHCI])
	Subsystem: Intel Corporation 82801I (ICH9 Family) USB2 EHCI Controller #1 [8086:293a]
	Control: I/O- Mem+ BusMaster+ SpecCycle- MemWINV- VGASnoop- ParErr- Stepping- SERR- FastB2B- DisINTx-
	Status: Cap+ 66MHz- UDF- FastB2B+ ParErr- DEVSEL=medium >TAbort- <TAbort- <MAbort- >SERR- <PERR- INTx-
	Latency: 0
	Interrupt: pin A routed to IRQ 23
	Region 0: Memory at feaff400 (32-bit, non-prefetchable) [size=1K]
	Capabilities: <access denied>
	Kernel driver in use: ehci-pci

00:1e.0 PCI bridge [0604]: Intel Corporation 82801 PCI Bridge [8086:244e] (rev 92) (prog-if 01 [Subtractive decode])
	Control: I/O- Mem- BusMaster+ SpecCycle- MemWINV- VGASnoop- ParErr- Stepping- SERR+ FastB2B- DisINTx-
	Status: Cap+ 66MHz- UDF- FastB2B- ParErr- DEVSEL=fast >TAbort- <TAbort- <MAbort- >SERR- <PERR- INTx-
	Latency: 0
	Bus: primary=00, secondary=02, subordinate=02, sec-latency=32
	I/O behind bridge: None
	Memory behind bridge: None
	Prefetchable memory behind bridge: None
	Secondary status: 66MHz- FastB2B+ ParErr- DEVSEL=medium >TAbort- <TAbort- <MAbort+ <SERR- <PERR-
	BridgeCtl: Parity- SERR+ NoISA+ VGA- VGA16- MAbort- >Reset- FastB2B-
		PriDiscTmr- SecDiscTmr- DiscTmrStat- DiscTmrSERREn-
	Capabilities: <access denied>

00:1f.0 ISA bridge [0601]: Intel Corporation 82801IO (ICH9DO) LPC Interface Controller [8086:2914] (rev 02)
	Subsystem: Intel Corporation 82801IO (ICH9DO) LPC Interface Controller [8086:2914]
	Control: I/O+ Mem+ BusMaster+ SpecCycle- MemWINV- VGASnoop- ParErr- Stepping- SERR- FastB2B- DisINTx-
	Status: Cap+ 66MHz- UDF- FastB2B- ParErr- DEVSEL=medium >TAbort- <TAbort- <MAbort- >SERR- <PERR- INTx-
	Latency: 0
	Capabilities: <access denied>
	Kernel driver in use: lpc_ich
	Kernel modules: lpc_ich

00:1f.2 RAID bus controller [0104]: Intel Corporation SATA Controller [RAID mode] [8086:2822] (rev 02)
	Subsystem: Intel Corporation SATA Controller [RAID mode] [8086:2822]
	Control: I/O+ Mem+ BusMaster+ SpecCycle- MemWINV- VGASnoop- ParErr- Stepping- SERR- FastB2B- DisINTx+
	Status: Cap+ 66MHz+ UDF- FastB2B+ ParErr- DEVSEL=medium >TAbort- <TAbort- <MAbort- >SERR- <PERR- INTx-
	Latency: 0
	Interrupt: pin B routed to IRQ 26
	Region 0: I/O ports at dc00 [size=8]
	Region 1: I/O ports at d880 [size=4]
	Region 2: I/O ports at d800 [size=8]
	Region 3: I/O ports at d480 [size=4]
	Region 4: I/O ports at d400 [size=32]
	Region 5: Memory at feafd800 (32-bit, non-prefetchable) [size=2K]
	Capabilities: <access denied>
	Kernel driver in use: ahci
	Kernel modules: ahci

00:1f.3 SMBus [0c05]: Intel Corporation 82801I (ICH9 Family) SMBus Controller [8086:2930] (rev 02)
	Subsystem: Intel Corporation 82801I (ICH9 Family) SMBus Controller [8086:2930]
	Control: I/O+ Mem+ BusMaster- SpecCycle- MemWINV- VGASnoop- ParErr- Stepping- SERR- FastB2B- DisINTx-
	Status: Cap- 66MHz- UDF- FastB2B+ ParErr- DEVSEL=medium >TAbort- <TAbort- <MAbort- >SERR- <PERR- INTx-
	Interrupt: pin C routed to IRQ 18
	Region 0: Memory at feaff000 (64-bit, non-prefetchable) [size=256]
	Region 4: I/O ports at 0400 [size=32]
	Kernel driver in use: i801_smbus
	Kernel modules: i2c_i801

00:1f.6 Signal processing controller [1180]: Intel Corporation 82801I (ICH9 Family) Thermal Subsystem [8086:2932] (rev 02)
	Subsystem: Intel Corporation 82801I (ICH9 Family) Thermal Subsystem [8086:2932]
	Control: I/O- Mem+ BusMaster- SpecCycle- MemWINV- VGASnoop- ParErr- Stepping- SERR- FastB2B- DisINTx-
	Status: Cap+ 66MHz- UDF- FastB2B- ParErr- DEVSEL=fast >TAbort- <TAbort- <MAbort- >SERR- <PERR- INTx-
	Interrupt: pin C routed to IRQ 0
	Region 0: Memory at fed08000 (64-bit, non-prefetchable) [size=4K]
	Capabilities: <access denied>

01:00.0 VGA compatible controller [0300]: Matrox Electronics Systems Ltd. Millennium P650 PCIe [102b:2538] (rev 02) (prog-if 00 [VGA controller])
	Subsystem: Matrox Electronics Systems Ltd. Parhelia APVe [102b:0947]
	Control: I/O+ Mem+ BusMaster+ SpecCycle- MemWINV- VGASnoop- ParErr- Stepping- SERR- FastB2B- DisINTx-
	Status: Cap+ 66MHz- UDF- FastB2B- ParErr- DEVSEL=fast >TAbort- <TAbort- <MAbort- >SERR- <PERR- INTx-
	Latency: 0, Cache Line Size: 32 bytes
	Interrupt: pin A routed to IRQ 10
	Region 0: Memory at f0000000 (64-bit, prefetchable) [size=128M]
	Region 2: Memory at febfe000 (64-bit, non-prefetchable) [size=8K]
	Expansion ROM at 000c0000 [disabled] [size=128K]
	Capabilities: <access denied>

