00:00.0 Host bridge [0600]: Silicon Integrated Systems [SiS] 661FX/M661FX/M661MX Host [1039:0661] (rev 11)
	Subsystem: Foxconn International, Inc. 661FX/M661FX/M661MX Host [105b:0c4c]
	Control: I/O+ Mem+ BusMaster+ SpecCycle- MemWINV- VGASnoop- ParErr- Stepping- SERR- FastB2B- DisINTx-
	Status: Cap+ 66MHz- UDF- FastB2B- ParErr- DEVSEL=medium >TAbort- <TAbort- <MAbort+ >SERR- <PERR- INTx-
	Latency: 32
	Region 0: Memory at e0000000 (32-bit, non-prefetchable) [size=128M]
	Capabilities: [c0] AGP version 3.5
		Status: RQ=32 Iso- ArqSz=2 Cal=3 SBA+ ITACoh- GART64- HTrans- 64bit- FW+ AGP3+ Rate=x4,x8
		Command: RQ=1 ArqSz=0 Cal=0 SBA- AGP- GART64- 64bit- FW- Rate=<none>
	Kernel driver in use: agpgart-sis
	Kernel modules: sis_agp

00:01.0 PCI bridge [0604]: Silicon Integrated Systems [SiS] AGP Port (virtual PCI-to-PCI bridge) [1039:0003] (prog-if 00 [Normal decode])
	Control: I/O+ Mem+ BusMaster+ SpecCycle- MemWINV- VGASnoop- ParErr- Stepping- SERR+ FastB2B- DisINTx-
	Status: Cap- 66MHz+ UDF- FastB2B- ParErr- DEVSEL=fast >TAbort- <TAbort- <MAbort- >SERR- <PERR- INTx-
	Latency: 64
	Bus: primary=00, secondary=01, subordinate=01, sec-latency=32
	I/O behind bridge: [disabled] [16-bit]
	Memory behind bridge: e8000000-eaffffff [size=48M] [32-bit]
	Prefetchable memory behind bridge: d0000000-dfffffff [size=256M] [32-bit]
	Secondary status: 66MHz+ FastB2B- ParErr- DEVSEL=fast >TAbort- <TAbort- <MAbort+ <SERR- <PERR-
	BridgeCtl: Parity- SERR+ NoISA+ VGA+ VGA16- MAbort- >Reset- FastB2B-
		PriDiscTmr- SecDiscTmr- DiscTmrStat- DiscTmrSERREn-

00:02.0 ISA bridge [0601]: Silicon Integrated Systems [SiS] SiS964 [MuTIOL Media IO] LPC Controller [1039:0964] (rev 36)
	Control: I/O+ Mem+ BusMaster+ SpecCycle+ MemWINV- VGASnoop- ParErr- Stepping- SERR- FastB2B- DisINTx-
	Status: Cap- 66MHz- UDF- FastB2B- ParErr- DEVSEL=medium >TAbort- <TAbort- <MAbort- >SERR- <PERR- INTx-
	Latency: 0
	Kernel modules: i2c_sis630

00:02.5 IDE interface [0101]: Silicon Integrated Systems [SiS] 5513 IDE Controller [1039:5513] (rev 01) (prog-if 8a [ISA Compatibility mode controller, supports both channels switched to PCI native mode, supports bus mastering])
	Subsystem: Foxconn International, Inc. 5513 IDE Controller [105b:0c4c]
	Control: I/O+ Mem- BusMaster+ SpecCycle- MemWINV- VGASnoop- ParErr- Stepping- SERR- FastB2B- DisINTx-
	Status: Cap+ 66MHz- UDF- FastB2B- ParErr- DEVSEL=medium >TAbort- <TAbort- <MAbort- >SERR- <PERR- INTx-
	Latency: 128
	Interrupt: pin ? routed to IRQ 16
	Region 0: I/O ports at 01f0 [size=8]
	Region 1: I/O ports at 03f4
	Region 2: I/O ports at 0170 [size=8]
	Region 3: I/O ports at 0374
	Region 4: I/O ports at 4000 [size=16]
	Capabilities: [58] Power Management version 2
		Flags: PMEClk- DSI- D1- D2- AuxCurrent=0mA PME(D0-,D1-,D2-,D3hot-,D3cold+)
		Status: D0 NoSoftRst- PME-Enable- DSel=0 DScale=0 PME-
	Kernel driver in use: pata_sis
	Kernel modules: pata_sis, pata_acpi, ata_generic

00:02.7 Multimedia audio controller [0401]: Silicon Integrated Systems [SiS] SiS7012 AC'97 Sound Controller [1039:7012] (rev a0)
	Subsystem: Foxconn International, Inc. SiS7012 AC'97 Sound Controller [105b:0c4c]
	Control: I/O+ Mem- BusMaster+ SpecCycle- MemWINV- VGASnoop- ParErr- Stepping- SERR- FastB2B- DisINTx-
	Status: Cap+ 66MHz- UDF- FastB2B+ ParErr- DEVSEL=medium >TAbort- <TAbort- <MAbort- >SERR- <PERR- INTx-
	Latency: 32 (13000ns min, 2750ns max)
	Interrupt: pin C routed to IRQ 18
	Region 0: I/O ports at d000 [size=256]
	Region 1: I/O ports at d400 [size=128]
	Capabilities: [48] Power Management version 2
		Flags: PMEClk- DSI- D1+ D2+ AuxCurrent=55mA PME(D0-,D1-,D2-,D3hot+,D3cold+)
		Status: D0 NoSoftRst- PME-Enable- DSel=0 DScale=0 PME-
	Kernel driver in use: snd_intel8x0
	Kernel modules: snd_intel8x0

00:03.0 USB controller [0c03]: Silicon Integrated Systems [SiS] USB 1.1 Controller [1039:7001] (rev 0f) (prog-if 10 [OHCI])
	Subsystem: Foxconn International, Inc. USB 1.1 Controller [105b:0c4c]
	Control: I/O+ Mem+ BusMaster+ SpecCycle- MemWINV- VGASnoop- ParErr- Stepping- SERR- FastB2B- DisINTx-
	Status: Cap- 66MHz- UDF- FastB2B+ ParErr- DEVSEL=medium >TAbort- <TAbort- <MAbort- >SERR- <PERR- INTx-
	Latency: 32 (20000ns max), Cache Line Size: 32 bytes
	Interrupt: pin A routed to IRQ 20
	Region 0: Memory at ec004000 (32-bit, non-prefetchable) [size=4K]
	Kernel driver in use: ohci-pci
	Kernel modules: ohci_pci

00:03.1 USB controller [0c03]: Silicon Integrated Systems [SiS] USB 1.1 Controller [1039:7001] (rev 0f) (prog-if 10 [OHCI])
	Subsystem: Foxconn International, Inc. USB 1.1 Controller [105b:0c4c]
	Control: I/O+ Mem+ BusMaster+ SpecCycle- MemWINV- VGASnoop- ParErr- Stepping- SERR- FastB2B- DisINTx-
	Status: Cap- 66MHz- UDF- FastB2B+ ParErr- DEVSEL=medium >TAbort- <TAbort- <MAbort- >SERR- <PERR- INTx-
	Latency: 32 (20000ns max), Cache Line Size: 32 bytes
	Interrupt: pin B routed to IRQ 21
	Region 0: Memory at ec000000 (32-bit, non-prefetchable) [size=4K]
	Kernel driver in use: ohci-pci
	Kernel modules: ohci_pci

00:03.2 USB controller [0c03]: Silicon Integrated Systems [SiS] USB 1.1 Controller [1039:7001] (rev 0f) (prog-if 10 [OHCI])
	Subsystem: Foxconn International, Inc. USB 1.1 Controller [105b:0c4c]
	Control: I/O+ Mem+ BusMaster+ SpecCycle- MemWINV- VGASnoop- ParErr- Stepping- SERR- FastB2B- DisINTx-
	Status: Cap- 66MHz- UDF- FastB2B+ ParErr- DEVSEL=medium >TAbort- <TAbort- <MAbort- >SERR- <PERR- INTx-
	Latency: 32 (20000ns max), Cache Line Size: 32 bytes
	Interrupt: pin C routed to IRQ 22
	Region 0: Memory at ec001000 (32-bit, non-prefetchable) [size=4K]
	Kernel driver in use: ohci-pci
	Kernel modules: ohci_pci

00:03.3 USB controller [0c03]: Silicon Integrated Systems [SiS] USB 2.0 Controller [1039:7002] (prog-if 20 [EHCI])
	Subsystem: Foxconn International, Inc. USB 2.0 Controller [105b:0c4c]
	Control: I/O- Mem+ BusMaster+ SpecCycle- MemWINV- VGASnoop- ParErr- Stepping- SERR- FastB2B- DisINTx-
	Status: Cap+ 66MHz- UDF- FastB2B+ ParErr- DEVSEL=medium >TAbort- <TAbort- <MAbort- >SERR- <PERR- INTx-
	Latency: 32 (20000ns max), Cache Line Size: 32 bytes
	Interrupt: pin D routed to IRQ 23
	Region 0: Memory at ec002000 (32-bit, non-prefetchable) [size=4K]
	Capabilities: [50] Power Management version 2
		Flags: PMEClk- DSI- D1- D2- AuxCurrent=375mA PME(D0+,D1-,D2-,D3hot+,D3cold+)
		Status: D0 NoSoftRst- PME-Enable- DSel=0 DScale=0 PME-
	Kernel driver in use: ehci-pci
	Kernel modules: ehci_pci

00:04.0 Ethernet controller [0200]: Silicon Integrated Systems [SiS] SiS900 PCI Fast Ethernet [1039:0900] (rev 91)
	Subsystem: Foxconn International, Inc. SiS900 PCI Fast Ethernet [105b:0c4c]
	Control: I/O+ Mem+ BusMaster+ SpecCycle- MemWINV- VGASnoop- ParErr- Stepping- SERR- FastB2B- DisINTx-
	Status: Cap+ 66MHz- UDF- FastB2B+ ParErr- DEVSEL=medium >TAbort- <TAbort- <MAbort- >SERR- <PERR- INTx-
	Latency: 32 (13000ns min, 2750ns max)
	Interrupt: pin A routed to IRQ 19
	Region 0: I/O ports at d800 [size=256]
	Region 1: Memory at ec003000 (32-bit, non-prefetchable) [size=4K]
	Expansion ROM at 80000000 [virtual] [disabled] [size=128K]
	Capabilities: [40] Power Management version 2
		Flags: PMEClk- DSI- D1+ D2+ AuxCurrent=0mA PME(D0+,D1+,D2+,D3hot+,D3cold+)
		Status: D0 NoSoftRst- PME-Enable- DSel=0 DScale=0 PME-
	Kernel driver in use: sis900
	Kernel modules: sis900

00:05.0 IDE interface [0101]: Silicon Integrated Systems [SiS] RAID bus controller 180 SATA/PATA  [SiS] [1039:0180] (rev 01) (prog-if 85 [PCI native mode-only controller, supports bus mastering])
	Subsystem: Foxconn International, Inc. RAID bus controller 180 SATA/PATA  [SiS] [105b:0c4c]
	Control: I/O+ Mem- BusMaster+ SpecCycle- MemWINV- VGASnoop- ParErr- Stepping- SERR- FastB2B- DisINTx-
	Status: Cap+ 66MHz+ UDF- FastB2B- ParErr- DEVSEL=medium >TAbort- <TAbort- <MAbort- >SERR- <PERR- INTx-
	Latency: 32
	Interrupt: pin A routed to IRQ 17
	Region 0: I/O ports at dc00 [size=8]
	Region 1: I/O ports at e000 [size=4]
	Region 2: I/O ports at e400 [size=8]
	Region 3: I/O ports at e800 [size=4]
	Region 4: I/O ports at ec00 [size=16]
	Capabilities: [58] Power Management version 2
		Flags: PMEClk- DSI- D1- D2- AuxCurrent=0mA PME(D0-,D1-,D2-,D3hot-,D3cold+)
		Status: D0 NoSoftRst- PME-Enable- DSel=0 DScale=0 PME-
	Kernel driver in use: sata_sis
	Kernel modules: sata_sis, pata_acpi, ata_generic

01:00.0 VGA compatible controller [0300]: NVIDIA Corporation NV44A [GeForce 6200] [10de:0221] (rev a1) (prog-if 00 [VGA controller])
	Control: I/O+ Mem+ BusMaster+ SpecCycle- MemWINV- VGASnoop- ParErr- Stepping- SERR- FastB2B- DisINTx-
	Status: Cap+ 66MHz+ UDF- FastB2B+ ParErr- DEVSEL=medium >TAbort- <TAbort- <MAbort- >SERR- <PERR- INTx-
	Latency: 32 (1250ns min, 250ns max)
	Interrupt: pin A routed to IRQ 16
	Region 0: Memory at e8000000 (32-bit, non-prefetchable) [size=16M]
	Region 1: Memory at d0000000 (32-bit, prefetchable) [size=256M]
	Region 2: Memory at e9000000 (32-bit, non-prefetchable) [size=16M]
	Expansion ROM at 000c0000 [virtual] [disabled] [size=128K]
	Capabilities: [60] Power Management version 2
		Flags: PMEClk- DSI- D1- D2- AuxCurrent=0mA PME(D0-,D1-,D2-,D3hot-,D3cold-)
		Status: D0 NoSoftRst- PME-Enable- DSel=0 DScale=0 PME-
	Capabilities: [44] AGP version 3.0
		Status: RQ=256 Iso- ArqSz=0 Cal=3 SBA+ ITACoh- GART64- HTrans- 64bit- FW+ AGP3+ Rate=x4,x8
		Command: RQ=1 ArqSz=0 Cal=0 SBA- AGP- GART64- 64bit- FW- Rate=<none>
	Kernel driver in use: nouveau
	Kernel modules: nouveau

