00:00.0 Host bridge [0600]: Intel Corporation Device [8086:7d01] (rev 04)
	Subsystem: Lenovo Device [17aa:3802]
	Control: I/O- Mem+ BusMaster+ SpecCycle- MemWINV- VGASnoop- ParErr- Stepping- SERR- FastB2B- DisINTx-
	Status: Cap+ 66MHz- UDF- FastB2B+ ParErr- DEVSEL=fast >TAbort- <TAbort- <MAbort- >SERR- <PERR- INTx-
	Latency: 0
	IOMMU group: 1
	Capabilities: <access denied>

00:01.0 PCI bridge [0604]: Intel Corporation Device [8086:7ecc] (rev 10) (prog-if 00 [Normal decode])
	Control: I/O+ Mem+ BusMaster+ SpecCycle- MemWINV- VGASnoop- ParErr- Stepping- SERR+ FastB2B- DisINTx+
	Status: Cap+ 66MHz- UDF- FastB2B- ParErr- DEVSEL=fast >TAbort- <TAbort- <MAbort- >SERR- <PERR- INTx-
	Latency: 0, Cache Line Size: 64 bytes
	Interrupt: pin A routed to IRQ 122
	IOMMU group: 2
	Bus: primary=00, secondary=01, subordinate=01, sec-latency=0
	I/O behind bridge: [disabled]
	Memory behind bridge: 86100000-861fffff [size=1M]
	Prefetchable memory behind bridge: [disabled]
	Secondary status: 66MHz- FastB2B- ParErr- DEVSEL=fast >TAbort- <TAbort- <MAbort- <SERR- <PERR-
	BridgeCtl: Parity- SERR+ NoISA- VGA- VGA16- MAbort- >Reset- FastB2B-
		PriDiscTmr- SecDiscTmr- DiscTmrStat- DiscTmrSERREn-
	Capabilities: <access denied>
	Kernel driver in use: pcieport

00:02.0 VGA compatible controller [0300]: Intel Corporation Device [8086:7d55] (rev 08) (prog-if 00 [VGA controller])
	Subsystem: Lenovo Device [17aa:3803]
	Control: I/O+ Mem+ BusMaster+ SpecCycle- MemWINV- VGASnoop- ParErr- Stepping- SERR- FastB2B- DisINTx-
	Status: Cap+ 66MHz- UDF- FastB2B- ParErr- DEVSEL=fast >TAbort- <TAbort- <MAbort- >SERR- <PERR- INTx-
	Latency: 0, Cache Line Size: 64 bytes
	Interrupt: pin ? routed to IRQ 145
	IOMMU group: 0
	Region 0: Memory at 4818000000 (64-bit, prefetchable) [size=16M]
	Region 2: Memory at 4000000000 (64-bit, prefetchable) [size=256M]
	Expansion ROM at 000c0000 [virtual] [disabled] [size=128K]
	Capabilities: <access denied>
	Kernel driver in use: i915

00:04.0 Signal processing controller [1180]: Intel Corporation Device [8086:7d03] (rev 04)
	Subsystem: Lenovo Device [17aa:3807]
	Control: I/O- Mem+ BusMaster+ SpecCycle- MemWINV- VGASnoop- ParErr- Stepping- SERR- FastB2B- DisINTx+
	Status: Cap+ 66MHz- UDF- FastB2B+ ParErr- DEVSEL=fast >TAbort- <TAbort- <MAbort- >SERR- <PERR- INTx-
	Latency: 0
	Interrupt: pin A routed to IRQ 181
	IOMMU group: 3
	Region 0: Memory at 4819280000 (64-bit, non-prefetchable) [size=128K]
	Capabilities: <access denied>
	Kernel driver in use: proc_thermal_pci

00:07.0 PCI bridge [0604]: Intel Corporation Device [8086:7ec4] (rev 10) (prog-if 00 [Normal decode])
	Control: I/O+ Mem+ BusMaster+ SpecCycle- MemWINV- VGASnoop- ParErr- Stepping- SERR- FastB2B- DisINTx+
	Status: Cap+ 66MHz- UDF- FastB2B- ParErr- DEVSEL=fast >TAbort- <TAbort- <MAbort- >SERR- <PERR- INTx-
	Latency: 0, Cache Line Size: 64 bytes
	Interrupt: pin A routed to IRQ 123
	IOMMU group: 4
	Bus: primary=00, secondary=02, subordinate=2b, sec-latency=0
	I/O behind bridge: 00003000-00003fff [size=4K]
	Memory behind bridge: 80000000-85ffffff [size=96M]
	Prefetchable memory behind bridge: 0000004010000000-000000480fffffff [size=32G]
	Secondary status: 66MHz- FastB2B- ParErr- DEVSEL=fast >TAbort- <TAbort- <MAbort- <SERR- <PERR-
	BridgeCtl: Parity- SERR+ NoISA- VGA- VGA16- MAbort- >Reset- FastB2B-
		PriDiscTmr- SecDiscTmr- DiscTmrStat- DiscTmrSERREn-
	Capabilities: <access denied>
	Kernel driver in use: pcieport

00:08.0 System peripheral [0880]: Intel Corporation Device [8086:7e4c] (rev 20)
	Subsystem: Lenovo Device [17aa:380e]
	Control: I/O- Mem- BusMaster- SpecCycle- MemWINV- VGASnoop- ParErr- Stepping- SERR- FastB2B- DisINTx-
	Status: Cap+ 66MHz- UDF- FastB2B- ParErr- DEVSEL=fast >TAbort- <TAbort- <MAbort- >SERR- <PERR- INTx-
	Interrupt: pin A routed to IRQ 255
	IOMMU group: 5
	Region 0: Memory at 48192d2000 (64-bit, non-prefetchable) [disabled] [size=4K]
	Capabilities: <access denied>

00:0a.0 Signal processing controller [1180]: Intel Corporation Device [8086:7d0d] (rev 01)
	Subsystem: Lenovo Device [17aa:380f]
	Control: I/O- Mem+ BusMaster- SpecCycle- MemWINV- VGASnoop- ParErr- Stepping- SERR- FastB2B- DisINTx-
	Status: Cap+ 66MHz- UDF- FastB2B- ParErr- DEVSEL=fast >TAbort- <TAbort- <MAbort- >SERR- <PERR- INTx-
	IOMMU group: 6
	Region 0: Memory at 4819240000 (64-bit, non-prefetchable) [size=256K]
	Capabilities: <access denied>
	Kernel driver in use: intel_vsec

00:0b.0 Processing accelerators [1200]: Intel Corporation Device [8086:7d1d] (rev 04)
	Subsystem: Lenovo Device [17aa:3811]
	Control: I/O- Mem+ BusMaster- SpecCycle- MemWINV- VGASnoop- ParErr- Stepping- SERR- FastB2B- DisINTx-
	Status: Cap+ 66MHz- UDF- FastB2B- ParErr- DEVSEL=fast >TAbort- <TAbort- <MAbort- >SERR- <PERR- INTx+
	IOMMU group: 7
	Region 0: Memory at 4810000000 (64-bit, non-prefetchable) [size=128M]
	Region 4: Memory at 48192d1000 (64-bit, non-prefetchable) [size=4K]
	Capabilities: <access denied>

00:0d.0 USB controller [0c03]: Intel Corporation Device [8086:7ec0] (rev 10) (prog-if 30 [XHCI])
	Subsystem: Lenovo Device [17aa:3810]
	Control: I/O- Mem+ BusMaster+ SpecCycle- MemWINV- VGASnoop- ParErr- Stepping- SERR- FastB2B- DisINTx+
	Status: Cap+ 66MHz- UDF- FastB2B+ ParErr- DEVSEL=medium >TAbort- <TAbort- <MAbort- >SERR- <PERR- INTx-
	Latency: 0, Cache Line Size: 64 bytes
	Interrupt: pin ? routed to IRQ 126
	IOMMU group: 8
	Region 0: Memory at 48192b0000 (64-bit, non-prefetchable) [size=64K]
	Capabilities: <access denied>
	Kernel driver in use: xhci_hcd

00:0d.2 USB controller [0c03]: Intel Corporation Device [8086:7ec2] (rev 10) (prog-if 40 [USB4 Host Interface])
	Subsystem: Lenovo Device [17aa:3813]
	Control: I/O+ Mem+ BusMaster+ SpecCycle- MemWINV- VGASnoop- ParErr- Stepping- SERR- FastB2B- DisINTx+
	Status: Cap+ 66MHz- UDF- FastB2B- ParErr- DEVSEL=fast >TAbort- <TAbort- <MAbort- >SERR- <PERR- INTx-
	Latency: 0, Cache Line Size: 64 bytes
	Interrupt: pin A routed to IRQ 16
	IOMMU group: 8
	Region 0: Memory at 4819200000 (64-bit, non-prefetchable) [size=256K]
	Region 2: Memory at 48192d0000 (64-bit, non-prefetchable) [size=4K]
	Capabilities: <access denied>
	Kernel driver in use: thunderbolt

00:12.0 Serial controller [0700]: Intel Corporation Device [8086:7e45] (rev 20) (prog-if 00 [8250])
	Subsystem: Lenovo Device [17aa:381a]
	Control: I/O- Mem+ BusMaster+ SpecCycle- MemWINV- VGASnoop- ParErr- Stepping- SERR- FastB2B- DisINTx+
	Status: Cap+ 66MHz- UDF- FastB2B- ParErr- DEVSEL=fast >TAbort- <TAbort- <MAbort- >SERR- <PERR- INTx-
	Latency: 0, Cache Line Size: 64 bytes
	Interrupt: pin A routed to IRQ 163
	IOMMU group: 9
	Region 0: Memory at 48192a0000 (64-bit, non-prefetchable) [size=64K]
	Capabilities: <access denied>
	Kernel driver in use: intel_ish_ipc

00:14.0 USB controller [0c03]: Intel Corporation Device [8086:7e7d] (rev 20) (prog-if 30 [XHCI])
	Subsystem: Lenovo Device [17aa:3821]
	Control: I/O- Mem+ BusMaster+ SpecCycle- MemWINV- VGASnoop- ParErr- Stepping- SERR- FastB2B- DisINTx+
	Status: Cap+ 66MHz- UDF- FastB2B+ ParErr- DEVSEL=medium >TAbort- <TAbort- <MAbort- >SERR- <PERR- INTx-
	Latency: 0, Cache Line Size: 64 bytes
	Interrupt: pin A routed to IRQ 127
	IOMMU group: 10
	Region 0: Memory at 86200000 (64-bit, non-prefetchable) [size=64K]
	Capabilities: <access denied>
	Kernel driver in use: xhci_hcd

00:14.2 RAM memory [0500]: Intel Corporation Device [8086:7e7f] (rev 20)
	Subsystem: Lenovo Device [17aa:3823]
	Control: I/O- Mem+ BusMaster- SpecCycle- MemWINV- VGASnoop- ParErr- Stepping- SERR- FastB2B- DisINTx-
	Status: Cap+ 66MHz- UDF- FastB2B- ParErr- DEVSEL=fast >TAbort- <TAbort- <MAbort- >SERR- <PERR- INTx-
	IOMMU group: 10
	Region 0: Memory at 48192c8000 (64-bit, non-prefetchable) [size=16K]
	Region 2: Memory at 48192cf000 (64-bit, non-prefetchable) [size=4K]
	Capabilities: <access denied>

00:14.3 Network controller [0280]: Intel Corporation Device [8086:7e40] (rev 20)
	Subsystem: Intel Corporation Device [8086:0094]
	Control: I/O- Mem+ BusMaster+ SpecCycle- MemWINV- VGASnoop- ParErr- Stepping- SERR- FastB2B- DisINTx+
	Status: Cap+ 66MHz- UDF- FastB2B- ParErr- DEVSEL=fast >TAbort- <TAbort- <MAbort- >SERR- <PERR- INTx-
	Latency: 0, Cache Line Size: 64 bytes
	Interrupt: pin C routed to IRQ 18
	IOMMU group: 11
	Region 0: Memory at 48192c4000 (64-bit, non-prefetchable) [size=16K]
	Capabilities: <access denied>
	Kernel driver in use: iwlwifi

00:15.0 Serial bus controller [0c80]: Intel Corporation Device [8086:7e78] (rev 20)
	Subsystem: Lenovo Device [17aa:3825]
	Control: I/O- Mem+ BusMaster+ SpecCycle- MemWINV- VGASnoop- ParErr- Stepping- SERR- FastB2B- DisINTx-
	Status: Cap+ 66MHz- UDF- FastB2B- ParErr- DEVSEL=fast >TAbort- <TAbort- <MAbort- >SERR- <PERR- INTx-
	Latency: 0, Cache Line Size: 64 bytes
	Interrupt: pin A routed to IRQ 32
	IOMMU group: 12
	Region 0: Memory at 48192ce000 (64-bit, non-prefetchable) [size=4K]
	Capabilities: <access denied>
	Kernel driver in use: intel-lpss

00:16.0 Communication controller [0780]: Intel Corporation Device [8086:7e70] (rev 20)
	Subsystem: Lenovo Device [17aa:382a]
	Control: I/O- Mem+ BusMaster+ SpecCycle- MemWINV- VGASnoop- ParErr- Stepping- SERR- FastB2B- DisINTx+
	Status: Cap+ 66MHz- UDF- FastB2B- ParErr- DEVSEL=fast >TAbort- <TAbort- <MAbort- >SERR- <PERR- INTx-
	Latency: 0
	Interrupt: pin A routed to IRQ 162
	IOMMU group: 13
	Region 0: Memory at 48192cd000 (64-bit, non-prefetchable) [size=4K]
	Capabilities: <access denied>
	Kernel driver in use: mei_me

00:1c.0 PCI bridge [0604]: Intel Corporation Device [8086:7e3d] (rev 20) (prog-if 00 [Normal decode])
	Control: I/O+ Mem+ BusMaster+ SpecCycle- MemWINV- VGASnoop- ParErr- Stepping- SERR+ FastB2B- DisINTx+
	Status: Cap+ 66MHz- UDF- FastB2B- ParErr- DEVSEL=fast >TAbort- <TAbort- <MAbort- >SERR- <PERR- INTx-
	Latency: 0, Cache Line Size: 64 bytes
	Interrupt: pin B routed to IRQ 124
	IOMMU group: 14
	Bus: primary=00, secondary=2c, subordinate=2c, sec-latency=0
	I/O behind bridge: [disabled]
	Memory behind bridge: 86000000-860fffff [size=1M]
	Prefetchable memory behind bridge: [disabled]
	Secondary status: 66MHz- FastB2B- ParErr- DEVSEL=fast >TAbort- <TAbort- <MAbort- <SERR- <PERR-
	BridgeCtl: Parity- SERR+ NoISA- VGA- VGA16- MAbort- >Reset- FastB2B-
		PriDiscTmr- SecDiscTmr- DiscTmrStat- DiscTmrSERREn-
	Capabilities: <access denied>
	Kernel driver in use: pcieport

00:1f.0 ISA bridge [0601]: Intel Corporation Device [8086:7e02] (rev 20)
	Subsystem: Lenovo Device [17aa:3843]
	Control: I/O+ Mem+ BusMaster+ SpecCycle- MemWINV- VGASnoop- ParErr- Stepping- SERR- FastB2B- DisINTx+
	Status: Cap- 66MHz- UDF- FastB2B- ParErr- DEVSEL=fast >TAbort- <TAbort- <MAbort- >SERR- <PERR- INTx-
	Latency: 0
	IOMMU group: 15

00:1f.3 Multimedia audio controller [0401]: Intel Corporation Device [8086:7e28] (rev 20)
	Subsystem: Lenovo Device [17aa:3846]
	Control: I/O- Mem+ BusMaster+ SpecCycle- MemWINV- VGASnoop- ParErr- Stepping- SERR- FastB2B- DisINTx+
	Status: Cap+ 66MHz- UDF- FastB2B- ParErr- DEVSEL=fast >TAbort- <TAbort- <MAbort- >SERR- <PERR- INTx-
	Latency: 32, Cache Line Size: 64 bytes
	Interrupt: pin A routed to IRQ 182
	IOMMU group: 15
	Region 0: Memory at 48192c0000 (64-bit, non-prefetchable) [size=16K]
	Region 4: Memory at 4819000000 (64-bit, non-prefetchable) [size=2M]
	Capabilities: <access denied>
	Kernel driver in use: sof-audio-pci-intel-mtl

00:1f.4 SMBus [0c05]: Intel Corporation Device [8086:7e22] (rev 20)
	Subsystem: Lenovo Device [17aa:3847]
	Control: I/O+ Mem+ BusMaster- SpecCycle- MemWINV- VGASnoop- ParErr- Stepping- SERR- FastB2B- DisINTx-
	Status: Cap- 66MHz- UDF- FastB2B+ ParErr- DEVSEL=medium >TAbort- <TAbort- <MAbort- >SERR- <PERR- INTx-
	Interrupt: pin C routed to IRQ 18
	IOMMU group: 15
	Region 0: Memory at 48192cc000 (64-bit, non-prefetchable) [size=256]
	Region 4: I/O ports at efa0 [size=32]
	Kernel driver in use: i801_smbus

00:1f.5 Serial bus controller [0c80]: Intel Corporation Device [8086:7e23] (rev 20)
	Subsystem: Lenovo Device [17aa:3848]
	Control: I/O- Mem+ BusMaster- SpecCycle- MemWINV- VGASnoop- ParErr- Stepping- SERR- FastB2B- DisINTx+
	Status: Cap- 66MHz- UDF- FastB2B- ParErr- DEVSEL=fast >TAbort- <TAbort- <MAbort- >SERR- <PERR- INTx-
	IOMMU group: 15
	Region 0: Memory at 7e800000 (32-bit, non-prefetchable) [size=4K]
	Kernel driver in use: intel-spi

01:00.0 Non-Volatile memory controller [0108]: SK hynix Device [1c5c:1d59] (rev 03) (prog-if 02 [NVM Express])
	Subsystem: SK hynix Device [1c5c:1d59]
	Control: I/O- Mem+ BusMaster+ SpecCycle- MemWINV- VGASnoop- ParErr- Stepping- SERR- FastB2B- DisINTx+
	Status: Cap+ 66MHz- UDF- FastB2B- ParErr- DEVSEL=fast >TAbort- <TAbort- <MAbort- >SERR- <PERR- INTx-
	Latency: 0, Cache Line Size: 64 bytes
	Interrupt: pin A routed to IRQ 16
	IOMMU group: 16
	Region 0: Memory at 86100000 (64-bit, non-prefetchable) [size=16K]
	Capabilities: <access denied>
	Kernel driver in use: nvme

2c:00.0 Unassigned class [ff00]: Realtek Semiconductor Co., Ltd. RTS522A PCI Express Card Reader [10ec:522a] (rev 01)
	Subsystem: Lenovo Device [17aa:38cd]
	Control: I/O- Mem+ BusMaster+ SpecCycle- MemWINV- VGASnoop- ParErr- Stepping- SERR- FastB2B- DisINTx+
	Status: Cap+ 66MHz- UDF- FastB2B- ParErr- DEVSEL=fast >TAbort- <TAbort- <MAbort- >SERR- <PERR- INTx-
	Latency: 0, Cache Line Size: 64 bytes
	Interrupt: pin A routed to IRQ 125
	IOMMU group: 17
	Region 0: Memory at 86000000 (32-bit, non-prefetchable) [size=4K]
	Capabilities: <access denied>
	Kernel driver in use: rtsx_pci

