00:00.0 Host bridge [0600]: NVIDIA Corporation nForce3 250Gb Host Bridge [10de:00e1] (rev a1)
	Subsystem: Elitegroup Computer Systems Device [1019:3401]
	Control: I/O- Mem+ BusMaster+ SpecCycle- MemWINV- VGASnoop- ParErr- Stepping- SERR- FastB2B- DisINTx-
	Status: Cap+ 66MHz+ UDF- FastB2B+ ParErr- DEVSEL=fast >TAbort- <TAbort- <MAbort- >SERR- <PERR- INTx-
	Latency: 0
	NUMA node: 0
	Region 0: Memory at e0000000 (32-bit, prefetchable) [size=128M]
	Capabilities: <access denied>
	Kernel driver in use: agpgart-amd64

00:01.0 ISA bridge [0601]: NVIDIA Corporation nForce3 250Gb LPC Bridge [10de:00e0] (rev a2)
	Subsystem: Elitegroup Computer Systems Device [1019:3401]
	Control: I/O+ Mem+ BusMaster+ SpecCycle+ MemWINV- VGASnoop- ParErr- Stepping- SERR- FastB2B- DisINTx-
	Status: Cap- 66MHz+ UDF- FastB2B+ ParErr- DEVSEL=fast >TAbort- <TAbort- <MAbort- >SERR- <PERR- INTx-
	Latency: 0
	NUMA node: 0

00:01.1 SMBus [0c05]: NVIDIA Corporation nForce 250Gb PCI System Management [10de:00e4] (rev a1)
	Subsystem: Elitegroup Computer Systems Device [1019:3401]
	Control: I/O+ Mem- BusMaster- SpecCycle- MemWINV- VGASnoop- ParErr- Stepping- SERR- FastB2B- DisINTx-
	Status: Cap+ 66MHz+ UDF- FastB2B+ ParErr- DEVSEL=fast >TAbort- <TAbort- <MAbort- >SERR- <PERR- INTx-
	Interrupt: pin A routed to IRQ 12
	NUMA node: 0
	Region 0: I/O ports at e000 [size=32]
	Region 4: I/O ports at 4c00 [size=64]
	Region 5: I/O ports at 4c40 [size=64]
	Capabilities: <access denied>
	Kernel driver in use: nForce2_smbus
	Kernel modules: i2c_nforce2

00:02.0 USB controller [0c03]: NVIDIA Corporation CK8S USB Controller [10de:00e7] (rev a1) (prog-if 10 [OHCI])
	Subsystem: Elitegroup Computer Systems Device [1019:3401]
	Control: I/O+ Mem+ BusMaster+ SpecCycle- MemWINV- VGASnoop- ParErr- Stepping- SERR- FastB2B- DisINTx-
	Status: Cap+ 66MHz+ UDF- FastB2B+ ParErr- DEVSEL=fast >TAbort- <TAbort- <MAbort- >SERR- <PERR- INTx-
	Latency: 0 (750ns min, 250ns max)
	Interrupt: pin A routed to IRQ 22
	NUMA node: 0
	Region 0: Memory at eb003000 (32-bit, non-prefetchable) [size=4K]
	Capabilities: <access denied>
	Kernel driver in use: ohci-pci

00:02.1 USB controller [0c03]: NVIDIA Corporation CK8S USB Controller [10de:00e7] (rev a1) (prog-if 10 [OHCI])
	Subsystem: Elitegroup Computer Systems Device [1019:3401]
	Control: I/O+ Mem+ BusMaster+ SpecCycle- MemWINV- VGASnoop- ParErr- Stepping- SERR- FastB2B- DisINTx-
	Status: Cap+ 66MHz+ UDF- FastB2B+ ParErr- DEVSEL=fast >TAbort- <TAbort- <MAbort- >SERR- <PERR- INTx-
	Latency: 0 (750ns min, 250ns max)
	Interrupt: pin B routed to IRQ 21
	NUMA node: 0
	Region 0: Memory at eb004000 (32-bit, non-prefetchable) [size=4K]
	Capabilities: <access denied>
	Kernel driver in use: ohci-pci

00:02.2 USB controller [0c03]: NVIDIA Corporation nForce3 EHCI USB 2.0 Controller [10de:00e8] (rev a2) (prog-if 20 [EHCI])
	Subsystem: Elitegroup Computer Systems Device [1019:3401]
	Control: I/O- Mem+ BusMaster+ SpecCycle- MemWINV- VGASnoop- ParErr- Stepping- SERR- FastB2B- DisINTx-
	Status: Cap+ 66MHz+ UDF- FastB2B+ ParErr- DEVSEL=fast >TAbort- <TAbort- <MAbort- >SERR- <PERR- INTx-
	Latency: 0 (750ns min, 250ns max)
	Interrupt: pin C routed to IRQ 20
	NUMA node: 0
	Region 0: Memory at eb005000 (32-bit, non-prefetchable) [size=256]
	Capabilities: <access denied>
	Kernel driver in use: ehci-pci

00:05.0 Bridge [0680]: NVIDIA Corporation CK8S Ethernet Controller [10de:00df] (rev a2)
	Subsystem: Elitegroup Computer Systems Device [1019:2501]
	Control: I/O+ Mem+ BusMaster+ SpecCycle- MemWINV- VGASnoop- ParErr- Stepping- SERR- FastB2B- DisINTx-
	Status: Cap+ 66MHz+ UDF- FastB2B+ ParErr- DEVSEL=fast >TAbort- <TAbort- <MAbort- >SERR- <PERR- INTx-
	Latency: 0 (250ns min, 5000ns max)
	Interrupt: pin A routed to IRQ 22
	NUMA node: 0
	Region 0: Memory at eb000000 (32-bit, non-prefetchable) [size=4K]
	Region 1: I/O ports at b400 [size=8]
	Capabilities: <access denied>
	Kernel driver in use: forcedeth
	Kernel modules: forcedeth

00:06.0 Multimedia audio controller [0401]: NVIDIA Corporation nForce3 250Gb AC'97 Audio Controller [10de:00ea] (rev a1)
	Subsystem: Elitegroup Computer Systems Device [1019:aa2e]
	Control: I/O+ Mem+ BusMaster+ SpecCycle- MemWINV- VGASnoop- ParErr- Stepping- SERR- FastB2B- DisINTx-
	Status: Cap+ 66MHz+ UDF- FastB2B+ ParErr- DEVSEL=fast >TAbort- <TAbort- <MAbort- >SERR- <PERR- INTx-
	Latency: 0 (500ns min, 1250ns max)
	Interrupt: pin A routed to IRQ 20
	NUMA node: 0
	Region 0: I/O ports at b800 [size=256]
	Region 1: I/O ports at bc00 [size=128]
	Region 2: Memory at eb001000 (32-bit, non-prefetchable) [size=4K]
	Capabilities: <access denied>
	Kernel driver in use: snd_intel8x0
	Kernel modules: snd_intel8x0

00:08.0 IDE interface [0101]: NVIDIA Corporation CK8S Parallel ATA Controller (v2.5) [10de:00e5] (rev a2) (prog-if 8a [ISA Compatibility mode controller, supports both channels switched to PCI native mode, supports bus mastering])
	Subsystem: Elitegroup Computer Systems Device [1019:3401]
	Control: I/O+ Mem- BusMaster+ SpecCycle- MemWINV- VGASnoop- ParErr- Stepping- SERR- FastB2B- DisINTx-
	Status: Cap+ 66MHz+ UDF- FastB2B+ ParErr- DEVSEL=fast >TAbort- <TAbort- <MAbort- >SERR- <PERR- INTx-
	Latency: 0 (750ns min, 250ns max)
	NUMA node: 0
	Region 0: [virtual] Memory at 000001f0 (32-bit, non-prefetchable) [size=8]
	Region 1: [virtual] Memory at 000003f0 (type 3, non-prefetchable)
	Region 2: [virtual] Memory at 00000170 (32-bit, non-prefetchable) [size=8]
	Region 3: [virtual] Memory at 00000370 (type 3, non-prefetchable)
	Region 4: I/O ports at f000 [size=16]
	Capabilities: <access denied>
	Kernel driver in use: pata_amd
	Kernel modules: pata_amd, pata_acpi

00:0a.0 IDE interface [0101]: NVIDIA Corporation nForce3 Serial ATA Controller [10de:00e3] (rev a2) (prog-if 85 [PCI native mode-only controller, supports bus mastering])
	Subsystem: Elitegroup Computer Systems Device [1019:5400]
	Control: I/O+ Mem- BusMaster+ SpecCycle- MemWINV- VGASnoop- ParErr- Stepping- SERR- FastB2B- DisINTx-
	Status: Cap+ 66MHz+ UDF- FastB2B+ ParErr- DEVSEL=fast >TAbort- <TAbort- <MAbort- >SERR- <PERR- INTx-
	Latency: 0 (750ns min, 250ns max)
	Interrupt: pin A routed to IRQ 21
	NUMA node: 0
	Region 0: I/O ports at 09f0 [size=8]
	Region 1: I/O ports at 0bf0 [size=4]
	Region 2: I/O ports at 0970 [size=8]
	Region 3: I/O ports at 0b70 [size=4]
	Region 4: I/O ports at d800 [size=16]
	Region 5: I/O ports at dc00 [size=128]
	Capabilities: <access denied>
	Kernel driver in use: sata_nv
	Kernel modules: sata_nv, pata_acpi

00:0b.0 PCI bridge [0604]: NVIDIA Corporation nForce3 250Gb AGP Host to PCI Bridge [10de:00e2] (rev a2) (prog-if 00 [Normal decode])
	Control: I/O+ Mem+ BusMaster+ SpecCycle- MemWINV- VGASnoop- ParErr- Stepping- SERR+ FastB2B- DisINTx-
	Status: Cap- 66MHz+ UDF- FastB2B- ParErr- DEVSEL=medium >TAbort- <TAbort- <MAbort- >SERR- <PERR- INTx-
	Latency: 16
	NUMA node: 0
	Bus: primary=00, secondary=01, subordinate=01, sec-latency=10
	I/O behind bridge: 00009000-00009fff [size=4K]
	Memory behind bridge: e8000000-e9ffffff [size=32M]
	Prefetchable memory behind bridge: d0000000-dfffffff [size=256M]
	Secondary status: 66MHz+ FastB2B- ParErr- DEVSEL=medium >TAbort- <TAbort- <MAbort+ <SERR- <PERR-
	BridgeCtl: Parity- SERR+ NoISA+ VGA+ VGA16- MAbort- >Reset- FastB2B-
		PriDiscTmr- SecDiscTmr- DiscTmrStat- DiscTmrSERREn-

00:0e.0 PCI bridge [0604]: NVIDIA Corporation nForce3 250Gb PCI-to-PCI Bridge [10de:00ed] (rev a2) (prog-if 00 [Normal decode])
	Control: I/O+ Mem+ BusMaster+ SpecCycle- MemWINV- VGASnoop- ParErr- Stepping- SERR+ FastB2B- DisINTx-
	Status: Cap- 66MHz+ UDF- FastB2B+ ParErr- DEVSEL=fast >TAbort- <TAbort- <MAbort- >SERR- <PERR- INTx-
	Latency: 0
	NUMA node: 0
	Bus: primary=00, secondary=02, subordinate=02, sec-latency=128
	I/O behind bridge: 0000a000-0000afff [size=4K]
	Memory behind bridge: ea000000-eaffffff [size=16M]
	Prefetchable memory behind bridge: None
	Secondary status: 66MHz- FastB2B+ ParErr- DEVSEL=medium >TAbort- <TAbort- <MAbort+ <SERR- <PERR-
	BridgeCtl: Parity- SERR+ NoISA+ VGA- VGA16- MAbort- >Reset- FastB2B-
		PriDiscTmr- SecDiscTmr+ DiscTmrStat- DiscTmrSERREn-

00:18.0 Host bridge [0600]: Advanced Micro Devices, Inc. [AMD] K8 [Athlon64/Opteron] HyperTransport Technology Configuration [1022:1100]
	Control: I/O- Mem- BusMaster- SpecCycle- MemWINV- VGASnoop- ParErr- Stepping- SERR- FastB2B- DisINTx-
	Status: Cap+ 66MHz- UDF- FastB2B- ParErr- DEVSEL=fast >TAbort- <TAbort- <MAbort- >SERR- <PERR- INTx-
	NUMA node: 0
	Capabilities: <access denied>

00:18.1 Host bridge [0600]: Advanced Micro Devices, Inc. [AMD] K8 [Athlon64/Opteron] Address Map [1022:1101]
	Control: I/O- Mem- BusMaster- SpecCycle- MemWINV- VGASnoop- ParErr- Stepping- SERR- FastB2B- DisINTx-
	Status: Cap- 66MHz- UDF- FastB2B- ParErr- DEVSEL=fast >TAbort- <TAbort- <MAbort- >SERR- <PERR- INTx-
	NUMA node: 0

00:18.2 Host bridge [0600]: Advanced Micro Devices, Inc. [AMD] K8 [Athlon64/Opteron] DRAM Controller [1022:1102]
	Control: I/O- Mem- BusMaster- SpecCycle- MemWINV- VGASnoop- ParErr- Stepping- SERR- FastB2B- DisINTx-
	Status: Cap- 66MHz- UDF- FastB2B- ParErr- DEVSEL=fast >TAbort- <TAbort- <MAbort- >SERR- <PERR- INTx-
	NUMA node: 0

00:18.3 Host bridge [0600]: Advanced Micro Devices, Inc. [AMD] K8 [Athlon64/Opteron] Miscellaneous Control [1022:1103]
	Control: I/O- Mem- BusMaster- SpecCycle- MemWINV- VGASnoop- ParErr- Stepping- SERR- FastB2B- DisINTx-
	Status: Cap- 66MHz- UDF- FastB2B- ParErr- DEVSEL=fast >TAbort- <TAbort- <MAbort- >SERR- <PERR- INTx-
	NUMA node: 0
	Kernel driver in use: k8temp
	Kernel modules: k8temp

01:00.0 VGA compatible controller [0300]: Advanced Micro Devices, Inc. [AMD/ATI] R360 [Radeon 9800 XXL/XT] [1002:4e4a] (prog-if 00 [VGA controller])
	Subsystem: Hightech Information System Ltd. Device [1787:9560]
	Control: I/O+ Mem+ BusMaster+ SpecCycle- MemWINV- VGASnoop- ParErr- Stepping+ SERR- FastB2B- DisINTx-
	Status: Cap+ 66MHz+ UDF- FastB2B+ ParErr- DEVSEL=medium >TAbort- <TAbort- <MAbort- >SERR- <PERR- INTx-
	Latency: 32 (2000ns min), Cache Line Size: 32 bytes
	Interrupt: pin A routed to IRQ 16
	NUMA node: 0
	Region 0: Memory at d0000000 (32-bit, prefetchable) [size=128M]
	Region 1: I/O ports at 9000 [size=256]
	Region 2: Memory at e9010000 (32-bit, non-prefetchable) [size=64K]
	[virtual] Expansion ROM at 000c0000 [disabled] [size=128K]
	Capabilities: <access denied>
	Kernel driver in use: radeon
	Kernel modules: radeonfb, radeon

01:00.1 Display controller [0380]: Advanced Micro Devices, Inc. [AMD/ATI] RV350 [Radeon 9800 XT] (Secondary) [1002:4e6a]
	Subsystem: Hightech Information System Ltd. Device [1787:9561]
	Control: I/O- Mem- BusMaster- SpecCycle- MemWINV- VGASnoop- ParErr- Stepping+ SERR- FastB2B- DisINTx-
	Status: Cap+ 66MHz+ UDF- FastB2B+ ParErr- DEVSEL=medium >TAbort- <TAbort- <MAbort- >SERR- <PERR- INTx-
	NUMA node: 0
	Region 0: Memory at d8000000 (32-bit, prefetchable) [disabled] [size=128M]
	Region 1: Memory at e9000000 (32-bit, non-prefetchable) [disabled] [size=64K]
	Capabilities: <access denied>

02:09.0 Ethernet controller [0200]: Realtek Semiconductor Co., Ltd. RTL-8100/8101L/8139 PCI Fast Ethernet Adapter [10ec:8139] (rev 10)
	Subsystem: Realtek Semiconductor Co., Ltd. RTL-8100/8101L/8139 PCI Fast Ethernet Adapter [10ec:8139]
	Control: I/O+ Mem+ BusMaster+ SpecCycle- MemWINV- VGASnoop- ParErr- Stepping- SERR- FastB2B- DisINTx-
	Status: Cap+ 66MHz- UDF- FastB2B+ ParErr- DEVSEL=medium >TAbort- <TAbort- <MAbort- >SERR- <PERR- INTx-
	Latency: 32 (8000ns min, 16000ns max)
	Interrupt: pin A routed to IRQ 17
	NUMA node: 0
	Region 0: I/O ports at a000 [size=256]
	Region 1: Memory at ea000000 (32-bit, non-prefetchable) [size=256]
	Capabilities: <access denied>
	Kernel driver in use: 8139too
	Kernel modules: 8139cp, 8139too

