00:00.0 Host bridge [0600]: Intel Corporation Device [8086:9b61] (rev 0c)
	Subsystem: Lenovo Device [17aa:380d]
	Control: I/O- Mem+ BusMaster+ SpecCycle- MemWINV- VGASnoop- ParErr- Stepping- SERR- FastB2B- DisINTx-
	Status: Cap+ 66MHz- UDF- FastB2B+ ParErr- DEVSEL=fast >TAbort- <TAbort- <MAbort+ >SERR- <PERR- INTx-
	Latency: 0
	Capabilities: <access denied>
	Kernel driver in use: skl_uncore

00:02.0 VGA compatible controller [0300]: Intel Corporation UHD Graphics [8086:9b41] (rev 02) (prog-if 00 [VGA controller])
	Subsystem: Lenovo Device [17aa:3fb2]
	Control: I/O+ Mem+ BusMaster+ SpecCycle- MemWINV- VGASnoop- ParErr- Stepping- SERR- FastB2B- DisINTx+
	Status: Cap+ 66MHz- UDF- FastB2B- ParErr- DEVSEL=fast >TAbort- <TAbort- <MAbort- >SERR- <PERR- INTx-
	Latency: 0, Cache Line Size: 64 bytes
	Interrupt: pin A routed to IRQ 126
	Region 0: Memory at b0000000 (64-bit, non-prefetchable) [size=16M]
	Region 2: Memory at a0000000 (64-bit, prefetchable) [size=256M]
	Region 4: I/O ports at 4000 [size=64]
	Expansion ROM at 000c0000 [virtual] [disabled] [size=128K]
	Capabilities: <access denied>
	Kernel driver in use: i915

00:04.0 Signal processing controller [1180]: Intel Corporation Xeon E3-1200 v5/E3-1500 v5/6th Gen Core Processor Thermal Subsystem [8086:1903] (rev 0c)
	Subsystem: Lenovo Device [17aa:384d]
	Control: I/O- Mem+ BusMaster+ SpecCycle- MemWINV- VGASnoop- ParErr- Stepping- SERR- FastB2B- DisINTx-
	Status: Cap+ 66MHz- UDF- FastB2B+ ParErr- DEVSEL=fast >TAbort- <TAbort- <MAbort- >SERR- <PERR- INTx-
	Latency: 0
	Interrupt: pin A routed to IRQ 16
	Region 0: Memory at b1210000 (64-bit, non-prefetchable) [size=32K]
	Capabilities: <access denied>
	Kernel driver in use: proc_thermal

00:08.0 System peripheral [0880]: Intel Corporation Xeon E3-1200 v5/v6 / E3-1500 v5 / 6th/7th/8th Gen Core Processor Gaussian Mixture Model [8086:1911]
	Subsystem: Lenovo Device [17aa:387f]
	Control: I/O- Mem+ BusMaster+ SpecCycle- MemWINV- VGASnoop- ParErr- Stepping- SERR- FastB2B- DisINTx-
	Status: Cap+ 66MHz- UDF- FastB2B- ParErr- DEVSEL=fast >TAbort- <TAbort- <MAbort- >SERR- <PERR- INTx-
	Latency: 0, Cache Line Size: 64 bytes
	Interrupt: pin A routed to IRQ 11
	Region 0: Memory at b1224000 (64-bit, non-prefetchable) [size=4K]
	Capabilities: <access denied>

00:12.0 Signal processing controller [1180]: Intel Corporation Comet Lake Thermal Subsytem [8086:02f9]
	Subsystem: Lenovo Device [17aa:380a]
	Control: I/O- Mem+ BusMaster+ SpecCycle- MemWINV- VGASnoop- ParErr- Stepping- SERR- FastB2B- DisINTx-
	Status: Cap+ 66MHz- UDF- FastB2B- ParErr- DEVSEL=fast >TAbort- <TAbort- <MAbort- >SERR- <PERR- INTx-
	Latency: 0
	Interrupt: pin A routed to IRQ 16
	Region 0: Memory at b1225000 (64-bit, non-prefetchable) [size=4K]
	Capabilities: <access denied>
	Kernel driver in use: intel_pch_thermal

00:14.0 USB controller [0c03]: Intel Corporation Device [8086:02ed] (prog-if 30 [XHCI])
	Subsystem: Lenovo Device [17aa:380c]
	Control: I/O- Mem+ BusMaster+ SpecCycle- MemWINV- VGASnoop- ParErr- Stepping- SERR- FastB2B- DisINTx+
	Status: Cap+ 66MHz- UDF- FastB2B+ ParErr- DEVSEL=medium >TAbort- <TAbort- <MAbort- >SERR- <PERR- INTx-
	Latency: 0
	Interrupt: pin A routed to IRQ 124
	Region 0: Memory at b1200000 (64-bit, non-prefetchable) [size=64K]
	Capabilities: <access denied>
	Kernel driver in use: xhci_hcd

00:14.2 RAM memory [0500]: Intel Corporation Device [8086:02ef]
	Subsystem: Lenovo Device [17aa:380b]
	Control: I/O- Mem+ BusMaster+ SpecCycle- MemWINV- VGASnoop- ParErr- Stepping- SERR- FastB2B- DisINTx-
	Status: Cap+ 66MHz- UDF- FastB2B- ParErr- DEVSEL=fast >TAbort- <TAbort- <MAbort- >SERR- <PERR- INTx-
	Latency: 0, Cache Line Size: 64 bytes
	Region 0: Memory at b1220000 (64-bit, non-prefetchable) [size=8K]
	Region 2: Memory at b1226000 (64-bit, non-prefetchable) [size=4K]
	Capabilities: <access denied>

00:14.3 Network controller [0280]: Intel Corporation Wireless-AC 9462 [8086:02f0]
	Subsystem: Intel Corporation Device [8086:0234]
	Control: I/O- Mem+ BusMaster+ SpecCycle- MemWINV- VGASnoop- ParErr- Stepping- SERR- FastB2B- DisINTx+
	Status: Cap+ 66MHz- UDF- FastB2B- ParErr- DEVSEL=fast >TAbort- <TAbort- <MAbort- >SERR- <PERR- INTx-
	Latency: 0, Cache Line Size: 64 bytes
	Interrupt: pin A routed to IRQ 16
	Region 0: Memory at b1218000 (64-bit, non-prefetchable) [size=16K]
	Capabilities: <access denied>
	Kernel driver in use: iwlwifi

00:15.0 Serial bus controller [0c80]: Intel Corporation Serial IO I2C Host Controller [8086:02e8]
	Subsystem: Lenovo Device [17aa:380e]
	Control: I/O- Mem+ BusMaster+ SpecCycle- MemWINV- VGASnoop- ParErr- Stepping- SERR- FastB2B- DisINTx-
	Status: Cap+ 66MHz- UDF- FastB2B- ParErr- DEVSEL=fast >TAbort- <TAbort- <MAbort- >SERR- <PERR- INTx-
	Latency: 0, Cache Line Size: 64 bytes
	Interrupt: pin A routed to IRQ 16
	Region 0: Memory at 9b800000 (64-bit, non-prefetchable) [virtual] [size=4K]
	Capabilities: <access denied>
	Kernel driver in use: intel-lpss

00:16.0 Communication controller [0780]: Intel Corporation Comet Lake Management Engine Interface [8086:02e0]
	Subsystem: Lenovo Device [17aa:3808]
	Control: I/O- Mem+ BusMaster+ SpecCycle- MemWINV- VGASnoop- ParErr- Stepping- SERR- FastB2B- DisINTx+
	Status: Cap+ 66MHz- UDF- FastB2B- ParErr- DEVSEL=fast >TAbort- <TAbort- <MAbort- >SERR- <PERR- INTx-
	Latency: 0
	Interrupt: pin A routed to IRQ 127
	Region 0: Memory at b1228000 (64-bit, non-prefetchable) [size=4K]
	Capabilities: <access denied>
	Kernel driver in use: mei_me

00:17.0 SATA controller [0106]: Intel Corporation Comet Lake SATA AHCI Controller [8086:02d3] (prog-if 01 [AHCI 1.0])
	Subsystem: Lenovo Device [17aa:3806]
	Control: I/O+ Mem+ BusMaster+ SpecCycle- MemWINV- VGASnoop- ParErr- Stepping- SERR- FastB2B- DisINTx+
	Status: Cap+ 66MHz+ UDF- FastB2B+ ParErr- DEVSEL=medium >TAbort- <TAbort- <MAbort- >SERR- <PERR- INTx-
	Latency: 0
	Interrupt: pin A routed to IRQ 123
	Region 0: Memory at b1222000 (32-bit, non-prefetchable) [size=8K]
	Region 1: Memory at b122f000 (32-bit, non-prefetchable) [size=256]
	Region 2: I/O ports at 4080 [size=8]
	Region 3: I/O ports at 4088 [size=4]
	Region 4: I/O ports at 4060 [size=32]
	Region 5: Memory at b122e000 (32-bit, non-prefetchable) [size=2K]
	Capabilities: <access denied>
	Kernel driver in use: ahci

00:19.0 Serial bus controller [0c80]: Intel Corporation Device [8086:02c5]
	Subsystem: Lenovo Device [17aa:3803]
	Control: I/O- Mem+ BusMaster+ SpecCycle- MemWINV- VGASnoop- ParErr- Stepping- SERR- FastB2B- DisINTx-
	Status: Cap+ 66MHz- UDF- FastB2B- ParErr- DEVSEL=fast >TAbort- <TAbort- <MAbort- >SERR- <PERR- INTx-
	Latency: 0, Cache Line Size: 64 bytes
	Interrupt: pin A routed to IRQ 32
	Region 0: Memory at 9b801000 (64-bit, non-prefetchable) [size=4K]
	Capabilities: <access denied>
	Kernel driver in use: intel-lpss

00:19.2 Communication controller [0780]: Intel Corporation Device [8086:02c7]
	Subsystem: Lenovo Device [17aa:3804]
	Control: I/O- Mem+ BusMaster+ SpecCycle- MemWINV- VGASnoop- ParErr- Stepping- SERR- FastB2B- DisINTx-
	Status: Cap+ 66MHz- UDF- FastB2B- ParErr- DEVSEL=fast >TAbort- <TAbort- <MAbort- >SERR- <PERR- INTx-
	Latency: 0, Cache Line Size: 64 bytes
	Interrupt: pin C routed to IRQ 34
	Region 0: Memory at b122a000 (64-bit, non-prefetchable) [virtual] [size=4K]
	Region 2: Memory at b122b000 (64-bit, non-prefetchable) [virtual] [size=4K]
	Capabilities: <access denied>
	Kernel driver in use: intel-lpss

00:1d.0 PCI bridge [0604]: Intel Corporation Device [8086:02b1] (rev f0) (prog-if 00 [Normal decode])
	Control: I/O+ Mem+ BusMaster+ SpecCycle- MemWINV- VGASnoop- ParErr- Stepping- SERR- FastB2B- DisINTx+
	Status: Cap+ 66MHz- UDF- FastB2B- ParErr- DEVSEL=fast >TAbort- <TAbort- <MAbort- >SERR- <PERR- INTx-
	Latency: 0, Cache Line Size: 64 bytes
	Interrupt: pin B routed to IRQ 122
	Bus: primary=00, secondary=01, subordinate=01, sec-latency=0
	I/O behind bridge: 00003000-00003fff [size=4K]
	Memory behind bridge: b1100000-b11fffff [size=1M]
	Prefetchable memory behind bridge: [disabled]
	Secondary status: 66MHz- FastB2B- ParErr- DEVSEL=fast >TAbort- <TAbort- <MAbort+ <SERR- <PERR-
	BridgeCtl: Parity- SERR+ NoISA- VGA- VGA16- MAbort- >Reset- FastB2B-
		PriDiscTmr- SecDiscTmr- DiscTmrStat- DiscTmrSERREn-
	Capabilities: <access denied>
	Kernel driver in use: pcieport

00:1f.0 ISA bridge [0601]: Intel Corporation Device [8086:0284]
	Subsystem: Lenovo Device [17aa:3809]
	Control: I/O+ Mem+ BusMaster+ SpecCycle- MemWINV- VGASnoop- ParErr- Stepping- SERR- FastB2B- DisINTx-
	Status: Cap- 66MHz- UDF- FastB2B- ParErr- DEVSEL=medium >TAbort- <TAbort- <MAbort- >SERR- <PERR- INTx-
	Latency: 0

00:1f.3 Audio device [0403]: Intel Corporation Device [8086:02c8] (prog-if 80)
	Subsystem: Lenovo Device [17aa:3819]
	Control: I/O- Mem+ BusMaster+ SpecCycle- MemWINV- VGASnoop- ParErr- Stepping- SERR- FastB2B- DisINTx+
	Status: Cap+ 66MHz- UDF- FastB2B- ParErr- DEVSEL=fast >TAbort- <TAbort- <MAbort- >SERR- <PERR- INTx-
	Latency: 32, Cache Line Size: 64 bytes
	Interrupt: pin A routed to IRQ 138
	Region 0: Memory at b121c000 (64-bit, non-prefetchable) [size=16K]
	Region 4: Memory at b1000000 (64-bit, non-prefetchable) [size=1M]
	Capabilities: <access denied>
	Kernel driver in use: snd_hda_intel

00:1f.4 SMBus [0c05]: Intel Corporation Device [8086:02a3]
	Subsystem: Lenovo Device [17aa:3812]
	Control: I/O+ Mem+ BusMaster- SpecCycle- MemWINV- VGASnoop- ParErr- Stepping- SERR- FastB2B- DisINTx-
	Status: Cap- 66MHz- UDF- FastB2B+ ParErr- DEVSEL=medium >TAbort- <TAbort- <MAbort- >SERR- <PERR- INTx-
	Interrupt: pin A routed to IRQ 16
	Region 0: Memory at b122c000 (64-bit, non-prefetchable) [size=256]
	Region 4: I/O ports at 4040 [size=32]
	Kernel driver in use: i801_smbus

00:1f.5 Serial bus controller [0c80]: Intel Corporation Comet Lake SPI (flash) Controller [8086:02a4]
	Subsystem: Lenovo Device [17aa:3811]
	Control: I/O- Mem+ BusMaster+ SpecCycle- MemWINV- VGASnoop- ParErr- Stepping- SERR- FastB2B- DisINTx+
	Status: Cap- 66MHz- UDF- FastB2B- ParErr- DEVSEL=fast >TAbort- <TAbort- <MAbort- >SERR- <PERR- INTx-
	Latency: 0
	Region 0: Memory at fe010000 (32-bit, non-prefetchable) [size=4K]

01:00.0 Ethernet controller [0200]: Realtek Semiconductor Co., Ltd. RTL8111/8168/8411 PCI Express Gigabit Ethernet Controller [10ec:8168] (rev 10)
	Subsystem: Lenovo Device [17aa:38df]
	Control: I/O+ Mem+ BusMaster+ SpecCycle- MemWINV- VGASnoop- ParErr- Stepping- SERR- FastB2B- DisINTx+
	Status: Cap+ 66MHz- UDF- FastB2B- ParErr- DEVSEL=fast >TAbort- <TAbort- <MAbort- >SERR- <PERR- INTx-
	Latency: 0, Cache Line Size: 64 bytes
	Interrupt: pin A routed to IRQ 17
	Region 0: I/O ports at 3000 [size=256]
	Region 2: Memory at b1104000 (64-bit, non-prefetchable) [size=4K]
	Region 4: Memory at b1100000 (64-bit, non-prefetchable) [size=16K]
	Capabilities: <access denied>
	Kernel driver in use: r8169

