00:00.0 Host bridge [0600]: Advanced Micro Devices, Inc. [AMD/ATI] RD790 Host Bridge [1002:5956]
	Subsystem: Advanced Micro Devices, Inc. [AMD/ATI] RD790 Host Bridge [1002:5956]
	Control: I/O- Mem+ BusMaster+ SpecCycle- MemWINV- VGASnoop- ParErr- Stepping- SERR- FastB2B- DisINTx-
	Status: Cap+ 66MHz+ UDF- FastB2B- ParErr- DEVSEL=medium >TAbort- <TAbort- <MAbort+ >SERR- <PERR- INTx-
	Latency: 0
	NUMA node: 0
	Region 3: Memory at <ignored> (64-bit, non-prefetchable)
	Capabilities: <access denied>

00:02.0 PCI bridge [0604]: Advanced Micro Devices, Inc. [AMD/ATI] RX780/RD790 PCI to PCI bridge (external gfx0 port A) [1002:5978] (prog-if 00 [Normal decode])
	Control: I/O+ Mem+ BusMaster+ SpecCycle- MemWINV- VGASnoop- ParErr- Stepping- SERR+ FastB2B- DisINTx+
	Status: Cap+ 66MHz- UDF- FastB2B- ParErr- DEVSEL=fast >TAbort- <TAbort- <MAbort- >SERR- <PERR- INTx-
	Latency: 0, Cache Line Size: 64 bytes
	Interrupt: pin A routed to IRQ 24
	NUMA node: 0
	Bus: primary=00, secondary=01, subordinate=01, sec-latency=0
	I/O behind bridge: 00009000-00009fff [size=4K]
	Memory behind bridge: fd000000-fe6fffff [size=23M]
	Prefetchable memory behind bridge: 00000000d6000000-00000000dfffffff [size=160M]
	Secondary status: 66MHz- FastB2B- ParErr- DEVSEL=fast >TAbort- <TAbort- <MAbort+ <SERR- <PERR-
	BridgeCtl: Parity+ SERR+ NoISA- VGA+ VGA16+ MAbort- >Reset- FastB2B-
		PriDiscTmr- SecDiscTmr- DiscTmrStat- DiscTmrSERREn-
	Capabilities: <access denied>
	Kernel driver in use: pcieport

00:04.0 PCI bridge [0604]: Advanced Micro Devices, Inc. [AMD/ATI] RD790 PCI to PCI bridge (PCI express gpp port A) [1002:597a] (prog-if 00 [Normal decode])
	Control: I/O+ Mem+ BusMaster+ SpecCycle- MemWINV- VGASnoop- ParErr- Stepping- SERR+ FastB2B- DisINTx+
	Status: Cap+ 66MHz- UDF- FastB2B- ParErr- DEVSEL=fast >TAbort- <TAbort- <MAbort- >SERR- <PERR- INTx-
	Latency: 0, Cache Line Size: 64 bytes
	Interrupt: pin A routed to IRQ 25
	NUMA node: 0
	Bus: primary=00, secondary=02, subordinate=02, sec-latency=0
	I/O behind bridge: 0000a000-0000bfff [size=8K]
	Memory behind bridge: fe700000-fe7fffff [size=1M]
	Prefetchable memory behind bridge: None
	Secondary status: 66MHz- FastB2B- ParErr- DEVSEL=fast >TAbort- <TAbort- <MAbort+ <SERR- <PERR-
	BridgeCtl: Parity+ SERR+ NoISA- VGA- VGA16- MAbort- >Reset- FastB2B-
		PriDiscTmr- SecDiscTmr- DiscTmrStat- DiscTmrSERREn-
	Capabilities: <access denied>
	Kernel driver in use: pcieport

00:06.0 PCI bridge [0604]: Advanced Micro Devices, Inc. [AMD/ATI] RD790 PCI to PCI bridge (PCI express gpp port C) [1002:597c] (prog-if 00 [Normal decode])
	Control: I/O+ Mem+ BusMaster+ SpecCycle- MemWINV- VGASnoop- ParErr- Stepping- SERR+ FastB2B- DisINTx+
	Status: Cap+ 66MHz- UDF- FastB2B- ParErr- DEVSEL=fast >TAbort- <TAbort- <MAbort- >SERR- <PERR- INTx-
	Latency: 0, Cache Line Size: 64 bytes
	Interrupt: pin A routed to IRQ 26
	NUMA node: 0
	Bus: primary=00, secondary=03, subordinate=03, sec-latency=0
	I/O behind bridge: 0000c000-0000cfff [size=4K]
	Memory behind bridge: fe800000-fe8fffff [size=1M]
	Prefetchable memory behind bridge: None
	Secondary status: 66MHz- FastB2B- ParErr- DEVSEL=fast >TAbort- <TAbort- <MAbort+ <SERR- <PERR-
	BridgeCtl: Parity+ SERR+ NoISA- VGA- VGA16- MAbort- >Reset- FastB2B-
		PriDiscTmr- SecDiscTmr- DiscTmrStat- DiscTmrSERREn-
	Capabilities: <access denied>
	Kernel driver in use: pcieport

00:07.0 PCI bridge [0604]: Advanced Micro Devices, Inc. [AMD/ATI] RX780/RD790 PCI to PCI bridge (PCI express gpp port D) [1002:597d] (prog-if 00 [Normal decode])
	Control: I/O+ Mem+ BusMaster+ SpecCycle- MemWINV- VGASnoop- ParErr- Stepping- SERR+ FastB2B- DisINTx+
	Status: Cap+ 66MHz- UDF- FastB2B- ParErr- DEVSEL=fast >TAbort- <TAbort- <MAbort- >SERR- <PERR- INTx-
	Latency: 0, Cache Line Size: 64 bytes
	Interrupt: pin A routed to IRQ 27
	NUMA node: 0
	Bus: primary=00, secondary=04, subordinate=04, sec-latency=0
	I/O behind bridge: 0000d000-0000efff [size=8K]
	Memory behind bridge: fe900000-fe9fffff [size=1M]
	Prefetchable memory behind bridge: None
	Secondary status: 66MHz- FastB2B- ParErr- DEVSEL=fast >TAbort- <TAbort- <MAbort+ <SERR- <PERR-
	BridgeCtl: Parity+ SERR+ NoISA- VGA- VGA16- MAbort- >Reset- FastB2B-
		PriDiscTmr- SecDiscTmr- DiscTmrStat- DiscTmrSERREn-
	Capabilities: <access denied>
	Kernel driver in use: pcieport

00:09.0 PCI bridge [0604]: Advanced Micro Devices, Inc. [AMD/ATI] RD790 PCI to PCI bridge (PCI express gpp port E) [1002:597e] (prog-if 00 [Normal decode])
	Control: I/O- Mem+ BusMaster+ SpecCycle- MemWINV- VGASnoop- ParErr- Stepping- SERR+ FastB2B- DisINTx+
	Status: Cap+ 66MHz- UDF- FastB2B- ParErr- DEVSEL=fast >TAbort- <TAbort- <MAbort- >SERR- <PERR- INTx-
	Latency: 0, Cache Line Size: 64 bytes
	Interrupt: pin A routed to IRQ 28
	NUMA node: 0
	Bus: primary=00, secondary=05, subordinate=05, sec-latency=0
	I/O behind bridge: None
	Memory behind bridge: fea00000-feafffff [size=1M]
	Prefetchable memory behind bridge: None
	Secondary status: 66MHz- FastB2B- ParErr- DEVSEL=fast >TAbort- <TAbort- <MAbort+ <SERR- <PERR-
	BridgeCtl: Parity+ SERR+ NoISA- VGA- VGA16- MAbort- >Reset- FastB2B-
		PriDiscTmr- SecDiscTmr- DiscTmrStat- DiscTmrSERREn-
	Capabilities: <access denied>
	Kernel driver in use: pcieport

00:12.0 SATA controller [0106]: Advanced Micro Devices, Inc. [AMD/ATI] SB600 Non-Raid-5 SATA [1002:4380] (prog-if 01 [AHCI 1.0])
	Subsystem: ASUSTeK Computer Inc. Device [1043:8231]
	Control: I/O+ Mem+ BusMaster+ SpecCycle- MemWINV- VGASnoop- ParErr- Stepping- SERR+ FastB2B- DisINTx-
	Status: Cap+ 66MHz+ UDF- FastB2B- ParErr- DEVSEL=medium >TAbort- <TAbort- <MAbort- >SERR- <PERR- INTx-
	Latency: 64, Cache Line Size: 64 bytes
	Interrupt: pin A routed to IRQ 22
	NUMA node: 0
	Region 0: I/O ports at 8000 [size=8]
	Region 1: I/O ports at 7000 [size=4]
	Region 2: I/O ports at 6000 [size=8]
	Region 3: I/O ports at 5000 [size=4]
	Region 4: I/O ports at 4000 [size=16]
	Region 5: Memory at fcfff800 (32-bit, non-prefetchable) [size=1K]
	Capabilities: <access denied>
	Kernel driver in use: ahci
	Kernel modules: ahci

00:13.0 USB controller [0c03]: Advanced Micro Devices, Inc. [AMD/ATI] SB600 USB (OHCI0) [1002:4387] (prog-if 10 [OHCI])
	Subsystem: ASUSTeK Computer Inc. Device [1043:8288]
	Control: I/O+ Mem+ BusMaster+ SpecCycle- MemWINV+ VGASnoop- ParErr- Stepping- SERR+ FastB2B- DisINTx-
	Status: Cap- 66MHz+ UDF- FastB2B+ ParErr- DEVSEL=medium >TAbort- <TAbort- <MAbort- >SERR- <PERR- INTx-
	Latency: 64, Cache Line Size: 64 bytes
	Interrupt: pin A routed to IRQ 16
	NUMA node: 0
	Region 0: Memory at fcffe000 (32-bit, non-prefetchable) [size=4K]
	Kernel driver in use: ohci-pci

00:13.1 USB controller [0c03]: Advanced Micro Devices, Inc. [AMD/ATI] SB600 USB (OHCI1) [1002:4388] (prog-if 10 [OHCI])
	Subsystem: ASUSTeK Computer Inc. Device [1043:8288]
	Control: I/O+ Mem+ BusMaster+ SpecCycle- MemWINV+ VGASnoop- ParErr- Stepping- SERR+ FastB2B- DisINTx-
	Status: Cap- 66MHz+ UDF- FastB2B+ ParErr- DEVSEL=medium >TAbort- <TAbort- <MAbort- >SERR- <PERR- INTx-
	Latency: 64, Cache Line Size: 64 bytes
	Interrupt: pin B routed to IRQ 17
	NUMA node: 0
	Region 0: Memory at fcffd000 (32-bit, non-prefetchable) [size=4K]
	Kernel driver in use: ohci-pci

00:13.2 USB controller [0c03]: Advanced Micro Devices, Inc. [AMD/ATI] SB600 USB (OHCI2) [1002:4389] (prog-if 10 [OHCI])
	Subsystem: ASUSTeK Computer Inc. Device [1043:8288]
	Control: I/O+ Mem+ BusMaster+ SpecCycle- MemWINV+ VGASnoop- ParErr- Stepping- SERR+ FastB2B- DisINTx-
	Status: Cap- 66MHz+ UDF- FastB2B+ ParErr- DEVSEL=medium >TAbort- <TAbort- <MAbort- >SERR- <PERR- INTx-
	Latency: 64, Cache Line Size: 64 bytes
	Interrupt: pin C routed to IRQ 18
	NUMA node: 0
	Region 0: Memory at fcffc000 (32-bit, non-prefetchable) [size=4K]
	Kernel driver in use: ohci-pci

00:13.3 USB controller [0c03]: Advanced Micro Devices, Inc. [AMD/ATI] SB600 USB (OHCI3) [1002:438a] (prog-if 10 [OHCI])
	Subsystem: ASUSTeK Computer Inc. Device [1043:8288]
	Control: I/O+ Mem+ BusMaster+ SpecCycle- MemWINV+ VGASnoop- ParErr- Stepping- SERR+ FastB2B- DisINTx-
	Status: Cap- 66MHz+ UDF- FastB2B+ ParErr- DEVSEL=medium >TAbort- <TAbort- <MAbort- >SERR- <PERR- INTx-
	Latency: 64, Cache Line Size: 64 bytes
	Interrupt: pin B routed to IRQ 17
	NUMA node: 0
	Region 0: Memory at fcffb000 (32-bit, non-prefetchable) [size=4K]
	Kernel driver in use: ohci-pci

00:13.4 USB controller [0c03]: Advanced Micro Devices, Inc. [AMD/ATI] SB600 USB (OHCI4) [1002:438b] (prog-if 10 [OHCI])
	Subsystem: ASUSTeK Computer Inc. Device [1043:8288]
	Control: I/O+ Mem+ BusMaster+ SpecCycle- MemWINV+ VGASnoop- ParErr- Stepping- SERR+ FastB2B- DisINTx-
	Status: Cap- 66MHz+ UDF- FastB2B+ ParErr- DEVSEL=medium >TAbort- <TAbort- <MAbort- >SERR- <PERR- INTx-
	Latency: 64, Cache Line Size: 64 bytes
	Interrupt: pin C routed to IRQ 18
	NUMA node: 0
	Region 0: Memory at fcffa000 (32-bit, non-prefetchable) [size=4K]
	Kernel driver in use: ohci-pci

00:13.5 USB controller [0c03]: Advanced Micro Devices, Inc. [AMD/ATI] SB600 USB Controller (EHCI) [1002:4386] (prog-if 20 [EHCI])
	Subsystem: ASUSTeK Computer Inc. Device [1043:8288]
	Control: I/O+ Mem+ BusMaster+ SpecCycle- MemWINV+ VGASnoop- ParErr- Stepping- SERR+ FastB2B- DisINTx-
	Status: Cap+ 66MHz+ UDF- FastB2B+ ParErr- DEVSEL=medium >TAbort- <TAbort- <MAbort- >SERR- <PERR- INTx-
	Latency: 64, Cache Line Size: 64 bytes
	Interrupt: pin D routed to IRQ 19
	NUMA node: 0
	Region 0: Memory at fcfff000 (32-bit, non-prefetchable) [size=256]
	Capabilities: <access denied>
	Kernel driver in use: ehci-pci

00:14.0 SMBus [0c05]: Advanced Micro Devices, Inc. [AMD/ATI] SBx00 SMBus Controller [1002:4385] (rev 14)
	Subsystem: ASUSTeK Computer Inc. Device [1043:8288]
	Control: I/O+ Mem+ BusMaster- SpecCycle- MemWINV- VGASnoop- ParErr- Stepping- SERR- FastB2B- DisINTx+
	Status: Cap+ 66MHz+ UDF- FastB2B- ParErr- DEVSEL=medium >TAbort- <TAbort- <MAbort- >SERR- <PERR- INTx-
	NUMA node: 0
	Region 0: I/O ports at 0b00 [size=16]
	Capabilities: <access denied>
	Kernel modules: i2c_piix4, sp5100_tco

00:14.1 IDE interface [0101]: Advanced Micro Devices, Inc. [AMD/ATI] SB600 IDE [1002:438c] (prog-if 8a [ISA Compatibility mode controller, supports both channels switched to PCI native mode, supports bus mastering])
	Subsystem: ASUSTeK Computer Inc. Device [1043:8288]
	Control: I/O+ Mem- BusMaster+ SpecCycle- MemWINV- VGASnoop- ParErr- Stepping- SERR- FastB2B- DisINTx-
	Status: Cap- 66MHz+ UDF- FastB2B- ParErr- DEVSEL=medium >TAbort- <TAbort- <MAbort- >SERR- <PERR- INTx-
	Latency: 64
	Interrupt: pin A routed to IRQ 16
	NUMA node: 0
	Region 0: [virtual] Memory at 000001f0 (32-bit, non-prefetchable) [size=8]
	Region 1: [virtual] Memory at 000003f0 (type 3, non-prefetchable)
	Region 2: [virtual] Memory at 00000170 (32-bit, non-prefetchable) [size=8]
	Region 3: [virtual] Memory at 00000370 (type 3, non-prefetchable)
	Region 4: I/O ports at ff00 [size=16]
	Kernel driver in use: pata_atiixp
	Kernel modules: pata_atiixp, pata_acpi

00:14.2 Audio device [0403]: Advanced Micro Devices, Inc. [AMD/ATI] SBx00 Azalia (Intel HDA) [1002:4383]
	Subsystem: ASUSTeK Computer Inc. Device [1043:8288]
	Control: I/O- Mem+ BusMaster+ SpecCycle- MemWINV- VGASnoop- ParErr- Stepping- SERR- FastB2B- DisINTx-
	Status: Cap+ 66MHz- UDF- FastB2B- ParErr- DEVSEL=slow >TAbort- <TAbort- <MAbort- >SERR- <PERR- INTx-
	Latency: 64, Cache Line Size: 64 bytes
	Interrupt: pin A routed to IRQ 16
	NUMA node: 0
	Region 0: Memory at fcff4000 (64-bit, non-prefetchable) [size=16K]
	Capabilities: <access denied>
	Kernel driver in use: snd_hda_intel
	Kernel modules: snd_hda_intel

00:14.3 ISA bridge [0601]: Advanced Micro Devices, Inc. [AMD/ATI] SB600 PCI to LPC Bridge [1002:438d]
	Subsystem: ASUSTeK Computer Inc. Device [1043:8288]
	Control: I/O+ Mem+ BusMaster+ SpecCycle+ MemWINV- VGASnoop- ParErr- Stepping- SERR- FastB2B- DisINTx-
	Status: Cap- 66MHz+ UDF- FastB2B- ParErr- DEVSEL=medium >TAbort- <TAbort- <MAbort- >SERR- <PERR- INTx-
	Latency: 0
	NUMA node: 0

00:14.4 PCI bridge [0604]: Advanced Micro Devices, Inc. [AMD/ATI] SBx00 PCI to PCI Bridge [1002:4384] (prog-if 01 [Subtractive decode])
	Control: I/O+ Mem+ BusMaster+ SpecCycle- MemWINV- VGASnoop- ParErr- Stepping- SERR+ FastB2B- DisINTx-
	Status: Cap- 66MHz+ UDF- FastB2B+ ParErr- DEVSEL=medium >TAbort- <TAbort- <MAbort- >SERR- <PERR- INTx-
	Latency: 64
	NUMA node: 0
	Bus: primary=00, secondary=06, subordinate=06, sec-latency=64
	I/O behind bridge: None
	Memory behind bridge: feb00000-febfffff [size=1M]
	Prefetchable memory behind bridge: None
	Secondary status: 66MHz- FastB2B+ ParErr- DEVSEL=medium >TAbort- <TAbort- <MAbort+ <SERR- <PERR-
	BridgeCtl: Parity+ SERR+ NoISA- VGA- VGA16- MAbort- >Reset- FastB2B-
		PriDiscTmr- SecDiscTmr- DiscTmrStat- DiscTmrSERREn-

00:18.0 Host bridge [0600]: Advanced Micro Devices, Inc. [AMD] Family 10h Processor HyperTransport Configuration [1022:1200]
	Control: I/O- Mem- BusMaster- SpecCycle- MemWINV- VGASnoop- ParErr- Stepping- SERR- FastB2B- DisINTx-
	Status: Cap+ 66MHz- UDF- FastB2B- ParErr- DEVSEL=fast >TAbort- <TAbort- <MAbort- >SERR- <PERR- INTx-
	NUMA node: 0
	Capabilities: <access denied>

00:18.1 Host bridge [0600]: Advanced Micro Devices, Inc. [AMD] Family 10h Processor Address Map [1022:1201]
	Control: I/O- Mem- BusMaster- SpecCycle- MemWINV- VGASnoop- ParErr- Stepping- SERR- FastB2B- DisINTx-
	Status: Cap- 66MHz- UDF- FastB2B- ParErr- DEVSEL=fast >TAbort- <TAbort- <MAbort- >SERR- <PERR- INTx-
	NUMA node: 0

00:18.2 Host bridge [0600]: Advanced Micro Devices, Inc. [AMD] Family 10h Processor DRAM Controller [1022:1202]
	Control: I/O- Mem- BusMaster- SpecCycle- MemWINV- VGASnoop- ParErr- Stepping- SERR- FastB2B- DisINTx-
	Status: Cap- 66MHz- UDF- FastB2B- ParErr- DEVSEL=fast >TAbort- <TAbort- <MAbort- >SERR- <PERR- INTx-
	NUMA node: 0

00:18.3 Host bridge [0600]: Advanced Micro Devices, Inc. [AMD] Family 10h Processor Miscellaneous Control [1022:1203]
	Control: I/O- Mem- BusMaster- SpecCycle- MemWINV- VGASnoop- ParErr- Stepping- SERR- FastB2B- DisINTx-
	Status: Cap+ 66MHz- UDF- FastB2B- ParErr- DEVSEL=fast >TAbort- <TAbort- <MAbort- >SERR- <PERR- INTx-
	NUMA node: 0
	Capabilities: <access denied>
	Kernel driver in use: k10temp
	Kernel modules: k10temp

00:18.4 Host bridge [0600]: Advanced Micro Devices, Inc. [AMD] Family 10h Processor Link Control [1022:1204]
	Control: I/O- Mem- BusMaster- SpecCycle- MemWINV- VGASnoop- ParErr- Stepping- SERR- FastB2B- DisINTx-
	Status: Cap- 66MHz- UDF- FastB2B- ParErr- DEVSEL=fast >TAbort- <TAbort- <MAbort- >SERR- <PERR- INTx-
	NUMA node: 0

01:00.0 VGA compatible controller [0300]: NVIDIA Corporation GK208B [GeForce GT 710] [10de:128b] (rev a1) (prog-if 00 [VGA controller])
	Subsystem: NVIDIA Corporation Device [10de:118b]
	Control: I/O+ Mem+ BusMaster+ SpecCycle- MemWINV- VGASnoop- ParErr- Stepping- SERR+ FastB2B- DisINTx+
	Status: Cap+ 66MHz- UDF- FastB2B- ParErr- DEVSEL=fast >TAbort- <TAbort- <MAbort- >SERR- <PERR- INTx-
	Latency: 0, Cache Line Size: 64 bytes
	Interrupt: pin A routed to IRQ 30
	NUMA node: 0
	Region 0: Memory at fd000000 (32-bit, non-prefetchable) [size=16M]
	Region 1: Memory at d8000000 (64-bit, prefetchable) [size=128M]
	Region 3: Memory at d6000000 (64-bit, prefetchable) [size=32M]
	Region 5: I/O ports at 9800 [size=128]
	Expansion ROM at 000c0000 [disabled] [size=128K]
	Capabilities: <access denied>
	Kernel driver in use: nouveau
	Kernel modules: nvidiafb, nouveau

01:00.1 Audio device [0403]: NVIDIA Corporation GK208 HDMI/DP Audio Controller [10de:0e0f] (rev a1)
	Subsystem: NVIDIA Corporation Device [10de:118b]
	Control: I/O- Mem+ BusMaster+ SpecCycle- MemWINV- VGASnoop- ParErr- Stepping- SERR+ FastB2B- DisINTx-
	Status: Cap+ 66MHz- UDF- FastB2B- ParErr- DEVSEL=fast >TAbort- <TAbort- <MAbort- >SERR- <PERR- INTx-
	Latency: 0, Cache Line Size: 64 bytes
	Interrupt: pin B routed to IRQ 19
	NUMA node: 0
	Region 0: Memory at fe67c000 (32-bit, non-prefetchable) [size=16K]
	Capabilities: <access denied>
	Kernel driver in use: snd_hda_intel
	Kernel modules: snd_hda_intel

02:00.0 IDE interface [0101]: Marvell Technology Group Ltd. 88SE6111/6121 SATA II / PATA Controller [11ab:6121] (rev b1) (prog-if 8f [PCI native mode controller, supports both channels switched to ISA compatibility mode, supports bus mastering])
	Subsystem: Marvell Technology Group Ltd. 88SE6111/6121 1/2 port SATA II + 1 port PATA Controller [11ab:6121]
	Control: I/O+ Mem+ BusMaster+ SpecCycle- MemWINV- VGASnoop- ParErr- Stepping- SERR+ FastB2B- DisINTx-
	Status: Cap+ 66MHz- UDF- FastB2B- ParErr- DEVSEL=fast >TAbort- <TAbort- <MAbort- >SERR- <PERR- INTx-
	Latency: 0, Cache Line Size: 64 bytes
	Interrupt: pin A routed to IRQ 16
	NUMA node: 0
	Region 0: I/O ports at b800 [size=8]
	Region 1: I/O ports at b400 [size=4]
	Region 2: I/O ports at b000 [size=8]
	Region 3: I/O ports at a800 [size=4]
	Region 4: I/O ports at a400 [size=16]
	Region 5: Memory at fe7ffc00 (32-bit, non-prefetchable) [size=1K]
	Capabilities: <access denied>
	Kernel driver in use: pata_marvell
	Kernel modules: ahci, pata_marvell, pata_acpi

03:00.0 Ethernet controller [0200]: Marvell Technology Group Ltd. 88E8056 PCI-E Gigabit Ethernet Controller [11ab:4364] (rev 12)
	Subsystem: ASUSTeK Computer Inc. Motherboard [1043:81f8]
	Control: I/O+ Mem+ BusMaster+ SpecCycle- MemWINV- VGASnoop- ParErr- Stepping- SERR+ FastB2B- DisINTx+
	Status: Cap+ 66MHz- UDF- FastB2B- ParErr- DEVSEL=fast >TAbort- <TAbort- <MAbort- >SERR- <PERR- INTx-
	Latency: 0, Cache Line Size: 64 bytes
	Interrupt: pin A routed to IRQ 29
	NUMA node: 0
	Region 0: Memory at fe8fc000 (64-bit, non-prefetchable) [size=16K]
	Region 2: I/O ports at c800 [size=256]
	Expansion ROM at fe8c0000 [disabled] [size=128K]
	Capabilities: <access denied>
	Kernel driver in use: sky2
	Kernel modules: sky2

04:00.0 IDE interface [0101]: Marvell Technology Group Ltd. 88SE6111/6121 SATA II / PATA Controller [11ab:6121] (rev b2) (prog-if 8f [PCI native mode controller, supports both channels switched to ISA compatibility mode, supports bus mastering])
	Subsystem: Marvell Technology Group Ltd. 88SE6111/6121 1/2 port SATA II + 1 port PATA Controller [11ab:6121]
	Control: I/O+ Mem+ BusMaster+ SpecCycle- MemWINV- VGASnoop- ParErr- Stepping- SERR+ FastB2B- DisINTx-
	Status: Cap+ 66MHz- UDF- FastB2B- ParErr- DEVSEL=fast >TAbort- <TAbort- <MAbort- >SERR- <PERR- INTx-
	Latency: 0, Cache Line Size: 64 bytes
	Interrupt: pin A routed to IRQ 19
	NUMA node: 0
	Region 0: I/O ports at e800 [size=8]
	Region 1: I/O ports at e400 [size=4]
	Region 2: I/O ports at e000 [size=8]
	Region 3: I/O ports at d800 [size=4]
	Region 4: I/O ports at d400 [size=16]
	Region 5: Memory at fe9ffc00 (32-bit, non-prefetchable) [size=1K]
	Capabilities: <access denied>
	Kernel driver in use: pata_marvell
	Kernel modules: ahci, pata_marvell, pata_acpi

05:00.0 Ethernet controller [0200]: Qualcomm Atheros AR242x / AR542x Wireless Network Adapter (PCI-Express) [168c:001c] (rev 01)
	Subsystem: AzureWave Device [1a3b:1034]
	Control: I/O+ Mem+ BusMaster+ SpecCycle- MemWINV- VGASnoop- ParErr- Stepping- SERR+ FastB2B- DisINTx-
	Status: Cap+ 66MHz- UDF- FastB2B- ParErr- DEVSEL=fast >TAbort- <TAbort- <MAbort- >SERR- <PERR- INTx-
	Latency: 0, Cache Line Size: 64 bytes
	Interrupt: pin A routed to IRQ 17
	NUMA node: 0
	Region 0: Memory at feaf0000 (64-bit, non-prefetchable) [size=64K]
	Capabilities: <access denied>
	Kernel driver in use: ath5k
	Kernel modules: ath5k

06:08.0 FireWire (IEEE 1394) [0c00]: LSI Corporation FW322/323 [TrueFire] 1394a Controller [11c1:5811] (rev 70) (prog-if 10 [OHCI])
	Subsystem: ASUSTeK Computer Inc. LSI FW322/323 IEEE 1394a FireWire Controller [1043:8294]
	Control: I/O- Mem+ BusMaster+ SpecCycle- MemWINV+ VGASnoop- ParErr- Stepping- SERR+ FastB2B- DisINTx-
	Status: Cap+ 66MHz- UDF- FastB2B+ ParErr- DEVSEL=medium >TAbort- <TAbort- <MAbort- >SERR- <PERR- INTx-
	Latency: 64 (3000ns min, 6000ns max), Cache Line Size: 64 bytes
	Interrupt: pin A routed to IRQ 22
	NUMA node: 0
	Region 0: Memory at febff000 (32-bit, non-prefetchable) [size=4K]
	Capabilities: <access denied>
	Kernel driver in use: firewire_ohci
	Kernel modules: firewire_ohci

