00:00.0 Host bridge [0600]: VIA Technologies, Inc. VX900 Host Bridge: Host Control [1106:0410] (rev 80)
	Subsystem: VIA Technologies, Inc. Device [1106:3410]
	Control: I/O- Mem+ BusMaster+ SpecCycle- MemWINV- VGASnoop- ParErr- Stepping- SERR- FastB2B- DisINTx-
	Status: Cap- 66MHz- UDF- FastB2B- ParErr- DEVSEL=medium >TAbort- <TAbort- <MAbort- >SERR- <PERR- INTx-
	Latency: 32, Cache Line Size: 32 bytes

00:00.1 Host bridge [0600]: VIA Technologies, Inc. VX900 Error Reporting [1106:1410]
	Subsystem: Device [5f3f:0877]
	Control: I/O- Mem+ BusMaster+ SpecCycle- MemWINV- VGASnoop- ParErr- Stepping- SERR- FastB2B- DisINTx-
	Status: Cap- 66MHz- UDF- FastB2B- ParErr- DEVSEL=medium >TAbort- <TAbort- <MAbort- >SERR- <PERR- INTx-
	Latency: 0, Cache Line Size: 32 bytes

00:00.2 Host bridge [0600]: VIA Technologies, Inc. VX900 CPU Bus Controller [1106:2410]
	Subsystem: Device [1c88:43df]
	Control: I/O- Mem+ BusMaster+ SpecCycle- MemWINV- VGASnoop- ParErr- Stepping- SERR- FastB2B- DisINTx-
	Status: Cap- 66MHz- UDF- FastB2B- ParErr- DEVSEL=medium >TAbort- <TAbort- <MAbort- >SERR- <PERR- INTx-
	Latency: 0, Cache Line Size: 32 bytes

00:00.3 Host bridge [0600]: VIA Technologies, Inc. VX900 DRAM Bus Control [1106:3410]
	Subsystem: VIA Technologies, Inc. VX900 DRAM Bus Control [1106:3410]
	Control: I/O- Mem+ BusMaster+ SpecCycle- MemWINV- VGASnoop- ParErr- Stepping- SERR- FastB2B- DisINTx-
	Status: Cap- 66MHz- UDF- FastB2B- ParErr- DEVSEL=medium >TAbort- <TAbort- <MAbort- >SERR- <PERR- INTx-
	Latency: 0

00:00.4 Host bridge [0600]: VIA Technologies, Inc. VX900 Power Management and Chip Testing Control [1106:4410]
	Subsystem: VIA Technologies, Inc. VX900 Power Management and Chip Testing Control [1106:4410]
	Control: I/O- Mem+ BusMaster+ SpecCycle- MemWINV- VGASnoop- ParErr- Stepping- SERR- FastB2B- DisINTx-
	Status: Cap- 66MHz- UDF- FastB2B- ParErr- DEVSEL=medium >TAbort- <TAbort- <MAbort- >SERR- <PERR- INTx-
	Latency: 0, Cache Line Size: 32 bytes

00:00.5 Host bridge [0600]: VIA Technologies, Inc. VX900 APIC and Central Traffic Control [1106:5410]
	Subsystem: Device [2a58:2b69]
	Control: I/O- Mem+ BusMaster+ SpecCycle- MemWINV- VGASnoop- ParErr- Stepping- SERR- FastB2B- DisINTx-
	Status: Cap- 66MHz- UDF- FastB2B- ParErr- DEVSEL=fast >TAbort- <TAbort- <MAbort- >SERR- <PERR- INTx-
	Latency: 0, Cache Line Size: 32 bytes

00:00.6 Host bridge [0600]: VIA Technologies, Inc. VX900 Scratch Registers [1106:6410]
	Subsystem: VIA Technologies, Inc. VX900 Scratch Registers [1106:6410]
	Control: I/O- Mem+ BusMaster+ SpecCycle- MemWINV- VGASnoop- ParErr- Stepping- SERR- FastB2B- DisINTx-
	Status: Cap- 66MHz- UDF- FastB2B- ParErr- DEVSEL=medium >TAbort- <TAbort- <MAbort- >SERR- <PERR- INTx-
	Latency: 0, Cache Line Size: 32 bytes

00:00.7 Host bridge [0600]: VIA Technologies, Inc. VX900 North-South Module Interface Control [1106:7410]
	Subsystem: VIA Technologies, Inc. VX900 North-South Module Interface Control [1106:7410]
	Control: I/O- Mem+ BusMaster+ SpecCycle- MemWINV- VGASnoop- ParErr- Stepping- SERR- FastB2B- DisINTx-
	Status: Cap- 66MHz- UDF- FastB2B- ParErr- DEVSEL=medium >TAbort- <TAbort- <MAbort- >SERR- <PERR- INTx-
	Latency: 0, Cache Line Size: 32 bytes

00:01.0 VGA compatible controller [0300]: VIA Technologies, Inc. VX900 Graphics [Chrome9 HD] [1106:7122] (prog-if 00 [VGA controller])
	Subsystem: VIA Technologies, Inc. VX900 Graphics [Chrome9 HD] [1106:7122]
	Control: I/O+ Mem+ BusMaster+ SpecCycle- MemWINV- VGASnoop- ParErr- Stepping- SERR- FastB2B- DisINTx-
	Status: Cap+ 66MHz- UDF- FastB2B- ParErr- DEVSEL=fast >TAbort- <TAbort- <MAbort- >SERR- <PERR- INTx-
	Latency: 32
	Interrupt: pin A routed to IRQ 11
	Region 0: Memory at fa000000 (32-bit, non-prefetchable) [size=16M]
	Region 1: Memory at f9000000 (32-bit, non-prefetchable) [size=16M]
	Region 2: Memory at f4000000 (32-bit, prefetchable) [size=64M]
	[virtual] Expansion ROM at 000c0000 [disabled] [size=128K]
	Capabilities: <access denied>
	Kernel modules: viafb

00:01.1 Audio device [0403]: VIA Technologies, Inc. Device [1106:9170]
	Subsystem: VIA Technologies, Inc. Device [1106:9170]
	Control: I/O- Mem+ BusMaster+ SpecCycle- MemWINV- VGASnoop- ParErr- Stepping- SERR- FastB2B- DisINTx+
	Status: Cap+ 66MHz- UDF- FastB2B- ParErr- DEVSEL=fast >TAbort- <TAbort- <MAbort- >SERR- <PERR- INTx-
	Latency: 0, Cache Line Size: 32 bytes
	Interrupt: pin B routed to IRQ 35
	Region 0: Memory at f8300000 (32-bit, non-prefetchable) [size=16K]
	Capabilities: <access denied>
	Kernel driver in use: snd_hda_intel
	Kernel modules: snd_hda_intel

00:03.0 PCI bridge [0604]: VIA Technologies, Inc. VX900 PCI Express Root Port 0 [1106:a410] (prog-if 00 [Normal decode])
	Control: I/O+ Mem+ BusMaster+ SpecCycle- MemWINV- VGASnoop- ParErr- Stepping- SERR+ FastB2B- DisINTx+
	Status: Cap+ 66MHz- UDF- FastB2B- ParErr- DEVSEL=fast >TAbort- <TAbort- <MAbort- >SERR- <PERR- INTx-
	Latency: 0, Cache Line Size: 32 bytes
	Interrupt: pin A routed to IRQ 25
	Bus: primary=00, secondary=01, subordinate=01, sec-latency=0
	I/O behind bridge: None
	Memory behind bridge: None
	Prefetchable memory behind bridge: None
	Secondary status: 66MHz- FastB2B- ParErr- DEVSEL=fast >TAbort- <TAbort- <MAbort- <SERR- <PERR-
	BridgeCtl: Parity- SERR- NoISA+ VGA- VGA16- MAbort- >Reset- FastB2B-
		PriDiscTmr- SecDiscTmr- DiscTmrStat- DiscTmrSERREn-
	Capabilities: <access denied>
	Kernel driver in use: pcieport
	Kernel modules: shpchp

00:03.1 PCI bridge [0604]: VIA Technologies, Inc. VX900 PCI Express Root Port 1 [1106:b410] (prog-if 00 [Normal decode])
	Control: I/O+ Mem+ BusMaster+ SpecCycle- MemWINV- VGASnoop- ParErr- Stepping- SERR+ FastB2B- DisINTx+
	Status: Cap+ 66MHz- UDF- FastB2B- ParErr- DEVSEL=fast >TAbort- <TAbort- <MAbort- >SERR- <PERR- INTx-
	Latency: 0, Cache Line Size: 32 bytes
	Interrupt: pin B routed to IRQ 27
	Bus: primary=00, secondary=02, subordinate=02, sec-latency=0
	I/O behind bridge: None
	Memory behind bridge: None
	Prefetchable memory behind bridge: None
	Secondary status: 66MHz- FastB2B- ParErr- DEVSEL=fast >TAbort- <TAbort- <MAbort- <SERR- <PERR-
	BridgeCtl: Parity- SERR- NoISA+ VGA- VGA16- MAbort- >Reset- FastB2B-
		PriDiscTmr- SecDiscTmr- DiscTmrStat- DiscTmrSERREn-
	Capabilities: <access denied>
	Kernel driver in use: pcieport
	Kernel modules: shpchp

00:03.2 PCI bridge [0604]: VIA Technologies, Inc. VX900 PCI Express Root Port 2 [1106:c410] (prog-if 00 [Normal decode])
	Control: I/O+ Mem+ BusMaster+ SpecCycle- MemWINV- VGASnoop- ParErr- Stepping- SERR+ FastB2B- DisINTx+
	Status: Cap+ 66MHz- UDF- FastB2B- ParErr- DEVSEL=fast >TAbort- <TAbort- <MAbort- >SERR- <PERR- INTx-
	Latency: 0, Cache Line Size: 32 bytes
	Interrupt: pin C routed to IRQ 29
	Bus: primary=00, secondary=03, subordinate=03, sec-latency=0
	I/O behind bridge: 00005000-00005fff [size=4K]
	Memory behind bridge: f0000000-f03fffff [size=4M]
	Prefetchable memory behind bridge: 00000000f8000000-00000000f80fffff [size=1M]
	Secondary status: 66MHz- FastB2B- ParErr- DEVSEL=fast >TAbort- <TAbort- <MAbort+ <SERR- <PERR-
	BridgeCtl: Parity- SERR- NoISA+ VGA- VGA16- MAbort- >Reset- FastB2B-
		PriDiscTmr- SecDiscTmr- DiscTmrStat- DiscTmrSERREn-
	Capabilities: <access denied>
	Kernel driver in use: pcieport
	Kernel modules: shpchp

00:03.3 PCI bridge [0604]: VIA Technologies, Inc. VX900 PCI Express Root Port 3 [1106:d410] (prog-if 00 [Normal decode])
	Control: I/O+ Mem+ BusMaster+ SpecCycle- MemWINV- VGASnoop- ParErr- Stepping- SERR+ FastB2B- DisINTx+
	Status: Cap+ 66MHz- UDF- FastB2B- ParErr- DEVSEL=fast >TAbort- <TAbort- <MAbort- >SERR- <PERR- INTx-
	Latency: 0, Cache Line Size: 32 bytes
	Interrupt: pin D routed to IRQ 31
	Bus: primary=00, secondary=04, subordinate=04, sec-latency=0
	I/O behind bridge: None
	Memory behind bridge: None
	Prefetchable memory behind bridge: None
	Secondary status: 66MHz- FastB2B- ParErr- DEVSEL=fast >TAbort- <TAbort- <MAbort- <SERR- <PERR-
	BridgeCtl: Parity- SERR- NoISA+ VGA- VGA16- MAbort- >Reset- FastB2B-
		PriDiscTmr- SecDiscTmr- DiscTmrStat- DiscTmrSERREn-
	Capabilities: <access denied>
	Kernel driver in use: pcieport
	Kernel modules: shpchp

00:03.4 Host bridge [0600]: VIA Technologies, Inc. VX900 PCI Express Physical Layer Electrical Sub-block [1106:e410]
	Control: I/O- Mem+ BusMaster+ SpecCycle- MemWINV- VGASnoop- ParErr- Stepping- SERR- FastB2B- DisINTx-
	Status: Cap- 66MHz- UDF- FastB2B- ParErr- DEVSEL=fast >TAbort- <TAbort- <MAbort- >SERR- <PERR- INTx-
	Latency: 0, Cache Line Size: 32 bytes

00:0b.0 Network controller [0280]: VIA Technologies, Inc. VX855/VX875 USB Device Controller [1106:a409] (rev 10)
	Subsystem: VIA Technologies, Inc. VX855/VX875 USB Device Controller [1106:a409]
	Control: I/O+ Mem+ BusMaster+ SpecCycle- MemWINV+ VGASnoop- ParErr- Stepping- SERR- FastB2B- DisINTx-
	Status: Cap+ 66MHz- UDF- FastB2B- ParErr- DEVSEL=medium >TAbort- <TAbort- <MAbort- >SERR- <PERR- INTx-
	Latency: 32, Cache Line Size: 32 bytes
	Interrupt: pin A routed to IRQ 11
	Region 0: Memory at f8308000 (32-bit, non-prefetchable) [size=2K]
	Capabilities: <access denied>

00:0f.0 IDE interface [0101]: VIA Technologies, Inc. VX900 Serial ATA Controller [1106:9001] (prog-if 8a [ISA Compatibility mode controller, supports both channels switched to PCI native mode, supports bus mastering])
	Subsystem: VIA Technologies, Inc. VX900 Serial ATA Controller [1106:9001]
	Control: I/O+ Mem+ BusMaster+ SpecCycle- MemWINV- VGASnoop- ParErr- Stepping- SERR- FastB2B- DisINTx-
	Status: Cap+ 66MHz- UDF- FastB2B+ ParErr- DEVSEL=medium >TAbort- <TAbort- <MAbort- >SERR- <PERR- INTx-
	Latency: 32
	Region 0: [virtual] Memory at 000001f0 (32-bit, non-prefetchable) [size=8]
	Region 1: [virtual] Memory at 000003f0 (type 3, non-prefetchable)
	Region 2: [virtual] Memory at 00000170 (32-bit, non-prefetchable) [size=8]
	Region 3: [virtual] Memory at 00000370 (type 3, non-prefetchable)
	Region 4: I/O ports at 4480 [size=16]
	Capabilities: <access denied>
	Kernel driver in use: pata_via
	Kernel modules: pata_via, pata_acpi

00:10.0 USB controller [0c03]: VIA Technologies, Inc. VT82xx/62xx UHCI USB 1.1 Controller [1106:3038] (rev a0) (prog-if 00 [UHCI])
	Subsystem: VIA Technologies, Inc. VT82xx/62xx UHCI USB 1.1 Controller [1106:3038]
	Control: I/O+ Mem+ BusMaster+ SpecCycle- MemWINV+ VGASnoop- ParErr- Stepping- SERR- FastB2B- DisINTx-
	Status: Cap+ 66MHz- UDF- FastB2B- ParErr- DEVSEL=medium >TAbort- <TAbort- <MAbort- >SERR- <PERR- INTx-
	Latency: 32, Cache Line Size: 32 bytes
	Interrupt: pin A routed to IRQ 20
	Region 4: I/O ports at 4400 [size=32]
	Capabilities: <access denied>
	Kernel driver in use: uhci_hcd

00:10.1 USB controller [0c03]: VIA Technologies, Inc. VT82xx/62xx UHCI USB 1.1 Controller [1106:3038] (rev a0) (prog-if 00 [UHCI])
	Subsystem: VIA Technologies, Inc. VT82xx/62xx UHCI USB 1.1 Controller [1106:3038]
	Control: I/O+ Mem+ BusMaster+ SpecCycle- MemWINV+ VGASnoop- ParErr- Stepping- SERR- FastB2B- DisINTx-
	Status: Cap+ 66MHz- UDF- FastB2B- ParErr- DEVSEL=medium >TAbort- <TAbort- <MAbort- >SERR- <PERR- INTx-
	Latency: 32, Cache Line Size: 32 bytes
	Interrupt: pin B routed to IRQ 22
	Region 4: I/O ports at 4420 [size=32]
	Capabilities: <access denied>
	Kernel driver in use: uhci_hcd

00:10.2 USB controller [0c03]: VIA Technologies, Inc. VT82xx/62xx UHCI USB 1.1 Controller [1106:3038] (rev a0) (prog-if 00 [UHCI])
	Subsystem: VIA Technologies, Inc. VT82xx/62xx UHCI USB 1.1 Controller [1106:3038]
	Control: I/O+ Mem+ BusMaster+ SpecCycle- MemWINV+ VGASnoop- ParErr- Stepping- SERR- FastB2B- DisINTx-
	Status: Cap+ 66MHz- UDF- FastB2B- ParErr- DEVSEL=medium >TAbort- <TAbort- <MAbort- >SERR- <PERR- INTx-
	Latency: 32, Cache Line Size: 32 bytes
	Interrupt: pin C routed to IRQ 21
	Region 4: I/O ports at 4440 [size=32]
	Capabilities: <access denied>
	Kernel driver in use: uhci_hcd

00:10.3 USB controller [0c03]: VIA Technologies, Inc. VT82xx/62xx UHCI USB 1.1 Controller [1106:3038] (rev a0) (prog-if 00 [UHCI])
	Subsystem: VIA Technologies, Inc. VT82xx/62xx UHCI USB 1.1 Controller [1106:3038]
	Control: I/O+ Mem+ BusMaster+ SpecCycle- MemWINV+ VGASnoop- ParErr- Stepping- SERR- FastB2B- DisINTx-
	Status: Cap+ 66MHz- UDF- FastB2B- ParErr- DEVSEL=medium >TAbort- <TAbort- <MAbort- >SERR- <PERR- INTx-
	Latency: 32, Cache Line Size: 32 bytes
	Interrupt: pin D routed to IRQ 23
	Region 4: I/O ports at 4460 [size=32]
	Capabilities: <access denied>
	Kernel driver in use: uhci_hcd

00:10.4 USB controller [0c03]: VIA Technologies, Inc. USB 2.0 [1106:3104] (rev 90) (prog-if 20 [EHCI])
	Subsystem: VIA Technologies, Inc. USB 2.0 Controller [1106:3104]
	Control: I/O+ Mem+ BusMaster+ SpecCycle- MemWINV+ VGASnoop- ParErr- Stepping- SERR- FastB2B- DisINTx-
	Status: Cap+ 66MHz- UDF- FastB2B- ParErr- DEVSEL=medium >TAbort- <TAbort- <MAbort- >SERR- <PERR- INTx-
	Latency: 32, Cache Line Size: 32 bytes
	Interrupt: pin D routed to IRQ 23
	Region 0: Memory at f8308800 (32-bit, non-prefetchable) [size=256]
	Capabilities: <access denied>
	Kernel driver in use: ehci-pci

00:11.0 ISA bridge [0601]: VIA Technologies, Inc. VX900 Bus Control and Power Management [1106:8410]
	Subsystem: VIA Technologies, Inc. VX900 Bus Control and Power Management [1106:8410]
	Control: I/O+ Mem+ BusMaster- SpecCycle- MemWINV- VGASnoop- ParErr- Stepping- SERR- FastB2B- DisINTx-
	Status: Cap+ 66MHz- UDF- FastB2B- ParErr- DEVSEL=medium >TAbort- <TAbort- <MAbort- >SERR- <PERR- INTx-
	Capabilities: <access denied>
	Kernel modules: i2c_viapro

00:11.7 Host bridge [0600]: VIA Technologies, Inc. VX8xx South-North Module Interface Control [1106:a353]
	Subsystem: VIA Technologies, Inc. VX8xx South-North Module Interface Control [1106:a353]
	Control: I/O- Mem+ BusMaster+ SpecCycle- MemWINV- VGASnoop- ParErr- Stepping- SERR+ FastB2B- DisINTx-
	Status: Cap- 66MHz- UDF- FastB2B- ParErr- DEVSEL=medium >TAbort- <TAbort- <MAbort+ >SERR- <PERR- INTx-
	Latency: 8

00:13.0 PCI bridge [0604]: VIA Technologies, Inc. VX855/VX875/VX900 PCI to PCI Bridge [1106:b353] (prog-if 01 [Subtractive decode])
	Control: I/O+ Mem+ BusMaster+ SpecCycle- MemWINV- VGASnoop- ParErr- Stepping- SERR+ FastB2B- DisINTx-
	Status: Cap+ 66MHz- UDF- FastB2B- ParErr- DEVSEL=fast >TAbort- <TAbort- <MAbort+ >SERR- <PERR- INTx-
	Latency: 0
	Bus: primary=00, secondary=05, subordinate=05, sec-latency=0
	I/O behind bridge: None
	Memory behind bridge: None
	Prefetchable memory behind bridge: None
	Secondary status: 66MHz- FastB2B- ParErr- DEVSEL=medium >TAbort- <TAbort- <MAbort- <SERR- <PERR-
	BridgeCtl: Parity- SERR- NoISA+ VGA- VGA16- MAbort- >Reset- FastB2B-
		PriDiscTmr- SecDiscTmr- DiscTmrStat- DiscTmrSERREn-
	Capabilities: <access denied>

00:14.0 Audio device [0403]: VIA Technologies, Inc. VT8237A/VT8251 HDA Controller [1106:3288] (rev 20)
	Subsystem: VIA Technologies, Inc. VT8237A/VT8251 HDA Controller [1106:3288]
	Control: I/O- Mem+ BusMaster+ SpecCycle- MemWINV- VGASnoop- ParErr- Stepping- SERR- FastB2B- DisINTx+
	Status: Cap+ 66MHz- UDF- FastB2B- ParErr- DEVSEL=fast >TAbort- <TAbort- <MAbort- >SERR- <PERR- INTx-
	Latency: 0, Cache Line Size: 32 bytes
	Interrupt: pin A routed to IRQ 36
	Region 0: Memory at f8304000 (64-bit, non-prefetchable) [size=16K]
	Capabilities: <access denied>
	Kernel driver in use: snd_hda_intel
	Kernel modules: snd_hda_intel

03:00.0 Ethernet controller [0200]: Realtek Semiconductor Co., Ltd. RTL8111/8168/8411 PCI Express Gigabit Ethernet Controller [10ec:8168] (rev 06)
	Subsystem: Realtek Semiconductor Co., Ltd. Device [10ec:0123]
	Physical Slot: 0
	Control: I/O+ Mem+ BusMaster+ SpecCycle- MemWINV- VGASnoop- ParErr- Stepping- SERR+ FastB2B- DisINTx+
	Status: Cap+ 66MHz- UDF- FastB2B- ParErr- DEVSEL=fast >TAbort- <TAbort- <MAbort- >SERR- <PERR- INTx-
	Latency: 0, Cache Line Size: 32 bytes
	Interrupt: pin A routed to IRQ 32
	Region 0: I/O ports at 5000 [size=256]
	Region 2: Memory at f8004000 (64-bit, prefetchable) [size=4K]
	Region 4: Memory at f8000000 (64-bit, prefetchable) [size=16K]
	Capabilities: <access denied>
	Kernel driver in use: r8169
	Kernel modules: r8169

