00:00.0 Host bridge [0600]: VIA Technologies, Inc. K8M800 Host Bridge [1106:0204]
	Subsystem: Acer Incorporated [ALI] Device [1025:006e]
	Control: I/O- Mem+ BusMaster+ SpecCycle- MemWINV- VGASnoop- ParErr- Stepping- SERR- FastB2B- DisINTx-
	Status: Cap+ 66MHz+ UDF- FastB2B- ParErr- DEVSEL=medium >TAbort- <TAbort- <MAbort+ >SERR- <PERR+ INTx-
	Latency: 8
	Region 0: Memory at d0000000 (32-bit, prefetchable) [size=256M]
	Capabilities: [80] AGP version 3.0
		Status: RQ=32 Iso- ArqSz=0 Cal=2 SBA+ ITACoh- GART64- HTrans- 64bit- FW- AGP3+ Rate=x4,x8
		Command: RQ=1 ArqSz=0 Cal=2 SBA+ AGP+ GART64- 64bit- FW- Rate=x8
	Capabilities: [50] Power Management version 2
		Flags: PMEClk- DSI- D1- D2- AuxCurrent=0mA PME(D0-,D1-,D2-,D3hot-,D3cold-)
		Status: D0 NoSoftRst- PME-Enable- DSel=0 DScale=0 PME-
	Capabilities: [60] HyperTransport: Slave or Primary Interface
		Command: BaseUnitID=0 UnitCnt=3 MastHost- DefDir- DUL-
		Link Control 0: CFlE- CST- CFE- <LkFail- Init+ EOC- TXO- <CRCErr=0 IsocEn- LSEn- ExtCTL- 64b-
		Link Config 0: MLWI=16bit DwFcIn- MLWO=16bit DwFcOut- LWI=16bit DwFcInEn- LWO=16bit DwFcOutEn-
		Link Control 1: CFlE- CST- CFE- <LkFail+ Init- EOC+ TXO+ <CRCErr=0 IsocEn- LSEn- ExtCTL- 64b-
		Link Config 1: MLWI=8bit DwFcIn- MLWO=8bit DwFcOut- LWI=8bit DwFcInEn- LWO=8bit DwFcOutEn-
		Revision ID: 1.02
		Link Frequency 0: 800MHz
		Link Error 0: <Prot- <Ovfl- <EOC- CTLTm-
		Link Frequency Capability 0: 200MHz+ 300MHz- 400MHz+ 500MHz- 600MHz+ 800MHz+ 1.0GHz- 1.2GHz- 1.4GHz- 1.6GHz- Vend-
		Feature Capability: IsocFC- LDTSTOP+ CRCTM- ECTLT- 64bA- UIDRD-
		Link Frequency 1: 200MHz
		Link Error 1: <Prot- <Ovfl- <EOC- CTLTm-
		Link Frequency Capability 1: 200MHz+ 300MHz- 400MHz+ 500MHz- 600MHz+ 800MHz+ 1.0GHz- 1.2GHz- 1.4GHz- 1.6GHz- Vend-
		Error Handling: PFlE- OFlE- PFE- OFE- EOCFE- RFE- CRCFE- SERRFE- CF- RE- PNFE- ONFE- EOCNFE- RNFE- CRCNFE- SERRNFE-
		Prefetchable memory behind bridge Upper: 00-00
		Bus Number: 00
	Capabilities: [58] HyperTransport: Interrupt Discovery and Configuration
	Kernel driver in use: agpgart-amd64

00:00.1 Host bridge [0600]: VIA Technologies, Inc. K8M800 Host Bridge [1106:1204]
	Control: I/O- Mem+ BusMaster+ SpecCycle- MemWINV- VGASnoop- ParErr- Stepping- SERR- FastB2B- DisINTx-
	Status: Cap- 66MHz- UDF- FastB2B- ParErr- DEVSEL=medium >TAbort- <TAbort- <MAbort- >SERR- <PERR- INTx-
	Latency: 0

00:00.2 Host bridge [0600]: VIA Technologies, Inc. K8M800 Host Bridge [1106:2204]
	Control: I/O- Mem+ BusMaster+ SpecCycle- MemWINV- VGASnoop- ParErr- Stepping- SERR- FastB2B- DisINTx-
	Status: Cap- 66MHz- UDF- FastB2B- ParErr- DEVSEL=medium >TAbort- <TAbort- <MAbort- >SERR- <PERR- INTx-
	Latency: 0

00:00.3 Host bridge [0600]: VIA Technologies, Inc. K8M800 Host Bridge [1106:3204]
	Control: I/O- Mem+ BusMaster+ SpecCycle- MemWINV- VGASnoop- ParErr- Stepping- SERR- FastB2B- DisINTx-
	Status: Cap- 66MHz- UDF- FastB2B- ParErr- DEVSEL=medium >TAbort- <TAbort- <MAbort- >SERR- <PERR- INTx-
	Latency: 0

00:00.4 Host bridge [0600]: VIA Technologies, Inc. K8M800 Host Bridge [1106:4204]
	Control: I/O- Mem+ BusMaster+ SpecCycle- MemWINV- VGASnoop- ParErr- Stepping- SERR- FastB2B- DisINTx-
	Status: Cap- 66MHz- UDF- FastB2B- ParErr- DEVSEL=medium >TAbort- <TAbort- <MAbort- >SERR- <PERR- INTx-
	Latency: 0

00:00.7 Host bridge [0600]: VIA Technologies, Inc. K8M800 Host Bridge [1106:7204]
	Control: I/O- Mem+ BusMaster+ SpecCycle- MemWINV- VGASnoop- ParErr- Stepping- SERR- FastB2B- DisINTx-
	Status: Cap- 66MHz- UDF- FastB2B- ParErr- DEVSEL=medium >TAbort- <TAbort- <MAbort- >SERR- <PERR- INTx-
	Latency: 0

00:01.0 PCI bridge [0604]: VIA Technologies, Inc. VT8237/8251 PCI bridge [K8M890/K8T800/K8T890 South] [1106:b188] (prog-if 00 [Normal decode])
	Control: I/O+ Mem+ BusMaster+ SpecCycle- MemWINV- VGASnoop- ParErr- Stepping- SERR- FastB2B- DisINTx-
	Status: Cap+ 66MHz+ UDF- FastB2B- ParErr- DEVSEL=medium >TAbort- <TAbort- <MAbort- >SERR- <PERR- INTx-
	Latency: 0
	Bus: primary=00, secondary=01, subordinate=01, sec-latency=0
	Memory behind bridge: c1000000-c1ffffff
	Prefetchable memory behind bridge: e0000000-efffffff
	Secondary status: 66MHz+ FastB2B- ParErr- DEVSEL=medium >TAbort- <TAbort- <MAbort+ <SERR- <PERR-
	BridgeCtl: Parity- SERR- NoISA+ VGA+ MAbort- >Reset- FastB2B-
		PriDiscTmr- SecDiscTmr- DiscTmrStat- DiscTmrSERREn-
	Capabilities: [80] Power Management version 2
		Flags: PMEClk- DSI- D1+ D2- AuxCurrent=0mA PME(D0-,D1-,D2-,D3hot-,D3cold-)
		Status: D0 NoSoftRst- PME-Enable- DSel=0 DScale=0 PME-
	Kernel modules: shpchp

00:0a.0 Class [8200]: InProComm Inc. Device [17fe:a220]
	Subsystem: AMBIT Microsystem Corp. Device [1468:0305]
	Control: I/O- Mem- BusMaster- SpecCycle+ MemWINV+ VGASnoop- ParErr- Stepping- SERR- FastB2B- DisINTx-
	Status: Cap+ 66MHz- UDF- FastB2B+ ParErr- DEVSEL=medium >TAbort- <TAbort- <MAbort- >SERR- <PERR- INTx-
	Interrupt: pin A routed to IRQ 10
	Region 0: I/O ports at 1c80 [disabled] [size=32]
	Region 1: [virtual] Memory at 80000000 (32-bit, non-prefetchable) [size=32]
	Region 2: Memory at 20001000 (32-bit, non-prefetchable) [size=2K]
	Capabilities: [40] Power Management version 2
		Flags: PMEClk- DSI+ D1- D2+ AuxCurrent=0mA PME(D0-,D1-,D2-,D3hot-,D3cold-)
		Status: D0 NoSoftRst- PME-Enable- DSel=0 DScale=0 PME-

00:0b.0 CardBus bridge [0607]: Texas Instruments PCI7420 CardBus Controller [104c:ac8e]
	Subsystem: Acer Incorporated [ALI] Device [1025:006e]
	Control: I/O+ Mem+ BusMaster+ SpecCycle- MemWINV- VGASnoop- ParErr- Stepping- SERR- FastB2B- DisINTx-
	Status: Cap+ 66MHz- UDF- FastB2B- ParErr- DEVSEL=medium >TAbort- <TAbort- <MAbort- >SERR- <PERR- INTx-
	Latency: 168, Cache Line Size: 64 bytes
	Interrupt: pin A routed to IRQ 17
	Region 0: Memory at 20000000 (32-bit, non-prefetchable) [size=4K]
	Bus: primary=00, secondary=02, subordinate=05, sec-latency=176
	Memory window 0: 34000000-37ffffff (prefetchable)
	Memory window 1: 30000000-33ffffff
	I/O window 0: 00002000-000020ff
	I/O window 1: 00002400-000024ff
	BridgeCtl: Parity- SERR- ISA- VGA- MAbort- >Reset+ 16bInt+ PostWrite+
	16-bit legacy interface ports at 0001
	Capabilities: [a0] Power Management version 2
		Flags: PMEClk- DSI+ D1+ D2+ AuxCurrent=0mA PME(D0+,D1+,D2+,D3hot+,D3cold+)
		Status: D0 NoSoftRst- PME-Enable- DSel=0 DScale=0 PME-
		Bridge: PM- B3+
	Kernel driver in use: yenta_cardbus
	Kernel modules: yenta_socket

00:0b.1 CardBus bridge [0607]: Texas Instruments PCI7420 CardBus Controller [104c:ac8e]
	Subsystem: Acer Incorporated [ALI] Device [1025:006e]
	Control: I/O+ Mem+ BusMaster+ SpecCycle- MemWINV- VGASnoop- ParErr- Stepping- SERR- FastB2B- DisINTx-
	Status: Cap+ 66MHz- UDF- FastB2B- ParErr- DEVSEL=medium >TAbort- <TAbort- <MAbort- >SERR- <PERR- INTx-
	Latency: 168, Cache Line Size: 64 bytes
	Interrupt: pin B routed to IRQ 18
	Region 0: Memory at 24000000 (32-bit, non-prefetchable) [size=4K]
	Bus: primary=00, secondary=06, subordinate=09, sec-latency=176
	Memory window 0: 2c000000-2fffffff (prefetchable)
	Memory window 1: 28000000-2bffffff
	I/O window 0: 00002800-000028ff
	I/O window 1: 00002c00-00002cff
	BridgeCtl: Parity- SERR- ISA- VGA- MAbort- >Reset+ 16bInt+ PostWrite+
	16-bit legacy interface ports at 0001
	Capabilities: [a0] Power Management version 2
		Flags: PMEClk- DSI+ D1+ D2+ AuxCurrent=0mA PME(D0+,D1+,D2+,D3hot+,D3cold+)
		Status: D0 NoSoftRst- PME-Enable- DSel=0 DScale=0 PME-
		Bridge: PM- B3+
	Kernel driver in use: yenta_cardbus
	Kernel modules: yenta_socket

00:0b.2 FireWire (IEEE 1394) [0c00]: Texas Instruments PCI7x20 1394a-2000 OHCI Two-Port PHY/Link-Layer Controller [104c:802e] (prog-if 10 [OHCI])
	Subsystem: Acer Incorporated [ALI] Device [1025:006e]
	Control: I/O- Mem+ BusMaster+ SpecCycle- MemWINV+ VGASnoop- ParErr- Stepping- SERR- FastB2B- DisINTx-
	Status: Cap+ 66MHz- UDF- FastB2B- ParErr- DEVSEL=medium >TAbort- <TAbort- <MAbort- >SERR- <PERR- INTx-
	Latency: 64 (500ns min, 1000ns max), Cache Line Size: 64 bytes
	Interrupt: pin C routed to IRQ 19
	Region 0: Memory at c0005000 (32-bit, non-prefetchable) [size=2K]
	Region 1: Memory at c0000000 (32-bit, non-prefetchable) [size=16K]
	Capabilities: [44] Power Management version 2
		Flags: PMEClk- DSI- D1+ D2+ AuxCurrent=0mA PME(D0+,D1+,D2+,D3hot+,D3cold-)
		Status: D0 NoSoftRst- PME-Enable- DSel=0 DScale=0 PME+
	Kernel driver in use: firewire_ohci
	Kernel modules: firewire_ohci

00:0c.0 Ethernet controller [0200]: Realtek Semiconductor Co., Ltd. RTL8169 PCI Gigabit Ethernet Controller [10ec:8169] (rev 10)
	Subsystem: Acer Incorporated [ALI] Device [1025:006e]
	Control: I/O+ Mem+ BusMaster+ SpecCycle- MemWINV+ VGASnoop- ParErr- Stepping- SERR- FastB2B- DisINTx-
	Status: Cap+ 66MHz+ UDF- FastB2B+ ParErr- DEVSEL=medium >TAbort- <TAbort- <MAbort- >SERR- <PERR- INTx-
	Latency: 64 (8000ns min, 16000ns max), Cache Line Size: 32 bytes
	Interrupt: pin A routed to IRQ 22
	Region 0: I/O ports at 1000 [size=256]
	Region 1: Memory at c0005800 (32-bit, non-prefetchable) [size=256]
	[virtual] Expansion ROM at 20020000 [disabled] [size=128K]
	Capabilities: [dc] Power Management version 2
		Flags: PMEClk- DSI- D1+ D2+ AuxCurrent=375mA PME(D0-,D1+,D2+,D3hot+,D3cold+)
		Status: D0 NoSoftRst- PME-Enable- DSel=0 DScale=0 PME-
	Kernel driver in use: r8169
	Kernel modules: r8169

00:10.0 USB controller [0c03]: VIA Technologies, Inc. VT82xx/62xx UHCI USB 1.1 Controller [1106:3038] (rev 80) (prog-if 00 [UHCI])
	Subsystem: Acer Incorporated [ALI] Device [1025:006e]
	Control: I/O+ Mem+ BusMaster+ SpecCycle- MemWINV+ VGASnoop- ParErr- Stepping- SERR- FastB2B- DisINTx-
	Status: Cap+ 66MHz- UDF- FastB2B- ParErr- DEVSEL=medium >TAbort- <TAbort- <MAbort- >SERR- <PERR- INTx-
	Latency: 64, Cache Line Size: 64 bytes
	Interrupt: pin A routed to IRQ 21
	Region 4: I/O ports at 1c00 [size=32]
	Capabilities: [80] Power Management version 2
		Flags: PMEClk- DSI- D1+ D2+ AuxCurrent=375mA PME(D0+,D1+,D2+,D3hot+,D3cold+)
		Status: D0 NoSoftRst- PME-Enable- DSel=0 DScale=0 PME-
	Kernel driver in use: uhci_hcd

00:10.1 USB controller [0c03]: VIA Technologies, Inc. VT82xx/62xx UHCI USB 1.1 Controller [1106:3038] (rev 80) (prog-if 00 [UHCI])
	Subsystem: Acer Incorporated [ALI] Device [1025:006e]
	Control: I/O+ Mem+ BusMaster+ SpecCycle- MemWINV+ VGASnoop- ParErr- Stepping- SERR- FastB2B- DisINTx-
	Status: Cap+ 66MHz- UDF- FastB2B- ParErr- DEVSEL=medium >TAbort- <TAbort- <MAbort- >SERR- <PERR- INTx-
	Latency: 64, Cache Line Size: 64 bytes
	Interrupt: pin B routed to IRQ 21
	Region 4: I/O ports at 1c20 [size=32]
	Capabilities: [80] Power Management version 2
		Flags: PMEClk- DSI- D1+ D2+ AuxCurrent=375mA PME(D0+,D1+,D2+,D3hot+,D3cold+)
		Status: D0 NoSoftRst- PME-Enable- DSel=0 DScale=0 PME-
	Kernel driver in use: uhci_hcd

00:10.2 USB controller [0c03]: VIA Technologies, Inc. VT82xx/62xx UHCI USB 1.1 Controller [1106:3038] (rev 80) (prog-if 00 [UHCI])
	Subsystem: Acer Incorporated [ALI] Device [1025:006e]
	Control: I/O+ Mem+ BusMaster+ SpecCycle- MemWINV+ VGASnoop- ParErr- Stepping- SERR- FastB2B- DisINTx-
	Status: Cap+ 66MHz- UDF- FastB2B- ParErr- DEVSEL=medium >TAbort- <TAbort- <MAbort- >SERR- <PERR- INTx-
	Latency: 64, Cache Line Size: 64 bytes
	Interrupt: pin C routed to IRQ 21
	Region 4: I/O ports at 1c40 [size=32]
	Capabilities: [80] Power Management version 2
		Flags: PMEClk- DSI- D1+ D2+ AuxCurrent=375mA PME(D0+,D1+,D2+,D3hot+,D3cold+)
		Status: D0 NoSoftRst- PME-Enable- DSel=0 DScale=0 PME-
	Kernel driver in use: uhci_hcd

00:10.3 USB controller [0c03]: VIA Technologies, Inc. USB 2.0 [1106:3104] (rev 82) (prog-if 20 [EHCI])
	Subsystem: Acer Incorporated [ALI] Device [1025:006e]
	Control: I/O+ Mem+ BusMaster+ SpecCycle- MemWINV+ VGASnoop- ParErr- Stepping- SERR- FastB2B- DisINTx-
	Status: Cap+ 66MHz- UDF- FastB2B- ParErr- DEVSEL=medium >TAbort- <TAbort- <MAbort- >SERR- <PERR- INTx-
	Latency: 64, Cache Line Size: 64 bytes
	Interrupt: pin D routed to IRQ 21
	Region 0: Memory at c0005c00 (32-bit, non-prefetchable) [size=256]
	Capabilities: [80] Power Management version 2
		Flags: PMEClk- DSI- D1+ D2+ AuxCurrent=375mA PME(D0+,D1+,D2+,D3hot+,D3cold+)
		Status: D0 NoSoftRst- PME-Enable- DSel=0 DScale=0 PME-
	Kernel driver in use: ehci-pci

00:11.0 ISA bridge [0601]: VIA Technologies, Inc. VT8235 ISA Bridge [1106:3177]
	Subsystem: VIA Technologies, Inc. VT8235 ISA Bridge [1106:3177]
	Control: I/O+ Mem+ BusMaster+ SpecCycle- MemWINV- VGASnoop- ParErr- Stepping+ SERR- FastB2B- DisINTx-
	Status: Cap+ 66MHz- UDF- FastB2B- ParErr- DEVSEL=medium >TAbort- <TAbort- <MAbort- >SERR- <PERR- INTx-
	Latency: 0
	Capabilities: [c0] Power Management version 2
		Flags: PMEClk- DSI- D1- D2- AuxCurrent=0mA PME(D0-,D1-,D2-,D3hot-,D3cold-)
		Status: D0 NoSoftRst- PME-Enable- DSel=0 DScale=0 PME-
	Kernel modules: i2c_viapro, via_ircc

00:11.1 IDE interface [0101]: VIA Technologies, Inc. VT82C586A/B/VT82C686/A/B/VT823x/A/C PIPC Bus Master IDE [1106:0571] (rev 06) (prog-if 8a [Master SecP PriP])
	Subsystem: Acer Incorporated [ALI] Device [1025:006e]
	Control: I/O+ Mem+ BusMaster+ SpecCycle- MemWINV- VGASnoop- ParErr- Stepping- SERR- FastB2B- DisINTx-
	Status: Cap+ 66MHz- UDF- FastB2B+ ParErr- DEVSEL=medium >TAbort- <TAbort- <MAbort- >SERR- <PERR- INTx-
	Latency: 64
	Interrupt: pin A routed to IRQ 0
	Region 0: [virtual] Memory at 000001f0 (32-bit, non-prefetchable) [size=8]
	Region 1: [virtual] Memory at 000003f0 (type 3, non-prefetchable)
	Region 2: [virtual] Memory at 00000170 (32-bit, non-prefetchable) [size=8]
	Region 3: [virtual] Memory at 00000370 (type 3, non-prefetchable)
	Region 4: I/O ports at 1c60 [size=16]
	Capabilities: [c0] Power Management version 2
		Flags: PMEClk- DSI- D1- D2- AuxCurrent=0mA PME(D0-,D1-,D2-,D3hot-,D3cold-)
		Status: D0 NoSoftRst- PME-Enable- DSel=0 DScale=0 PME-
	Kernel driver in use: pata_via
	Kernel modules: pata_via, pata_acpi

00:11.5 Multimedia audio controller [0401]: VIA Technologies, Inc. VT8233/A/8235/8237 AC97 Audio Controller [1106:3059] (rev 50)
	Subsystem: Acer Incorporated [ALI] Device [1025:0046]
	Control: I/O+ Mem- BusMaster- SpecCycle- MemWINV- VGASnoop- ParErr- Stepping- SERR- FastB2B- DisINTx-
	Status: Cap+ 66MHz- UDF- FastB2B- ParErr- DEVSEL=medium >TAbort- <TAbort- <MAbort- >SERR- <PERR- INTx-
	Interrupt: pin C routed to IRQ 22
	Region 0: I/O ports at 1400 [size=256]
	Capabilities: [c0] Power Management version 2
		Flags: PMEClk- DSI- D1+ D2+ AuxCurrent=0mA PME(D0-,D1-,D2-,D3hot-,D3cold-)
		Status: D0 NoSoftRst- PME-Enable- DSel=0 DScale=0 PME-
	Kernel driver in use: snd_via82xx
	Kernel modules: snd_via82xx

00:11.6 Communication controller [0780]: VIA Technologies, Inc. AC'97 Modem Controller [1106:3068] (rev 80)
	Subsystem: Acer Incorporated [ALI] Device [1025:0046]
	Control: I/O+ Mem- BusMaster- SpecCycle- MemWINV- VGASnoop- ParErr- Stepping- SERR- FastB2B- DisINTx-
	Status: Cap+ 66MHz- UDF- FastB2B- ParErr- DEVSEL=medium >TAbort- <TAbort- <MAbort- >SERR- <PERR- INTx-
	Interrupt: pin C routed to IRQ 22
	Region 0: I/O ports at 1800 [size=256]
	Capabilities: [d0] Power Management version 2
		Flags: PMEClk- DSI- D1- D2- AuxCurrent=0mA PME(D0-,D1-,D2-,D3hot-,D3cold-)
		Status: D0 NoSoftRst- PME-Enable- DSel=0 DScale=0 PME-
	Kernel driver in use: snd_via82xx_modem
	Kernel modules: snd_via82xx_modem

00:18.0 Host bridge [0600]: Advanced Micro Devices, Inc. [AMD] K8 [Athlon64/Opteron] HyperTransport Technology Configuration [1022:1100]
	Control: I/O- Mem- BusMaster- SpecCycle- MemWINV- VGASnoop- ParErr- Stepping- SERR- FastB2B- DisINTx-
	Status: Cap+ 66MHz- UDF- FastB2B- ParErr- DEVSEL=fast >TAbort- <TAbort- <MAbort- >SERR- <PERR- INTx-
	Capabilities: [80] HyperTransport: Host or Secondary Interface
		Command: WarmRst+ DblEnd- DevNum=0 ChainSide- HostHide+ Slave- <EOCErr- DUL-
		Link Control: CFlE- CST- CFE- <LkFail- Init+ EOC- TXO- <CRCErr=0 IsocEn- LSEn- ExtCTL- 64b-
		Link Config: MLWI=16bit DwFcIn- MLWO=16bit DwFcOut- LWI=16bit DwFcInEn- LWO=16bit DwFcOutEn-
		Revision ID: 1.02
		Link Frequency: 800MHz
		Link Error: <Prot- <Ovfl- <EOC- CTLTm-
		Link Frequency Capability: 200MHz+ 300MHz- 400MHz+ 500MHz- 600MHz+ 800MHz+ 1.0GHz+ 1.2GHz- 1.4GHz- 1.6GHz- Vend-
		Feature Capability: IsocFC- LDTSTOP+ CRCTM- ECTLT- 64bA- UIDRD- ExtRS- UCnfE-

00:18.1 Host bridge [0600]: Advanced Micro Devices, Inc. [AMD] K8 [Athlon64/Opteron] Address Map [1022:1101]
	Control: I/O- Mem- BusMaster- SpecCycle- MemWINV- VGASnoop- ParErr- Stepping- SERR- FastB2B- DisINTx-
	Status: Cap- 66MHz- UDF- FastB2B- ParErr- DEVSEL=fast >TAbort- <TAbort- <MAbort- >SERR- <PERR- INTx-

00:18.2 Host bridge [0600]: Advanced Micro Devices, Inc. [AMD] K8 [Athlon64/Opteron] DRAM Controller [1022:1102]
	Control: I/O- Mem- BusMaster- SpecCycle- MemWINV- VGASnoop- ParErr- Stepping- SERR- FastB2B- DisINTx-
	Status: Cap- 66MHz- UDF- FastB2B- ParErr- DEVSEL=fast >TAbort- <TAbort- <MAbort- >SERR- <PERR- INTx-

00:18.3 Host bridge [0600]: Advanced Micro Devices, Inc. [AMD] K8 [Athlon64/Opteron] Miscellaneous Control [1022:1103]
	Control: I/O- Mem- BusMaster- SpecCycle- MemWINV- VGASnoop- ParErr- Stepping- SERR- FastB2B- DisINTx-
	Status: Cap- 66MHz- UDF- FastB2B- ParErr- DEVSEL=fast >TAbort- <TAbort- <MAbort- >SERR- <PERR- INTx-
	Kernel driver in use: k8temp
	Kernel modules: k8temp

01:00.0 VGA compatible controller [0300]: NVIDIA Corporation NV36M [GeForce FX Go5700] [10de:0347] (rev a1) (prog-if 00 [VGA controller])
	Subsystem: Acer Incorporated [ALI] Device [1025:006e]
	Control: I/O+ Mem+ BusMaster+ SpecCycle- MemWINV- VGASnoop- ParErr- Stepping- SERR- FastB2B- DisINTx-
	Status: Cap+ 66MHz+ UDF- FastB2B+ ParErr- DEVSEL=medium >TAbort- <TAbort- <MAbort- >SERR- <PERR- INTx-
	Latency: 64 (1250ns min, 250ns max)
	Interrupt: pin A routed to IRQ 16
	Region 0: Memory at c1000000 (32-bit, non-prefetchable) [size=16M]
	Region 1: Memory at e0000000 (32-bit, prefetchable) [size=256M]
	[virtual] Expansion ROM at 000c0000 [disabled] [size=128K]
	Capabilities: [60] Power Management version 2
		Flags: PMEClk- DSI- D1- D2- AuxCurrent=0mA PME(D0-,D1-,D2-,D3hot-,D3cold-)
		Status: D0 NoSoftRst- PME-Enable- DSel=0 DScale=0 PME-
	Capabilities: [44] AGP version 3.0
		Status: RQ=32 Iso- ArqSz=0 Cal=3 SBA+ ITACoh- GART64- HTrans- 64bit- FW+ AGP3+ Rate=x4,x8
		Command: RQ=32 ArqSz=0 Cal=0 SBA+ AGP+ GART64- 64bit- FW- Rate=x8
	Kernel driver in use: nouveau
	Kernel modules: nvidiafb, nouveau

