00:00.0 Host bridge [0600]: Intel Corporation 8th Gen Core Processor Host Bridge/DRAM Registers [8086:3ec2] (rev 07)
	DeviceName:  Onboard Realtek Ethernet
	Subsystem: Acer Incorporated [ALI] Device [1025:1238]
	Control: I/O- Mem+ BusMaster+ SpecCycle- MemWINV- VGASnoop- ParErr- Stepping- SERR- FastB2B- DisINTx-
	Status: Cap+ 66MHz- UDF- FastB2B+ ParErr- DEVSEL=fast >TAbort- <TAbort- <MAbort+ >SERR- <PERR- INTx-
	Latency: 0
	Capabilities: [e0] Vendor Specific Information: Len=10 <?>
	Kernel driver in use: skl_uncore
	Kernel modules: ie31200_edac

00:02.0 VGA compatible controller [0300]: Intel Corporation CometLake-S GT2 [UHD Graphics 630] [8086:3e92] (prog-if 00 [VGA controller])
	DeviceName:  Onboard Intel Graphics
	Subsystem: Acer Incorporated [ALI] Device [1025:1238]
	Control: I/O+ Mem+ BusMaster+ SpecCycle- MemWINV- VGASnoop- ParErr- Stepping- SERR- FastB2B- DisINTx+
	Status: Cap+ 66MHz- UDF- FastB2B- ParErr- DEVSEL=fast >TAbort- <TAbort- <MAbort- >SERR- <PERR- INTx-
	Latency: 0, Cache Line Size: 64 bytes
	Interrupt: pin A routed to IRQ 135
	Region 0: Memory at de000000 (64-bit, non-prefetchable) [size=16M]
	Region 2: Memory at c0000000 (64-bit, prefetchable) [size=256M]
	Region 4: I/O ports at f000 [size=64]
	Expansion ROM at 000c0000 [virtual] [disabled] [size=128K]
	Capabilities: [40] Vendor Specific Information: Len=0c <?>
	Capabilities: [70] Express (v2) Root Complex Integrated Endpoint, MSI 00
		DevCap:	MaxPayload 128 bytes, PhantFunc 0
			ExtTag- RBE+ FLReset+
		DevCtl:	CorrErr- NonFatalErr- FatalErr- UnsupReq-
			RlxdOrd- ExtTag- PhantFunc- AuxPwr- NoSnoop- FLReset-
			MaxPayload 128 bytes, MaxReadReq 128 bytes
		DevSta:	CorrErr- NonFatalErr- FatalErr- UnsupReq- AuxPwr- TransPend-
		DevCap2: Completion Timeout: Not Supported, TimeoutDis- NROPrPrP- LTR-
			 10BitTagComp- 10BitTagReq- OBFF Not Supported, ExtFmt- EETLPPrefix-
			 EmergencyPowerReduction Not Supported, EmergencyPowerReductionInit-
			 FRS-
			 AtomicOpsCap: 32bit- 64bit- 128bitCAS-
		DevCtl2: Completion Timeout: 50us to 50ms, TimeoutDis- LTR- OBFF Disabled,
			 AtomicOpsCtl: ReqEn-
	Capabilities: [ac] MSI: Enable+ Count=1/1 Maskable- 64bit-
		Address: fee00018  Data: 0000
	Capabilities: [d0] Power Management version 2
		Flags: PMEClk- DSI+ D1- D2- AuxCurrent=0mA PME(D0-,D1-,D2-,D3hot-,D3cold-)
		Status: D0 NoSoftRst- PME-Enable- DSel=0 DScale=0 PME-
	Capabilities: [100 v1] Process Address Space ID (PASID)
		PASIDCap: Exec- Priv-, Max PASID Width: 14
		PASIDCtl: Enable- Exec- Priv-
	Capabilities: [200 v1] Address Translation Service (ATS)
		ATSCap:	Invalidate Queue Depth: 00
		ATSCtl:	Enable-, Smallest Translation Unit: 00
	Capabilities: [300 v1] Page Request Interface (PRI)
		PRICtl: Enable- Reset-
		PRISta: RF- UPRGI- Stopped+
		Page Request Capacity: 00008000, Page Request Allocation: 00000000
	Kernel driver in use: i915
	Kernel modules: i915

00:08.0 System peripheral [0880]: Intel Corporation Xeon E3-1200 v5/v6 / E3-1500 v5 / 6th/7th/8th Gen Core Processor Gaussian Mixture Model [8086:1911]
	Subsystem: Acer Incorporated [ALI] Device [1025:1238]
	Control: I/O- Mem- BusMaster- SpecCycle- MemWINV- VGASnoop- ParErr- Stepping- SERR- FastB2B- DisINTx-
	Status: Cap+ 66MHz- UDF- FastB2B- ParErr- DEVSEL=fast >TAbort- <TAbort- <MAbort- >SERR- <PERR- INTx-
	Interrupt: pin A routed to IRQ 255
	Region 0: Memory at df32f000 (64-bit, non-prefetchable) [disabled] [size=4K]
	Capabilities: [90] MSI: Enable- Count=1/1 Maskable- 64bit-
		Address: 00000000  Data: 0000
	Capabilities: [dc] Power Management version 2
		Flags: PMEClk- DSI- D1- D2- AuxCurrent=0mA PME(D0-,D1-,D2-,D3hot-,D3cold-)
		Status: D0 NoSoftRst- PME-Enable- DSel=0 DScale=0 PME-
	Capabilities: [f0] PCI Advanced Features
		AFCap: TP+ FLR+
		AFCtrl: FLR-
		AFStatus: TP-

00:14.0 USB controller [0c03]: Intel Corporation 200 Series/Z370 Chipset Family USB 3.0 xHCI Controller [8086:a2af] (prog-if 30 [XHCI])
	Subsystem: Acer Incorporated [ALI] Device [1025:1238]
	Control: I/O- Mem+ BusMaster+ SpecCycle- MemWINV- VGASnoop- ParErr- Stepping- SERR- FastB2B- DisINTx+
	Status: Cap+ 66MHz- UDF- FastB2B+ ParErr- DEVSEL=medium >TAbort- <TAbort- <MAbort- >SERR- <PERR- INTx-
	Latency: 0
	Interrupt: pin A routed to IRQ 126
	Region 0: Memory at df310000 (64-bit, non-prefetchable) [size=64K]
	Capabilities: [70] Power Management version 2
		Flags: PMEClk- DSI- D1- D2- AuxCurrent=375mA PME(D0-,D1-,D2-,D3hot+,D3cold+)
		Status: D0 NoSoftRst+ PME-Enable- DSel=0 DScale=0 PME-
	Capabilities: [80] MSI: Enable+ Count=1/8 Maskable- 64bit+
		Address: 00000000fee002d8  Data: 0000
	Kernel driver in use: xhci_hcd

00:14.2 Signal processing controller [1180]: Intel Corporation 200 Series PCH Thermal Subsystem [8086:a2b1]
	Subsystem: Acer Incorporated [ALI] Device [1025:1238]
	Control: I/O- Mem+ BusMaster- SpecCycle- MemWINV- VGASnoop- ParErr- Stepping- SERR- FastB2B- DisINTx-
	Status: Cap+ 66MHz- UDF- FastB2B- ParErr- DEVSEL=fast >TAbort- <TAbort- <MAbort- >SERR- <PERR- INTx-
	Interrupt: pin C routed to IRQ 255
	Region 0: Memory at df32e000 (64-bit, non-prefetchable) [size=4K]
	Capabilities: [50] Power Management version 3
		Flags: PMEClk- DSI+ D1- D2- AuxCurrent=0mA PME(D0-,D1-,D2-,D3hot-,D3cold-)
		Status: D0 NoSoftRst+ PME-Enable- DSel=0 DScale=0 PME-
	Capabilities: [80] MSI: Enable- Count=1/1 Maskable- 64bit-
		Address: 00000000  Data: 0000

00:16.0 Communication controller [0780]: Intel Corporation 200 Series PCH CSME HECI #1 [8086:a2ba]
	Subsystem: Acer Incorporated [ALI] Device [1025:1238]
	Control: I/O- Mem+ BusMaster+ SpecCycle- MemWINV- VGASnoop- ParErr- Stepping- SERR- FastB2B- DisINTx+
	Status: Cap+ 66MHz- UDF- FastB2B- ParErr- DEVSEL=fast >TAbort- <TAbort- <MAbort- >SERR- <PERR- INTx-
	Latency: 0
	Interrupt: pin A routed to IRQ 136
	Region 0: Memory at df32d000 (64-bit, non-prefetchable) [size=4K]
	Capabilities: [50] Power Management version 3
		Flags: PMEClk- DSI- D1- D2- AuxCurrent=0mA PME(D0-,D1-,D2-,D3hot+,D3cold-)
		Status: D0 NoSoftRst+ PME-Enable- DSel=0 DScale=0 PME-
	Capabilities: [8c] MSI: Enable+ Count=1/1 Maskable- 64bit+
		Address: 00000000fee003f8  Data: 0000
	Kernel driver in use: mei_me
	Kernel modules: mei_me

00:17.0 SATA controller [0106]: Intel Corporation 200 Series PCH SATA controller [AHCI mode] [8086:a282] (prog-if 01 [AHCI 1.0])
	DeviceName:  Onboard Intel SATA Controller
	Subsystem: Acer Incorporated [ALI] Device [1025:1238]
	Control: I/O+ Mem+ BusMaster+ SpecCycle- MemWINV- VGASnoop- ParErr- Stepping- SERR- FastB2B- DisINTx+
	Status: Cap+ 66MHz+ UDF- FastB2B+ ParErr- DEVSEL=medium >TAbort- <TAbort- <MAbort- >SERR- <PERR- INTx-
	Latency: 0
	Interrupt: pin A routed to IRQ 125
	Region 0: Memory at df328000 (32-bit, non-prefetchable) [size=8K]
	Region 1: Memory at df32c000 (32-bit, non-prefetchable) [size=256]
	Region 2: I/O ports at f090 [size=8]
	Region 3: I/O ports at f080 [size=4]
	Region 4: I/O ports at f060 [size=32]
	Region 5: Memory at df32b000 (32-bit, non-prefetchable) [size=2K]
	Capabilities: [80] MSI: Enable+ Count=1/1 Maskable- 64bit-
		Address: fee002b8  Data: 0000
	Capabilities: [70] Power Management version 3
		Flags: PMEClk- DSI- D1- D2- AuxCurrent=0mA PME(D0-,D1-,D2-,D3hot+,D3cold-)
		Status: D0 NoSoftRst+ PME-Enable- DSel=0 DScale=0 PME-
	Capabilities: [a8] SATA HBA v1.0 BAR4 Offset=00000004
	Kernel driver in use: ahci

00:1c.0 PCI bridge [0604]: Intel Corporation 200 Series PCH PCI Express Root Port #6 [8086:a295] (rev f0) (prog-if 00 [Normal decode])
	Control: I/O+ Mem+ BusMaster+ SpecCycle- MemWINV- VGASnoop- ParErr- Stepping- SERR- FastB2B- DisINTx+
	Status: Cap+ 66MHz- UDF- FastB2B- ParErr- DEVSEL=fast >TAbort- <TAbort- <MAbort- >SERR- <PERR- INTx-
	Latency: 0, Cache Line Size: 64 bytes
	Interrupt: pin B routed to IRQ 122
	Bus: primary=00, secondary=01, subordinate=01, sec-latency=0
	I/O behind bridge: 0000e000-0000efff [size=4K]
	Memory behind bridge: df200000-df2fffff [size=1M]
	Prefetchable memory behind bridge: 00000000d0000000-00000000d00fffff [size=1M]
	Secondary status: 66MHz- FastB2B- ParErr- DEVSEL=fast >TAbort- <TAbort- <MAbort+ <SERR- <PERR-
	BridgeCtl: Parity- SERR+ NoISA- VGA- VGA16+ MAbort- >Reset- FastB2B-
		PriDiscTmr- SecDiscTmr- DiscTmrStat- DiscTmrSERREn-
	Capabilities: [40] Express (v2) Root Port (Slot+), MSI 00
		DevCap:	MaxPayload 256 bytes, PhantFunc 0
			ExtTag- RBE+
		DevCtl:	CorrErr+ NonFatalErr+ FatalErr+ UnsupReq+
			RlxdOrd- ExtTag- PhantFunc- AuxPwr- NoSnoop-
			MaxPayload 128 bytes, MaxReadReq 128 bytes
		DevSta:	CorrErr- NonFatalErr- FatalErr- UnsupReq- AuxPwr+ TransPend-
		LnkCap:	Port #6, Speed 8GT/s, Width x1, ASPM L0s, Exit Latency L0s <1us
			ClockPM- Surprise- LLActRep+ BwNot+ ASPMOptComp+
		LnkCtl:	ASPM Disabled; RCB 64 bytes, Disabled- CommClk+
			ExtSynch- ClockPM- AutWidDis- BWInt- AutBWInt-
		LnkSta:	Speed 2.5GT/s (downgraded), Width x1 (ok)
			TrErr- Train- SlotClk+ DLActive+ BWMgmt+ ABWMgmt-
		SltCap:	AttnBtn- PwrCtrl- MRL- AttnInd- PwrInd- HotPlug- Surprise-
			Slot #9, PowerLimit 10.000W; Interlock- NoCompl+
		SltCtl:	Enable: AttnBtn- PwrFlt- MRL- PresDet- CmdCplt- HPIrq- LinkChg-
			Control: AttnInd Unknown, PwrInd Unknown, Power- Interlock-
		SltSta:	Status: AttnBtn- PowerFlt- MRL- CmdCplt- PresDet+ Interlock-
			Changed: MRL- PresDet- LinkState+
		RootCap: CRSVisible-
		RootCtl: ErrCorrectable- ErrNon-Fatal- ErrFatal- PMEIntEna- CRSVisible-
		RootSta: PME ReqID 0000, PMEStatus- PMEPending-
		DevCap2: Completion Timeout: Range ABC, TimeoutDis+ NROPrPrP- LTR+
			 10BitTagComp- 10BitTagReq- OBFF Not Supported, ExtFmt- EETLPPrefix-
			 EmergencyPowerReduction Not Supported, EmergencyPowerReductionInit-
			 FRS- LN System CLS Not Supported, TPHComp- ExtTPHComp- ARIFwd+
			 AtomicOpsCap: Routing- 32bit- 64bit- 128bitCAS-
		DevCtl2: Completion Timeout: 50us to 50ms, TimeoutDis- LTR+ OBFF Disabled, ARIFwd-
			 AtomicOpsCtl: ReqEn- EgressBlck-
		LnkCap2: Supported Link Speeds: 2.5-8GT/s, Crosslink- Retimer- 2Retimers- DRS-
		LnkCtl2: Target Link Speed: 8GT/s, EnterCompliance- SpeedDis-
			 Transmit Margin: Normal Operating Range, EnterModifiedCompliance- ComplianceSOS-
			 Compliance De-emphasis: -6dB
		LnkSta2: Current De-emphasis Level: -3.5dB, EqualizationComplete- EqualizationPhase1-
			 EqualizationPhase2- EqualizationPhase3- LinkEqualizationRequest-
			 Retimer- 2Retimers- CrosslinkRes: unsupported
	Capabilities: [80] MSI: Enable+ Count=1/1 Maskable- 64bit-
		Address: fee00218  Data: 0000
	Capabilities: [90] Subsystem: Acer Incorporated [ALI] Device [1025:1238]
	Capabilities: [a0] Power Management version 3
		Flags: PMEClk- DSI- D1- D2- AuxCurrent=0mA PME(D0+,D1-,D2-,D3hot+,D3cold+)
		Status: D0 NoSoftRst- PME-Enable- DSel=0 DScale=0 PME-
	Capabilities: [100 v1] Advanced Error Reporting
		UESta:	DLP- SDES- TLP- FCP- CmpltTO- CmpltAbrt- UnxCmplt- RxOF- MalfTLP- ECRC- UnsupReq- ACSViol-
		UEMsk:	DLP- SDES- TLP- FCP- CmpltTO- CmpltAbrt- UnxCmplt+ RxOF- MalfTLP- ECRC- UnsupReq- ACSViol-
		UESvrt:	DLP+ SDES- TLP- FCP- CmpltTO- CmpltAbrt- UnxCmplt- RxOF+ MalfTLP+ ECRC- UnsupReq- ACSViol-
		CESta:	RxErr- BadTLP- BadDLLP- Rollover- Timeout- AdvNonFatalErr-
		CEMsk:	RxErr- BadTLP- BadDLLP- Rollover- Timeout- AdvNonFatalErr+
		AERCap:	First Error Pointer: 00, ECRCGenCap- ECRCGenEn- ECRCChkCap- ECRCChkEn-
			MultHdrRecCap- MultHdrRecEn- TLPPfxPres- HdrLogCap-
		HeaderLog: 00000000 00000000 00000000 00000000
		RootCmd: CERptEn+ NFERptEn+ FERptEn+
		RootSta: CERcvd- MultCERcvd- UERcvd- MultUERcvd-
			 FirstFatal- NonFatalMsg- FatalMsg- IntMsg 0
		ErrorSrc: ERR_COR: 0000 ERR_FATAL/NONFATAL: 0000
	Capabilities: [140 v1] Access Control Services
		ACSCap:	SrcValid+ TransBlk+ ReqRedir+ CmpltRedir+ UpstreamFwd- EgressCtrl- DirectTrans-
		ACSCtl:	SrcValid- TransBlk- ReqRedir- CmpltRedir- UpstreamFwd- EgressCtrl- DirectTrans-
	Capabilities: [200 v1] L1 PM Substates
		L1SubCap: PCI-PM_L1.2+ PCI-PM_L1.1+ ASPM_L1.2+ ASPM_L1.1+ L1_PM_Substates+
			  PortCommonModeRestoreTime=40us PortTPowerOnTime=44us
		L1SubCtl1: PCI-PM_L1.2- PCI-PM_L1.1- ASPM_L1.2- ASPM_L1.1-
			   T_CommonMode=0us LTR1.2_Threshold=0ns
		L1SubCtl2: T_PwrOn=44us
	Capabilities: [220 v1] Secondary PCI Express
		LnkCtl3: LnkEquIntrruptEn- PerformEqu-
		LaneErrStat: 0
	Kernel driver in use: pcieport

00:1c.6 PCI bridge [0604]: Intel Corporation 200 Series PCH PCI Express Root Port #7 [8086:a296] (rev f0) (prog-if 00 [Normal decode])
	Control: I/O+ Mem+ BusMaster+ SpecCycle- MemWINV- VGASnoop- ParErr- Stepping- SERR- FastB2B- DisINTx+
	Status: Cap+ 66MHz- UDF- FastB2B- ParErr- DEVSEL=fast >TAbort- <TAbort- <MAbort- >SERR- <PERR- INTx-
	Latency: 0, Cache Line Size: 64 bytes
	Interrupt: pin C routed to IRQ 123
	Bus: primary=00, secondary=02, subordinate=02, sec-latency=0
	I/O behind bridge: [disabled]
	Memory behind bridge: df100000-df1fffff [size=1M]
	Prefetchable memory behind bridge: [disabled]
	Secondary status: 66MHz- FastB2B- ParErr- DEVSEL=fast >TAbort- <TAbort- <MAbort+ <SERR- <PERR-
	BridgeCtl: Parity- SERR+ NoISA- VGA- VGA16+ MAbort- >Reset- FastB2B-
		PriDiscTmr- SecDiscTmr- DiscTmrStat- DiscTmrSERREn-
	Capabilities: [40] Express (v2) Root Port (Slot+), MSI 00
		DevCap:	MaxPayload 256 bytes, PhantFunc 0
			ExtTag- RBE+
		DevCtl:	CorrErr+ NonFatalErr+ FatalErr+ UnsupReq+
			RlxdOrd- ExtTag- PhantFunc- AuxPwr- NoSnoop-
			MaxPayload 128 bytes, MaxReadReq 128 bytes
		DevSta:	CorrErr- NonFatalErr- FatalErr- UnsupReq- AuxPwr+ TransPend-
		LnkCap:	Port #7, Speed 8GT/s, Width x1, ASPM L0s, Exit Latency L0s <1us
			ClockPM- Surprise- LLActRep+ BwNot+ ASPMOptComp+
		LnkCtl:	ASPM Disabled; RCB 64 bytes, Disabled- CommClk+
			ExtSynch- ClockPM- AutWidDis- BWInt- AutBWInt-
		LnkSta:	Speed 2.5GT/s (downgraded), Width x1 (ok)
			TrErr- Train- SlotClk+ DLActive+ BWMgmt+ ABWMgmt-
		SltCap:	AttnBtn- PwrCtrl- MRL- AttnInd- PwrInd- HotPlug- Surprise-
			Slot #10, PowerLimit 10.000W; Interlock- NoCompl+
		SltCtl:	Enable: AttnBtn- PwrFlt- MRL- PresDet- CmdCplt- HPIrq- LinkChg-
			Control: AttnInd Unknown, PwrInd Unknown, Power- Interlock-
		SltSta:	Status: AttnBtn- PowerFlt- MRL- CmdCplt- PresDet+ Interlock-
			Changed: MRL- PresDet- LinkState+
		RootCap: CRSVisible-
		RootCtl: ErrCorrectable- ErrNon-Fatal- ErrFatal- PMEIntEna- CRSVisible-
		RootSta: PME ReqID 0000, PMEStatus- PMEPending-
		DevCap2: Completion Timeout: Range ABC, TimeoutDis+ NROPrPrP- LTR+
			 10BitTagComp- 10BitTagReq- OBFF Not Supported, ExtFmt- EETLPPrefix-
			 EmergencyPowerReduction Not Supported, EmergencyPowerReductionInit-
			 FRS- LN System CLS Not Supported, TPHComp- ExtTPHComp- ARIFwd+
			 AtomicOpsCap: Routing- 32bit- 64bit- 128bitCAS-
		DevCtl2: Completion Timeout: 50us to 50ms, TimeoutDis- LTR+ OBFF Disabled, ARIFwd-
			 AtomicOpsCtl: ReqEn- EgressBlck-
		LnkCap2: Supported Link Speeds: 2.5-8GT/s, Crosslink- Retimer- 2Retimers- DRS-
		LnkCtl2: Target Link Speed: 8GT/s, EnterCompliance- SpeedDis-
			 Transmit Margin: Normal Operating Range, EnterModifiedCompliance- ComplianceSOS-
			 Compliance De-emphasis: -6dB
		LnkSta2: Current De-emphasis Level: -3.5dB, EqualizationComplete- EqualizationPhase1-
			 EqualizationPhase2- EqualizationPhase3- LinkEqualizationRequest-
			 Retimer- 2Retimers- CrosslinkRes: unsupported
	Capabilities: [80] MSI: Enable+ Count=1/1 Maskable- 64bit-
		Address: fee00258  Data: 0000
	Capabilities: [90] Subsystem: Acer Incorporated [ALI] Device [1025:1238]
	Capabilities: [a0] Power Management version 3
		Flags: PMEClk- DSI- D1- D2- AuxCurrent=0mA PME(D0+,D1-,D2-,D3hot+,D3cold+)
		Status: D0 NoSoftRst- PME-Enable- DSel=0 DScale=0 PME-
	Capabilities: [100 v1] Advanced Error Reporting
		UESta:	DLP- SDES- TLP- FCP- CmpltTO- CmpltAbrt- UnxCmplt- RxOF- MalfTLP- ECRC- UnsupReq- ACSViol-
		UEMsk:	DLP- SDES- TLP- FCP- CmpltTO- CmpltAbrt- UnxCmplt+ RxOF- MalfTLP- ECRC- UnsupReq- ACSViol-
		UESvrt:	DLP+ SDES- TLP- FCP- CmpltTO- CmpltAbrt- UnxCmplt- RxOF+ MalfTLP+ ECRC- UnsupReq- ACSViol-
		CESta:	RxErr- BadTLP- BadDLLP- Rollover- Timeout- AdvNonFatalErr-
		CEMsk:	RxErr- BadTLP- BadDLLP- Rollover- Timeout- AdvNonFatalErr+
		AERCap:	First Error Pointer: 00, ECRCGenCap- ECRCGenEn- ECRCChkCap- ECRCChkEn-
			MultHdrRecCap- MultHdrRecEn- TLPPfxPres- HdrLogCap-
		HeaderLog: 00000000 00000000 00000000 00000000
		RootCmd: CERptEn+ NFERptEn+ FERptEn+
		RootSta: CERcvd- MultCERcvd- UERcvd- MultUERcvd-
			 FirstFatal- NonFatalMsg- FatalMsg- IntMsg 0
		ErrorSrc: ERR_COR: 0000 ERR_FATAL/NONFATAL: 0000
	Capabilities: [140 v1] Access Control Services
		ACSCap:	SrcValid+ TransBlk+ ReqRedir+ CmpltRedir+ UpstreamFwd- EgressCtrl- DirectTrans-
		ACSCtl:	SrcValid- TransBlk- ReqRedir- CmpltRedir- UpstreamFwd- EgressCtrl- DirectTrans-
	Capabilities: [200 v1] L1 PM Substates
		L1SubCap: PCI-PM_L1.2+ PCI-PM_L1.1+ ASPM_L1.2+ ASPM_L1.1+ L1_PM_Substates+
			  PortCommonModeRestoreTime=40us PortTPowerOnTime=44us
		L1SubCtl1: PCI-PM_L1.2+ PCI-PM_L1.1+ ASPM_L1.2+ ASPM_L1.1+
			   T_CommonMode=40us LTR1.2_Threshold=163840ns
		L1SubCtl2: T_PwrOn=60us
	Capabilities: [220 v1] Secondary PCI Express
		LnkCtl3: LnkEquIntrruptEn- PerformEqu-
		LaneErrStat: 0
	Kernel driver in use: pcieport

00:1d.0 PCI bridge [0604]: Intel Corporation 200 Series PCH PCI Express Root Port #9 [8086:a298] (rev f0) (prog-if 00 [Normal decode])
	Control: I/O+ Mem+ BusMaster+ SpecCycle- MemWINV- VGASnoop- ParErr- Stepping- SERR- FastB2B- DisINTx+
	Status: Cap+ 66MHz- UDF- FastB2B- ParErr- DEVSEL=fast >TAbort- <TAbort- <MAbort- >SERR- <PERR- INTx-
	Latency: 0, Cache Line Size: 64 bytes
	Interrupt: pin A routed to IRQ 124
	Bus: primary=00, secondary=03, subordinate=03, sec-latency=0
	I/O behind bridge: [disabled]
	Memory behind bridge: df000000-df0fffff [size=1M]
	Prefetchable memory behind bridge: [disabled]
	Secondary status: 66MHz- FastB2B- ParErr- DEVSEL=fast >TAbort- <TAbort- <MAbort+ <SERR- <PERR-
	BridgeCtl: Parity- SERR+ NoISA- VGA- VGA16+ MAbort- >Reset- FastB2B-
		PriDiscTmr- SecDiscTmr- DiscTmrStat- DiscTmrSERREn-
	Capabilities: [40] Express (v2) Root Port (Slot+), MSI 00
		DevCap:	MaxPayload 256 bytes, PhantFunc 0
			ExtTag- RBE+
		DevCtl:	CorrErr+ NonFatalErr+ FatalErr+ UnsupReq+
			RlxdOrd- ExtTag- PhantFunc- AuxPwr- NoSnoop-
			MaxPayload 256 bytes, MaxReadReq 128 bytes
		DevSta:	CorrErr- NonFatalErr- FatalErr- UnsupReq- AuxPwr+ TransPend-
		LnkCap:	Port #9, Speed 8GT/s, Width x4, ASPM not supported
			ClockPM- Surprise- LLActRep+ BwNot+ ASPMOptComp+
		LnkCtl:	ASPM Disabled; RCB 64 bytes, Disabled- CommClk+
			ExtSynch- ClockPM- AutWidDis- BWInt- AutBWInt-
		LnkSta:	Speed 8GT/s (ok), Width x4 (ok)
			TrErr- Train- SlotClk+ DLActive+ BWMgmt+ ABWMgmt-
		SltCap:	AttnBtn- PwrCtrl- MRL- AttnInd- PwrInd- HotPlug- Surprise-
			Slot #12, PowerLimit 25.000W; Interlock- NoCompl+
		SltCtl:	Enable: AttnBtn- PwrFlt- MRL- PresDet- CmdCplt- HPIrq- LinkChg-
			Control: AttnInd Unknown, PwrInd Unknown, Power- Interlock-
		SltSta:	Status: AttnBtn- PowerFlt- MRL- CmdCplt- PresDet+ Interlock-
			Changed: MRL- PresDet- LinkState+
		RootCap: CRSVisible-
		RootCtl: ErrCorrectable- ErrNon-Fatal- ErrFatal- PMEIntEna- CRSVisible-
		RootSta: PME ReqID 0000, PMEStatus- PMEPending-
		DevCap2: Completion Timeout: Range ABC, TimeoutDis+ NROPrPrP- LTR+
			 10BitTagComp- 10BitTagReq- OBFF Not Supported, ExtFmt- EETLPPrefix-
			 EmergencyPowerReduction Not Supported, EmergencyPowerReductionInit-
			 FRS- LN System CLS Not Supported, TPHComp- ExtTPHComp- ARIFwd+
			 AtomicOpsCap: Routing- 32bit- 64bit- 128bitCAS-
		DevCtl2: Completion Timeout: 50us to 50ms, TimeoutDis- LTR+ OBFF Disabled, ARIFwd-
			 AtomicOpsCtl: ReqEn- EgressBlck-
		LnkCap2: Supported Link Speeds: 2.5-8GT/s, Crosslink- Retimer- 2Retimers- DRS-
		LnkCtl2: Target Link Speed: 8GT/s, EnterCompliance- SpeedDis-
			 Transmit Margin: Normal Operating Range, EnterModifiedCompliance- ComplianceSOS-
			 Compliance De-emphasis: -6dB
		LnkSta2: Current De-emphasis Level: -3.5dB, EqualizationComplete+ EqualizationPhase1+
			 EqualizationPhase2+ EqualizationPhase3+ LinkEqualizationRequest-
			 Retimer- 2Retimers- CrosslinkRes: unsupported
	Capabilities: [80] MSI: Enable+ Count=1/1 Maskable- 64bit-
		Address: fee00298  Data: 0000
	Capabilities: [90] Subsystem: Acer Incorporated [ALI] Device [1025:1238]
	Capabilities: [a0] Power Management version 3
		Flags: PMEClk- DSI- D1- D2- AuxCurrent=0mA PME(D0+,D1-,D2-,D3hot+,D3cold+)
		Status: D0 NoSoftRst- PME-Enable- DSel=0 DScale=0 PME-
	Capabilities: [100 v1] Advanced Error Reporting
		UESta:	DLP- SDES- TLP- FCP- CmpltTO- CmpltAbrt- UnxCmplt- RxOF- MalfTLP- ECRC- UnsupReq- ACSViol-
		UEMsk:	DLP- SDES- TLP- FCP- CmpltTO- CmpltAbrt- UnxCmplt+ RxOF- MalfTLP- ECRC- UnsupReq- ACSViol-
		UESvrt:	DLP+ SDES- TLP- FCP- CmpltTO- CmpltAbrt- UnxCmplt- RxOF+ MalfTLP+ ECRC- UnsupReq- ACSViol-
		CESta:	RxErr- BadTLP- BadDLLP- Rollover- Timeout- AdvNonFatalErr-
		CEMsk:	RxErr- BadTLP- BadDLLP- Rollover- Timeout- AdvNonFatalErr+
		AERCap:	First Error Pointer: 00, ECRCGenCap- ECRCGenEn- ECRCChkCap- ECRCChkEn-
			MultHdrRecCap- MultHdrRecEn- TLPPfxPres- HdrLogCap-
		HeaderLog: 00000000 00000000 00000000 00000000
		RootCmd: CERptEn+ NFERptEn+ FERptEn+
		RootSta: CERcvd- MultCERcvd- UERcvd- MultUERcvd-
			 FirstFatal- NonFatalMsg- FatalMsg- IntMsg 0
		ErrorSrc: ERR_COR: 0000 ERR_FATAL/NONFATAL: 0000
	Capabilities: [140 v1] Access Control Services
		ACSCap:	SrcValid+ TransBlk+ ReqRedir+ CmpltRedir+ UpstreamFwd- EgressCtrl- DirectTrans-
		ACSCtl:	SrcValid- TransBlk- ReqRedir- CmpltRedir- UpstreamFwd- EgressCtrl- DirectTrans-
	Capabilities: [200 v1] L1 PM Substates
		L1SubCap: PCI-PM_L1.2+ PCI-PM_L1.1+ ASPM_L1.2+ ASPM_L1.1+ L1_PM_Substates+
			  PortCommonModeRestoreTime=40us PortTPowerOnTime=44us
		L1SubCtl1: PCI-PM_L1.2+ PCI-PM_L1.1+ ASPM_L1.2+ ASPM_L1.1+
			   T_CommonMode=40us LTR1.2_Threshold=163840ns
		L1SubCtl2: T_PwrOn=44us
	Capabilities: [220 v1] Secondary PCI Express
		LnkCtl3: LnkEquIntrruptEn- PerformEqu-
		LaneErrStat: 0
	Kernel driver in use: pcieport

00:1f.0 ISA bridge [0601]: Intel Corporation Device [8086:a2cc]
	Subsystem: Acer Incorporated [ALI] Device [1025:1238]
	Control: I/O+ Mem+ BusMaster+ SpecCycle- MemWINV- VGASnoop- ParErr- Stepping- SERR- FastB2B- DisINTx-
	Status: Cap- 66MHz- UDF- FastB2B- ParErr- DEVSEL=medium >TAbort- <TAbort- <MAbort- >SERR- <PERR- INTx-
	Latency: 0

00:1f.2 Memory controller [0580]: Intel Corporation 200 Series/Z370 Chipset Family Power Management Controller [8086:a2a1]
	Subsystem: Acer Incorporated [ALI] Device [1025:1238]
	Control: I/O- Mem- BusMaster- SpecCycle- MemWINV- VGASnoop- ParErr- Stepping- SERR- FastB2B- DisINTx-
	Status: Cap- 66MHz- UDF- FastB2B- ParErr- DEVSEL=fast >TAbort- <TAbort- <MAbort- >SERR- <PERR- INTx-
	Region 0: Memory at df324000 (32-bit, non-prefetchable) [disabled] [size=16K]

00:1f.3 Audio device [0403]: Intel Corporation 200 Series PCH HD Audio [8086:a2f0]
	Subsystem: Acer Incorporated [ALI] Device [1025:1238]
	Control: I/O- Mem+ BusMaster+ SpecCycle- MemWINV- VGASnoop- ParErr- Stepping- SERR- FastB2B- DisINTx+
	Status: Cap+ 66MHz- UDF- FastB2B- ParErr- DEVSEL=fast >TAbort- <TAbort- <MAbort- >SERR- <PERR- INTx-
	Latency: 32, Cache Line Size: 64 bytes
	Interrupt: pin A routed to IRQ 138
	Region 0: Memory at df320000 (64-bit, non-prefetchable) [size=16K]
	Region 4: Memory at df300000 (64-bit, non-prefetchable) [size=64K]
	Capabilities: [50] Power Management version 3
		Flags: PMEClk- DSI- D1- D2- AuxCurrent=55mA PME(D0-,D1-,D2-,D3hot+,D3cold+)
		Status: D3 NoSoftRst+ PME-Enable+ DSel=0 DScale=0 PME-
	Capabilities: [60] MSI: Enable+ Count=1/1 Maskable- 64bit+
		Address: 00000000fee00438  Data: 0000
	Kernel driver in use: snd_hda_intel
	Kernel modules: snd_hda_intel

00:1f.4 SMBus [0c05]: Intel Corporation 200 Series/Z370 Chipset Family SMBus Controller [8086:a2a3]
	Subsystem: Acer Incorporated [ALI] Device [1025:1238]
	Control: I/O+ Mem+ BusMaster- SpecCycle- MemWINV- VGASnoop- ParErr- Stepping- SERR- FastB2B- DisINTx-
	Status: Cap- 66MHz- UDF- FastB2B+ ParErr- DEVSEL=medium >TAbort- <TAbort- <MAbort- >SERR- <PERR- INTx-
	Interrupt: pin A routed to IRQ 16
	Region 0: Memory at df32a000 (64-bit, non-prefetchable) [size=256]
	Region 4: I/O ports at f040 [size=32]
	Kernel driver in use: i801_smbus
	Kernel modules: i2c_i801

01:00.0 Ethernet controller [0200]: Realtek Semiconductor Co., Ltd. RTL8111/8168/8411 PCI Express Gigabit Ethernet Controller [10ec:8168] (rev 11)
	Subsystem: Acer Incorporated [ALI] Device [1025:1238]
	Control: I/O+ Mem+ BusMaster+ SpecCycle- MemWINV- VGASnoop- ParErr- Stepping- SERR- FastB2B- DisINTx+
	Status: Cap+ 66MHz- UDF- FastB2B- ParErr- DEVSEL=fast >TAbort- <TAbort- <MAbort- >SERR- <PERR- INTx-
	Latency: 0, Cache Line Size: 64 bytes
	Interrupt: pin A routed to IRQ 17
	Region 0: I/O ports at e000 [size=256]
	Region 2: Memory at df200000 (64-bit, non-prefetchable) [size=4K]
	Region 4: Memory at d0000000 (64-bit, prefetchable) [size=16K]
	Capabilities: [40] Power Management version 3
		Flags: PMEClk- DSI- D1+ D2+ AuxCurrent=375mA PME(D0+,D1+,D2+,D3hot+,D3cold+)
		Status: D0 NoSoftRst+ PME-Enable- DSel=0 DScale=0 PME-
	Capabilities: [50] MSI: Enable- Count=1/1 Maskable- 64bit+
		Address: 0000000000000000  Data: 0000
	Capabilities: [70] Express (v2) Endpoint, MSI 01
		DevCap:	MaxPayload 128 bytes, PhantFunc 0, Latency L0s <512ns, L1 <64us
			ExtTag- AttnBtn- AttnInd- PwrInd- RBE+ FLReset- SlotPowerLimit 10.000W
		DevCtl:	CorrErr- NonFatalErr- FatalErr- UnsupReq-
			RlxdOrd+ ExtTag- PhantFunc- AuxPwr- NoSnoop-
			MaxPayload 128 bytes, MaxReadReq 4096 bytes
		DevSta:	CorrErr- NonFatalErr- FatalErr- UnsupReq- AuxPwr+ TransPend-
		LnkCap:	Port #0, Speed 2.5GT/s, Width x1, ASPM L0s L1, Exit Latency L0s unlimited, L1 <64us
			ClockPM+ Surprise- LLActRep- BwNot- ASPMOptComp+
		LnkCtl:	ASPM Disabled; RCB 64 bytes, Disabled- CommClk+
			ExtSynch- ClockPM+ AutWidDis- BWInt- AutBWInt-
		LnkSta:	Speed 2.5GT/s (ok), Width x1 (ok)
			TrErr- Train- SlotClk+ DLActive- BWMgmt- ABWMgmt-
		DevCap2: Completion Timeout: Range ABCD, TimeoutDis+ NROPrPrP- LTR+
			 10BitTagComp- 10BitTagReq- OBFF Via message/WAKE#, ExtFmt- EETLPPrefix-
			 EmergencyPowerReduction Not Supported, EmergencyPowerReductionInit-
			 FRS- TPHComp- ExtTPHComp-
			 AtomicOpsCap: 32bit- 64bit- 128bitCAS-
		DevCtl2: Completion Timeout: 50us to 50ms, TimeoutDis- LTR+ OBFF Disabled,
			 AtomicOpsCtl: ReqEn-
		LnkCap2: Supported Link Speeds: 2.5GT/s, Crosslink- Retimer- 2Retimers- DRS-
		LnkCtl2: Target Link Speed: 2.5GT/s, EnterCompliance- SpeedDis-
			 Transmit Margin: Normal Operating Range, EnterModifiedCompliance- ComplianceSOS-
			 Compliance De-emphasis: -6dB
		LnkSta2: Current De-emphasis Level: -6dB, EqualizationComplete- EqualizationPhase1-
			 EqualizationPhase2- EqualizationPhase3- LinkEqualizationRequest-
			 Retimer- 2Retimers- CrosslinkRes: unsupported
	Capabilities: [b0] MSI-X: Enable+ Count=4 Masked-
		Vector table: BAR=4 offset=00000000
		PBA: BAR=4 offset=00000800
	Capabilities: [d0] Vital Product Data
		Not readable
	Capabilities: [100 v1] Advanced Error Reporting
		UESta:	DLP- SDES- TLP- FCP- CmpltTO- CmpltAbrt- UnxCmplt- RxOF- MalfTLP- ECRC- UnsupReq- ACSViol-
		UEMsk:	DLP- SDES- TLP- FCP- CmpltTO- CmpltAbrt- UnxCmplt- RxOF- MalfTLP- ECRC- UnsupReq- ACSViol-
		UESvrt:	DLP+ SDES+ TLP- FCP+ CmpltTO- CmpltAbrt- UnxCmplt- RxOF+ MalfTLP+ ECRC- UnsupReq- ACSViol-
		CESta:	RxErr- BadTLP- BadDLLP- Rollover- Timeout- AdvNonFatalErr-
		CEMsk:	RxErr- BadTLP- BadDLLP- Rollover- Timeout- AdvNonFatalErr+
		AERCap:	First Error Pointer: 00, ECRCGenCap+ ECRCGenEn- ECRCChkCap+ ECRCChkEn-
			MultHdrRecCap- MultHdrRecEn- TLPPfxPres- HdrLogCap-
		HeaderLog: 00000000 00000000 00000000 00000000
	Capabilities: [140 v1] Virtual Channel
		Caps:	LPEVC=0 RefClk=100ns PATEntryBits=1
		Arb:	Fixed- WRR32- WRR64- WRR128-
		Ctrl:	ArbSelect=Fixed
		Status:	InProgress-
		VC0:	Caps:	PATOffset=00 MaxTimeSlots=1 RejSnoopTrans-
			Arb:	Fixed- WRR32- WRR64- WRR128- TWRR128- WRR256-
			Ctrl:	Enable+ ID=0 ArbSelect=Fixed TC/VC=ff
			Status:	NegoPending- InProgress-
	Capabilities: [160 v1] Device Serial Number ...
	Capabilities: [170 v1] Latency Tolerance Reporting
		Max snoop latency: 3145728ns
		Max no snoop latency: 3145728ns
	Kernel driver in use: r8169
	Kernel modules: r8169

02:00.0 Network controller [0280]: Intel Corporation Dual Band Wireless-AC 3168NGW [Stone Peak] [8086:24fb] (rev 10)
	Subsystem: Intel Corporation Device [8086:2110]
	Control: I/O- Mem+ BusMaster+ SpecCycle- MemWINV- VGASnoop- ParErr- Stepping- SERR- FastB2B- DisINTx+
	Status: Cap+ 66MHz- UDF- FastB2B- ParErr- DEVSEL=fast >TAbort- <TAbort- <MAbort- >SERR- <PERR- INTx-
	Latency: 0, Cache Line Size: 64 bytes
	Interrupt: pin A routed to IRQ 137
	Region 0: Memory at df100000 (64-bit, non-prefetchable) [size=8K]
	Capabilities: [c8] Power Management version 3
		Flags: PMEClk- DSI+ D1- D2- AuxCurrent=0mA PME(D0+,D1-,D2-,D3hot+,D3cold+)
		Status: D0 NoSoftRst- PME-Enable- DSel=0 DScale=0 PME-
	Capabilities: [d0] MSI: Enable+ Count=1/1 Maskable- 64bit+
		Address: 00000000fee00418  Data: 0000
	Capabilities: [40] Express (v2) Endpoint, MSI 00
		DevCap:	MaxPayload 128 bytes, PhantFunc 0, Latency L0s <512ns, L1 unlimited
			ExtTag- AttnBtn- AttnInd- PwrInd- RBE+ FLReset+ SlotPowerLimit 0.000W
		DevCtl:	CorrErr- NonFatalErr- FatalErr- UnsupReq-
			RlxdOrd+ ExtTag- PhantFunc- AuxPwr+ NoSnoop+ FLReset-
			MaxPayload 128 bytes, MaxReadReq 128 bytes
		DevSta:	CorrErr- NonFatalErr- FatalErr- UnsupReq- AuxPwr+ TransPend-
		LnkCap:	Port #0, Speed 2.5GT/s, Width x1, ASPM L1, Exit Latency L1 <32us
			ClockPM+ Surprise- LLActRep- BwNot- ASPMOptComp+
		LnkCtl:	ASPM Disabled; RCB 64 bytes, Disabled- CommClk+
			ExtSynch- ClockPM+ AutWidDis- BWInt- AutBWInt-
		LnkSta:	Speed 2.5GT/s (ok), Width x1 (ok)
			TrErr- Train- SlotClk+ DLActive- BWMgmt- ABWMgmt-
		DevCap2: Completion Timeout: Range B, TimeoutDis+ NROPrPrP- LTR+
			 10BitTagComp- 10BitTagReq- OBFF Via WAKE#, ExtFmt- EETLPPrefix-
			 EmergencyPowerReduction Not Supported, EmergencyPowerReductionInit-
			 FRS- TPHComp- ExtTPHComp-
			 AtomicOpsCap: 32bit- 64bit- 128bitCAS-
		DevCtl2: Completion Timeout: 16ms to 55ms, TimeoutDis- LTR+ OBFF Disabled,
			 AtomicOpsCtl: ReqEn-
		LnkCtl2: Target Link Speed: 2.5GT/s, EnterCompliance- SpeedDis-
			 Transmit Margin: Normal Operating Range, EnterModifiedCompliance- ComplianceSOS-
			 Compliance De-emphasis: -6dB
		LnkSta2: Current De-emphasis Level: -3.5dB, EqualizationComplete- EqualizationPhase1-
			 EqualizationPhase2- EqualizationPhase3- LinkEqualizationRequest-
			 Retimer- 2Retimers- CrosslinkRes: unsupported
	Capabilities: [100 v1] Advanced Error Reporting
		UESta:	DLP- SDES- TLP- FCP- CmpltTO- CmpltAbrt- UnxCmplt- RxOF- MalfTLP- ECRC- UnsupReq- ACSViol-
		UEMsk:	DLP- SDES- TLP- FCP- CmpltTO- CmpltAbrt- UnxCmplt- RxOF- MalfTLP- ECRC- UnsupReq- ACSViol-
		UESvrt:	DLP+ SDES+ TLP- FCP+ CmpltTO- CmpltAbrt- UnxCmplt- RxOF+ MalfTLP+ ECRC- UnsupReq- ACSViol-
		CESta:	RxErr- BadTLP- BadDLLP- Rollover- Timeout- AdvNonFatalErr-
		CEMsk:	RxErr- BadTLP- BadDLLP- Rollover- Timeout- AdvNonFatalErr+
		AERCap:	First Error Pointer: 00, ECRCGenCap- ECRCGenEn- ECRCChkCap- ECRCChkEn-
			MultHdrRecCap- MultHdrRecEn- TLPPfxPres- HdrLogCap-
		HeaderLog: 00000000 00000000 00000000 00000000
	Capabilities: [140 v1] Device Serial Number ...
	Capabilities: [14c v1] Latency Tolerance Reporting
		Max snoop latency: 3145728ns
		Max no snoop latency: 3145728ns
	Capabilities: [154 v1] L1 PM Substates
		L1SubCap: PCI-PM_L1.2+ PCI-PM_L1.1+ ASPM_L1.2+ ASPM_L1.1+ L1_PM_Substates+
			  PortCommonModeRestoreTime=30us PortTPowerOnTime=60us
		L1SubCtl1: PCI-PM_L1.2+ PCI-PM_L1.1+ ASPM_L1.2+ ASPM_L1.1+
			   T_CommonMode=0us LTR1.2_Threshold=163840ns
		L1SubCtl2: T_PwrOn=60us
	Kernel driver in use: iwlwifi
	Kernel modules: iwlwifi

03:00.0 Non-Volatile memory controller [0108]: Samsung Electronics Co Ltd NVMe SSD Controller SM981/PM981/PM983 [144d:a808] (prog-if 02 [NVM Express])
	Subsystem: Samsung Electronics Co Ltd Device [144d:a801]
	Control: I/O- Mem+ BusMaster+ SpecCycle- MemWINV- VGASnoop- ParErr- Stepping- SERR- FastB2B- DisINTx+
	Status: Cap+ 66MHz- UDF- FastB2B- ParErr- DEVSEL=fast >TAbort- <TAbort- <MAbort- >SERR- <PERR- INTx-
	Latency: 0, Cache Line Size: 64 bytes
	Interrupt: pin A routed to IRQ 16
	NUMA node: 0
	Region 0: Memory at df000000 (64-bit, non-prefetchable) [size=16K]
	Capabilities: [40] Power Management version 3
		Flags: PMEClk- DSI- D1- D2- AuxCurrent=0mA PME(D0-,D1-,D2-,D3hot-,D3cold-)
		Status: D0 NoSoftRst+ PME-Enable- DSel=0 DScale=0 PME-
	Capabilities: [50] MSI: Enable- Count=1/32 Maskable- 64bit+
		Address: 0000000000000000  Data: 0000
	Capabilities: [70] Express (v2) Endpoint, MSI 00
		DevCap:	MaxPayload 256 bytes, PhantFunc 0, Latency L0s unlimited, L1 unlimited
			ExtTag- AttnBtn- AttnInd- PwrInd- RBE+ FLReset+ SlotPowerLimit 25.000W
		DevCtl:	CorrErr+ NonFatalErr+ FatalErr+ UnsupReq+
			RlxdOrd+ ExtTag- PhantFunc- AuxPwr- NoSnoop+ FLReset-
			MaxPayload 256 bytes, MaxReadReq 512 bytes
		DevSta:	CorrErr- NonFatalErr- FatalErr- UnsupReq- AuxPwr- TransPend-
		LnkCap:	Port #0, Speed 8GT/s, Width x4, ASPM L1, Exit Latency L1 <64us
			ClockPM+ Surprise- LLActRep- BwNot- ASPMOptComp+
		LnkCtl:	ASPM Disabled; RCB 64 bytes, Disabled- CommClk+
			ExtSynch- ClockPM+ AutWidDis- BWInt- AutBWInt-
		LnkSta:	Speed 8GT/s (ok), Width x4 (ok)
			TrErr- Train- SlotClk+ DLActive- BWMgmt- ABWMgmt-
		DevCap2: Completion Timeout: Range ABCD, TimeoutDis+ NROPrPrP- LTR+
			 10BitTagComp- 10BitTagReq- OBFF Not Supported, ExtFmt- EETLPPrefix-
			 EmergencyPowerReduction Not Supported, EmergencyPowerReductionInit-
			 FRS- TPHComp- ExtTPHComp-
			 AtomicOpsCap: 32bit- 64bit- 128bitCAS-
		DevCtl2: Completion Timeout: 50us to 50ms, TimeoutDis- LTR+ OBFF Disabled,
			 AtomicOpsCtl: ReqEn-
		LnkCap2: Supported Link Speeds: 2.5-8GT/s, Crosslink- Retimer- 2Retimers- DRS-
		LnkCtl2: Target Link Speed: 8GT/s, EnterCompliance- SpeedDis-
			 Transmit Margin: Normal Operating Range, EnterModifiedCompliance- ComplianceSOS-
			 Compliance De-emphasis: -6dB
		LnkSta2: Current De-emphasis Level: -6dB, EqualizationComplete+ EqualizationPhase1+
			 EqualizationPhase2+ EqualizationPhase3+ LinkEqualizationRequest-
			 Retimer- 2Retimers- CrosslinkRes: unsupported
	Capabilities: [b0] MSI-X: Enable+ Count=33 Masked-
		Vector table: BAR=0 offset=00003000
		PBA: BAR=0 offset=00002000
	Capabilities: [100 v2] Advanced Error Reporting
		UESta:	DLP- SDES- TLP- FCP- CmpltTO- CmpltAbrt- UnxCmplt- RxOF- MalfTLP- ECRC- UnsupReq- ACSViol-
		UEMsk:	DLP- SDES- TLP- FCP- CmpltTO- CmpltAbrt- UnxCmplt- RxOF- MalfTLP- ECRC- UnsupReq- ACSViol-
		UESvrt:	DLP+ SDES+ TLP- FCP+ CmpltTO- CmpltAbrt- UnxCmplt- RxOF+ MalfTLP+ ECRC- UnsupReq- ACSViol-
		CESta:	RxErr- BadTLP- BadDLLP- Rollover- Timeout- AdvNonFatalErr-
		CEMsk:	RxErr- BadTLP- BadDLLP- Rollover- Timeout- AdvNonFatalErr+
		AERCap:	First Error Pointer: 00, ECRCGenCap+ ECRCGenEn- ECRCChkCap+ ECRCChkEn-
			MultHdrRecCap+ MultHdrRecEn- TLPPfxPres- HdrLogCap-
		HeaderLog: 00000000 00000000 00000000 00000000
	Capabilities: [148 v1] Device Serial Number ...
	Capabilities: [158 v1] Power Budgeting <?>
	Capabilities: [168 v1] Secondary PCI Express
		LnkCtl3: LnkEquIntrruptEn- PerformEqu-
		LaneErrStat: 0
	Capabilities: [188 v1] Latency Tolerance Reporting
		Max snoop latency: 3145728ns
		Max no snoop latency: 3145728ns
	Capabilities: [190 v1] L1 PM Substates
		L1SubCap: PCI-PM_L1.2+ PCI-PM_L1.1+ ASPM_L1.2+ ASPM_L1.1+ L1_PM_Substates+
			  PortCommonModeRestoreTime=10us PortTPowerOnTime=10us
		L1SubCtl1: PCI-PM_L1.2+ PCI-PM_L1.1+ ASPM_L1.2+ ASPM_L1.1+
			   T_CommonMode=0us LTR1.2_Threshold=163840ns
		L1SubCtl2: T_PwrOn=44us
	Kernel driver in use: nvme
	Kernel modules: nvme

