00:00.0 Host bridge [0600]: Intel Corporation Mobile 4 Series Chipset Memory Controller Hub [8086:2a40] (rev 09)
	Subsystem: Gateway, Inc. Device [107b:0704]
	Control: I/O- Mem+ BusMaster+ SpecCycle- MemWINV- VGASnoop- ParErr- Stepping- SERR+ FastB2B- DisINTx-
	Status: Cap+ 66MHz- UDF- FastB2B+ ParErr- DEVSEL=fast >TAbort- <TAbort- <MAbort+ >SERR- <PERR- INTx-
	Latency: 0
	Capabilities: <access denied>

00:02.0 VGA compatible controller [0300]: Intel Corporation Mobile 4 Series Chipset Integrated Graphics Controller [8086:2a42] (rev 09) (prog-if 00 [VGA controller])
	Subsystem: Gateway, Inc. Device [107b:0704]
	Control: I/O+ Mem+ BusMaster+ SpecCycle- MemWINV- VGASnoop- ParErr- Stepping- SERR- FastB2B- DisINTx-
	Status: Cap+ 66MHz- UDF- FastB2B+ ParErr- DEVSEL=fast >TAbort- <TAbort- <MAbort- >SERR- <PERR- INTx-
	Latency: 0
	Interrupt: pin A routed to IRQ 16
	Region 0: Memory at f0000000 (64-bit, non-prefetchable) [size=4M]
	Region 2: Memory at d0000000 (64-bit, prefetchable) [size=256M]
	Region 4: I/O ports at 1800 [size=8]
	[virtual] Expansion ROM at 000c0000 [disabled] [size=128K]
	Capabilities: <access denied>
	Kernel driver in use: i915
	Kernel modules: i915

00:02.1 Display controller [0380]: Intel Corporation Mobile 4 Series Chipset Integrated Graphics Controller [8086:2a43] (rev 09)
	Subsystem: Gateway, Inc. Device [107b:0704]
	Control: I/O+ Mem+ BusMaster+ SpecCycle- MemWINV- VGASnoop- ParErr- Stepping- SERR- FastB2B- DisINTx-
	Status: Cap+ 66MHz- UDF- FastB2B+ ParErr- DEVSEL=fast >TAbort- <TAbort- <MAbort- >SERR- <PERR- INTx-
	Latency: 0
	Region 0: Memory at f0400000 (64-bit, non-prefetchable) [size=1M]
	Capabilities: <access denied>

00:1a.0 USB controller [0c03]: Intel Corporation 82801I (ICH9 Family) USB UHCI Controller #4 [8086:2937] (rev 03) (prog-if 00 [UHCI])
	Subsystem: Gateway, Inc. Device [107b:0704]
	Control: I/O+ Mem- BusMaster+ SpecCycle- MemWINV- VGASnoop- ParErr- Stepping- SERR- FastB2B- DisINTx-
	Status: Cap+ 66MHz- UDF- FastB2B+ ParErr- DEVSEL=medium >TAbort- <TAbort- <MAbort- >SERR- <PERR- INTx-
	Latency: 0
	Interrupt: pin A routed to IRQ 16
	Region 4: I/O ports at 1820 [size=32]
	Capabilities: <access denied>
	Kernel driver in use: uhci_hcd

00:1a.1 USB controller [0c03]: Intel Corporation 82801I (ICH9 Family) USB UHCI Controller #5 [8086:2938] (rev 03) (prog-if 00 [UHCI])
	Subsystem: Gateway, Inc. Device [107b:0704]
	Control: I/O+ Mem- BusMaster+ SpecCycle- MemWINV- VGASnoop- ParErr- Stepping- SERR- FastB2B- DisINTx-
	Status: Cap+ 66MHz- UDF- FastB2B+ ParErr- DEVSEL=medium >TAbort- <TAbort- <MAbort- >SERR- <PERR- INTx-
	Latency: 0
	Interrupt: pin B routed to IRQ 21
	Region 4: I/O ports at 1840 [size=32]
	Capabilities: <access denied>
	Kernel driver in use: uhci_hcd

00:1a.2 USB controller [0c03]: Intel Corporation 82801I (ICH9 Family) USB UHCI Controller #6 [8086:2939] (rev 03) (prog-if 00 [UHCI])
	Subsystem: Gateway, Inc. Device [107b:0704]
	Control: I/O+ Mem- BusMaster+ SpecCycle- MemWINV- VGASnoop- ParErr- Stepping- SERR- FastB2B- DisINTx-
	Status: Cap+ 66MHz- UDF- FastB2B+ ParErr- DEVSEL=medium >TAbort- <TAbort- <MAbort- >SERR- <PERR- INTx-
	Latency: 0
	Interrupt: pin C routed to IRQ 19
	Region 4: I/O ports at 1860 [size=32]
	Capabilities: <access denied>
	Kernel driver in use: uhci_hcd

00:1a.7 USB controller [0c03]: Intel Corporation 82801I (ICH9 Family) USB2 EHCI Controller #2 [8086:293c] (rev 03) (prog-if 20 [EHCI])
	Subsystem: Gateway, Inc. Device [107b:0704]
	Control: I/O- Mem+ BusMaster+ SpecCycle- MemWINV- VGASnoop- ParErr- Stepping- SERR+ FastB2B- DisINTx-
	Status: Cap+ 66MHz- UDF- FastB2B+ ParErr- DEVSEL=medium >TAbort- <TAbort- <MAbort- >SERR- <PERR- INTx-
	Latency: 0
	Interrupt: pin C routed to IRQ 19
	Region 0: Memory at f0b04800 (32-bit, non-prefetchable) [size=1K]
	Capabilities: <access denied>
	Kernel driver in use: ehci-pci

00:1b.0 Audio device [0403]: Intel Corporation 82801I (ICH9 Family) HD Audio Controller [8086:293e] (rev 03)
	Subsystem: Gateway, Inc. Device [107b:0704]
	Control: I/O- Mem+ BusMaster+ SpecCycle- MemWINV- VGASnoop- ParErr- Stepping- SERR+ FastB2B- DisINTx+
	Status: Cap+ 66MHz- UDF- FastB2B- ParErr- DEVSEL=fast >TAbort- <TAbort- <MAbort- >SERR- <PERR- INTx-
	Latency: 0, Cache Line Size: 64 bytes
	Interrupt: pin A routed to IRQ 30
	Region 0: Memory at f0900000 (64-bit, non-prefetchable) [size=16K]
	Capabilities: <access denied>
	Kernel driver in use: snd_hda_intel
	Kernel modules: snd_hda_intel

00:1c.0 PCI bridge [0604]: Intel Corporation 82801I (ICH9 Family) PCI Express Port 1 [8086:2940] (rev 03) (prog-if 00 [Normal decode])
	Control: I/O+ Mem+ BusMaster+ SpecCycle- MemWINV- VGASnoop- ParErr- Stepping- SERR+ FastB2B- DisINTx-
	Status: Cap+ 66MHz- UDF- FastB2B- ParErr- DEVSEL=fast >TAbort- <TAbort- <MAbort- >SERR- <PERR- INTx-
	Latency: 0, Cache Line Size: 64 bytes
	Interrupt: pin A routed to IRQ 17
	Bus: primary=00, secondary=02, subordinate=03, sec-latency=0
	I/O behind bridge: 00002000-00002fff [size=4K]
	Memory behind bridge: f0500000-f05fffff [size=1M]
	Prefetchable memory behind bridge: 00000000f0c00000-00000000f0cfffff [size=1M]
	Secondary status: 66MHz- FastB2B- ParErr- DEVSEL=fast >TAbort- <TAbort- <MAbort+ <SERR- <PERR-
	BridgeCtl: Parity- SERR+ NoISA+ VGA- VGA16- MAbort- >Reset- FastB2B-
		PriDiscTmr- SecDiscTmr- DiscTmrStat- DiscTmrSERREn-
	Capabilities: <access denied>
	Kernel driver in use: pcieport

00:1c.2 PCI bridge [0604]: Intel Corporation 82801I (ICH9 Family) PCI Express Port 3 [8086:2944] (rev 03) (prog-if 00 [Normal decode])
	Control: I/O+ Mem+ BusMaster+ SpecCycle- MemWINV- VGASnoop- ParErr- Stepping- SERR+ FastB2B- DisINTx-
	Status: Cap+ 66MHz- UDF- FastB2B- ParErr- DEVSEL=fast >TAbort- <TAbort- <MAbort- >SERR- <PERR- INTx-
	Latency: 0, Cache Line Size: 64 bytes
	Interrupt: pin C routed to IRQ 18
	Bus: primary=00, secondary=04, subordinate=05, sec-latency=0
	I/O behind bridge: 00003000-00003fff [size=4K]
	Memory behind bridge: f0600000-f06fffff [size=1M]
	Prefetchable memory behind bridge: 00000000f0d00000-00000000f0dfffff [size=1M]
	Secondary status: 66MHz- FastB2B- ParErr- DEVSEL=fast >TAbort- <TAbort- <MAbort+ <SERR- <PERR-
	BridgeCtl: Parity- SERR+ NoISA+ VGA- VGA16- MAbort- >Reset- FastB2B-
		PriDiscTmr- SecDiscTmr- DiscTmrStat- DiscTmrSERREn-
	Capabilities: <access denied>
	Kernel driver in use: pcieport

00:1c.5 PCI bridge [0604]: Intel Corporation 82801I (ICH9 Family) PCI Express Port 6 [8086:294a] (rev 03) (prog-if 00 [Normal decode])
	Control: I/O+ Mem+ BusMaster+ SpecCycle- MemWINV- VGASnoop- ParErr- Stepping- SERR+ FastB2B- DisINTx-
	Status: Cap+ 66MHz- UDF- FastB2B- ParErr- DEVSEL=fast >TAbort- <TAbort- <MAbort- >SERR- <PERR- INTx-
	Latency: 0, Cache Line Size: 64 bytes
	Interrupt: pin B routed to IRQ 16
	Bus: primary=00, secondary=06, subordinate=06, sec-latency=0
	I/O behind bridge: 00004000-00004fff [size=4K]
	Memory behind bridge: f0700000-f07fffff [size=1M]
	Prefetchable memory behind bridge: 00000000c0000000-00000000c01fffff [size=2M]
	Secondary status: 66MHz- FastB2B- ParErr- DEVSEL=fast >TAbort- <TAbort- <MAbort+ <SERR- <PERR-
	BridgeCtl: Parity- SERR+ NoISA+ VGA- VGA16- MAbort- >Reset- FastB2B-
		PriDiscTmr- SecDiscTmr- DiscTmrStat- DiscTmrSERREn-
	Capabilities: <access denied>
	Kernel driver in use: pcieport

00:1d.0 USB controller [0c03]: Intel Corporation 82801I (ICH9 Family) USB UHCI Controller #1 [8086:2934] (rev 03) (prog-if 00 [UHCI])
	Subsystem: Gateway, Inc. Device [107b:0704]
	Control: I/O+ Mem- BusMaster+ SpecCycle- MemWINV- VGASnoop- ParErr- Stepping- SERR- FastB2B- DisINTx-
	Status: Cap+ 66MHz- UDF- FastB2B+ ParErr- DEVSEL=medium >TAbort- <TAbort- <MAbort- >SERR- <PERR- INTx-
	Latency: 0
	Interrupt: pin A routed to IRQ 23
	Region 4: I/O ports at 1880 [size=32]
	Capabilities: <access denied>
	Kernel driver in use: uhci_hcd

00:1d.1 USB controller [0c03]: Intel Corporation 82801I (ICH9 Family) USB UHCI Controller #2 [8086:2935] (rev 03) (prog-if 00 [UHCI])
	Subsystem: Gateway, Inc. Device [107b:0704]
	Control: I/O+ Mem- BusMaster+ SpecCycle- MemWINV- VGASnoop- ParErr- Stepping- SERR- FastB2B- DisINTx-
	Status: Cap+ 66MHz- UDF- FastB2B+ ParErr- DEVSEL=medium >TAbort- <TAbort- <MAbort- >SERR- <PERR- INTx-
	Latency: 0
	Interrupt: pin B routed to IRQ 19
	Region 4: I/O ports at 18a0 [size=32]
	Capabilities: <access denied>
	Kernel driver in use: uhci_hcd

00:1d.2 USB controller [0c03]: Intel Corporation 82801I (ICH9 Family) USB UHCI Controller #3 [8086:2936] (rev 03) (prog-if 00 [UHCI])
	Subsystem: Gateway, Inc. Device [107b:0704]
	Control: I/O+ Mem- BusMaster+ SpecCycle- MemWINV- VGASnoop- ParErr- Stepping- SERR- FastB2B- DisINTx-
	Status: Cap+ 66MHz- UDF- FastB2B+ ParErr- DEVSEL=medium >TAbort- <TAbort- <MAbort- >SERR- <PERR- INTx-
	Latency: 0
	Interrupt: pin C routed to IRQ 18
	Region 4: I/O ports at 18c0 [size=32]
	Capabilities: <access denied>
	Kernel driver in use: uhci_hcd

00:1d.7 USB controller [0c03]: Intel Corporation 82801I (ICH9 Family) USB2 EHCI Controller #1 [8086:293a] (rev 03) (prog-if 20 [EHCI])
	Subsystem: Gateway, Inc. Device [107b:0704]
	Control: I/O- Mem+ BusMaster+ SpecCycle- MemWINV- VGASnoop- ParErr- Stepping- SERR+ FastB2B- DisINTx-
	Status: Cap+ 66MHz- UDF- FastB2B+ ParErr- DEVSEL=medium >TAbort- <TAbort- <MAbort- >SERR- <PERR- INTx-
	Latency: 0
	Interrupt: pin A routed to IRQ 23
	Region 0: Memory at f0b04c00 (32-bit, non-prefetchable) [size=1K]
	Capabilities: <access denied>
	Kernel driver in use: ehci-pci

00:1e.0 PCI bridge [0604]: Intel Corporation 82801 Mobile PCI Bridge [8086:2448] (rev 93) (prog-if 01 [Subtractive decode])
	Control: I/O+ Mem+ BusMaster+ SpecCycle- MemWINV- VGASnoop- ParErr- Stepping- SERR+ FastB2B- DisINTx-
	Status: Cap+ 66MHz- UDF- FastB2B- ParErr- DEVSEL=fast >TAbort- <TAbort- <MAbort- >SERR- <PERR- INTx-
	Latency: 0
	Bus: primary=00, secondary=07, subordinate=07, sec-latency=32
	I/O behind bridge: None
	Memory behind bridge: f0800000-f08fffff [size=1M]
	Prefetchable memory behind bridge: None
	Secondary status: 66MHz- FastB2B+ ParErr- DEVSEL=medium >TAbort- <TAbort- <MAbort+ <SERR- <PERR-
	BridgeCtl: Parity- SERR+ NoISA+ VGA- VGA16- MAbort- >Reset- FastB2B-
		PriDiscTmr- SecDiscTmr- DiscTmrStat- DiscTmrSERREn-
	Capabilities: <access denied>

00:1f.0 ISA bridge [0601]: Intel Corporation ICH9M LPC Interface Controller [8086:2919] (rev 03)
	Subsystem: Gateway, Inc. Device [107b:0704]
	Control: I/O+ Mem+ BusMaster+ SpecCycle- MemWINV- VGASnoop- ParErr- Stepping- SERR- FastB2B- DisINTx-
	Status: Cap+ 66MHz- UDF- FastB2B- ParErr- DEVSEL=medium >TAbort- <TAbort- <MAbort- >SERR- <PERR- INTx-
	Latency: 0
	Capabilities: <access denied>
	Kernel driver in use: lpc_ich
	Kernel modules: lpc_ich

00:1f.2 SATA controller [0106]: Intel Corporation 82801IBM/IEM (ICH9M/ICH9M-E) 4 port SATA Controller [AHCI mode] [8086:2929] (rev 03) (prog-if 01 [AHCI 1.0])
	Subsystem: Gateway, Inc. Device [107b:0704]
	Control: I/O+ Mem+ BusMaster+ SpecCycle- MemWINV- VGASnoop- ParErr- Stepping- SERR- FastB2B- DisINTx+
	Status: Cap+ 66MHz+ UDF- FastB2B+ ParErr- DEVSEL=medium >TAbort- <TAbort- <MAbort- >SERR- <PERR- INTx-
	Latency: 0
	Interrupt: pin B routed to IRQ 25
	Region 0: I/O ports at 1818 [size=8]
	Region 1: I/O ports at 180c [size=4]
	Region 2: I/O ports at 1810 [size=8]
	Region 3: I/O ports at 1808 [size=4]
	Region 4: I/O ports at 18e0 [size=32]
	Region 5: Memory at f0b04000 (32-bit, non-prefetchable) [size=2K]
	Capabilities: <access denied>
	Kernel driver in use: ahci
	Kernel modules: ahci

00:1f.3 SMBus [0c05]: Intel Corporation 82801I (ICH9 Family) SMBus Controller [8086:2930] (rev 03)
	Subsystem: Gateway, Inc. Device [107b:0704]
	Control: I/O+ Mem+ BusMaster- SpecCycle- MemWINV- VGASnoop- ParErr- Stepping- SERR+ FastB2B- DisINTx-
	Status: Cap- 66MHz- UDF- FastB2B+ ParErr- DEVSEL=medium >TAbort- <TAbort- <MAbort- >SERR- <PERR- INTx-
	Interrupt: pin C routed to IRQ 19
	Region 0: Memory at c0200000 (64-bit, non-prefetchable) [size=256]
	Region 4: I/O ports at 1c00 [size=32]
	Kernel driver in use: i801_smbus
	Kernel modules: i2c_i801

02:00.0 Network controller [0280]: Intel Corporation Wireless 7260 [8086:08b1] (rev 73)
	Subsystem: Intel Corporation Dual Band Wireless-AC 7260 [Wilkins Peak 2] [8086:4070]
	Control: I/O- Mem+ BusMaster+ SpecCycle- MemWINV- VGASnoop- ParErr- Stepping- SERR+ FastB2B- DisINTx+
	Status: Cap+ 66MHz- UDF- FastB2B- ParErr- DEVSEL=fast >TAbort- <TAbort- <MAbort- >SERR- <PERR- INTx-
	Latency: 0, Cache Line Size: 64 bytes
	Interrupt: pin A routed to IRQ 29
	Region 0: Memory at f0500000 (64-bit, non-prefetchable) [size=8K]
	Capabilities: <access denied>
	Kernel driver in use: iwlwifi
	Kernel modules: iwlwifi

04:00.0 USB controller [0c03]: Renesas Technology Corp. uPD720202 USB 3.0 Host Controller [1912:0015] (rev 02) (prog-if 30 [XHCI])
	Subsystem: Renesas Technology Corp. uPD720202 USB 3.0 Host Controller [1912:0015]
	Control: I/O- Mem+ BusMaster+ SpecCycle- MemWINV- VGASnoop- ParErr- Stepping- SERR+ FastB2B- DisINTx+
	Status: Cap+ 66MHz- UDF- FastB2B- ParErr- DEVSEL=fast >TAbort- <TAbort- <MAbort- >SERR- <PERR- INTx-
	Latency: 0, Cache Line Size: 64 bytes
	Interrupt: pin A routed to IRQ 18
	Region 0: Memory at f0600000 (64-bit, non-prefetchable) [size=8K]
	Capabilities: <access denied>
	Kernel driver in use: xhci_hcd
	Kernel modules: xhci_pci

06:00.0 Ethernet controller [0200]: Marvell Technology Group Ltd. 88E8057 PCI-E Gigabit Ethernet Controller [11ab:4380] (rev 10)
	Subsystem: Gateway, Inc. Device [107b:0704]
	Control: I/O+ Mem+ BusMaster+ SpecCycle- MemWINV- VGASnoop- ParErr- Stepping- SERR+ FastB2B- DisINTx+
	Status: Cap+ 66MHz- UDF- FastB2B- ParErr- DEVSEL=fast >TAbort- <TAbort- <MAbort- >SERR- <PERR- INTx-
	Latency: 0, Cache Line Size: 64 bytes
	Interrupt: pin A routed to IRQ 24
	Region 0: Memory at f0700000 (64-bit, non-prefetchable) [size=16K]
	Region 2: I/O ports at 4000 [size=256]
	[virtual] Expansion ROM at f0720000 [disabled] [size=128K]
	Capabilities: <access denied>
	Kernel driver in use: sky2
	Kernel modules: sky2

07:09.0 Mass storage controller [0180]: O2 Micro, Inc. Integrated MS/xD Controller [1217:7130] (rev 03)
	Subsystem: Gateway, Inc. Device [107b:0704]
	Control: I/O- Mem+ BusMaster- SpecCycle- MemWINV- VGASnoop- ParErr- Stepping- SERR+ FastB2B- DisINTx-
	Status: Cap+ 66MHz- UDF- FastB2B- ParErr- DEVSEL=slow >TAbort- <TAbort- <MAbort- >SERR- <PERR- INTx-
	Interrupt: pin A routed to IRQ 5
	Region 0: Memory at f0800000 (32-bit, non-prefetchable) [size=4K]
	Capabilities: <access denied>

07:09.2 SD Host controller [0805]: O2 Micro, Inc. Integrated MMC/SD Controller [1217:7120] (rev 02) (prog-if 01)
	Subsystem: Gateway, Inc. Device [107b:0704]
	Control: I/O- Mem+ BusMaster+ SpecCycle- MemWINV- VGASnoop- ParErr- Stepping- SERR+ FastB2B- DisINTx-
	Status: Cap+ 66MHz- UDF- FastB2B- ParErr- DEVSEL=slow >TAbort- <TAbort- <MAbort- >SERR- <PERR- INTx-
	Latency: 32, Cache Line Size: 64 bytes
	Interrupt: pin A routed to IRQ 16
	Region 0: Memory at f0801000 (32-bit, non-prefetchable) [size=256]
	Capabilities: <access denied>
	Kernel driver in use: sdhci-pci
	Kernel modules: sdhci_pci

