00:00.0 Host bridge [0600]: Intel Corporation Device [8086:31f0] (rev 06)
	Subsystem: Hewlett-Packard Company Device [103c:86f0]
	Control: I/O+ Mem+ BusMaster+ SpecCycle- MemWINV- VGASnoop- ParErr- Stepping- SERR- FastB2B- DisINTx-
	Status: Cap- 66MHz- UDF- FastB2B- ParErr- DEVSEL=fast >TAbort- <TAbort- <MAbort- >SERR- <PERR- INTx-
	Latency: 0

00:00.1 Signal processing controller [1180]: Intel Corporation Device [8086:318c] (rev 06)
	Subsystem: Hewlett-Packard Company Device [103c:86f0]
	Control: I/O- Mem+ BusMaster+ SpecCycle- MemWINV- VGASnoop- ParErr- Stepping- SERR- FastB2B- DisINTx-
	Status: Cap+ 66MHz- UDF- FastB2B+ ParErr- DEVSEL=fast >TAbort- <TAbort- <MAbort- >SERR- <PERR- INTx+
	Latency: 0
	Interrupt: pin B routed to IRQ 24
	Region 0: Memory at 80000000 (64-bit, non-prefetchable) [size=32K]
	Capabilities: [d0] Power Management version 3
		Flags: PMEClk- DSI- D1- D2- AuxCurrent=0mA PME(D0-,D1-,D2-,D3hot-,D3cold-)
		Status: D0 NoSoftRst+ PME-Enable- DSel=0 DScale=0 PME-
	Capabilities: [e0] Vendor Specific Information: Len=0c <?>
	Kernel driver in use: proc_thermal
	Kernel modules: processor_thermal_device

00:00.3 System peripheral [0880]: Intel Corporation Device [8086:3190] (rev 06)
	Subsystem: Hewlett-Packard Company Device [103c:86f0]
	Control: I/O- Mem- BusMaster- SpecCycle- MemWINV- VGASnoop- ParErr- Stepping- SERR- FastB2B- DisINTx-
	Status: Cap+ 66MHz- UDF- FastB2B- ParErr- DEVSEL=fast >TAbort- <TAbort- <MAbort- >SERR- <PERR- INTx-
	Interrupt: pin A routed to IRQ 23
	Region 0: Memory at a141a000 (64-bit, non-prefetchable) [disabled] [size=4K]
	Capabilities: [90] MSI: Enable- Count=1/1 Maskable- 64bit-
		Address: 00000000  Data: 0000
	Capabilities: [a0] Vendor Specific Information: Len=14 <?>
	Capabilities: [dc] Power Management version 2
		Flags: PMEClk- DSI- D1- D2- AuxCurrent=0mA PME(D0-,D1-,D2-,D3hot-,D3cold-)
		Status: D0 NoSoftRst- PME-Enable- DSel=0 DScale=0 PME-
	Capabilities: [f0] PCI Advanced Features
		AFCap: TP+ FLR+
		AFCtrl: FLR-
		AFStatus: TP-

00:02.0 VGA compatible controller [0300]: Intel Corporation Device [8086:3184] (rev 06) (prog-if 00 [VGA controller])
	Subsystem: Hewlett-Packard Company Device [103c:86f0]
	Control: I/O+ Mem+ BusMaster+ SpecCycle- MemWINV- VGASnoop- ParErr- Stepping- SERR- FastB2B- DisINTx+
	Status: Cap+ 66MHz- UDF- FastB2B- ParErr- DEVSEL=fast >TAbort- <TAbort- <MAbort- >SERR- <PERR- INTx-
	Latency: 0, Cache Line Size: 64 bytes
	Interrupt: pin A routed to IRQ 131
	Region 0: Memory at a0000000 (64-bit, non-prefetchable) [size=16M]
	Region 2: Memory at 90000000 (64-bit, prefetchable) [size=256M]
	Region 4: I/O ports at f000 [size=64]
	[virtual] Expansion ROM at 000c0000 [disabled] [size=128K]
	Capabilities: [40] Vendor Specific Information: Len=0c <?>
	Capabilities: [70] Express (v2) Root Complex Integrated Endpoint, MSI 00
		DevCap:	MaxPayload 128 bytes, PhantFunc 0, Latency L0s <64ns, L1 <1us
			ExtTag- RBE+ FLReset+
		DevCtl:	Report errors: Correctable- Non-Fatal- Fatal- Unsupported-
			RlxdOrd- ExtTag- PhantFunc- AuxPwr- NoSnoop-
			MaxPayload 128 bytes, MaxReadReq 128 bytes
		DevSta:	CorrErr- UncorrErr- FatalErr- UnsuppReq- AuxPwr- TransPend-
		LnkCap:	Port #0, Speed unknown, Width x0, ASPM not supported, Latency L0 <64ns, L1 <1us
			ClockPM- Surprise- LLActRep- BwNot-
		LnkCtl:	ASPM Disabled; Disabled- Retrain- CommClk-
			ExtSynch- ClockPM- AutWidDis- BWInt- AutBWInt-
		LnkSta:	Speed unknown, Width x0, TrErr- Train- SlotClk- DLActive- BWMgmt- ABWMgmt-
		DevCap2: Completion Timeout: Not Supported, TimeoutDis-, LTR-, OBFF Not Supported
		DevCtl2: Completion Timeout: 50us to 50ms, TimeoutDis-, LTR-, OBFF Disabled
		LnkCtl2: Target Link Speed: 2.5GT/s, EnterCompliance- SpeedDis-
			 Transmit Margin: Normal Operating Range, EnterModifiedCompliance- ComplianceSOS-
			 Compliance De-emphasis: -6dB
		LnkSta2: Current De-emphasis Level: -6dB, EqualizationComplete-, EqualizationPhase1-
			 EqualizationPhase2-, EqualizationPhase3-, LinkEqualizationRequest-
	Capabilities: [ac] MSI: Enable+ Count=1/1 Maskable- 64bit-
		Address: fee00018  Data: 0000
	Capabilities: [d0] Power Management version 2
		Flags: PMEClk- DSI+ D1- D2- AuxCurrent=0mA PME(D0-,D1-,D2-,D3hot-,D3cold-)
		Status: D0 NoSoftRst- PME-Enable- DSel=0 DScale=0 PME-
	Capabilities: [100 v1] #1b
	Capabilities: [200 v1] Address Translation Service (ATS)
		ATSCap:	Invalidate Queue Depth: 00
		ATSCtl:	Enable-, Smallest Translation Unit: 00
	Capabilities: [300 v1] #13
	Kernel driver in use: i915
	Kernel modules: i915

00:0e.0 Audio device [0403]: Intel Corporation Device [8086:3198] (rev 06)
	Subsystem: Hewlett-Packard Company Device [103c:86f0]
	Control: I/O- Mem+ BusMaster+ SpecCycle- MemWINV- VGASnoop- ParErr- Stepping- SERR+ FastB2B- DisINTx+
	Status: Cap+ 66MHz- UDF- FastB2B- ParErr- DEVSEL=fast >TAbort- <TAbort- <MAbort- >SERR- <PERR- INTx-
	Latency: 0, Cache Line Size: 64 bytes
	Interrupt: pin A routed to IRQ 137
	Region 0: Memory at a1410000 (64-bit, non-prefetchable) [size=16K]
	Region 4: Memory at a1000000 (64-bit, non-prefetchable) [size=1M]
	Capabilities: [50] Power Management version 3
		Flags: PMEClk- DSI- D1- D2- AuxCurrent=55mA PME(D0+,D1-,D2-,D3hot+,D3cold+)
		Status: D3 NoSoftRst+ PME-Enable+ DSel=0 DScale=0 PME-
	Capabilities: [80] Vendor Specific Information: Len=14 <?>
	Capabilities: [60] MSI: Enable+ Count=1/1 Maskable- 64bit+
		Address: 00000000fee004b8  Data: 0000
	Capabilities: [70] Express (v1) Root Complex Integrated Endpoint, MSI 00
		DevCap:	MaxPayload 128 bytes, PhantFunc 0, Latency L0s <64ns, L1 <1us
			ExtTag- RBE- FLReset+
		DevCtl:	Report errors: Correctable- Non-Fatal- Fatal- Unsupported-
			RlxdOrd- ExtTag- PhantFunc- AuxPwr- NoSnoop-
			MaxPayload 128 bytes, MaxReadReq 512 bytes
		DevSta:	CorrErr- UncorrErr- FatalErr- UnsuppReq- AuxPwr+ TransPend-
		LnkCap:	Port #0, Speed unknown, Width x0, ASPM not supported, Latency L0 <64ns, L1 <1us
			ClockPM- Surprise- LLActRep- BwNot-
		LnkCtl:	ASPM L0s Enabled; Disabled- Retrain- CommClk-
			ExtSynch- ClockPM- AutWidDis- BWInt- AutBWInt-
		LnkSta:	Speed unknown, Width x1, TrErr- Train- SlotClk+ DLActive+ BWMgmt+ ABWMgmt+
	Kernel driver in use: snd_hda_intel
	Kernel modules: snd_hda_intel, snd_soc_skl, snd_sof_pci

00:0f.0 Communication controller [0780]: Intel Corporation Device [8086:319a] (rev 06)
	Subsystem: Hewlett-Packard Company Device [103c:86f0]
	Control: I/O- Mem+ BusMaster+ SpecCycle- MemWINV- VGASnoop- ParErr- Stepping- SERR- FastB2B- DisINTx+
	Status: Cap+ 66MHz- UDF- FastB2B- ParErr- DEVSEL=fast >TAbort- <TAbort- <MAbort- >SERR- <PERR- INTx-
	Latency: 0
	Interrupt: pin A routed to IRQ 129
	Region 0: Memory at a1419000 (64-bit, non-prefetchable) [size=4K]
	Capabilities: [50] Power Management version 3
		Flags: PMEClk- DSI- D1- D2- AuxCurrent=0mA PME(D0-,D1-,D2-,D3hot+,D3cold-)
		Status: D0 NoSoftRst+ PME-Enable- DSel=0 DScale=0 PME-
	Capabilities: [8c] MSI: Enable+ Count=1/1 Maskable- 64bit+
		Address: 00000000fee00398  Data: 0000
	Capabilities: [a4] Vendor Specific Information: Len=14 <?>
	Kernel driver in use: mei_me
	Kernel modules: mei_me

00:12.0 SATA controller [0106]: Intel Corporation Device [8086:31e3] (rev 06) (prog-if 01 [AHCI 1.0])
	Subsystem: Hewlett-Packard Company Device [103c:86f0]
	Control: I/O+ Mem+ BusMaster+ SpecCycle- MemWINV- VGASnoop- ParErr- Stepping- SERR+ FastB2B- DisINTx+
	Status: Cap+ 66MHz+ UDF- FastB2B+ ParErr- DEVSEL=medium >TAbort- <TAbort- <MAbort- >SERR- <PERR- INTx-
	Latency: 0
	Interrupt: pin A routed to IRQ 127
	Region 0: Memory at a1414000 (32-bit, non-prefetchable) [size=8K]
	Region 1: Memory at a1418000 (32-bit, non-prefetchable) [size=256]
	Region 2: I/O ports at f090 [size=8]
	Region 3: I/O ports at f080 [size=4]
	Region 4: I/O ports at f060 [size=32]
	Region 5: Memory at a1417000 (32-bit, non-prefetchable) [size=2K]
	Capabilities: [80] MSI: Enable+ Count=1/1 Maskable- 64bit-
		Address: fee002f8  Data: 0000
	Capabilities: [70] Power Management version 3
		Flags: PMEClk- DSI- D1- D2- AuxCurrent=0mA PME(D0-,D1-,D2-,D3hot+,D3cold-)
		Status: D0 NoSoftRst+ PME-Enable- DSel=0 DScale=0 PME-
	Capabilities: [a8] SATA HBA v1.0 BAR4 Offset=00000004
	Kernel driver in use: ahci

00:13.0 PCI bridge [0604]: Intel Corporation Device [8086:31d8] (rev f6) (prog-if 00 [Normal decode])
	Control: I/O+ Mem+ BusMaster+ SpecCycle- MemWINV- VGASnoop- ParErr- Stepping- SERR+ FastB2B- DisINTx+
	Status: Cap+ 66MHz- UDF- FastB2B- ParErr- DEVSEL=fast >TAbort- <TAbort- <MAbort- >SERR- <PERR- INTx-
	Latency: 0, Cache Line Size: 64 bytes
	Bus: primary=00, secondary=01, subordinate=01, sec-latency=0
	Secondary status: 66MHz- FastB2B- ParErr- DEVSEL=fast >TAbort- <TAbort- <MAbort- <SERR- <PERR-
	BridgeCtl: Parity- SERR+ NoISA- VGA- MAbort- >Reset- FastB2B-
		PriDiscTmr- SecDiscTmr- DiscTmrStat- DiscTmrSERREn-
	Capabilities: [40] Express (v2) Root Port (Slot+), MSI 00
		DevCap:	MaxPayload 256 bytes, PhantFunc 0, Latency L0s <64ns, L1 <1us
			ExtTag- RBE+ FLReset-
		DevCtl:	Report errors: Correctable- Non-Fatal- Fatal- Unsupported-
			RlxdOrd- ExtTag- PhantFunc- AuxPwr- NoSnoop-
			MaxPayload 256 bytes, MaxReadReq 128 bytes
		DevSta:	CorrErr- UncorrErr- FatalErr- UnsuppReq- AuxPwr+ TransPend-
		LnkCap:	Port #3, Speed 5GT/s, Width x2, ASPM not supported, Latency L0 <1us, L1 <4us
			ClockPM- Surprise- LLActRep+ BwNot+
		LnkCtl:	ASPM Disabled; RCB 64 bytes Disabled- Retrain- CommClk-
			ExtSynch- ClockPM- AutWidDis- BWInt- AutBWInt-
		LnkSta:	Speed 2.5GT/s, Width x0, TrErr- Train+ SlotClk+ DLActive- BWMgmt- ABWMgmt-
		SltCap:	AttnBtn- PwrCtrl- MRL- AttnInd- PwrInd- HotPlug- Surprise-
			Slot #2, PowerLimit 25.000W; Interlock- NoCompl+
		SltCtl:	Enable: AttnBtn- PwrFlt- MRL- PresDet- CmdCplt- HPIrq- LinkChg-
			Control: AttnInd Unknown, PwrInd Unknown, Power- Interlock-
		SltSta:	Status: AttnBtn- PowerFlt- MRL- CmdCplt- PresDet- Interlock-
			Changed: MRL- PresDet- LinkState-
		RootCtl: ErrCorrectable- ErrNon-Fatal- ErrFatal- PMEIntEna+ CRSVisible-
		RootCap: CRSVisible-
		RootSta: PME ReqID 0000, PMEStatus- PMEPending-
		DevCap2: Completion Timeout: Range ABC, TimeoutDis+, LTR+, OBFF Not Supported ARIFwd+
		DevCtl2: Completion Timeout: 50us to 50ms, TimeoutDis+, LTR+, OBFF Disabled ARIFwd-
		LnkCtl2: Target Link Speed: 2.5GT/s, EnterCompliance- SpeedDis-
			 Transmit Margin: Normal Operating Range, EnterModifiedCompliance- ComplianceSOS-
			 Compliance De-emphasis: -6dB
		LnkSta2: Current De-emphasis Level: -3.5dB, EqualizationComplete-, EqualizationPhase1-
			 EqualizationPhase2-, EqualizationPhase3-, LinkEqualizationRequest-
	Capabilities: [80] MSI: Enable+ Count=1/1 Maskable- 64bit-
		Address: fee00218  Data: 0000
	Capabilities: [90] Subsystem: Hewlett-Packard Company Device [103c:86f0]
	Capabilities: [a0] Power Management version 3
		Flags: PMEClk- DSI- D1- D2- AuxCurrent=0mA PME(D0+,D1-,D2-,D3hot+,D3cold+)
		Status: D0 NoSoftRst- PME-Enable- DSel=0 DScale=0 PME-
	Capabilities: [100 v0] #00
	Capabilities: [140 v1] Access Control Services
		ACSCap:	SrcValid+ TransBlk+ ReqRedir+ CmpltRedir+ UpstreamFwd- EgressCtrl- DirectTrans-
		ACSCtl:	SrcValid- TransBlk- ReqRedir- CmpltRedir- UpstreamFwd- EgressCtrl- DirectTrans-
	Capabilities: [150 v0] #00
	Capabilities: [200 v0] #00
	Kernel driver in use: pcieport

00:13.2 PCI bridge [0604]: Intel Corporation Device [8086:31da] (rev f6) (prog-if 00 [Normal decode])
	Control: I/O+ Mem+ BusMaster+ SpecCycle- MemWINV- VGASnoop- ParErr- Stepping- SERR+ FastB2B- DisINTx+
	Status: Cap+ 66MHz- UDF- FastB2B- ParErr- DEVSEL=fast >TAbort- <TAbort- <MAbort- >SERR- <PERR- INTx-
	Latency: 0, Cache Line Size: 64 bytes
	Bus: primary=00, secondary=02, subordinate=02, sec-latency=0
	Memory behind bridge: a1300000-a13fffff
	Secondary status: 66MHz- FastB2B- ParErr- DEVSEL=fast >TAbort- <TAbort- <MAbort+ <SERR- <PERR-
	BridgeCtl: Parity- SERR+ NoISA- VGA- MAbort- >Reset- FastB2B-
		PriDiscTmr- SecDiscTmr- DiscTmrStat- DiscTmrSERREn-
	Capabilities: [40] Express (v2) Root Port (Slot+), MSI 00
		DevCap:	MaxPayload 256 bytes, PhantFunc 0, Latency L0s <64ns, L1 <1us
			ExtTag- RBE+ FLReset-
		DevCtl:	Report errors: Correctable- Non-Fatal- Fatal- Unsupported-
			RlxdOrd- ExtTag- PhantFunc- AuxPwr- NoSnoop-
			MaxPayload 256 bytes, MaxReadReq 128 bytes
		DevSta:	CorrErr- UncorrErr- FatalErr- UnsuppReq- AuxPwr+ TransPend-
		LnkCap:	Port #5, Speed 5GT/s, Width x1, ASPM not supported, Latency L0 <1us, L1 <4us
			ClockPM- Surprise- LLActRep+ BwNot+
		LnkCtl:	ASPM Disabled; RCB 64 bytes Disabled- Retrain- CommClk+
			ExtSynch- ClockPM- AutWidDis- BWInt- AutBWInt-
		LnkSta:	Speed 5GT/s, Width x1, TrErr- Train- SlotClk+ DLActive+ BWMgmt+ ABWMgmt-
		SltCap:	AttnBtn- PwrCtrl- MRL- AttnInd- PwrInd- HotPlug- Surprise-
			Slot #4, PowerLimit 10.000W; Interlock- NoCompl+
		SltCtl:	Enable: AttnBtn- PwrFlt- MRL- PresDet- CmdCplt- HPIrq- LinkChg-
			Control: AttnInd Unknown, PwrInd Unknown, Power- Interlock-
		SltSta:	Status: AttnBtn- PowerFlt- MRL- CmdCplt- PresDet+ Interlock-
			Changed: MRL- PresDet- LinkState+
		RootCtl: ErrCorrectable- ErrNon-Fatal- ErrFatal- PMEIntEna+ CRSVisible-
		RootCap: CRSVisible-
		RootSta: PME ReqID 0000, PMEStatus- PMEPending-
		DevCap2: Completion Timeout: Range ABC, TimeoutDis+, LTR+, OBFF Not Supported ARIFwd+
		DevCtl2: Completion Timeout: 50us to 50ms, TimeoutDis+, LTR+, OBFF Disabled ARIFwd-
		LnkCtl2: Target Link Speed: 5GT/s, EnterCompliance- SpeedDis-
			 Transmit Margin: Normal Operating Range, EnterModifiedCompliance- ComplianceSOS-
			 Compliance De-emphasis: -6dB
		LnkSta2: Current De-emphasis Level: -3.5dB, EqualizationComplete-, EqualizationPhase1-
			 EqualizationPhase2-, EqualizationPhase3-, LinkEqualizationRequest-
	Capabilities: [80] MSI: Enable+ Count=1/1 Maskable- 64bit-
		Address: fee00238  Data: 0000
	Capabilities: [90] Subsystem: Hewlett-Packard Company Device [103c:86f0]
	Capabilities: [a0] Power Management version 3
		Flags: PMEClk- DSI- D1- D2- AuxCurrent=0mA PME(D0+,D1-,D2-,D3hot+,D3cold+)
		Status: D0 NoSoftRst- PME-Enable- DSel=0 DScale=0 PME-
	Capabilities: [100 v0] #00
	Capabilities: [140 v1] Access Control Services
		ACSCap:	SrcValid+ TransBlk+ ReqRedir+ CmpltRedir+ UpstreamFwd- EgressCtrl- DirectTrans-
		ACSCtl:	SrcValid- TransBlk- ReqRedir- CmpltRedir- UpstreamFwd- EgressCtrl- DirectTrans-
	Capabilities: [150 v0] #00
	Capabilities: [200 v0] #00
	Kernel driver in use: pcieport

00:13.3 PCI bridge [0604]: Intel Corporation Device [8086:31db] (rev f6) (prog-if 00 [Normal decode])
	Control: I/O+ Mem+ BusMaster+ SpecCycle- MemWINV- VGASnoop- ParErr- Stepping- SERR+ FastB2B- DisINTx+
	Status: Cap+ 66MHz- UDF- FastB2B- ParErr- DEVSEL=fast >TAbort- <TAbort- <MAbort- >SERR- <PERR- INTx-
	Latency: 0, Cache Line Size: 64 bytes
	Bus: primary=00, secondary=03, subordinate=03, sec-latency=0
	Secondary status: 66MHz- FastB2B- ParErr- DEVSEL=fast >TAbort- <TAbort- <MAbort- <SERR- <PERR-
	BridgeCtl: Parity- SERR+ NoISA- VGA- MAbort- >Reset- FastB2B-
		PriDiscTmr- SecDiscTmr- DiscTmrStat- DiscTmrSERREn-
	Capabilities: [40] Express (v2) Root Port (Slot-), MSI 00
		DevCap:	MaxPayload 256 bytes, PhantFunc 0, Latency L0s <64ns, L1 <1us
			ExtTag- RBE+ FLReset-
		DevCtl:	Report errors: Correctable- Non-Fatal- Fatal- Unsupported-
			RlxdOrd- ExtTag- PhantFunc- AuxPwr- NoSnoop-
			MaxPayload 256 bytes, MaxReadReq 128 bytes
		DevSta:	CorrErr- UncorrErr- FatalErr- UnsuppReq- AuxPwr+ TransPend-
		LnkCap:	Port #6, Speed 5GT/s, Width x1, ASPM not supported, Latency L0 <1us, L1 <4us
			ClockPM- Surprise- LLActRep+ BwNot+
		LnkCtl:	ASPM Disabled; RCB 64 bytes Disabled- Retrain- CommClk-
			ExtSynch- ClockPM- AutWidDis- BWInt- AutBWInt-
		LnkSta:	Speed 2.5GT/s, Width x0, TrErr- Train+ SlotClk+ DLActive- BWMgmt- ABWMgmt-
		RootCtl: ErrCorrectable- ErrNon-Fatal- ErrFatal- PMEIntEna+ CRSVisible-
		RootCap: CRSVisible-
		RootSta: PME ReqID 0000, PMEStatus- PMEPending-
		DevCap2: Completion Timeout: Range ABC, TimeoutDis+, LTR+, OBFF Not Supported ARIFwd+
		DevCtl2: Completion Timeout: 50us to 50ms, TimeoutDis+, LTR+, OBFF Disabled ARIFwd-
		LnkCtl2: Target Link Speed: 2.5GT/s, EnterCompliance- SpeedDis-
			 Transmit Margin: Normal Operating Range, EnterModifiedCompliance- ComplianceSOS-
			 Compliance De-emphasis: -6dB
		LnkSta2: Current De-emphasis Level: -3.5dB, EqualizationComplete-, EqualizationPhase1-
			 EqualizationPhase2-, EqualizationPhase3-, LinkEqualizationRequest-
	Capabilities: [80] MSI: Enable+ Count=1/1 Maskable- 64bit-
		Address: fee00258  Data: 0000
	Capabilities: [90] Subsystem: Hewlett-Packard Company Device [103c:86f0]
	Capabilities: [a0] Power Management version 3
		Flags: PMEClk- DSI- D1- D2- AuxCurrent=0mA PME(D0+,D1-,D2-,D3hot+,D3cold+)
		Status: D3 NoSoftRst- PME-Enable+ DSel=0 DScale=0 PME-
	Capabilities: [100 v0] #00
	Capabilities: [140 v1] Access Control Services
		ACSCap:	SrcValid+ TransBlk+ ReqRedir+ CmpltRedir+ UpstreamFwd- EgressCtrl- DirectTrans-
		ACSCtl:	SrcValid- TransBlk- ReqRedir- CmpltRedir- UpstreamFwd- EgressCtrl- DirectTrans-
	Capabilities: [150 v0] #00
	Capabilities: [200 v0] #00
	Kernel driver in use: pcieport

00:14.0 PCI bridge [0604]: Intel Corporation Device [8086:31d6] (rev f6) (prog-if 00 [Normal decode])
	Control: I/O+ Mem+ BusMaster+ SpecCycle- MemWINV- VGASnoop- ParErr- Stepping- SERR+ FastB2B- DisINTx+
	Status: Cap+ 66MHz- UDF- FastB2B- ParErr- DEVSEL=fast >TAbort- <TAbort- <MAbort- >SERR- <PERR- INTx-
	Latency: 0, Cache Line Size: 64 bytes
	Bus: primary=00, secondary=04, subordinate=04, sec-latency=0
	I/O behind bridge: 0000e000-0000efff
	Memory behind bridge: a1200000-a12fffff
	Secondary status: 66MHz- FastB2B- ParErr- DEVSEL=fast >TAbort- <TAbort- <MAbort- <SERR- <PERR-
	BridgeCtl: Parity- SERR+ NoISA- VGA- MAbort- >Reset- FastB2B-
		PriDiscTmr- SecDiscTmr- DiscTmrStat- DiscTmrSERREn-
	Capabilities: [40] Express (v2) Root Port (Slot+), MSI 00
		DevCap:	MaxPayload 256 bytes, PhantFunc 0, Latency L0s <64ns, L1 <1us
			ExtTag- RBE+ FLReset-
		DevCtl:	Report errors: Correctable- Non-Fatal- Fatal- Unsupported-
			RlxdOrd- ExtTag- PhantFunc- AuxPwr- NoSnoop-
			MaxPayload 128 bytes, MaxReadReq 128 bytes
		DevSta:	CorrErr- UncorrErr- FatalErr- UnsuppReq- AuxPwr+ TransPend-
		LnkCap:	Port #1, Speed 5GT/s, Width x1, ASPM not supported, Latency L0 <1us, L1 <4us
			ClockPM- Surprise- LLActRep+ BwNot+
		LnkCtl:	ASPM Disabled; RCB 64 bytes Disabled- Retrain- CommClk+
			ExtSynch- ClockPM- AutWidDis- BWInt- AutBWInt-
		LnkSta:	Speed 2.5GT/s, Width x1, TrErr- Train- SlotClk+ DLActive+ BWMgmt+ ABWMgmt-
		SltCap:	AttnBtn- PwrCtrl- MRL- AttnInd- PwrInd- HotPlug- Surprise-
			Slot #0, PowerLimit 10.000W; Interlock- NoCompl+
		SltCtl:	Enable: AttnBtn- PwrFlt- MRL- PresDet- CmdCplt- HPIrq- LinkChg-
			Control: AttnInd Unknown, PwrInd Unknown, Power- Interlock-
		SltSta:	Status: AttnBtn- PowerFlt- MRL- CmdCplt- PresDet+ Interlock-
			Changed: MRL- PresDet- LinkState+
		RootCtl: ErrCorrectable- ErrNon-Fatal- ErrFatal- PMEIntEna+ CRSVisible-
		RootCap: CRSVisible-
		RootSta: PME ReqID 0000, PMEStatus- PMEPending-
		DevCap2: Completion Timeout: Range ABC, TimeoutDis+, LTR+, OBFF Not Supported ARIFwd+
		DevCtl2: Completion Timeout: 50us to 50ms, TimeoutDis+, LTR+, OBFF Disabled ARIFwd-
		LnkCtl2: Target Link Speed: 5GT/s, EnterCompliance- SpeedDis-
			 Transmit Margin: Normal Operating Range, EnterModifiedCompliance- ComplianceSOS-
			 Compliance De-emphasis: -6dB
		LnkSta2: Current De-emphasis Level: -3.5dB, EqualizationComplete-, EqualizationPhase1-
			 EqualizationPhase2-, EqualizationPhase3-, LinkEqualizationRequest-
	Capabilities: [80] MSI: Enable+ Count=1/1 Maskable- 64bit-
		Address: fee00298  Data: 0000
	Capabilities: [90] Subsystem: Hewlett-Packard Company Device [103c:86f0]
	Capabilities: [a0] Power Management version 3
		Flags: PMEClk- DSI- D1- D2- AuxCurrent=0mA PME(D0+,D1-,D2-,D3hot+,D3cold+)
		Status: D0 NoSoftRst- PME-Enable- DSel=0 DScale=0 PME-
	Capabilities: [100 v0] #00
	Capabilities: [140 v1] Access Control Services
		ACSCap:	SrcValid+ TransBlk+ ReqRedir+ CmpltRedir+ UpstreamFwd- EgressCtrl- DirectTrans-
		ACSCtl:	SrcValid- TransBlk- ReqRedir- CmpltRedir- UpstreamFwd- EgressCtrl- DirectTrans-
	Capabilities: [150 v0] #00
	Capabilities: [200 v0] #00
	Kernel driver in use: pcieport

00:14.1 PCI bridge [0604]: Intel Corporation Device [8086:31d7] (rev f6) (prog-if 00 [Normal decode])
	Control: I/O+ Mem+ BusMaster+ SpecCycle- MemWINV- VGASnoop- ParErr- Stepping- SERR+ FastB2B- DisINTx+
	Status: Cap+ 66MHz- UDF- FastB2B- ParErr- DEVSEL=fast >TAbort- <TAbort- <MAbort- >SERR- <PERR- INTx-
	Latency: 0, Cache Line Size: 64 bytes
	Bus: primary=00, secondary=05, subordinate=05, sec-latency=0
	I/O behind bridge: 0000d000-0000dfff
	Memory behind bridge: a1100000-a11fffff
	Secondary status: 66MHz- FastB2B- ParErr- DEVSEL=fast >TAbort- <TAbort- <MAbort- <SERR- <PERR-
	BridgeCtl: Parity- SERR+ NoISA- VGA- MAbort- >Reset- FastB2B-
		PriDiscTmr- SecDiscTmr- DiscTmrStat- DiscTmrSERREn-
	Capabilities: [40] Express (v2) Root Port (Slot+), MSI 00
		DevCap:	MaxPayload 256 bytes, PhantFunc 0, Latency L0s <64ns, L1 <1us
			ExtTag- RBE+ FLReset-
		DevCtl:	Report errors: Correctable- Non-Fatal- Fatal- Unsupported-
			RlxdOrd- ExtTag- PhantFunc- AuxPwr- NoSnoop-
			MaxPayload 128 bytes, MaxReadReq 128 bytes
		DevSta:	CorrErr- UncorrErr- FatalErr- UnsuppReq- AuxPwr+ TransPend-
		LnkCap:	Port #2, Speed 5GT/s, Width x1, ASPM L1, Latency L0 <1us, L1 <4us
			ClockPM- Surprise- LLActRep+ BwNot+
		LnkCtl:	ASPM L1 Enabled; RCB 64 bytes Disabled- Retrain- CommClk+
			ExtSynch- ClockPM- AutWidDis- BWInt- AutBWInt-
		LnkSta:	Speed 2.5GT/s, Width x1, TrErr- Train- SlotClk+ DLActive+ BWMgmt+ ABWMgmt-
		SltCap:	AttnBtn- PwrCtrl- MRL- AttnInd- PwrInd- HotPlug- Surprise-
			Slot #1, PowerLimit 10.000W; Interlock- NoCompl+
		SltCtl:	Enable: AttnBtn- PwrFlt- MRL- PresDet- CmdCplt- HPIrq- LinkChg-
			Control: AttnInd Unknown, PwrInd Unknown, Power- Interlock-
		SltSta:	Status: AttnBtn- PowerFlt- MRL- CmdCplt- PresDet+ Interlock-
			Changed: MRL- PresDet- LinkState+
		RootCtl: ErrCorrectable- ErrNon-Fatal- ErrFatal- PMEIntEna+ CRSVisible-
		RootCap: CRSVisible-
		RootSta: PME ReqID 0000, PMEStatus- PMEPending-
		DevCap2: Completion Timeout: Range ABC, TimeoutDis+, LTR+, OBFF Not Supported ARIFwd+
		DevCtl2: Completion Timeout: 50us to 50ms, TimeoutDis+, LTR+, OBFF Disabled ARIFwd-
		LnkCtl2: Target Link Speed: 5GT/s, EnterCompliance- SpeedDis-
			 Transmit Margin: Normal Operating Range, EnterModifiedCompliance- ComplianceSOS-
			 Compliance De-emphasis: -6dB
		LnkSta2: Current De-emphasis Level: -3.5dB, EqualizationComplete-, EqualizationPhase1-
			 EqualizationPhase2-, EqualizationPhase3-, LinkEqualizationRequest-
	Capabilities: [80] MSI: Enable+ Count=1/1 Maskable- 64bit-
		Address: fee002b8  Data: 0000
	Capabilities: [90] Subsystem: Hewlett-Packard Company Device [103c:86f0]
	Capabilities: [a0] Power Management version 3
		Flags: PMEClk- DSI- D1- D2- AuxCurrent=0mA PME(D0+,D1-,D2-,D3hot+,D3cold+)
		Status: D0 NoSoftRst- PME-Enable- DSel=0 DScale=0 PME-
	Capabilities: [100 v0] #00
	Capabilities: [140 v1] Access Control Services
		ACSCap:	SrcValid+ TransBlk+ ReqRedir+ CmpltRedir+ UpstreamFwd- EgressCtrl- DirectTrans-
		ACSCtl:	SrcValid- TransBlk- ReqRedir- CmpltRedir- UpstreamFwd- EgressCtrl- DirectTrans-
	Capabilities: [150 v0] #00
	Capabilities: [200 v0] #00
	Kernel driver in use: pcieport

00:15.0 USB controller [0c03]: Intel Corporation Device [8086:31a8] (rev 06) (prog-if 30 [XHCI])
	Subsystem: Hewlett-Packard Company Device [103c:86f0]
	Control: I/O- Mem+ BusMaster+ SpecCycle- MemWINV- VGASnoop- ParErr- Stepping- SERR+ FastB2B- DisINTx+
	Status: Cap+ 66MHz- UDF- FastB2B+ ParErr- DEVSEL=medium >TAbort- <TAbort- <MAbort- >SERR- <PERR- INTx-
	Latency: 0
	Interrupt: pin A routed to IRQ 128
	Region 0: Memory at a1400000 (64-bit, non-prefetchable) [size=64K]
	Capabilities: [70] Power Management version 2
		Flags: PMEClk- DSI- D1- D2- AuxCurrent=375mA PME(D0-,D1-,D2-,D3hot+,D3cold+)
		Status: D0 NoSoftRst+ PME-Enable- DSel=0 DScale=0 PME-
	Capabilities: [80] MSI: Enable+ Count=1/8 Maskable- 64bit+
		Address: 00000000fee00338  Data: 0000
	Capabilities: [90] Vendor Specific Information: Len=14 <?>
	Kernel driver in use: xhci_hcd

00:1f.0 ISA bridge [0601]: Intel Corporation Device [8086:31e8] (rev 06)
	Subsystem: Hewlett-Packard Company Device [103c:86f0]
	Control: I/O+ Mem+ BusMaster+ SpecCycle- MemWINV- VGASnoop- ParErr- Stepping- SERR+ FastB2B- DisINTx-
	Status: Cap- 66MHz- UDF- FastB2B- ParErr- DEVSEL=medium >TAbort- <TAbort- <MAbort- >SERR- <PERR- INTx-
	Latency: 0

00:1f.1 SMBus [0c05]: Intel Corporation Device [8086:31d4] (rev 06)
	Subsystem: Hewlett-Packard Company Device [103c:86f0]
	Control: I/O+ Mem+ BusMaster- SpecCycle- MemWINV- VGASnoop- ParErr- Stepping- SERR+ FastB2B- DisINTx-
	Status: Cap- 66MHz- UDF- FastB2B+ ParErr- DEVSEL=medium >TAbort- <TAbort- <MAbort- >SERR- <PERR- INTx-
	Interrupt: pin A routed to IRQ 20
	Region 0: Memory at a1416000 (64-bit, non-prefetchable) [size=256]
	Region 4: I/O ports at f040 [size=32]
	Kernel driver in use: i801_smbus
	Kernel modules: i2c_i801

02:00.0 Non-Volatile memory controller [0108]: Sandisk Corp Device [15b7:5009] (rev 01) (prog-if 02 [NVM Express])
	Subsystem: Sandisk Corp Device [15b7:5009]
	Control: I/O+ Mem+ BusMaster+ SpecCycle- MemWINV- VGASnoop- ParErr- Stepping- SERR+ FastB2B- DisINTx+
	Status: Cap+ 66MHz- UDF- FastB2B- ParErr- DEVSEL=fast >TAbort- <TAbort- <MAbort- >SERR- <PERR- INTx-
	Latency: 0, Cache Line Size: 64 bytes
	Interrupt: pin A routed to IRQ 20
	Region 0: Memory at a1300000 (64-bit, non-prefetchable) [size=16K]
	Region 4: Memory at a1304000 (64-bit, non-prefetchable) [size=256]
	Capabilities: [80] Power Management version 3
		Flags: PMEClk- DSI- D1- D2- AuxCurrent=0mA PME(D0-,D1-,D2-,D3hot-,D3cold-)
		Status: D0 NoSoftRst+ PME-Enable- DSel=0 DScale=0 PME-
	Capabilities: [90] MSI: Enable- Count=1/32 Maskable- 64bit+
		Address: 0000000000000000  Data: 0000
	Capabilities: [b0] MSI-X: Enable+ Count=17 Masked-
		Vector table: BAR=0 offset=00002000
		PBA: BAR=4 offset=00000000
	Capabilities: [c0] Express (v2) Endpoint, MSI 00
		DevCap:	MaxPayload 512 bytes, PhantFunc 0, Latency L0s <1us, L1 unlimited
			ExtTag- AttnBtn- AttnInd- PwrInd- RBE+ FLReset+
		DevCtl:	Report errors: Correctable+ Non-Fatal+ Fatal+ Unsupported+
			RlxdOrd+ ExtTag- PhantFunc- AuxPwr- NoSnoop+ FLReset-
			MaxPayload 256 bytes, MaxReadReq 512 bytes
		DevSta:	CorrErr- UncorrErr- FatalErr- UnsuppReq- AuxPwr- TransPend-
		LnkCap:	Port #0, Speed 8GT/s, Width x4, ASPM L1, Latency L0 <256ns, L1 <8us
			ClockPM+ Surprise- LLActRep- BwNot-
		LnkCtl:	ASPM Disabled; RCB 64 bytes Disabled- Retrain- CommClk+
			ExtSynch- ClockPM+ AutWidDis- BWInt- AutBWInt-
		LnkSta:	Speed 5GT/s, Width x1, TrErr- Train- SlotClk+ DLActive- BWMgmt- ABWMgmt-
		DevCap2: Completion Timeout: Range B, TimeoutDis+, LTR+, OBFF Not Supported
		DevCtl2: Completion Timeout: 50us to 50ms, TimeoutDis-, LTR+, OBFF Disabled
		LnkCtl2: Target Link Speed: 8GT/s, EnterCompliance- SpeedDis-
			 Transmit Margin: Normal Operating Range, EnterModifiedCompliance- ComplianceSOS-
			 Compliance De-emphasis: -6dB
		LnkSta2: Current De-emphasis Level: -3.5dB, EqualizationComplete-, EqualizationPhase1-
			 EqualizationPhase2-, EqualizationPhase3-, LinkEqualizationRequest-
	Capabilities: [100 v2] Advanced Error Reporting
		UESta:	DLP- SDES- TLP- FCP- CmpltTO- CmpltAbrt- UnxCmplt- RxOF- MalfTLP- ECRC- UnsupReq- ACSViol-
		UEMsk:	DLP- SDES- TLP- FCP- CmpltTO- CmpltAbrt- UnxCmplt- RxOF- MalfTLP- ECRC- UnsupReq- ACSViol-
		UESvrt:	DLP+ SDES+ TLP- FCP+ CmpltTO- CmpltAbrt- UnxCmplt- RxOF+ MalfTLP+ ECRC- UnsupReq- ACSViol-
		CESta:	RxErr- BadTLP- BadDLLP- Rollover- Timeout- NonFatalErr-
		CEMsk:	RxErr- BadTLP- BadDLLP- Rollover- Timeout- NonFatalErr+
		AERCap:	First Error Pointer: 00, GenCap+ CGenEn- ChkCap+ ChkEn-
	Capabilities: [150 v1] Device Serial Number ...
	Capabilities: [1b8 v1] Latency Tolerance Reporting
		Max snoop latency: 3145728ns
		Max no snoop latency: 3145728ns
	Capabilities: [300 v1] #19
	Capabilities: [900 v1] L1 PM Substates
		L1SubCap: PCI-PM_L1.2+ PCI-PM_L1.1- ASPM_L1.2+ ASPM_L1.1- L1_PM_Substates+
			  PortCommonModeRestoreTime=32us PortTPowerOnTime=10us
	Kernel driver in use: nvme
	Kernel modules: nvme

04:00.0 Network controller [0280]: Realtek Semiconductor Co., Ltd. RTL8821CE 802.11ac PCIe Wireless Network Adapter [10ec:c821]
	Subsystem: Hewlett-Packard Company Device [103c:831a]
	Control: I/O- Mem- BusMaster- SpecCycle- MemWINV- VGASnoop- ParErr- Stepping- SERR+ FastB2B- DisINTx-
	Status: Cap+ 66MHz- UDF- FastB2B- ParErr- DEVSEL=fast >TAbort- <TAbort- <MAbort- >SERR- <PERR- INTx-
	Interrupt: pin A routed to IRQ 10
	Region 0: I/O ports at e000 [disabled] [size=256]
	Region 2: Memory at a1200000 (64-bit, non-prefetchable) [disabled] [size=64K]
	Capabilities: [40] Power Management version 3
		Flags: PMEClk- DSI- D1+ D2+ AuxCurrent=375mA PME(D0+,D1+,D2+,D3hot+,D3cold+)
		Status: D0 NoSoftRst+ PME-Enable- DSel=0 DScale=0 PME-
	Capabilities: [50] MSI: Enable- Count=1/1 Maskable- 64bit+
		Address: 0000000000000000  Data: 0000
	Capabilities: [70] Express (v2) Endpoint, MSI 00
		DevCap:	MaxPayload 128 bytes, PhantFunc 0, Latency L0s <4us, L1 <64us
			ExtTag- AttnBtn- AttnInd- PwrInd- RBE+ FLReset-
		DevCtl:	Report errors: Correctable- Non-Fatal- Fatal- Unsupported-
			RlxdOrd+ ExtTag- PhantFunc- AuxPwr- NoSnoop-
			MaxPayload 128 bytes, MaxReadReq 512 bytes
		DevSta:	CorrErr- UncorrErr- FatalErr- UnsuppReq- AuxPwr+ TransPend-
		LnkCap:	Port #0, Speed 2.5GT/s, Width x1, ASPM L0s L1, Latency L0 <2us, L1 <64us
			ClockPM+ Surprise- LLActRep- BwNot-
		LnkCtl:	ASPM Disabled; RCB 64 bytes Disabled- Retrain- CommClk+
			ExtSynch- ClockPM+ AutWidDis- BWInt- AutBWInt-
		LnkSta:	Speed 2.5GT/s, Width x1, TrErr- Train- SlotClk+ DLActive- BWMgmt- ABWMgmt-
		DevCap2: Completion Timeout: Not Supported, TimeoutDis+, LTR+, OBFF Via message/WAKE#
		DevCtl2: Completion Timeout: 50us to 50ms, TimeoutDis-, LTR+, OBFF Disabled
		LnkCtl2: Target Link Speed: 5GT/s, EnterCompliance- SpeedDis-
			 Transmit Margin: Normal Operating Range, EnterModifiedCompliance- ComplianceSOS-
			 Compliance De-emphasis: -6dB
		LnkSta2: Current De-emphasis Level: -3.5dB, EqualizationComplete-, EqualizationPhase1-
			 EqualizationPhase2-, EqualizationPhase3-, LinkEqualizationRequest-
	Capabilities: [100 v2] Advanced Error Reporting
		UESta:	DLP- SDES- TLP- FCP- CmpltTO- CmpltAbrt- UnxCmplt- RxOF- MalfTLP- ECRC- UnsupReq- ACSViol-
		UEMsk:	DLP- SDES- TLP- FCP- CmpltTO- CmpltAbrt- UnxCmplt- RxOF- MalfTLP- ECRC- UnsupReq- ACSViol-
		UESvrt:	DLP+ SDES+ TLP- FCP+ CmpltTO- CmpltAbrt- UnxCmplt- RxOF+ MalfTLP+ ECRC- UnsupReq- ACSViol-
		CESta:	RxErr- BadTLP- BadDLLP- Rollover- Timeout- NonFatalErr-
		CEMsk:	RxErr- BadTLP- BadDLLP- Rollover- Timeout- NonFatalErr+
		AERCap:	First Error Pointer: 00, GenCap+ CGenEn- ChkCap+ ChkEn-
	Capabilities: [148 v1] Device Serial Number ...
	Capabilities: [158 v1] Latency Tolerance Reporting
		Max snoop latency: 3145728ns
		Max no snoop latency: 3145728ns
	Capabilities: [160 v1] L1 PM Substates
		L1SubCap: PCI-PM_L1.2- PCI-PM_L1.1- ASPM_L1.2- ASPM_L1.1- L1_PM_Substates-
	Capabilities: [170 v1] #1f
	Capabilities: [17c v1] Vendor Specific Information: ID=0003 Rev=1 Len=054 <?>

05:00.0 Ethernet controller [0200]: Realtek Semiconductor Co., Ltd. RTL8111/8168/8411 PCI Express Gigabit Ethernet Controller [10ec:8168] (rev 15)
	Subsystem: Hewlett-Packard Company Device [103c:86f0]
	Control: I/O+ Mem+ BusMaster+ SpecCycle- MemWINV- VGASnoop- ParErr- Stepping- SERR+ FastB2B- DisINTx+
	Status: Cap+ 66MHz- UDF- FastB2B- ParErr- DEVSEL=fast >TAbort- <TAbort- <MAbort- >SERR- <PERR- INTx-
	Latency: 0, Cache Line Size: 64 bytes
	Interrupt: pin A routed to IRQ 23
	Region 0: I/O ports at d000 [size=256]
	Region 2: Memory at a1104000 (64-bit, non-prefetchable) [size=4K]
	Region 4: Memory at a1100000 (64-bit, non-prefetchable) [size=16K]
	Capabilities: [40] Power Management version 3
		Flags: PMEClk- DSI- D1+ D2+ AuxCurrent=375mA PME(D0+,D1+,D2+,D3hot+,D3cold+)
		Status: D0 NoSoftRst+ PME-Enable- DSel=0 DScale=0 PME-
	Capabilities: [50] MSI: Enable- Count=1/1 Maskable- 64bit+
		Address: 0000000000000000  Data: 0000
	Capabilities: [70] Express (v2) Endpoint, MSI 01
		DevCap:	MaxPayload 128 bytes, PhantFunc 0, Latency L0s <512ns, L1 <64us
			ExtTag- AttnBtn- AttnInd- PwrInd- RBE+ FLReset-
		DevCtl:	Report errors: Correctable- Non-Fatal- Fatal- Unsupported-
			RlxdOrd+ ExtTag- PhantFunc- AuxPwr- NoSnoop-
			MaxPayload 128 bytes, MaxReadReq 4096 bytes
		DevSta:	CorrErr- UncorrErr- FatalErr- UnsuppReq- AuxPwr+ TransPend-
		LnkCap:	Port #0, Speed 2.5GT/s, Width x1, ASPM L0s L1, Latency L0 unlimited, L1 <64us
			ClockPM+ Surprise- LLActRep- BwNot-
		LnkCtl:	ASPM L1 Enabled; RCB 64 bytes Disabled- Retrain- CommClk+
			ExtSynch- ClockPM+ AutWidDis- BWInt- AutBWInt-
		LnkSta:	Speed 2.5GT/s, Width x1, TrErr- Train- SlotClk+ DLActive- BWMgmt- ABWMgmt-
		DevCap2: Completion Timeout: Range ABCD, TimeoutDis+, LTR+, OBFF Via message/WAKE#
		DevCtl2: Completion Timeout: 50us to 50ms, TimeoutDis-, LTR+, OBFF Disabled
		LnkCtl2: Target Link Speed: 2.5GT/s, EnterCompliance- SpeedDis-
			 Transmit Margin: Normal Operating Range, EnterModifiedCompliance- ComplianceSOS-
			 Compliance De-emphasis: -6dB
		LnkSta2: Current De-emphasis Level: -6dB, EqualizationComplete-, EqualizationPhase1-
			 EqualizationPhase2-, EqualizationPhase3-, LinkEqualizationRequest-
	Capabilities: [b0] MSI-X: Enable+ Count=4 Masked-
		Vector table: BAR=4 offset=00000000
		PBA: BAR=4 offset=00000800
	Capabilities: [100 v2] Advanced Error Reporting
		UESta:	DLP- SDES- TLP- FCP- CmpltTO- CmpltAbrt- UnxCmplt- RxOF- MalfTLP- ECRC- UnsupReq- ACSViol-
		UEMsk:	DLP- SDES- TLP- FCP- CmpltTO- CmpltAbrt- UnxCmplt- RxOF- MalfTLP- ECRC- UnsupReq- ACSViol-
		UESvrt:	DLP+ SDES+ TLP- FCP+ CmpltTO- CmpltAbrt- UnxCmplt- RxOF+ MalfTLP+ ECRC- UnsupReq- ACSViol-
		CESta:	RxErr- BadTLP- BadDLLP- Rollover- Timeout- NonFatalErr-
		CEMsk:	RxErr- BadTLP- BadDLLP- Rollover- Timeout- NonFatalErr+
		AERCap:	First Error Pointer: 00, GenCap+ CGenEn- ChkCap+ ChkEn-
	Capabilities: [140 v1] Virtual Channel
		Caps:	LPEVC=0 RefClk=100ns PATEntryBits=1
		Arb:	Fixed- WRR32- WRR64- WRR128-
		Ctrl:	ArbSelect=Fixed
		Status:	InProgress-
		VC0:	Caps:	PATOffset=00 MaxTimeSlots=1 RejSnoopTrans-
			Arb:	Fixed- WRR32- WRR64- WRR128- TWRR128- WRR256-
			Ctrl:	Enable+ ID=0 ArbSelect=Fixed TC/VC=ff
			Status:	NegoPending- InProgress-
	Capabilities: [160 v1] Device Serial Number ...
	Capabilities: [170 v1] Latency Tolerance Reporting
		Max snoop latency: 3145728ns
		Max no snoop latency: 3145728ns
	Capabilities: [178 v1] L1 PM Substates
		L1SubCap: PCI-PM_L1.2+ PCI-PM_L1.1+ ASPM_L1.2+ ASPM_L1.1+ L1_PM_Substates+
			  PortCommonModeRestoreTime=150us PortTPowerOnTime=150us
	Kernel driver in use: r8169
	Kernel modules: r8169

