00:00.0 Host bridge [0600]: Silicon Integrated Systems [SiS] 661FX/M661FX/M661MX Host [1039:0661] (rev 11)
	Subsystem: ASUSTeK Computer Inc. 661FX/M661FX/M661MX Host [1043:1197]
	Control: I/O+ Mem+ BusMaster+ SpecCycle- MemWINV- VGASnoop- ParErr- Stepping- SERR- FastB2B- DisINTx-
	Status: Cap+ 66MHz- UDF- FastB2B- ParErr- DEVSEL=medium >TAbort- <TAbort- <MAbort+ >SERR- <PERR- INTx-
	Latency: 32
	Region 0: Memory at e0000000 (32-bit, non-prefetchable) [size=64M]
	Capabilities: [c0] AGP version 3.5
		Status: RQ=32 Iso- ArqSz=2 Cal=3 SBA+ ITACoh- GART64- HTrans- 64bit- FW- AGP3+ Rate=x4,x8
		Command: RQ=1 ArqSz=0 Cal=0 SBA- AGP- GART64- 64bit- FW- Rate=<none>
	Kernel driver in use: agpgart-sis
	Kernel modules: sis_agp

00:01.0 PCI bridge [0604]: Silicon Integrated Systems [SiS] AGP Port (virtual PCI-to-PCI bridge) [1039:0003] (prog-if 00 [Normal decode])
	Control: I/O+ Mem+ BusMaster+ SpecCycle- MemWINV- VGASnoop- ParErr- Stepping- SERR+ FastB2B- DisINTx-
	Status: Cap- 66MHz+ UDF- FastB2B- ParErr- DEVSEL=fast >TAbort- <TAbort- <MAbort- >SERR- <PERR- INTx-
	Latency: 64
	Bus: primary=00, secondary=01, subordinate=01, sec-latency=64
	I/O behind bridge: 0000b000-0000bfff
	Memory behind bridge: df600000-df6fffff
	Prefetchable memory behind bridge: cd500000-dd4fffff
	Secondary status: 66MHz+ FastB2B- ParErr- DEVSEL=fast >TAbort- <TAbort- <MAbort+ <SERR- <PERR-
	BridgeCtl: Parity- SERR+ NoISA- VGA+ MAbort- >Reset- FastB2B-
		PriDiscTmr- SecDiscTmr- DiscTmrStat- DiscTmrSERREn-
	Kernel modules: shpchp

00:02.0 ISA bridge [0601]: Silicon Integrated Systems [SiS] SiS964 [MuTIOL Media IO] LPC Controller [1039:0964] (rev 36)
	Control: I/O+ Mem+ BusMaster+ SpecCycle+ MemWINV- VGASnoop- ParErr- Stepping- SERR- FastB2B- DisINTx-
	Status: Cap- 66MHz- UDF- FastB2B- ParErr- DEVSEL=medium >TAbort- <TAbort- <MAbort- >SERR- <PERR- INTx-
	Latency: 0
	Kernel modules: i2c_sis630

00:02.5 IDE interface [0101]: Silicon Integrated Systems [SiS] 5513 IDE Controller [1039:5513] (rev 01) (prog-if 80 [ISA Compatibility mode-only controller, supports bus mastering])
	Subsystem: ASUSTeK Computer Inc. 5513 IDE Controller [1043:1197]
	Control: I/O+ Mem- BusMaster+ SpecCycle- MemWINV- VGASnoop- ParErr- Stepping- SERR- FastB2B- DisINTx-
	Status: Cap+ 66MHz- UDF- FastB2B- ParErr- DEVSEL=medium >TAbort- <TAbort- <MAbort- >SERR- <PERR- INTx-
	Latency: 128
	Region 0: I/O ports at 01f0 [size=8]
	Region 1: I/O ports at 03f4
	Region 2: I/O ports at 0170 [size=8]
	Region 3: I/O ports at 0374
	Region 4: I/O ports at ffa0 [size=16]
	Capabilities: [58] Power Management version 2
		Flags: PMEClk- DSI- D1- D2- AuxCurrent=0mA PME(D0-,D1-,D2-,D3hot-,D3cold+)
		Status: D0 NoSoftRst- PME-Enable- DSel=0 DScale=0 PME-
	Kernel driver in use: pata_sis
	Kernel modules: pata_acpi

00:02.6 Modem [0703]: Silicon Integrated Systems [SiS] AC'97 Modem Controller [1039:7013] (rev a0) (prog-if 00 [Generic])
	Subsystem: ASUSTeK Computer Inc. AC'97 Modem Controller [1043:1816]
	Control: I/O+ Mem- BusMaster- SpecCycle- MemWINV- VGASnoop- ParErr- Stepping- SERR+ FastB2B- DisINTx-
	Status: Cap+ 66MHz- UDF- FastB2B+ ParErr- DEVSEL=medium >TAbort- <TAbort- <MAbort- >SERR- <PERR- INTx-
	Interrupt: pin C routed to IRQ 18
	Region 0: I/O ports at e400 [size=256]
	Region 1: I/O ports at e000 [size=128]
	Capabilities: [48] Power Management version 2
		Flags: PMEClk- DSI- D1- D2- AuxCurrent=55mA PME(D0-,D1-,D2-,D3hot+,D3cold+)
		Status: D0 NoSoftRst- PME-Enable- DSel=0 DScale=0 PME-
	Kernel modules: snd_intel8x0m

00:02.7 Multimedia audio controller [0401]: Silicon Integrated Systems [SiS] SiS7012 AC'97 Sound Controller [1039:7012] (rev a0)
	Subsystem: ASUSTeK Computer Inc. SiS7012 AC'97 Sound Controller [1043:1193]
	Control: I/O+ Mem- BusMaster+ SpecCycle- MemWINV- VGASnoop- ParErr- Stepping- SERR+ FastB2B- DisINTx-
	Status: Cap+ 66MHz- UDF- FastB2B+ ParErr- DEVSEL=medium >TAbort- <TAbort- <MAbort- >SERR- <PERR- INTx-
	Latency: 64 (13000ns min, 2750ns max)
	Interrupt: pin C routed to IRQ 18
	Region 0: I/O ports at e800 [size=256]
	Region 1: I/O ports at ec00 [size=128]
	Capabilities: [48] Power Management version 2
		Flags: PMEClk- DSI- D1+ D2+ AuxCurrent=55mA PME(D0-,D1-,D2-,D3hot+,D3cold+)
		Status: D0 NoSoftRst- PME-Enable- DSel=0 DScale=0 PME-
	Kernel driver in use: snd_intel8x0
	Kernel modules: snd_intel8x0

00:03.0 USB controller [0c03]: Silicon Integrated Systems [SiS] USB 1.1 Controller [1039:7001] (rev 0f) (prog-if 10 [OHCI])
	Subsystem: ASUSTeK Computer Inc. USB 1.1 Controller [1043:1197]
	Control: I/O+ Mem+ BusMaster+ SpecCycle- MemWINV+ VGASnoop- ParErr- Stepping- SERR+ FastB2B- DisINTx-
	Status: Cap- 66MHz- UDF- FastB2B+ ParErr- DEVSEL=medium >TAbort- <TAbort- <MAbort- >SERR- <PERR- INTx-
	Latency: 64 (20000ns max)
	Interrupt: pin A routed to IRQ 20
	Region 0: Memory at dfffc000 (32-bit, non-prefetchable) [size=4K]
	Kernel driver in use: ohci-pci

00:03.1 USB controller [0c03]: Silicon Integrated Systems [SiS] USB 1.1 Controller [1039:7001] (rev 0f) (prog-if 10 [OHCI])
	Subsystem: ASUSTeK Computer Inc. USB 1.1 Controller [1043:1197]
	Control: I/O+ Mem+ BusMaster+ SpecCycle- MemWINV+ VGASnoop- ParErr- Stepping- SERR+ FastB2B- DisINTx-
	Status: Cap- 66MHz- UDF- FastB2B+ ParErr- DEVSEL=medium >TAbort- <TAbort- <MAbort- >SERR- <PERR- INTx-
	Latency: 64 (20000ns max)
	Interrupt: pin B routed to IRQ 21
	Region 0: Memory at dfffd000 (32-bit, non-prefetchable) [size=4K]
	Kernel driver in use: ohci-pci

00:03.2 USB controller [0c03]: Silicon Integrated Systems [SiS] USB 1.1 Controller [1039:7001] (rev 0f) (prog-if 10 [OHCI])
	Subsystem: ASUSTeK Computer Inc. USB 1.1 Controller [1043:1197]
	Control: I/O+ Mem+ BusMaster+ SpecCycle- MemWINV+ VGASnoop- ParErr- Stepping- SERR+ FastB2B- DisINTx-
	Status: Cap- 66MHz- UDF- FastB2B+ ParErr- DEVSEL=medium >TAbort- <TAbort- <MAbort- >SERR- <PERR- INTx-
	Latency: 64 (20000ns max)
	Interrupt: pin C routed to IRQ 22
	Region 0: Memory at dfffe000 (32-bit, non-prefetchable) [size=4K]
	Kernel driver in use: ohci-pci

00:03.3 USB controller [0c03]: Silicon Integrated Systems [SiS] USB 2.0 Controller [1039:7002] (prog-if 20 [EHCI])
	Subsystem: ASUSTeK Computer Inc. USB 2.0 Controller [1043:1197]
	Control: I/O- Mem+ BusMaster+ SpecCycle- MemWINV- VGASnoop- ParErr- Stepping- SERR+ FastB2B- DisINTx-
	Status: Cap+ 66MHz- UDF- FastB2B+ ParErr- DEVSEL=medium >TAbort- <TAbort- <MAbort- >SERR- <PERR- INTx-
	Latency: 64 (20000ns max)
	Interrupt: pin D routed to IRQ 23
	Region 0: Memory at dffff000 (32-bit, non-prefetchable) [size=4K]
	Capabilities: [50] Power Management version 2
		Flags: PMEClk- DSI- D1- D2- AuxCurrent=375mA PME(D0+,D1-,D2-,D3hot+,D3cold+)
		Status: D0 NoSoftRst- PME-Enable- DSel=0 DScale=0 PME-
	Kernel driver in use: ehci-pci

00:04.0 Ethernet controller [0200]: Silicon Integrated Systems [SiS] SiS900 PCI Fast Ethernet [1039:0900] (rev 90)
	Subsystem: ASUSTeK Computer Inc. SiS900 PCI Fast Ethernet [1043:1455]
	Control: I/O+ Mem+ BusMaster+ SpecCycle- MemWINV- VGASnoop- ParErr- Stepping- SERR+ FastB2B- DisINTx-
	Status: Cap+ 66MHz- UDF- FastB2B+ ParErr- DEVSEL=medium >TAbort- <TAbort- <MAbort- >SERR- <PERR- INTx-
	Latency: 64 (13000ns min, 2750ns max)
	Interrupt: pin A routed to IRQ 19
	Region 0: I/O ports at d800 [size=256]
	Region 1: Memory at dfffb000 (32-bit, non-prefetchable) [size=4K]
	Expansion ROM at dffc0000 [disabled] [size=128K]
	Capabilities: [40] Power Management version 2
		Flags: PMEClk- DSI- D1+ D2+ AuxCurrent=0mA PME(D0+,D1+,D2+,D3hot+,D3cold+)
		Status: D0 NoSoftRst- PME-Enable- DSel=0 DScale=0 PME-
	Kernel driver in use: sis900
	Kernel modules: sis900

00:09.0 CardBus bridge [0607]: Ricoh Co Ltd RL5c476 II [1180:0476] (rev b3)
	Subsystem: ASUSTeK Computer Inc. RL5c476 II [1043:1197]
	Control: I/O+ Mem+ BusMaster+ SpecCycle- MemWINV- VGASnoop- ParErr- Stepping- SERR- FastB2B- DisINTx-
	Status: Cap+ 66MHz- UDF- FastB2B- ParErr- DEVSEL=medium >TAbort- <TAbort- <MAbort- >SERR- <PERR- INTx-
	Latency: 168
	Interrupt: pin A routed to IRQ 17
	Region 0: Memory at 78000000 (32-bit, non-prefetchable) [size=4K]
	Bus: primary=00, secondary=02, subordinate=05, sec-latency=176
	Memory window 0: 7c000000-7fffffff (prefetchable)
	Memory window 1: 80000000-83ffffff
	I/O window 0: 00001000-000010ff
	I/O window 1: 00001400-000014ff
	BridgeCtl: Parity- SERR- ISA- VGA- MAbort- >Reset- 16bInt+ PostWrite+
	16-bit legacy interface ports at 0001
	Capabilities: [dc] Power Management version 2
		Flags: PMEClk+ DSI- D1+ D2+ AuxCurrent=0mA PME(D0+,D1+,D2+,D3hot+,D3cold+)
		Status: D0 NoSoftRst- PME-Enable- DSel=0 DScale=2 PME-
		Bridge: PM- B3+
	Kernel driver in use: yenta_cardbus
	Kernel modules: yenta_socket

00:09.1 FireWire (IEEE 1394) [0c00]: Ricoh Co Ltd R5C552 IEEE 1394 Controller [1180:0552] (rev 08) (prog-if 10 [OHCI])
	Subsystem: ASUSTeK Computer Inc. R5C552 IEEE 1394 Controller [1043:1197]
	Control: I/O- Mem+ BusMaster+ SpecCycle- MemWINV- VGASnoop- ParErr- Stepping- SERR+ FastB2B- DisINTx-
	Status: Cap+ 66MHz- UDF- FastB2B- ParErr- DEVSEL=medium >TAbort- <TAbort- <MAbort- >SERR- <PERR- INTx-
	Latency: 64 (500ns min, 1000ns max)
	Interrupt: pin B routed to IRQ 19
	Region 0: Memory at dfffa000 (32-bit, non-prefetchable) [size=2K]
	Capabilities: [dc] Power Management version 2
		Flags: PMEClk- DSI- D1- D2- AuxCurrent=0mA PME(D0+,D1-,D2-,D3hot+,D3cold+)
		Status: D0 NoSoftRst- PME-Enable- DSel=0 DScale=2 PME+
	Kernel driver in use: firewire_ohci
	Kernel modules: firewire_ohci

00:09.2 SD Host controller [0805]: Ricoh Co Ltd R5C822 SD/SDIO/MMC/MS/MSPro Host Adapter [1180:0822] (rev 17)
	Subsystem: ASUSTeK Computer Inc. R5C822 SD/SDIO/MMC/MS/MSPro Host Adapter [1043:1197]
	Control: I/O- Mem+ BusMaster+ SpecCycle- MemWINV- VGASnoop- ParErr- Stepping- SERR+ FastB2B- DisINTx-
	Status: Cap+ 66MHz- UDF- FastB2B- ParErr- DEVSEL=medium >TAbort- <TAbort- <MAbort- >SERR- <PERR- INTx-
	Latency: 64
	Interrupt: pin C routed to IRQ 18
	Region 0: Memory at dfffa800 (32-bit, non-prefetchable) [size=256]
	Capabilities: [80] Power Management version 2
		Flags: PMEClk- DSI- D1+ D2+ AuxCurrent=0mA PME(D0+,D1+,D2+,D3hot+,D3cold+)
		Status: D0 NoSoftRst- PME-Enable- DSel=0 DScale=2 PME-
	Kernel driver in use: sdhci-pci
	Kernel modules: sdhci_pci

00:09.3 System peripheral [0880]: Ricoh Co Ltd R5C592 Memory Stick Bus Host Adapter [1180:0592] (rev 08)
	Subsystem: ASUSTeK Computer Inc. R5C592 Memory Stick Bus Host Adapter [1043:1197]
	Control: I/O- Mem+ BusMaster- SpecCycle- MemWINV- VGASnoop- ParErr- Stepping- SERR+ FastB2B- DisINTx-
	Status: Cap+ 66MHz- UDF- FastB2B- ParErr- DEVSEL=medium >TAbort- <TAbort- <MAbort- >SERR- <PERR- INTx-
	Interrupt: pin C routed to IRQ 18
	Region 0: Memory at dfffac00 (32-bit, non-prefetchable) [size=256]
	Capabilities: [80] Power Management version 2
		Flags: PMEClk- DSI- D1+ D2+ AuxCurrent=0mA PME(D0+,D1+,D2+,D3hot+,D3cold+)
		Status: D0 NoSoftRst- PME-Enable- DSel=0 DScale=2 PME-
	Kernel driver in use: r592
	Kernel modules: r592

01:00.0 VGA compatible controller [0300]: Silicon Integrated Systems [SiS] 661/741/760 PCI/AGP or 662/761Gx PCIE VGA Display Adapter [1039:6330] (prog-if 00 [VGA controller])
	Subsystem: ASUSTeK Computer Inc. 661/741/760 PCI/AGP or 662/761Gx PCIE VGA Display Adapter [1043:1921]
	Control: I/O+ Mem+ BusMaster- SpecCycle- MemWINV- VGASnoop- ParErr- Stepping- SERR- FastB2B- DisINTx-
	Status: Cap+ 66MHz+ UDF- FastB2B- ParErr- DEVSEL=medium >TAbort- <TAbort- <MAbort- >SERR- <PERR- INTx-
	Interrupt: pin A routed to IRQ 11
	BIST result: 00
	Region 0: Memory at d0000000 (32-bit, prefetchable) [size=128M]
	Region 1: Memory at df6e0000 (32-bit, non-prefetchable) [size=128K]
	Region 2: I/O ports at bc00 [size=128]
	[virtual] Expansion ROM at 000c0000 [disabled] [size=128K]
	Capabilities: [40] Power Management version 2
		Flags: PMEClk- DSI- D1+ D2+ AuxCurrent=0mA PME(D0-,D1-,D2-,D3hot-,D3cold-)
		Status: D0 NoSoftRst- PME-Enable- DSel=0 DScale=0 PME-
	Capabilities: [50] AGP version 3.0
		Status: RQ=256 Iso- ArqSz=0 Cal=0 SBA+ ITACoh- GART64- HTrans- 64bit- FW- AGP3+ Rate=x4,x8
		Command: RQ=1 ArqSz=0 Cal=0 SBA- AGP- GART64- 64bit- FW- Rate=<none>
	Kernel modules: sisfb

