00:00.0 Host bridge [0600]: Intel Corporation Coffee Lake HOST and DRAM Controller [8086:3e34] (rev 0b)
	DeviceName: Onboard - Other
	Subsystem: Acer Incorporated [ALI] Coffee Lake HOST and DRAM Controller [1025:1305]
	Control: I/O- Mem+ BusMaster+ SpecCycle- MemWINV- VGASnoop- ParErr- Stepping- SERR- FastB2B- DisINTx-
	Status: Cap+ 66MHz- UDF- FastB2B+ ParErr- DEVSEL=fast >TAbort- <TAbort- <MAbort- >SERR- <PERR- INTx-
	Latency: 0
	Capabilities: [e0] Vendor Specific Information: Len=10 <?>
	Kernel driver in use: skl_uncore

00:02.0 VGA compatible controller [0300]: Intel Corporation WhiskeyLake-U GT2 [UHD Graphics 620] [8086:3ea0] (prog-if 00 [VGA controller])
	DeviceName: Onboard - Video
	Subsystem: Acer Incorporated [ALI] UHD Graphics 620 (Whiskey Lake) [1025:1305]
	Control: I/O+ Mem+ BusMaster+ SpecCycle- MemWINV- VGASnoop- ParErr- Stepping- SERR- FastB2B- DisINTx+
	Status: Cap+ 66MHz- UDF- FastB2B- ParErr- DEVSEL=fast >TAbort- <TAbort- <MAbort- >SERR- <PERR- INTx-
	Latency: 0, Cache Line Size: 64 bytes
	Interrupt: pin A routed to IRQ 135
	Region 0: Memory at a0000000 (64-bit, non-prefetchable) [size=16M]
	Region 2: Memory at 90000000 (64-bit, prefetchable) [size=256M]
	Region 4: I/O ports at 3000 [size=64]
	Expansion ROM at 000c0000 [virtual] [disabled] [size=128K]
	Capabilities: [40] Vendor Specific Information: Len=0c <?>
	Capabilities: [70] Express (v2) Root Complex Integrated Endpoint, MSI 00
		DevCap:	MaxPayload 128 bytes, PhantFunc 0
			ExtTag- RBE+ FLReset+
		DevCtl:	CorrErr- NonFatalErr- FatalErr- UnsupReq-
			RlxdOrd- ExtTag- PhantFunc- AuxPwr- NoSnoop- FLReset-
			MaxPayload 128 bytes, MaxReadReq 128 bytes
		DevSta:	CorrErr- NonFatalErr- FatalErr- UnsupReq- AuxPwr- TransPend-
		DevCap2: Completion Timeout: Not Supported, TimeoutDis- NROPrPrP- LTR-
			 10BitTagComp- 10BitTagReq- OBFF Not Supported, ExtFmt- EETLPPrefix-
			 EmergencyPowerReduction Not Supported, EmergencyPowerReductionInit-
			 FRS-
			 AtomicOpsCap: 32bit- 64bit- 128bitCAS-
		DevCtl2: Completion Timeout: 50us to 50ms, TimeoutDis- LTR- OBFF Disabled,
			 AtomicOpsCtl: ReqEn-
	Capabilities: [ac] MSI: Enable+ Count=1/1 Maskable- 64bit-
		Address: fee00018  Data: 0000
	Capabilities: [d0] Power Management version 2
		Flags: PMEClk- DSI+ D1- D2- AuxCurrent=0mA PME(D0-,D1-,D2-,D3hot-,D3cold-)
		Status: D0 NoSoftRst- PME-Enable- DSel=0 DScale=0 PME-
	Capabilities: [100 v1] Process Address Space ID (PASID)
		PASIDCap: Exec- Priv-, Max PASID Width: 14
		PASIDCtl: Enable- Exec- Priv-
	Capabilities: [200 v1] Address Translation Service (ATS)
		ATSCap:	Invalidate Queue Depth: 00
		ATSCtl:	Enable-, Smallest Translation Unit: 00
	Capabilities: [300 v1] Page Request Interface (PRI)
		PRICtl: Enable- Reset-
		PRISta: RF- UPRGI- Stopped+
		Page Request Capacity: 00008000, Page Request Allocation: 00000000
	Kernel driver in use: i915
	Kernel modules: i915

00:04.0 Signal processing controller [1180]: Intel Corporation Xeon E3-1200 v5/E3-1500 v5/6th Gen Core Processor Thermal Subsystem [8086:1903] (rev 0b)
	DeviceName: Onboard - Other
	Subsystem: Acer Incorporated [ALI] Xeon E3-1200 v5/E3-1500 v5/6th Gen Core Processor Thermal Subsystem [1025:1305]
	Control: I/O- Mem+ BusMaster- SpecCycle- MemWINV- VGASnoop- ParErr- Stepping- SERR- FastB2B- DisINTx-
	Status: Cap+ 66MHz- UDF- FastB2B+ ParErr- DEVSEL=fast >TAbort- <TAbort- <MAbort- >SERR- <PERR- INTx-
	Interrupt: pin A routed to IRQ 16
	Region 0: Memory at a1210000 (64-bit, non-prefetchable) [size=32K]
	Capabilities: [90] MSI: Enable- Count=1/1 Maskable- 64bit-
		Address: 00000000  Data: 0000
	Capabilities: [d0] Power Management version 3
		Flags: PMEClk- DSI- D1- D2- AuxCurrent=0mA PME(D0-,D1-,D2-,D3hot-,D3cold-)
		Status: D0 NoSoftRst+ PME-Enable- DSel=0 DScale=0 PME-
	Capabilities: [e0] Vendor Specific Information: Len=0c <?>
	Kernel driver in use: proc_thermal
	Kernel modules: processor_thermal_device

00:08.0 System peripheral [0880]: Intel Corporation Xeon E3-1200 v5/v6 / E3-1500 v5 / 6th/7th/8th Gen Core Processor Gaussian Mixture Model [8086:1911]
	DeviceName: Onboard - Other
	Subsystem: Acer Incorporated [ALI] Xeon E3-1200 v5/v6 / E3-1500 v5 / 6th/7th/8th Gen Core Processor Gaussian Mixture Model [1025:1305]
	Control: I/O- Mem- BusMaster- SpecCycle- MemWINV- VGASnoop- ParErr- Stepping- SERR- FastB2B- DisINTx-
	Status: Cap+ 66MHz- UDF- FastB2B- ParErr- DEVSEL=fast >TAbort- <TAbort- <MAbort- >SERR- <PERR- INTx-
	Interrupt: pin A routed to IRQ 255
	Region 0: Memory at a122d000 (64-bit, non-prefetchable) [disabled] [size=4K]
	Capabilities: [90] MSI: Enable- Count=1/1 Maskable- 64bit-
		Address: 00000000  Data: 0000
	Capabilities: [dc] Power Management version 2
		Flags: PMEClk- DSI- D1- D2- AuxCurrent=0mA PME(D0-,D1-,D2-,D3hot-,D3cold-)
		Status: D0 NoSoftRst- PME-Enable- DSel=0 DScale=0 PME-
	Capabilities: [f0] PCI Advanced Features
		AFCap: TP+ FLR+
		AFCtrl: FLR-
		AFStatus: TP-

00:12.0 Signal processing controller [1180]: Intel Corporation Cannon Point-LP Thermal Controller [8086:9df9] (rev 30)
	DeviceName: Onboard - Other
	Subsystem: Acer Incorporated [ALI] Cannon Point-LP Thermal Controller [1025:1305]
	Control: I/O- Mem+ BusMaster- SpecCycle- MemWINV- VGASnoop- ParErr- Stepping- SERR- FastB2B- DisINTx-
	Status: Cap+ 66MHz- UDF- FastB2B- ParErr- DEVSEL=fast >TAbort- <TAbort- <MAbort- >SERR- <PERR- INTx-
	Interrupt: pin A routed to IRQ 16
	Region 0: Memory at a122c000 (64-bit, non-prefetchable) [size=4K]
	Capabilities: [50] Power Management version 3
		Flags: PMEClk- DSI+ D1- D2- AuxCurrent=0mA PME(D0-,D1-,D2-,D3hot-,D3cold-)
		Status: D0 NoSoftRst+ PME-Enable- DSel=0 DScale=0 PME-
	Capabilities: [80] MSI: Enable- Count=1/1 Maskable- 64bit-
		Address: 00000000  Data: 0000
	Kernel driver in use: intel_pch_thermal
	Kernel modules: intel_pch_thermal

00:14.0 USB controller [0c03]: Intel Corporation Cannon Point-LP USB 3.1 xHCI Controller [8086:9ded] (rev 30) (prog-if 30 [XHCI])
	DeviceName: Onboard - Other
	Subsystem: Acer Incorporated [ALI] Cannon Point-LP USB 3.1 xHCI Controller [1025:1305]
	Control: I/O- Mem+ BusMaster+ SpecCycle- MemWINV- VGASnoop- ParErr- Stepping- SERR- FastB2B- DisINTx+
	Status: Cap+ 66MHz- UDF- FastB2B+ ParErr- DEVSEL=medium >TAbort- <TAbort- <MAbort- >SERR- <PERR- INTx-
	Latency: 0
	Interrupt: pin A routed to IRQ 125
	Region 0: Memory at a1200000 (64-bit, non-prefetchable) [size=64K]
	Capabilities: [70] Power Management version 2
		Flags: PMEClk- DSI- D1- D2- AuxCurrent=375mA PME(D0-,D1-,D2-,D3hot+,D3cold+)
		Status: D0 NoSoftRst+ PME-Enable- DSel=0 DScale=0 PME-
	Capabilities: [80] MSI: Enable+ Count=1/8 Maskable- 64bit+
		Address: 00000000fee00278  Data: 0000
	Capabilities: [90] Vendor Specific Information: Len=14 <?>
	Kernel driver in use: xhci_hcd
	Kernel modules: xhci_pci

00:14.2 RAM memory [0500]: Intel Corporation Cannon Point-LP Shared SRAM [8086:9def] (rev 30)
	DeviceName: Onboard - Other
	Subsystem: Intel Corporation Cannon Point-LP Shared SRAM [8086:7270]
	Control: I/O- Mem- BusMaster- SpecCycle- MemWINV- VGASnoop- ParErr- Stepping- SERR- FastB2B- DisINTx-
	Status: Cap+ 66MHz- UDF- FastB2B- ParErr- DEVSEL=fast >TAbort- <TAbort- <MAbort- >SERR- <PERR- INTx-
	Region 0: Memory at a1222000 (64-bit, non-prefetchable) [disabled] [size=8K]
	Region 2: Memory at a122b000 (64-bit, non-prefetchable) [disabled] [size=4K]
	Capabilities: [80] Power Management version 3
		Flags: PMEClk- DSI- D1- D2- AuxCurrent=0mA PME(D0-,D1-,D2-,D3hot-,D3cold-)
		Status: D0 NoSoftRst+ PME-Enable- DSel=0 DScale=0 PME-

00:14.3 Network controller [0280]: Intel Corporation Cannon Point-LP CNVi [Wireless-AC] [8086:9df0] (rev 30)
	DeviceName: Onboard - Ethernet
	Subsystem: Intel Corporation Cannon Point-LP CNVi [Wireless-AC] [8086:0034]
	Control: I/O- Mem+ BusMaster+ SpecCycle- MemWINV- VGASnoop- ParErr- Stepping- SERR- FastB2B- DisINTx+
	Status: Cap+ 66MHz- UDF- FastB2B- ParErr- DEVSEL=fast >TAbort- <TAbort- <MAbort- >SERR- <PERR- INTx-
	Latency: 0, Cache Line Size: 64 bytes
	Interrupt: pin A routed to IRQ 16
	Region 0: Memory at a121c000 (64-bit, non-prefetchable) [size=16K]
	Capabilities: [c8] Power Management version 3
		Flags: PMEClk- DSI+ D1- D2- AuxCurrent=0mA PME(D0+,D1-,D2-,D3hot+,D3cold+)
		Status: D0 NoSoftRst+ PME-Enable- DSel=0 DScale=0 PME-
	Capabilities: [d0] MSI: Enable- Count=1/1 Maskable- 64bit+
		Address: 0000000000000000  Data: 0000
	Capabilities: [40] Express (v2) Root Complex Integrated Endpoint, MSI 00
		DevCap:	MaxPayload 128 bytes, PhantFunc 0
			ExtTag- RBE- FLReset+
		DevCtl:	CorrErr- NonFatalErr- FatalErr- UnsupReq-
			RlxdOrd+ ExtTag- PhantFunc- AuxPwr+ NoSnoop+ FLReset-
			MaxPayload 128 bytes, MaxReadReq 128 bytes
		DevSta:	CorrErr- NonFatalErr- FatalErr- UnsupReq- AuxPwr+ TransPend-
		DevCap2: Completion Timeout: Range B, TimeoutDis+ NROPrPrP- LTR+
			 10BitTagComp- 10BitTagReq- OBFF Via WAKE#, ExtFmt- EETLPPrefix-
			 EmergencyPowerReduction Not Supported, EmergencyPowerReductionInit-
			 FRS-
			 AtomicOpsCap: 32bit- 64bit- 128bitCAS-
		DevCtl2: Completion Timeout: 16ms to 55ms, TimeoutDis- LTR+ OBFF Disabled,
			 AtomicOpsCtl: ReqEn-
	Capabilities: [80] MSI-X: Enable+ Count=16 Masked-
		Vector table: BAR=0 offset=00002000
		PBA: BAR=0 offset=00003000
	Capabilities: [100 v0] Null
	Capabilities: [14c v1] Latency Tolerance Reporting
		Max snoop latency: 0ns
		Max no snoop latency: 0ns
	Capabilities: [164 v1] Vendor Specific Information: ID=0010 Rev=0 Len=014 <?>
	Kernel driver in use: iwlwifi
	Kernel modules: iwlwifi

00:15.0 Serial bus controller [0c80]: Intel Corporation Cannon Point-LP Serial IO I2C Controller #0 [8086:9de8] (rev 30)
	DeviceName: Onboard - Other
	Subsystem: Acer Incorporated [ALI] Cannon Point-LP Serial IO I2C Controller [1025:1305]
	Control: I/O- Mem+ BusMaster+ SpecCycle- MemWINV- VGASnoop- ParErr- Stepping- SERR- FastB2B- DisINTx-
	Status: Cap+ 66MHz- UDF- FastB2B- ParErr- DEVSEL=fast >TAbort- <TAbort- <MAbort- >SERR- <PERR- INTx-
	Latency: 0, Cache Line Size: 64 bytes
	Interrupt: pin A routed to IRQ 16
	Region 0: Memory at a1225000 (64-bit, non-prefetchable) [virtual] [size=4K]
	Capabilities: [80] Power Management version 3
		Flags: PMEClk- DSI- D1- D2- AuxCurrent=0mA PME(D0-,D1-,D2-,D3hot-,D3cold-)
		Status: D3 NoSoftRst+ PME-Enable- DSel=0 DScale=0 PME-
	Capabilities: [90] Vendor Specific Information: Len=14 <?>
	Kernel driver in use: intel-lpss
	Kernel modules: intel_lpss_pci

00:15.1 Serial bus controller [0c80]: Intel Corporation Cannon Point-LP Serial IO I2C Controller #1 [8086:9de9] (rev 30)
	DeviceName: Onboard - Other
	Subsystem: Acer Incorporated [ALI] Cannon Point-LP Serial IO I2C Controller [1025:1305]
	Control: I/O- Mem+ BusMaster+ SpecCycle- MemWINV- VGASnoop- ParErr- Stepping- SERR- FastB2B- DisINTx-
	Status: Cap+ 66MHz- UDF- FastB2B- ParErr- DEVSEL=fast >TAbort- <TAbort- <MAbort- >SERR- <PERR- INTx-
	Latency: 0, Cache Line Size: 64 bytes
	Interrupt: pin B routed to IRQ 17
	Region 0: Memory at a1229000 (64-bit, non-prefetchable) [virtual] [size=4K]
	Capabilities: [80] Power Management version 3
		Flags: PMEClk- DSI- D1- D2- AuxCurrent=0mA PME(D0-,D1-,D2-,D3hot-,D3cold-)
		Status: D3 NoSoftRst+ PME-Enable- DSel=0 DScale=0 PME-
	Capabilities: [90] Vendor Specific Information: Len=14 <?>
	Kernel driver in use: intel-lpss
	Kernel modules: intel_lpss_pci

00:16.0 Communication controller [0780]: Intel Corporation Cannon Point-LP MEI Controller #1 [8086:9de0] (rev 30)
	DeviceName: Onboard - Other
	Subsystem: Acer Incorporated [ALI] Cannon Point-LP MEI Controller [1025:1305]
	Control: I/O- Mem+ BusMaster+ SpecCycle- MemWINV- VGASnoop- ParErr- Stepping- SERR- FastB2B- DisINTx+
	Status: Cap+ 66MHz- UDF- FastB2B- ParErr- DEVSEL=fast >TAbort- <TAbort- <MAbort- >SERR- <PERR- INTx-
	Latency: 0
	Interrupt: pin A routed to IRQ 136
	Region 0: Memory at a1228000 (64-bit, non-prefetchable) [size=4K]
	Capabilities: [50] Power Management version 3
		Flags: PMEClk- DSI- D1- D2- AuxCurrent=0mA PME(D0-,D1-,D2-,D3hot+,D3cold-)
		Status: D0 NoSoftRst+ PME-Enable- DSel=0 DScale=0 PME-
	Capabilities: [8c] MSI: Enable+ Count=1/1 Maskable- 64bit+
		Address: 00000000fee00438  Data: 0000
	Capabilities: [a4] Vendor Specific Information: Len=14 <?>
	Kernel driver in use: mei_me
	Kernel modules: mei_me

00:17.0 RAID bus controller [0104]: Intel Corporation 82801 Mobile SATA Controller [RAID mode] [8086:282a] (rev 30)
	DeviceName: Onboard - Other
	Subsystem: Acer Incorporated [ALI] 82801 Mobile SATA Controller [RAID mode] [1025:1305]
	Control: I/O+ Mem+ BusMaster+ SpecCycle- MemWINV- VGASnoop- ParErr- Stepping- SERR- FastB2B- DisINTx+
	Status: Cap+ 66MHz+ UDF- FastB2B+ ParErr- DEVSEL=medium >TAbort- <TAbort- <MAbort- >SERR- <PERR- INTx-
	Latency: 0
	Interrupt: pin A routed to IRQ 16
	Region 0: Memory at a1220000 (32-bit, non-prefetchable) [size=8K]
	Region 1: Memory at a1227000 (32-bit, non-prefetchable) [size=256]
	Region 2: I/O ports at 3090 [size=8]
	Region 3: I/O ports at 3080 [size=4]
	Region 4: I/O ports at 3060 [size=32]
	Region 5: Memory at a1226000 (32-bit, non-prefetchable) [size=2K]
	Capabilities: [d0] MSI-X: Enable+ Count=1 Masked-
		Vector table: BAR=0 offset=00000000
		PBA: BAR=1 offset=00000000
	Capabilities: [70] Power Management version 3
		Flags: PMEClk- DSI- D1- D2- AuxCurrent=0mA PME(D0-,D1-,D2-,D3hot+,D3cold-)
		Status: D0 NoSoftRst+ PME-Enable- DSel=0 DScale=0 PME-
	Capabilities: [a8] SATA HBA v1.0 BAR4 Offset=00000004
	Kernel driver in use: ahci
	Kernel modules: ahci

00:19.0 Serial bus controller [0c80]: Intel Corporation Cannon Point-LP Serial IO I2C Host Controller [8086:9dc5] (rev 30)
	DeviceName: Onboard - Other
	Subsystem: Acer Incorporated [ALI] Cannon Point-LP Serial IO I2C Host Controller [1025:1305]
	Control: I/O- Mem+ BusMaster+ SpecCycle- MemWINV- VGASnoop- ParErr- Stepping- SERR- FastB2B- DisINTx-
	Status: Cap+ 66MHz- UDF- FastB2B- ParErr- DEVSEL=fast >TAbort- <TAbort- <MAbort- >SERR- <PERR- INTx-
	Latency: 0, Cache Line Size: 64 bytes
	Interrupt: pin A routed to IRQ 32
	Region 0: Memory at a122a000 (64-bit, non-prefetchable) [virtual] [size=4K]
	Capabilities: [80] Power Management version 3
		Flags: PMEClk- DSI- D1- D2- AuxCurrent=0mA PME(D0-,D1-,D2-,D3hot-,D3cold-)
		Status: D3 NoSoftRst+ PME-Enable- DSel=0 DScale=0 PME-
	Capabilities: [90] Vendor Specific Information: Len=14 <?>
	Kernel driver in use: intel-lpss
	Kernel modules: intel_lpss_pci

00:1d.0 PCI bridge [0604]: Intel Corporation Cannon Point-LP PCI Express Root Port #9 [8086:9db0] (rev f0) (prog-if 00 [Normal decode])
	Control: I/O+ Mem+ BusMaster+ SpecCycle- MemWINV- VGASnoop- ParErr- Stepping- SERR- FastB2B- DisINTx+
	Status: Cap+ 66MHz- UDF- FastB2B- ParErr- DEVSEL=fast >TAbort- <TAbort- <MAbort- >SERR- <PERR- INTx-
	Latency: 0, Cache Line Size: 64 bytes
	Interrupt: pin ? routed to IRQ 122
	Bus: primary=00, secondary=01, subordinate=01, sec-latency=0
	I/O behind bridge: 00004000-00004fff [size=4K]
	Memory behind bridge: a1300000-a14fffff [size=2M]
	Prefetchable memory behind bridge: 00000000a1500000-00000000a16fffff [size=2M]
	Secondary status: 66MHz- FastB2B- ParErr- DEVSEL=fast >TAbort- <TAbort- <MAbort+ <SERR- <PERR-
	BridgeCtl: Parity- SERR+ NoISA- VGA- VGA16+ MAbort- >Reset- FastB2B-
		PriDiscTmr- SecDiscTmr- DiscTmrStat- DiscTmrSERREn-
	Capabilities: [40] Express (v2) Root Port (Slot+), MSI 00
		DevCap:	MaxPayload 256 bytes, PhantFunc 0
			ExtTag- RBE+
		DevCtl:	CorrErr- NonFatalErr- FatalErr- UnsupReq-
			RlxdOrd- ExtTag- PhantFunc- AuxPwr- NoSnoop-
			MaxPayload 128 bytes, MaxReadReq 128 bytes
		DevSta:	CorrErr- NonFatalErr- FatalErr- UnsupReq- AuxPwr+ TransPend-
		LnkCap:	Port #9, Speed 8GT/s, Width x4, ASPM L0s L1, Exit Latency L0s <1us, L1 <4us
			ClockPM- Surprise- LLActRep+ BwNot+ ASPMOptComp+
		LnkCtl:	ASPM L0s L1 Enabled; RCB 64 bytes, Disabled- CommClk-
			ExtSynch- ClockPM- AutWidDis- BWInt- AutBWInt-
		LnkSta:	Speed 2.5GT/s (downgraded), Width x0 (downgraded)
			TrErr- Train- SlotClk+ DLActive- BWMgmt- ABWMgmt-
		SltCap:	AttnBtn- PwrCtrl- MRL- AttnInd- PwrInd- HotPlug+ Surprise+
			Slot #0, PowerLimit 0.000W; Interlock- NoCompl+
		SltCtl:	Enable: AttnBtn- PwrFlt- MRL- PresDet+ CmdCplt- HPIrq- LinkChg-
			Control: AttnInd Unknown, PwrInd Unknown, Power- Interlock-
		SltSta:	Status: AttnBtn- PowerFlt- MRL- CmdCplt- PresDet- Interlock-
			Changed: MRL- PresDet- LinkState-
		RootCap: CRSVisible-
		RootCtl: ErrCorrectable- ErrNon-Fatal- ErrFatal- PMEIntEna+ CRSVisible-
		RootSta: PME ReqID 0000, PMEStatus- PMEPending-
		DevCap2: Completion Timeout: Range ABC, TimeoutDis+ NROPrPrP- LTR+
			 10BitTagComp- 10BitTagReq- OBFF Via WAKE#, ExtFmt- EETLPPrefix-
			 EmergencyPowerReduction Not Supported, EmergencyPowerReductionInit-
			 FRS- LN System CLS Not Supported, TPHComp- ExtTPHComp- ARIFwd+
			 AtomicOpsCap: Routing- 32bit- 64bit- 128bitCAS-
		DevCtl2: Completion Timeout: 50us to 50ms, TimeoutDis- LTR- OBFF Disabled, ARIFwd-
			 AtomicOpsCtl: ReqEn- EgressBlck-
		LnkCap2: Supported Link Speeds: 2.5-8GT/s, Crosslink- Retimer- 2Retimers- DRS-
		LnkCtl2: Target Link Speed: 8GT/s, EnterCompliance- SpeedDis-
			 Transmit Margin: Normal Operating Range, EnterModifiedCompliance- ComplianceSOS-
			 Compliance De-emphasis: -6dB
		LnkSta2: Current De-emphasis Level: -3.5dB, EqualizationComplete- EqualizationPhase1-
			 EqualizationPhase2- EqualizationPhase3- LinkEqualizationRequest-
			 Retimer- 2Retimers- CrosslinkRes: unsupported
	Capabilities: [80] MSI: Enable+ Count=1/1 Maskable- 64bit-
		Address: fee001f8  Data: 0000
	Capabilities: [90] Subsystem: Acer Incorporated [ALI] Cannon Point-LP PCI Express Root Port [1025:1305]
	Capabilities: [a0] Power Management version 3
		Flags: PMEClk- DSI- D1- D2- AuxCurrent=0mA PME(D0+,D1-,D2-,D3hot+,D3cold+)
		Status: D3 NoSoftRst- PME-Enable+ DSel=0 DScale=0 PME-
	Kernel driver in use: pcieport

00:1d.4 PCI bridge [0604]: Intel Corporation Cannon Point-LP PCI Express Root Port #13 [8086:9db4] (rev f0) (prog-if 00 [Normal decode])
	Control: I/O+ Mem+ BusMaster+ SpecCycle- MemWINV- VGASnoop- ParErr- Stepping- SERR- FastB2B- DisINTx+
	Status: Cap+ 66MHz- UDF- FastB2B- ParErr- DEVSEL=fast >TAbort- <TAbort- <MAbort- >SERR- <PERR- INTx-
	Latency: 0, Cache Line Size: 64 bytes
	Interrupt: pin A routed to IRQ 123
	Bus: primary=00, secondary=02, subordinate=02, sec-latency=0
	I/O behind bridge: [disabled]
	Memory behind bridge: a1100000-a11fffff [size=1M]
	Prefetchable memory behind bridge: [disabled]
	Secondary status: 66MHz- FastB2B- ParErr- DEVSEL=fast >TAbort- <TAbort- <MAbort+ <SERR- <PERR-
	BridgeCtl: Parity- SERR+ NoISA- VGA- VGA16+ MAbort- >Reset- FastB2B-
		PriDiscTmr- SecDiscTmr- DiscTmrStat- DiscTmrSERREn-
	Capabilities: [40] Express (v2) Root Port (Slot+), MSI 00
		DevCap:	MaxPayload 256 bytes, PhantFunc 0
			ExtTag- RBE+
		DevCtl:	CorrErr+ NonFatalErr+ FatalErr+ UnsupReq+
			RlxdOrd- ExtTag- PhantFunc- AuxPwr- NoSnoop-
			MaxPayload 128 bytes, MaxReadReq 128 bytes
		DevSta:	CorrErr- NonFatalErr- FatalErr- UnsupReq- AuxPwr+ TransPend-
		LnkCap:	Port #13, Speed 8GT/s, Width x2, ASPM L1, Exit Latency L1 <16us
			ClockPM- Surprise- LLActRep+ BwNot+ ASPMOptComp+
		LnkCtl:	ASPM L1 Enabled; RCB 64 bytes, Disabled- CommClk+
			ExtSynch- ClockPM- AutWidDis- BWInt- AutBWInt-
		LnkSta:	Speed 8GT/s (ok), Width x2 (ok)
			TrErr- Train- SlotClk+ DLActive+ BWMgmt+ ABWMgmt-
		SltCap:	AttnBtn- PwrCtrl- MRL- AttnInd- PwrInd- HotPlug- Surprise-
			Slot #16, PowerLimit 25.000W; Interlock- NoCompl+
		SltCtl:	Enable: AttnBtn- PwrFlt- MRL- PresDet- CmdCplt- HPIrq- LinkChg-
			Control: AttnInd Unknown, PwrInd Unknown, Power- Interlock-
		SltSta:	Status: AttnBtn- PowerFlt- MRL- CmdCplt- PresDet+ Interlock-
			Changed: MRL- PresDet- LinkState+
		RootCap: CRSVisible-
		RootCtl: ErrCorrectable- ErrNon-Fatal- ErrFatal- PMEIntEna+ CRSVisible-
		RootSta: PME ReqID 0000, PMEStatus- PMEPending-
		DevCap2: Completion Timeout: Range ABC, TimeoutDis+ NROPrPrP- LTR+
			 10BitTagComp- 10BitTagReq- OBFF Not Supported, ExtFmt- EETLPPrefix-
			 EmergencyPowerReduction Not Supported, EmergencyPowerReductionInit-
			 FRS- LN System CLS Not Supported, TPHComp- ExtTPHComp- ARIFwd+
			 AtomicOpsCap: Routing- 32bit- 64bit- 128bitCAS-
		DevCtl2: Completion Timeout: 50us to 50ms, TimeoutDis- LTR+ OBFF Disabled, ARIFwd-
			 AtomicOpsCtl: ReqEn- EgressBlck-
		LnkCap2: Supported Link Speeds: 2.5-8GT/s, Crosslink- Retimer- 2Retimers- DRS-
		LnkCtl2: Target Link Speed: 8GT/s, EnterCompliance- SpeedDis-
			 Transmit Margin: Normal Operating Range, EnterModifiedCompliance- ComplianceSOS-
			 Compliance De-emphasis: -6dB
		LnkSta2: Current De-emphasis Level: -3.5dB, EqualizationComplete+ EqualizationPhase1+
			 EqualizationPhase2+ EqualizationPhase3+ LinkEqualizationRequest-
			 Retimer- 2Retimers- CrosslinkRes: unsupported
	Capabilities: [80] MSI: Enable+ Count=1/1 Maskable- 64bit-
		Address: fee00238  Data: 0000
	Capabilities: [90] Subsystem: Acer Incorporated [ALI] Cannon Point-LP PCI Express Root Port [1025:1305]
	Capabilities: [a0] Power Management version 3
		Flags: PMEClk- DSI- D1- D2- AuxCurrent=0mA PME(D0+,D1-,D2-,D3hot+,D3cold+)
		Status: D0 NoSoftRst- PME-Enable- DSel=0 DScale=0 PME-
	Capabilities: [100 v1] Advanced Error Reporting
		UESta:	DLP- SDES- TLP- FCP- CmpltTO- CmpltAbrt- UnxCmplt- RxOF- MalfTLP- ECRC- UnsupReq- ACSViol-
		UEMsk:	DLP- SDES- TLP- FCP- CmpltTO- CmpltAbrt- UnxCmplt+ RxOF- MalfTLP- ECRC- UnsupReq- ACSViol-
		UESvrt:	DLP+ SDES- TLP- FCP- CmpltTO- CmpltAbrt- UnxCmplt- RxOF+ MalfTLP+ ECRC- UnsupReq- ACSViol-
		CESta:	RxErr- BadTLP- BadDLLP- Rollover- Timeout- AdvNonFatalErr-
		CEMsk:	RxErr- BadTLP- BadDLLP- Rollover- Timeout- AdvNonFatalErr+
		AERCap:	First Error Pointer: 00, ECRCGenCap- ECRCGenEn- ECRCChkCap- ECRCChkEn-
			MultHdrRecCap- MultHdrRecEn- TLPPfxPres- HdrLogCap-
		HeaderLog: 00000000 00000000 00000000 00000000
		RootCmd: CERptEn+ NFERptEn+ FERptEn+
		RootSta: CERcvd- MultCERcvd- UERcvd- MultUERcvd-
			 FirstFatal- NonFatalMsg- FatalMsg- IntMsg 0
		ErrorSrc: ERR_COR: 0000 ERR_FATAL/NONFATAL: 0000
	Capabilities: [140 v1] Access Control Services
		ACSCap:	SrcValid+ TransBlk+ ReqRedir+ CmpltRedir+ UpstreamFwd- EgressCtrl- DirectTrans-
		ACSCtl:	SrcValid- TransBlk- ReqRedir- CmpltRedir- UpstreamFwd- EgressCtrl- DirectTrans-
	Capabilities: [150 v1] Precision Time Measurement
		PTMCap: Requester:- Responder:+ Root:+
		PTMClockGranularity: 4ns
		PTMControl: Enabled:+ RootSelected:+
		PTMEffectiveGranularity: Unknown
	Capabilities: [200 v1] L1 PM Substates
		L1SubCap: PCI-PM_L1.2+ PCI-PM_L1.1+ ASPM_L1.2+ ASPM_L1.1+ L1_PM_Substates+
			  PortCommonModeRestoreTime=40us PortTPowerOnTime=44us
		L1SubCtl1: PCI-PM_L1.2+ PCI-PM_L1.1+ ASPM_L1.2+ ASPM_L1.1+
			   T_CommonMode=40us LTR1.2_Threshold=65536ns
		L1SubCtl2: T_PwrOn=44us
	Capabilities: [220 v1] Secondary PCI Express
		LnkCtl3: LnkEquIntrruptEn- PerformEqu-
		LaneErrStat: 0
	Capabilities: [250 v1] Downstream Port Containment
		DpcCap:	INT Msg #0, RPExt+ PoisonedTLP+ SwTrigger+ RP PIO Log 4, DL_ActiveErr+
		DpcCtl:	Trigger:1 Cmpl- INT+ ErrCor- PoisonedTLP- SwTrigger- DL_ActiveErr-
		DpcSta:	Trigger- Reason:00 INT- RPBusy- TriggerExt:00 RP PIO ErrPtr:1f
		Source:	0000
	Kernel driver in use: pcieport

00:1f.0 ISA bridge [0601]: Intel Corporation Cannon Point-LP LPC Controller [8086:9d84] (rev 30)
	DeviceName: Onboard - Other
	Subsystem: Acer Incorporated [ALI] Cannon Point-LP LPC Controller [1025:1305]
	Control: I/O+ Mem+ BusMaster+ SpecCycle- MemWINV- VGASnoop- ParErr- Stepping- SERR- FastB2B- DisINTx-
	Status: Cap- 66MHz- UDF- FastB2B- ParErr- DEVSEL=medium >TAbort- <TAbort- <MAbort- >SERR- <PERR- INTx-
	Latency: 0

00:1f.3 Multimedia audio controller [0401]: Intel Corporation Cannon Point-LP High Definition Audio Controller [8086:9dc8] (rev 30)
	DeviceName: Onboard - Sound
	Subsystem: Acer Incorporated [ALI] Cannon Point-LP High Definition Audio Controller [1025:1305]
	Control: I/O- Mem+ BusMaster+ SpecCycle- MemWINV- VGASnoop- ParErr- Stepping- SERR- FastB2B- DisINTx+
	Status: Cap+ 66MHz- UDF- FastB2B- ParErr- DEVSEL=fast >TAbort- <TAbort- <MAbort- >SERR- <PERR- INTx-
	Latency: 32, Cache Line Size: 64 bytes
	Interrupt: pin A routed to IRQ 143
	Region 0: Memory at a1218000 (64-bit, non-prefetchable) [size=16K]
	Region 4: Memory at a1000000 (64-bit, non-prefetchable) [size=1M]
	Capabilities: [50] Power Management version 3
		Flags: PMEClk- DSI- D1- D2- AuxCurrent=55mA PME(D0-,D1-,D2-,D3hot+,D3cold+)
		Status: D0 NoSoftRst+ PME-Enable- DSel=0 DScale=0 PME-
	Capabilities: [80] Vendor Specific Information: Len=14 <?>
	Capabilities: [60] MSI: Enable+ Count=1/1 Maskable- 64bit+
		Address: 00000000fee00518  Data: 0000
	Kernel driver in use: sof-audio-pci-intel-cnl
	Kernel modules: snd_hda_intel, snd_sof_pci_intel_cnl

00:1f.4 SMBus [0c05]: Intel Corporation Cannon Point-LP SMBus Controller [8086:9da3] (rev 30)
	DeviceName: Onboard - Other
	Subsystem: Acer Incorporated [ALI] Cannon Point-LP SMBus Controller [1025:1305]
	Control: I/O+ Mem+ BusMaster- SpecCycle- MemWINV- VGASnoop- ParErr- Stepping- SERR- FastB2B- DisINTx-
	Status: Cap- 66MHz- UDF- FastB2B+ ParErr- DEVSEL=medium >TAbort- <TAbort- <MAbort- >SERR- <PERR- INTx-
	Interrupt: pin A routed to IRQ 16
	Region 0: Memory at a1224000 (64-bit, non-prefetchable) [size=256]
	Region 4: I/O ports at efa0 [size=32]
	Kernel driver in use: i801_smbus
	Kernel modules: i2c_i801

00:1f.5 Serial bus controller [0c80]: Intel Corporation Cannon Point-LP SPI Controller [8086:9da4] (rev 30)
	DeviceName: Onboard - Other
	Subsystem: Acer Incorporated [ALI] Cannon Point-LP SPI Controller [1025:1305]
	Control: I/O- Mem+ BusMaster- SpecCycle- MemWINV- VGASnoop- ParErr- Stepping- SERR- FastB2B- DisINTx+
	Status: Cap- 66MHz- UDF- FastB2B- ParErr- DEVSEL=fast >TAbort- <TAbort- <MAbort- >SERR- <PERR- INTx-
	Region 0: Memory at fe010000 (32-bit, non-prefetchable) [size=4K]

02:00.0 Non-Volatile memory controller [0108]: SK hynix BC501 NVMe Solid State Drive 512GB [1c5c:1327] (prog-if 02 [NVM Express])
	Subsystem: SK hynix BC501 NVMe Solid State Drive 512GB [1c5c:0000]
	Control: I/O+ Mem+ BusMaster+ SpecCycle- MemWINV- VGASnoop- ParErr- Stepping- SERR- FastB2B- DisINTx+
	Status: Cap+ 66MHz- UDF- FastB2B- ParErr- DEVSEL=fast >TAbort- <TAbort- <MAbort- >SERR- <PERR- INTx-
	Latency: 0, Cache Line Size: 64 bytes
	Interrupt: pin A routed to IRQ 16
	NUMA node: 0
	Region 0: Memory at a1100000 (64-bit, non-prefetchable) [size=16K]
	Capabilities: [80] Power Management version 3
		Flags: PMEClk- DSI- D1+ D2- AuxCurrent=0mA PME(D0+,D1+,D2-,D3hot+,D3cold-)
		Status: D0 NoSoftRst+ PME-Enable- DSel=0 DScale=0 PME-
	Capabilities: [90] MSI: Enable- Count=1/32 Maskable+ 64bit+
		Address: 0000000000000000  Data: 0000
		Masking: 00000000  Pending: 00000000
	Capabilities: [b0] MSI-X: Enable+ Count=32 Masked-
		Vector table: BAR=0 offset=00002000
		PBA: BAR=0 offset=00003000
	Capabilities: [c0] Express (v2) Endpoint, MSI 00
		DevCap:	MaxPayload 128 bytes, PhantFunc 0, Latency L0s unlimited, L1 unlimited
			ExtTag- AttnBtn- AttnInd- PwrInd- RBE+ FLReset+ SlotPowerLimit 75.000W
		DevCtl:	CorrErr+ NonFatalErr+ FatalErr+ UnsupReq+
			RlxdOrd+ ExtTag- PhantFunc- AuxPwr- NoSnoop+ FLReset-
			MaxPayload 128 bytes, MaxReadReq 512 bytes
		DevSta:	CorrErr- NonFatalErr- FatalErr- UnsupReq- AuxPwr- TransPend-
		LnkCap:	Port #0, Speed 8GT/s, Width x2, ASPM L1, Exit Latency L1 <64us
			ClockPM+ Surprise- LLActRep- BwNot- ASPMOptComp+
		LnkCtl:	ASPM L1 Enabled; RCB 64 bytes, Disabled- CommClk+
			ExtSynch- ClockPM+ AutWidDis- BWInt- AutBWInt-
		LnkSta:	Speed 8GT/s (ok), Width x2 (ok)
			TrErr- Train- SlotClk+ DLActive- BWMgmt- ABWMgmt-
		DevCap2: Completion Timeout: Range B, TimeoutDis+ NROPrPrP- LTR+
			 10BitTagComp- 10BitTagReq- OBFF Not Supported, ExtFmt+ EETLPPrefix-
			 EmergencyPowerReduction Not Supported, EmergencyPowerReductionInit-
			 FRS- TPHComp- ExtTPHComp-
			 AtomicOpsCap: 32bit- 64bit- 128bitCAS-
		DevCtl2: Completion Timeout: 50us to 50ms, TimeoutDis- LTR+ OBFF Disabled,
			 AtomicOpsCtl: ReqEn-
		LnkCap2: Supported Link Speeds: 2.5-8GT/s, Crosslink- Retimer- 2Retimers- DRS-
		LnkCtl2: Target Link Speed: 8GT/s, EnterCompliance- SpeedDis-
			 Transmit Margin: Normal Operating Range, EnterModifiedCompliance- ComplianceSOS-
			 Compliance De-emphasis: -6dB
		LnkSta2: Current De-emphasis Level: -6dB, EqualizationComplete+ EqualizationPhase1+
			 EqualizationPhase2+ EqualizationPhase3+ LinkEqualizationRequest-
			 Retimer- 2Retimers- CrosslinkRes: unsupported
	Capabilities: [100 v2] Advanced Error Reporting
		UESta:	DLP- SDES- TLP- FCP- CmpltTO- CmpltAbrt- UnxCmplt- RxOF- MalfTLP- ECRC- UnsupReq- ACSViol-
		UEMsk:	DLP- SDES- TLP- FCP- CmpltTO- CmpltAbrt- UnxCmplt- RxOF- MalfTLP- ECRC- UnsupReq- ACSViol-
		UESvrt:	DLP+ SDES+ TLP- FCP+ CmpltTO- CmpltAbrt- UnxCmplt- RxOF+ MalfTLP+ ECRC- UnsupReq- ACSViol-
		CESta:	RxErr- BadTLP- BadDLLP- Rollover- Timeout- AdvNonFatalErr-
		CEMsk:	RxErr- BadTLP- BadDLLP- Rollover- Timeout- AdvNonFatalErr-
		AERCap:	First Error Pointer: 00, ECRCGenCap+ ECRCGenEn- ECRCChkCap+ ECRCChkEn-
			MultHdrRecCap- MultHdrRecEn- TLPPfxPres- HdrLogCap-
		HeaderLog: 00000000 00000000 00000000 00000000
	Capabilities: [150 v1] Device Serial Number ...
	Capabilities: [160 v1] Power Budgeting <?>
	Capabilities: [1b8 v1] Latency Tolerance Reporting
		Max snoop latency: 3145728ns
		Max no snoop latency: 3145728ns
	Capabilities: [300 v1] Secondary PCI Express
		LnkCtl3: LnkEquIntrruptEn- PerformEqu-
		LaneErrStat: 0
	Capabilities: [400 v1] Vendor Specific Information: ID=0001 Rev=1 Len=010 <?>
	Capabilities: [900 v1] L1 PM Substates
		L1SubCap: PCI-PM_L1.2+ PCI-PM_L1.1+ ASPM_L1.2+ ASPM_L1.1+ L1_PM_Substates+
			  PortCommonModeRestoreTime=24us PortTPowerOnTime=26us
		L1SubCtl1: PCI-PM_L1.2+ PCI-PM_L1.1+ ASPM_L1.2+ ASPM_L1.1+
			   T_CommonMode=0us LTR1.2_Threshold=65536ns
		L1SubCtl2: T_PwrOn=44us
	Kernel driver in use: nvme
	Kernel modules: nvme

